,Ticker,Title,Article,Summary,Link,Date
24,MSFT,MSFT: Microsoft vs. Salesforce.com: Which SaaS Stock is a Better Investment?,"Software giant Microsoft Corporation (MSFT) develops, licenses, and supports software, services, devices, and solutions worldwide. In comparison, salesforce.com, inc. (CRM), which is also a well-known player in the industry, develops enterprise cloud computing solutions with a focus on customer relationship management worldwide.

Over the past year, the adoption of a remote work structure has intensified the role of technology in organizations. Organizations are seeking new ways to improve their operations to ensure higher productivity. Changing market dynamics have led to an accelerated demand for cloud-based solutions, which has aided the software as a service (SaaS) market. The global SaaS market is expected to reach $436.9 billion in 2025 growing at a 12.5% CAGR. As major players in the industry, we think both MSFT and CRM should continue to benefit substantially from the industry tailwinds.

MSFT has gained 27.2% in price over the past six months, while CRM has returned 23.3% over the period. Also, MSFT’s 33.6% gains year-to-date compare with CRM’s 17.2% returns. In terms of their past year’s performance, MSFT is the clear winner with 40.7% price gains versus CRM’s 4.1%.

Click here to check out our Software Industry Report for 2021

But which stock is a better buy now? Let’s find out.

Latest Development

On July 14, MSFT unveiled Windows 365, a cloud service that introduced a new way to experience Windows 10 or Windows 11 to businesses of all sizes. “Just like applications were brought to the cloud with SaaS, we are now bringing the operating system to the cloud, providing organizations with greater flexibility and a secure way to empower their workforce to be more productive and connected, regardless of location,” said Satya Nadella, chairman and CEO, Microsoft.

On August 10, CRM announced Salesforce+, an all-new streaming service with compelling live and on-demand content for every role, industry, and line of business, all in one place. The evolving digital-first world should provide Salesforce+ the perfect opportunity to gain popularity quickly.

Recent Financial Results

MSFT’s revenue increased 21% year-over-year to $46.15 billion in its fiscal fourth quarter, ended June 30. Its operating income stood at $19.10 billion, up 42% from the same period last year. Its net income grew 47% from its year-ago value to $16.46 billion, and its EPS increased 49% year-over-year to $2.17.

For its fiscal second quarter, ended July 31, CRM’s total revenues increased 23.1% year-over-year to $6.34 billion. Its gross profit improved 23.1% year-over-year to $4.73 billion, while its income from operations grew 86.5% from its year-ago value to $332 million. Its cash and cash equivalents balance rose 55.5% year-over-year to $6.30 billion.

Past and Expected Financial Performance

MSFT’s net income and EPS have grown at CAGRs of 54.6% and 55.8%, respectively, over the past three years. Analysts expect MSFT’s revenue to increase 23.2% in the current quarter, 14.2% in the current year, and 13% in the next year. Its EPS is expected to grow 13.7% in the current quarter, 9.3% in the current year, and 14.7% in the next year. Furthermore, its EPS is expected to grow at a 15.3% rate per annum over the next five years.

In comparison, CRM’s net income and EPS have grown at CAGRs of 35% and 25.3%, respectively, over the past three years. Analysts expect the company’s revenue to increase 23.8% in the current year and 19.6% in the next year. Its EPS is expected to decline 47.1% in the current quarter and 10.6% in the current year. However, its EPS is expected to grow marginally in the next year. Also, CRM’s EPS is expected to grow at a 10.4% rate per annum over the next five years.

Profitability

MSFT is more profitable, with net income and EBITDA margins of 36.45% and 48.08%, respectively, compared to CRM’s 9.99% and 15.17%.

MSFT’s ROE, ROA and ROTC of 47.08%,13.76% and 20.58%, respectively, compare with CRM’s 5.01%, 0.99% and 1.25%.

Thus, MSFT is more profitable here.

Valuation

In terms of forward EV/Sales, MSFT is currently trading at 11.53x, which is 13.1% higher than CRM, which is currently trading at 10.02x. However, CRM’s 34.32 forward EV/EBITDA ratio is 30.8% higher than MSFT’s 23.76.

POWR Ratings

MSFT has an overall B rating, which equates to Buy in our proprietary POWR Ratings system. CRM, in contrast, has an overall C rating, which translates to Neutral. The POWR Ratings are calculated considering 118 different factors, with each factor weighted to an optimal degree.

MSFT has a B Stability grade, which is consistent with its relatively low 0.78 beta. In comparison, CRM has a 1.09 beta, which justifies its Stability grade of C.

MSFT has a B grade for Quality. This is justified because MSFT’s 48.08% EBITDA margin is 227.1% higher than the 14.70% industry average. CRM, in contrast, has a grade of C for Quality. This is justified because CRM’s 15.17% EBITDA margin is 3.2% higher than the industry average.

Of the 146 stocks in the Software – Application industry, MSFT is ranked #15, while CRM is ranked #50.

Beyond what we’ve stated above, we have also rated the stocks for Sentiment, Momentum, Value, and Growth. Click here to view MSFT ratings. Also, get all CRM ratings here.

The Winner

The SaaS market is expanding rapidly owing to the growing demand for cloud-based solutions. While both MSFT and CRM dominate the industry, its higher profit margins and solid growth prospects we think make MSFT the better bet now.

Our research shows that odds of success increase when one invests in stocks with an Overall Rating of Strong Buy or Buy. View all the top-rated stocks in the Software – Application industry here.

Click here to check out our Software Industry Report for 2021

MSFT shares were trading at $295.71 per share on Friday afternoon, down $1.54 (-0.52%). Year-to-date, MSFT has gained 33.82%, versus a 19.92% rise in the benchmark S&P 500 index during the same period.

About the Author: Subhasree Kar

Subhasree’s keen interest in financial instruments led her to pursue a career as an investment analyst. After earning a Master’s degree in Economics, she gained knowledge of equity research and portfolio management at Finlatics. More...

More Resources for the Stocks in this Article","Click here to check out our Software Industry Report for 2021But which stock is a better buy now?
Also, CRM’s EPS is expected to grow at a 10.4% rate per annum over the next five years.
Of the 146 stocks in the Software – Application industry, MSFT is ranked #15, while CRM is ranked #50.
While both MSFT and CRM dominate the industry, its higher profit margins and solid growth prospects we think make MSFT the better bet now.
Click here to check out our Software Industry Report for 2021MSFT shares were trading at $295.71 per share on Friday afternoon, down $1.54 (-0.52%).",https://stocknews.com/news/msft-crm-microsoft-vs-salesforce-com-which-saas-stock-is-a-better-investment/,2021-09-20 00:00:00
25,MSFT,"Notable Thursday Option Activity: BKNG, NFLX, MSFT","Among the underlying components of the S&P 500 index, we saw noteworthy options trading volume today in Booking Holdings Inc (Symbol: BKNG), where a total of 2,989 contracts have traded so far, representing approximately 298,900 underlying shares. That amounts to about 102.5% of BKNG's average daily trading volume over the past month of 291,625 shares. Particularly high volume was seen for the $2250 strike put option expiring September 17, 2021, with 105 contracts trading so far today, representing approximately 10,500 underlying shares of BKNG. Below is a chart showing BKNG's trailing twelve month trading history, with the $2250 strike highlighted in orange:

Netflix Inc (Symbol: NFLX) options are showing a volume of 34,325 contracts thus far today. That number of contracts represents approximately 3.4 million underlying shares, working out to a sizeable 95% of NFLX's average daily trading volume over the past month, of 3.6 million shares. Especially high volume was seen for the $585 strike call option expiring September 17, 2021, with 2,338 contracts trading so far today, representing approximately 233,800 underlying shares of NFLX. Below is a chart showing NFLX's trailing twelve month trading history, with the $585 strike highlighted in orange:

And Microsoft Corporation (Symbol: MSFT) options are showing a volume of 182,687 contracts thus far today. That number of contracts represents approximately 18.3 million underlying shares, working out to a sizeable 84.6% of MSFT's average daily trading volume over the past month, of 21.6 million shares. Especially high volume was seen for the $305 strike call option expiring September 17, 2021, with 21,809 contracts trading so far today, representing approximately 2.2 million underlying shares of MSFT. Below is a chart showing MSFT's trailing twelve month trading history, with the $305 strike highlighted in orange:

For the various different available expirations for BKNG options, NFLX options, or MSFT options, visit StockOptionsChannel.com.

Today's Most Active Call & Put Options of the S&P 500 »

The views and opinions expressed herein are the views and opinions of the author and do not necessarily reflect those of Nasdaq, Inc.","That amounts to about 102.5% of BKNG's average daily trading volume over the past month of 291,625 shares.
Particularly high volume was seen for the $2250 strike put option expiring September 17, 2021, with 105 contracts trading so far today, representing approximately 10,500 underlying shares of BKNG.
Especially high volume was seen for the $585 strike call option expiring September 17, 2021, with 2,338 contracts trading so far today, representing approximately 233,800 underlying shares of NFLX.
Especially high volume was seen for the $305 strike call option expiring September 17, 2021, with 21,809 contracts trading so far today, representing approximately 2.2 million underlying shares of MSFT.
Below is a chart showing MSFT's trailing twelve month trading history, with the $305 strike highlighted in orange:For the various different available expirations for BKNG options, NFLX options, or MSFT options, visit StockOptionsChannel.com.",https://www.nasdaq.com/articles/notable-thursday-option-activity%3A-bkng-nflx-msft-2021-09-16,2021-09-16 00:00:00
26,MSFT,"Technology Sector Update for 09/15/2021: CTXS, CAN, MSFT, XLK, SOXX","Technology stocks were climbing in Wednesday's premarket trading. The Technology Select Sector SPDR ETF (XLK) was 0.33% higher and the Semiconductor Sector Index Fund (SOXX) was recently up 0.20%.

Citrix Systems (CTXS) is working with advisers as it once again explores the possibility of selling itself, Bloomberg News reported, citing unnamed people with knowledge of the matter. Citrix Systems was rallying by more than 4% in recent trading.

Canaan (CAN) was advancing by more than 4% as it reported Q2 net earnings of RMB1.40 ($0.22) per ADS, compared with a net loss of RMB0.11 per ADS a year ago.

Microsoft (MSFT) was up over 1% after saying it is raising its quarterly dividend by 6 cents, or 11% from the previous quarter, to $0.62 per share. The dividend is payable Dec. 9 to shareholders of record on Nov. 18.

The views and opinions expressed herein are the views and opinions of the author and do not necessarily reflect those of Nasdaq, Inc.","Technology stocks were climbing in Wednesday's premarket trading.
The Technology Select Sector SPDR ETF (XLK) was 0.33% higher and the Semiconductor Sector Index Fund (SOXX) was recently up 0.20%.
Citrix Systems (CTXS) is working with advisers as it once again explores the possibility of selling itself, Bloomberg News reported, citing unnamed people with knowledge of the matter.
Microsoft (MSFT) was up over 1% after saying it is raising its quarterly dividend by 6 cents, or 11% from the previous quarter, to $0.62 per share.
The views and opinions expressed herein are the views and opinions of the author and do not necessarily reflect those of Nasdaq, Inc.",https://www.nasdaq.com/articles/technology-sector-update-for-09-15-2021%3A-ctxs-can-msft-xlk-soxx-2021-09-15,2021-09-15 00:00:00
27,MSFT,"Daily Dividend Report: O,PM,MSFT,VTR,KDP","Realty Income, The Monthly Dividend Company—, today announced its Board of Directors has declared an increase in the company's common stock monthly cash dividend to $0.236 per share from $0.2355 per share. The dividend is payable on October 15, 2021 to shareholders of record as of October 1, 2021. This is the 112th dividend increase since Realty Income's listing on the NYSE in 1994. The ex-dividend date for October's dividend is September 30, 2021. The new monthly dividend represents an annualized dividend amount of $2.832 per share as compared to the current annualized dividend amount of $2.826 per share. ""We remain committed to our company's mission of paying dependable monthly dividends to our shareholders that increase over time,"" said Sumit Roy, President and Chief Executive Officer of Realty Income. ""Our Board of Directors has once again determined that we are able to increase the amount of the monthly dividend to our shareholders, marking the 112th increase since our company's public listing in 1994. With the payment of the October dividend, we will have made 615 consecutive monthly dividend payments throughout our 52-year operating history.""

The Board of Directors of Philip Morris International today increased the company's regular quarterly dividend by 4.2% to an annualized rate of $5.00 per share. The new quarterly dividend of $1.25 per share, up from $1.20 per share, is payable on October 14, 2021, to shareholders of record as of September 29, 2021. The ex-dividend date is September 28, 2021.

Microsoft on Tuesday announced that its board of directors declared a quarterly dividend of $0.62 per share, reflecting a 6 cent or 11% increase over the previous quarter's dividend. The dividend is payable Dec. 9, 2021, to shareholders of record on Nov. 18, 2021. The ex-dividend date will be Nov. 17, 2021. The board of directors also approved a new share repurchase program authorizing up to $60 billion in share repurchases. The new share repurchase program, which has no expiration date, may be terminated at any time.

Ventas today announced that its Board of Directors has declared a quarterly dividend of $0.45 per common share. The dividend will be payable in cash on October 14, 2021 to stockholders of record as of the close of business on October 1, 2021.

Keurig Dr Pepper announced today that its Board of Directors has declared a regular quarterly cash dividend of $0.1875 per share, payable in U.S. dollars, on the Company's common stock. The regular quarterly dividend will be paid on October 15, 2021 to shareholders of record on October 1, 2021.

The views and opinions expressed herein are the views and opinions of the author and do not necessarily reflect those of Nasdaq, Inc.","Realty Income, The Monthly Dividend Company—, today announced its Board of Directors has declared an increase in the company's common stock monthly cash dividend to $0.236 per share from $0.2355 per share.
This is the 112th dividend increase since Realty Income's listing on the NYSE in 1994.
The new monthly dividend represents an annualized dividend amount of $2.832 per share as compared to the current annualized dividend amount of $2.826 per share.
With the payment of the October dividend, we will have made 615 consecutive monthly dividend payments throughout our 52-year operating history.""
The regular quarterly dividend will be paid on October 15, 2021 to shareholders of record on October 1, 2021.",https://www.nasdaq.com/articles/daily-dividend-report%3A-opmmsftvtrkdp-2021-09-15,2021-09-15 00:00:00
28,MSFT,Microsoft President explain why MSFT pledged $20 billion to cybersecurity,"Wajeeh is an active follower of world affairs, technology, an avid reader, and loves to play table tennis in… read more

Microsoft Corporation (NASDAQ: MSFT) recently pledged $20 billion to battle cyberattacks over the next five years. The move is attributed to the recent rise in cyberattacks, which as per President Brad Smith, are getting more sophisticated over time.

President Smith’s remarks on CNBC’s “Squawk Box”

In the latest softcover edition of his New York Times bestseller book “Tools and Weapons: The Promise and the Peril of the Digital Age”, out today, Smith added a new chapter that offers insight into the solar wind cyberattack of 2020.

Are you looking for fast-news, hot-tips and market analysis? Sign-up for the Invezz newsletter, today. “The new chapter reflects two things; first, the sophistication of cyberattacks continues to grow. It’s what we’ve seen in the solar winds attack and the recent ransomware and other attacks, which confirm that, in so many ways, it requires all of us to do more to step up as a company,” Smith said on CNBC’s “Squawk Box”.

Shares of the $2.25 trillion company are down less than 1.0% on the intraday chart. Here’s Crossmark’s Victoria Fernandez’ outlook on whether now is a suitable time to trim your position in MSFT or not.

Cyberattacks are not a threat for the tech sector only

Cyberattacks threaten more than just the tech sector, added President Smith. In his interview, he fixated on the need to share information that could help companies join hands against the cyberthreats.

“One of the conclusions of the 9/11 commission is that there’d been a failure of strategic intelligence. People had been sharing information only on a need-to-know basis. They needed to create a culture around the need to share, and that’s what we need to do here too,” he said.

According to Smith, tech companies should be the pioneer of pledging more to cybersecurity, but the government has to play its part too, as it has one of the largest IT infrastructures in the world.","The move is attributed to the recent rise in cyberattacks, which as per President Brad Smith, are getting more sophisticated over time.
Here’s Crossmark’s Victoria Fernandez’ outlook on whether now is a suitable time to trim your position in MSFT or not.
Cyberattacks are not a threat for the tech sector onlyCyberattacks threaten more than just the tech sector, added President Smith.
In his interview, he fixated on the need to share information that could help companies join hands against the cyberthreats.
They needed to create a culture around the need to share, and that’s what we need to do here too,” he said.",https://invezz.com/news/2021/09/07/microsoft-president-explains-why-msft-pledged-20-billion-to-cybersecurity/,2021-09-07 00:00:00
29,MSFT,Microsoft Remains a Top-Notch Dividend Stock,"After the dot-com bubble burst in 2000, many investors viewed tech stocks with a skeptical eye. Full of promise yet with little follow-up, profitable tech stocks were few and far between. Even worse, losses were commonplace. But Microsoft (NASDAQ:MSFT) rose from the ashes of the dot-com bubble with heaps of cash, proceeding to pay its first dividend in 2003. Since then, the tech company has managed to increase both its stock price and its dividend payout by leaps and bounds.

Thanks to a combination of strong revenue growth, fast-growing profits, and consistent annual dividend increases, the software giant has become a must-have for many dividend investors -- and the company's latest dividend increase reiterates its strength as a dividend stock.

Microsoft's dividend: The details

Earlier this month, the $2.2 trillion-dollar tech company announced an 11% increase to its quarterly dividend. It's payable on Dec. 9 and to shareholders of record on Nov. 18. The new quarterly dividend of $0.62 comes out to $2.48 annually, giving Microsoft a dividend yield of about 0.8%.

Impressively, the dividend hike actually marks an acceleration from the 10% dividend increase the company announced in 2020.

In conjunction with its dividend increase announcement, Microsoft's board of directors also approved a $60 billion share repurchase program. This gives the company even more ways to return cash to shareholders -- albeit indirectly in the form of buying back shares and thus increasing shareholder ownership in the company.

The robust dividend hike and Microsoft's new share repurchase program together reflect the strength of the software company's underlying business and its recent performance. Microsoft's revenue for fiscal 2021 (which ended on Jun. 30, 2021) rose 21% year over year to $46.2 billion, while net income grew 47% to $16.5 billion.

A dividend-paying powerhouse

The company's double-digit dividend increase helps drive home why investors shouldn't search solely for dividend yield when looking for dividend stocks to buy. They should also consider the growth prospects of a company's dividend.

Sure, Microsoft's dividend yield of less than 1% may seem unappealing at first glance, but investors should realize that it's likely the software giant's dividend growth will average a growth rate of approximately 10% annually for the next five years. With tailwinds of strong top- and bottom-line growth and dividend payments currently accounting for less than one-third of the tech giant's total annual earnings, there is substantial room for upside in Microsoft's dividend payments.","Thanks to a combination of strong revenue growth, fast-growing profits, and consistent annual dividend increases, the software giant has become a must-have for many dividend investors -- and the company's latest dividend increase reiterates its strength as a dividend stock.
Microsoft's dividend: The detailsEarlier this month, the $2.2 trillion-dollar tech company announced an 11% increase to its quarterly dividend.
The new quarterly dividend of $0.62 comes out to $2.48 annually, giving Microsoft a dividend yield of about 0.8%.
Impressively, the dividend hike actually marks an acceleration from the 10% dividend increase the company announced in 2020.
A dividend-paying powerhouseThe company's double-digit dividend increase helps drive home why investors shouldn't search solely for dividend yield when looking for dividend stocks to buy.",https://www.fool.com/investing/2021/09/23/microsoft-remains-a-top-notch-dividend-stock/,2021-09-23 00:00:00
