,Ticker,Title,Article,Summary,Link,Date
79,MSFT,2 Top Growth Stocks That Dividend Investors Will Also Love,"Choosing between dividend stocks and growth stocks can be difficult. While the former might offer you some sort of stable recurring income, the latter gives you the potential to benefit from long-term gains -- and usually, is a riskier investment. But there are some stocks that can give you the best of both worlds, offering you a mix of both dividend income and growth potential.

Twostocks that fall into that category are Innovative Industrial Properties (NYSE:IIPR) and Microsoft (NASDAQ:MSFT). Both investments are capable of generating consistent dividend income over the years while giving you the opportunity to benefit from growth in the cannabis and technology sectors, respectively.

1. Innovative Industrial Properties

Real estate investment trust (REIT) Innovative Industrial Properties pays investors a yield of 2.3% -- well above the S&P 500 average of 1.3%. As the cannabis company has grown over the years, its dividend has come along for the ride; since REITs need to pay out 90% of their earnings back to shareholders, as long as profits increase, investors know that so too will their payouts.

The REIT's quarterly dividend payment of $1.40 is more than double the $0.60 that the company was paying just two years earlier. While you may initially be scared off by its payout ratio of more than 100%, REITs rely on funds from operations (FFO) to evaluate their performance and dividend-paying abilities (as opposed to accounting income, which includes non-cash expenses). And although its diluted earnings per share of $1.17 for the period ending June 30 was below its quarterly payout, the company's diluted FFO of $1.56 was well above it. Revenue of $48.9 million for the period doubled from a year ago while net income soared by 124%.

And as good as those numbers look, they can get even better in the future. The cannabis industry's continued growth has opened up more opportunities for Innovative Industrial Properties as more states permit recreational or medicinal use marijuana and more growers are looking for space to lease -- often through sale-and-leaseback agreements that allow them to raise money to fund their growth.

As of the end of the company's most recent quarter, Innovative Industrial Properties had 73 properties spread across 18 states -- up from 61 properties in 16 states a year earlier. Two markets to watch closely are New York and New Jersey, which today account for just 4.2% and 2.9% of the REIT's portfolio, respectively. Those states passed legislation this year permitting recreational marijuana, and I wouldn't be surprised if those percentages rose significantly in the next year or two as companies jockey for market share in those regions.

In the past year, shares of this pot stock have soared 93%, well ahead of the S&P 500's returns of 29%. And with the marijuana industry still not legal in every or state or at the federal level, it's not too late to profit from this company's explosive growth -- which is still in its early stages. The growing dividend income serves both as a bonus and an incentive for investors to remain patient and just buy and hold.

2. Microsoft

Microsoft's dividend yield of around 0.8% isn't terribly high and is well below average. However, with a payout ratio of only 27%, the tech giant certainly has the room to increase its dividend in the future. The company increased its payouts by 10% last year, from $0.51 to $0.56. The quarterly payment has doubled from 2013 when Microsoft was paying shareholders $0.23.

There's little doubt the payout will continue rising as the company continues to deliver impressive numbers. On July 27, Microsoft reported net income of $16.5 billion for the period ending June 30, which grew 47% year over year. Sales of $46.2 billion were also up by 21%. The strength of Microsoft's business is its diversity. While sales from its Surface laptops was down 20% year over year, the company had several high-growth areas. Its LinkedIn marketing solutions segment generated revenue growth of 97% from the prior-year period. And Microsoft's cloud computing service, Azure, grew sales at a rate of 51%.

The company's Office 365 commercial software grew at a more modest rate of 25% (and as low as 18% for its Office consumer products and services). But that could get a boost in the near future as Microsoft recently announced price hikes for the commercial software (most monthly increases are in the range of $2 to $3 per user) -- ""the first substantive pricing update"" since it launched the office suite 10 years ago.

Microsoft has no shortage of ways to grow its business. Whether it is gaming, cloud-based software and services, or its flagship Office software, investors won't have to worry about its opportunities drying up anytime soon. And as those profits roll in, the dividend increases could become more generous in future years. Microsoft is a stock that any investor can justify putting in their portfolio, whether it's for dividend income or the sheer growth potential the investment offers. Over the past 12 months, shares of Microsoft are up by more than 32%.","Choosing between dividend stocks and growth stocks can be difficult.
But there are some stocks that can give you the best of both worlds, offering you a mix of both dividend income and growth potential.
Both investments are capable of generating consistent dividend income over the years while giving you the opportunity to benefit from growth in the cannabis and technology sectors, respectively.
Innovative Industrial PropertiesReal estate investment trust (REIT) Innovative Industrial Properties pays investors a yield of 2.3% -- well above the S&P 500 average of 1.3%.
The growing dividend income serves both as a bonus and an incentive for investors to remain patient and just buy and hold.",https://www.fool.com/investing/2021/09/01/2-top-growth-stocks-that-dividend-investors-will-a/,2021-09-01 00:00:00
80,MSFT,"How Apple, Microsoft and Nvidia Stocks Are Reversing Course And What To Watch For - Apple (AAPL), Microsoft (MSFT), Nvidia (NVDA)","Apple, Inc (NASDAQ:AAPL), Microsoft Corporation (NASDAQ:MSFT) and NVIDIA Corporation (NASDAQ:NVDA) have all recently reversed course into uptrends. An uptrend occurs when a stock makes a series of higher highs and higher lows on the chart.

The higher highs indicate the bulls are in control, while the intermittent higher lows indicate consolidation periods. Traders can use moving averages to help identify an uptrend with rising lower-frame moving averages (such as the eight-day or 21-day exponential moving averages) indicating the stock is in a steep shorter-term uptrend and rising longer-term moving averages (such as the 200-day simple moving average) indicating a long-term uptrend.

A stock often signals when the higher high is in by printing a reversal candlestick such as a doji, bearish engulfing or hanging man candlestick. Likewise, the higher low could be signaled when a doji, morning star or hammer candlestick is printed. Moreover, the higher highs and higher lows often take place at resistance and support levels.

In an uptrend the ""trend is your friend"" until it’s not, and in an uptrend there are ways for both bullish and bearish traders to participate in the stock:

Bullish traders who are already holding a position in a stock can feel confident the uptrend will continue unless the stock makes a lower low. Traders looking to take a position in a stock trading in an uptrend can enter and usually find the safest entry on the higher low.

Bearish traders can enter the trade on the higher high and exit on the pullback. These traders can also enter when the uptrend breaks and the stock makes a lower low, indicating a reversal into a downtrend may be in the cards.

See Also: This Cannabis Stock Has A Better 1-Year Return Than Tesla, Nio, GM, Apple, Disney And Microsoft

The Apple Chart: Apple reached a high of $147.47 on Friday and regained the eight-day exponential moving average (EMA) as support. The stock will need to make a higher low in the future as it continues its uptrend. Apple has resistance above at $147.79 and $150 while it has support below at $144.53 and $141.37.

The Microsoft Chart: Microsoft made a higher high on Thursday at the $300.90 level and on Friday may have put in the higher low at $296.93 when it printed a hammer candlestick. Microsoft has resistance above at the $301.50 level and above at its Aug. 20 and Aug. 24 all-time high of $305.84. The stock has support below at $298.20 and $296.93.

The NVIDIA Chart: Nvidia reached a high of $225.35 on Thursday and may have put in the higher low on Friday when it consolidated down to the $218.61 level and printed a doji reversal candlestick. Nvidia's only resistance above is at its all-time high of $230.43, and it has support below at the $219.77 and $208.75 levels.","Apple, Inc (NASDAQ:AAPL), Microsoft Corporation (NASDAQ:MSFT) and NVIDIA Corporation (NASDAQ:NVDA) have all recently reversed course into uptrends.
Likewise, the higher low could be signaled when a doji, morning star or hammer candlestick is printed.
Bearish traders can enter the trade on the higher high and exit on the pullback.
The stock will need to make a higher low in the future as it continues its uptrend.
The Microsoft Chart: Microsoft made a higher high on Thursday at the $300.90 level and on Friday may have put in the higher low at $296.93 when it printed a hammer candlestick.",https://www.benzinga.com/trading-ideas/long-ideas/21/09/23103866/how-apple-microsoft-and-nvidia-stocks-are-reversing-course-and-what-to-watch-for,2021-09-01 00:00:00
81,MSFT,Microsoft To Launch Office 2021 On Oct 5,"TechCrunch

Last week, we talked about how YouTube has managed to skate along while Facebook has gotten pummeled over platform responsibility concerns. This week, we're looking at another slippery slope Apple is dancing on the edge of. After first hitting that sweet trillion dollar valuation, then surpassing two trillion, Apple is likely well aware that it's a long road ahead to becoming the first quadrillion dollar company and they're going to have to make some controversial choices to get there.","TechCrunchLast week, we talked about how YouTube has managed to skate along while Facebook has gotten pummeled over platform responsibility concerns.
This week, we're looking at another slippery slope Apple is dancing on the edge of.
After first hitting that sweet trillion dollar valuation, then surpassing two trillion, Apple is likely well aware that it's a long road ahead to becoming the first quadrillion dollar company and they're going to have to make some controversial choices to get there.",https://finance.yahoo.com/news/microsoft-launch-office-2021-oct-105023128.html,2021-10-10 00:00:00
82,MSFT,"Microsoft, Citrix, Weber Rise Premarket; Wynn Resorts Falls","By Peter Nurse

Investing.com -- Stocks in focus in premarket trade on Wednesday, September 15th. Please refresh for updates.

Microsoft (NASDAQ:MSFT) stock rose 1.2% after the software giant announced a $60 billion share buyback, with no expiration date, and a higher quarterly dividend.

Apple (NASDAQ:AAPL) stock rose 0.2%, with the world’s largest company rebounding after the previous session’s lukewarm response to the unveiling of its Phone 13 and a new iPad mini.

Chevron (NYSE:CVX) stock rose 0.5%, boosted by the rise in oil prices, even after JPMorgan (NYSE:JPM) downgraded the oil major, citing its ramp up in clean energy spending. The company said yesterday it will increase spending on alternative energy projects to $10 billion from $3 billion.

Wynn Resorts (NASDAQ:WYNN) stock fell 4.9%. MGM Resorts (NYSE:MGM) stock fell 1.5% and Las Vegas Sands (NYSE:LVS) stock dropped 4.5%, continuing Tuesday’s selloff after the government of Macau sought to increase regulatory scrutiny over casinos in the world’s largest gambling hub.

Weber (NYSE:WEBR) stock rose 2% after the maker of outdoor grills posted a strong first quarterly report since going public, with sales rising 19% from a year earlier.

Theravance Biopharma (NASDAQ:TBPH) stock fell 17% on the back of the biopharmaceutical company announcing its drug to treat hypotension did not meet its primary endpoint. It now intends to cut its workforce by around 75%.

Lucid Group (NASDAQ:LCID) stock rose 2.4% following Bank of America (NYSE:BAC) predicting a 50% gain, saying the newly floated electric vehicle company appears to be on a firm footing to become a real player in the growing market.

Regeneron (NASDAQ:REGN) stock rose 1.9% after the drugmaker announced that the U.S. government would buy an additional 1.4 million doses of its Covid-19 antibody treatment.

Sage Therapeutic (NASDAQ:SAGE) stock rose 3.4%, boosted by the FDA granting fast-track status to the drugmaker’s experimental treatment for Huntington’s disease.

Story continues

Citrix Systems (NASDAQ:CTXS) stock rose 5.8% after Bloomberg reported the software company is working with advisers to consider a possible sale. Activist investor Elliott recently disclosed at 10% stake in the company.

Related Articles

Microsoft, Citrix, Weber Rise Premarket; Wynn Resorts Falls

Biden to meet U.S. CEOs in 'rallying cry' for vaccine mandates

Pullback in CrowdStrike: Opportunity for Investors","Wynn Resorts (NASDAQ:WYNN) stock fell 4.9%.
Regeneron (NASDAQ:REGN) stock rose 1.9% after the drugmaker announced that the U.S. government would buy an additional 1.4 million doses of its Covid-19 antibody treatment.
Sage Therapeutic (NASDAQ:SAGE) stock rose 3.4%, boosted by the FDA granting fast-track status to the drugmaker’s experimental treatment for Huntington’s disease.
Story continuesCitrix Systems (NASDAQ:CTXS) stock rose 5.8% after Bloomberg reported the software company is working with advisers to consider a possible sale.
Related ArticlesMicrosoft, Citrix, Weber Rise Premarket; Wynn Resorts FallsBiden to meet U.S. CEOs in 'rallying cry' for vaccine mandatesPullback in CrowdStrike: Opportunity for Investors",https://finance.yahoo.com/news/microsoft-citrix-weber-rise-premarket-081109264.html,2021-10-10 00:00:00
83,MSFT,SoftBank Vision Fund’s Deep Nishar Is Discussing Leaving Firm,"(Bloomberg) -- SoftBank Vision Fund’s sole senior managing partner, Deep Nishar, is discussing leaving the firm, according to people with knowledge of the matter.

Nishar, who’s based in the San Francisco Bay Area, joined SoftBank in 2015, according to his LinkedIn profile. Previously a lecturer at Stanford University, he also served as a senior vice president of products and user experience at LinkedIn, and before that, worked at Google. Nishar also has a strong technical background, co-authoring 14 patents, his biography on SoftBank’s website shows. He has held discussions regarding his potential departure, though nothing has been finalized, said one of the people, who asked not to be identified discussing private talks.

Nishar has been involved in more than three dozen of SoftBank’s bets, including 10X Genomics Inc., Guardant Health Inc., Slack Technologies Inc., Pear Therapeutics Inc. and Grofers, the firm’s website shows. There are only three executives at the fund who outrank Nishar, including Masayoshi Son, founder and chairman of SoftBank Group Corp.

A representative for SoftBank Investment Advisers, which oversees Vision Fund and Vision Fund 2, declined to comment. Nishar didn’t immediately respond to a request for comment.

The Vision Fund has faced major changes in its senior personnel since launching in 2017, with past exits including Jeff Housenbold, Colin Fan and Ervin Tu, all managing partners.

More stories like this are available on bloomberg.com

Subscribe now to stay ahead with the most trusted business news source.

©2021 Bloomberg L.P.","(Bloomberg) -- SoftBank Vision Fund’s sole senior managing partner, Deep Nishar, is discussing leaving the firm, according to people with knowledge of the matter.
Nishar, who’s based in the San Francisco Bay Area, joined SoftBank in 2015, according to his LinkedIn profile.
Nishar also has a strong technical background, co-authoring 14 patents, his biography on SoftBank’s website shows.
There are only three executives at the fund who outrank Nishar, including Masayoshi Son, founder and chairman of SoftBank Group Corp.A representative for SoftBank Investment Advisers, which oversees Vision Fund and Vision Fund 2, declined to comment.
The Vision Fund has faced major changes in its senior personnel since launching in 2017, with past exits including Jeff Housenbold, Colin Fan and Ervin Tu, all managing partners.",https://finance.yahoo.com/news/softbank-vision-fund-deep-nishar-173418346.html,2021-10-10 00:00:00
84,MSFT,"Wells Fargo picks Microsoft, Google as cloud service providers","A Wells Fargo logo is seen in New York City, U.S. January 10, 2017. REUTERS/Stephanie Keith

Sept 15 (Reuters) - Wells Fargo & Co (WFC.N) said on Wednesday that it had picked Microsoft Corp (MSFT.O) and Alphabet Inc's (GOOGL.O) Google as its public cloud providers, embracing a multi-cloud approach.

While Microsoft's Azure will serve as the bank's primary cloud provider, Google Cloud will provide additional business-critical public cloud services.

As part of its new digital infrastructure strategy, the company will also move towards some third party-owned data centers, as it aims to rely predominantly on public cloud in the longer term, it said.

The move makes Wells Fargo the latest big bank to use third-party data centers for cloud-related services.

The company did not disclose the financial details of its agreement with Microsoft and Google.

Multi-cloud enables flexibility and also allows businesses to off-load some of the heavy costs of running their own data centers by renting public ones.

Reporting by Chavi Mehta in Bengaluru; Editing by Anil D'Silva

Our Standards: The Thomson Reuters Trust Principles.","A Wells Fargo logo is seen in New York City, U.S. January 10, 2017.
REUTERS/Stephanie KeithSept 15 (Reuters) - Wells Fargo & Co (WFC.N) said on Wednesday that it had picked Microsoft Corp (MSFT.O) and Alphabet Inc's (GOOGL.O) Google as its public cloud providers, embracing a multi-cloud approach.
While Microsoft's Azure will serve as the bank's primary cloud provider, Google Cloud will provide additional business-critical public cloud services.
The move makes Wells Fargo the latest big bank to use third-party data centers for cloud-related services.
Multi-cloud enables flexibility and also allows businesses to off-load some of the heavy costs of running their own data centers by renting public ones.",https://www.reuters.com/business/finance/wells-fargo-picks-microsoft-google-cloud-service-providers-2021-09-15/,2021-09-15 00:00:00
85,MSFT,Microsoft Edge Hits A Big Milestone,"Microsoft today shared a big milestone for Microsoft Edge. The company says 1,000 builds have now gone through both the Edge Dev and Canary channels since the initial announcement of the Chromium-based browser. Of course, Microsoft is also pushing out the weekly Edge Dev build too (95.0.1000.0) and we have a look at everything you need to know.

Since this is one of the first Edge Version 95 builds, don't expect anything major in this release. Microsoft just added a couple of fixes here and there, and also fixed some crashes. The changelog is small, and you can peek at it below.

Added the ability to sync custom IE mode site lists between devices.

Re-enabled the improved browser profile sign-in dialog.

Fixed a crash on launch on Linux.

Fixed a crash when clicking the … menu in a PWA or website installed as an app.

Fixed a crash when watching videos.

Fixed a crash when using Smart Copy.

Fixed an issue where the browser crashes when switching to a different profile, including Guest or Kids mode.

Fixed an error when exporting a Collection to Word.

Fixed an issue on mobile where Collections sometimes don’t sync.

Even though Microsoft hit the 1,000 build mark, some of the same known issues from the past months will still persist in this latest version of Edge Dev. We sound like a broken record at this point, but it's the same issues with ad-blocking extensions on YouTube, tabs and extensions crashing, Kaspersky Internet Suite, duplicate favorites, and wobbling with scrolling.

Congratulations to Microsoft for hitting the 1,000 build mark! There are sure to be many more builds to come. Happy downloading, Edge Insiders, and remember to submit your feedback to Microsoft, as it helps make the browser better for everyone!

Share This Post:","Microsoft today shared a big milestone for Microsoft Edge.
The company says 1,000 builds have now gone through both the Edge Dev and Canary channels since the initial announcement of the Chromium-based browser.
Of course, Microsoft is also pushing out the weekly Edge Dev build too (95.0.1000.0) and we have a look at everything you need to know.
Since this is one of the first Edge Version 95 builds, don't expect anything major in this release.
Even though Microsoft hit the 1,000 build mark, some of the same known issues from the past months will still persist in this latest version of Edge Dev.",https://www.onmsft.com/news/microsoft-edge-dev-canary-1000-builds,2021-09-09 13:02:04-07:00
