,Ticker,Title,Article,Summary,Link,Date
50,MSFT,Where Is Microsoft's Stock Headed?,"Microsoft (NASDAQ: MSFT), declined by 1.3% in the last twenty-one trading days. Meanwhile, the broader S&P500 declined by 1.6% over the last twenty-one trading days. As per Trefis’ Microsoft’s valuation of $323, there is around a 10% upside potential from the current price. Now, is MSFT stock poised to grow? Based on our machine learning analysis of trends in the stock price over the last ten years, there is a 69% chance of a rise in MSFT stock over the next month (twenty-one trading days). See our analysis on Microsoft’s Stock Chance Of Rise for more details.

Five Days: MSFT -1.3%, vs. S&P500 -3.1%; Underperformed market

(26% event probability)

Microsoft’s stock declined 1.3% over a five day trading period ending 9/17/2021, compared to the broader market (S&P500) which declined by 3.1%

over a five day trading period ending 9/17/2021, compared to the broader market (S&P500) which declined by 3.1% A change of -1.3% or more over five trading days has a 26% event probability, which has occurred 666 times out of 2516 in the last ten years

Ten Days: MSFT -2.7%, vs. S&P500 -4.5%; Outperformed market

(13% event probability)

Microsoft’s stock declined -2.7% over the last ten trading days (two weeks), compared to the broader market (S&P500) which declined by -4.5%

over the last ten trading days (two weeks), compared to the broader market (S&P500) which declined by -4.5% A change of -2.7% or more over ten trading days has a 13% event probability, which has occurred 332 times out of 2517 in the last ten years

Twenty-One Days: MSFT -1.3%, vs. S&P500 -1.6%; Outperformed market

(26% event probability)

Microsoft’s stock declined 1.3% over the last twenty-one trading days (one month), compared to the broader market (S&P500) which declined by 1.6%

over the last twenty-one trading days (one month), compared to the broader market (S&P500) which declined by 1.6% A change of -1.3% or more over twenty-one trading days has a 26% event probability, which has occurred 643 times out of 2516 in the last ten years

Trefis Market Beating PortfoliosTrefis Price Estimates

The views and opinions expressed herein are the views and opinions of the author and do not necessarily reflect those of Nasdaq, Inc.","Microsoft (NASDAQ: MSFT), declined by 1.3% in the last twenty-one trading days.
Meanwhile, the broader S&P500 declined by 1.6% over the last twenty-one trading days.
Now, is MSFT stock poised to grow?
Based on our machine learning analysis of trends in the stock price over the last ten years, there is a 69% chance of a rise in MSFT stock over the next month (twenty-one trading days).
See our analysis on Microsoft’s Stock Chance Of Rise for more details.",https://www.nasdaq.com/articles/where-is-microsofts-stock-headed-2021-09-23,2021-09-23 00:00:00
51,MSFT,4 Cybersecurity Stocks to Buy on Rising Ransomware Attacks,"Cybersecurity is now a megatrend as an increasing number of companies are investing in artificial intelligence (AI) and cloud tech during the pandemic. The shift to e-commerce and remote working practices demands huge exposure to AI and cloud computing solutions but also pushes firms to consider cybersecurity risks.

Government and businesses are dealing with a number of sophisticated cyber threats that are disrupting daily work and are difficult to prevent. From wiper malware to firmware and evil AI, ransomware has taken the spotlight and is responsible for several attacks. In recent months, multiple high-profile cyberattacks have made businesses question the security of their networks and infrastructure. Some of them are REvil ransomware attack on Colonial Pipeline, the SolarWinds’ hack, and the cyberattack on the world’s largest meat supplier, JBS.

President Joe Biden has been stressing on strengthening the country’s cybersecurity and on Aug 25, he organized a summit on national cybersecurity, hosting executives from major technology, financial, and energy companies. At the summit, Biden said that “our critical infrastructure is owned and operated by the private sector” and it is difficult for the federal government to meet the challenge alone.

Among the attendees was Microsoft Corporation’s MSFT Satya Nadella who said that the tech giant will invest $20 billion over the next five years to speed up cybersecurity work. Microsoft will also provide $150 million in technical services to help federal, state, and local governments to keep their security systems up to date. Additionally, Google’s parent Alphabet committed $10 billion toward security efforts in an attempt to offer digital-skill certifications to 100,000 American workers. Meanwhile, IBM said it will train 150,000 people in cybersecurity skills.

The challenge at present is that the emerging fields of AI and cloud computing are aiding cybercriminals and hacking groups. AI characteristically can evolve and adapt to situations, hence AI-assisted smarter and autonomous malware can adapt to changing circumstances and learn how to improve tactics to pull off advanced attacks. Researchers have already demonstrated that early-stage AI is significantly better than humans at launching phishing attacks and crafting viral tweets and many companies really don’t have strong firewalls to see what advance evil AI can do. Advancing technologies have cultivated deepfakes that could potentially trigger political crises and incriminate innocent people.

Story continues

Given the current scenario, going back into the handwritten paper documentation era is not an option. Instead, government and businesses need to strengthen cybersecurity and public-private partnerships to address the ongoing cyberattacks and threats. There is high demand for next-generation security software and per Gartner’s forecast, spending on information security and risk management technology and services may grow 12.4% to reach $150.4 billion in 2021, globally. Per records, at present, cybercrimes, which include damage and destruction of data, stolen money, lost property, intellectual property theft, etc., cost the world almost $600 billion each year. Hence, the adoption of cybersecurity solutions is expected to grow.

4 Cybersecurity Stock Choices

According to a Mordor Intelligence study, the cybersecurity market was valued at $156.24 billion in 2020 and is expected to reach a worth of $352.25 billion by 2026, at a CAGR of 14.5%. The need for security is significantly higher in private financial and banking services, healthcare, and aerospace defense sectors. Hence, we have shortlisted four stocks that are poised to grow.

Qualys, Inc. QLYS provides cloud-based information technology, security, and compliance solutions. In August, this company planned to acquire cloud management platform startup TotalCloud to enhance its cloud security offering and “further strengthen” the Qualys Cloud Platform. The company’s expected earnings growth rate for the current year is 6.3% compared with the Zacks Security industry’s projected earnings growth of 1.8%.

The Zacks Consensus Estimate for this company’s current-year earnings has been revised 11.7% upward over the past 60 days. Qualys flaunts a Zacks Rank #1 (Strong Buy). You can see the complete list of today’s Zacks #1 Rank stocks here.

Microsoft develops, licenses, and supports software, services, devices, and solutions. As mentioned above, the company plans to ramp up cybersecurity and invest $20 billion over the next five years. The company’s expected earnings growth rate for the current year is 8% compared with the Zacks Computer - Software industry’s projected earnings growth of 3.5%.

The Zacks Consensus Estimate for this company’s current-year earnings has been revised 3.6% upward over the past 60 days. Microsoft sports a Zacks Rank #2 (Buy) and has witnessed nearly 35% growth so far this year.

Radware Ltd. RDWR is a Zacks Rank #2 company that develops, manufactures, and markets cyber security and application delivery solutions for applications in physical, virtual, cloud, and software defined data centers. The company’s expected earnings growth rate for the current year is 20.3% compared with the Zacks Security industry’s projected earnings growth of 1.8%. The Zacks Consensus Estimate for this company’s current-year earnings has been revised 6.9% upward over the past 60 days. Shares of Radware have moved up 29.2% so far this year.

F5 Networks, Inc. FFIV provides multi-cloud application services for the security, performance, and availability of network applications, servers, and storage systems. This Zacks Rank #2 company’s expected earnings growth rate for the current year is 13.2% against the Zacks Internet - Software industry’s projected earnings decline of 0.9%. The Zacks Consensus Estimate for this company’s current-year earnings has been revised 3.5% upward over the past 60 days.



Want the latest recommendations from Zacks Investment Research? Today, you can download 7 Best Stocks for the Next 30 Days. Click to get this free report



Microsoft Corporation (MSFT) : Free Stock Analysis Report



F5 Networks, Inc. (FFIV) : Free Stock Analysis Report



Radware Ltd. (RDWR) : Free Stock Analysis Report



Qualys, Inc. (QLYS) : Free Stock Analysis Report



To read this article on Zacks.com click here.



Zacks Investment Research","In August, this company planned to acquire cloud management platform startup TotalCloud to enhance its cloud security offering and “further strengthen” the Qualys Cloud Platform.
The company’s expected earnings growth rate for the current year is 6.3% compared with the Zacks Security industry’s projected earnings growth of 1.8%.
The company’s expected earnings growth rate for the current year is 8% compared with the Zacks Computer - Software industry’s projected earnings growth of 3.5%.
The company’s expected earnings growth rate for the current year is 20.3% compared with the Zacks Security industry’s projected earnings growth of 1.8%.
This Zacks Rank #2 company’s expected earnings growth rate for the current year is 13.2% against the Zacks Internet - Software industry’s projected earnings decline of 0.9%.",https://finance.yahoo.com/news/4-cybersecurity-stocks-buy-rising-105910683.html,2021-09-23 00:00:00
52,MSFT,Is Microsoft Corporation (MSFT) Stock a Attractive Value?,"Wednesday, September 08, 2021 02:27 PM | InvestorsObserver Analysts

Microsoft Corporation (MSFT) stock has risen 47.55% over the last 12 months, and the average rating from Wall Street analysts is a Strong Buy. InvestorsObserver’s proprietary ranking system, gives MSFT stock a score of 72 out of a possible 100. That rank is mainly influenced by a short-term technical score of 89. MSFT's rank also includes a long-term technical score of 86. The fundamental score for MSFT is 41. In addition to the average rating from Wall Street analysts, MSFT stock has a mean target price of $320.20. This means analysts expect the stock to increase 7.08% over the next 12 months.

See Full MSFT Report MSFT has an Overall Score of 72. Find out what this means to you and get the rest of the rankings on MSFT!

What's Happening with MSFT Stock Today","Wednesday, September 08, 2021 02:27 PM | InvestorsObserver AnalystsMicrosoft Corporation (MSFT) stock has risen 47.55% over the last 12 months, and the average rating from Wall Street analysts is a Strong Buy.
InvestorsObserver’s proprietary ranking system, gives MSFT stock a score of 72 out of a possible 100.
In addition to the average rating from Wall Street analysts, MSFT stock has a mean target price of $320.20.
This means analysts expect the stock to increase 7.08% over the next 12 months.
What's Happening with MSFT Stock Today",https://www.investorsobserver.com/news/stock-update/is-microsoft-corporation-msft-stock-a-attractive-value-2,2021-09-23 00:00:00
53,MSFT,Microsoft will now let you kill your passwords for good,"Microsoft CEO Satya Nadella speaks during a device-launching event ahead of the Mobile World Congress in Barcelona, Spain February 24, 2019. REUTERS/Sergio Perez

Passwords are probably the worst part about connecting to the web. At Yahoo Finance, we’re asked to change our passwords several times a year, and they need to be incredibly long. Oh, and you can’t use the same phrase more than once.

And while those are the best ways to stay safe online, they’re still a hassle. To that end, Microsoft (MSFT) is releasing its passwordless login technology for all consumers.

Rather than logging in with a password, the company will now let you type in your username, then use either the Microsoft Authenticator app, Windows Hello, a physical security key, or a phone or email verification to access your Outlook, OneDrive, Microsoft Family Safety, and other apps. The company is also working on expanding this to additional services including Xbox accounts in the future.

You’ll need to set up the feature before you can start using it, though, which means you’ll have to set up the passwordless option yourself. To do so, you’ll have to download the Microsoft Authenticator app — it’s available for iOS and Android — and link it to your account.

Then you’ll need to sign in to your Microsoft account via a browser, and go to the Advanced Security Options page and turn on Passwordless Account. From there you can follow the on-screen instructions to determine how to use the feature.

When setting up your account, you can choose how you'd like to authenticate yourself in the future. (Image: Microsoft)

I’ve been using passwordless sign in on my Microsoft account for a while now using the Authenticator app, and it’s proven far easier than forgetting my password and having to reset it every month. I type in my email, click log-in and get a prompt from the Authenticator app asking if I'm trying to sign in. Then I just follow the on-screen directions, and I'm in.

You can also choose to go back to using passwords at any time if you’d like. But that would be crazy.

Story continues

Of course, there are other means of keeping yourself safe online too. LastPass is a service that acts as a master password for all of the sites that you log in to, eliminating the need to remember a boatload of different passwords.

Multi-factor authentication is also an option for people who aren’t quite finished with using passwords that allows you to sign into your account with a password and protect it with a text message or an app notification.

While Microsoft says its passwordless approach will only work with its own products for now, the company is working with other organizations to make the use of passwordless logins more readily available for services across the web.

If that becomes the case, you may never have to scramble to reset your password when you inevitably forget it again.

Sign up for Yahoo Finance Tech newsletter

More from Dan

Follow Yahoo Finance on Twitter, Facebook, Instagram, Flipboard, LinkedIn, YouTube, and reddit

Got a tip? Email Daniel Howley at dhowley@yahoofinance.com over via encrypted mail at danielphowley@protonmail.com, and follow him on Twitter at @DanielHowley.","At Yahoo Finance, we’re asked to change our passwords several times a year, and they need to be incredibly long.
Rather than logging in with a password, the company will now let you type in your username, then use either the Microsoft Authenticator app, Windows Hello, a physical security key, or a phone or email verification to access your Outlook, OneDrive, Microsoft Family Safety, and other apps.
To do so, you’ll have to download the Microsoft Authenticator app — it’s available for iOS and Android — and link it to your account.
Then you’ll need to sign in to your Microsoft account via a browser, and go to the Advanced Security Options page and turn on Passwordless Account.
I type in my email, click log-in and get a prompt from the Authenticator app asking if I'm trying to sign in.",https://finance.yahoo.com/news/microsoft-will-let-you-kill-your-password-for-good-130029675.html,2021-09-23 00:00:00
54,MSFT,4 Stocks Jim Cramer Is Watching in Monday's 'Bifurcated' Market,"Stocks were mixed in intraday Monday with the Dow Jones Industrial Average up 150.94 points, the Nasdaq Composite down 73.22 points and the S&P 500 down 6.23 points.

“The bifurcation is so stark,” Jim Cramer told Action Alerts PLUS senior analyst Jeff Marks.

Cramer said that as interest rates increase, investors are shifting from technology stocks to the banks, oils, industrials and travel and leisure names.

In the video above, Cramer explained why he’s putting particular attention on Microsoft (MSFT) - Get Microsoft Corporation (MSFT) Report, Amazon (AMZN) - Get Amazon.com, Inc. Report, Facebook (FB) - Get Facebook, Inc. Class A Report and Disney (DIS) - Get Walt Disney Company Report Monday.

How the Long Tech Rally Evolved

Recap TheStreet Live: Everything Jim Cramer Is Watching 9/27/21

Microsoft, Facebook, Amazon and Disney are holdings in Jim Cramer's Action Alerts PLUS charitable trust.","Stocks were mixed in intraday Monday with the Dow Jones Industrial Average up 150.94 points, the Nasdaq Composite down 73.22 points and the S&P 500 down 6.23 points.
“The bifurcation is so stark,” Jim Cramer told Action Alerts PLUS senior analyst Jeff Marks.
Cramer said that as interest rates increase, investors are shifting from technology stocks to the banks, oils, industrials and travel and leisure names.
In the video above, Cramer explained why he’s putting particular attention on Microsoft (MSFT) - Get Microsoft Corporation (MSFT) Report, Amazon (AMZN) - Get Amazon.com, Inc. Report, Facebook (FB) - Get Facebook, Inc. Class A Report and Disney (DIS) - Get Walt Disney Company Report Monday.
How the Long Tech Rally EvolvedRecap TheStreet Live: Everything Jim Cramer Is Watching 9/27/21Microsoft, Facebook, Amazon and Disney are holdings in Jim Cramer's Action Alerts PLUS charitable trust.",https://www.thestreet.com/jim-cramer/jim-cramer-stocks-bifurcated-market-amzn-fb-msft-dis-monday,2021-09-27 15:30:35+00:00
55,MSFT,Boost Your Portfolio With These 3 Promising Tech Stocks,"Modern technologies are offering us amazing resources, making lives more efficient and increasing work productivity. Thus, with the use of technology increasing rapidly across the world, the investment opportunities have also risen manifold.

Rising Tech Adoption

The technology sector excelled last year, backed by rapidly increasing dependency on online solutions for work. Thus, with changing habits and technology companies disrupting older markets and lifestyles, long-term revenue growth for players belonging to the space is inevitable.

Migrating operations to the cloud has been becoming a common affair for every company across the world. The pace has picked up since the onset of the coronavirus pandemic. With cloud computing and remote work becoming essential, there has been a rise in demand for cybersecurity services. Thus, to support computing power, demand for companies that design and manufacture computer chips has skyrocketed.

With technology companies becoming a great long-term investment option, we have employed our proprietary stock screener to zero down on three prospective stocks. All the three firms carry a Zacks Rank #2 (Buy). You can see the complete list of today’s Zacks #1 Rank (Strong Buy) stocks here.

3 Stocks in the Spotlight

Microsoft Corporation MSFT is the second largest provider of cloud infrastructure. Of the total cloud infrastructure services spending in the second quarter of 2021, the share of Microsoft Azure was 22%, only lagging Amazon Web Services (AWS) that accounted for 31% of the total spending, according to Canalys – a leading analyst firm. In terms of revenue growth in the June quarter, Microsoft Azure, however, outpaced AWS.

In all of technology, Microsoft offers the most comprehensive cloud software backed by its leading cloud products comprising Azure, Office 365 and Dynamics CRM. The company has gained 33.6% so far this year, driven by strength in its Azure cloud platform amid accelerated global digital transformation. For fiscal 2022, the company has witnessed upward earnings estimate revisions in the past 60 days, reflecting earnings growth potential.

Story continues

NVIDIA Corporation NVDA, a semiconductor chip company, is among the world’s leading producers of graphics processing units (GPU). Being a pioneer in GPU production, the company has gained advantages over other players in the space in designing semiconductors for the AI industry. Since companies across the world are spending massively on AI, NVIDIA is well placed to generate significant cashflows in the long term.

While designing GPUs for high-end computer game graphics, the company has embarked on a venture. The company, headquartered in Santa Clara, CA, continues to have a strong foothold within its key gaming markets. So far this year, the stock has gained 69.9%, backed by contributions from gaming, data center and professional visualization markets.

ASML Holding NV ASML is a well-known player in the market since it is a leading supplier of photolithography machines to semiconductor manufacturers. So far this year, the stock has gained 75% on mounting demand for chip manufacturing equipment.

The company will bank on its fat order book, which is at a record 8.3 billion euros, comprising 4.9 billion euros for extreme ultraviolet (EUV) systems. Thus, the company is well-positioned to generate significant cashflow over the long run. The stock has witnessed upward earnings estimate revisions for 2021 and 2022, respectively, in the past 60 days.



Want the latest recommendations from Zacks Investment Research? Today, you can download 7 Best Stocks for the Next 30 Days. Click to get this free report



Microsoft Corporation (MSFT) : Free Stock Analysis Report



NVIDIA Corporation (NVDA) : Free Stock Analysis Report



ASML Holding N.V. (ASML) : Free Stock Analysis Report



To read this article on Zacks.com click here.



Zacks Investment Research","Rising Tech AdoptionThe technology sector excelled last year, backed by rapidly increasing dependency on online solutions for work.
With technology companies becoming a great long-term investment option, we have employed our proprietary stock screener to zero down on three prospective stocks.
3 Stocks in the SpotlightMicrosoft Corporation MSFT is the second largest provider of cloud infrastructure.
In all of technology, Microsoft offers the most comprehensive cloud software backed by its leading cloud products comprising Azure, Office 365 and Dynamics CRM.
Click to get this free reportMicrosoft Corporation (MSFT) : Free Stock Analysis ReportNVIDIA Corporation (NVDA) : Free Stock Analysis ReportASML Holding N.V. (ASML) : Free Stock Analysis ReportTo read this article on Zacks.com click here.",https://finance.yahoo.com/news/boost-portfolio-3-promising-tech-140102008.html,2021-09-27 15:30:35+00:00
