,Ticker,Title,Article,Summary,Link,Date
0,MSFT,"Microsoft (MSFT) Reveals New Repurchase Plan, Bumps Dividend","Microsoft MSFT recently announced that its board has approved a new share buyback plan allowing it to repurchase up to $60 billion worth of shares over an unspecified period. The buyback plan has no expiry date and may also be dismissed at any time, added the company.

The company’s board of directors approved an 11% hike in quarterly cash dividend to 62 cents per share, bringing the annualized dividend rate to $2.48 per share. The new dividend will be paid out on Dec 9, 2021, to shareholders of record on Nov 18.

Microsoft’s strong balance sheet and cash flows provide it with ample financial flexibility to pursue shareholder-friendly endeavours.

As of Jun 30, 2021, Microsoft had total cash, cash equivalents and short-term investments balance of $130.33 billion, while long-term debt (including current portion) was $58.15 billion. The company generated operating cash flow of $76.74 billion in fiscal 2021.

In fiscal 2021, Microsoft paid out dividends worth $16.9 billion and repurchased shares worth nearly $23 billion.

Microsoft Corporation Price and Consensus

Microsoft Corporation price-consensus-chart | Microsoft Corporation Quote

Microsoft also named Brad Smith as president and vice chair of the company. Smith will report to CEO Satya Nadella. The company’s 2021 Annual Shareholders Meeting will be held virtually this year, given the pandemic situation, on Nov 30, 2021.

Following the announcement, shares of Microsoft are up 1.2% in the premarket trading on Sep 15.

Growth Opportunities Galore for Microsoft

Microsoft’s initiatives to bump shareholders’ wealth underscores its growth potential and robust liquidity position.

The Redmond, WA-based company is benefiting from momentum in its Azure cloud platform. Azure is witnessing rapid uptake owing to the pandemic-induced digital transformation across the globe. The company is now one of the two public cloud providers that can deliver a wide variety of infrastructure-as-a-service (IaaS) and platform-as-a-service (PaaS) solutions at scale.

Azure’s increased availability in more than 60 announced regions worldwide is boosting its cloud business and consolidating its competitive position against Amazon’s AMZN Amazon Web Services and Alphabet’s GOOGL Google cloud.

Microsoft’s workspace communication offering, Teams, is gaining from the continuation of remote work as well as the implementation of flexible work model. The company noted that Teams had a monthly active user base of 250 million at the end of the fourth quarter of fiscal 2021.

Integration of Teams with Microsoft’s various inhouse offerings (PowerPoint presentations, SharePoint, Stream, Dynamics 365) makes it a winner as it facilitates easy collaboration and engagement, while driving outcomes and saving time. However, Microsoft needs to watch out for stiff competition in the space from the likes of Zoom Video ZM and Cisco.

Recovery in ad and job market is bolstering LinkedIn and Search revenues. Healthy uptake of new Xbox consoles is driving the gaming segment’s performance.

Microsoft commands a dominating position in the operating systems domain. A few days back, the company announced that it will roll out the latest version of its operating system — Windows 11 — beginning from Oct 5, 2021. Windows 11 will be available as a free upgrade for eligible Windows 10 PCs.

Successive editions of Windows operating system have resulted in strong revenues and cash flow generation for the tech giant. The company has a large Microsoft 365 installed user base. Microsoft’s Windows 10 monthly active devices stand around 1.3 billion.

In the past year, shares of Microsoft — a Zacks Rank #2 (Buy) company — have rallied 46.2% compared with industry’s growth of 37.2%.

You can see the complete list of today’s Zacks #1 Rank (Strong Buy) stocks here.

Time to Invest in Legal Marijuana

If you’re looking for big gains, there couldn’t be a better time to get in on a young industry primed to skyrocket from $17.7 billion back in 2019 to an expected $73.6 billion by 2027.

After a clean sweep of 6 election referendums in 5 states, pot is now legal in 36 states plus D.C. Federal legalization is expected soon and that could be a still greater bonanza for investors. Even before the latest wave of legalization, Zacks Investment Research has recommended pot stocks that have shot up as high as +285.9%.

You’re invited to check out Zacks’ Marijuana Moneymakers: An Investor’s Guide. It features a timely Watch List of pot stocks and ETFs with exceptional growth potential.

The views and opinions expressed herein are the views and opinions of the author and do not necessarily reflect those of Nasdaq, Inc.","Microsoft MSFT recently announced that its board has approved a new share buyback plan allowing it to repurchase up to $60 billion worth of shares over an unspecified period.
As of Jun 30, 2021, Microsoft had total cash, cash equivalents and short-term investments balance of $130.33 billion, while long-term debt (including current portion) was $58.15 billion.
In fiscal 2021, Microsoft paid out dividends worth $16.9 billion and repurchased shares worth nearly $23 billion.
Microsoft Corporation Price and ConsensusMicrosoft Corporation price-consensus-chart | Microsoft Corporation QuoteMicrosoft also named Brad Smith as president and vice chair of the company.
Successive editions of Windows operating system have resulted in strong revenues and cash flow generation for the tech giant.",https://www.nasdaq.com/articles/microsoft-msft-reveals-new-repurchase-plan-bumps-dividend-2021-09-15,2021-09-15 00:00:00
1,MSFT,MSFT Stock: Why It Increased Today,"The stock price of Microsoft Corporation (NASDAQ: MSFT) is trading at over 1% pre-market this morning. This is why it happened.

The stock price of Microsoft Corporation (NASDAQ: MSFT) is trading at over 1% pre-market this morning. Investors are responding positively to a Bloomberg report about the company planning to buy back up to $60 billion in stock.

This could be the company’s largest-ever stock-repurchase program. The last major share buyback was in September 2019 at $40 billion.

Microsoft did not disclose how the buyback would be funded, but they have over a $130 billion cash pile. This could be used for funding acquisitions, increasing dividends, and setting up buybacks. Microsoft recently increased its dividends by $0.06 to $0.62 per share.

Investors also appear to be responding to Microsoft naming its President and Chief Legal Officer Brad Smith as vice-chair of the company. Smith had joined Microsoft in 1993 and was named general counsel in 2002.

Disclaimer: This content is intended for informational purposes. Before making any investment, you should do your own analysis.","The stock price of Microsoft Corporation (NASDAQ: MSFT) is trading at over 1% pre-market this morning.
The stock price of Microsoft Corporation (NASDAQ: MSFT) is trading at over 1% pre-market this morning.
Investors are responding positively to a Bloomberg report about the company planning to buy back up to $60 billion in stock.
Microsoft recently increased its dividends by $0.06 to $0.62 per share.
Investors also appear to be responding to Microsoft naming its President and Chief Legal Officer Brad Smith as vice-chair of the company.",https://pulse2.com/microsoft-nasdaq-msft-stock-why-it-increased-today/,2021-09-15 12:15:07+00:00
2,MSFT,Where Is Microsoft’s Stock Headed?,"Led by MIT engineers and Wall Street analysts, Trefis (through its dashboards platform dashboards.trefis.com) helps you understand how a company's products, that you touch, read, or hear about everyday, impact its stock price. Surprisingly, the founders of Trefis discovered that along with most other people they just did not understand even the seemingly familiar companies around them: Apple, Google, Coca Cola, Walmart, GE, Ford, Gap, and others. This might include you though you may have invested money in these companies, or may have been working with one of them for years as an employee, or have consulted with them as an expert for a long time. You can play with assumptions, or try scenarios, as-well-as ask questions to other users and experts. The platform uses extensive data to show in a single snapshot what drives the value of a company's business. Trefis is currently used by hundreds of thousands of investors, company employees, and business professionals.

Read Less","Led by MIT engineers and Wall Street analysts, Trefis (through its dashboards platform dashboards.trefis.com) helps you understand how a company's products, that you touch, read, or hear about everyday, impact its stock price.
Surprisingly, the founders of Trefis discovered that along with most other people they just did not understand even the seemingly familiar companies around them: Apple, Google, Coca Cola, Walmart, GE, Ford, Gap, and others.
You can play with assumptions, or try scenarios, as-well-as ask questions to other users and experts.
The platform uses extensive data to show in a single snapshot what drives the value of a company's business.
Trefis is currently used by hundreds of thousands of investors, company employees, and business professionals.",https://www.forbes.com/sites/greatspeculations/2021/09/22/where-is-microsofts-stock-headed/,2021-09-22 00:00:00
3,MSFT,Microsoft (MSFT) Board Approves $60B Share Repurchase Program,"Microsoft Corporation's (MSFT) board has approved a $60 billion stock repurchase program, according to reports. The company also raised its quarterly dividend to 62 cents from the earlier 56 cents. The dividend will be paid out on Dec. 9 to persons who held Microsoft shares as of Nov. 18. The share repurchase program does not have a timetable and can be terminated any time, the company stated.



Microsoft has stepped up its share buyback programs in the past decade, announcing such programs every three years since 2013. For example, it initiated $40 billion share buyback programs in 2013 and 2016. The announcement of this new program comes toward the end of a similar 2019 $40 billion program. Microsoft has already spent $23 billion from that program this year and has $8.7 billion remaining.

Key Takeaways Microsoft's board has approved a $60 billion share buyback program.

The company also announced an 11% hike in its quarterly dividend.

Microsoft's announcement comes on the heels on a Democrat-led effort to impose a 2% excise tax on share buybacks by corporates.

How Does Microsoft's Announcement Affect Its Shareholders?

Microsoft's latest announcement is interesting because it comes on the heels of efforts by Democrats to levy a 2% excise tax on stock buybacks by publicly-traded companies. Stock repurchases have surged in recent years. In 2018, publicly listed companies announced that they would spend $1.1 trillion from their balance sheet on repurchasing shares. While that number declined by 30.8% during the pandemic, this year is witnessing a revival of sorts in the practice.

Microsoft competitors in the technology industry have also jumped onto the buyback bandwagon. Apple Inc. (AAPL) leads the way. As of April 30, it had spent $77 billion on stock repurchases in the past four quarters. Meanwhile, Alphabet Inc. (GOOGL) had repurchased $11.4 billion worth of shares in the March-ending quarter, and Facebook Inc. (FB) had spent $3.9 billion.

Critics say that stock market gains and rising market capitalizations in recent years are a function of stock buybacks. Company buybacks have resulted in artificial scarcity of stock and boosted their earnings per share (EPS) and valuations.

Share buyback programs have helped play a role in elevating Microsoft's stock price, hoisting it above competitors to become the second most valuable publicly traded company in the world after Apple. For example, Microsoft's stock price has more than doubled, from $130.90 to $301.76 as of this writing, from September 2019, since it announced the last such program.

To be sure, the popularity of Microsoft's product portfolio during the pandemic coupled with rapid advances in its cloud unit have also boosted its revenues. The company has also returned an increasing amount of capital to shareholders. For example, its dividend per share jumped from $0.36 in the first quarter of 2016 to $0.56 in the last quarter. The annual amount spent on total dividends and share buybacks jumped by $5.5 billion and $10 billion, respectively, during the same time period.

Microsoft's stock repurchase programs had reduced its overall share count by 1% in public markets by the end of April.","Microsoft Corporation's (MSFT) board has approved a $60 billion stock repurchase program, according to reports.
Microsoft has stepped up its share buyback programs in the past decade, announcing such programs every three years since 2013.
For example, it initiated $40 billion share buyback programs in 2013 and 2016.
The announcement of this new program comes toward the end of a similar 2019 $40 billion program.
Key Takeaways Microsoft's board has approved a $60 billion share buyback program.",https://www.investopedia.com/microsoft-msft-board-approves-usd60b-share-repurchase-program-5201509,2021-09-16 17:20:58.554000+00:00
4,MSFT,MSFT Stock: $366 Price Target From Tigress Financial,"The shares of Microsoft Corporation (NASDAQ: MSFT) have received a price target of $366 from Tigress Financial. These are the details.

The shares of Microsoft Corporation (NASDAQ: MSFT) have received a price target of $366 from Tigress Financial. And Tigress Financial analyst Ivan Feinseth had raised the price target from $303 and is maintaining a “Buy” rating on the company shares.

Feinseth is expecting a strong performance of cloud-based services for driving another quarter of record results. Plus Feinseth cited the company’s recent 11% quarterly dividend increase and the new $60 billion repurchase authorization as the reason for the higher price target. The new share repurchase program does not have an expiration date and could be terminated at any time.

Microsoft’s board of directors had also approved the appointment of Brad Smith as president and vice-chair of Microsoft as well.

Disclaimer: This content is intended for informational purposes. Before making any investment, you should do your own analysis.","The shares of Microsoft Corporation (NASDAQ: MSFT) have received a price target of $366 from Tigress Financial.
The shares of Microsoft Corporation (NASDAQ: MSFT) have received a price target of $366 from Tigress Financial.
And Tigress Financial analyst Ivan Feinseth had raised the price target from $303 and is maintaining a “Buy” rating on the company shares.
Plus Feinseth cited the company’s recent 11% quarterly dividend increase and the new $60 billion repurchase authorization as the reason for the higher price target.
Microsoft’s board of directors had also approved the appointment of Brad Smith as president and vice-chair of Microsoft as well.",https://pulse2.com/microsoft-nasdaq-msft-stock-366-price-target-from-tigress-financial/,2021-09-18 08:24:03+00:00
5,MSFT,"Technology Sector Update for 09/15/2021: IRNT,CTXS,MSFT","Technology stocks were higher, with the SPDR Technology Select Sector ETF (XLK) Wednesday rising 0.5%, although the Philadelphia Semiconductor Index was falling less than 0.1% this afternoon, reversing a small morning advance.

In company news, Ironnet (IRNT) climbed nearly 23% after the cybersecurity company late Tuesday said it continues to expect FY22 revenue in a range of $43 million to $45 million, straddling the single-analyst estimate looking for $44 million in revenue for the 12 months ending Jan. 31.

Citrix Systems (CTXS) rose 2.8% after the workspace software firm reportedly hired financial and legal advisers to measure potential buyout interest, Bloomberg News reported, citing unnamed people with knowledge of the matter. No decision has been made on whether to proceed with a sale and could choose to continue as a standalone company, the sources told Bloomberg.

Microsoft (MSFT) was 1.5% higher after the tech giant said it has authorized a new $60 billion stock buyback program and also declared a quarterly dividend of $0.62 per share, up 11% over its most recent distribution to investors.

The views and opinions expressed herein are the views and opinions of the author and do not necessarily reflect those of Nasdaq, Inc.","Technology stocks were higher, with the SPDR Technology Select Sector ETF (XLK) Wednesday rising 0.5%, although the Philadelphia Semiconductor Index was falling less than 0.1% this afternoon, reversing a small morning advance.
Citrix Systems (CTXS) rose 2.8% after the workspace software firm reportedly hired financial and legal advisers to measure potential buyout interest, Bloomberg News reported, citing unnamed people with knowledge of the matter.
No decision has been made on whether to proceed with a sale and could choose to continue as a standalone company, the sources told Bloomberg.
Microsoft (MSFT) was 1.5% higher after the tech giant said it has authorized a new $60 billion stock buyback program and also declared a quarterly dividend of $0.62 per share, up 11% over its most recent distribution to investors.
The views and opinions expressed herein are the views and opinions of the author and do not necessarily reflect those of Nasdaq, Inc.",https://www.nasdaq.com/articles/technology-sector-update-for-09-15-2021%3A-irntctxsmsft-2021-09-15,2021-09-15 00:00:00
6,MSFT,Where Is Microsoft's Stock Headed? -- Trefis,"Microsoft (NASDAQ: MSFT), declined by 1.3% in the last twenty-one trading days. Meanwhile, the broader S&P500 declined by 1.6% over the last twenty-one trading days. As per Trefis’ Microsoft’s valuation of $323, there is around a 10% upside potential from the current price. Now, is MSFT stock poised to grow? Based on our machine learning analysis of trends in the stock price over the last ten years, there is a 69% chance of a rise in MSFT stock over the next month (twenty-one trading days). See our analysis on Microsoft’s Stock Chance Of Rise for more details.

Five Days: MSFT -1.3%, vs. S&P500 -3.1%; Underperformed market

(26% event probability)

Microsoft’s stock declined 1.3% over a five day trading period ending 9/17/2021, compared to the broader market (S&P500) which declined by 3.1%

over a five day trading period ending 9/17/2021, compared to the broader market (S&P500) which declined by 3.1% A change of -1.3% or more over five trading days has a 26% event probability, which has occurred 666 times out of 2516 in the last ten years

Ten Days: MSFT -2.7%, vs. S&P500 -4.5%; Outperformed market

(13% event probability)

Microsoft’s stock declined -2.7% over the last ten trading days (two weeks), compared to the broader market (S&P500) which declined by -4.5%

over the last ten trading days (two weeks), compared to the broader market (S&P500) which declined by -4.5% A change of -2.7% or more over ten trading days has a 13% event probability, which has occurred 332 times out of 2517 in the last ten years

Twenty-One Days: MSFT -1.3%, vs. S&P500 -1.6%; Outperformed market

(26% event probability)

Microsoft’s stock declined 1.3% over the last twenty-one trading days (one month), compared to the broader market (S&P500) which declined by 1.6%

over the last twenty-one trading days (one month), compared to the broader market (S&P500) which declined by 1.6% A change of -1.3% or more over twenty-one trading days has a 26% event probability, which has occurred 643 times out of 2516 in the last ten years

Trefis Market Beating Portfolios

Invest with","Microsoft (NASDAQ: MSFT), declined by 1.3% in the last twenty-one trading days.
Meanwhile, the broader S&P500 declined by 1.6% over the last twenty-one trading days.
As per Trefis’ Microsoft’s valuation of $323, there is around a 10% upside potential from the current price.
Now, is MSFT stock poised to grow?
Based on our machine learning analysis of trends in the stock price over the last ten years, there is a 69% chance of a rise in MSFT stock over the next month (twenty-one trading days).",https://www.trefis.com/stock/msft/articles/524559/where-is-microsofts-stock-headed/2021-09-21,2021-09-21 00:00:00
