,Ticker,Title,Article,Summary,Link,Date
45,GOOGL,Microsoft's cloud will now help power a project co-created by Google sister company Verily,"Satya Nadella, chief executive officer of Microsoft Corp., speaks during the Microsoft Developers Build Conference in Seattle, Washington, U.S., on Monday, May 7, 2018. The Build conference, marking its second consecutive year in Seattle, is expected to put emphasis on the company's cloud technologies and the artificial intelligence features within those services.

Microsoft announced Monday it will contribute cloud-based data storage and computing power to Terra, a software project enabling industry and academic researchers to collaborate on large-scale analysis of health information.

Verily, the life sciences company operating under Google parent company Alphabet, co-developed Terra and has been using it for the past three years. The other partner in Terra is the Broad Institute, a nonprofit health research institution that Harvard and the Massachusetts Institute of Technology established in 2004.

The service has run on Google's cloud infrastructure. Now, the groups will also deploy Terra on Microsoft's Azure cloud.

The move in an example of Google Cloud's struggles to gain traction against its larger cloud competitors, as well as Microsoft's success enlisting a broad range of Azure partners across industries. In 2019, the public cloud-services market grew 37% from the prior year, with Microsoft holding about 18% and Amazon, the biggest player, controlling 45%, according to estimates from technology industry research company Gartner. Google had 5% of the market. More recent figures are not available.

""I think there are several aspects of Azure that are very compelling,"" said Anthony Philippakis, Broad Institute's chief data officer. ""When we look at how trusted they are across the life-sciences ecosystem, it's quite amazing. Almost every health-care system runs on Microsoft products.""

Bringing Terra to Azure could lead to significant adoption of the software, he said. Microsoft has more than 168,000 partners in health care and life sciences, said Dr/ Greg Moore, a Microsoft corporate vice president who previously worked on health care in Google's cloud division. As of 2019, 95% of Microsoft's commercial revenue came from partners, according to the company.

Microsoft's decision to contribute to Terra alongside the Broad Institute and Verily comes less than a year after it introduced a Cloud for Health Care bundle including Azure and the Teams communication app. Health care represents a sector where Microsoft can increase its revenue and profit, RBC analysts wrote in a November report.

The appearance of the coronavirus ""has made us more aware than ever"" how critical it is for researchers from various organizations to collaborate, rather than relying on narrower data sets and computing resources that are kept on site, said Clare Bernard, a senior director at the Broad Institute.

Philippakis would not specify whether the software could become available on Amazon Web Services.

""Any decisions about incorporating future clouds will be made jointly between Broad, Verily and Microsoft,"" he said.

WATCH: Alphabet's life sciences arm Verily teams up with big pharma to modernize clinical trials","Verily, the life sciences company operating under Google parent company Alphabet, co-developed Terra and has been using it for the past three years.
Now, the groups will also deploy Terra on Microsoft's Azure cloud.
Microsoft has more than 168,000 partners in health care and life sciences, said Dr/ Greg Moore, a Microsoft corporate vice president who previously worked on health care in Google's cloud division.
Health care represents a sector where Microsoft can increase its revenue and profit, RBC analysts wrote in a November report.
""Any decisions about incorporating future clouds will be made jointly between Broad, Verily and Microsoft,"" he said.",https://www.cnbc.com/2021/01/11/microsoft-azure-coming-to-terra-co-created-by-alphabet-verily.html,2021-01-11 00:00:00
46,GOOGL,Are you a robot?,"Why did this happen?

Please make sure your browser supports JavaScript and cookies and that you are not blocking them from loading. For more information you can review our Terms of Service and Cookie Policy.","Why did this happen?
Please make sure your browser supports JavaScript and cookies and that you are not blocking them from loading.
For more information you can review our Terms of Service and Cookie Policy.",https://www.bloomberg.com/news/articles/2021-01-14/epic-widens-fortnite-access-dispute-with-apple-google-in-u-k,2021-01-14 00:00:00
47,GOOGL,Are you a robot?,"Why did this happen?

Please make sure your browser supports JavaScript and cookies and that you are not blocking them from loading. For more information you can review our Terms of Service and Cookie Policy.","Why did this happen?
Please make sure your browser supports JavaScript and cookies and that you are not blocking them from loading.
For more information you can review our Terms of Service and Cookie Policy.",https://www.bloomberg.com/news/articles/2021-01-01/huawei-restores-tencent-games-to-app-store-after-negotiations,2021-01-01 00:00:00
48,GOOGL,"Weekly Preview: Earnings To Watch This Week (AMZN, BABA, GOOG, PTON)","Several days of profit taking sent Wall Street lower on Friday, prompting some skeptics to assert that the anticipated long-overdue correction has finally arrived. All three major averages were punished, notably the Dow Jones Industrial Average which dropped by as much as 700 points as the battle between selling hedge funds and retail investors raged on. But who will win?

The massive stock gains in heavily shorted companies like GameStop (GME) (shares surged another 67.9% on Friday), AMC Entertainment (AMC) and BlackBerry (BB), among others, has heightened concerns about the frothiness (or bubble) in the market. The excess volatility, compounded by worries about the slowness of the coronavirus vaccine rollout, could be a recipe for a selloff which some analysts believe has been long overdue.

The Dow Jones Industrial Average plunged 620.74 points, or 2%, to close Friday at 29,982.62, marking its lowest close in more than a month. Among the Dow’s biggest decliners were Apple (AAPL) and Microsoft (MSFT) which fell 3.74% and 2.92%, respectively. More than 2% declines in both Disney (DIS) and Walmart (WMT) also pressured the Dow. The S&P 500 index lost 73.14 points to close at 3,714.24, while the tech-heavy Nasdaq Composite Index tumbled 266.46 points, or 2% to close at 13,073.64.

On the bright side, all three averages were off their lows, though each suffered their steepest weekly declines not seen since October. For the week, the Dow closed 3.2% lower, the S&P 500 down 3.3% and Nasdaq Composite lost 3.5%. These declines come despite what I would consider upbeat earnings reports from several big tech giants earlier in the week. With 165,073 new COVID cases reported on Thursday, along with 3,862 deaths, according to a New York Times tracker, the market is now reconciling that slowness in COVID vaccine response which means the pandemic's impact may last longer than hoped.

As such, evidenced by Friday’s declines, investors are de-risking, especially at a time when stocks were at all-time highs. For those who have been on the sidelines, this could be a buying opportunity, focusing on big-cap winners. That is, if you can stomach the volatility and COVID-related headlines risk. Here are the stocks I’ll be watching this week.

Alibaba (BABA) - Reports before the open, Tuesday, Feb. 2

Wall Street expects Alibaba to earn $3.22 per share on revenue of $32.98 billion. This compares to the year-ago quarter when earnings came to $2.61 per share on revenue of $23.14 billion.

What to watch: Alibaba stock has rebounded strongly over the past few weeks after the shares were punished due to concerns related to the whereabouts of the company’s founder after he disappeared from public view for weeks. BABA stock also plunged in late December after an IPO for Ma’s Ant Group was suspended seemingly in retaliation after Ma reportedly spoke critically about Chinese regulators. But can a strong earnings report supplant these concerns? With the Chinese economy on a path towards revitalization, growth expectations for BABA are high given that the company controls some two-thirds of China’s e-commerce market through Taobao and Tmall. On Tuesday, the company must give investors a reason to believe the stock has significantly more room to run and can remain on a sustained path to recovery.

Alphabet (GOOG , GOOGL) - Reports after the close, Tuesday, Feb. 2

Wall Street expects Alphabet to earn $15.98 per share on revenue of $53.11 billion. This compares to the year-ago quarter when earnings came to $15.35 per share on revenue of $46.08 billion.

What to watch: Shares of Google parent Alphabet, up 4% year to date, compared with 1% decline in the S&P 500 index, have outperformed their FAANG peers over the past week. The gains have been driven by bullish comments from several analysts, including James Lee of Mizuho, who last week argued that Google stock deserves a higher multiple given the cyclical recovery in its advertising business. The analyst raised his price target on GOOGL to $2,100 from $1,810, implying 10% upside, while citing an uptrend a rebound in several verticals in online advertising, particularly in areas such as retail, financial services and travel. He thinks Google will report both higher ad demand and stronger ad pricing. Morgan Stanley also reiterated its Overweight rating and $2,050 price target. Evidenced by the strong results from Facebook (FB) there’s some cause for optimism.

Amazon (AMZN) - Reports after the close, Tuesday, Feb. 2

Wall Street expects Amazon to earn $7.19 per share on revenue of $119.66 billion. This compares to the year-ago quarter when earnings came to $6.47 per share on revenue of $87.44 billion.

What to watch: Shares of Amazon have seemingly gone nowhere over the past six months. The stock, which closed Friday at $3,206.20, is right in line with both its 50-day and 200-day moving averages of $3,207.20 and $3,183.18, respectively. This is even though Amazon has executed at near perfection evidenced by an almost 40% rise in total net revenue in the third quarter which included operating margin of 6.4% of sales, compared to the 5.1% consensus. The e-commerce giant continues to benefit from a combination of factors. Aside from the strong demand acceleration caused by the pandemic, Amazon continues to be effective in its strategy not only to grow its Prime members, but also getting them to spend more during each transaction. And there are plenty of evidence to suggests that its market share gains are here to stay, beyond the pandemic. As such, with concerns about near-term margin pressure seemingly vanished, it would be a mistake to part with this long-term winner.

Peloton (PTON) - Reports after the close, Thursday, Feb. 4

Wall Street expects Peloton to earn 8 cents per share on revenue of $1.03 billion. This compares to the year-ago quarter when it lost 18 cents per share on revenue of $466.30 million.

What to watch: While the market assumes Peloton is well-positioned to disrupt the fitness industry through its at-home connected fitness subscription platform, valuation concerns have emerged. Down 9% over the past week and 4% year to date, PTON stock has given up as much at 17% since reaching its all-time of $171 earlier this month. But with demand still high for its fitness products and subscriptions interest still accelerating, investors want to know whether all of the good news is already priced in. Analyst Jason Helfstein at Oppenheimer isn’t worried, however. Helfstein, who has an Outperform rating on the stock, believes Peloton still has tons of tailwinds from the COVID-induced gym cancellations. He recently bumped his price target to $185 from $140, which assumes 27% premium from current levels.

The views and opinions expressed herein are the views and opinions of the author and do not necessarily reflect those of Nasdaq, Inc.","These declines come despite what I would consider upbeat earnings reports from several big tech giants earlier in the week.
This compares to the year-ago quarter when earnings came to $2.61 per share on revenue of $23.14 billion.
This compares to the year-ago quarter when earnings came to $15.35 per share on revenue of $46.08 billion.
This compares to the year-ago quarter when earnings came to $6.47 per share on revenue of $87.44 billion.
And there are plenty of evidence to suggests that its market share gains are here to stay, beyond the pandemic.",https://www.nasdaq.com/articles/weekly-preview%3A-earnings-to-watch-this-week-amzn-baba-goog-pton-2021-01-31,2021-01-31 00:00:00
49,GOOGL,Are you a robot?,"Why did this happen?

Please make sure your browser supports JavaScript and cookies and that you are not blocking them from loading. For more information you can review our Terms of Service and Cookie Policy.","Why did this happen?
Please make sure your browser supports JavaScript and cookies and that you are not blocking them from loading.
For more information you can review our Terms of Service and Cookie Policy.",https://www.bloomberg.com/news/articles/2021-01-13/google-suspends-political-ads-until-after-biden-s-inauguration,2021-01-13 00:00:00
50,GOOGL,Are you a robot?,"Why did this happen?

Please make sure your browser supports JavaScript and cookies and that you are not blocking them from loading. For more information you can review our Terms of Service and Cookie Policy.","Why did this happen?
Please make sure your browser supports JavaScript and cookies and that you are not blocking them from loading.
For more information you can review our Terms of Service and Cookie Policy.",https://www.bloomberg.com/news/articles/2021-01-09/amazon-worker-group-calls-for-cloud-unit-to-drop-parler,2021-01-09 00:00:00
51,GOOGL,Microsoft CEO Satya Nadella: There is ‘a big crisis right now’ for cybersecurity,"Microsoft (MSFT) is officially a cybersecurity giant. For the first time on Tuesday, Microsoft disclosed revenue from its various security offerings as part of its quarterly earnings — $10 billion over the last 12 months.

That amounts to a 40% year-over-year jump in the growing security business, making up roughly 7% of the company’s total revenue for the previous year.

“We waited in some sense [until] this milestone to show the depth, the breadth, the span of what we are doing,” Microsoft CEO Satya Nadella told Yahoo Finance in an interview on Wednesday, a day after the company released its quarterly earnings report.

“And, you know, [there’s] a lot of work ahead, but we are investing very heavily because guess what? You know 10 years from now we'll still be talking about it as technology becomes even [a deeper part] of our lives in our society in all critical industries.”

The $10 billion figure comes from the security-related revenue generated by services including Microsoft’s Azure Active Directory, Intune, Microsoft Defender for Endpoint, Office 365, Microsoft Cloud App Security, Microsoft Information and Governance, Azure Sentinel, Azure Monitoring, and Azure Information Protection.

In this May 6, 2019, file photo Microsoft CEO Satya Nadella delivers the keynote address at Build, the company's annual conference for software developers in Seattle. AP Photo/Elaine Thompson, File)

Each of those makes up what Microsoft calls its Intelligent Cloud and Productivity and Business Processes segments. Those overarching segments generated $14.6 billion and $13.4 billion in revenue, respectively, in the company’s fiscal Q2 2021.

“What we have built is very helpful in times of crisis and there is a big crisis right now,” Nadella said. “But you need to sort of obviously build all of this over a period of years if not decades and then sustain it through not just product innovation, but also I would say, practice every day.”

Story continues

The announcement follows Microsoft’s involvement in uncovering the breadth of the massive SolarWinds cyber attack in December, which hit private companies like cybersecurity firm FireEye (FEYE) and government agencies including the Treasury, Commerce, and State Departments, as well as the National Nuclear Security Administration and the Department of Homeland Security.

Microsoft itself was also hacked, though no customer data was breached. A Reuters report indicated that, as part of the hack of the National Telecommunications and Information Agency, Microsoft’s Office 365 software was attacked, allowing the intruders to monitor agency emails for months. Microsoft, however, said at the time that it has identified no vulnerabilities in its cloud or Office software.

Though hit by the attack, Microsoft also worked with the government and customers to help determine the scale of the hack.

“I was most proud that we became the first responders for this attack,” Vasu Jakkal, Microsoft corporate vice president of security, compliance, and identity marketing, told Yahoo Finance.

“We were the defenders that other defenders were turning to. We were working with FireEye and across the public sector and private sector coming together saying ‘What should we do, and how should we protect our world against it?’ ” she said.

The U.S. Treasury Department was one of the victims of the SolarWinds hack. (Image: Xinhua/ via Getty Images)

Part of Microsoft’s ability to respond to the hack has to do with what’s called “zero trust” architecture, Nadella explained. Essentially that means a company’s cybersecurity capabilities always function as though there has been a breach of some kind. It’s a defense against being left flatfooted when a new hack comes along that you’re not able to protect against.

“One of the things about Microsoft’s investment is really not just about the security investment — which is substantial when you look at Defender or Sentinel or Azure Active Directory and the list goes on — but it is that ability to take all of our investments in AI and data and infrastructure and bring it to bear for security,” Nadella said. “And that I think is what makes us pretty unique.”

Working from home adds to companies’ security needs

The SolarWinds hack came as the coronavirus pandemic spurred many companies to allow their employees to work from home, which introduced a new attack vector for hackers. When you’re working from your office, you’re, hopefully, hooked into a secured connection that can monitor for things like malware or other strange network activity.

At home, though, you’re running on your own network, adding a wrinkle to your employer’s ability to protect itself. It wouldn’t take much for you to download malware on your computer at home, then accidentally send that software to your company’s systems when you connect to its network to update a spreadsheet or upload a report.

“Security has to be built in at every single point,” Jakkal said. “It cannot be an afterthought,”

Microsoft says it currently protects more than 400,000 customers across 120 countries, including 90 Fortune 100 companies. The tech giant breaks its security offerings down into four categories: security, compliance, identity, and management.

Part of that includes providing security not just for Microsoft-powered devices, but those running Apple’s (AAPL) iOS and macOS and Google’s (GOOG, GOOGL) Android, as well as products running on competing cloud platforms like Amazon’s (AMZN) Amazon Web Services and Google’s Google Cloud Platform.

“There needs to be a real different approach to creating a cybersecurity solution for customers,” Nadella said.

“In what is an interconnected world it's not about any one point solution, it is about having, I would say, an architectural approach, which then needs to be reinforced every day.”

As cloud services continue to expand, and Microsoft’s stake in the industry grows alongside it, protecting the customers who use those services will prove ever more important.

“It is not just transformation in order for you to remain in business. You need to have that digital control plane, not just for your workers so that they can log on to their PCs from home and be on Teams calls,” Nadella said.

“Your manufacturing plant needs to continue where the engineers, the operational data all need to be reasoned over. That is the transformation that I think we are seeing the acceleration of.”

Of course, hackers and cybercriminals will continue to hit at businesses regardless of what company they have protecting them. But with the continued growth in cloud computing and an expanded work-from-home environment, Microsoft stands to benefit as a player in the cybersecurity industry.

Sign up for Yahoo Finance Tech newsletter

Yahoo Finance Tech

Got a tip? Email Daniel Howley at dhowley@yahoofinance.com over via encrypted mail at danielphowley@protonmail.com, and follow him on Twitter at @DanielHowley.

More from Dan:

Follow Yahoo Finance on Twitter, Facebook, Instagram, Flipboard, SmartNews, LinkedIn, YouTube, and reddit.","In this May 6, 2019, file photo Microsoft CEO Satya Nadella delivers the keynote address at Build, the company's annual conference for software developers in Seattle.
AP Photo/Elaine Thompson, File)Each of those makes up what Microsoft calls its Intelligent Cloud and Productivity and Business Processes segments.
“What we have built is very helpful in times of crisis and there is a big crisis right now,” Nadella said.
Essentially that means a company’s cybersecurity capabilities always function as though there has been a breach of some kind.
But with the continued growth in cloud computing and an expanded work-from-home environment, Microsoft stands to benefit as a player in the cybersecurity industry.",https://finance.yahoo.com/news/microsoft-ceo-satya-nadella-there-is-a-big-crisis-right-now-for-cybersecurity-192533356.html,2021-01-09 00:00:00
52,GOOGL,Are you a robot?,"Why did this happen?

Please make sure your browser supports JavaScript and cookies and that you are not blocking them from loading. For more information you can review our Terms of Service and Cookie Policy.","Why did this happen?
Please make sure your browser supports JavaScript and cookies and that you are not blocking them from loading.
For more information you can review our Terms of Service and Cookie Policy.",https://www.bloomberg.com/news/articles/2021-01-19/youtube-extends-trump-suspension-ahead-of-biden-s-inauguration,2021-01-19 00:00:00
