,Ticker,Title,Article,Summary,Link,Date
0,GOOGL,Alphabet reports big earnings beat as revenue grows 34%,"In this article GOOGL

Alphabet reported huge beats on its top and bottom lines for its first quarter of 2021, as well as a new $50 billion stock buyback, which boosted the shares more than 4% in after-hours trading. Here's how Google's parent company fared in the quarter relative to what Wall Street analysts polled by Refinitiv expected: Earnings: $26.29 per share vs. $15.82 per share expected

$26.29 per share vs. $15.82 per share expected Revenue: $55.31 billion vs. $51.70 billion expected

$55.31 billion vs. $51.70 billion expected Google Cloud revenue: $4.05 billion vs. $4.07 billion, according to FactSet estimates.

$4.05 billion vs. $4.07 billion, according to FactSet estimates. YouTube ads: $6.01 billion vs. $5.70 billion, according to StreetAccount.

$6.01 billion vs. $5.70 billion, according to StreetAccount. Traffic Acquisition Costs (TAC): $9.71 billion vs. $9.25 billion, according to FactSet estimates. Google's revenue rose 34% from the same period a year prior. The company reported advertising revenue of $44.68 billion for the quarter. That's a significant rise from $33.76 billion in the same quarter last year, making it the fastest annualized growth rate in at least four years, although the results were boosted by an easy comparable with last year's quarter, as the onset of the coronavirus pandemic caused a steep drop in advertising spend.

Zoom In Icon Arrows pointing outwards

YouTube ads came in at $6.01 billion during the quarter — a 49% rise from year ago. YouTube became the winner of the pandemic in terms of social media sites, according to a recent Pew report, which said the video platform saw usage grow from 73% of U.S. adults in 2019 to 81% in 2021. Alphabet CEO Sundar Pichai said on the company's earnings call that YouTube's TikTok competitor Shorts is garnering 6.5 billion daily views, a significant increase from 3.5 billion at the end of January. Google Cloud revenue grew 46% year over year to $4.05 billion, which was in line with Wall Street's expectations. It lost $974 million during the quarter, significantly narrowing losses from the same period a year ago. Google Cloud includes infrastructure and data analytics platforms, collaboration tools such as Google Docs and Sheets, and ""other services for enterprise customers."" During the quarter, the company also recorded a $4.84 billion gain in the value of certain investments. (This was offset by a loss of $86 million in the value of other unspecified investments, for a total net gain of $4.75 billion.) It did not disclose which investments drove the gain, but UiPath, Stripe and Oscar Health are all likely contributors. The company does not wait until it sells shares to recognize a gain, but instead uses ""various valuation methodologies"" to make ""upward and downward adjustments to the carrying value of our equity securities as a result of observable price changes."" The company's ""Other Bets"" segment, which includes its health tech unit Verily and autonomous-vehicle bet Waymo, lost $1.15 billion on revenue of $198 million. Alphabet's board approved an additional stock repurchase of up to $50 billion on April 23, Tuesday's filing stated.","$4.05 billion vs. $4.07 billion, according to FactSet estimates.
YouTube ads: $6.01 billion vs. $5.70 billion, according to StreetAccount.
$6.01 billion vs. $5.70 billion, according to StreetAccount.
Traffic Acquisition Costs (TAC): $9.71 billion vs. $9.25 billion, according to FactSet estimates.
During the quarter, the company also recorded a $4.84 billion gain in the value of certain investments.",https://www.cnbc.com/2021/04/27/alphabet-goog-earnings-q1-2021.html,2021-04-27 00:00:00
1,GOOGL,Google (Alphabet) Earnings: What Happened,"Google (Alphabet) Earnings Results Metric Beat/Miss/Match Reported Value Analysts' Prediction Diluted EPS (GAAP) Beat $26.29 $15.45 Revenue Beat $55.3B $51.6B Google Cloud Revenue Match $4.0B $4.0B

Source: Predictions based on analysts' consensus from Visible Alpha

Key Takeaways Google Cloud revenue matched analyst estimates.

Google Cloud is one of the company's primary business segments. Cloud revenue is outpacing revenue growth for the company as a whole.

Google advertising revenue rose 32.3%, comprising 80.8% of companywide revenue.

Google (Alphabet) Financial Results: Analysis

Alphabet Inc. (GOOGL), parent company of Google, reported Q1 FY 2021 earnings that beat analyst expectations. Diluted earnings per share (EPS) reported in accordance with GAAP came in well above what analysts were forecasting. Revenue also surpassed analyst estimates. Google's cloud revenue came in at $4.0 billion, matching expectations. The company's shares were up more than 4% in after-hours trading. Over the past year, Alphabet's shares have provided a total return of 80.2%, above the S&P 500's total return of 45.5%.

GOOGL Google Cloud Revenue

Google Cloud is one of the tech giant's primary business segments, the other being Google Services. The cloud segment provides developers with a highly scalable and reliable platform for building, testing, and deploying applications. It also offers workspace collaboration tools, including apps like Gmail, Docs, Drive, Calendar, Meet, and more. At the end of 2020, Google Cloud had an estimated 9% of the global cloud market, ranking it third behind Microsoft Corporation's (MSFT) Azure and top-ranked Amazon.com, Inc.'s (AMZN) Amazon Web Services. Google Cloud revenue rose 45.7% compared to the year-ago quarter, while company-wide revenue rose 34.4%.

GOOGL Share Repurchases

The company noted that its board of directors authorized on April 23 an additional $50.0 billion in share repurchases. The repurchases are expected to be carried out from time to time depending on general business and market conditions as well as other investment opportunities. Share buybacks reduce the total number of a company's being held by investors, helping to boost the price of the remaining shares outstanding.

GOOGL Advertising Revenue

Google dominates the digital-advertising market. The company captured as much as 28.9% of U.S. digital ad sales in 2020. In Q1 FY 2021, Google advertising revenue rose 32.3%. At $44.7 billion, Google advertising accounted for about 80.8% of total revenue in the first quarter.

The ongoing transition to online commerce, a trend accelerated by the COVID-19 pandemic, will likely boost the digital advertising market. This should help to fuel Google's revenue growth further. But it faces significant competition from rivals like Facebook, Inc. (FB) and Amazon. However, dominance in online services supports Google's hold on the digital advertising market. Google's search engine garners 92% of online search traffic, and YouTube comprises 73% of online videos.

The company did not offer any forward guidance in its earnings press release. Alphabet's next earnings report (for Q2 FY 2021) is estimated to be released on July 28, 2021.","Google (Alphabet) Earnings Results Metric Beat/Miss/Match Reported Value Analysts' Prediction Diluted EPS (GAAP) Beat $26.29 $15.45 Revenue Beat $55.3B $51.6B Google Cloud Revenue Match $4.0B $4.0BSource: Predictions based on analysts' consensus from Visible AlphaKey Takeaways Google Cloud revenue matched analyst estimates.
Google advertising revenue rose 32.3%, comprising 80.8% of companywide revenue.
Google (Alphabet) Financial Results: AnalysisAlphabet Inc. (GOOGL), parent company of Google, reported Q1 FY 2021 earnings that beat analyst expectations.
GOOGL Google Cloud RevenueGoogle Cloud is one of the tech giant's primary business segments, the other being Google Services.
Google Cloud revenue rose 45.7% compared to the year-ago quarter, while company-wide revenue rose 34.4%.",https://www.investopedia.com/google-alphabet-q1-fy2021-earnings-report-recap-5180814,2021-04-27 22:18:56.405000+00:00
2,GOOGL,Alphabet (GOOGL) 1st Quarter Earnings: What to Expect,"Shares of Google parent Alphabet (GOOG , GOOGL), up 12% in thirty days and 30% year to date, compared with 11% rise in the S&P 500 index, have outperformed their FAANG peers over the past six months. Ahead of the company’s first quarter fiscal 2021 earnings results Tuesday, investors want to know if Google's gains are sustainable.

These gains, which began since the March 2020 bottom, have been driven by the tech giant’s cyclical recovery in its advertising business. This was noticeable last quarter when the company delivered 23% revenue increase which, according to several analysts, justified a higher multiple. Investors are also excited about the recent uptrend in several verticals in online advertising, particularly in areas such as retail, financial services and travel.

Last week, while citing benefits from improved digital ads from e-commerce and a recovery in travel and entertainment, which is expected to rise 15% and 20%, respectively, analysts at Oppenheimer not only raised forecast for global Internet advertising for fiscal 2021, they also boosted ad revenue estimates. The analysts also cited an uptrend in auto and consumer products, which are expected to rise some 20% where the outsized impact from those gains will be realized by search.

These trends would certainly be a significant boost to Google, particularly as Internet advertising, which accounted for 57% of global advertising in 2020, will continue to gain share of the ad market. Oppenheimer expects Internet advertising to gain 487 basis points of share in 2021. As such, Oppenheimer is raising its 2021 ad revenue estimates for Google by 4%. The analyst also raised its price target on the stock to $2,350 from $2,250. But Oppenheimer is not alone in its bullishness.

Investors are also excited about Google Cloud revenue potential which last quarter rose 47% and appears strong. Notably, Google Cloud still accounts for just under 7% of Alphabet's revenues, meaning more meaningful growth could be underway. On Tuesday, beyond the strong growth in ad revenue and guidance for 2021, the market will want to see sustained improvement in the cloud business to assess at which point the cloud can realistically become a more compelling narrative for Google stock.

For the quarter that ended March, Wall Street is looking for the Mountain View, Calif.-based tech giant earn $15.69 per share on revenue of $51.49 billion. This compares to the year-ago quarter when earnings came to $9.87 per share on revenue of $41.16 billion. For the full year, ending in December, earnings are expected to rise 19% year over year to $69.70 per share, while full-year revenue of the $227.13 billion would rise 24.4% year over year.

The company's extensive advantages in technology and the network effect brought on by its various platforms such as YouTube, Google Cloud, Gmail, etc., have been the main driver of its growth. In the fourth quarter, the company easily beat Street earnings expectations, thanks to a strong rebound in ad spending and broad revenue gains. Q4 revenues surged 24% year over year to $56.9 billion, with profits jumping 42% to $15.23 billion.

The revenue gains were driven by Search and YouTube which benefited from a rebound in consumer and business activity. The impressive Q4 numbers suggests businesses were getting back to normal operations. With increased vaccine distribution coming in Q1, Google’s guidance for Q2 will be closely-watched on Tuesday. If the stock pulls back, it should be viewed as a buying opportunity for investors who were on the sidelines.

The views and opinions expressed herein are the views and opinions of the author and do not necessarily reflect those of Nasdaq, Inc.","Ahead of the company’s first quarter fiscal 2021 earnings results Tuesday, investors want to know if Google's gains are sustainable.
Investors are also excited about Google Cloud revenue potential which last quarter rose 47% and appears strong.
Notably, Google Cloud still accounts for just under 7% of Alphabet's revenues, meaning more meaningful growth could be underway.
In the fourth quarter, the company easily beat Street earnings expectations, thanks to a strong rebound in ad spending and broad revenue gains.
The revenue gains were driven by Search and YouTube which benefited from a rebound in consumer and business activity.",https://www.nasdaq.com/articles/alphabet-googl-1st-quarter-earnings%3A-what-to-expect-2021-04-27,2021-04-27 00:00:00
3,GOOGL,Were Hedge Funds Right About Betting On Alphabet Inc (GOOGL)?,"Our extensive research has shown that imitating the smart money can generate significant returns for retail investors, which is why we track nearly 900 active prominent money managers and analyze their quarterly 13F filings. The stocks that are heavily bought by hedge funds historically outperformed the market, though there is no shortage of high profile failures like hedge funds' 2018 losses in Facebook and Apple. Let’s take a closer look at what the funds we track think about Alphabet Inc (NASDAQ:GOOGL) in this article.

Is Alphabet Inc (NASDAQ:GOOGL) a bargain? The smart money was buying. The number of long hedge fund positions advanced by 17 in recent months. Alphabet Inc (NASDAQ:GOOGL) was in 179 hedge funds' portfolios at the end of the fourth quarter of 2020. The all time high for this statistic was previously 167. This means the bullish number of hedge fund positions in this stock reached a brand new all time high. Our calculations also showed that GOOGL ranks #4 among the 30 most popular stocks among hedge funds (click for Q4 rankings).

Dan Loeb THIRD POINT

Dan Loeb of Third Point

At Insider Monkey we leave no stone unturned when looking for the next great investment idea. For example, the CBD market is growing at a 33% annualized rate, so we are taking a closer look at this under-the-radar hemp stock. We go through lists like the 10 best biotech stocks under $10 to identify the next stock with 10x upside potential. Even though we recommend positions in only a tiny fraction of the companies we analyze, we check out as many stocks as we can. We read hedge fund investor letters and listen to stock pitches at hedge fund conferences. You can subscribe to our free daily newsletter on our website. Now let's take a gander at the fresh hedge fund action encompassing Alphabet Inc (NASDAQ:GOOGL).

Do Hedge Funds Think GOOGL Is A Good Stock To Buy Now?

At Q4's end, a total of 179 of the hedge funds tracked by Insider Monkey were long this stock, a change of 10% from the third quarter of 2020. Below, you can check out the change in hedge fund sentiment towards GOOGL over the last 22 quarters. With hedgies' positions undergoing their usual ebb and flow, there exists an ""upper tier"" of key hedge fund managers who were upping their holdings substantially (or already accumulated large positions).

Story continues

Is GOOGL A Good Stock To Buy?

More specifically, Fisher Asset Management was the largest shareholder of Alphabet Inc (NASDAQ:GOOGL), with a stake worth $2927.7 million reported as of the end of December. Trailing Fisher Asset Management was Viking Global, which amassed a stake valued at $1086.3 million. D1 Capital Partners, AQR Capital Management, and Melvin Capital Management were also very fond of the stock, becoming one of the largest hedge fund holders of the company. In terms of the portfolio weights assigned to each position AltaRock Partners allocated the biggest weight to Alphabet Inc (NASDAQ:GOOGL), around 23.5% of its 13F portfolio. Fosse Capital Partners is also relatively very bullish on the stock, earmarking 20.73 percent of its 13F equity portfolio to GOOGL.

As one would reasonably expect, specific money managers were leading the bulls' herd. Third Point, managed by Dan Loeb, created the most outsized position in Alphabet Inc (NASDAQ:GOOGL). Third Point had $455.7 million invested in the company at the end of the quarter. Catherine D. Wood's ARK Investment Management also initiated a $164.9 million position during the quarter. The other funds with brand new GOOGL positions are Ryan Frick and Oliver Evans's Dorsal Capital Management, Michael Rockefeller and Karl Kroeker's Woodline Partners, and Keith Meister's Corvex Capital.

Let's now review hedge fund activity in other stocks similar to Alphabet Inc (NASDAQ:GOOGL). These stocks are Facebook Inc (NASDAQ:FB), Tesla Inc. (NASDAQ:TSLA), Alibaba Group Holding Limited (NYSE:BABA), Taiwan Semiconductor Mfg. Co. Ltd. (NYSE:TSM), Berkshire Hathaway Inc. (NYSE:BRK-B), Visa Inc (NYSE:V), and Johnson & Johnson (NYSE:JNJ). All of these stocks' market caps are closest to GOOGL's market cap.

[table] Ticker, No of HFs with positions, Total Value of HF Positions (x1000), Change in HF Position FB,242,38233910,12 TSLA,68,12308025,1 BABA,156,17892090,-10 TSM,72,11843403,5 BRK-B,110,20795968,1 V,166,23599162,6 JNJ,81,5820696,-1 Average,127.9,18641893,2 [/table]

View table here if you experience formatting issues.

As you can see these stocks had an average of 127.9 hedge funds with bullish positions and the average amount invested in these stocks was $18642 million. That figure was $21903 million in GOOGL's case. Facebook Inc (NASDAQ:FB) is the most popular stock in this table. On the other hand Tesla Inc. (NASDAQ:TSLA) is the least popular one with only 68 bullish hedge fund positions. Alphabet Inc (NASDAQ:GOOGL) is not the most popular stock in this group but hedge fund interest is still way above average. Our overall hedge fund sentiment score for GOOGL is 88.9. Stocks with higher number of hedge fund positions relative to other stocks as well as relative to their historical range receive a higher sentiment score. Our calculations showed that top 30 most popular stocks among hedge funds returned 81.2% in 2019 and 2020, and outperformed the S&P 500 ETF (SPY) by 26 percentage points. These stocks gained 12.3% in 2021 through April 19th and still beat the market by 0.9 percentage points. Hedge funds were also right about betting on GOOGL as the stock returned 30.6% since the end of Q4 (through 4/19) and outperformed the market. Hedge funds were rewarded for their relative bullishness.

Get real-time email alerts: Follow Alphabet Inc. (NASDAQ:GOOG)

Disclosure: None. This article was originally published at Insider Monkey.

Related Content","The stocks that are heavily bought by hedge funds historically outperformed the market, though there is no shortage of high profile failures like hedge funds' 2018 losses in Facebook and Apple.
Alphabet Inc (NASDAQ:GOOGL) was in 179 hedge funds' portfolios at the end of the fourth quarter of 2020.
Our calculations also showed that GOOGL ranks #4 among the 30 most popular stocks among hedge funds (click for Q4 rankings).
We read hedge fund investor letters and listen to stock pitches at hedge fund conferences.
Hedge funds were also right about betting on GOOGL as the stock returned 30.6% since the end of Q4 (through 4/19) and outperformed the market.",https://finance.yahoo.com/news/were-hedge-funds-betting-alphabet-180452735.html,2021-04-27 00:00:00
4,GOOGL,Why Google's Stock Offers 50% Upside Potential,"Alphabet Inc (NASDAQ: GOOGL) (NASDAQ: GOOG) shares are worth more than the current Street-high price target of $3,000, according to an analyst at Bernstein.

The Alphabet Analyst: Bernstein analyst Mark Shmulik maintained an Outperform rating and $2,500 price target for Alphabet shares.

The Alphabet Thesis: The sum-of-the-parts analysis of Google shares yields a valuation of $3,100 per share, analyst Shmulik said in a note. The analyst's STOP analysis splintered Google into six businesses, namely Search, YouTube, Network, Cloud, Hardware and Other, and Other Bets.

Google is unlikely to make major moves, given the streamlining seen over the past 12 months, including winding down of Loon, Sidewalk Labs, etc., the analyst said. The Network business, however, is likely to be a divestment candidate, according to the analyst.

The Network business' revenue contribution has slid from 20% in 2015 to 13% in 2020, while at the same time attracting regulatory interest, given Google's dominant position across the DSP, SSP and the exchange, Shmulik said.

Related Link: 3 Reasons Alphabet Stock Is Underperforming, Yet Resilient

""We like the Google story, with strong 2021 catalysts across search (tied to re-open), YouTube (TV ad dollar migration) and Cloud (secular tailwinds),"" the analyst wrote in the note.

There have been calls to break up big tech, and Google is facing three U.S. antitrust lawsuits currently regarding its dominant position in Search, contract negotiations with OEMs and anticompetitive behavior in Network Members, the analyst noted. The company is also facing pressure from European regulators, he added.

""Internet investors are grappling with regulatory and privacy headwinds against an otherwise stellar business with a compelling TAM,"" Shmulik said.

A break-up, the analyst said, could more likely be accretive. A regulator-forced divestment will not occur anytime soon, he added.

Bernstein has a bull-case price target of $3,100, representing about 50% upside from current levels, while the unlikely bear case offers a floor of $1,675, the analyst said.

Story continues

Search contributes $1,651 to the firm's bull-case price target, while Network Members, YouTube ads and subscriptions, Google Cloud, Hardware and Other, and Other Bets would account for $76, $496, $572, $173 and $113, respectively.

Alphabet Price Action: At last check, Alphabet Class A (GOOGL) shares were advancing 3.71% to $2,208.75.62. Class C shares (GOOG) are up 3.76% at $2,218.20.

Related Link: Why Google's Speedy Recovery In Digital Advertising Impresses Stifel Analyst

(Photo: Pawel Czerwinski via Unsplash)

Latest Ratings for GOOGL

Apr 2021 Wolfe Research Initiates Coverage On Outperform Mar 2021 Stifel Upgrades Hold Buy Mar 2021 Morgan Stanley Maintains Overweight

View More Analyst Ratings for GOOGL

View the Latest Analyst Ratings

See more from Benzinga

© 2021 Benzinga.com. Benzinga does not provide investment advice. All rights reserved.","The Alphabet Analyst: Bernstein analyst Mark Shmulik maintained an Outperform rating and $2,500 price target for Alphabet shares.
The Alphabet Thesis: The sum-of-the-parts analysis of Google shares yields a valuation of $3,100 per share, analyst Shmulik said in a note.
The analyst's STOP analysis splintered Google into six businesses, namely Search, YouTube, Network, Cloud, Hardware and Other, and Other Bets.
Bernstein has a bull-case price target of $3,100, representing about 50% upside from current levels, while the unlikely bear case offers a floor of $1,675, the analyst said.
Alphabet Price Action: At last check, Alphabet Class A (GOOGL) shares were advancing 3.71% to $2,208.75.62.",https://finance.yahoo.com/news/why-googles-stock-offers-50-193856251.html,2021-04-27 00:00:00
5,GOOGL,GOOGL Stock Is Worth Much More Based On Its Massive Free Cash Flow,GOOGL Stock Is Worth Much More Based On Its Massive Free Cash Flow,GOOGL Stock Is Worth Much More Based On Its Massive Free Cash Flow,https://investorplace.com/2021/04/googl-stock-is-worth-much-more-based-on-its-massive-free-cash-flow/,2021-04-30 16:56:55+00:00
