,Ticker,Title,Article,Summary,Link,Date
124,GOOGL,"‘Bro Culture’ at Camera Maker Verkada Pushed Profits, Parties","(Bloomberg) -- Verkada Inc.'s security camera customers were livid. Hackers had breached footage from thousands of surveillance devices trained on their operations, including schools, prisons, hospitals and companies around the world. On a webinar with Verkada’s CEO, users wanted answers. Fast.

One pointed question came from Sequoia Capital, Verkada's most prominent investor: How, inquired Silas Thomas, information technology manager at the venture capital firm, can we cut off Verkada employees from access to Sequoia’s cameras?

Verkada Chief Executive Officer Filip Kaliszan told Thomas that access had already been disabled. In response to another customer’s query, he summed up the mood. “We understand that this definitely kind of made it difficult to trust us.”

Once little known outside of Silicon Valley, Verkada gained unwanted notoriety in March after Bloomberg reported that hackers had accessed the internet-connected cameras in facilities of its customers, including the carmaker Tesla Inc. and cybersecurity firm Cloudflare Inc.

Although some sales staffers allegedly marketed Verkada as “virtually unhackable,” the breach exposed alarmingly lax safeguards at a company selling powerful surveillance tools that include facial recognition technology and that promised security and privacy protections to go with them. In the weeks since then, current and former employees have told Bloomberg that the inattention to data protection was emblematic of a larger “bro culture” that was sophomoric and sales obsessed, and which tolerated the harassment of women, frequent partying and misleading marketing claims.

Video footage of female employees was passed among male colleagues, who offered graphic comments, and in-office parties -- even during the pandemic -- were prone to excessive drinking and occasional drug use, according to the employees.

“Verkada gives frat boys a bad name,” one former sales employee said.

In a statement, a Verkada spokesperson said, “We acknowledge that early on, our internal policies did not initially keep pace with our rapid growth; however, we have taken several steps to ensure we are creating a supportive and inclusive environment.’’ A party celebrating the company’s first $100 million in sales, during which many employees didn’t wear masks despite the pandemic, was “a lapse in judgement,” the spokesperson said.“Excessive drinking in the office and illicit drug use of any kind — both of which are grounds for termination — have never been commonplace at Verkada,” the spokesperson said. In-office celebrations could include champagne toasts but didn’t mean employees were intoxicated. In an appearance on Bloomberg TV in March, Sequoia Capital’s Roelof Botha praised Verkada for swiftly reacting to the breach. “They’re sending out very frequent updates on a daily basis as they’re investigating, and making sure this is an experience that is not repeated,"" Botha said.

Story continues

During the last year, Verkada has expanded its human resources team, completed a gender pay equity review and made compensation adjustments, implemented new training programs and strengthened mechanisms that employees can use to report abusive behavior with a 24/7 anonymous hotline, the company said. Verkada also has “refocused how we recruit and hire diverse candidates,” according to the spokesperson.

“Verkada is committed to creating a workplace that is respectful and inclusive of everyone,” the spokesperson said. “We have clear policies around sexual harassment and workplace behavior and there have been and will continue to be consequences for anyone who violates them.’’

The company declined to comment on some of the specific instances outlined in this article, nearly all of which three or more current or former employees confirmed. For this story, Bloomberg interviewed eight current Verkada employees and 15 former employees, all of whom requested anonymity either to protect professional relationships or because they weren't authorized to speak on the company’s behalf.

Some praised Verkada’s sense of camaraderie and management, particularly recent efforts to address cultural problems such as hiring more women and cracking down on misbehavior. However, most spoke critically of the company and its work environment.

Signs of internal problems emerged last year, after a group of men at Verkada captured images of female employees with internal cameras, without their knowledge, and posted them on a Slack channel, along with sexually graphic comments, several former employees said. The rogue Slack channel was initially reported in October 2020 by the trade publication IPVM .

The organizers initially received a light punishment — they had their stock options reduced — but were later fired after news of the Slack channel spread, former employees said. In an October communication to his staff, Kaliszan said the initial discipline wasn’t adequate and apologized.

In another episode early this year, Verkada fired a sales manager after he exposed himself to a female colleague at a late-night, out-of-office gathering involving some members of the sales team, according to three people familiar with the incident. The firing, which came swiftly after an internal investigation, was considered a turning point in the company's attitude toward inappropriate behavior, according to the people. The sales manager declined to comment.

Verkada isn’t the only Silicon Valley startup in which employees — often young, single and flush with cash — have engaged in questionable behavior, including sexual misconduct and substance abuse. But Verkada sells security cameras that peer into offices, factory floors, intensive care units and other sensitive areas — the kind of product that demands professionalism and discretion.

Based in San Mateo, Verkada was founded in 2016 by three computer science graduates from Stanford University — Kaliszan, James Ren and Benjamin Bercovitz — and an experienced technology hand, Hans Robertson, a Massachusetts Institute of Technology graduate. He had co-founded the startup Meraki — which sold cloud-managed networking devices — and was acquired by Cisco Systems for $1.2 billion in 2012.

Figures provided by Verkada show that the company raised money quickly--$15 million in 2018 led by Next47, $40 million in April 2019 led by Meritech Capital Partners and Sequoia Capital, and $80 million in November 2019 led by Felicis Ventures. By then, the company was valued at $1.6 billion; it now has 550 employees.

Its market share had grown rapidly too, from 38 customers in 2017 to more than 5,500 last year, according to the company’s website.

But according to former employees and others, Verkada’s sales pitch to customers sometimes included misleading claims.

In some instances, sales staffers told customers that Verkada’s system was “virtually unhackable,” and that Verkada had hired the cybersecurity company Okta Inc. to perform a penetration test to gauge the safety of its networks and determined that it couldn’t be breached.

An Okta spokesman said the company conducted its own penetration test of Verkada as part of its due diligence as a customer and found some vulnerabilities, which it forwarded to the camera company. Okta said it never conducted a pen test on behalf of Verkada. “It is disingenuous to use the Okta brand in this manner,” the spokesman said.The Verkada spokesperson said, “We expect our sales team to accurately represent our products and answer questions truthfully.”

Verkada also marketed itself to potential customers as a “Stanford/MIT company,” according to emails that Bloomberg obtained via public records requests. Stanford said it wasn’t affiliated with Verkada, and MIT said in a statement, “Companies should not refer to themselves as an ‘MIT company’ simply because of a founder’s alumni status.”At the same time, Verkada’s sales team engaged in behavior that went well beyond the norm in a profession that thrives on adrenaline and profits, the employees said. Drinking among the sales staff was allegedly excessive even by the often-casual standards of technology startups, where refrigerators full of beer aren’t uncommon. Two former employees said they saw cocaine use in the office.

Impromptu celebrations would break out when a sales representative closed a deal worth more than $20,000, with alcohol flowing and music blaring, according to the employees. The sales team would regularly engage in a chant – “Mo-ney! Mo-ney! Mo-ney!” – that would become a roar, sometimes lasting minutes.

A sales team scavenger hunt in 2019 included drunken employees filing into a Casper store in San Francisco, where they bounced on the mattresses, wrestled with each other and posed for pictures. The store manager called Verkada's customer service line to complain, saying their employer was obvious due to the group's logo-emblazoned T-shirts. A Casper spokeswoman confirmed the incident but provided no further details.

One employee described being on the phone with a customer, when suddenly some members of the sales team turned on a speaker and began blasting a Cardi B song with sexually explicit lyrics. The employee recalled having to seek a quieter place in the office and apologize to the customer.

Management at least acknowledged the disruption caused by the sales teams’ allegedly bawdy antics. They told some of the engineering staff to expense noise-canceling headphones, according to two former employees.

Some former employees said they felt left out while working at Verkada, which grew up at a time when Silicon Valley was reckoning with the MeToo movement and companies from Google to Uber were addressing challenges faced by female employees. At Verkada, meetings and events routinely began with Robertson saying, “OK boys” or “Yeah, gentlemen,” seemingly ignoring the women in the room, the former employees said. Two other former staffers described a loud discussion in the open-plan office about a well-qualified job candidate. A Verkada marketing executive said he didn’t want to hire her because she was a mother and wouldn’t be motivated to work on weekends.The marketing executive didn’t respond to a message seeking comment. The Verkada spokesperson said the company rejects that characterization. “Verkada looks for the best people for every role, and we would never discriminate.” Many of its employees are parents, including those on the executive’s team, the company’s spokesperson said.

In November 2019, at an all-hands meeting where employees could submit inquiries anonymously via an app, one pointed out that a female director had departed, leaving no women executives, while another questioned Verkada’s “pervasive hyper-masculine culture,” according to screenshots reviewed by Bloomberg. The questions were read aloud and answered by Kaliszan, who said a group of friends who happened to be male founded the company. But he said Verkada needed to make an effort to hire more women. ​​​​In responses on the app, which employees could view in real time, one wrote anonymously, “Some employees are too concerned with a liberal agenda.” Another wrote, “Proud to work at a company that is hiring the best people for the job regardless of their gender.”According to a Verkada spokesperson, the company hired a new head of human resources, Dervilla Lannon, in March 2020, and she was promoted in November, joining the executive team. Of its employees, 21% identify as female, and they make up 23% of management positions, according to the spokesperson, who added the company still has a way to go. The recent hack raised new questions within the company. Two current and three former employees said they believed the aggressive focus on sales and growth, paired with the allegedly boisterous office environment, contributed to a lack of attention on security.

Three former engineering employees said they had raised concerns internally between 2018 and 2019 about the widespread use of Super Admin accounts, which gave staffers access to customer cameras. The accounts didn’t always require extra security settings to login, such as two-factor authentication, making them potentially vulnerable to hackers if passwords were leaked or otherwise compromised.

Last year, the company began reducing the number of employees with those accounts and tightened settings, ensuring that newly created Super Admin users would have to use two-factor authentication, according to two former employees. However, the employees said, the new settings weren’t applied to some older accounts, and it remained possible for someone with Super Admin credentials to login and view camera footage through a Verkada website that was accessible on the internet.

Those oversights would come back to bite the company. In March, Verkada hired Kyle Randolph, an experienced chief information security officer. But Randolph, a former security engineer at Twitter Inc. and Adobe Inc., had little time to patch up the vulnerabilities. In his second week on the job, an international hacker collective gained access to a Super Admin account and breached Verkada, gaining entry to customer cameras and throwing the company into crisis.

Randolph didn't respond to messages seeking comment.

“I wasn’t shocked by the hack – the way we did some things could be prone to abuse,” said one former Verkada engineer. “We were not mature enough as a company. We were driven too much by numbers.”

(Updates with Sequoia comment in ninth paragraph. )

For more articles like this, please visit us at bloomberg.com

Subscribe now to stay ahead with the most trusted business news source.

©2021 Bloomberg L.P.","(Bloomberg) -- Verkada Inc.'s security camera customers were livid.
In an appearance on Bloomberg TV in March, Sequoia Capital’s Roelof Botha praised Verkada for swiftly reacting to the breach.
But according to former employees and others, Verkada’s sales pitch to customers sometimes included misleading claims.
The sales team would regularly engage in a chant – “Mo-ney!
The Verkada spokesperson said the company rejects that characterization.",https://finance.yahoo.com/news/bro-culture-camera-maker-verkada-154144887.html,2021-04-09 00:00:00
125,GOOGL,Are you a robot?,"Why did this happen?

Please make sure your browser supports JavaScript and cookies and that you are not blocking them from loading. For more information you can review our Terms of Service and Cookie Policy.","Why did this happen?
Please make sure your browser supports JavaScript and cookies and that you are not blocking them from loading.
For more information you can review our Terms of Service and Cookie Policy.",https://www.bloomberg.com/news/articles/2021-04-15/google-commits-millions-for-vaccine-shots-and-online-psas,2021-04-15 00:00:00
126,GOOGL,"The Week Ahead: Tesla, Microsoft, Boeing, Altria Group, and AbbVie to Report Earnings","On Monday, we are expecting Tesla's (TSLA) earnings report to start off the week. Despite the auto manufacturer's dominance in the industry, we predict that fierce competition will emerge at some point in this decade.

For Tuesday, we are looking out for reports from 3M (MMM), Starbucks (SBUX), Advanced Micro Devices (AMD), Visa (V), General Electric (GE), and Alphabet (GOOGL). Microsoft (MSFT) also joins our list of reports expected on Tuesday. After acquiring Nuance Communications, a leading company in artificial intelligence, the wide-moat software company can dive deeper into the healthcare space.","On Monday, we are expecting Tesla's (TSLA) earnings report to start off the week.
Despite the auto manufacturer's dominance in the industry, we predict that fierce competition will emerge at some point in this decade.
For Tuesday, we are looking out for reports from 3M (MMM), Starbucks (SBUX), Advanced Micro Devices (AMD), Visa (V), General Electric (GE), and Alphabet (GOOGL).
Microsoft (MSFT) also joins our list of reports expected on Tuesday.
After acquiring Nuance Communications, a leading company in artificial intelligence, the wide-moat software company can dive deeper into the healthcare space.",https://www.morningstar.com/articles/1035101/the-week-ahead-tesla-microsoft-boeing-altria-group-and-abbvie-to-report-earnings,2021-04-23 00:00:00
127,GOOGL,"Google Play Movies & TV App Is Getting Dropped From Roku Devices, Smart TVs","Google is killing off the Google Play Movies & TV app, which lets users purchase and rent films and series, from Roku devices and smart TVs.

As of June 15, 2021, the Google Play Movies & TV app will no longer be available on the Roku players or TVs or Samsung, LG and Vizio smart TVs. For those platforms, “The YouTube app will be your new home for movies and shows,” Google says in a notice on its website. The change was announced last month but was only recently spotted by 9to5Google.

The move is an effort by Google to streamline its entertainment apps — and to promote Google TV, its recently launched entertainment interface that combines streaming services, live TV, movies, TV shows and other apps, as its primary connected-TV touchpoint. Google TV is available on the newest Chromecast and the interface is coming to select Android TV models including from Sony and TCL.

Content that has been purchased via Google Play Movies & TV will be available on YouTube. In addition, users can apply Google Play credits YouTube purchases. Watchlists that users have created in Google Play Movies & TV will not available on YouTube, but they can set up new playlists to replicate them.

The Google Play Movies & TV app will continue to be available on Android and iOS mobile devices and on Android TV. You can also watch eligible titles purchased through Google Play Movies & TV on the Movies Anywhere app on smart TVs in the U.S.

Google noted that the YouTube app is available on devices that currently support the Google Play Movies & TV app. However, according to the company, content will not be viewable on LG NetCast and LG SimpleSmart devices.

(Pictured above: Google Play Movies & TV app on Roku)","Google is killing off the Google Play Movies & TV app, which lets users purchase and rent films and series, from Roku devices and smart TVs.
As of June 15, 2021, the Google Play Movies & TV app will no longer be available on the Roku players or TVs or Samsung, LG and Vizio smart TVs.
The Google Play Movies & TV app will continue to be available on Android and iOS mobile devices and on Android TV.
You can also watch eligible titles purchased through Google Play Movies & TV on the Movies Anywhere app on smart TVs in the U.S.Google noted that the YouTube app is available on devices that currently support the Google Play Movies & TV app.
(Pictured above: Google Play Movies & TV app on Roku)",https://finance.yahoo.com/news/google-play-movies-tv-app-093641375.html,2021-04-23 00:00:00
128,GOOGL,Can Shopify Get Back to Prior Highs on Earnings?,"Shopify is ripping higher on earnings, clearing all of its key moving averages. Let's look at how the charts are setting up now.

Shopify (SHOP) - Get Shopify, Inc. Class A Report was enjoying a powerful rally on Wednesday, up about 10% after better-than-expected earnings.

That’s putting it lightly, though. The company reported robust bottom-line results, with a huge gain in its investment in Affirm Holdings (AFRM) - Get Affirm Holdings Report.

Revenue of $988.6 million grew 110% year over year and crushed analysts' expectations of $859 million.

Further, gross merchandise volume (GMV) from merchant customers climbed 114% to $37.3 billion.

The strong results are giving Amazon (AMZN) - Get Amazon.com, Inc. Report bulls some optimism ahead of earnings, which are due up on Thursday after the close of trading.

That said, it’s been a mixed earnings picture so far on Wednesday, which includes companies like Alphabet (GOOGL) - Get Alphabet Inc. Class A Report, Pinterest (PINS) - Get Pinterest, Inc. Class A Report and Spotify (SPOT) - Get Spotify Technology SA Report.

In any regard, Shopify stock has been in a funk for a couple of months. Will this earnings report finally help the stock break out of that slump?

Amazon and Alphabet are holdings in Jim Cramer's Action Alerts PLUS member club. Want to be alerted before Jim Cramer buys or sells AMZN or GOOGL? Learn more now.

Trading Shopify

Daily chart of Shopify stock. Chart courtesy of TrendSpider.com

In December, Shopify stock broke out over range resistance at $1,100. Bulls then saw that level become support in January.

It was a nice bullish setup, which helped propel the stock to new all-time highs near $1,500 in mid-February. That was a $400 a share rally, with seven days of gains in eight trading sessions.

However, once growth stocks came under pressure, shares plunged 33% in just a few weeks, bottoming right near $1,000.

Resolving the recent consolidation to the upside, the stock is clearing all of its major moving averages. Shopify stock is also taking out the April high at $1,250. Where can it go from here?

I want to watch that prior monthly high at $1,250, along with the 61.8% retracement near $1,310. So far, $1,300 has rejected the stock, while $1,250 was reclaimed.

On a dip, let’s see if $1,250 holds as support. If it does, bulls remain in control. If it fails, it puts the 10-day and 50-day moving averages in play. Below that and prior range resistance near $1,100 could be back in play.

On the upside, keep an eye on the $1,300 to $1,310 area. Above it puts the gap-fill level from February in play near $1,360. Above that and $1,400-plus is possible.","Shopify (SHOP) - Get Shopify, Inc. Class A Report was enjoying a powerful rally on Wednesday, up about 10% after better-than-expected earnings.
The company reported robust bottom-line results, with a huge gain in its investment in Affirm Holdings (AFRM) - Get Affirm Holdings Report.
In any regard, Shopify stock has been in a funk for a couple of months.
Trading ShopifyDaily chart of Shopify stock.
Chart courtesy of TrendSpider.comIn December, Shopify stock broke out over range resistance at $1,100.",https://www.thestreet.com/investing/shopify-shop-stock-earnings-rally-trading-042821,2021-04-28 16:40:31+00:00
