,Ticker,Title,Article,Summary,Link,Date
128,GOOGL,FOCUS-Alphabet's Verily bets on long-term payoff from virus-testing deals,"By Paresh Dave

OAKLAND, Calif., Jan 25 (Reuters) - For Alphabet Inc's GOOGL.O Verily, a healthcare venture that is one the tech giant's most prominent ""other bets,"" the coronavirus pandemic offered an immediate business opportunity.

Starting last February, the company shifted many of its about 1,000 employees to developing software for governments and employers to manage coronavirus testing.

It quickly landed major customers including the state of California, which records show paid Verily $49.6 million to use its Baseline software to schedule virus tests.

Smaller deals included a previously unreported $3.1 million grant from the National Foundation for the Centers for Disease Control and Prevention to operate California testing sites.

Verily executives said the pandemic work was a chance to demonstrate the company's capabilities, and attract new customers.

""The conversations are naturally flowing in that way,"" said Dr. Jessica Mega, Verily's chief medical and scientific officer.

Critics say the effort has been another distraction for Verily, which has bounced between dozens of projects without producing a stable revenue stream. The venture has drawn more than $1.8 billion in funding from Alphabet and outside investors including private equity firm Silver Lake.

Converting temporary buyers into long-term clients may be wishful thinking, four industry analysts said.

Two former executives and a current employee criticized the company for taking on another one-off opportunity instead of focusing on attracting recurring subscribers to its software for clinical research, disease management and other tasks.

""I don't think COVID will give them significant tailwinds,"" said one of the people, speaking on the condition of anonymity.

Chief Executive Andy Conrad has told employees Verily is driving toward an initial public offering, and more consistent sales would be essential for a successful Wall Street debut.

Verily's overall sales are not disclosed by Alphabet. Evercore ISI analyst Kevin Rippey estimated 2020 ""other bets"" overall revenue at about $650 million, with Verily contributing under $175 million. The former executives described Verily's actual revenue as higher, and another analyst suggested $200 million to $300 million as more realistic.

'WE HAD TO HELP'

Spun out of Google in 2015, Verily develops devices and software aimed at improving data collection, treatment, research and patient care.

It has enjoyed bursts of revenue from collaborations with healthcare companies, including work with DexCom Inc DXCM.O on a miniaturized blood glucose monitor and a scuttled, high-profile experiment with Alcon AG ALCC.S to create a smart contact lens for similar measurements.

But Verily's financial future hinges on software products led by Baseline, which helps drugmakers enroll participants for clinical trials and analyze study data. It aims to reduce paperwork and site visits compared with traditional methods.

Mega said the company refashioned Baseline to schedule coronavirus tests after governments such as California started asking for help. The software also powers scheduling for 460 Rite Aid Corp RAD.N pharmacies, which provide testing as part of a partnership with the Department of Health and Human Services.

Baseline enabled about 2 million people to get tests nationwide last year, she said, a fraction of the 250 million administered overall.

Dr. Vivian Lee, Verily's president of health platforms, said government COVID-19 projects helped jumpstart separate testing software dubbed Healthy at Work and Healthy at School.

The new tools have 20 customers between them, including Brown University and some biotech companies, Verily said. The University of Alabama, Birmingham has spent $6.9 million on Healthy at School, according to previously unreported records.

Ralph Zottola, an assistant vice president at the university, said it is considering Verily for software to validate whether students have been vaccinated because the company has been ""a good partner.""

When the need for coronavirus testing software ends, Verily aims to transition some new customers to Onduo, one of its core offerings alongside Baseline. The program includes sensors, diet coaching and other personalized tools that insurers and employers can provide for managing chronic diseases and general wellness.

Onduo counts Walgreens Boots Alliance Inc WBA.O and insurers such as CareFirst as customers.

Still, both Onduo and Baseline remain very small players in medical software markets researchers say are worth over $100 billion in the United States annually, and some larger rivals like Teladoc Health Inc's TDOC.N Livongo and Omada Health Inc did not divert resources to the pandemic last year.

Livongo, which directly competes with Onduo, reported sales more than doubled to $267 million during the first three quarters of 2020 compared with same period a year earlier.

Mega defended Verily's moves during the greatest public health crisis in a century.

""Across the company, we've raised our hands,"" she said. ""There was an opportunity, we had to help, but it's accelerating our core business.""

(Reporting by Paresh Dave; Editing by Jonathan Weber and Bill Berkrot)

((paresh.dave@thomsonreuters.com; 415-565-1302;))

The views and opinions expressed herein are the views and opinions of the author and do not necessarily reflect those of Nasdaq, Inc.","It quickly landed major customers including the state of California, which records show paid Verily $49.6 million to use its Baseline software to schedule virus tests.
Verily executives said the pandemic work was a chance to demonstrate the company's capabilities, and attract new customers.
Critics say the effort has been another distraction for Verily, which has bounced between dozens of projects without producing a stable revenue stream.
Evercore ISI analyst Kevin Rippey estimated 2020 ""other bets"" overall revenue at about $650 million, with Verily contributing under $175 million.
When the need for coronavirus testing software ends, Verily aims to transition some new customers to Onduo, one of its core offerings alongside Baseline.",https://www.nasdaq.com/articles/focus-alphabets-verily-bets-on-long-term-payoff-from-virus-testing-deals-2021-01-25,2021-01-25 00:00:00
129,GOOGL,'The market is paying Tesla to take capital': Credit Suisse analyst,"Tesla (TSLA) shares are trading lower on Monday, breaking their 11-day winning streak on Monday despite some Wall Street price target increases on the electric vehicle maker.

Over the weekend Chinese search giant Baidu (BIDU) announced it will create an EV company via a partnership with Zhejiang Geely. Tesla competitor NIO (NIO) also unveiled its new sedan with a powerful battery pack over the weekend.

Credit Suisse analyst Dan Levy doubled his price target on Tesla to $800 from $400 based on “solid margins” and the company’s ability to raise capital amid its massive rally last year.

“With Tesla raising $12bn in ‘20 and not seeing a dent in the stock, it implies Tesla’s cost of capital is negative – the market is paying Tesla to take capital,” wrote Levy in a note to investors.

“This is a significant advantage vs. other automakers, and Tesla has the funds to expand capacity as much as it desires,” he added.

He also noted “significant progress in margin, showing Tesla has further opportunity to cut cost and thus unlock lower pricepoints.”

JANUARY 8th 2021: Elon Musk - CEO of Tesla, Inc. and CTO and chief designer of SpaceX - is now the richest person in the world, passing Amazon CEO Jeff Bezos. - File Photo by: zz/STRF/STAR MAX/IPx 2020 8/14/20 The Tesla Automobile dealership in Downtown Manhattan, New York City. (NYC)

BofA analyst John Murphy also raised its price target on Tesla to $900 from $500, maintaining a Neutral rating on the stock.

He highlighted “the higher the upward spiral of Tesla's stock goes, the cheaper capital becomes to fund growth, which is then rewarded by investors with a higher stock price.”

Tesla’s stock is down as much as 6% in early trading following a 40% rally over the last 30 days. Last week Tesla CEO Elon Musk become the richest person in the world, surpassing Amazon’s Jeff Bezos.

Shares soared more than 740% last year after strong deliveries, back-to-back quarters of profitability, and inclusion in the S&P 500.

Yahoo Finance Premium

Ines covers the U.S. stock market. Follow her on Twitter at @ines_ferre

NIO earnings: Chinese EV maker beats on revenue in the 3rd quarter

'If people can buy shoes and clothes online they'll definitely want to do it with cars:' Shift Co-CEO

Follow Yahoo Finance on Twitter, Facebook, Instagram, Flipboard, LinkedIn, and reddit.","Tesla (TSLA) shares are trading lower on Monday, breaking their 11-day winning streak on Monday despite some Wall Street price target increases on the electric vehicle maker.
Credit Suisse analyst Dan Levy doubled his price target on Tesla to $800 from $400 based on “solid margins” and the company’s ability to raise capital amid its massive rally last year.
“With Tesla raising $12bn in ‘20 and not seeing a dent in the stock, it implies Tesla’s cost of capital is negative – the market is paying Tesla to take capital,” wrote Levy in a note to investors.
(NYC)BofA analyst John Murphy also raised its price target on Tesla to $900 from $500, maintaining a Neutral rating on the stock.
Last week Tesla CEO Elon Musk become the richest person in the world, surpassing Amazon’s Jeff Bezos.",https://finance.yahoo.com/news/the-market-is-paying-tesla-to-take-capital-credit-suisse-analyst-161004261.html,2021-01-25 00:00:00
130,GOOGL,Google opens Dublin hub to tackle harmful online content,"A 3D printed Google logo is seen in this illustration taken April 12, 2020. REUTERS/Dado Ruvic/Illustration/File Photo

BRUSSELS, Jan 27 (Reuters) - Alphabet unit Google (GOOGL.O) on Wednesday opened a centre to tackle harmful online content, in a move also designed to ease regulatory concerns about how the company and other tech giants police a growing problem on the internet.

The world's most popular search engine, along with other U.S. tech giants, has drawn criticism because of the spread of illegal and harmful content via their platforms, triggering calls for more regulatory action.

The 27-country European Union has taken the lead in proposing tough new rules to curb their powers, protect smaller rivals and make them take more responsibility for removing harmful content from their platforms. The proposed rules are expected to come into force in the next two years.

The Google Safety Engineering Center at Google's European headquarters in Dublin will focus on content responsibility and is the first in the world for the company, the company's Director of Trust and Safety Amanda Storey said in a blog.

""The new Dublin centre will be a regional hub for Google experts working to tackle the spread of illegal and harmful content and a place where we can share this work with policymakers, researchers, and regulators,"" she said.

She added it would help everyone understand work with ""trusted flaggers"" and the way incidents are tackled, but she did not specify how many would be employed in the centre, whose staff will work from home for as long as lockdown restrictions require.

Reporting by Foo Yun Chee; editing by Barbara Lewis

Our Standards: The Thomson Reuters Trust Principles.","A 3D printed Google logo is seen in this illustration taken April 12, 2020.
REUTERS/Dado Ruvic/Illustration/File PhotoBRUSSELS, Jan 27 (Reuters) - Alphabet unit Google (GOOGL.O) on Wednesday opened a centre to tackle harmful online content, in a move also designed to ease regulatory concerns about how the company and other tech giants police a growing problem on the internet.
The world's most popular search engine, along with other U.S. tech giants, has drawn criticism because of the spread of illegal and harmful content via their platforms, triggering calls for more regulatory action.
The 27-country European Union has taken the lead in proposing tough new rules to curb their powers, protect smaller rivals and make them take more responsibility for removing harmful content from their platforms.
""The new Dublin centre will be a regional hub for Google experts working to tackle the spread of illegal and harmful content and a place where we can share this work with policymakers, researchers, and regulators,"" she said.",https://www.reuters.com/technology/google-opens-dublin-hub-tackle-harmful-online-content-2021-01-27/,2021-01-27 00:00:00
131,GOOGL,"Google Play is unsportsmanlike, U.S. states likely to argue in potential lawsuit","A Google sign is pictured on a Google building in the Manhattan borough of New York City, New York, U.S., October 20, 2020. REUTERS/Carlo Allegri/File Photo

WASHINGTON, Jan 15 (Reuters) - State attorneys general are planning a third lawsuit against Alphabet Inc's (GOOGL.O) Google, this one focused on the search and advertising giant's Play Store for Android phones, according to two sources familiar with the matter.

The lawsuit is expected to be filed in February or March, the sources said, and it would follow complaints about Google's management of its Play Store even though the company was originally seen as more open about its app store than Apple Inc (AAPL.O).

Including a U.S. Justice Department lawsuit filed against Google in October , the possible new action would be the fourth government lawsuit brought against the Silicon Valley company since late 2020. All allege that Google abused its dominance of the internet search business or otherwise broke antitrust law. read more

Google bans apps with objectionable content from its store,

and further requires that some apps use the company's payment tools and pay Google as much as 30% of their revenue.

Those and related policies prompted criticism from app developers, particularly when Google said last year it would ramp up enforcement. Google's Play Store is far more widely used than similar products from Amazon.com Inc (AMZN.O), Samsung Electronics Co Ltd (005930.KS), Huawei Technologies Co Ltd (HWT.UL) and others.

The probe will be headed by attorneys general of Utah, North Carolina and New York, and other states are also expected to join, one of the sources said.

Asked to comment on the possible new legal action, Google said in a statement that its Android mobile operating system has allowed users access to multiple app stores, which means that developers have options.

""Most Android devices ship with at least two app stores preinstalled, and consumers are able to install additional app stores,"" Sameer Samat, vice president of Android and Google Play, said in a statement.

""This openness means that even if a developer and Google do not agree on business terms the developer can still distribute on the Android platform,"" he said.

Video game maker Epic Games Inc sued Google and Apple separately in U.S. district court in August, accusing the companies of using their dominance to charge app developers an ""exorbitant"" fee of 30% on sales and of imposing other restrictions.

Apple, whose app store does not directly compete with Google's because it is not compatible with Android devices, is under Justice Department investigation for its policies.

After more than a year of investigations into the four major tech platforms, including Facebook Inc (FB.O), Amazon and Apple, the Justice Department was first out of the gate with a lawsuit against Google focused on its search business and search advertising.

In addition, two groups of state attorneys general filed lawsuits last year, one led by Texas and focused on advertising. The other targeted Google's alleged efforts to extend its dominance in search to newer markets, like voice assistants.

Reporting by Diane Bartz in Washington, Paresh Dave in Oakland, Calif., and Karen Freifeld in New York Editing by Matthew Lewis

Our Standards: The Thomson Reuters Trust Principles.","A Google sign is pictured on a Google building in the Manhattan borough of New York City, New York, U.S., October 20, 2020.
Including a U.S. Justice Department lawsuit filed against Google in October , the possible new action would be the fourth government lawsuit brought against the Silicon Valley company since late 2020.
Those and related policies prompted criticism from app developers, particularly when Google said last year it would ramp up enforcement.
Google's Play Store is far more widely used than similar products from Amazon.com Inc (AMZN.O), Samsung Electronics Co Ltd (005930.KS), Huawei Technologies Co Ltd (HWT.UL) and others.
""Most Android devices ship with at least two app stores preinstalled, and consumers are able to install additional app stores,"" Sameer Samat, vice president of Android and Google Play, said in a statement.",https://www.reuters.com/business/google-play-is-unsportsmanlike-us-states-likely-argue-potential-lawsuit-2021-01-15/,2021-01-15 00:00:00
132,GOOGL,7 Bold Predictions for Tech Stocks in 2021,,,https://investorplace.com/2021/01/7-bold-predictions-for-tech-stocks/,2021-01-07 00:00:00
133,GOOGL,Are you a robot?,"Why did this happen?

Please make sure your browser supports JavaScript and cookies and that you are not blocking them from loading. For more information you can review our Terms of Service and Cookie Policy.","Why did this happen?
Please make sure your browser supports JavaScript and cookies and that you are not blocking them from loading.
For more information you can review our Terms of Service and Cookie Policy.",https://www.bloomberg.com/news/articles/2021-01-27/yellen-sunak-discuss-firms-taxes-amid-digital-levies-dispute,2021-01-27 00:00:00
134,GOOGL,Checking in with Bandwidth Stock After a Big Year,"Bandwidth Inc. (NASDAQ:BAND) is a software company focused that operates as a cloud-based communications platform service provider. Bandwidth provides software application programming interfaces (or APIs) for voice and messaging to companies like Alphabet (GOOGL), Microsoft (MSFT), Cisco Systems (CSCO), and Zoom Communications (ZM).



Bandwidth stock is a ways off its Oct. 13 record high of $198.60. However, the pullbacks BAND has encountered in November and currently this month have been contained by the shares' 160-day moving average. Year-over-year, the equity is up 123%.

A short squeeze could help BAND return to those October highs. Short interest increased by almost 8% in the most recent reporting period and the 8.40 million shares sold short accounts for a healthy 26% of the stock's total available float. At BAND's average pace of trading, it would take more than eight days for shorts to buy back their bearish bets.

Despite its $3.9 billion market cap, Bandwidth is still in its early growing stages. Although the company is growing revenue consistently, the growth rate isn’t sufficient enough at the moment to warrant its current valuation. BAND generated revenue of about $250 million over the past 12 months, and has only grown its net profit by $95 million over the past four years. Nonetheless, Bandwidth stock is demonstrating an overall upward trajectory and positive figures, including a balance sheet with nearly twice their total debt amount in cash and cash equivalents.","Bandwidth Inc. (NASDAQ:BAND) is a software company focused that operates as a cloud-based communications platform service provider.
Bandwidth provides software application programming interfaces (or APIs) for voice and messaging to companies like Alphabet (GOOGL), Microsoft (MSFT), Cisco Systems (CSCO), and Zoom Communications (ZM).
Bandwidth stock is a ways off its Oct. 13 record high of $198.60.
BAND generated revenue of about $250 million over the past 12 months, and has only grown its net profit by $95 million over the past four years.
Nonetheless, Bandwidth stock is demonstrating an overall upward trajectory and positive figures, including a balance sheet with nearly twice their total debt amount in cash and cash equivalents.",https://www.schaeffersresearch.com/content/analysis/2021/01/14/checking-in-with-bandwidth-stock-after-a-big-year,2021-01-14 00:00:00
135,GOOGL,Are you a robot?,"Why did this happen?

Please make sure your browser supports JavaScript and cookies and that you are not blocking them from loading. For more information you can review our Terms of Service and Cookie Policy.","Why did this happen?
Please make sure your browser supports JavaScript and cookies and that you are not blocking them from loading.
For more information you can review our Terms of Service and Cookie Policy.",https://www.bloomberg.com/news/articles/2021-01-01/biden-s-pick-to-lead-treasury-made-over-7m-in-speaking-fees,2021-01-01 00:00:00
