,Ticker,Title,Article,Summary,Link,Date
0,GOOGL,"Google stock: Alphabet (GOOGL) is poised to be the 'best performing' of the mega caps in 2021, says Goldman Sachs portfolio manager","Once in the running for Asia’s richest man, Evergrande’s Hui Ka Yan scrambles to save his real estate empire","Once in the running for Asia’s richest man, Evergrande’s Hui Ka Yan scrambles to save his real estate empire",https://fortune.com/2021/01/25/google-stock-alphabet-googl-shares-2021-tech-stocks-faamg-goldman-sachs/,2021-01-25 00:00:00
1,GOOGL,Are you a robot?,"Why did this happen?

Please make sure your browser supports JavaScript and cookies and that you are not blocking them from loading. For more information you can review our Terms of Service and Cookie Policy.","Why did this happen?
Please make sure your browser supports JavaScript and cookies and that you are not blocking them from loading.
For more information you can review our Terms of Service and Cookie Policy.",https://www.bloomberg.com/news/articles/2021-01-21/alphabet-workers-union-leader-parul-koul-takes-on-google-googl,2021-01-21 00:00:00
2,GOOGL,"Amazon and Alphabet earnings, January jobs report: What to know in the week ahead","As investors continue to digest last week’s Reddit-fueled volatility, they will also look this week to the regular cadence of quarterly earnings reports and economic data.

Another couple of Big Tech earnings will punctuate the flow of quarterly results, with Alphabet (GOOGL, GOOG) and Amazon (AMZN) each set to report after market close on Tuesday.

Facebook’s (FB) results last Wednesday offered a mixed picture of the internet advertising landscape against the ongoing pandemic. The company’s fourth-quarter advertising revenue handily topped estimates, though the company noted “significant uncertainty” remained over the trajectory of its ad business heading into 2021. While Facebook’s social media ad business is not a perfect analogy to Alphabet’s search-driven ad business, the results suggested a still-strained environment for online advertisers with the virus still inflicting disruptions across business customers.

Analysts are looking for Alphabet to report accelerating revenue growth in its fiscal fourth quarter versus the third quarter, as improving operating conditions for its advertising customers helped boost results at the end of the year. Consensus analysts are looking for sales, excluding traffic acquisition costs, to grow 18% to $44.16 billion, versus the 15% growth posted in the third quarter.

“Our checks with SEMs [search engine marketers] suggest search spending accelerated from 3Q to 4Q,” JPMorgan analyst Doug Anmuth wrote in a note last week.

“Certain verticals heavily affected by COVID-19, including travel that we believe represented 10-15% of search revenue prior to the pandemic, likely remained challenged throughout 4Q given resurgence and related shutdowns,” he added. “We believe recovery in these verticals will happen through ’21 as consumers continue to get vaccinated, driving further acceleration in ad revenue.”

Other smaller areas of Alphabet’s business have been growing strongly. Google’s Cloud business grew revenues nearly 45% year-over-year during the third quarter, ticking up slightly from the previous quarter’s 43% growth. And last quarter, Alphabet CEO Sundar Pichai announced Google would break out Google Cloud’s operating profit for the first time ever in fourth-quarter results, offering a glimpse at the return the company received after years of investment to compete with cloud leaders like Amazon’s AWS and Microsoft’s Azure.

Story continues

A worker assembles a box for delivery at the Amazon fulfillment center in Baltimore, Maryland, U.S., April 30, 2019. REUTERS/Clodagh Kilcoyne

“Following years of heavy investment in Google Cloud, we believe Cloud around breakeven or marginally profitable would show both profitability path for Cloud and margin stabilization/expansion potential for the remainder of the Google Segment,” Anmuth said.

Meanwhile, e-commerce behemoth Amazon is likely to report another blockbuster quarter amid the accelerating shift to online shopping during the pandemic. The company will likely post its first-ever quarter doing more than $100 billion in revenue, which would bring full-year 2020 revenue to a staggering $379 billion.

While retail sales across the U.S. scaled back across most consumer categories in the final months of the year, sales at online retailers remained robust. Government data showed that in December, U.S. non-store retailers — or e-commerce platforms — grew sales 19% over the same month in 2019.

“Thematic data points we have gathered throughout 2020... collectively point to consumers globally becoming increasingly comfortable purchasing online every day as opposed to every now and then,” Credit Suisse analyst Stephen Ju wrote in a note last week. “These factors amount to the following near to long-term potential implications for Amazon: 1) upside to GMV [gross merchandise value] estimates in 2021 and beyond ... and 2) moderating customer acquisition/retention costs as greater purchase frequency reinforces Amazon/Prime brand.”

But while sales likely soared yet again over the fourth quarter and holiday shopping season, Amazon has also vowed to funnel even more capital back into the business to sustain its growth and increase safety for its workers during the pandemic. Amazon said its operating income in the fourth quarter would come in between $1.0 billion and $4.5 billion, when factoring in costs of about $4.0 billion in costs related to COVID-19. That compares to operating income of $3.9 billion in the fourth quarter of 2019. And Amazon’s estimated costs doubled from the $2 billion it said it would spend on COVID-related expenses in the third quarter of 2020.

January jobs report

On Friday, the U.S. Labor Department’s January jobs report will likely show that the economy resumed adding back payrolls at the start of 2021, after a dip in hiring in December.

Consensus economists expect to see the unemployment rate hold steady at 6.7% for a third straight month and a modest rise in non-farm payrolls. Specifically, economists anticipate non-farm payrolls rose by 58,000 in January, after declining by a net 140,000 in December. That had marked the first drop since April, as a resurgence in coronavirus infections around the holidays coupled with weakening hiring trends during the winter. And as of December, employment was still 9.8 million below its pre-pandemic levels from February of 2020, after even seven straight months of payroll gains failed to fully recover the jobs lost at the worst points of the pandemic.

By far the biggest contributor to the December drop in payrolls had services sector employees, as leisure and hospitality industries shed a net 498,000 jobs in the final month of 2020. This phenomenon may be reflected again in January before alleviating in the coming months, as funds from the latest $900 billion fiscal stimulus package and broadening vaccine-conferred immunity to COVID-19 percolated through the economy.

“We estimate that non-farm payroll employment was broadly unchanged in January, but the recent fiscal support and drop-back in new virus cases suggest the labour market recovery will resume soon,” Capital Economics senior U.S. economist Andrew Hunter said in a note Thursday. “Excluding leisure and hospitality, employment in most other industries continued to rise in December and the early signs are that continued in January.”

Initial jobless claims during the survey week for the non-farm payrolls report suggests some downside risk to the January report, however. During the survey week, or the week including the 12th of the month, first-time unemployment claims spiked above 900,000, closing back in on levels not seen since August. But at the same time, continuing claims and claims for federal pandemic-era unemployment benefits also retreated, suggesting some reentrants into the workforce during the month.

“Since the beginning of the January NFP [non-farm payrolls] survey period, continuing claims in regular state programs, PEUC [Pandemic Emergency Unemployment Compensation] and extended benefits have declined 160k, consistent with our view that the labor market likely stabilized in January,” Nomura Chief Economist Lewis Alexander wrote Thursday.

Earnings Calendar

Monday: Warner Music Group (WMG) before market open

Tuesday: Alibaba (BABA), McKesson (MKC), ConocoPhillips (COP), SiriusXM Holdings (SIRI), Harley-Davidson (HOG), UPS (UPS), Pfizer (PFE), Marathon Petroleum (MPC), Exxon Mobil (XOM) before market open; Amgen (AMGN), Alphabet (GOOGL), Match Group (MTCH), Amazon (AMZN), FireEye (FEYE), Electronic Arts (EA), Chipotle Mexican Grill (CMG) after market close

Wednesday: Apollo Global Management (APO), AbbVie (ABBV), Humana (HUM) before market open; Qualcomm (QCOM), Align Technology (ALGN), IAC (IAC), eBay (EBAY), PayPal (PYPL), GrubHub (GRUB), Qorvo (QRVO), Allstate (ALL) after market close

Thursday: Merck (MRK), Bristol-Myers Squibb (BMY), The New York Times (NYT), Tapestry (TPR), Clorox (CLX), Cigna (CI), Ralph Lauren (RL), Phillip Morris (PM) before market open; Zendesk (ZEN), Prudential Financial (PRU), GoPro (GPRO), Activision Blizzard (ATVI), Snap (SNAP), Gilead (GILD), Pinterest (PINS), Peloton (PTON), Ford (F) after market close

Friday: Regeneron Pharmaceuticals (REGN) before market open

Economic Calendar

Monday: Markit US manufacturing PMI, January final (59.1 expected, 59.1 in prior print); Construction spending month-over-month, December (0.8% expected, 0.9% in November); ISM Manufacturing, January (60.0 expected, 60.7 in December)

Tuesday: Wards total vehicle sales, January (16.10 million expected, 16.27 million in December)

Wednesday: MBA mortgage applications, week ended January 29 (-4.1% during prior week); ADP employment change, January (50,000 expected, -123,000 in December); Markit US Composite PMI, January final (58.0 in prior print); Markit US services PMI, January final (57.5 in print print); ISM Services Index, January (56.8 expected, 57.7 in December)

Thursday: Challenger job cuts, year-over-year, January (134.5% in December); Initial jobless claims, week ended January 30 (847,000 during prior week); Continuing claims, week ended January 23 (4.771 million during prior week); Factory orders, December (1.0% expected, 1.0% in November); Durable goods orders, December final (0.2% in prior print); Durable goods orders excluding transportation, December final (0.7% in November); Non-defense capital goods orders excluding aircraft, December final (0.6% in prior print); Non-defense capital goods shipments excluding aircraft, December final (0.5% in prior print)

Friday: Change in non-farm payrolls, January (50,000 expected, -140,000 in December); Unemployment rate, January (6.7% expected, 6.7% in December); Average hourly earnings, month-over-month, January (0.3% expected, 0.8% in December); Average hourly earnings, year-over-year, January (5.0% expected, 5.1% in December); Labor force participation rate, January (61.5% in December); Trade balance, December (-$66.5 billion expected, -$68.1 billion in November); Consumer credit, December ($12.500 billion expected, $15.274 billion in November)

—

Emily McCormick is a reporter for Yahoo Finance. Follow her on Twitter: @emily_mcck

Read more from Emily:

Find live stock market quotes and the latest business and finance news

For tutorials and information on investing and trading stocks, check out Cashay

Follow Yahoo Finance on Twitter, Facebook, Instagram, Flipboard, LinkedIn, and reddit.","As investors continue to digest last week’s Reddit-fueled volatility, they will also look this week to the regular cadence of quarterly earnings reports and economic data.
Another couple of Big Tech earnings will punctuate the flow of quarterly results, with Alphabet (GOOGL, GOOG) and Amazon (AMZN) each set to report after market close on Tuesday.
Story continuesA worker assembles a box for delivery at the Amazon fulfillment center in Baltimore, Maryland, U.S., April 30, 2019.
Meanwhile, e-commerce behemoth Amazon is likely to report another blockbuster quarter amid the accelerating shift to online shopping during the pandemic.
But at the same time, continuing claims and claims for federal pandemic-era unemployment benefits also retreated, suggesting some reentrants into the workforce during the month.",https://finance.yahoo.com/news/amazon-and-alphabet-earnings-january-jobs-report-what-to-know-in-the-week-ahead-170537752.html,2021-01-21 00:00:00
3,GOOGL,Alphabet Crushed All Expectations In Q3. What Can We Expect In Q4?,"Key Takeaways:

After crushing earnings expectations in Q3, Alphabet looks to sustain momentum in Q4

Ad revenue seen bouncing back, indicating it might be open season in the advertising arena

Google GOOG cloud growth is worth watching as company tries to gain share

When you create a product that’s efficient, effective, and well-branded it can become peoples’ top choice, and that favorability could pose a significant barrier to entry. The downside: You might be accused of having a monopoly on your hands and face a basket of antitrust lawsuits.

That pretty much sums up Google’s parent company, Alphabet (GOOGL).

After facing pandemic headwinds in Q2 of 2020 resulting in the company’s first-ever year-over-year quarterly revenue decline, GOOGL got back on its feet in Q3, crushing analyst expectations in just about every business segment. The road through Q4 looked promising, but then the search behemoth found itself broadsided with antitrust lawsuits from the Justice Department and 38 other states and territories.

GOOGL’s “monopoly” problem may arguably dampen investor sentiment. But let’s face it: the trial isn’t taking place until September 2023, and investor attention spans tend to fall on the short-term side of things. That means the focus might be more on GOOGL’s previous quarter and the ones ahead this year. Could all this be nothing more or less exciting than business as usual? We’ll find out when GOOGL reports Q4 earnings after the bell on Feb. 2.

FIGURE 1: SECTOR TRACKING. Shares of Alphabet (GOOGL—candlestick) have pretty much been moving in ... [+] sync with the Communication Service sector ($IXC—purple line). It’ll be interesting to see how well the two correlate after GOOGL announces its Q4 earnings. Data source: Nasdaq, S&P Dow Jones Indices. Chart source: The thinkorswim® platform from TD Ameritrade. Data source: Nasdaq, S&P Dow Jones Indices. Chart source: The thinkorswim® platform from TD Ameritrade.

It’s Open Season for Online Ad Space

The exciting news leading into the last quarter of 2020 was that search and YouTube ad revenues had bounced back in a big way during Q3. The drop in ad spending—nearly 80% of the company’s entire revenue—hit GOOGL like a ton of bricks in Q2 amid the lockdown.

Even though people at home relied heavily on online search and streaming entertainment via YouTube—making “online” the ideal stage for attention and engagement—many businesses were temporarily shuttered; most looking to cut expenses amid economic uncertainty. When you consider those challenges, the drop in ad spend was understandable.

But if economic gloom prevented businesses from spending or doubling-down on their ad efforts, GOOGL’s Q3 ad revenue of $37.1 billion—jumping 10% year over year from Q2’s negative 8%—might have indicated early on that the space was, once again, about to be re-engaged.

GOOGL may be the dominant player in search-based advertising and it may also hold a huge chunk of market share through its streaming YouTube platform. But the global share of online advertising, estimated at $389 billion in 2021 alone according to Statista, still presents a wide field of opportunity. In short, there’s lots of room for growth. And the time seems ripe to take the field, as vaccine rollouts and continued stimulus support encourage businesses to try to get back to business as usual.

Did GOOGL take the opportunity to make a quick move on the renewed advertising season? That’s something investors will have to listen for when GOOGL opens its books.

Plenty of Room for Clouds in the Virtual Sky

GOOGL is a huge company with a real penchant for disruption and innovation. But in the cloud space, it’s a small catcher-upper, trailing well behind leaders Amazon AMZN (AMZN) and Microsoft (MSFT MSFT ). To date, GOOGL’s cloud makes up only a little over 7% of its total revenue.

But what matters most in GOOGL’s catch-up game isn’t the size of its cloud share but its growth rate. In Q3, its cloud revenue may have been up only $3.4 billion, small compared to AMZN’s $11.6 billion or MSFT’s $13 billion revenue for cloud. But if you take a look at the growth rate, GOOGL’s Q3 cloud revenue grew 45% year over year, as compared with AMZN’s 29% and MSFT’s 20%.

GOOGL’s pursuit reminds us of a slogan (and book title) that captures the spirit of innovation in early tech, not unlike GOOGL in its early years: “It’s not the big that eat the small … it’s the fast that eat the slow.” Keep this in mind when GOOGL reports cloud revenues in the coming quarter, as Google Cloud, a segment CEO Sundar Pichai is aggressively driving, will be reported as its own stand-alone segment.

In “Other” News ...

GOOGL’s “Other Bets,” its smaller projects and subsidiaries including Waymo, its driverless vehicle tech, and Verily Life Sciences brought in $178 million in Q3 revenue, nearly 15% more than a year earlier. However, it also generated a Q3 operating loss of $1.1 billion—up 17% from the same quarter the prior year.

GOOGL also finalized its acquisition of electronic consumer and fitness company Fitbit FIT a few weeks ago. Results of that acquisition will likely be reported in the quarter to come.

Looking Ahead

In Q3, GOOGL crushed analyst expectations, with earnings per share of $16.40 topping analyst estimates of $11.29, and revenue of $46.17 billion versus estimates of $42.90 billion according to research firm Refinitiv.

Though analysts largely expect to see a year over year decline in Communications Services net profit margins, according to FactSet, analysts expect GOOGL to outperform its sector peers. Research firm CFRA noted the company’s dominance in search and streaming (YouTube) ad revenues as primary drivers.

Though GOOGL CFO Ruth Porat withheld guidance for Q4, she emphasized the company’s continued investment in segments offering “long-term sustainable financial value” particularly cloud growth.

Will GOOGL offer any guidance this time out? It’s possible, but other Tech companies, including Apple AAPL (AAPL), decided not to, citing uncertainty around the pandemic.

Alphabet Earnings and Options Activity

GOOGL is expected to report an adjusted EPS of $15.93, up from $15.35 in the prior-year quarter, according to third-party consensus analyst estimates. Revenue is projected at $53.1 billion, up 15.2% from a year ago.

The options market has priced in an expected share price move of 4.3% in either direction around the earnings release.

Looking at the Feb. 5 options expiration, call activity has been spread out, but with a concentration at the 1900 strike. Put activity has also been spread out with the most active at the 1700 strike. The implied volatility sits at the 32nd percentile as of Friday morning.

Note: Call options represent the right, but not the obligation, to buy the underlying security at a predetermined price over a set period of time. Put options represent the right, but not the obligation, to sell the underlying security at a predetermined price over a set period of time.

TD Ameritrade® commentary for educational purposes only. Member SIPC. Options involve risks and are not suitable for all investors. Please read Characteristics and Risks of Standardized Options.","We’ll find out when GOOGL reports Q4 earnings after the bell on Feb. 2.
To date, GOOGL’s cloud makes up only a little over 7% of its total revenue.
In Q3, its cloud revenue may have been up only $3.4 billion, small compared to AMZN’s $11.6 billion or MSFT’s $13 billion revenue for cloud.
But if you take a look at the growth rate, GOOGL’s Q3 cloud revenue grew 45% year over year, as compared with AMZN’s 29% and MSFT’s 20%.
Looking AheadIn Q3, GOOGL crushed analyst expectations, with earnings per share of $16.40 topping analyst estimates of $11.29, and revenue of $46.17 billion versus estimates of $42.90 billion according to research firm Refinitiv.",https://www.forbes.com/sites/jjkinahan/2021/01/29/alphabet-crushed-all-expectations-in-q3-what-can-we-expect-in-q4/,2021-01-29 00:00:00
4,GOOGL,"Alphabet’s Target Price Raised to $2,050 at Morgan Stanley; $2,450 in Best Case","Morgan Stanley raised their stock price forecast on Alphabet Inc to $2,050 from $1,880, assigning an “Overweight” rating and said it expects 20% online advertisement growth in 2021.

Internet giant’s advertising revenues rebounded in the third quarter of last year, with YouTube advertising revenues growing more than 30% to $5 billion from the same period a year ago. The California-based multinational conglomerate also benefited from the strong momentum in Play Store as sales surged during the COVID-19 pandemic lockdown.

“We are also bullish GOOGL ($2,050 price target, 20% upside) on the travel recovery (12-15% of paid search) and strong YouTube trends from an improved direct response offering/more stable branded ad market. We are also optimistic about the sum of the parts narrative as we see Google Cloud disclosure in 1Q:21 shining better light on this potential $375 billion asset,” noted Brian Nowak, equity analyst at Morgan Stanley.

“For perspective, this would imply GOOGL (ex-Cloud) is currently trading at 8x core EBITDA for 11% CAGR ’21-’24 EBITDA growth. Sum of the parts would bring our $2,450 bull case (40% upside) into play.”

Morgan Stanley gave a target price of $2,450 under a bull-case scenario and $1,465 under the worst-case scenario. Other equity analysts also recently updated their stock outlook. Alphabet had its price target upped by Robert W. Baird to $2,000. Argus increased their price target to $1,850 from $1,620 and gave the company a buy rating. Credit Suisse Group raised their target price to $1,950 from $1,850 and gave the stock an outperform rating. JP Morgan raised the stock price forecast to $2,050 from $1,870 and gave the stock an overweight rating.

Twenty-eight analysts who offered stock ratings for Alphabet in the last three months forecast the average price in 12 months at $1,944.04 with a high forecast of $2,250.00 and a low forecast of $1,700.00. The average price target represents a 12.62% increase from the last price of $1,726.13. From those 28 equity analysts, 26 rated “Buy”, two rated “Hold” and none rated “Sell”, according to Tipranks.

Story continues

Alphabet’s shares closed 1.51% lower at $1726.13 on Monday; however, the stock is rose over 30% in 2020.

“Google Websites growth is likely to rebound in 2021 as we believe there are several underappreciated products driven by mobile search, strong YouTube contribution, and continued innovation, such as Maps monetization,” Morgan Stanley’s Nowak added.

“Continued expense discipline leads to operating leverage and upward revisions on EPS estimates.”

This article was originally posted on FX Empire

More From FXEMPIRE:","Morgan Stanley raised their stock price forecast on Alphabet Inc to $2,050 from $1,880, assigning an “Overweight” rating and said it expects 20% online advertisement growth in 2021.
Sum of the parts would bring our $2,450 bull case (40% upside) into play.”Morgan Stanley gave a target price of $2,450 under a bull-case scenario and $1,465 under the worst-case scenario.
Credit Suisse Group raised their target price to $1,950 from $1,850 and gave the stock an outperform rating.
JP Morgan raised the stock price forecast to $2,050 from $1,870 and gave the stock an overweight rating.
The average price target represents a 12.62% increase from the last price of $1,726.13.",https://finance.yahoo.com/news/alphabet-target-price-raised-2-055308951.html,2021-01-29 00:00:00
