,Ticker,Title,Article,Summary,Link,Date
43,GOOGL,"The Zacks Analyst Blog Highlights: Sony, NVIDIA, Microsoft, Google and Deere","For Immediate Release

Chicago, IL – April 12, 2021 – Zacks.com announces the list of stocks featured in the Analyst Blog. Every day the Zacks Equity Research analysts discuss the latest news and events impacting stocks and the financial markets. Stocks recently featured in the blog include: Sony Group Corporation SONY, NVIDIA Corporation NVDA, Microsoft Corporation MSFT, Alphabet Inc. GOOGL and Deere & Company DE.

Here are highlights from Friday’s Analyst Blog:

""Spatial Computing"" Emerging: 5 Stocks to Buy

Disruptive innovation in technology is making way in the world, with spatial computing covering the combined capabilities of global positioning systems (GPS), artificial intelligence (AI), Internet of things (IoT), machine learning (ML), remote sensing and more. Spatial computing brings together the physical and digital worlds. From booking a ride on Uber to doctors performing complicated surgeries, this umbrella concept offers a wide array of technologies that are poised to grow.

Human-Machine Interaction: A Key Driver

One of the key features of spatial computing is that it uses the 3D space around an object to interface with technology, creating a two-way relationship, connecting man and machine. For instance, one can use a smart speaker for voice-automated Internet searching and also direct their cleaning robots. Spatial computing also helps shoppers create a virtual copy of their rooms and see how furniture will look before purchasing it.

Applications combined with wearable technologies now help one monitor heart rate, pulse, blood pressure and body temperature. These devices are not only handy for athletes but also help common man track their general wellbeing in day-to-day lives.

Additionally, when spatial computing is deployed on the factory floor, it enables seamless interactions between employees through augmented reality (AR). The company can keep a close watch on performance management, improve ML capabilities, and optimize design and factory floor operations.

Story continues

Gaming, Medicine and Beyond

The gaming space has been booming in the past year and much of its advancement can be credited to spatial computing. Augmented reality is enhancing the gaming and entertainment experience rapidly. Spatial computing’s dependence on 3D imaging techniques allows players to immerse in the virtual world and perform physical activities. The market already has several AR/VR headsets or glasses-free holographic displays like Magic Leap, HTC Vive and Oculus.

In the field of medicine and healthcare, 3D printing has the potential to transform the manufacturing landscape. Medical breakthroughs like 3D bioprinting can now create tissues that are both spatially patterned and three-dimensional. Hence, a 3Dprinted human liver is no longer a myth. Spatial computing is also making transportation faster, cheaper and more convenient.

Another application of spatial computing can be seen in agriculture, with farmers now being able to use precision agriculture to control the way crops are produced. Drones and bots can now survey land quality, climate and suggest farmers how to control the number of chemicals used on crops.

Spatial Computing Market Growth Pointers

As mentioned earlier, spatial computing is an umbrella concept for various technologies and has found application in nearly every sector of human life. Its scope to enhance the quality of life, from daily household tasks to reducing traffic accidents, weather forecasting to security, makes it an area of growth and holds potential for investors to earn hefty returns.

According to Zion Market Research’s report, the global spatial computing market, which was estimated at $22.22 billion in 2019, is likely to see a CAGR of nearly 41% to $196.21 billion by 2026.

5 Top Picks

Given spatial computing’s scope for innovative improvement, we have shortlisted five stocks that are poised to grow.

Sony Group designs, develops, produces, and sells electronic equipment, instruments, and devices for the consumer, professional, and industrial markets. VR gaming has been a highlight of the company with its PlayStation VR headset. The Spatial Reality Display enables creators across automotive and industrial design, to Computer Graphics (CG) and Visual Effects (VFX) designers and creators in film to bring ideas to life in 3D displays.

The company’s expected earnings growth rate for the current year is more than 100% compared with the Zacks Audio Video Production industry’s projected earnings growth of 19.3%. The Zacks Consensus Estimate for this company’s current-year earnings has been revised 5.6% upward over the past 60 days. Sony flaunts a Zacks Rank #1 (Strong Buy). You can see the complete list of today’s Zacks #1 Rank stocks here.

NVIDIA operates as a visual computing company. The company offers graphics processing units that developers need to bring virtual worlds to life. Nvidia also provides drivers that can be used in all major headset brands, including Oculus, Valve Index and HTC Vive.

The company’s expected earnings growth rate for the current year is 33.7% compared with the Zacks Semiconductor - General industry’s projected earnings growth of 18.4%. The Zacks Consensus Estimate for this Zacks Rank #1 company’s current-year earnings has been revised 15.1% upward over the past 60 days.

Microsoft develops, licenses and supports software, services, devices, and solutions. The company is engaged in spatial computing and offers virtual reality-based products like DreamWalker that allow users to walk from one place to another in the real world while experiencing a completely different place.

The company’s expected earnings growth rate for the current year is nearly 28% compared with the Zacks Computer - Software industry’s projected earnings growth of 2.1%. The Zacks Consensus Estimate for this company’s current-year earnings has been revised 0.4% upward over the past 60 days. Microsoft holds a Zacks Rank #2 (Buy).

Alphabet offers performance and brand advertising services and more. The company has been focusing on opportunities to bring more spatial computing to the masses, one of its widely used services being Google Maps. Meanwhile, Google’s ARCore includes light detection, surface and edge detection, and six degrees of freedom in user motion.

The company’s expected earnings growth rate for the current year is 18.2% compared with the Zacks Internet - Services industry’s projected earnings growth of 7.2%. The Zacks Consensus Estimate for this Zacks Rank #2 company’s current-year earnings has been revised 0.3% upward over the past 60 days.

Deere & Company manufactures and distributes various equipment. The company uses virtual reality to visualize tractors early in the design process, which in return shortens the time from concept to production. Deere is also using AI, ML, and computer vision applications in agriculture that can increase yields, reduce costs, and boost sustainability.

The company’s expected earnings growth rate for the current year is 82.5% compared with the Zacks Manufacturing - Farm Equipment industry’s projected earnings growth of 17.6%. The Zacks Consensus Estimate for this Zacks Rank #2 company’s current-year earnings has been revised 20.5% upward over the past 60 days.

Zacks Names “Single Best Pick to Double”

From thousands of stocks, 5 Zacks experts each have chosen their favorite to skyrocket +100% or more in months to come. From those 5, Director of Research Sheraz Mian hand-picks one to have the most explosive upside of all.

You know this company from its past glory days, but few would expect that it’s poised for a monster turnaround. Fresh from a successful repositioning and flush with A-list celeb endorsements, it could rival or surpass other recent Zacks’ Stocks Set to Double like Boston Beer Company which shot up +143.0% in a little more than 9 months and Nvidia which boomed +175.9% in one year.

Free: See Our Top Stock and 4 Runners Up >>

Media Contact

Zacks Investment Research

800-767-3771 ext. 9339

support@zacks.com

https://www.zacks.com

Past performance is no guarantee of future results. Inherent in any investment is the potential for loss. This material is being provided for informational purposes only and nothing herein constitutes investment, legal, accounting or tax advice, or a recommendation to buy, sell or hold a security. No recommendation or advice is being given as to whether any investment is suitable for a particular investor. It should not be assumed that any investments in securities, companies, sectors or markets identified and described were or will be profitable. All information is current as of the date of herein and is subject to change without notice. Any views or opinions expressed may not reflect those of the firm as a whole. Zacks Investment Research does not engage in investment banking, market making or asset management activities of any securities. These returns are from hypothetical portfolios consisting of stocks with Zacks Rank = 1 that were rebalanced monthly with zero transaction costs. These are not the returns of actual portfolios of stocks. The S&P 500 is an unmanaged index. Visit https://www.zacks.com/performance for information about the performance numbers displayed in this press release.



Want the latest recommendations from Zacks Investment Research? Today, you can download 7 Best Stocks for the Next 30 Days. Click to get this free report



Deere & Company (DE) : Free Stock Analysis Report



Alphabet Inc. (GOOGL) : Free Stock Analysis Report



Sony Corporation (SONY) : Free Stock Analysis Report



To read this article on Zacks.com click here.



Zacks Investment Research","Spatial computing also helps shoppers create a virtual copy of their rooms and see how furniture will look before purchasing it.
Additionally, when spatial computing is deployed on the factory floor, it enables seamless interactions between employees through augmented reality (AR).
Spatial Computing Market Growth PointersAs mentioned earlier, spatial computing is an umbrella concept for various technologies and has found application in nearly every sector of human life.
The company’s expected earnings growth rate for the current year is 18.2% compared with the Zacks Internet - Services industry’s projected earnings growth of 7.2%.
Zacks Investment Research does not engage in investment banking, market making or asset management activities of any securities.",https://finance.yahoo.com/news/zacks-analyst-blog-highlights-sony-114211827.html,2021-04-06 00:00:00
44,GOOGL,"Fitbit launches new fashion forward Fitbit Luxe tracker, its first under Google","The Fitbit Luxe is the company's first tracker since it was acquired by Google's Alphabet. (Image: Fitbit)

Fitbit on Monday announced its first new product as an official part of Google’s Alphabet (GOOG, GOOGL), the fashion forward Fitbit Luxe. Available for pre-order starting today for $149, the Luxe is a tracker with a built-in, color display designed to look like a piece of jewelry rather than a fitness band.

Fitbit is positioning the Luxe as a device that provides consumers with both physical and mental well-being features via the included Fitbit Premium app. Beyond the usual heart rate monitor and sleep tracking Fitbit devices are known for, Fitbit is adding a host of mental wellness options including 200 mindfulness sessions from brands like Aaptiv, Aura, and Deepak Chopra’s Mindful Method.

“We’ve made major technological advancements with Luxe, creating a smaller, slimmer, beautifully designed tracker packed with advanced — some that were previously only available with our smartwatches — making these tools accessible to even more people around the globe,” Fitbit cofounder, vice president, and general manager James Park said in a statement.

Available in three colors — gold, platinum, and matte graphite — the Luxe is compatible with a number of accessories ranging from simple straps to jewelry-like bangles.

The Fitbit Luxe is designed to be accessorized with a number of available bracelets. (Image: Fitbit)

Of course, it wouldn’t be a Fitbit if it didn’t offer a variety of health tracking capabilities. According to Fitbit, the Luxe allows you to track your breathing rate, heart rate variability, resting heart rate, skin temperature and variation, and oxygen saturation. The Luxe also includes 20 on-wrist exercise options including golf, pilates, spinning, and tennis.

Sleep tracking is also included with the Luxe, complete with a Sleep Score that tells you how restful your sleep is and provides you with the means to understand your sleep patterns.

All users will be able to view their overall health status via the Fitbit app, while Fitbit Premium users will be able to track monthly trends and see their own personal ranges.

From the sound of it, the most detailed health data gleaned from the device will only be available through the Fitbit app rather than directly on the Luxe. It’s also worth pointing out that the tracker includes 6 free months of the Fitbit Premium, which works out to a $59 value. After that, you’ll need to start paying for the service, which costs $9.99 per month or $79 for a full year.

Story continues

Fitbit says the Luxe can get up to 5 days of battery life. That’s way more than the Apple Watch, which lasts about a day and a half. The Luxe also offers customizable call, text, and smartphone notifications.

The first big product after a closely scrutinized acquisition

The Luxe is the first new product from Fitbit since Google closed its $2.1 billion acquisition of the firm in January. The deal received heavy scrutiny in both the U.S. and E.U., as regulators raised concerns about Google gaining access to Fitbit users’ health data.

In allowing the acquisition to move forward, the E.U. requires that Google not use Fitbit user data to sell ads for 10 years, with the option to extend that limit by another 10 years. In a presentation Monday, Park made sure to mention that Fitbit user data would be protected under Google.

Fitbit was an early pioneer in the wearable fitness market thanks to the sleek design of its products and features including heart rate tracking. But as smartwatches became more prominent, Fitbit had trouble maintaining its lead.

Google, meanwhile, attempted to get into the smartwatch market with its own Android-powered devices produced by companies ranging from Motorola and Fossil to Huawei. And while WearOS devices, as they are called, are still available, they’ve never become major mainstream hits.

Apple (AAPL), meanwhile, has dominated the smartwatch market with its Apple Watch line, making the company the preeminent wearable maker in the world. And with its lowest priced watch, the Apple Watch 3, priced at just $199, the company has continued to draw fans.

According to IDC, Apple held a whopping 33% global market share in the wearable market as of Q3 2020. Fitbit, meanwhile, controlled just 2.6%.

But with Fitbit and Google now one company, the two could finally put together a serious contender to Apple’s wearable throne — and Luxe could be the first step in that direction.

Sign up for Yahoo Finance Tech newsletter

Got a tip? Email Daniel Howley at dhowley@yahoofinance.com over via encrypted mail at danielphowley@protonmail.com, and follow him on Twitter at @DanielHowley.

More from Dan:

Follow Yahoo Finance on Twitter, Facebook, Instagram, Flipboard, SmartNews, LinkedIn, YouTube, and reddit. Find live stock market quotes and the latest business and finance newsFor tutorials and information on investing and trading stocks, check out Cashay.","The Fitbit Luxe is the company's first tracker since it was acquired by Google's Alphabet.
(Image: Fitbit)Fitbit on Monday announced its first new product as an official part of Google’s Alphabet (GOOG, GOOGL), the fashion forward Fitbit Luxe.
Fitbit is positioning the Luxe as a device that provides consumers with both physical and mental well-being features via the included Fitbit Premium app.
The Fitbit Luxe is designed to be accessorized with a number of available bracelets.
According to IDC, Apple held a whopping 33% global market share in the wearable market as of Q3 2020.",https://finance.yahoo.com/news/fitbit-launches-luxe-tracker-first-under-google-170009718.html,2021-04-06 00:00:00
45,GOOGL,Google’s earnings expected to be bright despite dark antitrust clouds,"When Google parent Alphabet Inc. reports first-quarter earnings on Tuesday, the bottom-line should be stout with advertising sales.

The same can’t be said for its prospects on the regulatory front.

Alphabet GOOGL GOOG is expected to show revenue growth of roughly 25% from last year, when the COVID-19 pandemic caused some companies to immediately...","When Google parent Alphabet Inc. reports first-quarter earnings on Tuesday, the bottom-line should be stout with advertising sales.
The same can’t be said for its prospects on the regulatory front.
Alphabet GOOGL GOOG is expected to show revenue growth of roughly 25% from last year, when the COVID-19 pandemic caused some companies to immediately...",https://www.marketwatch.com/story/googles-earnings-expected-to-be-bright-despite-dark-antitrust-clouds-11619196893,2021-04-06 00:00:00
46,GOOGL,Inclusive democracy is ‘good for the economy’: BNY Mellon Wealth Management CEO,"Hundreds of major companies — including Amazon (AMZN), Google (GOOG, GOOGL), and BlackRock (BLK) — signed a statement this week opposing ""any discriminatory legislation"" that would make it more difficult for people to vote.

The move escalated an ongoing confrontation between corporate America and political officials in the aftermath of a restrictive voting law enacted by Georgia last month, as more than 350 such bills stand before legislatures across 47 states, according to a report from the Brennan Center on April 1. Critics of these laws say they would have a disproportionate impact on Black voters.

In a new interview, BNY Mellon Wealth Management CEO Catherine Keating affirmed the bank's support for inclusive democracy, describing broad access to the polls as ""good for the economy.""

BNY Mellon — founded by Alexander Hamilton in 1784, making it one of the nation's oldest banks — considers itself representative of the overall economy and supports an inclusive political process that in turn strengthens the economic system, Keating said.

Catherine Keating, the CEO of BNY Mellon Wealth Management, speaks with Yahoo Finance Editor-in-Chief Andy Serwer on ""Influencers with Andy Serwer.""

""We think we represent the economy, and so we want to have a an open and working and successful economy,"" says Keating, who worked for nearly two decades at JPMorgan. ""That's really the way that we think about it.""

""We think that democracy is important,"" she adds. ""We think it's one of our greatest strengths.""

""We want as many people to be included in it as possible because we think it's going to be good for the economy and good for everybody,"" she says.

On March 31, 72 Black business leaders signed a public letter that criticized the voting law enacted in Georgia six days prior. The missive set off an uproar in corporate America, prompting Georgia-based companies Delta (DAL) and Coca-Cola (KO) to condemn the law amid intense public pressure.

The Georgia law includes a slew of measures that could make it harder to vote, including reduced access to ballot drop boxes, a ban on mobile voting centers, and making it a misdemeanor to offer food and water to voters in line.

Story continues

Meanwhile two restrictive voting bills under consideration in Texas — House Bill 6 and Senate Bill 7 — would outlaw 24-hour voting and prohibit local election officials from pro-actively sending mail-in ballot applications to voters, even if they qualify.

Most of the top companies in Texas — with the exception of American Airlines (AAL) and Dell (DELL) — passed up the opportunity to criticize the restrictive voting bills in response to an inquiry from Yahoo Finance earlier this week.

Keating spoke to Serwer in an episode of “Influencers with Andy Serwer,” a weekly interview series with leaders in business, politics, and entertainment.

She spent nearly two decades climbing the ranks at JPMorgan, helping the bank weather the Great Recession. In 2014, she jumped to the nonprofit Common Fund, a leading asset manager for endowments and foundations, which she ran until joining BNY Mellon three years ago.

Formerly the chair of the board at her alma mater, Villanova University, she belongs to the Council on Foreign Relations and the Economic Club of New York.

In comments that aligned with her affirmation of the country's democratic system, Keating praised the role that the federal government has played in supporting the economy amid the COVID-19 downturn.

""We think that our policymakers — whether it's the Federal Reserve, or Congress, the Treasury — have really done a great job for us as a country,"" she says.

In response to a question about potential threats to an anticipated economic recovery this year, Keating noted the ongoing COVID-19 risks. But she praised the economic stimulus provided by the federal government.

""Obviously, we are still in the middle of a global pandemic, and so we worry very much about about health and financial health,"" she adds. ""But also, there is more stimulus than we've ever seen before.""

Read more:","In a new interview, BNY Mellon Wealth Management CEO Catherine Keating affirmed the bank's support for inclusive democracy, describing broad access to the polls as ""good for the economy.""
Catherine Keating, the CEO of BNY Mellon Wealth Management, speaks with Yahoo Finance Editor-in-Chief Andy Serwer on ""Influencers with Andy Serwer.""
""We think we represent the economy, and so we want to have a an open and working and successful economy,"" says Keating, who worked for nearly two decades at JPMorgan.
""We want as many people to be included in it as possible because we think it's going to be good for the economy and good for everybody,"" she says.
On March 31, 72 Black business leaders signed a public letter that criticized the voting law enacted in Georgia six days prior.",https://finance.yahoo.com/news/inclusive-democracy-is-good-for-the-economy-bny-mellon-wealth-management-ceo-121200840.html,2021-04-06 00:00:00
47,GOOGL,Alphabet (GOOGL) Outpaces Stock Market Gains: What You Should Know,"This page has not been authorized, sponsored, or otherwise approved or endorsed by the companies represented herein. Each of the company logos represented herein are trademarks of Microsoft Corporation; Dow Jones & Company; Nasdaq, Inc.; Forbes Media, LLC; Investor's Business Daily, Inc.; and Morningstar, Inc.

Copyright 2021 Zacks Investment Research | 10 S Riverside Plaza Suite #1600 | Chicago, IL 60606

At the center of everything we do is a strong commitment to independent research and sharing its profitable discoveries with investors. This dedication to giving investors a trading advantage led to the creation of our proven Zacks Rank stock-rating system. Since 1988 it has more than doubled the S&P 500 with an average gain of +25.35% per year. These returns cover a period from January 1, 1988 through October 4, 2021. Zacks Rank stock-rating system returns are computed monthly based on the beginning of the month and end of the month Zacks Rank stock prices plus any dividends received during that particular month. A simple, equally-weighted average return of all Zacks Rank stocks is calculated to determine the monthly return. The monthly returns are then compounded to arrive at the annual return. Only Zacks Rank stocks included in Zacks hypothetical portfolios at the beginning of each month are included in the return calculations. Zacks Ranks stocks can, and often do, change throughout the month. Certain Zacks Rank stocks for which no month-end price was available, pricing information was not collected, or for certain other reasons have been excluded from these return calculations.

Visit Performance Disclosure for information about the performance numbers displayed above.

Visit www.zacksdata.com to get our data and content for your mobile app or website.

Real time prices by BATS. Delayed quotes by Sungard.

NYSE and AMEX data is at least 20 minutes delayed. NASDAQ data is at least 15 minutes delayed.

This site is protected by reCAPTCHA and the Google Privacy Policy and Terms of Service apply.","This dedication to giving investors a trading advantage led to the creation of our proven Zacks Rank stock-rating system.
Zacks Rank stock-rating system returns are computed monthly based on the beginning of the month and end of the month Zacks Rank stock prices plus any dividends received during that particular month.
A simple, equally-weighted average return of all Zacks Rank stocks is calculated to determine the monthly return.
Only Zacks Rank stocks included in Zacks hypothetical portfolios at the beginning of each month are included in the return calculations.
Certain Zacks Rank stocks for which no month-end price was available, pricing information was not collected, or for certain other reasons have been excluded from these return calculations.",https://www.zacks.com/stock/news/1366532/alphabet-googl-outpaces-stock-market-gains-what-you-should-know,2021-04-06 00:00:00
