,Ticker,Title,Article,Summary,Link,Date
41,AAPL,"Apple's iPad mini gets a powerful, pricier makeover","Apple's latest iPad mini gets a serious power improvement and larger display, but you'll have to pay more for the upgrade compared to the previous generation mini. (Image: Howley)

Apple's (AAPL) newest iPad mini is here. And the 6th-generation version of the pint-size iPad brings major changes. Not only does the latest iPad mini get a redesigned look with a larger display, but it also gets a powerful new processor, and upgraded front and rear cameras.

The tablet also gets a not-so-mini price increase from $399 to $499. That's more than the newly updated 9th-generation iPad, which starts at $329 and gets a larger 10.2-inch display.

For my money, the mini is still the go-to iPad for people looking for a tablet that's easy to schlep to and from the office or just around the house — and also packs a performance punch.

The mini's major makeover

Let's start with the iPad mini's new look. Gone are the large bezels surrounding the mini's display. In their place, Apple has stretched out the screen toward the mini's edges, allowing for a much larger panel.

The mini now gets an 8.3-inch Liquid Retina display in place of the old mini's 7.9-inch Retina display. The change is incredibly welcome, as the mini now fits in with the majority of the iPad line's styling. And let's face it. The prior generation mini was starting to look, well, old.

Despite the changes to the mini, its size hasn't changed all that much. It's actually a hair shorter than the 5th-generation tablet and ever so slightly thicker. It's just as easy to hold and lightweight as its predecessor, albeit with that bigger screen.

Speaking of which, I use my 5th-generation mini for watching the New York Mets lose while simultaneously playing video games with my wife, and as a means to stream ""Jeopardy"" while I run on the treadmill. I also bring it with me on trips to serve as my TV, because I need one to fall asleep at night. Don't judge me.

The iPad mini's larger display means you get more content on screen at once without having to hold a significantly larger device. (Image: Howley)

Story continues

For all of those reasons, I've always wanted the mini to get a larger screen, and the new version delivers. If you use your iPad as a secondary computer, the screen will give you more space to write up reports and compile spreadsheets (or whatever it is people with real jobs do).

That said, if you're looking for an iPad to completely replace your laptop, the mini might not be your best bet simply because it's far smaller than a traditional 13-inch laptop or even the 11-inch iPad Pro. Other iPads like the 9th-generation iPad and its 10.2-inch screen — or 4th-generation iPad Air and its 10.9-inch display — are better choices as full-on laptop replacements.

Power, performance, and Apple Pencil

Beyond its updated look and screen, the iPad mini also gets Apple's powerful new A15 Bionic chip. The same silicon found in the upcoming iPhone 13, Apple says the A15 Bionic provides an 80% performance boost over the 5th-generation mini, and based on benchmarks I've run, that about adds up.

Using Geekbench 5, a benchmarking app that measures CPU and GPU performance, the A15 in the new mini handedly beats out the prior generation mini and its A12 Bionic chip.

In real world use, the new iPad mini is as zippy as you'd expect. While using the photo editing app Pixelmator, I erased objects from shots in a blink, while the older iPad mini took a beat or two to make those same objects vanish. Games like 'Genshin Impact' also ran a bit smoother on the 6th-generation mini than on the 5-generation.

The iPad mini is now compatible with the Apple Pencil 2, meaning it can pair with and charge the stylus wirelessly. (Image: Howley)

All of that is to say, the new mini won't hit you with any slowdown while you’re using apps, playing games, or streaming video.

The 6th-generation iPad mini is also compatible with Apple's 2nd-generation Apple Pencil, so you can wirelessly charge and sync the pencil to the tablet to take notes or sketch.

Center Stage and USB C

Like the iPad Pro and new 9th-generation iPad, the mini's FaceTime camera gets Apple's Center Stage technology. The feature automatically centers you when you're making FaceTime calls. During a call with my parents and my nephew, I was able to move around near the tablet, and the camera quickly recentered me. If you have more than one person on your side of the conversation, the camera will zoom out to capture you both.

One important thing to point out about the iPad mini is that it now uses USB C rather than a Lightning connector. That means if you're coming from an older iPad mini, you're going to have to ditch your old cables.

While it's a pain, the new connection will allow for faster data transfer rates, as well as the ability to connect additional accessories to your tablet. For instance, if you're a photographer, you'll be able to connect it directly to the mini and instantly see your photos on the tablet.

Finally, battery life for the iPad mini is more or less unchanged from the prior generation model, meaning it will last you all day and let you stream movies without dying before the final act.

Should you get it?

The iPad mini has been my personal favorite iPad for years. And while its new $499 price tag is a little rich, for many people it's likely still worth it for the larger display and improved performance.

Still. if you're looking for something a bit less expensive, there's always the $329 9th-generation iPad. For my money, though, the iPad mini is a winner.

Sign up for Yahoo Finance Tech newsletter

More from Dan

Follow Yahoo Finance on Twitter, Facebook, Instagram, Flipboard, LinkedIn, YouTube, and reddit

Got a tip? Email Daniel Howley at dhowley@yahoofinance.com over via encrypted mail at danielphowley@protonmail.com, and follow him on Twitter at @DanielHowley.","Apple's latest iPad mini gets a serious power improvement and larger display, but you'll have to pay more for the upgrade compared to the previous generation mini.
Power, performance, and Apple PencilBeyond its updated look and screen, the iPad mini also gets Apple's powerful new A15 Bionic chip.
One important thing to point out about the iPad mini is that it now uses USB C rather than a Lightning connector.
That means if you're coming from an older iPad mini, you're going to have to ditch your old cables.
The iPad mini has been my personal favorite iPad for years.",https://finance.yahoo.com/news/apple-ipad-mini-review-130042886.html,23/9/2021 0:00
42,AAPL,Epic Won a Small Battle With Apple. Which Tech Giant Will Come Under Fire Next?,"Apple (NASDAQ:AAPL) recently scored a court victory against Epic Games, which sued the tech giant over its App Store. Epic did get one small win, though, and Epic's battle against big tech isn't over. Other companies could have to make changes as a result of the ruling. In this Motley Fool Live ""The 5"" segment recorded on Sept. 15, Motley Fool contributors Jason Hall, Toby Bordelon, and Nicholas Rossolillo discuss which tech giants could come under fire next.

Jason Hall: Toby, I know you've been dying to talk about this, Apple versus Epic. We got the ruling. Was it Thursday or Friday last week that are dropped? Anyway, you couldn't talk about it because we're talking about other stuff for three days.

Toby Bordelon: Yeah, it was Friday. It's actually Friday after market close. I think it was after market close. I'm ready for the weekend and boom, we get this decision dropped on us, which is pretty substantial. We got a decision in the Apple-Epic lawsuit. Now, remember, Epic sued Apple for various antitrust violations for anti-competitive practices related to the App Store, specifically Fortnite. They had disputes over the payment mechanisms for in-app purchases at Fortnite that led to Fortnite being ejected from the App Store, totally kicked off the iOS platform. Epic ended up suing. There were a lot of issues raised in this case, a lot of interesting issues. We don't have time to go into all the details now, but functionally, what happened for the most part is Apple won. Epic made 10 claims and Apple basically won on nine counts, 9 out of 10. The biggest one I think was that the judge explicitly said Apple is not a monopoly in the mobile gaming space. That was a nice ruling for Apple. But the point that Epic did win on, which is interesting and actually, when you think of the implications seems relatively minor, but there's going to be a change because of this. What Apple had done is they had told the developers, ""You can't tell your customers about other options to pay for your goods and services outside of the ad."" For instance, think about a company like Netflix (NASDAQ:NFLX). I think actually Netflix is a separate deal. But in theory, according to those rules, Netflix would not be able to say, ""Go to our website and sign up, and then just watch on the app.""

Hall: Without explicit permission from Apple to do so.

Bordelon: Yeah, exactly. The judge basically said, ""You can't do that."" You can't stop developers from saying that. You can't even stop them from linking out to the alternative payment mechanism. But also the judge said Apple's not actually required to allow developers to put a separate in-app payment mechanism and they can still require developers to use their own in-app payment system. The way things look, I understand, Apple can say, ""You must use our system for in-app payments, but you are of course allowed to tell people they can go outside the app to pay for stuff, if they want to."" Clearly, that's the change Apple has to make. They had to allow that to happen. But if you're a user, you've got your iPhone, you click on your app, you said, ""Oh, you can either click on this button to buy now through Apple system or you can go out to this other website and process the payment,"" I mean, it's real easy.

Hall: There's only two ways to do this. Either you create some kind of financial incentive for the customer and on these micro-transactions, is it big enough to soak up that 15 or 30 percent? It's should go to Apple anyway.

Bordelon: You have to counteract the laziness.

Hall: Right. Or you create a bad customer experience by forcing them to do it. Those are your only two choices and it's not ideal.

Bordelon: Right. I'm not sure how big of a blow to Apple's bottom line this is really going to be. If it holds up, Epic is going to appeal.

Hall: Oh, it's not done. That's the thing.

Bordelon: Yeah. Epic is going to appeal. This could go on for a way. But with that as a background, given where we are now, Apple is going to have to make a tweak of some sort to the App Store. Here's the question, guys. What's the next big tech company not named Apple that's going to have to make changes to their products or services because of an antitrust lawsuit or changes in the law? Think about Congress might come in and do something because they don't like what the courts are doing. What big company you think is going to have to make changes because of antitrust issues or related legal requirements that may be coming down the pipe? What do you think, Nick?

Nicholas Rossolillo: I think [Alphabet's (NASDAQ:GOOGL)(NASDAQ:GOOG)] Google absolutely is the next one. Interestingly, I think this gets overlooked. Epic filed a lawsuit against Google as well, against the Google Play store. Their angle was a little bit different, basically, where they were accusing Apple of that 30 percent take that Apple gets every time someone makes a purchase on the store or an in-app purchase, they weren't really going that route with Google. They were accusing Google basically of trying to prevent the Epic Store from getting on Android devices. A different angle, but still a potential issue where it appears that Google was trying to use its duopoly with Apple in controlling the world's smartphone market and mobile market to keep a potential competitor off of its platform. One of the accusations Epic even made was that Google at one point attempted a hostile takeover in order to keep the Epic Store at bay. That's still a pending lawsuit, that's going to work through the courts, but I think that's the most obvious business that is going to have to make some adjustments next, after Apple does.

Hall: I'll hop in here next. From what I've seen, I've been reading and paying attention a little bit more to this with Nvidia's (NASDAQ:NVDA) bid to acquire ARM. It seemed like initially when it was first announced, it's like, ""Whoa, that's a big deal. Is it going to happen?"" Then it was like, ""Yeah, OK. This is going to happen."" Now, more recently, I think there is substantial risk to UK regulators because ARM Holdings is a UK-based company and it's not just domicile there. That's where a large percentage of its staff is, it's truly headquartered in the UK. It could get blown up. UK regulators could stop it. I mean, this might not even necessarily end up in the court. The regulators could disapprove it and keep it from happening. Now, with that said, I think that as an Nvidia investor and Nvidia shareholder, yeah, it's a big win to own ARM, to bring that in, and that could really supercharge a company started growing at a very high rate. But Nvidia doesn't need to own ARM to continue to be a big winner. It's incredibly innovative, the things that they are involved in are really powerful. They don't need to add that ARM architecture, and the importance that ARM architecture has to so many other companies that do all of their own design work for semiconductors, they don't have to have that to continue to be a big winner. I think there's a lot more say for ARM investors remaining a separate company. I think somebody maybe in The Wall Street Journal that said, if not Nvidia then who? It's almost inevitable that ARM becomes part of a larger company. But as an Nvidia shareholder, I'm not particularly concerned that this deal looks like it very well. I think at this point it's maybe 50/50. Toby.

Bordelon: Yeah. I'd even go further than that, Jason. If I had to guess right now, my gut says this deal doesn't happen.

Hall: Yeah. If you're investing manager, you have to invest with that assumption.

Bordelon: Yeah, I'm leaning toward, and you have an issue too, is China taking a look at this, and it seems from what I can tell Nvidia didn't bother to file the paperwork for trying to review until just recently, and now they're listing ""We have to get this done by the next year."" China's not going to be rushed. But if anything, they're going to use to make an example, if you think we are last in line and you're going to push us off like everyone else well, we're just going to make you wait eight, nine months before we begin to open up your file. That's an issue. I could see ARM is independent for some time. I could see SoftBank (OTC:SFTBF) just spinning them off as a separate publicly traded company potentially. But I don't know how sustainable that is, long term. To your question, if not Nvidia then who? I'm not sure I have an answer. I can't think of anyone that doesn't have issues. I can't think of an obvious buyer that wouldn't have any trust issues.

Hall: If you're not going to let Nvidia, you're not going to let Intel (NASDAQ:INTC).

Bordelon: There's no way.

Hall: No way.

Rossolillo: I know Qualcomm (NASDAQ:QCOM) said they promise to invest in ARM if it was spun-off as an independent company.

Hall: That's true.

Bordelon: Yes. You can see that. You can see maybe Qualcomm, if not buying and taking a minority stake, which could make some sense on that. But yes, issuing, and I also agree with you, Nick, on the Google thing and I think that lawsuit almost looks like it could come down a lot harder on Alphabet than Apple's ended for them. There are some issues there that are very interesting so we'll have to see how that plays out. I'm afraid I want a different one too. I'm just going to throw out Facebook (NASDAQ:FB) here. A couple of weeks ago, they got sued again by the FTC trying to force a sale of Instagram and WhatsApp. They had done it before, and this case was dismissed and now they're back trying a different angle. I'm skeptical at this point that a breakup will be the net result of this. But I do think something's going to happen with them. I think it's inevitable that either, of course, Congress are going to impose some restrictions. You could see things like restrictions on daily use between divisions saying, ""Well, you don't have to break it off, but you're limited on what you can do between sharing info between Facebook and Instagram and WhatsApp, potentially."" Maybe more privacy protections, maybe some rules on how they enforce their terms of service because that's come out recently about is it done equally across all people or do they have rules that actually don't necessarily apply to some people and what does that mean? Facebook's in a bad place. I think they've irritated a lot of people and a lot of different regulators and Congress have taken a look. I feel like something is probably going to happen but I don't know that it'll be an actual breakup of the company, but definitely a field to watch. There is a lot of action here right now. Politically, I think a lot of people in Congress can get some traction by saying, ""I'm protecting my constituents from the big, bad tech companies."" That's something to watch.

Hall: Well, in fairness, I think what's happening with ARM, UK regulatory bodies are looking at a UK-based company with UK-based employees being acquired by a foreign company. What happens to those jobs? What happens to that intellectual property and assets [laughs] that was built and created there.

Bordelon: We do that all the time here in United States.

Hall: Oh yeah, of course we do.

Bordelon: Through national security layers over antitrust review all the time.","Apple (NASDAQ:AAPL) recently scored a court victory against Epic Games, which sued the tech giant over its App Store.
Epic did get one small win, though, and Epic's battle against big tech isn't over.
Jason Hall: Toby, I know you've been dying to talk about this, Apple versus Epic.
Now, remember, Epic sued Apple for various antitrust violations for anti-competitive practices related to the App Store, specifically Fortnite.
Epic made 10 claims and Apple basically won on nine counts, 9 out of 10.",https://www.fool.com/investing/2021/09/21/epic-won-a-small-battle-with-apple-which-tech-gian/,21/9/2021 0:00
43,AAPL,"New Apple (AAPL) iPhone 13, Apple Watch Series 7, iPad Mini, too confused which one to buy?","The Starters

The company on Tuesday ushered in iPhone upgrades focused almost entirely on cameras, it enlarged the screen on the Apple Watch for the second time in that product’s history, added a newer processor and front camera to its cheapest iPad, and revived the iPad mini as something akin to a smaller iPad Air.

After a slew of major product updates last fall at the height of the pandemic, Apple’s latest launch event was an exercise in incrementalism. And that’s not a bad thing.

While the new devices have excited many Apple fans, the upgrades left some people itching for more—and they may have to wait awhile. While I’d still expect new MacBook Pros and AirPods by the end of 2021, I don’t anticipate anything groundbreaking for at least another year.

2022 is certain to be a stronger showing, with as many as three new Apple Watch models, a major iPhone upgrade, revamped Mac Pros and MacBook Airs with Apple Silicon, new AirPods Pro earbuds, and an updated iPad Pro design. Oh, and don’t forget a potential preview of Apple’s future mixed-reality headset.

But Apple doesn’t launch new devices just to please people who upgrade every year. If you skipped the iPhone 12 and get the iPhone 13, you’re obviously gaining two years of new features. That’s pretty enticing.

Also don’t ignore what else the company has cooking in its labs: an all-new home device that combines a HomePod with an Apple TV and FaceTime camera, Apple Watches with even more health sensors, a foldable iPhone and true AR glasses. I wouldn’t start clamoring for any of these yet, though, as all of them are probably still between two and four years away.

iPhone 13 and iPhone 13 Pro

The incremental update to the iPhone isn’t a surprise. Typically Apple does a minor iPhone upgrade as a follow-up to a major overhaul—in this case, last year’s iPhone 12. According to some company watchers, it might have made more sense to call the new phones the 12S (the branding style Apple uses for smaller advances), but that would have been bad marketing. Calling it the iPhone 13 makes it seem like a more worthy upgrade. And I think it’s certainly fair, given the breadth of the camera hardware changes and the fact that this is only the second year of a critical 5G transition. Apple’s “S” editions typically include a major processor update, significant camera improvements and a standout feature. The 3GS, for instance, added a faster processor, a camera that could record video, and voice control. The 4S got 1080P video recording, the first dual-core iPhone chip and Siri. The 5S had the first 64-bit Apple chip, a new camera flash and Touch ID. You get the point.

The iPhone 13 has upgraded camera hardware, but the new processor appears to be a smaller step up. The company is comparing its CPU and GPU speeds to the rest of the industry, not the iPhone 12’s A14. That means Apple touted that its speeds were 50% faster than Android rivals, rather than focusing on the 10%-to-20% gain compared with its own phone. The iPhone 13 and iPhone 13 Pro lines lack the usual cool “S” feature—unless you count a slightly narrower notch (which is nice) and the addition of ProMotion (finally!). I’d also add that the Cinematic mode and Photographic Styles features, at the very least, probably could have been enabled on the iPhone 12 with a software update. But, of course, Apple needs reasons for you to upgrade.

Perhaps the biggest surprise for the iPhone this year is the lack of price hikes and the device’s near-immediate availability. Despite the ongoing impact of Covid-19 on chips and the supply chain, the new iPhones were available for preorders on Friday and are set to arrive in stores later this week. And while other technology companies have warned of price increases, Apple’s pricing has remained constant.

Because the latest carrier deals will make it possible for me to get an iPhone 13 Pro Max at essentially no cost, I’m looking forward to turning in my 12 Pro Max. But if you have an iPhone 12 and you aren’t eligible for such a deal, I would suggest holding off for another year—unless the new camera is a must for you. Apple Watch Series 7

While the iPhone 13 didn’t suffer from supply-chain hiccups, Apple wasn’t so fortunate with its smartwatches. The company didn’t give a release date for the new Series 7 line, simply saying it would be “later this fall”—a sign that product delays are taking a toll. And though the latest models will get a 20% larger screen, not much else is new. As I wrote before the device was announced, the bigger display offers about 16% more pixels on the new 45-millimeter version and represents a screen-size increase from about 1.78 inches to just over 1.9 inches.

News Summary:

New Apple (AAPL) iPhone 13, Apple Watch Series 7, iPad Mini, too confused which one to buy?

Check all news and articles from the latest Security news updates.","If you skipped the iPhone 12 and get the iPhone 13, you’re obviously gaining two years of new features.
iPhone 13 and iPhone 13 ProThe incremental update to the iPhone isn’t a surprise.
The iPhone 13 and iPhone 13 Pro lines lack the usual cool “S” feature—unless you count a slightly narrower notch (which is nice) and the addition of ProMotion (finally!).
Apple Watch Series 7While the iPhone 13 didn’t suffer from supply-chain hiccups, Apple wasn’t so fortunate with its smartwatches.
News Summary:New Apple (AAPL) iPhone 13, Apple Watch Series 7, iPad Mini, too confused which one to buy?",https://www.bollyinside.com/news/new-apple-aapl-iphone-13-apple-watch-series-7-ipad-mini-too-confused-which-one-to-buy,2021-09-24 23:44:24+00:00
