,Ticker,Title,Article,Summary,Link,Date
132,AAPL,Apple Inc (NASDAQ: AAPL) Must Make Up its Mind On The Way Forward Regarding the 30% Fee after Court Ruling,"The judge still left an opening for Apple Inc (NASDAQ: AAPL) to pursue a 30% commission still, even though it might be pretty complicated for it. In other words, the mobile app developers that have constantly launched complaints about the high fee aren’t yet out of the woods.

Yvonne Gonzalez speaks out

It was a 185-page decision that most people thought would jeopardize the company’s App Store revenue stream a great deal, but that wasn’t the case. Instead, analysts say that the company still has an excellent opportunity to keep its revenue streams intact. It just needs to be smart about how it goes about revenue collection.

U.S. District Judge Yvonne Gonzalez Rogers speaks about the new twist in events, outlining that Apple is restricted in some ways. For example, it no longer reserves the right to ban developers from using external links, buttons, or the call to action to push customers to resort to alternative purchase methods.

Cook’s defense

Apple Chief Executive Officer Tim Cook says they have been considering developing a different system to help the company invoice the app developers. Still, each time they realize that it could be a great mess. The judge posed a question to Cook, and he wanted to get his thoughts about a case where payments could be made outside. Cook said that the developers who would collect payments from consumers outside the platform would still need to give Apple its dues.

Cook believes straightening matters in the way the court purports requires the development of a pretty complex system. It should be a system that can track the exact amount of money that developers collect from consumers and then cut a portion that goes to the company.

Apple is going through a rough patch, with many lawmakers and regulators exerting pressure on it. They want it to loosen its grip when it comes to the distribution of apps.","The judge still left an opening for Apple Inc (NASDAQ: AAPL) to pursue a 30% commission still, even though it might be pretty complicated for it.
In other words, the mobile app developers that have constantly launched complaints about the high fee aren’t yet out of the woods.
U.S. District Judge Yvonne Gonzalez Rogers speaks about the new twist in events, outlining that Apple is restricted in some ways.
Cook’s defenseApple Chief Executive Officer Tim Cook says they have been considering developing a different system to help the company invoice the app developers.
Cook believes straightening matters in the way the court purports requires the development of a pretty complex system.",https://www.journaltranscript.com/2021/09/apple-inc-nasdaq-aapl-must-make-up-its-mind-on-the-way-forward-regarding-the-30-fee-after-court-ruling/,2021-09-22 18:17:55+00:00
133,AAPL,Jamf Sets Same-Day Support For Apple's Fall Launches,Thank you for subscribing! If you have any questions feel free to call us at 1-877-440-ZING or email us at vipaccounts@benzinga.com,"Thank you for subscribing!
If you have any questions feel free to call us at 1-877-440-ZING or email us at vipaccounts@benzinga.com",https://www.benzinga.com/news/21/09/23017566/jamf-sets-same-day-support-for-apples-fall-launches,2021-09-22 18:17:55+00:00
134,AAPL,Apple Threatens Facebook With Ban Over Instagram Human Trafficking Ads: Report,"According to a BBC report, Apple (NASDAQ: AAPL) threatened to ban Facebook Inc. (NASDAQ: FB) photo-based social media platform Instagram from its iOS App Store after recent reports of slaves for sale being advertised on the platform.

What Happened: A mid-September Wall Street Journal investigation accused Facebook of a weak response to the activities of drug cartels and human traffickers.

Hashtags — mostly in Arabic — used by users in Saudi Arabia and Kuwait purportedly featured sale ads for the illegal buying and selling of domestic workers for a few thousand dollars and categorized by race.

The women sold were reportedly deprived of their basic rights, unable to leave and at risk of being sold again in a condition that amounted to slavery. The trades were carried out using multiple apps including Instagram — owned by Facebook, which allegedly knew about and had been investigating the online slave trade since at least 2018.

After a 2019 BBC report on the issue, Facebook banned the main hashtag used for slave sale ads and banned hundreds of Instagram accounts, but as of press time, the ads are still present under different hashtags. BBC alerted both Alphabet Inc.(NASDAQ: GOOG) (NASDAQ: GOOGL) and Apple of slaves being sold through apps available on their app stores breaching their rules for app developers.

Google said it was ""deeply troubled"" by the findings while Apple said that it expected the developers — namely Facebook — to take ""immediate corrective actions."" The activity continuing until the present time resulted in Apple threatening Facebook with the removal of its app from its store.

FB Price Action: Facebook's stock is seemingly unaffected by the report and gained 0.8% Thursday to close at $345.96.

See Also: BEST BLUE CHIP STOCKS","According to a BBC report, Apple (NASDAQ: AAPL) threatened to ban Facebook Inc. (NASDAQ: FB) photo-based social media platform Instagram from its iOS App Store after recent reports of slaves for sale being advertised on the platform.
What Happened: A mid-September Wall Street Journal investigation accused Facebook of a weak response to the activities of drug cartels and human traffickers.
Hashtags — mostly in Arabic — used by users in Saudi Arabia and Kuwait purportedly featured sale ads for the illegal buying and selling of domestic workers for a few thousand dollars and categorized by race.
After a 2019 BBC report on the issue, Facebook banned the main hashtag used for slave sale ads and banned hundreds of Instagram accounts, but as of press time, the ads are still present under different hashtags.
The activity continuing until the present time resulted in Apple threatening Facebook with the removal of its app from its store.",https://www.benzinga.com/tech/21/09/23071990/apple-threatens-facebook-with-ban-over-instagram-human-trafficking-ads-report,2021-09-22 18:17:55+00:00
135,AAPL,Something Wicked This Way Comes: Trailer For 'The Tragedy Of Macbeth' Goes Online,"The first trailer of one of the most anticipated — if unlikely — film releases of the year has been released online: “The Tragedy of Macbeth” starring Denzel Washington and Frances McDormand and released by Apple Inc.’s (NASDAQ: AAPL) Apple TV+ and A24.

What Happened: Directed and produced by Joel Coen, working for the first time outside of a collaboration with this brother Ethan, “The Tragedy of Macbeth” reimagines the Shakespearean drama in artistically bleak black-and-white cinematography in minimalist settings. The lead actors do not speak in the trailer, with the only dialogue coming from Kathryn Hunter’s witch who predicts the arrival of Macbeth into the launch of catastrophic circumstances.

“The Tragedy of Macbeth” will premiere on Sept. 24 as the opening night selection of the New York Film Festival, with a theatrical engagement starting on Dec. 25. Apple TV+ will offer the film for streaming on Jan. 14, 2022.

Why It Matters: Not unlike the superstitions and jinxes that many theatrical performers attribute to “The Scottish Play,” film productions of “Macbeth” have been plagued with problems. Orson Welles’ 1948 adaptation was burdened by a shoestring budget imposed by cheapjack Republic Pictures, and the film was withdrawn after its premiere and re-edited, with the actors’ originally Scottish-tinged accents replaced with Americanized speech patterns. The revised version was a commercial failure and Welles was forced to relocate to Europe to continue his filmmaking endeavors.

Laurence Olivier’s effort to mount a film of “Macbeth” starring himself and his wife Vivien Leigh came to naught, a crushing professional embarrassment for the actor considered by many to be the century’s finest Shakespearean.

Roman Polanksi’s 1971 production, his first film following the murder of his wife Sharon Tate by members of the Manson Family cult, was financed by Playboy publisher Hugh Hefner when no Hollywood studio would touch it. The film was criticized for its violence and nudity and failed at the box office despite being named Best Picture by the National Board of Review.

The most recent film version of “Macbeth” was Australian director Justin Kurzel’s 2015 production starring Michael Fassbender and Marion Cotillard. That film only grossed $16 million globally, falling far short of its $20 million budget and continuing the troubled cinematic legacy associated with the source material.

Photo: Denzel Washington as Macbeth in ""The Tragedy of Macbeth,"" courtesy of Apple TV+ and A24.","The first trailer of one of the most anticipated — if unlikely — film releases of the year has been released online: “The Tragedy of Macbeth” starring Denzel Washington and Frances McDormand and released by Apple Inc.’s (NASDAQ: AAPL) Apple TV+ and A24.
“The Tragedy of Macbeth” will premiere on Sept. 24 as the opening night selection of the New York Film Festival, with a theatrical engagement starting on Dec. 25.
Apple TV+ will offer the film for streaming on Jan. 14, 2022.
The most recent film version of “Macbeth” was Australian director Justin Kurzel’s 2015 production starring Michael Fassbender and Marion Cotillard.
Photo: Denzel Washington as Macbeth in ""The Tragedy of Macbeth,"" courtesy of Apple TV+ and A24.",https://www.benzinga.com/news/21/09/23035318/something-wicked-this-way-comes-trailer-for-the-tragedy-of-macbeth-goes-online,2021-09-22 18:17:55+00:00
136,AAPL,"Robinhood Said To Be Testing Long-Awaited Wallet, Transfer Features For Cryptos Like Bitcoin, Ethereum, Dogecoin","The long-awaited feature of cryptocurrency wallets and transfers on Robinhood Markets Inc (NASDAQ:HOOD) could be coming soon.

What Happened: Robinhood is testing crypto wallets and crypto transfers on its app, according to Bloomberg.

The new feature would allow users the ability to send and receive cryptocurrencies supported on the app like Bitcoin (CRYPTO: BTC), Ethereum (CRYPTO: ETH) and Dogecoin (CRYPTO: DOGE).

A beta version for the Robinhood app on Apple Inc (NASDAQ:AAPL) iPhones shows a waitlist page for signing up for a crypto wallet feature from the company. Bloomberg also reports that code referencing cryptocurrency transfers was found in the app.

Robinhood also teased crypto wallets on Twitter on Monday, asking users “What is one product feature you would love to see and why wallets?” The post was retweeted by Vlad Tenev with a gif of John Travolta looking around from inside a wallet.

Related Link: Robinhood Markets Says Working On Crypto Wallets But Doing So At Scale Is Difficult

Why It’s Important: Many cryptocurrency fans have called out Robinhood for not offering wallets and used the phrase “Not your keys, Not your coins.”

Robinhood had discussed adding wallets earlier this year but was also cautious explaining they want to do it right.

Having crypto wallets integrated on Robinhood would allow users to use cryptocurrencies without having to convert them to dollars.

The move by Robinhood could also place pressure on Coinbase Global Inc (NASDAQ:COIN), which has likely benefitted from dissatisfaction surrounding Robinhood’s existing crypto policies and limited offerings.

Price Action: HOOD shares were down 4% to $40.70 on Monday and saw a slight jump on the news report from Bloomberg in after-hours trading.

Photo: Courtesy of Robinhood.","The long-awaited feature of cryptocurrency wallets and transfers on Robinhood Markets Inc (NASDAQ:HOOD) could be coming soon.
What Happened: Robinhood is testing crypto wallets and crypto transfers on its app, according to Bloomberg.
The new feature would allow users the ability to send and receive cryptocurrencies supported on the app like Bitcoin (CRYPTO: BTC), Ethereum (CRYPTO: ETH) and Dogecoin (CRYPTO: DOGE).
A beta version for the Robinhood app on Apple Inc (NASDAQ:AAPL) iPhones shows a waitlist page for signing up for a crypto wallet feature from the company.
Having crypto wallets integrated on Robinhood would allow users to use cryptocurrencies without having to convert them to dollars.",https://www.benzinga.com/markets/cryptocurrency/21/09/23022420/robinhood-said-to-be-testing-long-awaited-wallet-transfer-features-for-cryptos-like-bitcoi,2021-09-22 18:17:55+00:00
137,AAPL,Is Apple's Stock Overvalued Or Undervalued?,"Apple Inc (NASDAQ: AAPL) shares have lagged the S&P 500 in 2021, generating a year-to-date total return of just 12.6%. Apple is still putting up impressive growth numbers.

But with a $2.54 trillion market cap, some investors are wondering if there’s any value left in Apple stock.

Earnings: A price-to-earnings ratio (PE) is one of the most basic fundamental metrics for gauging a stock’s value. The lower the PE, the higher the value. For comparison, the S&P 500’s PE is currently at about 34.6, more than double its long-term average of 15.9.

Apple’s PE is currently 29.4. While that number is certainly under the S&P 500 average as a whole, Apple’s PE has more than doubled over the past five years, suggesting its valuation has become fairly stretched.

Related Link: Is Now The Time To Buy Ford, GM And These 4 Other Undervalued Stocks?

Growth: Looking ahead to the next four quarters, the S&P 500’s forward PE ratio looks much more reasonable at just 20.7. Unfortunately, Apple’s forward earnings ratio of 26 doesn’t make the stock undervalued at its current price. In fact, it appears to be fairly valued compared to technology sector peers that are currently averaging a 26.4 forward earnings multiple.

However, when it comes to evaluating a stock, earnings are not everything.

Growth rate is also critical for companies that are rapidly building their bottom lines. The price-to-earnings-to-growth ratio (PEG) is a good way to incorporate growth rates into the evaluation process. The S&P 500’s overall PEG is currently about 1; Apple’s PEG is 1.49, again suggesting valuation upside may be limited.

Price-to-sales ratio is another important valuation metric, particularly for unprofitable companies and growth stocks. The S&P 500’s PS ratio is currently 3.1, nearly twice its long-term average of 1.62. Apple’s PS ratio is 7.3, which is not exactly what value investors are looking for.

The Verdict: At its current valuation, Apple stock isn’t showing any clear signs of being overvalued. Unfortunately, it doesn’t seem to be particularly undervalued either.","For comparison, the S&P 500’s PE is currently at about 34.6, more than double its long-term average of 15.9.
Apple’s PE is currently 29.4.
Growth: Looking ahead to the next four quarters, the S&P 500’s forward PE ratio looks much more reasonable at just 20.7.
Unfortunately, Apple’s forward earnings ratio of 26 doesn’t make the stock undervalued at its current price.
The Verdict: At its current valuation, Apple stock isn’t showing any clear signs of being overvalued.",https://www.benzinga.com/top-stories/21/09/22992899/is-apples-stock-overvalued-or-undervalued,2021-09-22 18:17:55+00:00
138,AAPL,"This Clean Energy Stock Has Better 1-Year Returns Than Tesla, Nio, Apple And Plug Power - FuelCell Energy (FCEL)","FuelCell Energy Inc (NASDAQ:FCEL), a stock that was listed in the early 1990s and peaked at the $5,000 mark two decades ago only to come down to trade in single-digit levels, has still fetched handsome returns over the past one year.

The Danbury, Connecticut-based company's stock has in the past quarter seen a jump in revenue and a narrower loss, and while it is much smaller in stature and size with a market capitalization of $2.25 billion, the stock has fared better than bigger companies such as Tesla Inc (NASDAQ:TSLA), Apple Inc (NASDAQ:AAPL), Nio Inc (NYSE:NIO) and peer Plug Power Inc (NASDAQ:PLUG).

FuelCell designs, manufactures, operates and services Direct Fuel Cell power plants. The company relies mostly on services for revenue and has in the past quarter reported a handsome jump in those numbers. But that's a one-off and the year-to-date numbers still fail to impress.

The Financial Conundrum: The company reported third-quarter numbers earlier this week. Revenue jumped 43% to $26.8 million for the quarter ended July 31, lifted by a $7.2 million increase in service agreements and license revenues. Analysts were expecting $20.69 million. Loss per share narrowed to $0.04 from $0.07, beating the estimate of $0.05.

It reported a backlog of $1.3 billion during the quarter was down 2.25%, implying it is not securing any big contracts.

Through July 31, FuelCell Energy sold about 44 million shares under the Open Market Sales Agreement, generating net proceeds of $369 million. The company ended the third quarter with cash and cash equivalents worth $494 million, compared with $192.1 million as of Oct. 31, 2020.

Shares jumped about 9% in the week after those announcements.

FuelCell, which reports earnings on a calendar year basis, has improved its year-to-date revenue but now has a wider loss. Revenue rose a little over 1% to $19.9 million, compared with a year ago. Net loss widened to $76.87 million so far this year, from $70.2 million a year ago.

FuelCell shares had shot up in February this year on speculation that President Joe Biden’s administration might lift spending on hydrogen fuel cells.

See Also: FuelCell Energy Charges Up After Earnings: What's Next For The Stock?

Return Over 1-Year: Here’s how FuelCell Energy’s stock performance stacks up against major companies and peers in the clean energy industry in the last 12-months:

FuelCell Energy shares are down 38.27% so far this year as of Friday’s close. The stock is however up from $2.59 a share in September last year to $6.55, a return of 152.9%. On a five-year basis, the stock is down 89.68%.

Tesla shares are up 4.07% so far this year. The stock is up from $449.39 a share last September to $759.49, a return of 69%. On a five-year basis, Tesla stock has returned 1,730.54% gains.

Nio shares are down 29.87% so far this year. The stock is up from $18.81 a share in September last year to $37.51, a return of 99.42%. On a five-year basis, the U.S.-listed Nio has returned 278.89% gains.

Plug Power shares are down 17.7% so far this year. The stock is up from $13.36 a share in September last year to $26.4, a return of 98.13%. On a five-year basis, Plug Power has returned 1523.9% gain.

Photo: Courtesy of Fuel Cell Energy","The company relies mostly on services for revenue and has in the past quarter reported a handsome jump in those numbers.
Through July 31, FuelCell Energy sold about 44 million shares under the Open Market Sales Agreement, generating net proceeds of $369 million.
FuelCell, which reports earnings on a calendar year basis, has improved its year-to-date revenue but now has a wider loss.
The stock is however up from $2.59 a share in September last year to $6.55, a return of 152.9%.
The stock is up from $13.36 a share in September last year to $26.4, a return of 98.13%.",https://www.benzinga.com/trading-ideas/long-ideas/21/09/22992386/this-clean-energy-stock-has-better-1-year-returns-than-tesla-nio-apple-and-plug-power,2021-09-22 18:17:55+00:00
139,AAPL,Can Reddit Save the Faltering Price Action in BlackBerry Stock?,Can Reddit Save the Faltering Price Action in BlackBerry Stock?,Can Reddit Save the Faltering Price Action in BlackBerry Stock?,https://investorplace.com/2021/09/can-reddit-save-the-faltering-price-action-in-blackberry-bb-stock/,2021-09-23 18:44:49+00:00
140,AAPL,Should you invest in Apple stock after predicting 5M iPhone pre-orders in China?,"Md Motiur enjoys researching how companies are solving challenges the world will face over the coming decades. In his… read more

On Wednesday, Apple Inc. (NASDAQ:AAPL) published a report saying that it expects five million iPhone pre-orders from China amid initial high demand for the iPhone 13.

The South China Morning Post said Wednesday there had been at least five million iPhone 13 orders in the eight days since the Technology giant unveiled the smartphone. The news outlet also said Chinese e-commerce platform JD.com (HKG:09618) accounted for at least three million iPhone 13 pre-orders.

Are you looking for fast-news, hot-tips and market analysis? Sign-up for the Invezz newsletter, today.

Apple shares surged slightly by 1.25% following the report for a year-to-date gain of 12.22%. As a result, the stock is now up nearly 30% over the last 12 months, meaning it is still underperforming the S&P 500 Index, which is up 32.66%.

The stock has also plunged more than 7% in the last two weeks amid rising China risk.

Why buy Apple shares now?

From an investment perspective, Apple’s recent share price decline of more than 7% has pushed its valuation multiple lower, making it an attractive investment opportunity for value investors.

The stock now trades at a P/E ratio of 28.44 and a forward P/E of 25.08. Moreover, analysts expect the iPhone maker’s earnings per share to grow at an average annual rate of about 19.61% over the next five years.

Therefore, the stock could still be a compelling option for growth investors as it continues to create more avenues for generating service revenue.

Source – TradingView

Apple shares seem poised for a rebound

Technically, the AAPL stock appears to have recently bounced off the trendline support line, just above the 100-day moving average. Moreover, the stock also seems to have recovered to avoid falling to the oversold conditions of the 14-day RSI.

Therefore, with the company’s latest iPhone model gaining traction in China, this could catalyze a significant rebound. As a result, investors can target potential rebounds at $151.55 or higher at $156.92.

On the other hand, if the stock price pulls back further, it could find support at $140.19 or lower at $134.95

Bottom line: now could be the time to buy AAPL shares

In summary, Apple shares seem to have recently pulled back to create an attractive opportunity for a rebound. In addition, the stock trades at relatively attractive valuation multiples whilst also offering exciting growth prospects.

Therefore, the recent pullback could be an opportunity to add a quality technology stock to your portfolio.

Where to buy right now

To invest simply and easily, users need a low-fee broker with a track record of reliability. The following brokers are highly rated, recognised worldwide, and safe to use:","In his… read moreOn Wednesday, Apple Inc. (NASDAQ:AAPL) published a report saying that it expects five million iPhone pre-orders from China amid initial high demand for the iPhone 13.
The South China Morning Post said Wednesday there had been at least five million iPhone 13 orders in the eight days since the Technology giant unveiled the smartphone.
The news outlet also said Chinese e-commerce platform JD.com (HKG:09618) accounted for at least three million iPhone 13 pre-orders.
Apple shares surged slightly by 1.25% following the report for a year-to-date gain of 12.22%.
Why buy Apple shares now?",https://invezz.com/news/2021/09/22/should-you-invest-in-apple-stock-after-predicting-5m-iphone-pre-orders-in-china/,22/9/2021 0:00
