,Ticker,Title,Article,Summary,Link,Date
75,AAPL,Wall Street ends sharply lower in broad sell-off,"Summary All eyes on Fed's policy meeting later this week

NEW YORK, Sept 20 (Reuters) - Wall Street plunged on Monday as fear of contagion from a potential collapse of China's Evergrande prompted a broad sell-off and sent investors fleeing equities for safety.

The Nasdaq fell to its lowest level in about a month, and Microsoft Corp (MSFT.O), Alphabet Inc (GOOGL.O), Amazon.com Inc (AMZN.O), Apple Inc (AAPL.O), Facebook Inc (FB.O) and Tesla Inc (TSLA.O) were among the biggest drags on the index as well as the S&P 500.

All 11 major S&P 500 sectors were lower, with economically sensitive groups like energy (.SPNY) down the most.

Investors also were nervous ahead of the Federal Reserve's policy meeting this week.

The banking sub-index (.SPXBK) dropped sharply while U.S. Treasury prices rose as worries about the possible default of Evergrande (3333.HK) appeared to affect the broader market.

""You kind of knew that when there was something that caught markets off guard, that it was going to lead to probably a bigger sell-off and you didn't know what the reason would be,"" said Sameer Samana, senior global market strategist at Wells Fargo Investment Institute.

People wearing face masks walk by the New York Stock Exchange (NYSE) during the outbreak of the coronavirus disease (COVID-19) in New York City, New York, U.S., July 19, 2021. REUTERS/Andrew Kelly

""I guess it's the China news but... it's not altogether surprising given how bullish people were.""

Wednesday will bring the results of the Fed's policy meeting, where the central bank is expected to lay the groundwork for a tapering, although the consensus is for an actual announcement to be delayed until the November or December meetings. read more

Unofficially, the Dow Jones Industrial Average (.DJI) fell 620.22 points, or 1.79%, to 33,964.66, the S&P 500 (.SPX) lost 75.28 points, or 1.70%, to 4,357.71 and the Nasdaq Composite (.IXIC) dropped 325.95 points, or 2.17%, to 14,718.02.

The S&P 500 is down sharply from its intra-day record high hit on Sept. 2 and is on track to snap a seven-month winning streak.

Strategists at Morgan Stanley said they expected a 10% correction in the S&P 500 as the Fed starts to unwind its monetary support, adding that signs of stalling economic growth could deepen it to 20%.

The CBOE volatility index (.VIX), known as Wall Street's fear gauge, rose.

(This story corrects to say Treasury prices rose in paragraph 5)

Reporting by Caroline Valetkevitch in New York; additional reporting by Devik Jain and Sagarika Jaisinghani in Bengaluru and by Noel Randewich in San Francisco; Editing by Sriraj Kalluvila and Lisa Shumaker

Our Standards: The Thomson Reuters Trust Principles.","Summary All eyes on Fed's policy meeting later this weekNEW YORK, Sept 20 (Reuters) - Wall Street plunged on Monday as fear of contagion from a potential collapse of China's Evergrande prompted a broad sell-off and sent investors fleeing equities for safety.
All 11 major S&P 500 sectors were lower, with economically sensitive groups like energy (.SPNY) down the most.
Investors also were nervous ahead of the Federal Reserve's policy meeting this week.
The S&P 500 is down sharply from its intra-day record high hit on Sept. 2 and is on track to snap a seven-month winning streak.
Strategists at Morgan Stanley said they expected a 10% correction in the S&P 500 as the Fed starts to unwind its monetary support, adding that signs of stalling economic growth could deepen it to 20%.",https://www.reuters.com/business/wall-street-ends-sharply-lower-broad-sell-off-2021-09-20/,20/9/2021 0:00
76,AAPL,10 Information Technology Stocks Showing Unusual Options Activity In Today's Session,"This unusual options alert can help traders discover the next big trading opportunities. Traders will search for circumstances when the market estimation of an option diverges heavily from its normal worth. Unusual trading activity could push option prices to exaggerated or underestimated levels.

Here's the list of some unusual options activity happening in today's session:



Symbol PUT/CALL Trade Type Sentiment Exp. Date Strike Price Total Trade Price Open Interest Volume AAPL CALL SWEEP BEARISH 09/24/21 $144.00 $31.3K 10.2K 30.5K INDI CALL TRADE NEUTRAL 10/15/21 $12.50 $34.3K 796 18.1K AMD CALL TRADE BEARISH 09/24/21 $103.00 $34.9K 4.6K 11.2K MARA CALL SWEEP BULLISH 09/24/21 $34.00 $72.0K 1.0K 3.0K NVDA CALL SWEEP BEARISH 10/15/21 $220.00 $100.0K 12.3K 2.9K INTC CALL SWEEP NEUTRAL 01/21/22 $57.50 $37.2K 16.8K 1.7K MGI CALL TRADE BEARISH 11/19/21 $10.00 $34.3K 2.7K 1.0K MVIS CALL SWEEP BEARISH 10/15/21 $13.50 $39.0K 10 617 PSFE CALL SWEEP BULLISH 01/20/23 $10.00 $39.8K 7.7K 581 QCOM PUT TRADE BULLISH 04/14/22 $120.00 $250.1K 405 348

Explanation

These bullet-by-bullet explanations have been constructed using the accompanying table.

• For AAPL (NASDAQ:AAPL), we notice a call option sweep that happens to be bearish, expiring in 3 day(s) on September 24, 2021. This event was a transfer of 202 contract(s) at a $144.00 strike. This particular call needed to be split into 6 different trades to become filled. The total cost received by the writing party (or parties) was $31.3K, with a price of $155.0 per contract. There were 10258 open contracts at this strike prior to today, and today 30588 contract(s) were bought and sold.

• For INDI (NASDAQ:INDI), we notice a call option trade that happens to be neutral, expiring in 24 day(s) on October 15, 2021. This event was a transfer of 362 contract(s) at a $12.50 strike. The total cost received by the writing party (or parties) was $34.3K, with a price of $95.0 per contract. There were 796 open contracts at this strike prior to today, and today 18160 contract(s) were bought and sold.

• Regarding AMD (NASDAQ:AMD), we observe a call option trade with bearish sentiment. It expires in 3 day(s) on September 24, 2021. Parties traded 236 contract(s) at a $103.00 strike. The total cost received by the writing party (or parties) was $34.9K, with a price of $148.0 per contract. There were 4663 open contracts at this strike prior to today, and today 11206 contract(s) were bought and sold.

• For MARA (NASDAQ:MARA), we notice a call option sweep that happens to be bullish, expiring in 3 day(s) on September 24, 2021. This event was a transfer of 800 contract(s) at a $34.00 strike. This particular call needed to be split into 6 different trades to become filled. The total cost received by the writing party (or parties) was $72.0K, with a price of $90.0 per contract. There were 1027 open contracts at this strike prior to today, and today 3023 contract(s) were bought and sold.

• Regarding NVDA (NASDAQ:NVDA), we observe a call option sweep with bearish sentiment. It expires in 24 day(s) on October 15, 2021. Parties traded 200 contract(s) at a $220.00 strike. This particular call needed to be split into 12 different trades to become filled. The total cost received by the writing party (or parties) was $100.0K, with a price of $500.0 per contract. There were 12312 open contracts at this strike prior to today, and today 2963 contract(s) were bought and sold.

• Regarding INTC (NASDAQ:INTC), we observe a call option sweep with neutral sentiment. It expires in 122 day(s) on January 21, 2022. Parties traded 204 contract(s) at a $57.50 strike. This particular call needed to be split into 9 different trades to become filled. The total cost received by the writing party (or parties) was $37.2K, with a price of $183.0 per contract. There were 16829 open contracts at this strike prior to today, and today 1719 contract(s) were bought and sold.

• Regarding MGI (NASDAQ:MGI), we observe a call option trade with bearish sentiment. It expires in 59 day(s) on November 19, 2021. Parties traded 980 contract(s) at a $10.00 strike. The total cost received by the writing party (or parties) was $34.3K, with a price of $35.0 per contract. There were 2721 open contracts at this strike prior to today, and today 1003 contract(s) were bought and sold.

• For MVIS (NASDAQ:MVIS), we notice a call option sweep that happens to be bearish, expiring in 24 day(s) on October 15, 2021. This event was a transfer of 600 contract(s) at a $13.50 strike. This particular call needed to be split into 40 different trades to become filled. The total cost received by the writing party (or parties) was $39.0K, with a price of $65.0 per contract. There were 10 open contracts at this strike prior to today, and today 617 contract(s) were bought and sold.

• Regarding PSFE (NYSE:PSFE), we observe a call option sweep with bullish sentiment. It expires in 486 day(s) on January 20, 2023. Parties traded 200 contract(s) at a $10.00 strike. This particular call needed to be split into 3 different trades to become filled. The total cost received by the writing party (or parties) was $39.8K, with a price of $199.0 per contract. There were 7782 open contracts at this strike prior to today, and today 581 contract(s) were bought and sold.

• Regarding QCOM (NASDAQ:QCOM), we observe a put option trade with bullish sentiment. It expires in 205 day(s) on April 14, 2022. Parties traded 345 contract(s) at a $120.00 strike. The total cost received by the writing party (or parties) was $250.1K, with a price of $725.0 per contract. There were 405 open contracts at this strike prior to today, and today 348 contract(s) were bought and sold.

Options Alert Terminology

- Call Contracts: The right to buy shares as indicated in the contract.

- Put Contracts: The right to sell shares as indicated in the contract.

- Expiration Date: When the contract expires. One must act on the contract by this date if one wants to use it.

- Premium/Option Price: The price of the contract.

For more information, visit our Guide to Understanding Options Alerts or read more news on unusual options activity.","• For AAPL (NASDAQ:AAPL), we notice a call option sweep that happens to be bearish, expiring in 3 day(s) on September 24, 2021.
There were 10258 open contracts at this strike prior to today, and today 30588 contract(s) were bought and sold.
There were 796 open contracts at this strike prior to today, and today 18160 contract(s) were bought and sold.
There were 4663 open contracts at this strike prior to today, and today 11206 contract(s) were bought and sold.
There were 405 open contracts at this strike prior to today, and today 348 contract(s) were bought and sold.",https://www.benzinga.com/markets/options/21/09/23036882/10-information-technology-stocks-showing-unusual-options-activity-in-todays-session,20/9/2021 0:00
77,AAPL,What to watch today: Dow set to drop about 700 points in global market sell-off,"BY THE NUMBERS

IN THE NEWS TODAY

STOCKS TO WATCH

Bank stocks, including JPMorgan (JPM), Bank of America (BAC) and Citigroup (C) slid in Monday's premarket as bond yields slide on slowdown fears. Big bank stocks took a hit as the falling rates may crimp profits. BofA and JPMorgan were each down more than 2%. Citigroup declined 2.5%. Colgate-Palmolive (CL) was upgraded to buy from hold by Deutsche Bank on Sunday. The investment firm said that Colgate's difficulties with inflation and in some international markets was already priced in to its stock. AstraZeneca (AZN) announced Monday that its breast cancer drug Enhertu showed positive results in a phase-three trial. Shares of the company were up more than 1% in premarket trading. Cathie Wood's ARK Innovation ETF (ARKK) was down 2.75% in the premarket, on pace to snap a three-day winning streak. Compugen, DraftKings, Coinbase and Square were also among the biggest ETF losers in early trading.

WATERCOOLER","BY THE NUMBERSIN THE NEWS TODAYSTOCKS TO WATCHBank stocks, including JPMorgan (JPM), Bank of America (BAC) and Citigroup (C) slid in Monday's premarket as bond yields slide on slowdown fears.
Big bank stocks took a hit as the falling rates may crimp profits.
The investment firm said that Colgate's difficulties with inflation and in some international markets was already priced in to its stock.
Cathie Wood's ARK Innovation ETF (ARKK) was down 2.75% in the premarket, on pace to snap a three-day winning streak.
Compugen, DraftKings, Coinbase and Square were also among the biggest ETF losers in early trading.",https://www.cnbc.com/2021/09/20/what-to-watch-today-dow-set-to-drop-nearly-700-points-in-global-market-sell-off.html,20/9/2021 0:00
78,AAPL,Traders are Buying the Dip,"The S&P 500 saw one of its worst days of the year Monday, falling 1.7%. The last hour saw a 50-point rally as traders bought the dip, so the day had a much better feel than earlier in the afternoon.

The recent selling has accelerated due to concerns over Evergrande, a large real estate company in China. The company will likely default this week and if they do, we could see some contagion in global markets. While American companies have very little direct exposure, the fear with an event like this is exposure to the exposed.

While the late day rally provided some nice relief, the long-term trend line and 50-day moving average are broken. Traders are now eyeing the important levels where they can buy the dip.

Let’s go over some areas inthe the S&P 500 that you should be eyeing if we get anymore aggressive selling:

Mondays Low - The low printed in the S&P 500 on Monday was 4305. This will be an important spot to hold over the next few sessions

4255 SPX- The 161.8% Fibonacci extension drawn from August lows to September highs is just above the 4250 level in the S&P. If this area holds, we could see a bounce back to the 50-day MA, giving to bulls one last chance to take us to all-time highs in 2021.

4100 SPX- The 200-day moving average currently resides just over the 4100 level and would be the next stop. The 200-day hasn’t been tested since June of 2020, so this is a long time coming. Traders will be anticipating a bounce off this support level.

3650 SPX- Morgan Stanley is calling for a possible 20% correction. If this plays out, the 200-day wouldn’t hold and we would fall to the 3650 area in the S&P.

S&P Futures Trading Levels for Today

The S&P futures currently sit at 4380, about 15 handles off overnight highs.

Support levels for the day will be 4372 and 4351.

Upside resistance is the overnight high at 4396 and 4410.

The current S&P trading environment has been sideways, but is now trending lower after yesterday.

Story continues

Three Stocks to Watch

AMZN- Amazon tested its 200-day moving average yesterday and bounced aggressively. Losing that $3300 support level would be a negative for stocks and the Nasdaq. Those waiting for a dip, can target $3050.

AAPL- Apple has fallen 15 points off its highs and seems to have its sights set on the 200-day at $134. Investors might want to look at the $136 area, which is the 61.8% retracement level from May lows to recent highs.

Apple Inc. Price and EPS Surprise

Apple Inc. Price and EPS Surprise

Apple Inc. price-eps-surprise | Apple Inc. Quote

UBER– The ride share company is up over 4% after the company guided pre-market. Uber narrowed its Q3 gross bookings outlook to the middle of the expected range. They raised Q3 EBITDA and achieved positive EBITDA in July and August.



Want the latest recommendations from Zacks Investment Research? Today, you can download 7 Best Stocks for the Next 30 Days. Click to get this free report



Amazon.com, Inc. (AMZN) : Free Stock Analysis Report



Apple Inc. (AAPL) : Free Stock Analysis Report



Uber Technologies, Inc. (UBER) : Free Stock Analysis Report



To read this article on Zacks.com click here.



Zacks Investment Research","The last hour saw a 50-point rally as traders bought the dip, so the day had a much better feel than earlier in the afternoon.
Traders are now eyeing the important levels where they can buy the dip.
4100 SPX- The 200-day moving average currently resides just over the 4100 level and would be the next stop.
Story continuesThree Stocks to WatchAMZN- Amazon tested its 200-day moving average yesterday and bounced aggressively.
Click to get this free reportAmazon.com, Inc. (AMZN) : Free Stock Analysis ReportApple Inc. (AAPL) : Free Stock Analysis ReportUber Technologies, Inc. (UBER) : Free Stock Analysis ReportTo read this article on Zacks.com click here.",https://finance.yahoo.com/news/traders-buying-dip-120512806.html,20/9/2021 0:00
79,AAPL,"Apple Working On iPhone Features To Detect Depression, Cognitive Decline: Report","Apple, Inc. (NASDAQ: AAPL) is reportedly nurturing serious ambitions to expand its presence in the health care sector.

What Happened: Apple is working on deploying its iPhones as a diagnostic device to detect neurodegenerative conditions such as depression, anxiety and cognitive decline, according to a Wall Street Journal report citing people familiar with the matter and documents reviewed by the publication.

Apple hopes to use sensor data on mobility, physical activity, sleep patterns and typing behavior, among other factors, to test digital signals associated with target conditions, the report said.

This would help create algorithms to detect the underlying conditions reliably.

The efforts are part of Apple's R&D partnerships with the University of California, Los Angeles, which is studying stress, anxiety and depression, and Biogen, Inc. (NASDAQ: BIIB), which is studying mild cognitive impairment.

""Seabreeze"" is Apple's code name for the UCLA project and ""Pi"" is the code name for the Biogen project, the Journal report said.

The UCLA, study will reportedly collect data from 3,000 volunteers beginning in 2021, and Biogen intends to enroll about 20,000 people for the study over the next two years.

Creating algorithms that are sufficiently reliable to accurately diagnose specific conditions is a tall order, according to the Journal report, which added that Apple executives are excited about the possibility.

Related Link: How Preorders For Apple's iPhone 13 Models Are Tracking

Why It's Important: Apple now has apps on the iPad, iPhone and Apple Watch to provide critical health information to patients and health care providers.

Loup Ventures Managing Partner Gene Munster sees Apple's health ambitions being anchored on devices and data that can be leveraged by clinicians for care.

The company's health initiatives will be made of three building blocks: data capture, data sharing and delivering care, Munster said.

The Apple Watch models have features such as high/low heart rate notification, irregular rhythm notification an ECG app and more.

The company is reportedly planning to include various types of monitoring — including blood pressure, temperature, sleep and blood sugar — to future versions of the Apple Watch.

AAPL Price Action: Apple shares were rising 0.72% to $143.97 midday Tuesday.

Related Link: Why Stop At Watches? Apple Explores Turning Its Wireless Buds Into Healthcare Devices","Apple, Inc. (NASDAQ: AAPL) is reportedly nurturing serious ambitions to expand its presence in the health care sector.
What Happened: Apple is working on deploying its iPhones as a diagnostic device to detect neurodegenerative conditions such as depression, anxiety and cognitive decline, according to a Wall Street Journal report citing people familiar with the matter and documents reviewed by the publication.
""Seabreeze"" is Apple's code name for the UCLA project and ""Pi"" is the code name for the Biogen project, the Journal report said.
Related Link: How Preorders For Apple's iPhone 13 Models Are TrackingWhy It's Important: Apple now has apps on the iPad, iPhone and Apple Watch to provide critical health information to patients and health care providers.
The company's health initiatives will be made of three building blocks: data capture, data sharing and delivering care, Munster said.",https://www.benzinga.com/general/health-care/21/09/23032111/apple-working-on-iphone-features-to-detect-depression-cognitive-decline-report,20/9/2021 0:00
80,AAPL,"Intel, Apple, carmakers to attend White House meeting on chip shortage","Intel CEO Pat Gelsinger attends an international business leaders' meeting in Versailles, France June 28, 2021.Stephane de Sakutin/Pool via REUTERS/File Photo

Sept 23(Reuters) - Intel Corp (INTC.O) Chief Executive Pat Gelsinger plans to attend a virtual White House meeting on the global chip shortage on Thursday, along with representatives from companies including Apple (AAPL.O), Microsoft (MSFT.O), Samsung Electronics (005930.KS), GM (GM.N), Ford (F.N) and Stellantis (STLA.MI), people familiar with the matter said.

The meeting will be hosted by Secretary of Commerce Gina Raimondo and National Economic Council Director Brian Deese, the Commerce Department saidearlier this month. Topics will include the impact of the coronavirus Delta variant on chip supplies and how to better coordinate between chip producers and consumers.

Other attendees will include TSMC, BMW (BMWG.DE) and Micron Technology Inc (MU.O), sources said.

The White House had said only that attendees would include producers, consumers and industry groups. The Commerce Department did not immediately respond to a request for comment.

A shortage of semiconductor chips has forced top automakers to cut production worldwide after a decrease in demand for cars early in the coronavirus pandemic led many chipmakers to shift production to computers and tablets, whose demand was soaring.

The White House meeting is the latest in a string of summits on the topic, allowing the Biden administration to show it is taking the chip crunch seriously.

President Joe Biden met with executives from major companies in April, saying he had bipartisan support for legislation to fund the semiconductor industry. In May, Raimondo said she held meetings with three dozen senior industry leaders on the chip shortage and said the United States could help boost transparency in the market.

While Intel and TSMC have announced plans to ramp up chip production with new U.S.-based plants, it takes years for new semiconductor plants to ramp up to full production. Meanwhile, legislation to fund a plan to offer grants to chipmakers to expand or build new factories awaits congressional approval.

Reporting by Stephen Nellis in San Francisco and Alexandra Alper and David Shepardson in Washington, D.C.; Editing by Leslie Adler and Jon Boyle

Our Standards: The Thomson Reuters Trust Principles.","Topics will include the impact of the coronavirus Delta variant on chip supplies and how to better coordinate between chip producers and consumers.
The White House had said only that attendees would include producers, consumers and industry groups.
The White House meeting is the latest in a string of summits on the topic, allowing the Biden administration to show it is taking the chip crunch seriously.
President Joe Biden met with executives from major companies in April, saying he had bipartisan support for legislation to fund the semiconductor industry.
In May, Raimondo said she held meetings with three dozen senior industry leaders on the chip shortage and said the United States could help boost transparency in the market.",https://www.reuters.com/technology/intel-chief-plans-attend-white-house-meeting-chip-shortage-2021-09-22/,22/9/2021 0:00
81,AAPL,Is Apple's Long-Rumored AR Headset Coming In 2022?,"Apple Inc (NASDAQ: AAPL) has just come off its major hardware launch event of the year and within days, rumors of timeline, specifications and pricing of Cupertino's augmented reality headset have begun making the rounds.

What Happened: Apple's AR headset will enter mass production in the second quarter of 2022, McRumors reported, citing a translated report featured in the Taiwan version of DigiTimes.

The AR headset has completed the second phase of prototype testing and mass production will begin shortly, the report said.

The first-gen AR headset, the report said, will have a slightly bulky design, similar to Facebook, Inc.'s (NASDAQ: FB) Oculus Rift headset.

Multiple camera modules, feature-eye tracking and possibly iris recognition may be featured in the AR headset.

The AR accessory could reportedly be priced between $2,000 and $3,000.

Related Link: How Is Apple's China Risk-Reward Scenario Playing Out?

What's Next: Premised on Apple revving up its AR platform and adding several AR-centric features to its iOS and iPadOS, it appears Apple Glasses are likely on their way, the report said.

Apple is also reportedly working on a VR and mixed reality headset, featuring ultra-high-resolution screens and a cinematic speaker system that should enable realistic visual experiences.

Apple will likely be the first to come to market with high-end Mixed Reality goggles in 2022, followed by more mainstream AR [Apple] glasses in 2025, Loup Ventures managing partner Gene Munster said in a note.

At last check Wednesday afternoon, Apple shares were up 1.21% at $145.17.

Related Link: Why Apple Is A 'Top Tech Name' To Own Right Now

Image by Gerd Altmann from Pixabay","What Happened: Apple's AR headset will enter mass production in the second quarter of 2022, McRumors reported, citing a translated report featured in the Taiwan version of DigiTimes.
The AR headset has completed the second phase of prototype testing and mass production will begin shortly, the report said.
The first-gen AR headset, the report said, will have a slightly bulky design, similar to Facebook, Inc.'s (NASDAQ: FB) Oculus Rift headset.
Multiple camera modules, feature-eye tracking and possibly iris recognition may be featured in the AR headset.
Apple is also reportedly working on a VR and mixed reality headset, featuring ultra-high-resolution screens and a cinematic speaker system that should enable realistic visual experiences.",https://www.benzinga.com/news/21/09/23055071/is-apples-long-rumored-ar-headset-coming-in-2022,22/9/2021 0:00
