,Ticker,Title,Article,Summary,Link,Date
0,AAPL,Evaluating Apple (AAPL) After Epic Antitrust Decision,"The Apple Inc. (AAPL) App Store lives on, although with different payment options, and Apple is not a monopoly. These are the main takeaways from U.S. District Judge Yvonne Gonzalez Rogers'decision in the antitrust suit brought on by Fortnite maker Epic Games, which is appealing the case.



The suit began after Apple removed Fortnite from the App Store. This came after Epic inserted a link to its own payment system in Fortnite, violating its development agreement. Epic purposely sidestepped Apple's in-app payment system, which takes an estimated 15% to 30% cut from all in-app transactions on iOS devices like iPhones. This generates billions in revenue annually.

Key Takeaways The judge in the antitrust suit brought against Apple by Fortnight maker Epic Games suggested that Apple was not a monopoly but hinted that changes to the App Store may be in order.

While the antitrust case is serious, it may not be too much of an issue for Apple stock's overall performance.

Big Money investors still love shares of the tech giant.



Judge Rogers sided with Epic on the payment system complaint, but other major decisions in the case went Apple's way. Her definition of the market in the case as digital mobile gaming transactions, rather than the entire iOS ecosystem as Epic hoped, seems to have laid the foundation for a ""no monopoly"" decision (but I'm no legal expert!). Still, she said that Apple was close to monopoly power in that market.

As a result, future changes to the App Store may be in order. Legislative interest may force changes too. So, how does that potentially affect Apple stock?

While an antitrust case is serious, and this certainly seems like a big deal, it may not be too much of an issue for the stock's overall performance. Let's keep in mind that, per my estimates in the ""legislative interest"" link above, App Store revenue may be about 5% of total revenue.

Of course, it could grow. But as is, this decision's impact on overall revenue and growth should be minimal, especially over time. Big Money investors know that.

I look at when I believe institutional investors trade stocks. I call them Big Money signals. I don't think these market movers are too worried about the recent ruling over the long haul. To get a real sense of what Big Money really thinks about Apple, let's broaden our horizons.

Below is a chart for Apple going back to 2017. I've notated the times when Big Money pushed into the shares. The way I see it, the more Big Money, the better.

TradingView.com

The activity in the above chart shows how big money, over time, loves Apple stock. Given the fundamentals, demonstrated growth, and future potential, it's hard not to concur. Sure, the stock has had rough patches. But zoom out, and it's clear that this stock's had somewhere to be—UP.

Now, the antitrust suit is obviously important. But even if the App Store were marginalized by other options on iOS devices, it's highly probable that the potential impact on overall revenue is small.

And who knows? The company could innovate this situation into a positive, perhaps creating a new, profitable payment arrangement or something entirely unique. Also, don't discount the possibility that Apple could end up a winner through market forces.

The Bottom Line

Apple received a mixed verdict in its recent antitrust case (the App Store payment system may be in trouble, but the judge doesn't consider the company a monopoly). But even in a worst-case scenario, it's likely that there could be only a minimal effect on the overall business.

From where I stand, Big Money senses this and is focused more on the long-term fundamentals and growth potential. What say you?

Disclosure: The author holds no position in AAPL at the time of publication.

","The Apple Inc. (AAPL) App Store lives on, although with different payment options, and Apple is not a monopoly.
Key Takeaways The judge in the antitrust suit brought against Apple by Fortnight maker Epic Games suggested that Apple was not a monopoly but hinted that changes to the App Store may be in order.
While the antitrust case is serious, it may not be too much of an issue for Apple stock's overall performance.
To get a real sense of what Big Money really thinks about Apple, let's broaden our horizons.
From where I stand, Big Money senses this and is focused more on the long-term fundamentals and growth potential.",https://www.investopedia.com/evaluating-apple-aapl-after-epic-antitrust-decision-5201959,2021-09-20 14:26:01.135000+00:00
1,AAPL,A Bite Of The Apple: A Look At Why Apple Might Be A Good Trade,"Hey 5-Star Trader,

“Tuesday Trade” Journal: One of the most important concepts in trading is to review your work, and learn from the good and the bad. Identifying what is working is critical — to do more of it. So, to lead by example, each Tuesday, you’ll get a trade from my trading journal, in which I explain my thought process from start to finish. Trading is all about finding something that works and applying it over and over again. That’s how you find trading success. So study up on this “Tuesday Trade” and let’s get to work.

For this week’s “Tuesday Trade,” I want to outline my trade in Apple Inc (NASDAQ: AAPL).

Apple is a large-cap stock that can present many opportunities if the moment is just right. For that reason, AAPL is always on my shortlist of tickers that I’m watching, and late last month I started to see something interesting setup.

Near the end of August, I saw that AAPL had been stuck around $148 for a while and was in a nice squeeze. I explored my options but found that I couldn't get a put credit spread with decent risk-reward. Instead, I decided to buy two unbalanced butterflies — BUY +2 BUTTERFLY AAPL 100 17 SEP 21 147/155/162.5 CALL @2.39 (limit order) LMT.

As mentioned previously, AAPL had been stuck around the $148 price point, so my idea behind this trade was for AAPL to stay within my butterfly rage. If AAPL behaved perfectly, I could make max profit, but if AAPL were to go higher, I would at least be able to keep my credit. This was a bullish trade with my risk being approximately $500.

Three days into my trade and everything was set up nicely and I was in the green. Sometimes, when I have more than one contract in a trade that is profitable I like to scale out so I sold one of my butterflies to lock in my gain — SELL -1 BUTTERFLY AAPL 100 17 SEP 21 147/155/162.5 CALL @3.51 LMT. However, I decided to hold the other half to try to secure max profits.

Several days later, I was able to make the rest of my profit on my remaining contract and closeout for a win — SELL -1 BUTTERFLY AAPL 100 17 SEP 21 147/155/162.5 CALL @3.70 LMT to close, taking profits on the rest of my bullish AAPL butterfly.

Story continues

Interested in improving your options trading? I’ve partnered with Benzinga to offer you my “Options 101” course at an exclusive discounted price. In this strategy package, I’ve outlined fundamentals and solidified key concepts into one concise class. Click to learn more!

Image by StartupStockPhotos from Pixabay

See more from Benzinga

© 2021 Benzinga.com. Benzinga does not provide investment advice. All rights reserved.","Hey 5-Star Trader,“Tuesday Trade” Journal: One of the most important concepts in trading is to review your work, and learn from the good and the bad.
So, to lead by example, each Tuesday, you’ll get a trade from my trading journal, in which I explain my thought process from start to finish.
For this week’s “Tuesday Trade,” I want to outline my trade in Apple Inc (NASDAQ: AAPL).
Instead, I decided to buy two unbalanced butterflies — BUY +2 BUTTERFLY AAPL 100 17 SEP 21 147/155/162.5 CALL @2.39 (limit order) LMT.
Story continuesInterested in improving your options trading?",https://finance.yahoo.com/news/bite-apple-look-why-apple-141925509.html,2021-09-20 14:26:01.135000+00:00
2,AAPL,Is Apple Inc. (AAPL) A Good Stock To Buy?,"The latest 13F reporting period has come and gone, and Insider Monkey is again at the forefront when it comes to making use of this gold mine of data. We have processed the filings of the more than 873 world-class investment firms that we track and now have access to the collective wisdom contained in these filings, which are based on their June 30th holdings, data that is available nowhere else. Should you consider Apple Inc. (NASDAQ:AAPL) for your portfolio? We'll look to this invaluable collective wisdom for the answer.

Is Apple Inc. (NASDAQ:AAPL) a good stock to buy? Prominent investors were turning bullish. The number of bullish hedge fund bets advanced by 11 lately. Apple Inc. (NASDAQ:AAPL) was in 138 hedge funds' portfolios at the end of the second quarter of 2021. The all time high for this statistic is 152. Our calculations also showed that AAPL ranked 9th among the 30 most popular stocks among hedge funds (click for Q2 rankings).

In the 21st century investor’s toolkit there are a multitude of tools stock market investors employ to size up stocks. A pair of the most under-the-radar tools are hedge fund and insider trading activity. We have shown that, historically, those who follow the best picks of the top fund managers can outperform the broader indices by a very impressive margin (see the details here). Also, our monthly newsletter's portfolio of long stock picks returned 185.4% since March 2017 (through August 2021) and beat the S&P 500 Index by more than 79 percentage points. You can download a sample issue of this newsletter on our website .

hedge funds vs. mutual funds

Warren Buffett of Berkshire Hathaway

At Insider Monkey, we scour multiple sources to uncover the next great investment idea. For example, lithium mining is one of the fastest growing industries right now, so we are checking out stock pitches like this emerging lithium stock. We go through lists like the 10 best EV stocks to pick the next Tesla that will deliver a 10x return. Even though we recommend positions in only a tiny fraction of the companies we analyze, we check out as many stocks as we can. We read hedge fund investor letters and listen to stock pitches at hedge fund conferences. You can subscribe to our free daily newsletter on our homepage. Keeping this in mind we're going to take a look at the key hedge fund action regarding Apple Inc. (NASDAQ:AAPL).

Story continues

Do Hedge Funds Think AAPL Is A Good Stock To Buy Now?

At the end of the second quarter, a total of 138 of the hedge funds tracked by Insider Monkey held long positions in this stock, a change of 9% from one quarter earlier. Below, you can check out the change in hedge fund sentiment towards AAPL over the last 24 quarters. With hedge funds' positions undergoing their usual ebb and flow, there exists a few noteworthy hedge fund managers who were upping their holdings meaningfully (or already accumulated large positions).

More specifically, Berkshire Hathaway was the largest shareholder of Apple Inc. (NASDAQ:AAPL), with a stake worth $121502.1 million reported as of the end of June. Trailing Berkshire Hathaway was Fisher Asset Management, which amassed a stake valued at $8883.2 million. Citadel Investment Group, D E Shaw, and Adage Capital Management were also very fond of the stock, becoming one of the largest hedge fund holders of the company. In terms of the portfolio weights assigned to each position Berkshire Hathaway allocated the biggest weight to Apple Inc. (NASDAQ:AAPL), around 41.46% of its 13F portfolio. Value Star Asset Management is also relatively very bullish on the stock, earmarking 19.58 percent of its 13F equity portfolio to AAPL.

As one would reasonably expect, key hedge funds have jumped into Apple Inc. (NASDAQ:AAPL) headfirst. Harvard Management Co, managed by Rick Slocum, assembled the most valuable position in Apple Inc. (NASDAQ:AAPL). Harvard Management Co had $333.5 million invested in the company at the end of the quarter. Sander Gerber's Hudson Bay Capital Management also initiated a $267.1 million position during the quarter. The other funds with new positions in the stock are Brad Dunkley and Blair Levinsky's Waratah Capital Advisors, Zach Schreiber's Point State Capital, and Aaron Cowen's Suvretta Capital Management.

Let's go over hedge fund activity in other stocks - not necessarily in the same industry as Apple Inc. (NASDAQ:AAPL) but similarly valued. These stocks are Microsoft Corporation (NASDAQ:MSFT), Amazon.com, Inc. (NASDAQ:AMZN), Alphabet Inc (NASDAQ:GOOGL), Facebook Inc (NASDAQ:FB), Tesla Inc. (NASDAQ:TSLA), Berkshire Hathaway Inc. (NYSE:BRK-B), and Taiwan Semiconductor Manufacturing Company Limited (NYSE:TSM). This group of stocks' market values resemble AAPL's market value.

[table] Ticker, No of HFs with positions, Total Value of HF Positions (x1000), Change in HF Position MSFT,238,62465125,-13 AMZN,271,60492350,28 GOOGL,190,26833902,5 FB,266,42349769,9 TSLA,60,9296858,-2 BRK-B,116,22380662,5 TSM,64,10694405,-12 Average,172.1,33501867,2.9 [/table]

View table here if you experience formatting issues.

As you can see these stocks had an average of 172.1 hedge funds with bullish positions and the average amount invested in these stocks was $33502 million. That figure was $145521 million in AAPL's case. Amazon.com, Inc. (NASDAQ:AMZN) is the most popular stock in this table. On the other hand Tesla Inc. (NASDAQ:TSLA) is the least popular one with only 60 bullish hedge fund positions. Apple Inc. (NASDAQ:AAPL) is not the least popular stock in this group but hedge fund interest is still below average. Our overall hedge fund sentiment score for AAPL is 66.7. Stocks with higher number of hedge fund positions relative to other stocks as well as relative to their historical range receive a higher sentiment score. Our calculations showed that top 5 most popular stocks among hedge funds returned 95.8% in 2019 and 2020, and outperformed the S&P 500 ETF (SPY) by 40 percentage points. These stocks gained 24.1% in 2021 through September 20th and still beat the market by 6.9 percentage points. A small number of hedge funds were also right about betting on AAPL as the stock returned 4.5% since the end of the second quarter (through 9/20) and outperformed the market by an even larger margin.

Get real-time email alerts: Follow Apple Inc. (NASDAQ:AAPL)

Suggested Articles:

Disclosure: None. This article was originally published at Insider Monkey.","Is Apple Inc. (NASDAQ:AAPL) a good stock to buy?
Our calculations also showed that AAPL ranked 9th among the 30 most popular stocks among hedge funds (click for Q2 rankings).
We read hedge fund investor letters and listen to stock pitches at hedge fund conferences.
Story continuesDo Hedge Funds Think AAPL Is A Good Stock To Buy Now?
Below, you can check out the change in hedge fund sentiment towards AAPL over the last 24 quarters.",https://finance.yahoo.com/news/apple-inc-aapl-good-stock-213144227.html,2021-09-20 14:26:01.135000+00:00
3,AAPL,Apple (AAPL) Stock Price and Forecast: Will Apple slump continue?,"Apple stock ends Monday 2.14% down amid risk aversion.

AAPL breaks trend line support in place since July.

Apple and markets are turning increasingly bearish.

Update: Apple finished the first day of the week at $142.94 per share, down 2.14$. Stocks markets plummeted on the back of fears, as a Chinese property giant may fall into default, jeopardizing the country's financial system. Wall Street posted sharp losses, although the three major indexes managed to bounce from intraday lows ahead of the close. The Nasdaq Composite shed 303 points, while the DJIA closed 614 points lower. The S&P 500 lost 1.85%.

Apple stock lost more ground on Friday as the market turned negative and sentiment continues to look more to further losses. Worries about Chinese tech and regulation are hitting some Nasdaq stocks, and Apple is getting hit by association. Also, China is in the crosshairs due to the ongoing worries over property developer Evergrande, and this is also weighing on sentiment. The Fed tapering is also high on investors' worry list. Given Apple's size, if the broad market turns lower, it is likely Apple will too. Quadruple witching may also have had something to do with the weakness in equities as the expiry of single stock futures and options and index futures and options came on Friday at the close. Given this has been a strong quarter, some reversal into witching was possible.

Apple 15-minute chart

We can see from the intraday chart above how Apple opened weaker and then just remained steady for the remainder of the session. In the process, though Apple broke the trend line support in place since July.

Apple key statistics

Market Cap $2.4 trillion Enterprise Value $2.3 trillion Price/Earnings (P/E) 29 Price/Book 38 Price/Sales 9 Gross Margin 41% Net Margin 25% EBITDA $112 billion 52 week low $103.10 52 week high $157.26 Average Wall Street rating and price target Buy $166.7

Apple stock forecast

Apple is getting dangerously close to our bearish zone below $144.50. This is the low from August, and below $144.50 the volume profile thins out quite noticeably, meaning that price support is limited. Breaking $144.50 means we wait for support at $134 before thinking about entering the stock again. Momentum oscillators, the Relative Strength Index (RSI) and the Moving Average Convergence Divergence (MACD) are all pointing lower and trending down in confirmation of price action. Markets in Europe are already down nearly 2%, so this may be the day we turn bearish on Apple stock with a break of $144.50. Unless something interesting happens between now and the open of the US main session, we are going to break $144.50.

There are some potential option plays to make here as a break of $144.50 may lead to a sudden price fall due to the lack of volume support. In turn, a one to two-week $135 strike put or something like that may see a sharp price move. A $135 put for October 2 is trading around $0.43 cents.

FXStreet View: Neutral, bearish on a break of $144.50, bullish above $155.

FXStreet Trade Ideas: Buy zone at $134. Buy a short-dated put on a break of $144.50.","Apple stock ends Monday 2.14% down amid risk aversion.
Apple stock lost more ground on Friday as the market turned negative and sentiment continues to look more to further losses.
This is the low from August, and below $144.50 the volume profile thins out quite noticeably, meaning that price support is limited.
Markets in Europe are already down nearly 2%, so this may be the day we turn bearish on Apple stock with a break of $144.50.
Unless something interesting happens between now and the open of the US main session, we are going to break $144.50.",https://www.fxstreet.com/news/apple-aapl-stock-price-and-forecast-why-is-apple-stock-down-202109201120,2021-09-20 14:26:01.135000+00:00
4,AAPL,"Apple (AAPL) Stock Price and Forecast: Apple stuck, is it time to buy?","Apple recovers but stalls at the 9-day moving average.

AAPL stock is now in a high volume resistance area.

IPhone maker still trying to break back above $152.

Apple recovered further ground on Thursday, but the move ran out of steam at the key short-term, 9-day moving average. This or the 8 or 10-day moving average (whichever is your preference) are closely watched by short-term swing traders as it gives an easy guide to sentiment. In strong moves it can guide prices higher or lower as seen from Apple between June and July. Buying dips to the 9-day moving average would have kept you on that strong surge from $125 to $150.

Apple 15-minute chart

The move on Wednesday had closed toward the high of the daily range, which is usually taken as a positive. Thursday duly saw a continuation with a gap open that Apple filled before rallying back up and stabilizing around $146. Apple stock closed at $146.83 for a gain of 0.67%. We do mention this a lot, but it is amazing how many times markets look to fill a gap.

Apple key statistics

Market Cap $2.4 trillion Enterprise Value $2.3 trillion Price/Earnings (P/E) 29 Price/Book 38 Price/Sales 9 Gross Margin 41% Net Margin 25% EBITDA $112 billion 52 week low $103.10 52 week high $157.26 Average Wall Street rating and price target Buy $166.7

Apple stock forecast

Now that Apple has arrested the decline and retraced to the 9-day moving average, the next stage of the recovery needs to begin. This is why we remain neutral on the stock for now. Apple is in an area of high volume, making gains harder to achieve. Only above $152 do we turn bullish as this takes out last week's high of $151.42 and will make the weekly candle an outside candle, assuming we do this next week and not this week. Technically, the short-term chart turned bearish on September 10 with a sharp fall below the 9 and 21-day moving averages, which set a lower high, always a classic bearish trend. This was not followed up with a lower low until $144.50 was broken on Monday. This created the channel highlighted. Apple is now at the point of breaking out of this, but only breaking last week's high at $151.42 will turn us bullish.

FXStreet View: Neutral, bearish below $144.50, bullish above $152.","Apple recovers but stalls at the 9-day moving average.
Apple recovered further ground on Thursday, but the move ran out of steam at the key short-term, 9-day moving average.
This or the 8 or 10-day moving average (whichever is your preference) are closely watched by short-term swing traders as it gives an easy guide to sentiment.
Buying dips to the 9-day moving average would have kept you on that strong surge from $125 to $150.
Apple stock closed at $146.83 for a gain of 0.67%.",https://www.fxstreet.com/news/apple-aapl-stock-price-and-forecast-apple-stuck-is-it-time-to-buy-202109241053,2021-09-20 14:26:01.135000+00:00
5,AAPL,Apple (AAPL) Stock Price and Forecast: Three reasons why its time to buy Apple?,"Apple pops as Fed helps calm equities.

No timeline was given for the taper but soon.

Equities and AAPL recover some lost ground.

Time to rally now that the Fed is out of the way. Let us go through the recent wall of worry that has been plaguing equity markets for most of September. First, September itself is historically not a good month for equities. Thankfully, then we only have one more week of trading before September is behind us. The Delta variant still rages around the world, but increasing evidence is showing vaccines do work and are the pathway out of lockdowns and more importantly future lockdowns, which would further hurt economic activity. Evergrande is still a worry but it has repaid some interest, and there are rumours that China is about to step in and steady things as hoped. Either way, investors have downgraded this one.

That is about it apart from talk of a US default as political squabbling over the debt ceiling continues, but really does anyone truly believe the politicians are going to mess things up that much! Ahem, ok, keep your comments to yourselves! Politicians are capable of some shocking mismanagement, but we just cannot see it getting to that stage.

After a poor session on Tuesday with a tiny range, Wednesday was a better performance with AAPL stock opening strongly and pushing on for much of the session, eventually closing up 1.69% at $145.85. Nice and steady movement, but there is still more to do before we can turn bullish on Apple.

Apple 15-minute chart

We can also see from the intraday chart above how the move continued for the session and closed near the high of the day. Always a good sign in our view.

Apple key statistics

Market Cap $2.4 trillion Enterprise Value $2.3 trillion Price/Earnings (P/E) 29 Price/Book 38 Price/Sales 9 Gross Margin 41% Net Margin 25% EBITDA $112 billion 52 week low $103.10 52 week high $157.26 Average Wall Street rating and price target Buy $166.7

Apple stock forecast

The support at $141.67 that we have had in place for some time looks to have held the decline for now, and things are starting to look bullish for the stock again. Below $141.67 we had cautioned that the move could accelerate due to a lack of volume, but now this has been avoided. The first target is the 9-day moving average at $146.95. Apple filled the gap created by Monday's ugly session. We expect this move to continue with a positive backdrop now in place again for equities and some headwinds behind us. Yesterday we said neutral between $146 and $152, and this is still the case. Breaking $152 will take out last week's high and on the weekly chart give us a bullish outside candle. We favour further gains, but the potential has not fully played out. Hence, we remain with the neutral stance until $152 is broken.

FXStreet View: Neutral, bullish above $152, bearish below $141.67.

FXStreet Ideas: Strong support at $134, so this is our buy zone. Buying a 25% delta (out of the money) short-term put could be an interesting strategy on a sharp break of $141.67.","Let us go through the recent wall of worry that has been plaguing equity markets for most of September.
Nice and steady movement, but there is still more to do before we can turn bullish on Apple.
Breaking $152 will take out last week's high and on the weekly chart give us a bullish outside candle.
FXStreet View: Neutral, bullish above $152, bearish below $141.67.
Buying a 25% delta (out of the money) short-term put could be an interesting strategy on a sharp break of $141.67.",https://www.fxstreet.com/news/apple-aapl-stock-price-and-forecast-three-reasons-why-its-time-to-buy-apple-202109231139,2021-09-20 14:26:01.135000+00:00
