,Ticker,Title,Article,Summary,Link,Date
77,TSLA,Bermuda Stock Exchange Begins Publishing MIAX Pearl Equities Market Data to the Pyth Network,"PRINCETON, N.J. and HAMILTON, Bermuda, Sept. 21, 2021 /PRNewswire/ -- MIAX®, creator and operator of high-performance securities exchanges, products and services, today announced that the Bermuda Stock Exchange (BSXTM), a wholly-owned subsidiary of Miami International Holdings, Inc., the parent company of MIAX, has successfully commenced publishing MIAX Pearl EquitiesTM market data for 10 actively traded U.S. companies to the Pyth Network. This is the first initiative by BSX to provide high fidelity data to the Pyth Network. Bermuda is recognized as having a strong fintech and digital regulatory framework created by the Bermuda Government with the passage of the Digital Asset Business Act of 2018 (DABA).

MIAX Pearl Equities market data is among the first U.S. equities exchange market data provided to the Pyth Network and was first published to the Pyth Network on September 13, 2021. BSX is publishing market data based on MIAX Pearl Equities top of book for selected symbols which is conflated and submitted to the Pyth Network at 400ms intervals to adhere to the requirements of the network.

""BSX is delighted to begin publishing MIAX Pearl Equities market data to the Pyth Network and anticipates we will quickly expand the breadth of data we are publishing to the network,"" said Thomas P. Gallagher, Chairman of BSX and Chairman & CEO of MIAX. ""Publishing high fidelity U.S. equity market data to the Pyth Network represents a critical initiative to participate in a market data oracle designed to support the DeFi markets of tomorrow.""

The initial set of 10 companies being published to the Pyth Network include Apple Inc. (AAPL), AMC Entertainment Holdings Inc. (AMC), Amazon.com Inc. (AMZN), General Electric Inc. (GE), Game Stop Inc. (GME), Google Inc. (GOOG), Netflix Inc. (NFLX), Invesco QQQ Trust Series 1 ETF (QQQ), SPDR S&P 500 ETF Trust (SPY) and Tesla Inc. (TSLA).

Dave Olsen, President and Chief Investment Officer at Jump Trading Group, added, ""The success of the Pyth Network is closely aligned with the quality of the market data being published to the oracle. The addition of MIAX Pearl Equities market data represents a critical inflection point for the Pyth Network as the availability of high fidelity market data from U.S. equities exchanges is unprecedented in DeFi.""

Story continues

Corporate Communications Contacts:

MIAX/BSX

Andy Nybo, SVP, Chief Communications Officer

609-524-3272

anybo@miami-holdings.com

About MIAX

MIAX's parent holding company, Miami International Holdings, Inc., owns Miami International Securities Exchange, LLC (MIAX®), MIAX PEARL, LLC (MIAX Pearl®), MIAX Emerald, LLC (MIAX Emerald®), the Minneapolis Grain Exchange, LLC (MGEX), and the Bermuda Stock Exchange (BSX).

MIAX, MIAX Pearl and MIAX Emerald are national securities exchanges registered with the Securities and Exchange Commission (SEC) that leverage MIAX's industry-leading technology and infrastructure to provide U.S. listed options trading to their member firms. MIAX serves as the exclusive exchange venue for cash-settled options on the SPIKES® Volatility Index (Ticker: SPIKE), a measure of the expected 30-day volatility in the SPDR® S&P 500® ETF (SPY). In addition to options, MIAX Pearl facilitates the trading of cash equities through MIAX Pearl Equities™.

MGEX is a registered exchange with the Commodity Futures Trading Commission (CFTC) and is a Notice Registered Securities Futures Product Exchange with the SEC. MGEX serves as the exclusive market for a variety of products, including Hard Red Spring Wheat and SPIKES Futures. In addition, MGEX is a Designated Contract Market (DCM) and Derivatives Clearing Organization (DCO) under the CFTC, providing DCM, DCO and cash market services in an array of asset classes.

BSX is a leading electronic international securities market regulated by the Bermuda Monetary Authority (BMA) specializing in the listing and trading of capital market instruments such as equities, debt issues, funds, hedge funds, derivative warrants and insurance linked securities. A full member of the World Federation of Exchanges and affiliate member of the International Organization of Securities Commissions, the BSX is globally recognized, including by the SEC.

MIAX's executive offices and National Operations Center are located in Princeton, NJ, with additional offices located in Miami, FL, Minneapolis, MN, and Hamilton, Bermuda.

To learn more about MIAX visit www.MIAXOptions.com .

To learn more about MGEX visit www.mgex.com .

To learn more about the BSX visit www.BSX.com .

Disclaimer and Cautionary Note Regarding Forward-Looking Statements

The press release shall not constitute an offer to sell or a solicitation of an offer to purchase any securities of Miami International Holdings, Inc. (together with its subsidiaries, the Company), and shall not constitute an offer, solicitation or sale in any state or jurisdiction in which such offer; solicitation or sale would be unlawful. This press release may contain forward-looking statements, including forward-looking statements within the meaning of the Private Securities Litigation Reform Act of 1995. Forward-looking statements describe future expectations, plans, results, or strategies and are generally preceded by words such as ""may"", ""future"", ""plan"" or ""planned"", ""will"" or ""should"", ""expected,"" ""anticipates"", ""draft"", ""eventually"" or ""projected"". You are cautioned that such statements are subject to a multitude of risks and uncertainties that could cause future circumstances, events, or results to differ materially from those projected in the forward-looking statements, including the risks that actual results may differ materially from those projected in the forward-looking statements.

All third-party trademarks (including logos and icons) referenced by the Company remain the property of their respective owners. Unless specifically identified as such, the Company's use of third-party trademarks does not indicate any relationship, sponsorship, or endorsement between the owners of these trademarks and the Company. Any references by the Company to third-party trademarks is to identify the corresponding third-party goods and/or services and shall be considered nominative fair use under the trademark law.

Cision

View original content to download multimedia:https://www.prnewswire.com/news-releases/bermuda-stock-exchange-begins-publishing-miax-pearl-equities-market-data-to-the-pyth-network-301381304.html

SOURCE MIAX; The Bermuda Stock Exchange","MIAX Pearl Equities market data is among the first U.S. equities exchange market data provided to the Pyth Network and was first published to the Pyth Network on September 13, 2021.
""Publishing high fidelity U.S. equity market data to the Pyth Network represents a critical initiative to participate in a market data oracle designed to support the DeFi markets of tomorrow.""
The addition of MIAX Pearl Equities market data represents a critical inflection point for the Pyth Network as the availability of high fidelity market data from U.S. equities exchanges is unprecedented in DeFi.""
Story continuesCorporate Communications Contacts:MIAX/BSXAndy Nybo, SVP, Chief Communications Officer609-524-3272anybo@miami-holdings.comAbout MIAXMIAX's parent holding company, Miami International Holdings, Inc., owns Miami International Securities Exchange, LLC (MIAX®), MIAX PEARL, LLC (MIAX Pearl®), MIAX Emerald, LLC (MIAX Emerald®), the Minneapolis Grain Exchange, LLC (MGEX), and the Bermuda Stock Exchange (BSX).
In addition to options, MIAX Pearl facilitates the trading of cash equities through MIAX Pearl Equities™.",https://finance.yahoo.com/news/bermuda-stock-exchange-begins-publishing-120000716.html,2021-09-21 00:00:00
78,TSLA,Could Ford Electric Vehicles Become Cop Car Of Choice? What Investors Should Know,"One of the oldest automotive companies has a storied history in being one of the companies used for police vehicles. A new test could see one state utilize electric vehicles from the automaker going forward.

What Happened: The Ford Motor Co (NYSE: F) Mustang Mach-E is set to be tested by the Michigan State Police.

The vehicle will be tested by the MSP as part of its 2022 Model Year Police Evaluation.

Ford will use the pilot program for the Mustang Mach-E as “a benchmark while it continues to explore purpose-built electric police vehicles in the future.”

Related Link: Ford Stock Rises On Q2 Revenue Beat: What Investors Should Know

Why It’s Important: Ford seeks to be a leader in the electric vehicle market and also continues to provide vehicles for state police agencies, which can bring in lucrative contract and recurring revenue.

Law enforcement agencies are turning to electric vehicles as a cost-cutting measure. Electric vehicles typically come with higher upfront costs, but make up for it with the lower maintenance and associated costs.

Ford has delivered electric police vehicles to the city of Ann Arbor in Michigan and also unveiled a Mach-E police car in the United Kingdom that has seen strong interest from test police agencies.

Tesla Inc (NASDAQ: TSLA) has been a popular choice for police testing. The Fremont police department purchased a Tesla Model S in 2018. The vehicle saved the police department over $2,000 compared to its normal Ford police vehicle.

As more police departments consider switching to Teslas or other electric vehicles to save costs, Ford is stepping up its game to maintain the potential contracts and relationships with police agencies.

F Price Action: F shares were down 5.57% at $12.80 midday Monday.

See more from Benzinga

© 2021 Benzinga.com. Benzinga does not provide investment advice. All rights reserved.","A new test could see one state utilize electric vehicles from the automaker going forward.
What Happened: The Ford Motor Co (NYSE: F) Mustang Mach-E is set to be tested by the Michigan State Police.
Law enforcement agencies are turning to electric vehicles as a cost-cutting measure.
Electric vehicles typically come with higher upfront costs, but make up for it with the lower maintenance and associated costs.
As more police departments consider switching to Teslas or other electric vehicles to save costs, Ford is stepping up its game to maintain the potential contracts and relationships with police agencies.",https://finance.yahoo.com/news/could-ford-electric-vehicles-become-155318403.html,2021-09-21 00:00:00
79,TSLA,Exxon Vs. Tesla: Which Stock Is The Better Buy For 2025?,"Javascript is Disabled

Your current browser configuration

is not compatible with this site.",Javascript is DisabledYour current browser configurationis not compatible with this site.,https://seekingalpha.com/article/4456226-exxon-vs-tesla-stock-better-buy-2025,2021-09-21 00:00:00
80,TSLA,"Ford, Redwood form 'circular' supply chain for EV battery materials","Ford Mustang Mach-E GT is seen during the Munich Auto Show, IAA Mobility 2021 in Munich, Germany, September 8, 2021. REUTERS/Michaela Rehle/File Photo

Sept 22 (Reuters) - Ford Motor Co (F.N) and startup Redwood Materials said on Wednesday they are partnering to form a ""closed loop"" or circular supply chain for electric vehicle batteries, from raw materials to recycling.

The aim is to lower the cost of EVs by reducing the dependence on imported materials, while also narrowing the environmental impact from mining and refining of battery materials.

Ford and Redwood will work closely with Korean battery maker SK Innovation (096770.KS), which has a joint venture with Ford called BlueOvalSK to make EV battery cells in the United States, Ford executive Lisa Drake said at a media briefing.

The issue

Redwood, which was founded in 2017 by former Tesla Inc (TSLA.O) executive J.B. Straubel, has been recycling battery scrap and materials at facilities in Nevada.

In mid-September, the company said it would expand its business to include refining those materials into battery components, including cathodes and anodes, with the aim of supplying enough of those components to equip a million electric vehicles after 2025. read more

In July, Redwood raised $700 million from investors, including Amazon.com Inc (AMZN.O), Fidelity, T. Rowe Price and Baillie Gifford. On Wednesday, Straubel said Ford had invested $50 million. Redwood currently is valued at $3.7 billion by investor website PitchBook. read more

Redwood has partnerships with battery makers Panasonic in Nevada and Envision AESC in Tennessee, as well as Amazon.

The issue of battery life-cycle management has taken on increasing importance in the plans of both vehicle and battery manufacturers.

General Motors Co (GM.N) President Mark Reuss, at a conference on Tuesday, said recycling and reuse of EV battery materials is a crucial issue for the auto industry as it ramps up production of electric vehicles. read more

""There's a lot of material in a battery cell that can be reused,"" he said. ""We're spending time on that.""

GM and battery partner LG Energy Solution (051910.KS) in May announced a partnership with startup Li-Cycle (LICY.N) to recycle battery scrap material from Ultium Cells, the GM-LGES joint venture that is building battery plants in Ohio and Tennessee.

Straubel said Redwood aims to begin recycling some material from Ford this year, with the goal of supplying the first anode material in 2023-2024 and the first cathode material at mid-decade.

Reporting by Paul Lienert in Detroit Editing by Matthew Lewis

Our Standards: The Thomson Reuters Trust Principles.","REUTERS/Michaela Rehle/File PhotoSept 22 (Reuters) - Ford Motor Co (F.N) and startup Redwood Materials said on Wednesday they are partnering to form a ""closed loop"" or circular supply chain for electric vehicle batteries, from raw materials to recycling.
The aim is to lower the cost of EVs by reducing the dependence on imported materials, while also narrowing the environmental impact from mining and refining of battery materials.
Ford and Redwood will work closely with Korean battery maker SK Innovation (096770.KS), which has a joint venture with Ford called BlueOvalSK to make EV battery cells in the United States, Ford executive Lisa Drake said at a media briefing.
The issueRedwood, which was founded in 2017 by former Tesla Inc (TSLA.O) executive J.B. Straubel, has been recycling battery scrap and materials at facilities in Nevada.
The issue of battery life-cycle management has taken on increasing importance in the plans of both vehicle and battery manufacturers.",https://www.reuters.com/business/autos-transportation/ford-redwood-form-circular-supply-chain-ev-battery-materials-2021-09-22/,2021-09-22 00:00:00
81,TSLA,Fremont Police Department Announces New Tesla for Vehicle Fleet,"Several police departments have been experimenting with Tesla Inc (NASDAQ: TSLA) electric vehicles in their lineups. The cars are fast, require very little maintenance and have a much lower cost of ownership over the lifetime of the vehicle compared to a gas car.

Now as shared by Tesmanian, the Fremont Police Department in California has added a new Tesla to its fleet: a new Model Y crossover. An earlier trial run with the Tesla Model 3 showed the department it could save big bucks running a Tesla as an official police vehicle.

Today, @FremontPD announced the deployment of a #Tesla Model Y to its #police fleet. The Department’s fleet of #hybrid and electric cars features over forty vehicles and four charging stations. Learn more by visiting https://t.co/SxKafgElHK. pic.twitter.com/LyCVJAS2kV

— Fremont Police Department (@FremontPD) September 22, 2021

The department is also using hybrid vehicles in an effort to lower its carbon footprint. The station has four chargers installed to charge up the EVs between shifts.

According to the purchasing document, the vehicle cost the department $60,284.08 after taxes and fees. The Model Y be available for the public and media to check out on Oct. 1, 2021, 5 p.m. – 9 p.m. at the Fremont Main Library.

Photo courtesy of Fremont Police Department.","Now as shared by Tesmanian, the Fremont Police Department in California has added a new Tesla to its fleet: a new Model Y crossover.
An earlier trial run with the Tesla Model 3 showed the department it could save big bucks running a Tesla as an official police vehicle.
Today, @FremontPD announced the deployment of a #Tesla Model Y to its #police fleet.
pic.twitter.com/LyCVJAS2kV— Fremont Police Department (@FremontPD) September 22, 2021The department is also using hybrid vehicles in an effort to lower its carbon footprint.
The Model Y be available for the public and media to check out on Oct. 1, 2021, 5 p.m. – 9 p.m. at the Fremont Main Library.",https://www.benzinga.com/government/21/09/23078545/fremont-police-department-announces-new-tesla-for-vehicle-fleet,2021-09-22 00:00:00
82,TSLA,Should You Invest in the Fidelity MSCI Consumer Discretionary Index ETF (FDIS)?,"Looking for broad exposure to the Consumer Discretionary - Broad segment of the equity market? You should consider the Fidelity MSCI Consumer Discretionary Index ETF (FDIS), a passively managed exchange traded fund launched on 10/21/2013.

While an excellent vehicle for long term investors, passively managed ETFs are a popular choice among institutional and retail investors due to their low costs, transparency, flexibility, and tax efficiency.

Sector ETFs are also funds of convenience, offering many ways to gain low risk and diversified exposure to a broad group of companies in particular sectors. Consumer Discretionary - Broad is one of the 16 broad Zacks sectors within the Zacks Industry classification. It is currently ranked 6, placing it in top 38%.

Index Details

The fund is sponsored by Fidelity. It has amassed assets over $1.58 billion, making it one of the larger ETFs attempting to match the performance of the Consumer Discretionary - Broad segment of the equity market. FDIS seeks to match the performance of the MSCI USA IMI Consumer Discretionary Index before fees and expenses.

MSCI USA IMI Consumer Discretionary Index represents the performance of the consumer discretionary sector in the U.S. equity market.

Costs

When considering an ETF's total return, expense ratios are an important factor, and cheaper funds can significantly outperform their more expensive counterparts in the long term if all other factors remain equal.

Annual operating expenses for this ETF are 0.08%, making it the least expensive product in the space.

It has a 12-month trailing dividend yield of 0.55%.

Sector Exposure and Top Holdings

It is important to delve into an ETF's holdings before investing despite the many upsides to these kinds of funds like diversified exposure, which minimizes single stock risk. And, most ETFs are very transparent products that disclose their holdings on a daily basis.

This ETF has heaviest allocation in the Consumer Discretionary sector--about 98.40% of the portfolio.

Story continues

Looking at individual holdings, Amazon.com Inc Common Stock Usd.01 (AMZN) accounts for about 23.97% of total assets, followed by Tesla Inc Common Stock Usd.001 (TSLA) and Home Depot Inc Common Stock Usd.05 (HD).

The top 10 holdings account for about 56.69% of total assets under management.

Performance and Risk

So far this year, FDIS has added about 14.96%, and it's up approximately 34.76% in the last one year (as of 09/21/2021). During this past 52-week period, the fund has traded between $59.50 and $83.37.

The ETF has a beta of 1.25 and standard deviation of 24.94% for the trailing three-year period, making it a medium risk choice in the space. With about 302 holdings, it effectively diversifies company-specific risk.

Alternatives

Fidelity MSCI Consumer Discretionary Index ETF holds a Zacks ETF Rank of 2 (Buy), which is based on expected asset class return, expense ratio, and momentum, among other factors. Because of this, FDIS is an excellent option for investors seeking exposure to the Consumer Discretionary ETFs segment of the market. There are other additional ETFs in the space that investors could consider as well.

Vanguard Consumer Discretionary ETF (VCR) tracks MSCI US Investable Market Consumer Discretionary 25/50 Index and the Consumer Discretionary Select Sector SPDR ETF (XLY) tracks Consumer Discretionary Select Sector Index. Vanguard Consumer Discretionary ETF has $6.55 billion in assets, Consumer Discretionary Select Sector SPDR ETF has $19.49 billion. VCR has an expense ratio of 0.10% and XLY charges 0.12%.

Bottom Line

To learn more about this product and other ETFs, screen for products that match your investment objectives and read articles on latest developments in the ETF investing universe, please visit Zacks ETF Center.



Want the latest recommendations from Zacks Investment Research? Today, you can download 7 Best Stocks for the Next 30 Days. Click to get this free report



Fidelity MSCI Consumer Discretionary Index ETF (FDIS): ETF Research Reports



Amazon.com, Inc. (AMZN) : Free Stock Analysis Report



The Home Depot, Inc. (HD) : Free Stock Analysis Report



Tesla, Inc. (TSLA) : Free Stock Analysis Report



Consumer Discretionary Select Sector SPDR ETF (XLY): ETF Research Reports



Vanguard Consumer Discretionary ETF (VCR): ETF Research Reports



To read this article on Zacks.com click here.","You should consider the Fidelity MSCI Consumer Discretionary Index ETF (FDIS), a passively managed exchange traded fund launched on 10/21/2013.
MSCI USA IMI Consumer Discretionary Index represents the performance of the consumer discretionary sector in the U.S. equity market.
Vanguard Consumer Discretionary ETF (VCR) tracks MSCI US Investable Market Consumer Discretionary 25/50 Index and the Consumer Discretionary Select Sector SPDR ETF (XLY) tracks Consumer Discretionary Select Sector Index.
Vanguard Consumer Discretionary ETF has $6.55 billion in assets, Consumer Discretionary Select Sector SPDR ETF has $19.49 billion.
Click to get this free reportFidelity MSCI Consumer Discretionary Index ETF (FDIS): ETF Research ReportsAmazon.com, Inc. (AMZN) : Free Stock Analysis ReportThe Home Depot, Inc. (HD) : Free Stock Analysis ReportTesla, Inc. (TSLA) : Free Stock Analysis ReportConsumer Discretionary Select Sector SPDR ETF (XLY): ETF Research ReportsVanguard Consumer Discretionary ETF (VCR): ETF Research ReportsTo read this article on Zacks.com click here.",https://finance.yahoo.com/news/invest-fidelity-msci-consumer-discretionary-102010724.html,2021-09-22 00:00:00
