,Ticker,Title,Article,Summary,Link,Date
42,TSLA,Vietnam's carmaker VinFast eyes more countries for its European strategy,"Workers at Vinfast's auto plant on the occasion of its opening ceremony in Hai Phong city, Vietnam June 14, 2019. REUTERS/Kham/File Photo

TURIN, Sept 23 (Reuters) - Vietnamese carmaker VinFast could add other markets in 2023 to expand its European strategy beyond a planned debut in Germany, France and the Netherlands next year.

The company, a unit of Vingroup JSC (VIC.HM) Vietnam's largest conglomerate which some have called ""Vietnam's answer to Tesla"" (TSLA.O), will debut in Europe next year with two battery electric SUVs models, the midsized VF e35 and the seven-seater VF e36, both designed by Italy's Pininfarina (PNNI.MI). read more

The two models launch in Vietnam, North America and Europe around mid-2022, after an unveiling planned later this year.

VinFast became Vietnam's first fully fledged domestic car manufacturer when its first gasoline-powered models built under its own badge hit the streets in 2019.

VinFast's B2B Sales Vice President Emiel Hendriksen said on Thursday it was also looking at Italy, Scandinavia, Switzerland and Austria for a second step in its European strategy.

""We're considering those countries for 2023,"" he said during a presentation at Pininfarina headquarters in Turin.

VinFast will initially rely on a direct distribution model in Germany, France and the Netherlands, based on property showrooms, but could later consider an agency-model for sales in other countries, Hendriksen said.

The company sold about 30,000 vehicles domestically last year and had set a target of selling 15,000 electric vehicles in 2022, although its representatives did not provide detailed forecasts for the European market on Thursday. read more

Earlier this year sources said parent Vingroup JSC was considering an U.S. initial public offering (IPO) of its car unit that could value VinFast at about $60 billion, though an initial second-quarter deadline for the deal mentioned by one of the sources was delayed.

VinFast Europe CEO Bich Tran said any IPO decision was up to the company's headquarters in Vietnam.

""Our European plans are independent from any IPO. We're carrying on with our plans, everything in Europe is moving as planned,"" she said.

Reporting by Giulio Piovaccari, editing by David Evans

Our Standards: The Thomson Reuters Trust Principles.","Workers at Vinfast's auto plant on the occasion of its opening ceremony in Hai Phong city, Vietnam June 14, 2019.
REUTERS/Kham/File PhotoTURIN, Sept 23 (Reuters) - Vietnamese carmaker VinFast could add other markets in 2023 to expand its European strategy beyond a planned debut in Germany, France and the Netherlands next year.
read moreThe two models launch in Vietnam, North America and Europe around mid-2022, after an unveiling planned later this year.
VinFast became Vietnam's first fully fledged domestic car manufacturer when its first gasoline-powered models built under its own badge hit the streets in 2019.
VinFast Europe CEO Bich Tran said any IPO decision was up to the company's headquarters in Vietnam.",https://www.reuters.com/business/autos-transportation/vietnams-carmaker-vinfast-eyes-more-countries-its-european-strategy-2021-09-23/,2021-09-23 00:00:00
43,TSLA,German auto giants place their bets on hydrogen cars,"MUNICH, Sept 22 (Reuters) - Battery power may be the frontrunner to become the car technology of the future, but don't rule out the underdog hydrogen.

That's the view of some major automakers, including BMW (BMWG.DE) and Audi (VOWG_p.DE), which are developing hydrogen fuel-cell passenger vehicle prototypes alongside their fleets of battery cars as part of preparations to abandon fossil fuels.

They are hedging their bets, calculating that a change in political winds could shift the balance towards hydrogen in an industry shaped by early-mover Tesla's (TSLA.O) decision to take the battery-powered road to clean cars.

Global auto hub Germany is in sharp focus. It is already betting billions on hydrogen fuel in sectors like steel and chemicals to meet climate targets, and closely-fought elections this month could see the Greens enter the coalition government and further push the technology.

BMW is hydrogen's biggest proponent among Germany's carmakers, charting a path to a mass-market model around 2030. The company also has one eye on shifting hydrogen policies in Europe and in China, the world's largest car market.

The Munich-based premium player has developed a hydrogen prototype car based on its X5 SUV, in a project already partly funded by the German government.

Jürgen Guldner, the BMW vice president who heads up the hydrogen fuel-cell car programme, told Reuters the carmaker would build a test fleet of close to 100 cars in 2022.

""Whether this (technology) is driven by politics or demand, we will be ready with a product,"" he said, adding that his team is already working to develop the next generation vehicles.

""We're on the verge of getting there and we're really convinced we'll see a breakthrough in this decade,"" he said.

VW's premium Audi brand told Reuters it had assembled a team of more than 100 mechanics and engineers who were researching hydrogen fuel cells on behalf of the whole Volkswagen group, and had built a few prototype cars.

loading

HYDROGEN TOO COSTLY NOW

Hydrogen is viewed as a sure bet by the world's biggest truckmakers, such as Daimler AG (DAIGn.DE) unit Daimler Truck, Volvo Trucks (VOLVb.ST) and Hyundai (005380.KS), because batteries are too heavy for long-distance commercial vehicles.

Yet fuel cell technology - where hydrogen passes through a catalyst, producing electricity - is for now too costly for mass-market consumer cars. Cells are complex and contain expensive materials, and although refuelling is quicker than battery recharging, infrastructure is more scarce.

The fact that hydrogen is so far behind in the race to the affordable market also means even some champions of the technology, like Germany's Greens, favour prioritising battery-powered passenger cars because they see them as the fastest way to reach their main goal of decarbonising transport.

The Greens do, however, back the use of hydrogen fuel for ships and planes and want to invest heavily in ""green"" hydrogen produced solely from renewable sources.

""Hydrogen will play a highly important role in the transport industry,"" said Stefan Gelbhaar, the party's transport policy spokesperson in the Bundestag.

Politics can be unpredictable though - diesel went from saint to sinner following Volkswagen's Dieselgate emissions-cheating scandal, which came to light in 2015. Some carmakers view hydrogen technology as an insurance policy as the EU targets an effective ban on fossil-fuel cars from 2035.

Last year Daimler said it would wind down production of the Mercedes-Benz GLC F-CELL, a hydrogen fuel-cell SUV, but a source familiar with company plans said the project could easily be revived if the European Commission or a German government with Green participation decide to promote hydrogen cars.

""We're focusing on (battery) electric first, but we're in close cooperation with our truck guys,"" said Jörg Burzer, Daimler's head of production, when asked about that approach.

1/6 BMW iX5 Hydrogen is seen during Munich Auto Show, IAA Mobility 2021 in Munich, Germany, September 8, 2021. REUTERS/Wolfgang Rattay Read More

""The technology is always available.""

180 KPH IN HYDROGEN X5

For years Japanese carmakers Toyota (7203.T), Nissan (7201.T) and Honda (7267.T), and South Korea's Hyundai, were alone in developing and pushing hydrogen fuel-cell cars, but now they have company.

China is expanding its hydrogen fuelling infrastructure, with several carmakers now working on fuel-cell cars, including Great Wall Motor (601633.SS), , which plans to develop hydrogen-powered SUVs.

The EU wants to build more hydrogen fuelling stations for commercial vehicles. Fitch Solutions auto analyst Joshua Cobb said the bloc was only likely to start pushing hydrogen passengers cars in two to three years' time, given it was still figuring out how to pay for its battery-electric car push and how to obtain enough ""green"" hydrogen from renewable sources.

But he added: ""It's not out of bounds to think if the (German) Greens come into power they could accelerate the push to adopt regulations favouring hydrogen fuel-cell cars.""

BMW's Guldner acknowledged hydrogen technology was too expensive to be viable for the consumer market today, but said costs would come down as trucking companies invested in the technology to bring fuel-cell vehicles to market at scale.

To demonstrate BMW's hydrogen X5 prototype, Guldner took Reuters for a spin at 180 km (112 miles) per hour on the autobahn near the carmaker's Munich headquarters and in a few minutes gave it enough fuel to run 500 km using a hydrogen gas pump at a Total petrol station.

Guldner said BMW saw hydrogen fuel-cell cars as ""complementary"" to its future battery electric model range, providing an alternative for customers who cannot charge at home, want to travel far and refuel swiftly. The motor in the hydrogen X5 is the same as BMW's all-electric iX.

""When the future is zero emissions, we believe having two answers is better than one,"" he added.

A LONG AND WINDING ROAD

Yet Fitch Solutions' Cobb said that it would still take years before any European policy support for hydrogen-powered cars translated into significant sales.

Indeed, auto consultancy LMC forecasts that various uses of hydrogen - in commercial vehicles, aviation and energy storage - would spur its adoption in passenger cars, but over the longer term.

""We're just not going to get there any time soon,"" said LMC senior powertrain analyst Sam Adham. LMC estimates in 2030 hydrogen fuel-cell models will make up just 0.1% of sales in Europe, and sales will only take off after 2035.

There remain divisions about the technology's prospects in the global car industry, and even within auto groups.

VW's Audi unit might be researching fuel cells, for example, but Volkswagen group CEO Herbert Diess has been scathing about hydrogen-powered cars.

""The hydrogen car has proven NOT to be the solution to climate change,"" he said in a tweet this year. ""Sham debates are a waste of time.""

Stephan Herbst, general manager of Toyota in Europe, has a different view.

Speaking in his role as a member of the Hydrogen Council business group, which forecasts that hydrogen will power more than 400 million cars by 2050, Herbst said he was confident that now governments had set ambitious carbon-reduction targets, they would push hydrogen alongside battery electric cars.

""We strongly believe this is not a question of either or,"" he added. ""We need both technologies.""

Reporting by Nick Carey; Additional reporting by Christina Amann in Berlin and Christoph Steitz in Frankfurt; Editing by Joseph White and Pravin Char

Our Standards: The Thomson Reuters Trust Principles.","The Greens do, however, back the use of hydrogen fuel for ships and planes and want to invest heavily in ""green"" hydrogen produced solely from renewable sources.
Some carmakers view hydrogen technology as an insurance policy as the EU targets an effective ban on fossil-fuel cars from 2035.
But he added: ""It's not out of bounds to think if the (German) Greens come into power they could accelerate the push to adopt regulations favouring hydrogen fuel-cell cars.""
LMC estimates in 2030 hydrogen fuel-cell models will make up just 0.1% of sales in Europe, and sales will only take off after 2035.
""The hydrogen car has proven NOT to be the solution to climate change,"" he said in a tweet this year.",https://www.reuters.com/technology/german-auto-giants-place-their-bets-hydrogen-cars-2021-09-22/,2021-09-22 00:00:00
44,TSLA,,,,https://www.bizjournals.com/washington/news/2021/09/23/tesla-to-open-new-arlington-dealershiop.html,2021-09-23 00:00:00
45,TSLA,Tesla Stock Continues Its Rally After Breaking Out Of Pennant Pattern - Tesla Motors (TSLA),"Tesla Inc. (NASDAQ:TSLA) shares are trading higher Friday, and the stock has been trending on social media sites throughout the day.

Tesla was up 1.7% at $766.47 at last check. Here's a technical look at the stock.

Tesla Daily Chart Analysis

The stock broke out of what technical traders call a pennant pattern and has continued to trade above the pattern support. This support may continue to hold even though the pattern looks to have finished.

After being condensed between narrowing highs and lows, the stock saw a breakout. The pattern support line is turning into a normal higher low trendline and may continue to hold as support in the future.

The stock trades above both the 50-day moving average (green), and the 200-day moving average (blue), indicating the stock is likely facing a period of bullish sentiment.

Each of these moving averages may hold as a potential area of support in the future.

The Relative Strength Index (RSI) has been trading sideways above the middle line. This shows that the stock has had more buying pressure than selling pressure throughout the past few weeks.

What’s Next For Tesla?

Bullish traders look to have control of the stock and would like to maintain it. For bulls to maintain control of the stock, they would like to see the stock stay above the higher low trendline while also holding above the moving averages.

Bearish traders are looking to see the stock fall below the support trendline and the moving averages. This may cause a possible change in trend and for the stock to start heading lower. Bears would then like to see the stock begin to form lower highs.","Tesla Inc. (NASDAQ:TSLA) shares are trading higher Friday, and the stock has been trending on social media sites throughout the day.
Tesla Daily Chart AnalysisThe stock broke out of what technical traders call a pennant pattern and has continued to trade above the pattern support.
This support may continue to hold even though the pattern looks to have finished.
The pattern support line is turning into a normal higher low trendline and may continue to hold as support in the future.
Bearish traders are looking to see the stock fall below the support trendline and the moving averages.",https://www.benzinga.com/trading-ideas/long-ideas/21/09/23093699/tesla-stock-continues-its-rally-after-breaking-out-of-pennant-pattern,2021-09-23 00:00:00
46,TSLA,Tesla's German landing will fuel competition - Volkswagen CEO,"Volkswagen CEO Herbert Diess attends the Munich Auto Show, IAA Mobility 2021, in Munich, Germany, September 7, 2021. REUTERS/Wolfgang Rattay

FRANKFURT, Sept 24 (Reuters) - The planned opening of Tesla's (TSLA.O) first gigafactory in Europe later this year will force local industry to step up its game, Volkswagen (VOWG_p.DE) Chief Executive Herbert Diess said on Friday.

Diess' comments, made on Twitter, come as Tesla continues work on its plant in Gruenheide, near Berlin, as it awaits final building approval for the 5.8 billion euro ($6.8 billion) site. read more

""Efficiency is key for the transformation of our industry/Germany. Tesla develops in shorter processes, works closer with the best in the industry and takes more risk,"" Diess, a known admirer of the electric car pioneer led by Elon Musk, said.

Wolfsburg-based Volkswagen, Europe's largest carmaker, aims to overtake Tesla as the world's top seller of electric cars by 2025, a claim that is underscored by an ambitious plan to build six large battery factories in Europe by 2030. read more

""Gruenheide will increase competition in Germany - also with Wolfsburg.""

The EV maker is hosting a public tour of the Gruenheide plant on Oct. 9, days before the final consultation for objections to its construction closes. Musk has confirmed he will attend the event, dubbed the ""Giga-fest"", in person.

($1 = 0.8540 euros)

Reporting by Christoph Steitz, Editing by Victoria Waldersee and Louise Heavens

Our Standards: The Thomson Reuters Trust Principles.","Volkswagen CEO Herbert Diess attends the Munich Auto Show, IAA Mobility 2021, in Munich, Germany, September 7, 2021.
REUTERS/Wolfgang RattayFRANKFURT, Sept 24 (Reuters) - The planned opening of Tesla's (TSLA.O) first gigafactory in Europe later this year will force local industry to step up its game, Volkswagen (VOWG_p.DE) Chief Executive Herbert Diess said on Friday.
The EV maker is hosting a public tour of the Gruenheide plant on Oct. 9, days before the final consultation for objections to its construction closes.
Musk has confirmed he will attend the event, dubbed the ""Giga-fest"", in person.
($1 = 0.8540 euros)Reporting by Christoph Steitz, Editing by Victoria Waldersee and Louise HeavensOur Standards: The Thomson Reuters Trust Principles.",https://www.reuters.com/business/autos-transportation/teslas-german-landing-will-fuel-competition-volkswagen-ceo-2021-09-24/,2021-09-24 00:00:00
47,TSLA,5 Stocks Insiders Are Selling,"When insiders sell shares, it indicates their concern in the company’s prospects or that they view the stock as being overpriced. Either way, this signals an opportunity to go short on the stock. Insider sales should not be taken as the only indicator for making an investment or trading decision. At best, it can lend conviction to a selling decision.

Below is a look at a few recent notable insider sales. For more, check out Benzinga's insider transactions platform.

Cloudera

The Trade: Cloudera, Inc. (NYSE: CLDR) President Michael Hollison disposed a total of 110126 shares at an average price of $15.94. The insider received $1,754,989.96 as a result of the transaction.

What’s Happening: Cloudera, last month, reported second-quarter FY22 revenue growth of 10% year-on-year to $236.1 million.

What Cloudera Does: Cloudera is an enterprise data cloud company. It sells software subscriptions and public cloud services for the Cloudera Data Platform (CDP) solution-set and software subscriptions for its traditional on-premises data platforms.

Tesla

The Trade: Tesla, Inc. (NASDAQ: TSLA) Chief Financial Officer Zachary Kirkhorn sold a total of 1250 shares at an average price of $756.95. The insider received $946,187.50 from selling those shares.

What’s Happening: Tesla is planning on offering car insurance, ""based on actual driving history,"" in Texas next month, as per the company’s CEO Elon Musk.

What Tesla Does: Founded in 2003 and based in Palo Alto, California, Tesla is a vertically integrated sustainable energy company that also aims to transition the world to electric mobility by making electric vehicles.

Qualys

The Trade: Qualys, Inc. (NASDAQ: QLYS) 10% owner Philippe Courtot Family Trust sold a total of 33989 shares at an average price of $120.33. The insider received $4,090,001.74 as a result of the transaction.

What’s Happening: The company, last month, reported better-than-expected Q2 results and raised FY21 guidance.

Story continues

What Qualys Does: Qualys Inc is a provider of cloud-based security and compliance solutions to enterprises, government entities, and small- and medium-sized businesses.

Progressive

The Trade: The Progressive Corporation (NYSE: PGR) President and CEO Patricia Susan Griffith sold a total of 45000 shares at an average price of $92.60. The insider received $4,166,793.00 from selling those shares.

What’s Happening: Progressive filed for a mixed shelf offering.

What Progressive Does: Progressive underwrites private and commercial auto insurance and specialty lines; it has over 20 million personal auto policies in force and is the fourth- largest auto insurer in the United States.

Halliburton

The Trade: Halliburton Company (NYSE: HAL) Director Murry Gerber sold a total of 44590 shares at an average price of $19.33. The insider received $861,782.01 from selling those shares.

What’s Happening: Halliburton is expected to report Q3 results on Tuesday, October 19, 2021.

What Halliburton Does: Halliburton is the world's second- largest oilfield-services company. Building from its origins pioneering oil and gas well cementing in the 1920s, Halliburton has evolved into the premier wellbore engineering company, with leading business lines in cementing, completion equipment, and pressure pumping.

See more from Benzinga

© 2021 Benzinga.com. Benzinga does not provide investment advice. All rights reserved.","The insider received $946,187.50 from selling those shares.
The insider received $4,166,793.00 from selling those shares.
The insider received $861,782.01 from selling those shares.
What’s Happening: Halliburton is expected to report Q3 results on Tuesday, October 19, 2021.
What Halliburton Does: Halliburton is the world's second- largest oilfield-services company.",https://finance.yahoo.com/news/5-stocks-insiders-selling-120319838.html,2021-09-24 00:00:00
48,TSLA,BOJ says to start accepting bank applications for climate scheme,"TOKYO, Sept 22 (Reuters) - The Bank of Japan said it would start accepting from Wednesday applications from financial institutions seeking to tap its new loan scheme targeting activities aimed at combating climate change.

Financial institutions will be required to disclose targets and actual results on investment and loans, as well as what steps they are taking to meet proposed disclosure rules set by the Task Force on Climate-Related Financial Disclosures (TCFD), the BOJ said in a statement on Wednesday.

The TFCD is an international body created by the Financial Stability Board (FSB) to develop disclosure rules on climate-related financial risks for companies, banks and investors. (Reporting by Leika Kihara, Tetsushi Kajimoto and Daniel Leussink Editing by Chang-Ran Kim)","TOKYO, Sept 22 (Reuters) - The Bank of Japan said it would start accepting from Wednesday applications from financial institutions seeking to tap its new loan scheme targeting activities aimed at combating climate change.
Financial institutions will be required to disclose targets and actual results on investment and loans, as well as what steps they are taking to meet proposed disclosure rules set by the Task Force on Climate-Related Financial Disclosures (TCFD), the BOJ said in a statement on Wednesday.
The TFCD is an international body created by the Financial Stability Board (FSB) to develop disclosure rules on climate-related financial risks for companies, banks and investors.
(Reporting by Leika Kihara, Tetsushi Kajimoto and Daniel Leussink Editing by Chang-Ran Kim)",https://finance.yahoo.com/news/boj-says-start-accepting-bank-032901612.html,2021-09-24 00:00:00
