,Ticker,Title,Article,Summary,Link,Date
0,TSLA,Tesla (TSLA) to Expand 'Full Self-Driving Capability' Beta,"Tesla, Inc. (TSLA) is planning to ramp up its roll out its of Full Self-Driving (FSD) software to customers by the end of this week. But regulators aren't too happy about it.



Key Takeaways Tesla plans to offer access to the latest version of its advanced driver assistance software to more drivers starting this Friday.

The National Transportation Safety Board head says the company's use of full self-driving to describe its features is ""misleading and irresponsible"" and encourages ""abuse of the technology.""

Revenue from FSD subscriptions could boost Tesla's top line.

A Trial Full Self-Driving Capability

In a tweet last week, Tesla CEO Elon Musk said that the FSD Beta V10.0.1 will be available to more drivers starting Sept. 24. The previous Beta release was tested with 2,000 drivers mostly on highways for almost a year in California.



The latest FSD version's scope has been expanded to navigating highways and city streets. A Beta button available in Tesla vehicles will request permission to assess monitor driver performance for ""good behavior"" for seven days before granting full beta access to the FSD functionality suite. Even though the FSD feature is meant to provide a degree of autonomy from driving tasks, Tesla requires drivers to remain fully engaged with their vehicles and always have their hands on the steering wheel.



A rash of accidents and mishaps have plagued Tesla vehicles since the first introduction of Autopilot and Self-Driving capability. The company is currently being investigated by the National Highway Transportation Safety Administration (NHTSA) for its Autopilot feature. The agency expanded the scope of its investigation recently by requesting data from other automakers that have incorporated similar features in their vehicles.



Full Self-Driving or Driver Assistance Software?

Tesla refers to its systems as Autopilot or self-driving systems, thereby implying auto-navigation and driving capability for its vehicles. They are actually advanced driver assistance systems (ADAS) that automate driving tasks. Examples of such tasks include parking cars using the Summon feature, navigating on Autopilot, and moving from a highway on-ramp to off-ramp and changing lanes. Tesla's systems are currently at Level 2. Full autonomy—or a vehicle that is capable of driving itself through city streets and highways—is achieved only at Level 5. In previous earnings calls and presentations, Tesla CEO Elon Musk has provided ambitious timelines to roll out full self-driving, only to backtrack and call the feature's development and implementation ""really quite, quite tricky.""



Not surprisingly, safety regulators have taken exception to Tesla's latest efforts to market its self-driving offerings. Jennifer Homendy, head of the National Transportation Safety Board, characterized Tesla's use of the FSD term as ""misleading and irresponsible"" and said that its use has ""misled numerous people to misuse and abuse technology."" Homendy told The Wall Street Journal, ""Basic safety issues have to be addressed before they're then expanding it to other city streets and other areas.""



Meanwhile, a recent MIT study concluded that drivers are less engaged with their Tesla vehicles in Autopilot mode. According to the study's authors, drivers looked less on road and were more involved in non-driving tasks during Autopilot as compared to manual driving. ""Visual behavior patterns change before and after [Autopilot] disengagement,"" the authors wrote. ""The higher proportion of off-road glances before disengagement to manual driving were not compensated by longer glances ahead.""



Self-Driving to Profits?

Tesla's push to expand the market for its FSD subscriptions could boost its revenue in the coming quarters. The company charges $199 per month for an upgrade from Basic Autopilot to FSD capability. Downloading the entire FSD suite cost $10,000.

Gene Munster, Loup Ventures managing partner, has estimated that booked operating profit from FSD will jump from the current $600 million in 2021 to $102 billion in 2032, if 80% of Teslas on the road at the end of 2013 opt to subscribe to the feature. FSD news and advances also have an effect on the company's stock price. Tesla's stock fell by 5% after the NHTSA announced its investigation in August.

","Tesla, Inc. (TSLA) is planning to ramp up its roll out its of Full Self-Driving (FSD) software to customers by the end of this week.
A Beta button available in Tesla vehicles will request permission to assess monitor driver performance for ""good behavior"" for seven days before granting full beta access to the FSD functionality suite.
A rash of accidents and mishaps have plagued Tesla vehicles since the first introduction of Autopilot and Self-Driving capability.
Tesla refers to its systems as Autopilot or self-driving systems, thereby implying auto-navigation and driving capability for its vehicles.
Meanwhile, a recent MIT study concluded that drivers are less engaged with their Tesla vehicles in Autopilot mode.",https://www.investopedia.com/tesla-tsla-to-expand-full-self-driving-capability-beta-5202161,2021-09-21 17:41:40.778000+00:00
1,TSLA,Are you a robot?,"Why did this happen?

Please make sure your browser supports JavaScript and cookies and that you are not blocking them from loading. For more information you can review our Terms of Service and Cookie Policy.","Why did this happen?
Please make sure your browser supports JavaScript and cookies and that you are not blocking them from loading.
For more information you can review our Terms of Service and Cookie Policy.",https://www.bloomberg.com/news/articles/2021-09-24/tesla-starts-judging-owners-it-charged-10-000-for-self-driving,2021-09-24 00:00:00
2,TSLA,Are you a robot?,"Why did this happen?

Please make sure your browser supports JavaScript and cookies and that you are not blocking them from loading. For more information you can review our Terms of Service and Cookie Policy.","Why did this happen?
Please make sure your browser supports JavaScript and cookies and that you are not blocking them from loading.
For more information you can review our Terms of Service and Cookie Policy.",https://www.bloomberg.com/news/articles/2021-09-22/new-tesla-battery-factory-touted-in-mayor-s-now-deleted-post,2021-09-22 00:00:00
3,TSLA,Self-proclaimed ‘Elon Musk fanboy’ builds Tesla (TSLA) position worth over $4.6 billion,"A self-proclaimed ‘Elon Musk fanboy’ has managed to accumulate a Tesla (TSLA) position worth over $4 billion. He has been keeping a relatively low profile, until now.

Despite his incredible wealth, Koguan Leo has managed to stay under the radar. A Google search won’t bring up a lot other than that he is a graduate of Columbia University and New York Law School, and he founded SHI International Corp, a large IT company.

The company wrote in his bio:

“Koguan Leo started and founded SHI International Corp. in 1989. He is the Founder and Chairman of the Board. He graduated from New York Law School in 1985 with a Juris Doctor (JD) and Columbia University in 1982 with a Master of International Affairs (MIA). In his honor, KoGuan Law School of Shanghai Jiao Tong University is named after him. He is also a Global Trustee Emeriti of Asia Society.”

More recently, he made the news for buying the $54 million Singapore penthouse of James Dyson – of fame for his vacuums.

The Chinese American billionaire has become active on Twitter as of late, and he comments a lot on Tesla and Elon Musk. He even described himself as an “Elon fanboy”.

On his Twitter account, he claimed to be the third-largest individual Tesla shareholder:

@bradsferguson, Please ask @MartinViecha, head of Investor Relation of Tesla, if I am Prof. Leo KoGuan and the 3rd largest individual shareholder of Tesla who owns more Tesla shares than that of ARK Invest and Baron Capital. Moreover, I challenge you to falsify KQID time engine. https://t.co/PMLwwohEmE — KoGuan Leo (@KoguanLeo) September 22, 2021

No public record could confirm this and Koguan Leo claimed that it is due to him holding the shares in several accounts, but he summoned Tesla’s head of investor relations, Martin Viecha, who confirmed the fact.

Koguan Leo apparently owns over 6.2 million shares of Tesla, which is currently worth $4.6 billion. That would indeed make him the third largest Tesla shareholder behind Elon Musk and Larry Ellison.

While it would be hard to catch up to those two, Koguan Leo says that he is still a buyer of Tesla shares. He went as far as claiming that he will “rise and fall with Tesla”:

More than 6.2 million Tesla shares. Still buying more shares slowly. I will rise and fall with Tesla. — KoGuan Leo (@KoguanLeo) September 20, 2021

He added that he is currently raising capital to buy another one-million Tesla shares by early next year.

Ark Invest, another large Tesla shareholder, has recently been selling shares of the electric automaker in a rebalancing of their portfolio – despite promoting a $3,000 per share target price for Tesla’s stock.

Koguan Leo says that he will be buying more shares than Ark can sell.

Electrek’s Take

I think we might have found the biggest Tesla bull on the planet.

It’s hard to guarantee since his company is private – and therefore, it’s hard to tell how much he is worth – but it sounds like his Tesla investment represents a large part of his net worth.

Of course, that’s subjective, and I know many people who have the majority of their net worth in Tesla stocks, but we are not talking about 10-figure net worths like this guy.

Whether you think that’s smart or not, you have to respect the guts needed to make such a large investment. Congrats.

FTC: We use income earning auto affiliate links. More.

Subscribe to Electrek on YouTube for exclusive videos and subscribe to the podcast.","A self-proclaimed ‘Elon Musk fanboy’ has managed to accumulate a Tesla (TSLA) position worth over $4 billion.
Koguan Leo apparently owns over 6.2 million shares of Tesla, which is currently worth $4.6 billion.
That would indeed make him the third largest Tesla shareholder behind Elon Musk and Larry Ellison.
While it would be hard to catch up to those two, Koguan Leo says that he is still a buyer of Tesla shares.
He went as far as claiming that he will “rise and fall with Tesla”:More than 6.2 million Tesla shares.",https://electrek.co/2021/09/23/elon-musk-fanboy-builds-tesla-tsla-position-worth-over-4-billion/,2021-09-23 00:00:00
4,TSLA,"EV Roundup: TSLA Under NTSB Scrutiny, WKHS Drops Suit Against USPS & More","The electric vehicle (EV) market has been growing prolifically, with both legacy automakers and pure-play EV makers stepping up efforts to launch new models. While electric cars are taking off in a big way, the pickups have been rather slow in shifting gears to electric. But that’s about to change soon. Last week, the first edition version of Rivian Automotive’s all-electric R1T pickup truck rolled off the assembly line at the company’s Illinois factory. With that, this California EV startup becomes the first company to bring an e-truck into the U.S. market, beating auto giants like Tesla TSLA, Ford F and General Motors GM. Deliveries of the “Launch Edition” R1T truck will commence this month. Keeping up with the heightened competition, Ford also commenced pre-production of F-150 Lightning. The company will invest another $250 million to ramp up the production capacity of its upcoming e-pickup to 80,000 annually.

Meanwhile, Canada-based EV maker GreenPower Motor GP announced the delivery of its first fully-electric BEAST School Bus to Santa Maria Joint Union High School District. Another Canada-based EV player ElectraMeccanica SOLO also revealed plans to launch deliveries of its flagship SOLO EV for a select group of early reservation holders and fleets effective Oct 4, 2021. Deliveries to other customers and reservation holders will step up gradually once the output ramps up. Meanwhile, China-based EV startup XPeng XPEV officially launched its P5 family sedan at a price range of RMB157,900-RMB223,900. With customer deliveries in China scheduled to commence by October-end, this would be the world’s first production vehicle with built-in LiDAR technology.

Recap of the Week’s Most Important Stories

Nikola Corporation NKLA and CNH Industrial’s Iveco truck unit inaugurated the joint-venture manufacturing facility in Germany, dedicated to the development of Nikola Tre electric heavy-duty trucks. The production line, currently anticipated to be capable of manufacturing 1,000 units per shift a year, will likely be substantially ramped up in the upcoming years. The first Nikola Tre models produced at the facility will be deployed for select customers in the United States in 2022. The companies also announced their collaboration for testing and subsequent implementation of heavy-duty EVs and charging infrastructure at the Port of Hamburg during 2022.

Story continues

Tesla’s Model 3 crash in Florida last week, which killed two people, will be investigated by the U.S. National Transportation Safety Board (“NTSB”). It is still debatable whether the vehicle involved in the crash was equipped with Autopilot or not. The NTSB will commence its investigation today and complete the work within a week so as to issue a preliminary report in about 30 days. This will be the second probe by the agency in a fatal accident involving Tesla’s models in less than six months’ time. The NTSB is also investigating a lethal crash in Texas involving a Model S sedan that crashed in a tree and burst into flames, killing both passengers in April. Meanwhile, Wedbush Securities, a Los Angeles-based investment firm,anticipates Tesla — which currently carries a Zacks Rank #3 (Hold) — to deliver 900,000 cars in 2021, followed by 1.3 million deliveries in 2022. You can see the complete list of today’s Zacks #1 Rank (Strong Buy) stocks here.

Workhorse Group Inc. WKHS voluntarily withdrew its lawsuit protesting the United States Postal Service’s (USPS) decision to let Oshkosh’s Defense arm build the next-generation mail truck. The dismissal of the lawsuit comes from Workhorse’s newly-appointed CEO, Rick Dauch, who took over just six weeks ago, following several quarters of unattained production targets. Reportedly, Dauch sees multiple business opportunities for Workhorse’s last-mile delivery trucks and drone system, and wants to kindle the company’s focus on taking advantage of those. Dauch has further stated his intention of cooperating with the government on future electric vehicles (EV), rather than challenge it through litigation.

General Motors is working with South Korea's LG Energy Solution, its long-time EV partner, in tracking and solving problems linked to the battery fires in Chevrolet Bolts that have paralyzed the vehicle’s entire production line. General Motors has discovered two manufacturing defects in the battery cells supplied by LG from two of its plants (one in South Korea and one in Michigan) — a torn anode tab and folded separator — which, in rare circumstances, might lead to a battery fire. This has triggered three recalls (affecting roughly 142,000 cars) and cost $1.8 billion to the automaker since last November. To resolve the issue, the entire battery pack for the older models will be replaced, while the newer models will have only the defective modules within the pack replaced. The U.S. auto giant has extended the suspension of Bolt EV and EUV production till mid-October.

Price Performance

The following table shows the price movement of some of the major EV players over the past week and six-month period.

Zacks Investment Research



Image Source: Zacks Investment Research

In the past six months, all stocks have decreased, apart from Tesla, XPeng, and Li Auto. Canoo bore the maximum brunt, with shares declining 55%. The past week also displayed a mixed price trend, with Lordstown Motors registering the maximum gain and Li Auto being the worst performer.

What’s Next in the Space?

Stay tuned for announcements of upcoming EV models and any important updates from the red-hot industry.



Want the latest recommendations from Zacks Investment Research? Today, you can download 7 Best Stocks for the Next 30 Days. Click to get this free report



Ford Motor Company (F) : Free Stock Analysis Report



General Motors Company (GM) : Free Stock Analysis Report



Tesla, Inc. (TSLA) : Free Stock Analysis Report



GreenPower Motor Company Inc. (GP) : Free Stock Analysis Report



Workhorse Group, Inc. (WKHS) : Free Stock Analysis Report



ElectraMeccanica Vehicles Corp. (SOLO) : Free Stock Analysis Report



Nikola Corporation (NKLA) : Free Stock Analysis Report



XPeng Inc. Sponsored ADR (XPEV) : Free Stock Analysis Report



To read this article on Zacks.com click here.



Zacks Investment Research","The electric vehicle (EV) market has been growing prolifically, with both legacy automakers and pure-play EV makers stepping up efforts to launch new models.
Dauch has further stated his intention of cooperating with the government on future electric vehicles (EV), rather than challenge it through litigation.
Stay tuned for announcements of upcoming EV models and any important updates from the red-hot industry.
Click to get this free reportFord Motor Company (F) : Free Stock Analysis ReportGeneral Motors Company (GM) : Free Stock Analysis ReportTesla, Inc. (TSLA) : Free Stock Analysis ReportGreenPower Motor Company Inc. (GP) : Free Stock Analysis ReportWorkhorse Group, Inc. (WKHS) : Free Stock Analysis ReportElectraMeccanica Vehicles Corp. (SOLO) : Free Stock Analysis ReportNikola Corporation (NKLA) : Free Stock Analysis ReportXPeng Inc.
Sponsored ADR (XPEV) : Free Stock Analysis ReportTo read this article on Zacks.com click here.",https://finance.yahoo.com/news/ev-roundup-tsla-under-ntsb-153803200.html,2021-09-23 00:00:00
5,TSLA,Tesla (TSLA) Stock Price and Forecast: Why it is time to buy Tesla?,"Tesla stock rallies nearly 2% on Wednesday as stock suffering ends.

TSLA is ready to test the $780 resistance level.

Tesla is due to enter the insurance market in Texas shortly.

Tesla rallied sharply on Wednesday and outperformed the broader market in doing so. While the S&P 500 closed up just under 1%, Tesla ended the day up 1.7% and closed back above $750. The Fed paved the way for the latest series of gains with a steady approach to the taper, failing to give an exact time but nonetheless putting the idea firmly in traders' minds now. The taper has to happen sooner rather than later and interest rate hikes have been penciled in sooner than expected also now. This has calmed fears of runaway inflation, and investors have reacted positively to the news. As we have often mentioned, investors hate uncertainty, and the Fed has now removed some of that and provided clarity and certainty.

Tesla rallied steadily through the day and closed nearly at the high of the session, which is always a positive.

Tesla 15-minute chart

Tesla key statistics

Market Cap $744 billion Price/Earnings 394 Price/Sales 23 Price/Book 29 Enterprise Value $756 billion Gross Margin 22% Net Margin 6% 52-week high $900.40 52-week low $329.88 Average Wall Street Rating and Price Target Hold, $704

Tesla stock forecast

The weekly chart below shows a steady uptrend and makes you wonder what all the panic was about earlier in the week. Nothing to see here. Move on says the weekly chart with a steady uptrend in place since May. Last week's high at $761 is the first target to turn this week's candle into a continuation rather than an inside indecision candle.

The daily chart looks a bit healthier now after yesterday's move, and $760 beckons to be broken. This will set Tesla into a light volume zone, and we would not be surprised to see this level go today. Technically, we remain neutral until a break of $760, but we are increasingly tempted to go early as we feel the Fed has done its job and calmed equity fears for now. The major headwinds of Evergrande, Fed and the Delta strain are subsiding and we are left with a strong economy and cash to spend from both buybacks and consumers.

FXStreet View: Neutral until $760, bullish above $760.

FXStreet Ideas: Yesterday's advice continues. ""Buy a $780 call for 1-2 week expiry if $763 is broken. Buy support zone at $680."" Still the same, but we are tempted to buy that $780 call today.","Tesla stock rallies nearly 2% on Wednesday as stock suffering ends.
While the S&P 500 closed up just under 1%, Tesla ended the day up 1.7% and closed back above $750.
Tesla rallied steadily through the day and closed nearly at the high of the session, which is always a positive.
""Buy a $780 call for 1-2 week expiry if $763 is broken.
Still the same, but we are tempted to buy that $780 call today.",https://www.fxstreet.com/news/tesla-tsla-stock-price-and-forecast-why-it-is-time-to-buy-tesla-202109231206,2021-09-23 00:00:00
6,TSLA,Are you a robot?,"Why did this happen?

Please make sure your browser supports JavaScript and cookies and that you are not blocking them from loading. For more information you can review our Terms of Service and Cookie Policy.","Why did this happen?
Please make sure your browser supports JavaScript and cookies and that you are not blocking them from loading.
For more information you can review our Terms of Service and Cookie Policy.",https://www.bloomberg.com/news/articles/2021-09-24/tesla-s-claim-of-no-tolerance-for-racism-faces-rare-public-trial,2021-09-24 00:00:00
7,TSLA,Tesla (TSLA) Stock Price and Forecast: Why it is time to buy Tesla?,"Tesla stock rallies nearly 2% on Wednesday as stock suffering ends.

TSLA is ready to test the $780 resistance level.

Tesla is due to enter the insurance market in Texas shortly.

Tesla rallied sharply on Wednesday and outperformed the broader market in doing so. While the S&P 500 closed up just under 1%, Tesla ended the day up 1.7% and closed back above $750. The Fed paved the way for the latest series of gains with a steady approach to the taper, failing to give an exact time but nonetheless putting the idea firmly in traders' minds now. The taper has to happen sooner rather than later and interest rate hikes have been penciled in sooner than expected also now. This has calmed fears of runaway inflation, and investors have reacted positively to the news. As we have often mentioned, investors hate uncertainty, and the Fed has now removed some of that and provided clarity and certainty.

Tesla rallied steadily through the day and closed nearly at the high of the session, which is always a positive.

Tesla 15-minute chart

Tesla key statistics

Market Cap $744 billion Price/Earnings 394 Price/Sales 23 Price/Book 29 Enterprise Value $756 billion Gross Margin 22% Net Margin 6% 52-week high $900.40 52-week low $329.88 Average Wall Street Rating and Price Target Hold, $704

Tesla stock forecast

The weekly chart below shows a steady uptrend and makes you wonder what all the panic was about earlier in the week. Nothing to see here. Move on says the weekly chart with a steady uptrend in place since May. Last week's high at $761 is the first target to turn this week's candle into a continuation rather than an inside indecision candle.

The daily chart looks a bit healthier now after yesterday's move, and $760 beckons to be broken. This will set Tesla into a light volume zone, and we would not be surprised to see this level go today. Technically, we remain neutral until a break of $760, but we are increasingly tempted to go early as we feel the Fed has done its job and calmed equity fears for now. The major headwinds of Evergrande, Fed and the Delta strain are subsiding and we are left with a strong economy and cash to spend from both buybacks and consumers.

FXStreet View: Neutral until $760, bullish above $760.

FXStreet Ideas: Yesterday's advice continues. ""Buy a $780 call for 1-2 week expiry if $763 is broken. Buy support zone at $680."" Still the same, but we are tempted to buy that $780 call today.","Tesla stock rallies nearly 2% on Wednesday as stock suffering ends.
While the S&P 500 closed up just under 1%, Tesla ended the day up 1.7% and closed back above $750.
Tesla rallied steadily through the day and closed nearly at the high of the session, which is always a positive.
""Buy a $780 call for 1-2 week expiry if $763 is broken.
Still the same, but we are tempted to buy that $780 call today.",https://www.fxstreet.com/news/tesla-tsla-stock-price-and-forecast-why-it-is-time-to-buy-tesla-202109231206,2021-09-24 00:00:00
8,TSLA,Are you a robot?,"Why did this happen?

Please make sure your browser supports JavaScript and cookies and that you are not blocking them from loading. For more information you can review our Terms of Service and Cookie Policy.","Why did this happen?
Please make sure your browser supports JavaScript and cookies and that you are not blocking them from loading.
For more information you can review our Terms of Service and Cookie Policy.",https://www.bloomberg.com/news/articles/2021-09-24/tesla-s-claim-of-no-tolerance-for-racism-faces-rare-public-trial,2021-09-24 00:00:00
