,Ticker,Title,Article,Summary,Link,Date
124,TSLA,An Inside Look At The Battery Technology Company That 'Beat Tesla To Mars',"KULR Technology Group Inc (AMEX: KULR) held its ""Battery Solutions Day"" event on Tuesday afternoon.

The company develops and commercializes high-performance thermal management technologies for electronics, batteries and other components.

Batteries already represent a multi-billion dollar market, but it's expected to grow five times larger over the next 10 to 15 years, KULR Technology Group CEO Michael Mo said Tuesday during the event.

KULR Technology Group is finding success in the battery transportation and energy storage markets, he said.

The company is known for its carbon-fiber structure, he said, adding that it's so innovative, NASA incorporated it into its Mars 2020 Perseverance Rover program. ""We are proud to say that we beat Tesla Inc (NASDAQ: TSLA) to Mars,"" he said.

Technology: Keith Cochran, president and COO of KULR Technology Group, said the company's new CellCheck product will dramatically increase the safety of battery packs by providing instant analysis of current and historic health. ""We believe this will be a game-changing product for the $38 billion lithium-ion battery market.""

He referred to existing smart battery technology as a ""kindergarten-level solution.""

""CellCheck is like a master's class professor,"" Cochran said. It checks charge cycles, excess heat/cold events, vibration, pressure and much more.

The company expects CellCheck to be at the center of KULR Technology Group's smart battery platform. CellCheck is set to be released in the first half of 2022.

KULR Technology Group provides the safest passive propagation resistant packaging solution for lithium batteries. The company's packaging was utilized by NASA to ship laptop batteries to the International Space Station in 2019.

Its packaging helps to avoid explosions and fires when something goes awry inside a battery pack.

KULR Technology Group has developed a proprietary automated system that will allow cells to be optically inspected for cosmetic defects, measured for dimensional variations and checked to ensure proper capacity. The cells will also be electrically tested via a capacity cycle, Cochran said. Each cell will be given a serial number and all test data will be accessible for customers on the cloud.

KULR Technology Group expects to generate $5 million to $10 million in revenue during the first year of its cell screening project.

Photo: Courtesy of KULR Technology Group.","KULR Technology Group Inc (AMEX: KULR) held its ""Battery Solutions Day"" event on Tuesday afternoon.
KULR Technology Group is finding success in the battery transportation and energy storage markets, he said.
He referred to existing smart battery technology as a ""kindergarten-level solution.""
The company expects CellCheck to be at the center of KULR Technology Group's smart battery platform.
KULR Technology Group expects to generate $5 million to $10 million in revenue during the first year of its cell screening project.",https://www.benzinga.com/news/21/09/23041245/an-inside-look-at-the-battery-technology-company-that-beat-tesla-to-mars,2021-09-25 00:00:00
125,TSLA,"4 Top Stock Trades for Wednesday: LCID, UBER, AZO, SNAP","InvestorPlace - Stock Market News, Stock Advice & Trading Tips

Late in the day on Monday, the stock market bounced from the session lows. Then, on Tuesday, it tried to add to the bounce. But with the Fed just around the corner, bulls aren’t acting too aggressive. With all of that in mind, let’s look at a few top stock trades for Wednesday.

Top Stock Trades for Tomorrow No. 1: Lucid Motors (LCID)

Source: Chart courtesy of TrendSpider

Lucid Motors (NASDAQ:LCID) is turning a couple of heads on Tuesday, rallying more than 15% at one point during the session. These types of stocks can be difficult to trade, due to the wide-range nature they tend to have.

We were aggressively long Lucid in Top Stock Trades once it reclaimed $17.50, then outlined its path up to the $27.50 to $29.50 area last week. In that sense, LCID stock has been money for the bulls that have stuck with it.

Now, things get a little trickier, as we are in that $27.50 to $29.50 area.

If shares dip, see that Lucid holds the 21-day and 200-day moving averages. On the upside, though, let’s see if Lucid can close above $29.81. Above $30, and this name could have some upside — potentially to $38, then possibly toward $45. But let’s start with $30 and not get too optimistic.

Top Stock Trades for Tomorrow No. 2: Uber (UBER)

Source: Chart courtesy of TrendSpider

Uber (NYSE:UBER) is giving bulls a nice bounce on the day, after providing better-than-expected forecasts.

The rally has helped clear a lot of negativity on the charts, although Uber is far from being in a bullish trend. It’s a great start, though.

From here, I’d love to see Uber hold up over the 50-day moving average and the Q2 low at $43.17. Above these marks and Uber can challenge further upside levels, such as the 21-week moving average, followed by the 200-day and the $50 level.

However, should Uber lose the $43 mark, the daily VWAP and 21-day moving average are on the table, along with a potential gap-fill near $40.

Top Stock Trades for Tomorrow No. 3: AutoZone (AZO)

Source: Chart courtesy of TrendSpider

AutoZone (NYSE:AZO) enjoyed a nice post-earnings pop to the upside, although it struggled to hold those gains as it faded from the session high.

Shares were again rejected from the $1,660 area, as well as downtrend resistance and the long-term 161.8% extension. That said, it’s above all of its major daily moving averages.

If AZO stock can hold $1,600, it’s likely okay on the long side. Below that mark puts its weekly low in play around $1,560. Below that mark and the 21-week moving average is in play, followed by $1,500.

On the upside, though, a close above $1,600 puts the 2021 high in play, near $1,667. Above that, and $1,700 is on the table, followed by the $1,770 area.

Top Trades for Tomorrow No. 4: Snap (SNAP)

Source: Chart courtesy of TrendSpider

We’re seeing some nice strength out of Snap (NYSE:SNAP) lately. Shares were up a little more than 6% on Tuesday as the stock continues to digest its post-earnings gains from July. That’s about two months worth of consolidation.

For now, $70 has been acting as support, while downtrend resistance has been putting a slight squeeze lower on the stock.

Keep an eye on $75.63. That’s last week’s high.

If Snap can clear this level, that puts a weekly-up rotation in play and could give us a move back toward the $78 to $80 area, which has so far been resistance. Above that, and this name can start rallying once again, putting the 161.8% extension in play near $89.

On the downside, however, a close below $70 will not bode well for bulls, technically putting the gap-fill level in play down at $63.74.

On the date of publication, Bret Kenwell did not have (either directly or indirectly) any positions in the securities mentioned in this article. The opinions expressed in this article are those of the writer, subject to the InvestorPlace.com Publishing Guidelines.

Bret Kenwell is the manager and author of Future Blue Chips and is on Twitter @BretKenwell.

The post 4 Top Stock Trades for Wednesday: LCID, UBER, AZO, SNAP appeared first on InvestorPlace.

The views and opinions expressed herein are the views and opinions of the author and do not necessarily reflect those of Nasdaq, Inc.","InvestorPlace - Stock Market News, Stock Advice & Trading TipsLate in the day on Monday, the stock market bounced from the session lows.
With all of that in mind, let’s look at a few top stock trades for Wednesday.
Top Stock Trades for Tomorrow No.
We were aggressively long Lucid in Top Stock Trades once it reclaimed $17.50, then outlined its path up to the $27.50 to $29.50 area last week.
The post 4 Top Stock Trades for Wednesday: LCID, UBER, AZO, SNAP appeared first on InvestorPlace.",https://www.nasdaq.com/articles/4-top-stock-trades-for-wednesday%3A-lcid-uber-azo-snap-2021-09-21,2021-09-21 00:00:00
126,TSLA,NIO Stock Rises on a New EV Battery. What Makes This One Special.,"Investors are welcoming news of a new electric-vehicle battery from China’s NIO—the latest advance in a continuing effort by global auto makers to develop power packs with the right mix of range and cost.

The new battery, officially rolled out Thursday, uses ternary lithium and lithium-iron phosphate, or LFP, rather than cobalt or nickel, making it less expensive than those cells. The trade-off is that it also has a little less range per charge.

It’s...","Investors are welcoming news of a new electric-vehicle battery from China’s NIO—the latest advance in a continuing effort by global auto makers to develop power packs with the right mix of range and cost.
The new battery, officially rolled out Thursday, uses ternary lithium and lithium-iron phosphate, or LFP, rather than cobalt or nickel, making it less expensive than those cells.
The trade-off is that it also has a little less range per charge.",https://www.barrons.com/articles/nio-stock-ev-battery-cobalt-51632404526,2021-09-21 00:00:00
127,TSLA,MORNING BID-Watch those spiralling gas prices,"A look at the day ahead from Sujata Rao. A massive week in monetary policy, with some 16 central banks holding meetings and possibly the first rate hike from a developed nation -- Norway. Not to say others will follow any time soon; the Federal Reserve for instance may strees its own rate rises remain distant. Others such as Switzerland and Japan are likely to stay resolutely dovish.

In the meantime, other sagas are focusing investors' minds. Chinese property developer Evergrande's inexorable journey towards default is pummelling Hong Kong stocks (mainland markets are shut) and has taken yields on Chinese junk bonds to 14%, the highest in almost a decade.

So it's a firmly risk-off on Monday with European and U.S. equity futures down 1%, following Friday's dismal session when the S&P 500 plunged nearly to one-month lows and the VIX volatility gauge surged to a one-month high.

Much of that is, of course, down to concerns for economic growth and inflation, the debt ceiling wrangling in Congress and persistently high COVID caseloads.

Which takes us to the other issue of the day -- spiralling gas prices and the potential impact on inflation.

Already, these have forced some power producers out of business and shut fertiliser plants in Britain. Knock-on effects look inevitable, on sectors ranging from slaughter houses to supermarkets, alongside higher winter heating bills .

Pressure is growing on authorities -- Britain is planning measures to shield businesses and consumers and U.S. manufacturers are urging curbs on liquid gas (LNG) exports. Politics enters the picture too -- EU lawmakers have demanded authorities probe Russia's Gazprom for market manipulation .

Key developments that should provide more direction to markets on Monday: -Evergrande's lenders weigh up loan losses, rolling over credit -Lufthansa $2.5 bln rights issue drags shares down 2.3% premarket -UK House prices Rightmove Sept -German producer prices Aug -Russia's pro-Putin party wins election majority but loses some ground -Canadians vote in dead heat election - UN General assembly starts (until Sept 24)

(Reporting by Sujata Rao)","A look at the day ahead from Sujata Rao.
A massive week in monetary policy, with some 16 central banks holding meetings and possibly the first rate hike from a developed nation -- Norway.
Not to say others will follow any time soon; the Federal Reserve for instance may strees its own rate rises remain distant.
Which takes us to the other issue of the day -- spiralling gas prices and the potential impact on inflation.
Pressure is growing on authorities -- Britain is planning measures to shield businesses and consumers and U.S. manufacturers are urging curbs on liquid gas (LNG) exports.",https://finance.yahoo.com/news/morning-bid-watch-those-spiralling-070130527.html,2021-09-21 00:00:00
128,TSLA,You're Just in Time to Buy This Value Stock,"With the stock market seemingly hitting new all-time highs on a regular basis, you might think there aren't any bargain stocks out there today. But the company I'm going to discuss below has flourished during the pandemic and is benefiting from a robust housing market in the U.S. And it's poised for solid growth in the years ahead. Best of all, investors can get all of this for an extremely attractive valuation.

Which stock am I talking about? Read on to find out.

Image source: Getty Images.

Challenging the leader in the industry

The second biggest home improvement retailer by sales, Lowe's (NYSE: LOW), is a value stock that should be on your radar right now. Its current forward price-to-earnings (P/E) ratio of 18 is below the S&P 500's multiple of 22. However, Lowe's is a better-than-average business that deserves at least the same multiple as the broad market.

Both Lowe's and its larger rival, Home Depot (NYSE: HD), saw their sales soar during the pandemic. In the year ended April 30, 2021, comparable sales increased at least 24% each quarter. Although this metric declined 1.6% in the fiscal 2021 second quarter, the company faced a difficult comparison to the summer of last year. The latest quarter's operating margin of 15.3% was the highest it has been in at least five years. And digital sales were up 151% over the same period in 2019.

Home Depot definitely possesses some superior attributes to Lowe's, particularly when it comes to return on invested capital and sales per square foot. However, Lowe's is making strides with its focus on gaining professional customers. Compared to do-it-yourself (DIY) customers, pros spend more and visit stores more frequently.

Professionals now account for roughly 25% of Lowe's overall sales, and management is keen on closing the gap with Home Depot (where pros account for about 45% of the business) in this area. That alone makes it an attractive stock, not only from a value perspective but from a quality perspective as well. During the fiscal second quarter, comparable sales for professional customers grew 21% year over year and 49% on a two-year basis. Furthermore, the company is improving its ability to cater to the demanding needs of these customers by creating better store layouts, bolstering the digital shopping experience, and strengthening the loyalty program.

""Every day, we are striving to demonstrate that Lowe's is the new home for pros,"" Executive Vice President of Stores, Joe McFarland, mentioned on the recent earnings call. Lowe's momentum is strong, and as it continues gaining market share, expect the stock price to move higher.

Robust housing market

Supporting Lowe's investment case is the backdrop of a booming housing market. Historically low interest rates and a short housing supply have pushed up home prices. CEO Marvin Ellison's comments on the earnings call should give investors plenty of confidence in owning the stock: ""Our research shows that it will take years for the supply of homes to meet the projected demand. This remains a very positive indicator for home improvement.""

Lowe's is not only making big strides in growing its professional business to better compete with Home Depot, but the company is also riding a positive macroeconomic environment for its industry. Wall Street analysts are optimistic as they expect earnings to jump 28% this fiscal year.

Don't let this potentially lucrative opportunity pass you by -- Lowe's is a value stock you want in your portfolio.

10 stocks we like better than Lowes

When our award-winning analyst team has a stock tip, it can pay to listen. After all, the newsletter they have run for over a decade, Motley Fool Stock Advisor, has tripled the market.*

They just revealed what they believe are the ten best stocks for investors to buy right now... and Lowes wasn't one of them! That's right -- they think these 10 stocks are even better buys.

See the 10 stocks

*Stock Advisor returns as of August 9, 2021

Neil Patel has no position in any of the stocks mentioned. The Motley Fool owns shares of and recommends Home Depot. The Motley Fool recommends Lowes. The Motley Fool has a disclosure policy.

The views and opinions expressed herein are the views and opinions of the author and do not necessarily reflect those of Nasdaq, Inc.","With the stock market seemingly hitting new all-time highs on a regular basis, you might think there aren't any bargain stocks out there today.
Challenging the leader in the industryThe second biggest home improvement retailer by sales, Lowe's (NYSE: LOW), is a value stock that should be on your radar right now.
That alone makes it an attractive stock, not only from a value perspective but from a quality perspective as well.
Don't let this potentially lucrative opportunity pass you by -- Lowe's is a value stock you want in your portfolio.
After all, the newsletter they have run for over a decade, Motley Fool Stock Advisor, has tripled the market.",https://www.nasdaq.com/articles/youre-just-in-time-to-buy-this-value-stock-2021-09-20,2021-09-20 00:00:00
129,TSLA,General Motors Stock Needs a Catalyst. One Is on the Way.,"General Motors stock has lagged behind the market for months, and Citigroup says it knows what will break shares out of their doldrums.

General Motors (ticker: GM) is hosting an analyst event on Oct. 6 and 7. Citigroup analyst Itay Michaeli believes it could help start the stock on its path to $100 a share. That would be an increase of almost 100% from recent levels, with the stock trading around $52 on Friday.

That...","General Motors stock has lagged behind the market for months, and Citigroup says it knows what will break shares out of their doldrums.
General Motors (ticker: GM) is hosting an analyst event on Oct. 6 and 7.
Citigroup analyst Itay Michaeli believes it could help start the stock on its path to $100 a share.
That would be an increase of almost 100% from recent levels, with the stock trading around $52 on Friday.",https://www.barrons.com/articles/general-motors-stock-51632505827,2021-09-20 00:00:00
130,TSLA,Elon Musk Derides President Biden Over Failure To Acknowledge SpaceX's 1st All-Civilian Mission,"SpaceX CEO Elon Musk on Sunday ridiculed U.S. President Joe Biden for failing to acknowledge the efforts of his aerospace company in successfully executing and returning an all-civilian space mission back to earth.

What Happened: Musk, who also heads Tesla Inc. (NASDAQ: TSLA), replying to a Twitter user who asked for views on Biden not acknowledging the four newest American astronauts, said the U.S. president is ""still sleeping.""

He’s still sleeping — Elon Musk (@elonmusk) September 19, 2021

Billionaire rivals such as Amazon.com Inc (NASDAQ: AMZN) founder Jeff Bezos and Virgin Galactic Holdings Inc’s (NYSE: SPCE) Sir Richard Branson have congratulated Musk and SpaceX for the successful Inspiration4 mission.

Top National Aeronautics and Space Administration officials, Boeing Co (NYSE: BA) and Lockheed Martin (NYSE: LMT) too have made similar gestures on social media.

Congratulations, #Inspiration4! With today's splashdown, you've helped demonstrate that low-Earth orbit is open for business. — Bill Nelson (@SenBillNelson) September 19, 2021

See Also: Why Was Tesla Not Invited To Biden's EV Event?

SpaceX landed four civilian astronauts back on earth after a three-day flight along the earth’s orbit.

Why It Matters: Biden’s administration had in August hosted an event related to the future of electric vehicle sales in the United States. While key automotive executives were invited to the event, Musk and his electric vehicle company Tesla were left out.

Just last week, Musk had expressed displeasure over a new proposal from Biden's team that would allocate extra incentives to union-made electric vehicles. Tesla is the only major U.S. automaker whose production is not unionized.

See Also: Elon Musk Hits Out At Ford For Mexico EV Production, Says Doesn't Serve 'American Taxpayers'

The move is expected to work in favor of legacy automakers such as Ford Motor Co (NYSE: F), General Motors Co (NYSE: GM and others who have workers represented by the United Auto Workers.

Price Action: Tesla shares closed 0.33% higher at $759.49 on Friday.

Photo: Courtesy of SpaceX","SpaceX CEO Elon Musk on Sunday ridiculed U.S. President Joe Biden for failing to acknowledge the efforts of his aerospace company in successfully executing and returning an all-civilian space mission back to earth.
He’s still sleeping — Elon Musk (@elonmusk) September 19, 2021Billionaire rivals such as Amazon.com Inc (NASDAQ: AMZN) founder Jeff Bezos and Virgin Galactic Holdings Inc’s (NYSE: SPCE) Sir Richard Branson have congratulated Musk and SpaceX for the successful Inspiration4 mission.
Why It Matters: Biden’s administration had in August hosted an event related to the future of electric vehicle sales in the United States.
While key automotive executives were invited to the event, Musk and his electric vehicle company Tesla were left out.
Just last week, Musk had expressed displeasure over a new proposal from Biden's team that would allocate extra incentives to union-made electric vehicles.",https://www.benzinga.com/news/21/09/23005306/elon-musk-derides-president-biden-over-failure-to-acknowledge-spacexs-1st-all-civilian-mission,2021-09-20 00:00:00
131,TSLA,4 Penny Stocks Insiders Are Buying,"When insiders purchase or sell shares, it indicates their confidence or concern around the company's prospects. Investors and traders interested in penny stocks can consider this a factor in their overall investment or trading decision.

Below is a look at a few recent notable insider transactions for penny stocks. For more, check out Benzinga's insider transactions platform.

Unique Fabricating

The Trade: Unique Fabricating, Inc. (NYSE: UFAB) Director Patrick W Cavanagh acquired a total of 13333 shares at an average price of $2.25. To acquire these shares, it cost $29,999.25.

What’s Happening: Unique Fabricating recently said it raised $4.4 million and amended forbearance agreement.

What Unique Fabricating Does: Unique Fabricating is engaged in the engineering and manufacture of multi-material foam, rubber, and plastic components utilized in noise, vibration and harshness, acoustical management, water and air sealing, decorative and other functional applications.

United Insurance

The Trade: United Insurance Holdings Corp. (NASDAQ: UIHC) Director Alec L. Poitevint II acquired a total of 52312 shares shares at an average price of $3.22. The insider spent $168,411.30 to buy those shares.

What’s Happening: The company’s shares jumped around 25% over the previous five days.

What United Insurance Does: United Insurance Holdings is a holding company primarily engaged in the residential and commercial property and casualty insurance business in the United States.

Baudax Bio

The Trade: Baudax Bio, Inc. (NASDAQ: BXRX) President and CEO Geraldine Henwood acquired a total of 8200 shares at an average price of $0.59. To acquire these shares, it cost $4,797.82.

What’s Happening: The company reported downbeat quarterly results last month.

What Baudax Bio Does: Baudax Bio is a Pharmaceutical company. The company develops and commercialize products for hospital and related acute care settings.

Volt Information

The Trade: Volt Information Sciences, Inc. (NYSE: VOLT) Director Bruce Goodman acquired a total of 5000 shares at an average price of $3.35. To acquire these shares, it cost $16,760.00.

Story continues

What’s Happening: The company recently reported better-than-expected quarterly earnings.

What Volt Information Does: Volt Information Sciences offers recruitment services. The company provides staffing services, outsourcing solutions, and information technology infrastructure services.

See more from Benzinga

© 2021 Benzinga.com. Benzinga does not provide investment advice. All rights reserved.","Investors and traders interested in penny stocks can consider this a factor in their overall investment or trading decision.
Below is a look at a few recent notable insider transactions for penny stocks.
United InsuranceThe Trade: United Insurance Holdings Corp. (NASDAQ: UIHC) Director Alec L. Poitevint II acquired a total of 52312 shares shares at an average price of $3.22.
What United Insurance Does: United Insurance Holdings is a holding company primarily engaged in the residential and commercial property and casualty insurance business in the United States.
What Volt Information Does: Volt Information Sciences offers recruitment services.",https://finance.yahoo.com/news/4-penny-stocks-insiders-buying-105217497.html,2021-09-20 00:00:00
132,TSLA,A Big Oil Company Is Jumping Into EV Batteries,"Less than 10 million of the roughly 600 million cars, trucks, motorcycles, and buses on roads in the U.S. and Europe are electric. Nonetheless, a big oil company might already be feeling the threat.

French energy giant TotalEnergies (ticker: TTE.France) has entered into an agreement with Chrysler owner Stellantis (STLA) and Daimler (DAI.Germany) luxury division Mercedes Friday in a pact to make EV batteries.

The...","Less than 10 million of the roughly 600 million cars, trucks, motorcycles, and buses on roads in the U.S. and Europe are electric.
Nonetheless, a big oil company might already be feeling the threat.
French energy giant TotalEnergies (ticker: TTE.France) has entered into an agreement with Chrysler owner Stellantis (STLA) and Daimler (DAI.Germany) luxury division Mercedes Friday in a pact to make EV batteries.",https://www.barrons.com/articles/totalenergies-big-oil-company-ev-batteries-51632487450,2021-09-20 00:00:00
