,Ticker,Title,Article,Summary,Link,Date
93,ARKK,"Cramer's Mad Money Recap: Tesla, Roku, Zoom Video","If you own the turbocharged growth stocks, be prepared to take the pain or cut your losses at the next rally, Jim Cramer warned his Mad Money viewers on another awful day for the markets.

He said investors must always remember that it's possible to have a great company with a bad stock. It's also possible that bad things can happen to great companies.

Why are the tech and growth stocks seemingly in free fall? In a word, bonds. When inflation heats up, so do bond yields, which makes the future earnings from stocks less attractive. This is even more true for growth stocks, which forego earnings to chase market share instead.

This is called multiple contraction, and it may be a new concept for younger investors but it's something veteran traders know all too well.

For a list of the stocks hardest hit by this multiple contraction, look no further than Cramer's ""Woodstocks,"" a list of stocks owned by Cathie Wood's ARK Invest. ARK (ARKK) - Get ARK Innovation ETF Report was all the rage in 2020, posting huge gains, but in 2021, shares of Tesla (TSLA) - Get Tesla Inc Report, Teladoc (TDOC) - Get Teladoc Health, Inc. Report, Square (SQ) - Get Square, Inc. Class A Report, Roku (ROKU) - Get Roku, Inc. Class A Report and Zoom Video (ZM) - Get Zoom Video Communications (ZM) Report are all racking up huge declines. But Cramer, like Wood, takes a long-term view on these names, which can't be kept down for long.

Cramer and the AAP team are looking at everything from earnings and politics to the Federal Reserve. Find out what they're telling their investment club members and get in on the conversation with a free trial subscription to Action Alerts Plus.

Executive Decision: Wendy's

In his first ""Executive Decision"" segment, Cramer spoke with Todd Penegor, president and CEO of Wendy's (WEN) - Get Wendy's Company Report, the fast-food chain that just posted a 5-cents-a-share earnings beat with a 13% increase in same-store sales. Shares of Wendy's closed lower on the day, dragged down by the overall markets.

Penegor said he's very excited about Wendy's growth in the breakfast category. He said the company sees strong trials and repeat business and there's lots more opportunity ahead as more people return to work and school.

Beyond breakfast, Penegor noted that new product innovations are also driving growth, as are popular chicken sandwich options.

When asked about capital allocation plans, Penegor said Wendy's will always invest for growth, but also keep an eye on its dividend, which was raised from five cents a share to nine cents and more recently from nine cents a share to 10 cents as the company continues to reward shareholders.

Finally, Penegor reaffirmed Wendy's commitment to 100% sustainable packaging by 2026.

Executive Decision: Wynn Resorts

For his second ""Executive Decision"" segment, Cramer also spoke with Matt Maddox, CEO of Wynn Resorts (WYNN) - Get Wynn Resorts, Limited (WYNN) Report, and Bill Foley, founder of Austerlitz Acquisition Corp I, to learn more about the company's plan to spin off their online sport betting business into a separate entity.

Maddox said that online sport betting will become a $30 billion to $40 billion business in the next few years. Spinning off their operations as an independent company was the best way to attack this growing opportunity.

Foley added the new company has the potential to become a dominant player in this business and with Wynn's backing and support, it's only getting started.

When asked about the traditional casino business, Maddox said there is a lot of excitement and a lot of customers coming back to their casinos in both Boston and Las Vegas and things are looking up in Macau.

Turning to the topic of SPACs, Foley said there is still value being created, but investors need to look for solid concepts with management teams that can deliver on their promises.

Executive Decision: NortonLifeLock

For his final ""Executive Decision"" segment, Cramer checked in Vincent Pilette, CEO of NortonLifeLock (NLOK) - Get NortonLifeLock Inc. Report, the cybersecurity company with shares up 7.1% Wednesday.

Pilette said that NortonLifeLock is a security platform for individuals that offers identity protection and privacy features to keep your digital life safe. He said in the old days, if you lost your wallet, you could replace it with just a few phone calls, but on the Internet, your information can appear months or years after a breach and you might not even know it.

NortonLifeLock is continually scanning the dark web, looking for stolen information and will alert customers any time new information is detected. It's estimated that less than 5% of all Internet users are using identity protection services, despite an identity being stolen every three seconds.

On Real Money, Cramer keys in on the companies and CEOs he knows best. Get more of his insights with a free trial subscription to Real Money.

Listen to the Billionaires?

In his ""No Huddle Offense"" segment, Cramer said there are a lot of billionaire investors out there, but that doesn't mean you should listen to them. He said most billionaires offer nothing special, spouting the same opinions, often trying to scare you out of the market with worries over hyperinflation.

But then there are the billionaires that offer something different and aren't afraid to admit when they're wrong. That's why Cramer follows Cathie Wood from ARK Invest, who is predicting a collapse in commodity prices, not continued inflation. He also follows Stanley Druckenmiller and David Temper, two billionaires that are humble and aren't afraid to change their minds when the facts change.

So the next time you see a billionaire on TV, ask yourself if they're challenging your world view. If you don't hear rigor and common sense, you probably shouldn't pay much attention.

Lightning Round

Here's what Cramer had to say about some of the stocks that callers offered up during the ""Mad Money Lightning Round"" Wednesday evening:

Silvergate Capital (SI) - Get SILVERGATE CAPITAL CORP. Report: ""They are very smart guys, but I want to see what Coinbase (COIN) says Thursday.""

FuboTV (FUBO) - Get FUBOTV INC. Report: ""This was a problematic quarter. I don't have as much faith in this business as I do with Roku (ROKU) - Get Roku, Inc. Class A Report.""

Boston Omaha (BOMN) - Get Boston Omaha Corp. Class A Report: ""You don't want the mini version of Berkshire, you want a sliver of Berkshire Hathaway (BRK.B) - Get Berkshire Hathaway Inc. Class B Report.""

Search Jim Cramer's ""Mad Money"" trading recommendations using our exclusive ""Mad Money"" Stock Screener.

To watch replays of Cramer's video segments, visit the Mad Money page on CNBC.

To sign up for Jim Cramer's free Booyah! newsletter with all of his latest articles and videos please click here.

At the time of publication, Cramer's Action Alerts PLUS had no position in the stocks mentioned.","This is even more true for growth stocks, which forego earnings to chase market share instead.
ARK (ARKK) - Get ARK Innovation ETF Report was all the rage in 2020, posting huge gains, but in 2021, shares of Tesla (TSLA) - Get Tesla Inc Report, Teladoc (TDOC) - Get Teladoc Health, Inc. Report, Square (SQ) - Get Square, Inc. Class A Report, Roku (ROKU) - Get Roku, Inc. Class A Report and Zoom Video (ZM) - Get Zoom Video Communications (ZM) Report are all racking up huge declines.
On Real Money, Cramer keys in on the companies and CEOs he knows best.
I don't have as much faith in this business as I do with Roku (ROKU) - Get Roku, Inc. Class A Report.""
Search Jim Cramer's ""Mad Money"" trading recommendations using our exclusive ""Mad Money"" Stock Screener.",https://www.thestreet.com/jim-cramer/cramers-mad-money-recap-may-12,2021-05-12 23:13:17+00:00
94,ARKK,"CoinDesk: Bitcoin, Ethereum, Crypto News and Price Data","With bitcoin down about 13% in the last 24 hours, and closer to 34% for the week, these are questions that a lot of people are asking themselves for the very first time. 2020 and 2021 saw a huge wave of new entrants into cryptocurrency, thanks first to sheer boredom, followed by the kind of get-rich-quick rubbernecking that turns everyone into a crypto expert every three years or so. To pick just one metric out of a hat, active Bitcoin wallet addresses have grown by roughly 35% since the start of the pandemic in March of last year.","With bitcoin down about 13% in the last 24 hours, and closer to 34% for the week, these are questions that a lot of people are asking themselves for the very first time.
2020 and 2021 saw a huge wave of new entrants into cryptocurrency, thanks first to sheer boredom, followed by the kind of get-rich-quick rubbernecking that turns everyone into a crypto expert every three years or so.
To pick just one metric out of a hat, active Bitcoin wallet addresses have grown by roughly 35% since the start of the pandemic in March of last year.",https://www.coindesk.com/crypto-crashing-investing-bitcoin/,2021-05-19 18:44:10+00:00
95,ARKK,UPDATE 3-Trump says New York criminal probe is in 'desperate search of a crime',"(Adds details from NYT report on Trump Organization CFO being probed in the last two graphs)

By Katanga Johnson

May 19 (Reuters) - Former U.S. President Donald Trump on Wednesday attacked New York state's attorney general for launching a criminal probe of his family business, saying he was ""being unfairly attacked and abused.""

""There is nothing more corrupt than an investigation that is in desperate search of a crime,"" Trump said in a statement, adding that ""we will overcome"" any attempt at prosecution.

The office of New York Attorney General Letitia James, which has been investigating whether the New York City-based Trump Organization falsely reported property values to secure loans and obtain economic and tax benefits, said on Tuesday its probe was no longer purely civil.

""We are now actively investigating the Trump Organization in a criminal capacity, along with the Manhattan DA,"" Fabien Levy, a spokesman for James, said in a statement, using the abbreviation for ""district attorney.""

Trump on Wednesday assailed the investigation as politically motivated.

""The attorney general of New York literally campaigned on prosecuting Donald Trump even before she knew anything about me,"" the Republican former president said. James is a Democrat.

Manhattan District Attorney Cyrus Vance has been investigating Trump’s pre-presidency business dealings for more than two years.

Vance’s office has said in court filings it was investigating ""possibly extensive and protracted criminal conduct"" at the Trump Organization, including tax and insurance fraud and falsification of business records.

Separately, the New York Times reported late on Wednesday that the office of the New York Attorney General had been criminally investigating Allen Weisselberg, the CFO of the Trump Organization, for months over tax issues, and had notified the company about it in a January letter.

The investigators have examined whether taxes were paid on fringe benefits that Trump gave him, including cars and tens of thousands of dollars in private school tuition for at least one of Weisselberg's grandchildren, according to the newspaper.

(Reporting by Katanga Johnson; additional reporting by Kanishka Singh; Editing by Tim Ahmann, Jonathan Oatis and Michael Perry)","""There is nothing more corrupt than an investigation that is in desperate search of a crime,"" Trump said in a statement, adding that ""we will overcome"" any attempt at prosecution.
The office of New York Attorney General Letitia James, which has been investigating whether the New York City-based Trump Organization falsely reported property values to secure loans and obtain economic and tax benefits, said on Tuesday its probe was no longer purely civil.
""The attorney general of New York literally campaigned on prosecuting Donald Trump even before she knew anything about me,"" the Republican former president said.
Manhattan District Attorney Cyrus Vance has been investigating Trump’s pre-presidency business dealings for more than two years.
Vance’s office has said in court filings it was investigating ""possibly extensive and protracted criminal conduct"" at the Trump Organization, including tax and insurance fraud and falsification of business records.",https://finance.yahoo.com/news/1-trump-says-york-criminal-163809650.html,2021-05-19 18:44:10+00:00
96,ARKK,"BNGO Stock: Don't Look Now, but Bionano Genomics May Be a Buy","Don’t Look Now, but Bionano Genomics May Be a Buy","Don’t Look Now, but Bionano Genomics May Be a Buy",https://investorplace.com/2021/05/bngo-stock-dont-look-now-but-bionano-genomics-may-be-a-buy/,2021-05-07 18:02:55+00:00
97,ARKK,Why DraftKings Is Down 3.5% Today,"What happened

Shares of DraftKings (NASDAQ:DKNG) were down 3.5% in afternoon trading Wednesday despite the Florida legislature approving a sports betting and expanded casino gaming bill.

The sportsbook's stock, which is down 42% from highs hit in March, also got another vote of confidence from Wall Street money manager Cathie Wood, whose Ark Investment Management bought an additional 708,000 shares of its stock yesterday.

So what

Although the measure passed, it will face legal challenges because it violates a voter amendment to the state constitution that only permits casino games to be held on Seminole Tribe tribal land. Under the bill that was approved, wagers could now be placed at horse tracks, jai alai arenas, and former dog tracks. The legislation also allows the Seminole Tribe to add roulette and craps to the seven casinos it operates.

The Seminole Tribe of Florida has exclusive rights to certain kinds of gambling in the state, and has the right to assign licenses to sportsbooks.

Now what

While Florida is an important state for sportsbooks like DraftKings, New York is perhaps the crown jewel market for sports betting -- and once it is approved there the state could readily surpass next door New Jersey as the premiere sports betting capital in the country.

Analysts recently downgraded DraftKings stock due to valuation concerns, but Wood has been buying shares all along. Her ARK Next Generation Internet exchange-traded fund now owns 2.2 million shares. The ARK Innovation ETF owns over 8 million shares.","What happenedShares of DraftKings (NASDAQ:DKNG) were down 3.5% in afternoon trading Wednesday despite the Florida legislature approving a sports betting and expanded casino gaming bill.
So whatAlthough the measure passed, it will face legal challenges because it violates a voter amendment to the state constitution that only permits casino games to be held on Seminole Tribe tribal land.
The legislation also allows the Seminole Tribe to add roulette and craps to the seven casinos it operates.
The Seminole Tribe of Florida has exclusive rights to certain kinds of gambling in the state, and has the right to assign licenses to sportsbooks.
Analysts recently downgraded DraftKings stock due to valuation concerns, but Wood has been buying shares all along.",https://www.fool.com/investing/2021/05/19/why-draftkings-is-down-35-today/,2021-05-19 00:00:00
98,ARKK,7 Reddit Stocks With Real Bullish Stories,,,https://investorplace.com/2021/05/7-reddit-stocks-with-real-bullish-stories/,2021-05-07 00:00:00
99,ARKK,ARK Investment Management LLC,"New Purchases: TWTR, PCAR, DKNG, BMY, SKLZ, LMT, TDY, BFLY, 13T1, CMLF, ABBV, VUZI, ONEM, SEER, EXPCU, AONE, BILL, ACIC, DM, SPFR, EMCO, INCR, ARD, KMTUF, LHX, THLEF, KRNT, ITGMF, ECP, HAML, ITMMF, MGIC, MLTM, PLSN, ROBOF, DRIO, ENLV, FROG, SEDG, IWF, EADSF, KODK, SPY, BA, GRMN, HEI, RTP, PYR, SPR,

TWTR, PCAR, DKNG, BMY, SKLZ, LMT, TDY, BFLY, 13T1, CMLF, ABBV, VUZI, ONEM, SEER, EXPCU, AONE, BILL, ACIC, DM, SPFR, EMCO, INCR, ARD, KMTUF, LHX, THLEF, KRNT, ITGMF, ECP, HAML, ITMMF, MGIC, MLTM, PLSN, ROBOF, DRIO, ENLV, FROG, SEDG, IWF, EADSF, KODK, SPY, BA, GRMN, HEI, RTP, PYR, SPR, Added Positions: TDOC, TSLA, SQ, SHOP, ZM, BIDU, U, TXG, EXAS, Z, NVSEF, SPOT, PLTR, REGN, TER, TWLO, FATE, BEAM, SE, JD, DOCU, VRTX, SI, TAK, BLI, BEKE, OPEN, IOVA, IRDM, VEEV, ACCD, TRMB, SNPS, NTDOY, IONS, ICE, NVDA, SRPT, RHHBY, INCY, SDGR, PDD, KTOS, ADPT, GBTC, ZZHGF, TTD, PTON, KMTUY, ADYYF, CDXS, YHEKF, NXPI, MGA, GOOG, TCEHY, DE, INTU, NNDM, WDAY, YAHOF, CSTL, DDD, MPNGF, NIU, RAVN, ANSS, MELI, ESLT, DCYHF, CAT, WKHS, ADYEY, MASS, RNSHF, CDNA, GH, TMO, AVAV, ALTR, ADSK, GWRE, HDB, HPQ, DASTF, MSFT, PTC, SAUHF, TWST, FRIIF, RPTX, FSLY, ISRG, SCHW, TEAM, CRWD, BYDDY, NET, BAINF, BABA, XONE, FARO, HUBS, SLGRF, SPCE, SURF, AJRD, ALGN, AME, GE, OERLF, KALU, BDGXF, LECO, SMAWF, BZQIF, MOG.A, DANE, HLTEF, PTNR, NICE, NUVA, MTRX, RDHL, SYK, TEVA, UCTT, UPS, XLNX, HXGBF, CELJF, FATLF, MDT, SPNS, ALLT, AUDC, CAMT, CHKP, CYBR, FVRR, ITRN, NVMI, RDWR, TARO, TSEM, URGN, WIX, INMD, PERI, RADA, ARNC, MGDDF, KMDA, BTAVF, GMDA, PYPD, SILC, MKTX, API, KAKZF, ATI, CRS, DD, EMN, HXL, SGLFF, HENOF, TRYIF, MMM, XRX, KDSKF, ARKAF, SDVKF, EVKIF, CRNT, EVGN, YAHOY, VLPNF, GILT, ARKK, ARKG,

TDOC, TSLA, SQ, SHOP, ZM, BIDU, U, TXG, EXAS, Z, NVSEF, SPOT, PLTR, REGN, TER, TWLO, FATE, BEAM, SE, JD, DOCU, VRTX, SI, TAK, BLI, BEKE, OPEN, IOVA, IRDM, VEEV, ACCD, TRMB, SNPS, NTDOY, IONS, ICE, NVDA, SRPT, RHHBY, INCY, SDGR, PDD, KTOS, ADPT, GBTC, ZZHGF, TTD, PTON, KMTUY, ADYYF, CDXS, YHEKF, NXPI, MGA, GOOG, TCEHY, DE, INTU, NNDM, WDAY, YAHOF, CSTL, DDD, MPNGF, NIU, RAVN, ANSS, MELI, ESLT, DCYHF, CAT, WKHS, ADYEY, MASS, RNSHF, CDNA, GH, TMO, AVAV, ALTR, ADSK, GWRE, HDB, HPQ, DASTF, MSFT, PTC, SAUHF, TWST, FRIIF, RPTX, FSLY, ISRG, SCHW, TEAM, CRWD, BYDDY, NET, BAINF, BABA, XONE, FARO, HUBS, SLGRF, SPCE, SURF, AJRD, ALGN, AME, GE, OERLF, KALU, BDGXF, LECO, SMAWF, BZQIF, MOG.A, DANE, HLTEF, PTNR, NICE, NUVA, MTRX, RDHL, SYK, TEVA, UCTT, UPS, XLNX, HXGBF, CELJF, FATLF, MDT, SPNS, ALLT, AUDC, CAMT, CHKP, CYBR, FVRR, ITRN, NVMI, RDWR, TARO, TSEM, URGN, WIX, INMD, PERI, RADA, ARNC, MGDDF, KMDA, BTAVF, GMDA, PYPD, SILC, MKTX, API, KAKZF, ATI, CRS, DD, EMN, HXL, SGLFF, HENOF, TRYIF, MMM, XRX, KDSKF, ARKAF, SDVKF, EVKIF, CRNT, EVGN, YAHOY, VLPNF, GILT, ARKK, ARKG, Reduced Positions: TSM, SPLK, CRSP, PYPL, PINS, PSTG, PACB, GOOGL, NVTA, ROKU, EDIT, FB, NTLA, TREE, PRLB, VCYT, PD, MTLS, TWOU, LSPD, MCRB, WORK, NFLX, AAPL, NSTG, CLLS, PSNL, ADBE, SSYS, CGEN, AMZN, CERS, ARCT, VRSK, SYRS, HUYA, ONVO, ZS, AQB, SNAP, HON, PSTI, LC, PHR, MPNGY, SBHGF, BVXV, IBKR,

TSM, SPLK, CRSP, PYPL, PINS, PSTG, PACB, GOOGL, NVTA, ROKU, EDIT, FB, NTLA, TREE, PRLB, VCYT, PD, MTLS, TWOU, LSPD, MCRB, WORK, NFLX, AAPL, NSTG, CLLS, PSNL, ADBE, SSYS, CGEN, AMZN, CERS, ARCT, VRSK, SYRS, HUYA, ONVO, ZS, AQB, SNAP, HON, PSTI, LC, PHR, MPNGY, SBHGF, BVXV, IBKR, Sold Out: CRM, FLIR, OKTA, LGVW, TCS, ILMN, ROK, AYLA, SMEGF, JDHIF,

Investment company Current Portfolio ) buys Teladoc Health Inc, Tesla Inc, Square Inc, Shopify Inc, Zoom Video Communications Inc, sells Taiwan Semiconductor Manufacturing Co, Splunk Inc, CRISPR Therapeutics AG, PayPal Holdings Inc, Pinterest Inc during the 3-months ended 2021Q1, according to the most recent filings of the investment company, ARK Investment Management LLC. As of 2021Q1, ARK Investment Management LLC owns 283 stocks with a total value of $50.2 billion. These are the details of the buys and sells.

For the details of Catherine Wood 's stock buys and sells, go to https://www.gurufocus.com/guru/catherine+wood/current-portfolio/portfolio

Catherine Wood

Tesla Inc (TSLA) - 5,785,523 shares, 7.70% of the total portfolio. Shares added by 39.94% Teladoc Health Inc (TDOC) - 14,424,180 shares, 5.22% of the total portfolio. Shares added by 84.16% Square Inc (SQ) - 10,978,316 shares, 4.97% of the total portfolio. Shares added by 55.01% Roku Inc (ROKU) - 4,997,644 shares, 3.24% of the total portfolio. Shares reduced by 7.05% Zillow Group Inc (Z) - 10,032,650 shares, 2.59% of the total portfolio. Shares added by 54.80%

ARK Investment Management LLC initiated holding in Twitter Inc. The purchase prices were between $45.18 and $77.63, with an estimated average price of $61.29. The stock is now traded at around $50.070000. The impact to a portfolio due to this purchase was 0.99%. The holding were 7,793,240 shares as of 2021-03-31.

ARK Investment Management LLC initiated holding in PACCAR Inc. The purchase prices were between $84.72 and $99.6, with an estimated average price of $93.81. The stock is now traded at around $94.230000. The impact to a portfolio due to this purchase was 0.58%. The holding were 3,157,652 shares as of 2021-03-31.

ARK Investment Management LLC initiated holding in DraftKings Inc. The purchase prices were between $44.86 and $71.98, with an estimated average price of $60.08. The stock is now traded at around $40.990000. The impact to a portfolio due to this purchase was 0.53%. The holding were 4,375,424 shares as of 2021-03-31.

ARK Investment Management LLC initiated holding in Bristol-Myers Squibb Company. The purchase prices were between $59.34 and $66.74, with an estimated average price of $62.18. The stock is now traded at around $65.040000. The impact to a portfolio due to this purchase was 0.27%. The holding were 2,179,919 shares as of 2021-03-31.

ARK Investment Management LLC initiated holding in Skillz Inc. The purchase prices were between $18 and $43.72, with an estimated average price of $28.87. The stock is now traded at around $13.730000. The impact to a portfolio due to this purchase was 0.23%. The holding were 6,012,260 shares as of 2021-03-31.

ARK Investment Management LLC initiated holding in Lockheed Martin Corp. The purchase prices were between $321.82 and $372.79, with an estimated average price of $342.99. The stock is now traded at around $387.770000. The impact to a portfolio due to this purchase was 0.2%. The holding were 276,755 shares as of 2021-03-31.

ARK Investment Management LLC added to a holding in Teladoc Health Inc by 84.16%. The purchase prices were between $171.3 and $294.54, with an estimated average price of $232.94. The stock is now traded at around $132.710000. The impact to a portfolio due to this purchase was 2.39%. The holding were 14,424,180 shares as of 2021-03-31.

ARK Investment Management LLC added to a holding in Tesla Inc by 39.94%. The purchase prices were between $563 and $883.09, with an estimated average price of $754.2. The stock is now traded at around $571.690000. The impact to a portfolio due to this purchase was 2.2%. The holding were 5,785,523 shares as of 2021-03-31.

ARK Investment Management LLC added to a holding in Square Inc by 55.01%. The purchase prices were between $201.87 and $276.57, with an estimated average price of $234.55. The stock is now traded at around $197.130000. The impact to a portfolio due to this purchase was 1.76%. The holding were 10,978,316 shares as of 2021-03-31.

ARK Investment Management LLC added to a holding in Shopify Inc by 123.14%. The purchase prices were between $1039.91 and $1474, with an estimated average price of $1212.21. The stock is now traded at around $1047.770000. The impact to a portfolio due to this purchase was 1.31%. The holding were 1,073,523 shares as of 2021-03-31.

ARK Investment Management LLC added to a holding in Zoom Video Communications Inc by 214.36%. The purchase prices were between $308.39 and $444.51, with an estimated average price of $369.11. The stock is now traded at around $290.160000. The impact to a portfolio due to this purchase was 1.31%. The holding were 3,002,347 shares as of 2021-03-31.

ARK Investment Management LLC added to a holding in Baidu Inc by 126.80%. The purchase prices were between $203.97 and $339.91, with an estimated average price of $261.9. The stock is now traded at around $179.360000. The impact to a portfolio due to this purchase was 1.24%. The holding were 5,127,543 shares as of 2021-03-31.

ARK Investment Management LLC sold out a holding in Salesforce.com Inc. The sale prices were between $205.33 and $248.59, with an estimated average price of $222.91.

ARK Investment Management LLC sold out a holding in FLIR Systems Inc. The sale prices were between $51.87 and $56.47, with an estimated average price of $54.34.

ARK Investment Management LLC sold out a holding in Okta Inc. The sale prices were between $208.51 and $291.78, with an estimated average price of $251.97.

ARK Investment Management LLC sold out a holding in Longview Acquisition Corp. The sale prices were between $17.17 and $24, with an estimated average price of $20.43.

ARK Investment Management LLC sold out a holding in TCS Group Holding PLC. The sale prices were between $32.9 and $61.8, with an estimated average price of $48.07.

ARK Investment Management LLC sold out a holding in Illumina Inc. The sale prices were between $361.28 and $504.76, with an estimated average price of $420.55.","As of 2021Q1, ARK Investment Management LLC owns 283 stocks with a total value of $50.2 billion.
ARK Investment Management LLC initiated holding in PACCAR Inc.
ARK Investment Management LLC initiated holding in DraftKings Inc.
ARK Investment Management LLC initiated holding in Bristol-Myers Squibb Company.
ARK Investment Management LLC sold out a holding in TCS Group Holding PLC.",https://www.gurufocus.com/news/1426945/ark-investment-management-llc-buys-teladoc-health-inc-tesla-inc-square-inc-sells-taiwan-semiconductor-manufacturing-co-splunk-inc-crispr-therapeutics-ag,2021-05-07 00:00:00
