,Ticker,Title,Article,Summary,Link,Date
0,ARKK,Cathie Wood hits back at Big Short's Michael Burry over bet against ARKK,"Cathie Wood has hit back at Michael Burry, the hedge fund manager who rose to fame in the Big Short for correctly calling the mortgage crisis of 2008, after it emerged he had bet against her flagship ARK Innovation ETF (ARKK).

Bloomberg reported that regulatory filing show Burry’s Scion Asset Management held puts worth around $31m against the $25.5bn ARK Innovation ETF at the end of June 2021. Per Bloomberg, the filings also show that Scion is short Tesla, the ARK ETF’s biggest holding at 10.4%.

Burry has been bearish on markets for some time, making repeated warnings via his now-defunct Twitter account about valuations, inflation, cryptocurrencies, and meme stocks, among other things. In June he cautioned about the ‘mother of crashes’ coming.

ARKK had a stellar 2020, finishing up 152.52%, in part thanks its sizable Tesla stake, as well as Covid-friendly tech plays such as Zoom and Teladoc Health. However, the fund has had a more difficult 2021 and is down 8.1% year-to-date. Tesla, which rose around 700% over 2020, is down around 10% for the year.

In the wake of Burry’ short against ARKK being made public, Wood took to Twitter (a 2.24% position in her fund) to defend her investment style and bullish outlook for growth stocks.

Over eight tweets, she said that the bull market had further to run, that bears were wrong about inflation, and that Burry did not understand ‘the fundamentals that are creating explosive growth and investment opportunities in the innovation space.’","Cathie Wood has hit back at Michael Burry, the hedge fund manager who rose to fame in the Big Short for correctly calling the mortgage crisis of 2008, after it emerged he had bet against her flagship ARK Innovation ETF (ARKK).
Bloomberg reported that regulatory filing show Burry’s Scion Asset Management held puts worth around $31m against the $25.5bn ARK Innovation ETF at the end of June 2021.
Per Bloomberg, the filings also show that Scion is short Tesla, the ARK ETF’s biggest holding at 10.4%.
Tesla, which rose around 700% over 2020, is down around 10% for the year.
In the wake of Burry’ short against ARKK being made public, Wood took to Twitter (a 2.24% position in her fund) to defend her investment style and bullish outlook for growth stocks.",https://citywireusa.com/professional-buyer/news/cathie-wood-hits-back-at-big-shorts-michael-burry-over-bet-against-arkk/a1543378,2021-08-17 13:35:00
1,ARKK,Are you a robot?,"Why did this happen?

Please make sure your browser supports JavaScript and cookies and that you are not blocking them from loading. For more information you can review our Terms of Service and Cookie Policy.","Why did this happen?
Please make sure your browser supports JavaScript and cookies and that you are not blocking them from loading.
For more information you can review our Terms of Service and Cookie Policy.",https://www.bloomberg.com/news/articles/2021-08-17/cathie-wood-says-china-tech-crackdown-boosts-u-s-arkk-etf-exits-china,2021-08-17 00:00:00
2,ARKK,Michael Burry of ‘Big Short’ Bets Against Cathie Wood’s ARKK,"(Bloomberg) -- Michael Burry, the investor made famous by “The Big Short” movie, has taken aim at one of Wall Street’s hottest stars.

Related: The Big Short’s Michael Burry Explains Why Index Funds Are Like Subprime CDOs

Burry’s Scion Asset Management owned bearish put contracts against 235,500 shares of the ARK Innovation ETF (ARKK) at the end of the second quarter, according to a regulatory filing Monday. The new position was valued at almost $31 million, the filing says.

The flagship exchange-traded fund of Cathie Wood and her firm Ark Investment Management lured billions in the past year after her thematic tech-focused bets trounced the market in 2020. But Wood and Ark have struggled to maintain momentum amid concerns about lofty prices and accelerating inflation.

Related: The Big Short’s Michael Burry Sees a Bubble in Passive Investing

Burry has been warning about unsustainable valuations in the market for months. In June, he cautioned that retail investors could be getting drawn into “the mother of all crashes” by investing in cryptocurrencies and meme stocks.

A put contract gives Scion the right to sell shares in the ETF before a certain date and at a previously agreed price. Its value increases if shares drop below the threshold. The exact terms of the puts, and when they were purchased, are undisclosed.

Burry has been indirectly betting against Wood for some time via a big position against Tesla Inc. -- one of Ark’s top picks and ARKK’s biggest holding.

Monday’s filing, a quarterly requirement of hedge funds above a certain size, also shows that Burry increased his bearish wagers against the electric-vehicle maker, with puts on 1,075,500 Tesla shares. That’s up from 800,100 shares in the first quarter.

Read more: Burry of ‘Big Short’ Fame Places Big Bet Against Musk, Tesla

ARKK dropped 2.6% as of 12:25 p.m. in New York amid broad tech-stock declines. Tesla slumped 4.7% as the U.S. opened a formal investigation into the company’s Autopilot system.

Burry rose to widespread fame when his successful bets against mortgage securities during the financial crisis were featured in “The Big Short,” the movie version of Michael Lewis’s best-selling book. Christian Bale portrayed the Scion founder and chief executive officer.","(Bloomberg) -- Michael Burry, the investor made famous by “The Big Short” movie, has taken aim at one of Wall Street’s hottest stars.
Related: The Big Short’s Michael Burry Sees a Bubble in Passive InvestingBurry has been warning about unsustainable valuations in the market for months.
Burry has been indirectly betting against Wood for some time via a big position against Tesla Inc. -- one of Ark’s top picks and ARKK’s biggest holding.
Read more: Burry of ‘Big Short’ Fame Places Big Bet Against Musk, TeslaARKK dropped 2.6% as of 12:25 p.m. in New York amid broad tech-stock declines.
Burry rose to widespread fame when his successful bets against mortgage securities during the financial crisis were featured in “The Big Short,” the movie version of Michael Lewis’s best-selling book.",https://www.wealthmanagement.com/etfs/michael-burry-big-short-bets-against-cathie-wood-s-arkk,2021-08-16 17:48:03+00:00
3,ARKK,Cathie Wood and Michael Burry lock horns as 'Big Short' investor bets against ARKK,"Cathie Wood and Michael Burry lock horns as 'Big Short' investor bets against ARKK

ARK Investment Management founder, CEO and CIO Cathie Wood has lashed back at news that hedge fund manager Michael Burry has taken out a $31m position against her company’s flagship ETF.

According to a 13F regulatory filing on Monday, the ‘Big Short’ investor’s Scion Asset Management owned put contracts against 235,000 shares of the Ark Innovation ETF (ARKK) at the end of Q2, Bloomberg revealed.

With Burry warning retail investors about unsustainable valuations and the potential for “the mother of all crashes” in cryptocurrency and meme stocks, ARKK returning 314% between its low in March 2020 and its high in February of this year would have made it a prime target for sceptics looking for a shorting opportunity.

While the exact detail of the contracts taken out by Scion are unknown, put positions would have allowed the firm to sell ETF shares before a pre-agreed price and date with the contracts’ value increasing as and when a securities’ value falls below the agreed price threshold.

Taking to Twitter to respond to Burry’s bearish play, Wood said: “To his credit, Michael Burry made a great call based on fundamentals and recognized the calamity brewing in the housing/mortgage market.

“I do not believe that he understands the fundamentals that are creating explosive growth and investment opportunities in the innovation space.”

Offering a positive word on the prospects of the firm’s ETFs, Wood added: “In our view, the seeds for the innovation that ARK Invest is dedicated to researching were planted during the 20 years ending with the tech and telecom bust.

“Having gestated for more than 20 years, these technologies should transform the world during the next 10 years.”

Unfortunately for ARK, Burry and others seem to have had strong convictions against innovative tech companies in the short term. In addition to direct ARKK shorts, Scion also increased wagers against Tesla – a top ARK holding – from 800,100 to 1.1 million between Q1 and Q2.

Since seeing its price peak little over seven months ago, ARKK has since fallen by 26% with some of its top ten allocations, including Spotify and Teladoc, falling more than 30% so far in 2021. Also, having comfortably outperformed most conventional benchmarks in 2020, the three top ARK ETFs have underperformed the S&P 500 by at least 20% year-to-date.

Source: ETFLogic

This period of underperformance is in line with conventional wisdom on bond coupons with US 10-year Treasury yields almost doubling between the end of the year and the end of Q1.

Such trajectories tend to be bad news for growth equity-based ETFs such as ARK’s given their underlying often have premium valuations based on hopes of future growth. When rates rise – meaning more expensive borrowing – this has an impact on companies’ future cash flows, and in turn, a negative effect on valuations.

Despite this, Wood stressed the worst of the corrections were confined to the beginning of the year.

“Most bears seem to believe that inflation will continue to accelerate, shortening investment time horizons and destroying valuations.

“Despite what we believe has been a supply-chain related/short term burst in inflation, both equities and bonds have appreciated since March,” she continued.

More contentiously, while many are seeing the spread of the COVID-19 delta variant as a warning light for currently bullish equity markets – and a cause of the recent commodity slump – Wood suggested current market strength will provide another “leg up” for innovation strategies.

“The deflation in commodity prices is cyclical but is adding to the secular forces caused by technologically enabled disruptive innovation [good deflation] and creative destruction [bad deflation].

“If we are correct, GDP and revenue growth will diminish until the opportunities in nascent technologies begin to move macro needles. In this environment, innovation based strategies should distinguish themselves.”

ARKK backers seem to agree. The ETF has gathered $6.5bn assets since the turn of the year despite returns being in negative territory.

These investors, like Wood herself, are taking the long-sighted view that volatile, concentrated portfolios might have pronounced periods of underperformance but also the potential for the most exciting runs of strong returns.

Abandoning the common line that all returns equal the market before fees, ARK supporters believe the drawdowns are a temporary pain worth enduring for innovation-based alpha. Over the last five years this has been proven right with the company’s core trio outperforming Europe’s most popular S&P 500 ETF by a factor of three.

Source: ETFLogic","Cathie Wood and Michael Burry lock horns as 'Big Short' investor bets against ARKKARK Investment Management founder, CEO and CIO Cathie Wood has lashed back at news that hedge fund manager Michael Burry has taken out a $31m position against her company’s flagship ETF.
According to a 13F regulatory filing on Monday, the ‘Big Short’ investor’s Scion Asset Management owned put contracts against 235,000 shares of the Ark Innovation ETF (ARKK) at the end of Q2, Bloomberg revealed.
“Having gestated for more than 20 years, these technologies should transform the world during the next 10 years.”Unfortunately for ARK, Burry and others seem to have had strong convictions against innovative tech companies in the short term.
In addition to direct ARKK shorts, Scion also increased wagers against Tesla – a top ARK holding – from 800,100 to 1.1 million between Q1 and Q2.
Abandoning the common line that all returns equal the market before fees, ARK supporters believe the drawdowns are a temporary pain worth enduring for innovation-based alpha.",https://www.etfstream.com/features/cathie-wood-and-michael-burry-lock-horns-as-big-short-investor-bets-against-arkk/,2021-08-18 16:58:15
4,ARKK,ARKK Believes in Dreamers and You Should Too,"(Tech stock analyst Jon D. Markman publishes Strategic Advantage, a lively guide to investing in the digital transformation of business and society. Click here for a trial.)



Cathie Wood of Ark Investments might be the most famous asset manager not named Warren yet critics are lining up to bet against her fund. She is likely to get the last laugh.

Wood was making the rounds Thursday on financial news networks. She is getting out in front of reports that the Big Short investor has made a major bet against her flagship fund.

Longer-term investors should accumulate Ark Innovation ETF (ARKK).

Michael Burry gained fame during the 2006-2009 housing bubble by correctly predicting the collapse of subprime mortgages, money lent to higher risk applicants. His research showed that subprime mortgage investments would fizzle when the borrowers were ultimately forced to replace their teaser rate loans with contracts that reflected their creditworthiness. Burry then persuaded Goldman Sachs to sell him credit default swaps to bet against the subprime bonds.

Burry was right. He earned $700 million for the partners in his Scion Capital hedge fund and $100 million personally. Then Hollywood memorialized his exploits in the film The Big Short.

According to a 13F filing at the Securities and Exchange Commission, now Burry is using options to bet against Ark Innovation ETF and Tesla (TSLA), Ark’s largest holding.

Except that Ark and Tesla are not the subprime crisis. The value of their securities has nothing to do with debt financing or default. The process is far more opaque.

Tesla is cashflow positive. Its production for 2021 is sold out. More importantly, the company has shown no trouble raising capital at current share prices and above. Institutional investors have bought into the valuation. If Burry is expecting some sort of bomb to eventually explode and bring clarity he’s likely to be disappointed.

There is also a social investing problem.



Legions of smaller investors have gamified opposition to hedge fund managers like Burry. They look for bearish bets then they collectively run stock prices higher to cause maximum pain. This process can continue for many months, as with the meme stocks Gamestop (GME) and AMC Entertainment (AMC).

Hedge fund managers have lost billions during 2021 betting against meme stocks.

The Ark Innovation fund returned 150% during 2020, although shares are down 8.6% year-to-date. Attracting bearish investors like Burry is not a bad thing. It is likely the fuel needed to get the fund moving higher again.

Longer-term investors should buy shares into the current weakness.

(Footnote: When I was managing editor of MSN Money in the late 1990s, I hired young Mike Burry as a weekly columnist focused on value stocks. He had just graduated from med school at Vanderbilt University and was headed to Stanford for further studies, but stock analysis and investing were his passions. The Big Short is a great film but skips over important and tragic events surrounding Burry’s efforts to short mortgage-backed bonds. Ask me about it next time we meet.)","(Tech stock analyst Jon D. Markman publishes Strategic Advantage, a lively guide to investing in the digital transformation of business and society.
She is getting out in front of reports that the Big Short investor has made a major bet against her flagship fund.
Longer-term investors should accumulate Ark Innovation ETF (ARKK).
Burry then persuaded Goldman Sachs to sell him credit default swaps to bet against the subprime bonds.
The Big Short is a great film but skips over important and tragic events surrounding Burry’s efforts to short mortgage-backed bonds.",https://www.thestreet.com/tech/news/arkkjdm082021,2021-08-20 16:17:39+00:00
5,ARKK,Is Cathie Wood's ARKK ETF a Buy Now?,"ARK Invest ETFs have been the center of media attention and drama so far in 2021. ARK Invest, founded by Cathie Wood in 2014, has been under the microscope after having a standout year following the pandemic. Today I am focusing specifically on one ARK Invest ETF, the ARK Innovation ETF (NYSEMKT: ARKK). Over the past year, ARKK has returned investors a whopping 48.75% versus Invesco QQQ ETF's (NASDAQ: QQQ) spectacular 36.63%. Even after a rough start to 2021, ARKK has outperformed QQQ by over 12%. The question investors have is whether this was solely fueled by the pandemic. If you zoom out and look at three-year returns, ARKK is up over 177% versus 108% for QQQ. That's 69% outperformance in three years.

ARKK is an actively managed ETF with an expense ratio of .75%. ARK Invest makes daily buys and sells and shares this information publicly. Although the transparency is great, I believe many investors use this data incorrectly. I see people post on social media and websites worried about what ARK Invest bought or sold the day before. The goal of ARKK is to invest in ""disruptive innovation"" over the long term. Cathie Wood has been very vocal in explaining that the fund invests with the goal of multiyear holdings, capturing gains from secular growth trends and disruptive technology.

ARKK invests in the following themes:

Genomic revolution

Industrial innovation

Next-generation internet

Fintech innovation

In today's video I break down ARKK. I provide a list of its current holdings, opinions on why the ETF has underperformed YTD, my thoughts on its long-term growth prospects, and technical analysis on where the price could be headed.

*Stock prices used in the below video were during the trading day of August 5, 2021. The video was published on August 5, 2021.

10 stocks we like better than ARK Innovation ETF

When our award-winning analyst team has a stock tip, it can pay to listen. After all, the newsletter they have run for over a decade, Motley Fool Stock Advisor, has tripled the market.*

They just revealed what they believe are the ten best stocks for investors to buy right now... and ARK Innovation ETF wasn't one of them! That's right -- they think these 10 stocks are even better buys.

See the 10 stocks

*Stock Advisor returns as of June 7, 2021

John Mackey, CEO of Whole Foods Market, an Amazon subsidiary, is a member of The Motley Fool's board of directors. Eric Cuka owns shares of ARK Innovation ETF, Amazon, Deere & Company, DocuSign, DraftKings Inc., Invesco QQQ Trust, Lockheed Martin, PagerDuty, Palantir Technologies Inc., Sea Limited, Square, Teladoc Health, Tesla, Twilio, Twist Bioscience Corporation, UiPath Inc., Unity Software Inc., Vanguard S&P 500 ETF, Zillow Group (A shares), and Zoom Video Communications and has the following options: long August 2021 $40 calls on Palantir Technologies Inc. The Motley Fool owns shares of and recommends Amazon, DocuSign, PagerDuty, Palantir Technologies Inc., Roku, Sea Limited, Shopify, Skillz Inc., Spotify Technology, Square, Teladoc Health, Tesla, Twilio, Unity Software Inc., Vanguard S&P 500 ETF, Zillow Group (A shares), Zillow Group (C shares), and Zoom Video Communications. The Motley Fool recommends Lockheed Martin and recommends the following options: long January 2022 $1,920 calls on Amazon, long January 2023 $1,140 calls on Shopify, short January 2022 $1,940 calls on Amazon, and short January 2023 $1,160 calls on Shopify. The Motley Fool has a disclosure policy. Eric is an affiliate of The Motley Fool and may be compensated for promoting its services. If you choose to subscribe through his link, he will earn some extra money that supports his channel. His opinions remain his own and are unaffected by The Motley Fool.

The views and opinions expressed herein are the views and opinions of the author and do not necessarily reflect those of Nasdaq, Inc.","ARK Invest, founded by Cathie Wood in 2014, has been under the microscope after having a standout year following the pandemic.
Today I am focusing specifically on one ARK Invest ETF, the ARK Innovation ETF (NYSEMKT: ARKK).
I see people post on social media and websites worried about what ARK Invest bought or sold the day before.
After all, the newsletter they have run for over a decade, Motley Fool Stock Advisor, has tripled the market.
*They just revealed what they believe are the ten best stocks for investors to buy right now... and ARK Innovation ETF wasn't one of them!",https://www.nasdaq.com/articles/is-cathie-woods-arkk-etf-a-buy-now-2021-08-06,2021-08-06 00:00:00
6,ARKK,Are you a robot?,"Why did this happen?

Please make sure your browser supports JavaScript and cookies and that you are not blocking them from loading. For more information you can review our Terms of Service and Cookie Policy.","Why did this happen?
Please make sure your browser supports JavaScript and cookies and that you are not blocking them from loading.
For more information you can review our Terms of Service and Cookie Policy.",https://www.bloomberg.com/news/articles/2021-08-02/anti-ark-etf-plan-caps-a-bad-stretch-for-cathie-wood-s-funds,2021-08-02 00:00:00
7,ARKK,You Can Short Cathie Wood’s ARK Innovation Fund. But Is It a Good Idea?,"For those bearish on ARK Invest’s innovation-driven stock picks, there might soon be a new ETF that allows investors to bet against them.

Tuttle Capital Management, a small fund company with 10 ETFs and $228 million under management, has filed to launch the Short ARKK ETF under the ticker SARK. The fund would seek to track the inverse performance of the $23 billion ARK Innovation ETF (ticker: ARKK) through swaps contracts, according to a filing with the Securities and Exchange Commission.

Inverse...","For those bearish on ARK Invest’s innovation-driven stock picks, there might soon be a new ETF that allows investors to bet against them.
Tuttle Capital Management, a small fund company with 10 ETFs and $228 million under management, has filed to launch the Short ARKK ETF under the ticker SARK.
The fund would seek to track the inverse performance of the $23 billion ARK Innovation ETF (ticker: ARKK) through swaps contracts, according to a filing with the Securities and Exchange Commission.",https://www.barrons.com/articles/short-ark-innovation-fund-etf-51628035888,2021-08-02 00:00:00
