,Ticker,Title,Article,Summary,Link,Date
39,ARKK,Can the Ark Innovation ETF stay afloat in a post-pandemic world?,"T he ARK Innovation ETF’s [ARKK] share price plunged nearly 35% from $156.58 on 12 February to $102.16 at 12 May’s close.

The active ARK Innovation ETF, which invests in disruptive innovation companies developing new products or services, technological improvements and advancements in scientific research such as DNA, has recorded a year-to-date daily total return of -14.77% (as of 12 May), according to Yahoo Finance.

In addition, according to CNBC, over $1.1bn of assets have been pulled this month. Tesla [TSLA], the fund’s top holding with a 10.30% weighting on 13 May, has seen its share price drop from its recent peak of $883.09 on 26 January to $589.89 at close on 12 May. The second-biggest holding, Teladoc Health [TDOC], which was weighted at 6.18%, has plunged 52.4% from its latest peak of $294.54 on 8 February to $140.08 on 12 May. In third-place is Roku [ROKU] with a 5.54% weighting, which has slid from $467.31 on 19 February to $308.03 on 12 May.

Other main holdings such as Square [SQ] and Shopify [SHOP] have also seen recent share price falls.

The growth in ecommerce in 2020 helped Shopify, more demand for digital payments helped Square and streaming media platform Roku benefited from people staying at home more and looking for entertainment.

Last year, too, saw Tesla’s share price accelerate, helped by surging demand for electric vehicles (EVs). Teladoc’s technology was utilised more often during lockdowns, as were other key holdings such as video conference group Zoom Video Communications [ZM].

Why the reverse?

The sight of global lockdowns coming to an end has got some investors worried about lower demand for the ARK Innovation ETF’s key holdings when more of society re-opens. Tesla has also had investor concerns, including weaker Chinese sales.

The ETF has also been the victim of a broad technology market selloff resulting from the prospect of rising inflation. Technology stocks receiving high valuations are based on future cashflow prospects. As inflation climbs, the value of that declines.

“If you're valuing a high-growth company based on its earnings 10 years out, those earnings into the future are worth a lot less today at higher inflation levels,” Dan Eye, head of asset allocation and equity research at Fort Pitt Capital Group, told Reuters.

AJ Bell investment director Russ Mould agrees that sentiment over historically lofty valuations could be changing. “Electric vehicle stocks, SPACs, IPOs and cult tracker funds like [the] ARK Innovation [ETF] are all [now] taking a beating,” he says.

“Perhaps [the threat of] inflation is persuading investors to look for cheap recovery plays that could offer rapid earnings growth now, in the event of a strong post-pandemic economic upturn, rather than keep buying expensive stocks that are promising profits growth a long time in the future.”

""Perhaps [investors don't want to...] keep buying expensive stocks that are profits growth a long time in the future"" - Russ Mould, AJ Bell

However, although share prices have changed, the narrative around innovative stocks has not. Tesla is likely to keep benefiting from growing demand for EVs as governments around the world strive to cut carbon emissions while other indicators for ecommerce, digital health and payments and DNA/genetic medicines also look positive.

So, despite the short-term drawdowns, the central concept of the ARK Innovation ETF — that Cathie Wood, founder and CEO of Ark Invest (pictured), is exposing investors to multi-decade growth themes — remains strong.

“The whole idea of an ETF is to play out its theme over time,” Dana Blankenhorn wrote in InvestorPlace.

“Wood’s thesis is that, over the long run, the disruptive technologies will transform the economy, to the benefit of disrupters. Over the long run, the theme of disruption does work. But over the short run, piling into disrupters leaves these stocks overvalued. If you buy ARKK stock today, you are betting Wood will recognise when that happens and sell, just like any other smart fund manager.”

""Over the long run, the theme of disruption does work"" - Dana Blankenhorn, InvestorPlace

Indeed, Ark Invest is grabbing opportunities such as snapping up shares of technology firm Palantir [PLTR]. “[Our] long-term focus allows us to buy if a name has been hit for short-term reasons or sell if a name is up on short-term exuberance,” Ark Invest’s chief operating officer, Tom Staudt, told CNBC.

Blankenhorn added: “Over the long run, Wood’s theme is correct. Buy the future and profit when it arrives.”

Yes, there are concerns over rising inflation and interest rates.

“The future ARKK stock price is unlikely to resemble its spectacular past,” Cliff D’Arcy wrote in The Motley Fool.

That said, there will likely be plenty of other investors willing to get on board the ARK Innovation ETF, even in these present choppy waters.

Disclaimer Past performance is not a reliable indicator of future results. CMC Markets is an execution-only service provider. The material (whether or not it states any opinions) is for general information purposes only, and does not take into account your personal circumstances or objectives. Nothing in this material is (or should be considered to be) financial, investment or other advice on which reliance should be placed. No opinion given in the material constitutes a recommendation by CMC Markets or the author that any particular investment, security, transaction or investment strategy is suitable for any specific person. The material has not been prepared in accordance with legal requirements designed to promote the independence of investment research. Although we are not specifically prevented from dealing before providing this material, we do not seek to take advantage of the material prior to its dissemination. CMC Markets does not endorse or offer opinion on the trading strategies used by the author. Their trading strategies do not guarantee any return and CMC Markets shall not be held responsible for any loss that you may incur, either directly or indirectly, arising from any investment based on any information contained herein. *Tax treatment depends on individual circumstances and can change or may differ in a jurisdiction other than the UK.","T he ARK Innovation ETF’s [ARKK] share price plunged nearly 35% from $156.58 on 12 February to $102.16 at 12 May’s close.
The sight of global lockdowns coming to an end has got some investors worried about lower demand for the ARK Innovation ETF’s key holdings when more of society re-opens.
“Electric vehicle stocks, SPACs, IPOs and cult tracker funds like [the] ARK Innovation [ETF] are all [now] taking a beating,” he says.
So, despite the short-term drawdowns, the central concept of the ARK Innovation ETF — that Cathie Wood, founder and CEO of Ark Invest (pictured), is exposing investors to multi-decade growth themes — remains strong.
That said, there will likely be plenty of other investors willing to get on board the ARK Innovation ETF, even in these present choppy waters.",https://www.cmcmarkets.com/en/opto/can-the-ark-innovation-etf-stay-afloat-in-a-post-pandemic-world,2021-05-11 09:14:04+00:00
40,ARKK,The Stealth Correction Is Quickly Gaining Momentum,"The indices are not hiding it like they did yesterday, but we have some full-fledged bear market action out there this morning. Market players are dumping stocks into the abyss, and support levels are falling fast. Breadth is around 1900 gainers to 5600 decliners, but it is far worse in other market areas. All the FATMAAN names are red, and recent ARK Innovation (ARKK) buys are running one gainer to around 39 decliners.

I can go into great detail about how poor this market action is right now, but this is the most aggressive and consistent selling we have seen in a while. There is no interest in trying to bottom fish 'value,' and it is very hard to find a decent chart.

What makes the action so much more difficult is that a big part of the market has already corrected very deeply. I've been talking about this for a while, but the big caps that drive the senior indices are still hovering near highs.

This is looking like a real purge in some of the small-cap and growth names, but can they bounce if the big-cap names are just starting a deeper correction. That is the problem, and I'm just going to sit back and watch.","The indices are not hiding it like they did yesterday, but we have some full-fledged bear market action out there this morning.
Breadth is around 1900 gainers to 5600 decliners, but it is far worse in other market areas.
I can go into great detail about how poor this market action is right now, but this is the most aggressive and consistent selling we have seen in a while.
There is no interest in trying to bottom fish 'value,' and it is very hard to find a decent chart.
What makes the action so much more difficult is that a big part of the market has already corrected very deeply.",https://realmoney.thestreet.com/investing/the-stealth-correction-is-quickly-gaining-momentum-15644241,2021-05-04 10:13:43-04:00
41,ARKK,It's a Strange Mix of Action Out There,"The indices look good, and breadth is strong at 2 to 1 positive, but momentum is mixed, as is illustrated by ARK Innovation ETF (ARKK) , which is trading down 0.7%. Traders still seem to be hesitant to aggressively chase, but lower interest rates are helping the overall move.

The best momentum on my screens right now are the U.S. cannabis plays that are referred to as Multi-State Operators (MSO). Names like Trulieve (TCNNF) , Green Thumb (GTBIF) , and Cresco Labs (CRLBF) are trading well after being mentioned in a positive story in Barron's this weekend.

Ammo, Inc. (POWW) finally announced the closing of its deal with gunbroker.com but is trading down on a 'sell the news' reaction. The company will update guidance next week and has previously said that the deal was accretive. I expect the stock to quickly find support as investors focus on some excellent numbers.

My Stock of the Week is Aurinia Pharmaceuticals (AUPH) . The stock finally turned up last week and will be announcing the first sales of its key product on Thursday. I believe it is a turning point for the stock, and I will be looking for better action.

The poor action in biotechnology has hurt quite a few stocks that I favor. The well-regarded biotechnology fund, Perceptive Life Sciences Offshore Fund Ltd, is the worst-performing fund this year with a drop of nearly 21%, which is reflective of the struggles in the sector.

It is a strange mix of action out there with many of the stocks that traders tend to favor not doing well, but the senior indices and breadth are good. We'll see how things develop as the day progresses.","Traders still seem to be hesitant to aggressively chase, but lower interest rates are helping the overall move.
The stock finally turned up last week and will be announcing the first sales of its key product on Thursday.
I believe it is a turning point for the stock, and I will be looking for better action.
The poor action in biotechnology has hurt quite a few stocks that I favor.
It is a strange mix of action out there with many of the stocks that traders tend to favor not doing well, but the senior indices and breadth are good.",https://realmoney.thestreet.com/investing/it-s-a-strange-mix-of-action-out-there-15642656,2021-05-03 10:39:22-04:00
42,ARKK,Where Are We Now in the Market's 'Cycle'?,"I had the same question posed to me by several folks on Friday, so I thought I should address it. The question is where are we in the cycle? Well, I do not know.

I have said many times before that I will not know it is the top, until well after the fact. But at the same time, I have also noted many similarities to the chart of ARK Innovation Fund (ARKK) to the Invesco QQQ (QQQ) from the year 2000.

My sense on this year, 2021, is that we hit a speculative peak in January and February. There was so much speculation in the market, that it was unsustainable. I also think much of that speculation has been wrung out of the market. In that respect it is similar to the early part of 2000, because that too was a speculative frenzy.

What many fail to recall is that the markets, namely tech stocks, came down off that high and basically went into a trading range for six to seven months before it finally took a new leg down. At this point, we're only three months post the peak in the speculative stocks. And keep in mind it took a recession and 9/11 to really kill that market.

I think mostly this market is in that up/down phase, where we keep getting group rotation -- one reason we can't seem to get a proper whoosh. Just look at the QQQs an the Russell 2000 fund (IWM) together. In March, IWM managed to make a new high (blue arrow) and the QQQs could barely lift themselves off the math. Yet in April the QQQs made a new high (green arrow) and IWM couldn't get going.

That's why, even if the S&P keeps making new highs, we have a lot of rotation -- that either/or market -- going on under the hood.

Here's something else interesting. Upside volume for Nasdaq was 89% Friday, which is impressive. Yet, the last time it was similar was April 21. Go look at the two charts above (IWM and QQQ) and you can see we were within a week of a peak. Prior to that it was Sept. 28. We rallied for another week and then came right back down. And prior to that? The early June 2020 high. Clearly that much enthusiasm for stocks hasn't been bullish for longer than a short-term rally.

I think bearishness toward tech stocks got somewhat extreme last week or maybe I should say bearishness toward growth stocks. Take a look at the Russell 2000 Growth vs. Value chart. That's a round trip isn't it? And that leg down from mid-April through last week says we probably need another breather on that trade.

I think if we do pullback early this week we'll be right back to an oversold condition and likely too much bearishness by the end of the week.","The question is where are we in the cycle?
But at the same time, I have also noted many similarities to the chart of ARK Innovation Fund (ARKK) to the Invesco QQQ (QQQ) from the year 2000.
My sense on this year, 2021, is that we hit a speculative peak in January and February.
At this point, we're only three months post the peak in the speculative stocks.
I think bearishness toward tech stocks got somewhat extreme last week or maybe I should say bearishness toward growth stocks.",https://realmoney.thestreet.com/investing/stocks/where-are-we-now-in-the-market-s-cycle--15656082,2021-05-17 06:00:00-04:00
43,ARKK,Stocks Drift as Summer Trading Kicks In,"Stocks drifted lower on Tuesday, but there was little urgency to the selling and a few pockets of strength existed. Breadth was close to 2 to 1 negative, but there were more than 350 new 12-month highs to just 60 new 12-month lows.

Cryptocurrencies stabilized and are finding some buying interest here on Wednesday morning, but most of the speculative names that started correcting months ago are looking better than they have in a while. ARK Innovation ETF (ARKK) , which is the measuring stick of high-beta growth stocks, managed to push higher and is at its highest price since May 7.

The thing that is most notable about the action right now is that there isn't much energy. Part of this is due to the upcoming Memorial Day weekend, which kicks off typically slower summer trading. There is likely to be more summer-trading impact this year as people are no longer trapped at home due to COVID and are anxious to move away from their computer screens.

Another issue that likely will drive slower summer trading is a decline in liquidity. Many speculative small-caps have been feeling that for a while, and it recently hit cryptocurrencies quite hard as well. Some of the excess liquidity was flowing into value stocks and Dow Jones Industrial Average names while the names favored by aggressive individual traders suffered, but that rotational action is now cooling.

Another shift in the market is that inflationary concerns have cooled off. Bonds have rebounded to where they were in early May, and there has been some softening in commodity prices. That concern is no longer dominating the conversation.

Summer trading isn't all bad. It can be a good environment for stock pickers who are selective and wait for the right setups. However, the action is narrower, and momentum has a tendency to fizzle out faster. It is important to find the themes and sectors that are working and stay disciplined, but it is much better than the sort of rotational action that hit speculative stocks so hard over the last few months.

Indices are indicated slightly higher, and Bitcoin is looking frisky.

Join us on May 26th for Real Talk, a special Real Money webinar featuring reopening portfolio picks from Chris Versace, Stephen ""Sarge"" Guilfoyle and Ed Ponsi. Sign up for the webinar to see them discuss and debate their portfolios.","Cryptocurrencies stabilized and are finding some buying interest here on Wednesday morning, but most of the speculative names that started correcting months ago are looking better than they have in a while.
The thing that is most notable about the action right now is that there isn't much energy.
Part of this is due to the upcoming Memorial Day weekend, which kicks off typically slower summer trading.
Another issue that likely will drive slower summer trading is a decline in liquidity.
Summer trading isn't all bad.",https://realmoney.thestreet.com/investing/stocks/stocks-drift-as-summer-trading-kicks-in-15666315,2021-05-26 07:32:09-04:00
44,ARKK,"Elon Musk, Chamath Palihapitiya and Cathie Wood Face a Reddit Reckoning","Wood has been more consistent. Untroubled by ARKK’s decline, she claims to “love this setup”: The lower price of her favorite stocks just means the future returns will be greater, she says. So far investors aren’t giving up on her. The $20 billion fund hasn’t experienced the exodus one might have expected and Friday’s rally showed some are still willing to buy the dip.","Wood has been more consistent.
Untroubled by ARKK’s decline, she claims to “love this setup”: The lower price of her favorite stocks just means the future returns will be greater, she says.
So far investors aren’t giving up on her.
The $20 billion fund hasn’t experienced the exodus one might have expected and Friday’s rally showed some are still willing to buy the dip.",https://www.bloombergquint.com/gadfly/musk-tsla-palihapitiya-ipoe-and-wood-arkk-face-a-reddit-reckoning,2021-05-26 07:32:09-04:00
45,ARKK,Why Skillz Stock Is Flying Higher Today,"What happened

Shares of Skillz (NYSE:SKLZ) stock, which had been pummeled in the tech stock sell-off over the past few weeks, is swinging higher in afternoon trading, up 15.4% as of 12:25 p.m. EDT. And you can probably thank Cathie Woods for that.

So what

The famed tech investor, who had been an aggressive buyer of Skillz stock last month and in early May, as well, appears to have been taking advantage of the sell-off to scoop up even more cheap shares of the San Francisco-based mobile-games platform this week.

According to the ARK funds website, which gives rolling updates of Ms. Woods' buys and sells, over the past two days, the ARK Innovation Index (NYSEMKT:ARKK) bought more than 1.4 million shares of Skillz after playing possum for five days.

Investors seem to be taking that as their cue to follow the leader and are buying Skillz shares in droves.

Now what

Is that the right call? With Skillz growing revenue by nearly twice over the past year and nearly five times over the past two years, it's understandable that investors might think Ms. Woods is onto something with her aggressive buying of Skillz stock. That being said, a word of caution to value investors.

Skillz stock is not making money. In fact, its losses are growing even faster than its revenues (up nearly six times in two years). The company is also burning through cash like mad -- $97.6 million in negative free cash flow racked up over the past 12 months.

Most analysts who follow the stock don't expect Skillz to book its first GAAP profit before 2025, at the earliest. While it's possible that they're all wrong and Cathie Woods is right, that's far from certain at this point.","What happenedShares of Skillz (NYSE:SKLZ) stock, which had been pummeled in the tech stock sell-off over the past few weeks, is swinging higher in afternoon trading, up 15.4% as of 12:25 p.m. EDT.
Investors seem to be taking that as their cue to follow the leader and are buying Skillz shares in droves.
With Skillz growing revenue by nearly twice over the past year and nearly five times over the past two years, it's understandable that investors might think Ms. Woods is onto something with her aggressive buying of Skillz stock.
Skillz stock is not making money.
Most analysts who follow the stock don't expect Skillz to book its first GAAP profit before 2025, at the earliest.",https://www.fool.com/investing/2021/05/14/why-skillz-stock-is-flying-higher-today/,2021-05-14 00:00:00
46,ARKK,The Selling Pressure on Many Stocks Is Brutal,"Breadth is running around 3400 advancers to 4000 decliners, and the DJIA and S&P 500 have minor losses, but the selling pressure on many stocks is brutal. Good earnings news is being sold aggressively, and growth stocks continue to fall on strong selling momentum. The ARK Innovation ETF (ARKK) continues to be pounded with a loss of 3.3% as 40 of the 41 stocks it holds are down. The only one that is up today is Peloton (PTON) which is seeing a small dead cat bounce.

What is most notable about this action is that the selling is done without regard to fundaments or valuation. It is just one giant basket of stocks being sold without regard to individual merits. The good news is that this sort of action always eventually leads to great stock picking, but the bad news is that there is no way to judge when it might end.

Currently, many stocks are caught in vicious downside momentum, and anyone trying to bottom fish is being hit. This is the sort of selling that will eventually lead to some sort of snapback, but where and when are the unknowns.

One of my favorite names, Aurinia Pharmaceuticals (AUPH) had takeover rumors in the Times of London that were reported on Bloomberg. The stock gapped up nicely on the news but totally gave back the gain and is now slightly negative. This is a good illustration of how positive news simply doesn't matter right now. The selling is overwhelming everything else.

The only thing that can be done right now is to stand aside and wait it out.","Breadth is running around 3400 advancers to 4000 decliners, and the DJIA and S&P 500 have minor losses, but the selling pressure on many stocks is brutal.
Good earnings news is being sold aggressively, and growth stocks continue to fall on strong selling momentum.
What is most notable about this action is that the selling is done without regard to fundaments or valuation.
It is just one giant basket of stocks being sold without regard to individual merits.
This is the sort of selling that will eventually lead to some sort of snapback, but where and when are the unknowns.",https://realmoney.thestreet.com/investing/the-selling-pressure-on-many-stocks-is-brutal-15647438,2021-05-06 10:34:38-04:00
