,Ticker,Title,Article,Summary,Link,Date
99,ARKK,Stocks vs ETFs: 58% of all new investments in 2021 on Globalise were made in ETFs: CEO Viraj Nanda,"Viraj Nanda, CEO, Globalise, feels that if one takes a 5-year view, low hanging fruit in small stocks seems to have gone, and one may be better placed if investors bet on large companies from here on.

Globalise is India’s first platform for guided global investing. Nanda began his career as an Investment Banker at Deutsche Bank in London. He is responsible for designing and implementing the strategic direction for expanding Globalise’s footprint in India.

In an interview with Moneycontrol’s Kshitij Anand, he said stock-specific ideas will keep on performing irrespective of size, so from here on, stock selection will matter more than blindly betting on small and mid-cap stocks.

Here are edited excerpts from that interview:

A) This is a welcome development for the entire Indian investment ecosystem. India holds tremendous potential with over 6.50 crore demat accounts and we foresee a significant surge among these towards global investing.

Recently, apart from traditional investors, there has also been a surge of millennials who are taking to new and exciting avenues of growth.

This move by NSE IFSC will help bring more investors into the fold of global investing and become a part of global growth journeys.

A) Global investing is a trend that has clearly picked up in the last year. That has been an outcome of several years of build-up as Indian investors have been warming up to the idea, while witnessing the strength of US markets, particularly in recent years.

In general, until before COVID, retail investors didn’t really participate in market returns despite frontline indices reaching new highs.

This was for several reasons, like polarised markets and the difficulty of active funds beating benchmarks. That has been contributing further to pent-up demand among investors to explore alternate investment avenues.

This really took off last year once markets stabilised post the initial COVID-related crash, as retail investment frenzy, particularly in technology stocks, generated enormous short gains, if not classical long-term wealth creation.

That further captured Indian investors’ interest and contributed to increasing numbers for international investing.

This trend has further accelerated in 2021 as more investors are looking towards the international markets. The growth is clearly visible on our platform as well as we witness increasing traction on new accounts and the value of trades.

Q) Are Indian investors glued to FAANG or the list has widened? Which are the top 10 stocks in terms of ownership you have seen Indian investors betting so far in 2021 vs what you have seen in 2020?

A) While investor interest has widened beyond the FAANG stocks, they continue to rank amongst the most popular stocks on Globalise.

As the US indices such as the S&P 500 and Nasdaq Composite continue to post new highs, Indian investors remain focused on large-cap technology stocks.

In the first half of 2021, Apple, Alphabet, Facebook, Amazon and Microsoft were the 5 most popular stocks on Globalise.

Beyond that, NVIDIA, Square, and Salesforce were among the other top technology picks by investors, along with Tesla and Pfizer in the broader market.

Q) Now with both BSE and NSE joining the party, will that impact your customers (loss of business)? What is the kind of offering you have planned or are offering currently that can be differentiators?

A) The use by NSE of unsponsored depositary receipts of US-listed companies will offer an alternative to Indian investors to own the underlying shares.

This will be an additional option for Indian investors who today already have the facility to directly acquire US stocks on US exchanges under the RBI LRS scheme.

Investing via depository receipts and investing directly in the US Stocks through platforms such as Globalise will each have its own benefits.

Direct access as available on Globalise will continue to offer benefits in terms of range of investment options, choice of asset classes, and pricing efficiency.

Q) Apart from stocks which are the ETFs that are popular among Indian investors? Please name a few of them and the kind of money riding in this category? Between stocks and ETFs which one is a more popular category?

A) ETFs are a popular investment route among investors, especially those that want to build a diversified exposure to the global markets.

For new investors, ETFs remain the preferred investment route – in the first half of 2021, 58% of all new investments on Globalise were made via ETFs.

Investors are also looking at ETFs as a way to build a diversified exposure to thematic investments. Just like with stocks, the growth-oriented technology sector seems to be the most popular among ETF investors.

However, trends like clean energy are also catching investors’ attention, evidenced by the most popular ETFs on the Globalise platform during the first half of 2021. The 5 most popular ETFs on Globalise were:1. ARK Innnovation ETF (ARKK)2. Renaissance IPO ETF (IPO)3. Small Cap Growth Vanguard ETF (BBK)4. Invesco WilderHill Clean Energy ETF (PBW)

5. Invesco QQQ Trust Series 1 (QQQ)

Q) What is the ideal portfolio allocation limit one should keep when diversifying overseas?

A) Conceptually, an investor could view his equity portfolio as a single globally diversified portfolio and, as a starting point, begin to construct it using the respective country’s share of global equity market cap as the allocation weight. That would mean allocation of close to 60% of all equity exposure to the US.

However, it is not practically possible for the Indian investor, for whom the concept of international investing is relatively new, to adopt this allocation.

So, investors may adopt a milestone-based approach for building global diversification, starting from 10% of portfolio and gradually increase it to 30% to 40% of the portfolio.

In this journey, as they become more confident about the idea of global investing, they can then take a strategic view of their overall portfolio and start building truly global portfolios with more meaningful international exposure that is based on global equity dynamics rather than home market considerations only.","Here are edited excerpts from that interview:A) This is a welcome development for the entire Indian investment ecosystem.
India holds tremendous potential with over 6.50 crore demat accounts and we foresee a significant surge among these towards global investing.
A) While investor interest has widened beyond the FAANG stocks, they continue to rank amongst the most popular stocks on Globalise.
In the first half of 2021, Apple, Alphabet, Facebook, Amazon and Microsoft were the 5 most popular stocks on Globalise.
For new investors, ETFs remain the preferred investment route – in the first half of 2021, 58% of all new investments on Globalise were made via ETFs.",https://www.moneycontrol.com/news/business/technicals/stocks-vs-etfs-58-of-all-new-investments-in-2021-on-globalise-were-made-in-etfs-viraj-nanda-ceo-globalise-7332321.html,2021-08-18 00:00:00
100,ARKK,Should You Buy TuSimple Stock Like Cathie Wood or Listen to Grizzly?,"TuSimple is a driverless truck company that went public in April 2021. The company priced the IPO above the range at $40. Like many other recent IPOs, it's trading below the issue price. While Cathie Wood of ARK Invest has been buying TSP stock, Grizzly Research issued a short sell report on the company. What’s the forecast for TuSimple stock and should you buy it like Wood or listen to Grizzly instead?","TuSimple is a driverless truck company that went public in April 2021.
The company priced the IPO above the range at $40.
Like many other recent IPOs, it's trading below the issue price.
While Cathie Wood of ARK Invest has been buying TSP stock, Grizzly Research issued a short sell report on the company.
What’s the forecast for TuSimple stock and should you buy it like Wood or listen to Grizzly instead?",https://marketrealist.com/p/should-i-buy-tusimple-stock-wood/,2021-08-16 12:59:58.102000+00:00
101,ARKK,Tesla's Musk highlights chip supply issues in early tweet to Cathie Wood,"Tesla Inc. TSLA, +1.23% Chief Executive Elon Musk took to Twitter Thursday to highlight continued supply chain issues facing the electric-car maker. Musk responded to a tweet from Cathie Wood, manager of the Ark Innovation ETF ARKK, +1.03% , who said Tesla seems to understand ""that China would like local champions to dominate electric vehicles (EV) sales inside the country but is pleased that Tesla is exporting from China high-quality/high-end EVs, especially to Europeans whose standards for fit-finish-design are quite high."" He said Tesla makes cars for export in the first half of the quarter and for the local Chinese market in the second half. ""As publicly disclosed, we are operating under extreme supply chain limitations regarding certain ""standard"" automotive chips,"" he wrote. ""Most problematic by far are Renesas 6723, -0.38% RNECY, -1.54% & Bosch."" Tesla shares were slightly higher premarket, and have gained 0.3% in the year to date, while the S&P 500 SPX, +0.19% has gained 18%.","Tesla Inc. TSLA, +1.23% Chief Executive Elon Musk took to Twitter Thursday to highlight continued supply chain issues facing the electric-car maker.
He said Tesla makes cars for export in the first half of the quarter and for the local Chinese market in the second half.
""As publicly disclosed, we are operating under extreme supply chain limitations regarding certain ""standard"" automotive chips,"" he wrote.
""Most problematic by far are Renesas 6723, -0.38% RNECY, -1.54% & Bosch.""
Tesla shares were slightly higher premarket, and have gained 0.3% in the year to date, while the S&P 500 SPX, +0.19% has gained 18%.",https://www.marketwatch.com/story/teslas-musk-highlights-chip-supply-issues-in-early-tweet-to-cathie-wood-2021-08-12,2021-08-12 00:00:00
102,ARKK,"Resilience? Stagflation Signs, Nvidia Action, Fed Hawks on Deck, Booster Rockets","Resilience? Is that what it's called?

The major large-cap indices all rallied back from lows created about an hour into Monday's regular trading session. The rally kept on keeping on right up until the closing bell.

The Dow Jones Industrials closed at a record high for the 35th time in 2021. Yawn. The S&P 500 set for that index, a 49th record close of just this year. More yawning. Aggregate trading volume actually increased significantly from Friday for NYSE-listed names. Still quite thin, mind you. Trading volume moved sideways for Nasdaq-listed names.

Traders digested the utter and absolutely humiliating collapse of U.S.-backed forces in Afghanistan, a presidential speech that was put off until after the closing bell, which did not matter to anyone, and a plethora of weaker-than-expected Chinese macroeconomic data points illustrating the extent of the impact of Covid's Delta variant upon the world's second-largest economy, and most important supplier to Planet Earth's other key economies.

Then there was the Empire State Manufacturing Index, the first regional look at the state of the U.S. manufacturing base for the month of August. The headline number disappointed, while remaining expansionary. New Orders, Shipments, Number of Employees, and Average Workweeks all showed signs of slower growth. However, Prices Paid and Prices Received remained on the same aggressively upward-bound trajectory as in July. Harbinger of stagflation? Duh.

The U.S. Treasury yield curve seems to think so. Bond traders continue to plow into the long end of the curve. As the wee hours pass early on Tuesday morning, I see the U.S. 30-Year Bond giving up just 1.89%, while the 10-Year Note pays 1.22%. These yields are down from 2.01% and 1.38% (respectively) as recently as last Thursday.

On Equities

Don't You just love hearing an anchor from anywhere read their business segment, and ignorantly spew out how the major indices made new highs, while the ""tech-heavy"" Nasdaq Composite closed -0.2%. No mention that the ""tech-heavier"" Nasdaq 100 closed just slightly in the green. No mention that the strength in Monday's equity marketplace was almost strictly limited to defensive-style sectors. Health Care, Utilities and Staples led the way. Cyclicals, such as Financials, Discretionaries, Materials, and Energy all sold off. Stagflation? Duh.

The Technology sector select SPDR ETF (XLK) , for that matter, finished the day in fourth place, up 0.45%, but this was not a broad story of some kind of rally into tech. Apple (AAPL) rallied 2% in an attempt to break out from established resistance at $150. Microsoft (MSFT) also explored new heights. Inside the sector, however, the Dow Jones U.S. Software Index closed slightly lower, while the Philadelphia Semiconductor Index surrendered 0.4%.

You do need to check out the action in Nvidia (NVDA) on Monday. Take a look at this:

It's not quite developed as of yet, but readers will see that on Monday, NVDA rebounded sharply off of its own 50-day simple moving average (SMA), and in the process, retook its 21-day exponential moving average (EMA). The stock's indicators appear sort of neutral right now.

Relative Strength and the Full Stochastics Oscillator both appear non-committal. This, while the daily Moving Average Convergence Divergence (MACD) might present a 12-day EMA and 26-day EMA that currently wrestle for control, but against the backdrop of a 9-day EMA that has not only gone negative, but has been negative (mostly) since the beginning of July.

I think NVDA will test at least that 21-day line again and perhaps the 50-day line once again, but we also have a potential ascending triangle in the making... and that my friends would be bullish. Since you were about to ask, I am still flat this name. For now.

For all the talk of resistance, equity markets were a hollow shell of ugliness on Monday. Losers beat winners by almost two to one at the NYSE, and by almost five to two at the Nasdaq. Declining volume crushed advancing volume quite decisively at both exchanges as well, while new lows beat new highs by more than five to two at the Nasdaq -- with the Composite less than a percent away from an all-time high. Seems legit. Who's down for an evening of Jenga? I'll buy the pizza.

On that note, the S&P 500 has now gone nine months without a 5% correction. No, we are not close to an all-time record there (19 months: June 2016 through January 2018), and there is this wall of liquidity that seems to absorb every dip. There are also enough reasons to be ever vigilant as we traverse a more than uncertain economic, monetary, fiscal, political, geo-political, and public health landscape.

Other than that, I don't see much to worry about.

The Fed

Last week, Minneapolis Fed President Neel Kashkari, who is not a voting member of the FOMC this year, told Bloomberg News: ""If we see a few more jobs reports like the one we just got, then I feel comfortable saying yeah, we are - maybe haven't filled the hole that we've been in - but we've made a lot of progress, and now, then will be the time to start tapering our asset purchases.""

Never mind the slight incoherence. That happens to all of us, when we are quoted publicly, word for word. Never mind the fact that after removing the seasonal adjustment U.S. job creation actually contracted in July. Nobody is willing to hear that.

The fact is that July was seen as a strong month for labor, and Kashkari needs to see more of those, before supporting any tapering of the $80B per month in Treasury purchases and $40B in mortgage-backed securities. (Oh, and never mind the fact that we are more than half a year late on removing MBS purchases from the program, and that prolonging that adjustment retards the natural development of multiple generations of U.S. households.)

The Minutes from the FOMC policy meeting of July 27-28 will not be released until Wednesday afternoon. Regardless, news has been broken at multiple sources (I read it at the WSJ, I heard it at CNBC) that several Fed officials are advocating for the termination of the entire asset purchase program by the middle of 2022, which means that if they are going to taper, they had better get on their horse soon and ride fairly hard. This plays very well into the narrative that such a tapering will at least signaled next week at Jackson Hole, and seriously debated at the Sept. 21-22 policy meeting, especially if the August employment situation appears strong.

In recent days, both Boston Fed President Eric Rosengren (not an idealogue) and Dallas Fed President Robert Kaplan (quite pragmatic), neither of whom vote on policy this year, have opined in such a way as to sound cautiously hawkish. With Kansas City's perma-hawk Esther George and Cleveland's more hawkish than most (and whose opinion I respect greatly) Loretta Mester both on the sidelines for 2021, I just don't see the Fed moving very aggressively very quickly. My thinking is that we talk about this for a couple of months unless there is an upside inflationary shock far worse than anything we have seen to date.

Next year, Cleveland (Mester), Kansas City (George), St. Louis (James Bullard), and Boston (Rosengren) replace Richmond (Thomas Barkin), Atlanta (Raphael Bostic), San Francisco (Mary Daly), and Chicago (Charles Evans) at the policy table. For those readers who do not follow the Fed all that closely, that is one heck of a hawkish turn in personality for the Committee. I mean, ONE HECK of a turn.

Booster Rockets

On Thursday, The FDA authorized Covid-19 booster shots for the immunocompromised. On Friday, the CDC got on board.

On Monday, we learned that Pfizer (PFE) and BioNTech (BNTX) had submitted their joint application to provide these ""booster"" shots to the general public. As ""we think"" we now know, immunity wanes over time after being fully vaccinated, and it is believed that the Delta variant more easily than past variants finds a way around this weakened immunity.

The Biden administration is expected to announce later this week that Americans who have been fully vaccinated should receive such a jab to ensure continued protection. This is why there are extra slots on that card you were issued by the CDC. The expectation is that the strategy will be to boost folks eight months after originally being ""fully"" vaccinated.

Moderna (MRNA) for its part is expected to submit such an application sometime next month, while Johnson & Johnson (JNJ) is expected to at least release data concerning the efficacy of a second shot of that company's single-shot vaccine.

Market Notes

1) In a 13-F filing on Monday, Scion Asset Management (Michael Burry of ""The Big Short"" fame) revealed a semi-sizable ($31M) long position in put options held against Cathie Wood's Ark Innovation ETF (ARKK) .

2) Palantir Technologies (PLTR) , in addition to announcing that the company had expanded its portfolio of investments in companies going public via SPAC to more than $300M, also announced the acquisition of $50.7M in gold bars. We like gold here, and we like PLTR.

3) Berkshire Hathaway (BRK.A) , (BRK.B) apparently added to its long position in Kroger (KR) , while trimming holdings in General Motors (GM) , Chevron (CVX) , AbbVie (ABBV) , Merck (MRK) , and Bristol-Myers Squibb (BMY) . It is here where Sarge reiterates his buy rating on ABBV and his price target of $142.

Economics (All Times Eastern)

08:30 - Retail Sales (July): Expecting -0.2% m/m, Last 0.6% m/m.

08:30 - Core Retail Sales (July): Expecting 0.2% m/m , Last 1.3% m/m.

08:55 - Redbook (Weekly): Last 16.2% y/y.

09:15 - Industrial Production (July): Expecting 0.5% m/m, Last 0.4% m/m.

09:15 - Capacity Utilization (July): Expecting 75.7%, Last 75.4%.

10:00 - Business Inventories (July): Expecting 0.8% m/m, Last 0.5% m/m.

10:00 - NAHB Housing Market Index (Aug): Expecting 80, Last 80.

16:30 - API Oil Inventories (Weekly): Last -816K.

The Fed (All Times Eastern)

13:30 - Speaker: Federal Reserve Chair Jerome Powell.

Today's Earnings Highlights (Consensus EPS Expectations)

Before the Open: (HD) (4.41), (WMT) (1.57)

After the Close: (A) (0.99), (ALC) (0.45)

(AAPL, ABBV, WMT, BMY, NVDA and MSFT are holdings in Jim Cramer's Action Alerts PLUS member club. Want to be alerted before Jim Cramer buys or sells these stocks? Learn more now.)","New Orders, Shipments, Number of Employees, and Average Workweeks all showed signs of slower growth.
Inside the sector, however, the Dow Jones U.S. Software Index closed slightly lower, while the Philadelphia Semiconductor Index surrendered 0.4%.
You do need to check out the action in Nvidia (NVDA) on Monday.
Losers beat winners by almost two to one at the NYSE, and by almost five to two at the Nasdaq.
With Kansas City's perma-hawk Esther George and Cleveland's more hawkish than most (and whose opinion I respect greatly) Loretta Mester both on the sidelines for 2021, I just don't see the Fed moving very aggressively very quickly.",https://realmoney.thestreet.com/investing/stocks/resilience-stagflation-signs-nvidia-action-fed-hawks-on-deck-booster-rockets-15742477,2021-08-17 07:42:33-04:00
103,ARKK,"3 Reasons to Buy This Cathie Wood Growth Stock, and 1 Reason Not to","As of this writing, Roku (NASDAQ:ROKU) is the third-largest holding in Cathie Wood's ARK Innovation ETF portfolio of stocks. The popular asset manager's fund holds over 3.2 million shares of the enabler of streaming content. That's a total value of almost $1.2 billion and makes up 5.4% of the portfolio.

Roku's stock price is down 25% in the last month as the market has turned sour on so-called stay-at-home stocks that benefited during the pandemic. However, that could be a buying opportunity for long-term investors.

Let's look at three reasons to buy this Cathie Wood favorite and one reason for caution.

1. More content is shifting to streaming from linear TV

More and more consumers are switching from linear TV connections to streaming content. Still, there is a long way to go before the transition runs its course. One estimate suggests in 18- to 45-year-olds, only 39% of their TV watching is streaming, highlighting that there is plenty of room for the shift to continue.

2. Roku has a great operating system that customers love

Roku enables this transition by selling hardware (streaming players) that connects TVs to its operating system. Additionally, it works with manufacturers to have its operating system built into TVs. Indeed, Roku is the leading operating system in TVs in the U.S. and Canada, and it's making good progress in Brazil and Mexico. Roku's system is proven to be reliable and reduces costs for manufacturers. Those features have helped Roku attract 55.1 million active accounts, up 28% from last year; a figure that is likely to grow as Roku continues its international expansion.

3. Roku is expanding internationally

The next market Roku will enter is Germany later this year. If Roku can match the success it's achieving in existing markets -- and there is no reason to think it won't -- it can continue to attract new customers. Indeed, the plan from management on international expansion is to keep doing more of the same, since it's working so well. During the second-quarter earnings call earlier this month, founder and CEO Anthony Wood commented:

In terms of growing active accounts globally, the strategy we're using is the same that worked for us well in the U.S., which is to focus on building active accounts, well, in terms of our business model internationally, it's to focus on building active accounts, engaging those users and then monetizing those users. And the way we are building active accounts is through selling our streaming players and licensing our operating system to TV manufacturers and coming to market with Roku TVs. Both of those are working well for us.

A concern? Roku's valuation is not cheap

The one reason to be hesitant about Roku stock right now is that it isn't cheap, despite falling in value by 25% in the last month. It's trading at a forward price-to-sales ratio of 16.73, down from nearly 25 earlier in the year. To be sure, Roku has excellent long-run prospects. However, that might already be priced into the stock at this price. Furthermore, the company has challenges in the near term, such as the negative effects of economic reopenings and supply chain issues, which are causing shortages in materials and harming profit margins.

All things considered, it may be prudent for investors to wait for an additional pullback in the stock price before accumulating shares in Roku. Or you could wait for supply chain issues and financial impacts from economic reopenings to play out before buying Roku stock.","Let's look at three reasons to buy this Cathie Wood favorite and one reason for caution.
Roku has a great operating system that customers loveRoku enables this transition by selling hardware (streaming players) that connects TVs to its operating system.
During the second-quarter earnings call earlier this month, founder and CEO Anthony Wood commented:In terms of growing active accounts globally, the strategy we're using is the same that worked for us well in the U.S., which is to focus on building active accounts, well, in terms of our business model internationally, it's to focus on building active accounts, engaging those users and then monetizing those users.
Roku's valuation is not cheapThe one reason to be hesitant about Roku stock right now is that it isn't cheap, despite falling in value by 25% in the last month.
Or you could wait for supply chain issues and financial impacts from economic reopenings to play out before buying Roku stock.",https://www.fool.com/investing/2021/08/26/3-reasons-to-buy-this-cathie-wood-growth-stock-and/,2021-08-26 00:00:00
