,Ticker,Title,Article,Summary,Link,Date
26,ARKK,Robinhood tanks 27% after shareholders file to sell,"Robinhood (HOOD) shares tanked 27% to close the session at $50.27 after several wild sessions. Thursday's decline followed an announcement that some stockholders would be cashing out up to 97.8 million shares. The news came after a massive two-day rally. The investment platform's shares had gained 100% earlier this week.

Robinhood appears to be the newest meme stock on the Wall Street, highlighting the power of retail investors. It was one of the most mentioned stocks on Reddit's WallStreetBets on Tuesday and Wednesday, according to SwaggyStocks. The stock's comment volume spiked over a two day span.

Shares were halted for volatility in the first few minutes of the trading session on Wednesday. The stock soared more than 80% at one point. The upward move comes a day after the stock spiked 24%. The stock price blew past its IPO price of $38 on Tuesday in stark contrast to its public debut last week.

On Wednesday Fidelity's real-time order data showed Robinhood as a top traded stock, behind Advanced Micro Devices (AMD) and AMC (AMC), two stocks followed by WSB members.

While short squeezes have initially driven up ""meme"" stocks in the past, Robinhood's move is not driven because of a short covering. ""Until HOOD stock borrow availability grows and the overall amount of HOOD shares shorted becomes relevant – buying and selling by long shareholders is the reason behind HOOD’s price moves,"" Ihor Dusaniwsky of S3 Partners told Yahoo Finance.

Vladimir Tenev, CEO and co-founder of Robinhood, is shown on an electronic screen at Nasdaq in New York's Times Square following his company's IPO, Thursday, July 29, 2021. (AP Photo/Mark Lennihan)

High profile investments in Robinhood may also be helping fuel the recent rally. Last week Cathie Wood's Ark Innovation ETF (ARKK) scooped up about 4.9 million shares of Robinhood, according to Bloomberg data.

The recent movements are a stark contrast compared to the stock's public debut last Thursday.The stock sank as much as 12% below its IPO price during its first day of trading on the Nasdaq (^IXIC). Shares closed down 8% that day. Some questioned whether its lackluster performance had anything to do with Robinhood's hybrid auction-style debut, a lack of lock-up period for 15% of shares held by employees and others, or concerns over regulatory headwinds.

Story continues

Robinhood has been a key player in the retail trading boom involving GameStop (GME) and other stocks over the past year and a half. In an unusual move, the company allocated about 35% of its shares to retail investors for its IPO.

Ines is a markets reporter covering stocks from the floor of the New York Stock Exchange. Follow her on Twitter at @ines_ferre

Follow Yahoo Finance on Twitter, Facebook, Instagram, Flipboard, LinkedIn, YouTube, and reddit","Robinhood (HOOD) shares tanked 27% to close the session at $50.27 after several wild sessions.
Robinhood appears to be the newest meme stock on the Wall Street, highlighting the power of retail investors.
The stock price blew past its IPO price of $38 on Tuesday in stark contrast to its public debut last week.
Last week Cathie Wood's Ark Innovation ETF (ARKK) scooped up about 4.9 million shares of Robinhood, according to Bloomberg data.
In an unusual move, the company allocated about 35% of its shares to retail investors for its IPO.",https://finance.yahoo.com/news/robinhood-dips-12-as-some-shareholders-file-to-sell-141203993.html,2021-08-03 00:00:00
27,ARKK,"Robinhood shares surge 50%, as investors scoop up 'the meme of memes'","Aug 4 (Reuters) - Shares of Robinhood Markets Inc (HOOD.O)rose more than 50% on Wednesday during a wild trading session as investors scooped up shares after its underwhelming stock market debut last week.

The online brokerage’s shares closed at $70.39, off the session high of $85 when the stock was up nearly 82%, with one analyst dubbing it ""the meme of memes"" in a reference to stocks popularized this year by retail investors congregating in online platforms such as Reddit's WallStreetBets.

The stock has risen far above its initial public offering price of $38 per share and has logged its fourth straight day of gains.

Its market capitalization rose to $58.8 billion, catapulting it ahead of Twitter Inc , restaurant chain Chipotle Mexican Grill (CMG.N) and asset manager T. Rowe Price (TROW.O).

Interest in the stock among retail investors soared on social media despite its weak market debut last week, when it fell below its IPO price. It was unclear exactly how much of Wednesday's buying was from retail investors, though.On Tuesday, retail trading volume rose tenfold, helping the stock gain 24%, according to Vanda Research. Over the past 24 hours, Robinhood was by far the most mentioned stock on WallStreetBets according to sentiment tracker SwaggyStocks.

""We know from meme stock trading that's happened over the last several months that when there's a lot of activity on social media, sometimes that will drive a stock higher or lower,” said Randy Frederick, vice president of trading and derivatives for Charles Schwab in Austin, Texas.

Wednesday marked the first day that investors could trade options on Robinhood shares, another way of betting on the stock. In recent months, options trades by retail investors have contributed to outsize moves in shares of companies like GameStop and AMC Entertainment Holdings. read more

Some 293,000 contracts changed hands by 3:15 p.m. (1915 GMT), about evenly spread between bearish puts and bullish calls, putting it on pace for one of the most active options markets debuts ever, according to Trade Alert data.

The logo of Robinhood Markets is displayed at a pop-up event on Wall Street after the company's IPO in New York City, July 29, 2021. REUTERS/Andrew Kelly

""I am surprised by how active it is, ... but then this is the meme of memes,"" said Henry Schwartz, head of product intelligence at Cboe.

Contracts betting on the shares rising above $70 by Aug. 20 were the most actively traded. Puts that come into play if the stocks falls below $20 by mid-August were the next most actively traded contract.

Implied volatility on the stock’s August options stood at around 240% -- indicating that traders expect the stock to move about 15% every day, with a greater-than-30% daily move once every 20 days, according to a note from Christopher Murphy of Susquehanna Investment Group.

Sentiment on Robinhood has also been helped by star stock picker Cathie Wood, who heads the ARK Invest asset management firm.

Wood's Ark Fintech Innovation ETF (ARKF.P) bought another 89,622 shares of Robinhood on Tuesday, and the stock now amounts to about 0.9% of its portfolio, according to a summary of the fund's daily trading.

Wood's flagship ARK Innovation ETF (ARKK.P) has accumulated nearly 5 million Robinhood shares.

""People are trying to jump on the back of Cathie Wood's vote of confidence in Robinhood shares,"" said Thomas Hayes, managing member at Great Hill Capital in New York.

""The catalyst was certainly Cathie Wood putting in a sizable position after everyone was downbeat after the IPO.""

Reporting by Sruthi Shankar and Medha Singh in Bengaluru; Sinead Carew and Saqib Ahmed in New York; Additional reporting by Noel Randewich in San Francisco; Editing by Shounak Dasgupta, Shailesh Kuber and David Gregorio

Our Standards: The Thomson Reuters Trust Principles.","Aug 4 (Reuters) - Shares of Robinhood Markets Inc (HOOD.O)rose more than 50% on Wednesday during a wild trading session as investors scooped up shares after its underwhelming stock market debut last week.
Wednesday marked the first day that investors could trade options on Robinhood shares, another way of betting on the stock.
In recent months, options trades by retail investors have contributed to outsize moves in shares of companies like GameStop and AMC Entertainment Holdings.
Wood's flagship ARK Innovation ETF (ARKK.P) has accumulated nearly 5 million Robinhood shares.
""People are trying to jump on the back of Cathie Wood's vote of confidence in Robinhood shares,"" said Thomas Hayes, managing member at Great Hill Capital in New York.",https://www.reuters.com/business/finance/robinhood-shares-surge-more-than-80-retail-investors-dive-2021-08-04/,2021-08-04 00:00:00
28,ARKK,"Netflix, Draftkings, Docusign, Twitter, Etsy — Stocks Cathie Wood's Ark Bought Or Sold Wednesday","One of Cathie Wood-led Ark Invest's key exchange traded funds on Wednesday nearly trimmed all of its exposure to Netflix Inc (NASDAQ: NFLX) as it sold 1,627 shares, estimated to be worth about $833,674, in the online video streaming service.

Netflix shares closed 0.67% lower at $512.40 on Wednesday.

The New York-based investment management group deployed the Ark Next Generation Internet ETF (NYSE: ARKW) to sell the shares, which after Wednesday’s trades, owns a total of 192 shares in Netflix.

Ark Invest also owns shares in Netflix via the Ark Space Exploration & Innovation ETF (BATS: ARKX). No other ETF holds any position in Netflix.

The two ETFs, after Wednesday’s trades, still held 27,546 shares, worth about $14.11 million, in the popular video streaming service.

See Also: Netflix, Nvidia, DraftKings, Alibaba, Square — Stocks Cathie Wood's Ark Bought Or Sold Tuesday

The popular asset manager also snapped up 91,300 shares - estimated to be worth about $4.76 million - in DraftKings Inc (NASDAQ: DKNG).

DraftKings shares closed 0.38% higher at $52.18 on Wednesday.

Ark Invest investment owns DraftKings shares via three of its active ETFs — ARKW, the Ark Innovation ETF (NYSE: ARKK), and the Ark Fintech Innovation ETF (NYSE: ARKF) but deployed only ARKF on Wednesday to buy the shares of the sports betting company.

On a consolidated basis, Ark still held 13.8 million shares, worth $722.17 million, in DraftKings, as of Wednesday’s trade.

The New York-based investment firm also sold 63,862 shares - estimated to be worth about $3.33 million - in DocuSign Inc (NASDAQ: DKNG).

Shares of DocuSign closed 0.38% lower at $52.18 on Wednesday.

Wood’s firm sold the shares in DocuSign via ARKK and also holds a stake in the company via ARKW.

The two ETFs held 1.77 million, worth $519.86 million, in DocuSign as of Wednesday.

The investment firm also sold 280,031 shares — estimated to be worth about $18.33 million — in Twitter Inc (NYSE: TWTR) via ARKW.

Story continues

ARKK too holds a position in the stock.

Twitter shares closed 0.27% lower at $65.46 on Wednesday.

Together the two ETFs held 12.6 million, worth $825.36, in the Jack Dorsey-led social media company Twitter ahead of Thursday’s trades.

The New York-based investment firm also snapped up 9,700 shares — estimated to be worth about $1.88 million — in Etsy Inc (NASDAQ: ETSY), an e-commerce platform for handmade goods and vintage items, via ARKF.

Etsy shares closed 2.92% higher at $193.96 on Wednesday.

Ark has been piling up shares in Etsy via ARKF and ARKW and has ahead of Thursday's trade, lifted the position in the company to 626,882 shares, worth $121.59 million, in a total of eight trades.

Some of the other key Ark buys on Wednesday included UiPath Inc (NYSE: PATH) and sells included Base Inc (OTC: BAINF).

See also: How to Buy Netflix Stock

See more from Benzinga

© 2021 Benzinga.com. Benzinga does not provide investment advice. All rights reserved.","The two ETFs, after Wednesday’s trades, still held 27,546 shares, worth about $14.11 million, in the popular video streaming service.
See Also: Netflix, Nvidia, DraftKings, Alibaba, Square — Stocks Cathie Wood's Ark Bought Or Sold TuesdayThe popular asset manager also snapped up 91,300 shares - estimated to be worth about $4.76 million - in DraftKings Inc (NASDAQ: DKNG).
On a consolidated basis, Ark still held 13.8 million shares, worth $722.17 million, in DraftKings, as of Wednesday’s trade.
The two ETFs held 1.77 million, worth $519.86 million, in DocuSign as of Wednesday.
Together the two ETFs held 12.6 million, worth $825.36, in the Jack Dorsey-led social media company Twitter ahead of Thursday’s trades.",https://finance.yahoo.com/news/netflix-draftkings-docusign-twitter-etsy-093115121.html,2021-08-04 00:00:00
29,ARKK,Buy This Top Cathie Wood Stock Before It Breaks Higher,"Cathie Wood, the founder and CEO of ARK Invest, has gained immense popularity among retail investors thanks to strong performance from many of the company's exchange-traded funds (ETFs). The stock price of the ARK Innovation ETF, for instance, has soared close to 150% since the beginning of 2020 and crushed the broader stock market's gains handsomely.

The terrific gains are a result of Wood's strategy of investing in disruptive tech companies, such as cloud communications specialist Twilio (NYSE:TWLO). Twilio is among the top 10 holdings in the ARK Innovation ETF, accounting for 3.66% of the fund's value. The stock has more than tripled in value since January 2020, but investors who have missed this terrific rally now have a golden opportunity to go long Twilio. Let's see why.

Twilio's latest slip is an opportunity in disguise

Twilio stock price fell after the company released its Q2 earnings report, which seems surprising as it easily beat Wall Street's expectations. It reported a 67% year-over-year increase in revenue to $669 million, while non-GAAP loss per share increased from $0.09 in the prior-year period to $0.11 last quarter.

Analysts expected Twilio to lose $0.13 per share on $598 million in revenue. However, it looks like Twilio's guidance for a bigger-than-expected loss this quarter may have triggered some panic among investors. Twilio expects to lose between $0.14 and $0.17 per share this quarter on revenue between $670 million and $680 million. Wall Street was expecting a smaller loss of $0.07 per share on $636.4 million in revenue.

But investors shouldn't be focusing on Twilio's near-term bottom-line miss, as it is pulling the right strings to ensure growth in a lucrative market. Its revenue is on track to increase 50% to 52% year over year this quarter -- but don't be surprised to see Twilio do better than that, for a couple of reasons.

First, the company's customer base is expanding at a quick pace. It finished Q2 with 240,000 customer accounts, compared to 200,000 in the year-ago period. The acquisitions of Segment and ValueFirst accounted for 7,500 of those customer additions.

Second, Twilio is generating incremental business from existing customers. This is evident from the company's dollar-based net expansion rate of 135% in Q2, up from 132% in the prior-year period. The dollar-based net expansion rate increases when Twilio's active customers increase their usage of products they are already using or buy additional services from the company.

It is worth noting that the metric wasn't impacted by the acquisitions of Segment and ValueFirst, as the dollar-based net expansion rate is calculated based on those active customer accounts that were present in the prior-year period. The new customers brought in by those acquisitions can boost spending if they decide to opt for Twilio's other products. Additionally, Twilio's existing customer base now has additional services to choose from, paving the way for further growth in the dollar-based net expansion rate in future quarters.

Investors shouldn't forget that Twilio added another fast-growing company to its portfolio recently. The company recently spent $850 million to acquire toll-free messaging provider Zipwhip, bringing 30,000 new customers into its fold.

Now, this acquisition-driven strategy is impacting the company's bottom-line performance because of acquisition-related expenses. For instance, it incurred $2.5 million in expenses to acquire Zipwhip. But investors shouldn't miss the forest for the trees, as Twilio's strategy of spending money to boost its top line will come in handy in the long run.

Focus on the bigger picture

Twilio is focused on grabbing as big a piece of the cloud communications market as possible. This is a smart thing to do, as the cloud communications market is expected to clock a compound annual growth rate of nearly 28% through 2026, and Twilio is currently growing at a faster pace than the space it operates in.

The company's acquisitions indicate that it intends to keep outpacing the broader industry's growth, a strategy that could substantially boost revenue in the long run and eventually pave the way for bottom-line improvements. Twilio estimates that its addressable market could hit $87 billion by 2023, a number that rises to $104 billion after including the revenue opportunity added by Segment.

So Twilio is just scratching the surface of a massive opportunity given that it has generated $2.25 billion in revenue in the past year. As such, it should be able to sustain its high levels of growth in the long run. That's why investors looking to add a growth stock to their portfolios can treat the recent slip in Twilio as a buying opportunity.","Cathie Wood, the founder and CEO of ARK Invest, has gained immense popularity among retail investors thanks to strong performance from many of the company's exchange-traded funds (ETFs).
The stock price of the ARK Innovation ETF, for instance, has soared close to 150% since the beginning of 2020 and crushed the broader stock market's gains handsomely.
Twilio expects to lose between $0.14 and $0.17 per share this quarter on revenue between $670 million and $680 million.
Twilio estimates that its addressable market could hit $87 billion by 2023, a number that rises to $104 billion after including the revenue opportunity added by Segment.
That's why investors looking to add a growth stock to their portfolios can treat the recent slip in Twilio as a buying opportunity.",https://www.fool.com/investing/2021/08/12/buy-top-cathie-wood-stock-before-breaks-higher/,2021-08-12 00:00:00
30,ARKK,Cathie Wood’s ARK Invest Bought Palantir Stock After Strong Earnings,"Fund company ARK Invest, led by the well known portfolio manager and stock picker Cathie Wood, loaded up on Palantir Technologies shares after the analytics software company posted strong quarterly financial results.

Early Thursday, Palantir reported June quarter revenue of $376 million, up 49% from a year ago, beating both the company’s own target and the Wall Street consensus by large margins. Its earnings, at 4 cents a share, were a penny better than estimated.

The...","Fund company ARK Invest, led by the well known portfolio manager and stock picker Cathie Wood, loaded up on Palantir Technologies shares after the analytics software company posted strong quarterly financial results.
Early Thursday, Palantir reported June quarter revenue of $376 million, up 49% from a year ago, beating both the company’s own target and the Wall Street consensus by large margins.
Its earnings, at 4 cents a share, were a penny better than estimated.",https://www.barrons.com/articles/cathie-woods-ark-invest-palantir-stock-51628881097,2021-08-12 00:00:00
31,ARKK,Guggenheim enlists ARK for 'early disruptors' investment trust,"Guggenheim Investments and ARK Investment Management have teamed up to launch a new unit investment trust (UIT) focused on making early stage investments in disruptive technology companies.

The ARK Early Stage Disruptors Portfolio, which launched Tuesday, invests in companies involved in DNA sequencing, robotics, energy storage, artificial intelligence and blockchain technology, according to Guggenheim’s website and multiple recent filings with the Securities and Exchange Commission (SEC).

The companies in the trust’s holdings are predominantly American small-cap firms. Its initial holdings including cloud computing companies, firms that work in genome editing and 3D printers, according to Guggenheim’s website.

It does not and will not include direct or indirect exposure to cryptocurrencies, according to SEC filings.

ARK will serve as the trust’s portfolio consultant and will recommend securities to Guggenheim, according to the SEC filings. There are 25 stocks in the portfolio, most of which also feature in ARK’s own ETFs, such as ARK Innovation ETF (ARKK), and ARKG Genomic Revolution ETF (ARKG). For example, the top two holdings in the UIT as of Wednesday were biotech firms Invitae Corp. and Pacific Biosciences of California. Both firms make up about 7% of the trust and appear at smaller weightings in both ARKK and ARKG.

Guggenheim and ARK did not immediately respond to requests for comment about the trust, which has an initial lifespan of two years, according to the SEC filings and Guggenheim’s website.

Performance data for the trust’s first series won’t be available until early September, according to Guggenheim’s website. Its initial offer price was $10 per unit, which ticked up to $10.08 as of Wednesday.

Guggenheim, which has about $255bn under management, already has a lineup of dozens of such unit investment trusts, which it offers to investors alongside mutual funds and ETFs, according to the firm’s website. These vehicles are typically offered at the request of a small number of clients.

ARK, led by CEO and portfolio manager Cathie Wood, has made waves over the last year thanks to massive returns during 2020. The firm’s flagship fund, ARKK, has faltered over the first half of 2021, however, and Wood’s 2020 success has drawn a backlash with some investors questioing the likelihood of future returns given the high valuations of some key holdings. Earlier this week, Tuttle Capital Management launched a counter ETF that allows investors to short the main ARK strategy.","Guggenheim Investments and ARK Investment Management have teamed up to launch a new unit investment trust (UIT) focused on making early stage investments in disruptive technology companies.
Its initial holdings including cloud computing companies, firms that work in genome editing and 3D printers, according to Guggenheim’s website.
ARK will serve as the trust’s portfolio consultant and will recommend securities to Guggenheim, according to the SEC filings.
Guggenheim and ARK did not immediately respond to requests for comment about the trust, which has an initial lifespan of two years, according to the SEC filings and Guggenheim’s website.
Performance data for the trust’s first series won’t be available until early September, according to Guggenheim’s website.",https://citywireusa.com/professional-buyer/news/guggenheim-enlists-ark-for-early-disruptors-investment-trust/a1539038,2021-08-05 13:16:00
