,Ticker,Title,Article,Summary,Link,Date
0,ARKK,Are you a robot?,"Why did this happen?

Please make sure your browser supports JavaScript and cookies and that you are not blocking them from loading. For more information you can review our Terms of Service and Cookie Policy.","Why did this happen?
Please make sure your browser supports JavaScript and cookies and that you are not blocking them from loading.
For more information you can review our Terms of Service and Cookie Policy.",https://www.bloomberg.com/news/articles/2021-05-11/cathie-wood-s-misery-mounts-as-arkk-assets-dip-below-20-billion,2021-05-11 00:00:00
1,ARKK,"Cathie Wood's ARK Innovation ETF falls to new low for the year, off nearly 35% from recent high","In this article ARKK

ARKK

Cathie Wood Source: CNBC

Cathie Wood's flagship fund Ark Innovation hit its lowest point of the year on Monday amid further selling in innovation stocks. Ark Innovation's 5% drop on Monday dragged the ""disruptive innovation"" ETF below its March low, a level that many investors are watching as a barometer for the larger tech sector. Ark Innovation is now nearly 35% off its most recent high: $159.70 on Feb. 16. Wood's core ETF is now down more than 13% this month and more than 16% year to date.

Zoom In Icon Arrows pointing outwards

Some of Ark Innovation's top holdings took big hits on Monday as the Nasdaq Composite dropped more than 2.5%. Tesla fell 6.4% and Teladoc Health dropped 6.6%. Square and Roku fell 7.3% and 4.9%, respectively. DraftKings declined 6.4% and Zillow lost 5.1%. Wood told CNBC on Friday that she loves the setup for her ETFs following the most recent sell-off in technology stocks. She said she envisions her strategies posting a compound annual rate of return of 25% to 30%.

""I love this setup,"" Wood said Friday on CNBC's ""Closing Bell."" ""The worst thing that could have happened to us is to have the market narrowly focus on just our ilk of stock — the innovation space."" However, more than $1.1 billion of fund flows have left Ark Innovation this month. Ark Invest — including its five core ETFs — has lost about nearly $2 billion in investor dollars in May, according to FactSet.

200-day moving average long gone

Ark Innovation broke below its 200-day moving average, a key technical level watched by traders that is essentially the average of the past 200 closing prices. ""The issue with ARKK and other speculative growth ETFs is that short-term rallies have been aggressively faded for three months now,"" Frank Cappelleri, Instinet executive director, told CNBC. ""The ETF will have to do more than just bounce for a few days to convince traders otherwise."" ""In other words, simply getting back above the 200-day moving average won't mean much without upside follow through. That continues to be the biggest concern,"" Cappelleri added.

Zoom In Icon Arrows pointing outwards","In this article ARKKARKKCathie Wood Source: CNBCCathie Wood's flagship fund Ark Innovation hit its lowest point of the year on Monday amid further selling in innovation stocks.
Ark Innovation's 5% drop on Monday dragged the ""disruptive innovation"" ETF below its March low, a level that many investors are watching as a barometer for the larger tech sector.
Ark Innovation is now nearly 35% off its most recent high: $159.70 on Feb. 16.
However, more than $1.1 billion of fund flows have left Ark Innovation this month.
""In other words, simply getting back above the 200-day moving average won't mean much without upside follow through.",https://www.cnbc.com/2021/05/10/cathie-woods-ark-innovation-etf-falls-to-new-low-for-the-year.html,2021-05-10 00:00:00
2,ARKK,3 ETFs Better Than ARK Innovation,"ARK Invest and its CEO, Cathie Wood, have been making headlines in the investing world. The investment management firm is known for its high-flying ETFs, which have experienced phenomenal returns over the past year.

Its flagship fund, the ARK Innovation ETF (NYSEMKT:ARKK), has earned an incredible 175% return over the past 12 months. Since its inception in 2014, it's earned an average return of nearly 34% per year.

With returns like that, it's easy to see why this ETF is attractive. But while it has had a good run so far, it's also an incredibly risky investment. The fund has only been around for a few years, and any investment without an extensive track record is risky.

Also, the ETF only contains between 35 and 55 stocks on average, which focus on ""disruptive innovation."" Considering many other ETFs contain hundreds or thousands of stocks, ARK Innovation doesn't provide much diversification. In addition, ""innovative"" companies tend to be higher risk than well-established ones.

This doesn't necessarily mean it's a bad investment, but it is a risky one. And there are a few ETFs that may be a better option for most investors. Here are three:

iShares Core S&P 500 ETF

The iShares Core S&P 500 ETF (NYSEMKT:IVV) tracks the S&P 500, meaning it includes all the same stocks as the index and aims to mirror its performance. The S&P 500 includes just over 500 stocks from some of the largest and most stable companies in the U.S., which makes this ETF a relatively safe investment.

While it does see lower average returns than ARK Innovation, it's far less risky. This doesn't mean you won't have years where you experience losses. But over the long term, you're more likely to earn positive average returns.

Since its inception in 2000, it has earned an average annual return of around 7%. Keep in mind that the market has experienced a significant amount of volatility in the past 20 years, including the dot-com bubble burst and the Great Recession. Despite these downturns, this ETF has still earned positive returns over time.

Vanguard Total Stock Market ETF

The Vanguard Total Stock Market ETF (NYSEMKT:VTI) includes 3,755 stocks from small, midsize, and large corporations in the U.S.

Similar to the S&P 500 ETF, this fund aims to track the stock market as a whole. But it contains far more stocks than an S&P 500 ETF, and it also includes stocks from companies of all sizes.

This provides more diversification and more opportunity for growth. Small and midsize companies can be more volatile, but they also tend to grow faster than large corporations. This means you could experience higher growth rates while still limiting your risk.

This ETF was established in 2001, and since then it has earned an average return of around 8%. Like the S&P 500 ETF, this fund has a long track record and has shown that it can withstand volatility over the long term.

Schwab U.S. Large-Cap Growth ETF

The Schwab U.S. Large-Cap Growth ETF (NYSEMKT:SCHG) includes 235 stocks from companies that are expected to experience above-average growth. Three of its largest holdings include tech behemoths Apple, Microsoft, and Amazon.

Growth ETFs can be riskier than S&P 500 ETFs or total stock market ETFs, but they also generally see higher-than-average returns. In fact, since this fund's inception in 2009, it has earned an average return of more than 17% per year.

This doesn't mean you'll earn returns of 17% every single year. There's a much greater chance that some years you'll experience low returns or even losses, while other years you'll earn significantly higher-than-average returns.

While its returns don't match those of ARK Innovation, this fund is safer because it includes more stocks, and many of the stocks in the fund are from large, well-established corporations. Despite being lower risk, though, it's still possible to make a lot of money with this ETF.

If you were to invest, say, $300 per month while earning a 17% average annual return, you'd have more than $2.3 million accumulated after 30 years. Again, you may not necessarily experience those types of returns, but this fund is designed for above-average growth.

ARK Innovation might be the flashy new fund taking the investing world by storm, but it's not necessarily the right investment for everyone. To keep your money safer while still maximizing your returns, these three ETFs could be a better option.","Its flagship fund, the ARK Innovation ETF (NYSEMKT:ARKK), has earned an incredible 175% return over the past 12 months.
Considering many other ETFs contain hundreds or thousands of stocks, ARK Innovation doesn't provide much diversification.
Here are three:iShares Core S&P 500 ETFThe iShares Core S&P 500 ETF (NYSEMKT:IVV) tracks the S&P 500, meaning it includes all the same stocks as the index and aims to mirror its performance.
While it does see lower average returns than ARK Innovation, it's far less risky.
Growth ETFs can be riskier than S&P 500 ETFs or total stock market ETFs, but they also generally see higher-than-average returns.",https://www.fool.com/investing/2021/05/10/3-etfs-better-than-arkk/,2021-05-10 00:00:00
3,ARKK,Are you a robot?,"Why did this happen?

Please make sure your browser supports JavaScript and cookies and that you are not blocking them from loading. For more information you can review our Terms of Service and Cookie Policy.","Why did this happen?
Please make sure your browser supports JavaScript and cookies and that you are not blocking them from loading.
For more information you can review our Terms of Service and Cookie Policy.",https://www.bloomberg.com/news/articles/2021-05-05/cathie-wood-s-ark-battered-by-selloff-in-stay-at-home-darlings,2021-05-05 00:00:00
4,ARKK,Cathie Wood's ARK Innovation ETF Is Struggling—and It May Get Worse,"One of the hottest exchange-traded funds is sliding again, and the selloff may only get worse.

The ARK Innovation ETF (ticker: ARKK) delivered a 153% return in 2020. But it’s now giving up those gains quickly. The ETF, which is actively managed by ARK Invest CEO Cathie Wood and her team, is down 27% over the last three months, including an 13% decline in the past week alone. It was falling again on Thursday, down 2.6% to $108.62 at 11:56 a.m.

The...","One of the hottest exchange-traded funds is sliding again, and the selloff may only get worse.
The ARK Innovation ETF (ticker: ARKK) delivered a 153% return in 2020.
But it’s now giving up those gains quickly.
The ETF, which is actively managed by ARK Invest CEO Cathie Wood and her team, is down 27% over the last three months, including an 13% decline in the past week alone.
It was falling again on Thursday, down 2.6% to $108.62 at 11:56 a.m.",https://www.barrons.com/articles/cathie-woods-ark-innovation-etf-is-selling-off-and-it-may-get-worse-51620318285,2021-05-05 00:00:00
5,ARKK,"Cathie Wood's ARK Innovation ETF drops more than 3% amid tech sell-off, off almost 30% from high","Cathie Wood, chief executive officer and chief investment officer of ARK Investment Management LLC, speaks during the Sooner Than You Think conference in the Brooklyn borough of New York on Tuesday, Oct. 16, 2018.

The fund is nearly 30% off its high in February of this year, after which the ETF spiraled on the threat of rising interest rates.

Ark Innovation dropped 3.3% on Tuesday, alongside the Nasdaq Composite's 1.9% tumble. The ""disruptive innovation"" fund is down more than 6.4% this week and 9.2% in 2021, while the S&P 500 has gained over 10% this year.

Some of Ark Innovation's top holdings were taking big hits. Tesla lost 1.7% and Teladoc Health dropped 3%. Square and Roku fell 5.1% and 4.7%, respectively. Zillow Group dipped 3.4%.

""High multiple stocks in tech are very crowded,"" Stephanie Link, chief investment strategist at HighTower, said on CNBC's "" Halftime Report ."" ""You have very tough comparisons going forward. But also the valuations. High valuations don't do well when you see better GDP growth, a little bit more inflation.""

It is challenging to pinpoint the exact reason for the selling in technology shares this week with interest rates staying lower and the sector coming off a week of blowout earnings. Investors could be taking profits in their biggest winners since the pandemic lows and rotating into things more leveraged to the reopening.

Plus, the threat of higher capital gains taxes likely isn't helping sentiment.

Jim Paulsen, chief investment strategist at the Leuthold Group, told CNBC that investors could be getting increasingly disappointed that stocks are not doing well in the face of fantastic earnings news. He suggested if ""good news"" is already fully priced in, a market top could be near.

In the face of this weakness, investors are pulling money from Wood's fund. More than $290 million left Ark Innovation in the last week, according to FactSet. However, more than $7 billion has flooded into Wood's ETF this year.

Wood, as usual, is staying the course during the pressure on her top holdings. After a 15% drop in Twitter's stock on Friday, Wood added 843,194 shares of Twitter to the Ark Innovation ETF and 468,256 shares to the Ark Next Generation Internet ETF. Those positions would be worth about $72.4 million based on Twitter's closing price on Friday.

Wood's other ETFs also experienced intense selling pressure on Tuesday. The Ark Next Generation ETF lost 3.2%, bringing its week-to-date losses to more than 5%. The Ark Genomic Revolution ETF and the Ark Autonomous Technology and Robotics ETF lost 4% and 2%, respectively on Tuesday. The pair are down 6.6% and 3.6% this week alone. The Ark Fintech Innovation ETF dropped 3%, bringing its losses for the week to 4.3%.

The Ark Autonomous Technology and Robotics ETF and Ark Fintech Innovation are Wood's only funds in the green for the year.

Wood gained popularity after Ark Innovation's rally of nearly 150% in 2020.","Ark Innovation dropped 3.3% on Tuesday, alongside the Nasdaq Composite's 1.9% tumble.
""High multiple stocks in tech are very crowded,"" Stephanie Link, chief investment strategist at HighTower, said on CNBC's "" Halftime Report .""
After a 15% drop in Twitter's stock on Friday, Wood added 843,194 shares of Twitter to the Ark Innovation ETF and 468,256 shares to the Ark Next Generation Internet ETF.
The Ark Genomic Revolution ETF and the Ark Autonomous Technology and Robotics ETF lost 4% and 2%, respectively on Tuesday.
The Ark Autonomous Technology and Robotics ETF and Ark Fintech Innovation are Wood's only funds in the green for the year.",https://www.cnbc.com/2021/05/04/cathie-woods-ark-innovation-etf-drops-nearly-5percent-amid-tech-sell-off-is-now-off-30percent-from-high.html,2021-05-04 00:00:00
6,ARKK,Are you a robot?,"Why did this happen?

Please make sure your browser supports JavaScript and cookies and that you are not blocking them from loading. For more information you can review our Terms of Service and Cookie Policy.","Why did this happen?
Please make sure your browser supports JavaScript and cookies and that you are not blocking them from loading.
For more information you can review our Terms of Service and Cookie Policy.",https://www.bloomberg.com/news/articles/2021-05-12/wall-street-s-160-billion-boom-in-thematic-etfs-is-fizzling-out,2021-05-12 00:00:00
7,ARKK,ARK Innovation's performance under pressure as tech stocks swoon,"A specialist trader watches his chart while working on the floor of the New York Stock Exchange July 8, 2014. REUTERS/Brendan McDermid

NEW YORK, May 5 (Reuters) - A rotation out of growth and technology stocks and a recent slide in shares of Tesla Inc (TSLA.O) are weighing on the performance of ARK Innovation (ARKK.P), the flagship exchange-traded fund managed by star stock picker Cathie Wood that bested all other U.S. equity funds in 2020.

The $23.1 billion fund posted a gain of less than 1% last month, a showing nearly 3 percentage points behind the average fund in its category, according to Morningstar data. For the year to date, the fund is down 9%, a performance that puts it in the bottom 100th percentile in Morningstar's category of 543 mid-cap growth funds. The S&P 500 (.SPX) is up 10.9% over the same time.

Investors pulled $645.5 million out of the fund during the week that ended April 21, a 2.6% decline that was its largest weekly outflow in percentage terms since 2018 and only the fifth weekly loss overall since 2019, according to Refinitiv Lipper. The fund brought in $37 million the following week, the smallest weekly inflow in percentage terms since January 2020.

Among the factors denting the fund is a rally in shares of financials, energy firms and other companies that stand to benefit from a powerful U.S. economic rebound that has made the growth and tech stocks that dominated last year less alluring to some investors. The Russell 1000 Value index (.RLV), for example, is up nearly 15.8% for the year to date, while the Russell 1000 Growth index (.RLG) is up 5.5% over the same time.

Shares of Tesla, which make up 10.5% of the fund and are its biggest holding, are down 4.5% since the start of the year, contributing to the fund's slide. Virtual healthcare company Teladoc Health Inc (TDOC.N), the fund's second-largest holding, has seen its shares fall nearly 21% over the same time.

""The market has rotated away from the fund's favored growth stocks toward more economically sensitive segments of the market,"" said Todd Rosenbluth, head of ETF and mutual fund research at CFRA. ""We think if underperformance continues longer, some investors will become frustrated and seek an alternative.""

More recently, growth and technology stocks have sold off over the last few days, a move investors have pinned on everything from profit-taking to worries that the U.S. economic rebound will peak in coming months. read more

Managing investor expectations after last year's eye-popping performance will be a test for fund manager Wood, who is widely seen as one of the most bullish investors on Wall Street in companies such as Tesla and the cryptocurrency bitcoin. She became a favorite of retail investors as technology and growth stocks surged during the pandemic last year.

ARK did not respond to a request to comment for this story.

The fund gained 152.8% in 2020, the best performance among any actively managed U.S. equity fund tracked by Morningstar.

Of the fund's 10-largest holdings, only one - payment company Square Inc (SQ.N) - is up for the year to date.

""We are in a scenario now that is quite different than it was the year before, and as we see the reopening increase and the pandemic eases, the performance of growth names is going to be more dictated by the Fed"" and its interest rate policies than by the economic recovery, said Quincy Krosby, chief market strategist at Prudential Financial.

The slowing performance of the fund could also focus more investor attention on its strategy of taking large bets on a handful of companies, a style that may make it ""ill-prepared to grapple with a major plot twist,"" noted Robby Greengold, a strategist on Morningstar's U.S. equities team.

Overall, funds such as ARK Innovation that outperformed in one year do not tend to outperform in the following year, according to a 2020 study led by James Choi, a professor at the Yale School of Management.

""The disappearance of significant performance persistence is due to lower returns to favorable styles, as well as less favorable style tilts and increased style-adjusted underperformance by past winning funds,"" the study noted.

Reporting by David Randall in New York Editing by Ira Iosebashvili and Matthew Lewis

Our Standards: The Thomson Reuters Trust Principles.","A specialist trader watches his chart while working on the floor of the New York Stock Exchange July 8, 2014.
For the year to date, the fund is down 9%, a performance that puts it in the bottom 100th percentile in Morningstar's category of 543 mid-cap growth funds.
""The market has rotated away from the fund's favored growth stocks toward more economically sensitive segments of the market,"" said Todd Rosenbluth, head of ETF and mutual fund research at CFRA.
She became a favorite of retail investors as technology and growth stocks surged during the pandemic last year.
The fund gained 152.8% in 2020, the best performance among any actively managed U.S. equity fund tracked by Morningstar.",https://www.reuters.com/business/finance/ark-innovations-performance-under-pressure-tech-stocks-swoon-2021-05-05/,2021-05-05 00:00:00
8,ARKK,Are you a robot?,"Why did this happen?

Please make sure your browser supports JavaScript and cookies and that you are not blocking them from loading. For more information you can review our Terms of Service and Cookie Policy.","Why did this happen?
Please make sure your browser supports JavaScript and cookies and that you are not blocking them from loading.
For more information you can review our Terms of Service and Cookie Policy.",https://www.bloomberg.com/news/articles/2021-05-13/cathie-wood-fans-buckle-up-as-etf-assets-sink-below-40-billion,2021-05-13 00:00:00
9,ARKK,Why I'm Shorting Cathie Wood's Flagship Ark ETF,"It's been a few brutal months for growth-oriented technology investors like myself. Many tech stocks have enjoyed astronomical gains over the past year in spite of -- and in some cases, thanks to -- the COVID-19 pandemic, so a pullback isn't entirely unexpected. Still, drawdowns of this magnitude can be difficult to experience both financially and emotionally. There's also been talk of rising interest rates alongside recent concerns about inflation that have contributed to souring investor sentiment.

For many of these reasons, I recently shorted Cathie Wood's flagship ETF, Ark Innovation (NYSEMKT:ARKK). Here's why.

Hedging against the sell-off

In many ways, Ark Innovation has become the poster child for speculative, high-growth tech stocks. As such, the actively managed ETF has been especially vulnerable to the recent pullback. As of Friday's close, Ark Innovation is approximately 35% off of its highs set in February.

The fund enjoyed incredible outperformance in 2020 as many of its holdings put up blockbuster returns during the pandemic due to a variety of factors. Technology companies were instrumental in helping people and businesses adapt to a world where a deadly virus forced everyone to work remotely, and enterprise organizations had to accelerate digital transformations. At the same time, there has been hope for electric vehicle (EV) stocks, as adoption is rising and the Biden administration is enacting supportive policies.

To be clear, I'm optimistic about the long-term prospects of many of Ark Innovation's core holdings. In fact, I own many of the fund's top 10 holdings outright. Specifically, I hold Tesla, Roku, Shopify, Spotify, and Twilio, and plan to continue doing so.

The reason why I'm shorting Ark Innovation is to put a hedge in place for potential downside protection if growth stocks continue to sell off. While maintaining long positions in many of the same holdings, shorting the ETF can potentially generate gains to offset short-term declines in the individual positions, thereby providing some defense for my overall portfolio. I only regret that I didn't put this hedging strategy in place sooner.

I considered alternative strategies, such as buying a bearish put spread on the tech-heavy Nasdaq Composite (NASDAQINDEX:^IXIC), but hedging with options can be more volatile due to all of the factors (the Greeks) that impact options pricing. Time decay (negative theta) can be costly, and ultimately I determined that shorting Ark Innovation outright would be more cost-effective, even after factoring in borrowing fees. Furthermore, Ark Innovation is more concentrated in the specific stocks that are especially weak right now, while the Nasdaq Composite is more diversified.

Tech's long-term prospects remain strong

For what it's worth, Wood remains optimistic on the outlook for technology stocks. In a recent interview with CNBC, the growth investor dismissed concerns around the pullback. ""From our point of view -- five-year time horizon -- nothing has changed except the price,"" Wood told the outlet.

Ark Innovation continues to buy tech stocks, as shown by its daily trade disclosures. If anything, the pullback might result in greater annual returns going forward. At the February peak, Wood said that Ark was expecting a compound annual growth rate (CAGR) of around 15%. As Ark continues to buy the dip, the fund is now raising its estimates to a CAGR of 25% to 30%.

Tech stocks, as measured by the Nasdaq Composite, have a long historical record of outperforming the other two major indexes. That includes greater volatility at times, but patient investors have little to be worried about. A little hedging in the short term can also help smooth out the swings.","For many of these reasons, I recently shorted Cathie Wood's flagship ETF, Ark Innovation (NYSEMKT:ARKK).
Hedging against the sell-offIn many ways, Ark Innovation has become the poster child for speculative, high-growth tech stocks.
As of Friday's close, Ark Innovation is approximately 35% off of its highs set in February.
The reason why I'm shorting Ark Innovation is to put a hedge in place for potential downside protection if growth stocks continue to sell off.
Time decay (negative theta) can be costly, and ultimately I determined that shorting Ark Innovation outright would be more cost-effective, even after factoring in borrowing fees.",https://www.fool.com/investing/2021/05/15/why-im-shorting-cathie-woods-flagship-ark-etf/,2021-05-15 00:00:00
10,ARKK,Are you a robot?,"Why did this happen?

Please make sure your browser supports JavaScript and cookies and that you are not blocking them from loading. For more information you can review our Terms of Service and Cookie Policy.","Why did this happen?
Please make sure your browser supports JavaScript and cookies and that you are not blocking them from loading.
For more information you can review our Terms of Service and Cookie Policy.",https://www.bloomberg.com/news/articles/2021-05-06/best-etfs-to-watch-gbct-arkk-arkx-and-soon-bitcoin-btc-funds,2021-05-06 00:00:00
