,Ticker,Title,Article,Summary,Link,Date
62,ARKK,"Nasdaq sinks, Home Depot & Roblox drop, Cathie Wood counters new 'Big Short' short","Yahoo Finance’s Jared Blikre reports on the day's trending tickers.

Video Transcript

BRIAN CHEUNG: But let's bring in Yahoo Finance's Jared Blikre for some more detail on the market action. Again, busy market action on this Tuesday. Tell us a little bit more about the NASDAQ, and specifically what's going on with the tech stocks today.

JARED BLIKRE: Yeah, tech stocks really taking a hit. And things kind of started out rocky at the 8:30 AM retail sales report, which missed expectations by a fairly wide margin. And if we take a look at the YFi Interactive here, we can see a lot of red across not only the US, but the entire world. Small caps really taking it on the chin here, down over 1 and 1/2%. Other markets off of their lows.

Well, looking inside the market, can see a lot of red in the NASDAQ 100. Some of the worst-performing stocks are in China. We have JD.com down over 3%, Alibaba down about 4%. We're talking about the new regulatory measures there. I think some new antitrust rules were introduced overnight, in addition to that bad miss by Tencent Music with an uncertain regulatory outlook.

So not a lot of contributing factors to the green space. But I will say health care is the exception. XLV is up 65 basis points, or about just over half a percent, nearly 2/3 of a percent. To the downside, it's really the value in cyclical sectors that are getting hit the most. Consumer discretionary, that reflects retail sales, that's down over 2 and 1/2%, followed by materials, industrials, energy, and then tech and then financials. But you can see a lot of broad-base weakness here.

We do need to check out the travel space. Reopening trade, as you could imagine, not faring very well today. Let's see. Southwest down 3%, so is Delta, Royal Caribbean. You get the picture there.

And let's round this out with a little bit of green here. We do have these vaccine stocks that got hit over the last few days. They are bouncing back. Moderna up over 5%, BioNTech over 5% as well. And it looks like Regeneron up 2.8%. Guys.

Story continues

JULIA LA ROCHE: And Jared, speaking of retail, Home Depot off quite a bit after that mixed earnings report. What can you tell us about that one?

JARED BLIKRE: Yeah, the comp sales miss-- the comp sales number missed expectations. As you can see, retail really getting a double whammy today from some disappointments out of the Home Depot earnings and the retail sales report that we were talking about. But let's take a look at Home Depot stock, and it's down 4 and 1/2% today, but still holding onto gains of 20% for the year, just largely haven't gone sideways since April.

It looks like we're heading towards the bottom end of the range here, this area right here. So if that's the case, we might have a little bit farther to go and see what happens down here. Otherwise, all I can say about the stock is it's in a sideways trading range. I do have some analyst commentary. This is Wells Fargo, looks like they are rating it an overweight with a price target of $360, saying gross margins, those contracted 77 basis points versus an expansion of 25 basis points expected.

Attributing the worse-than-expected performance to increasing supply chain costs and the impact of a 27% sequential decline in lumber prices. Still, EBIT margins expanded 20 basis points to a record 16.1%. So when we're talking about gross margins there, we're talking about input costs getting higher, and that's kind of disrupting the forecast for the third quarter. And that's one of the factors weighing on the stock today.

Also, lumber prices going down. They actually make higher margins when lumber prices are going up, because they are the biggest lumber distributor sales, I guess, retailer in the United States, so they try to get those lumber prices down first. So you put it all together, the economy's still humming. But when you dig inside some of these reports like Home Depot, you just find a little bit more weakness than what was expected. Guys.

BRIAN CHEUNG: Jared, the online game maker Roblox feeling the heat of the Street today after they reported earnings. Tell us a little bit more about why they're experiencing this. I mean, they've only been public for-- they haven't even been public for over six months yet. So I guess this is kind of them feeling the capital markets, if you will?

JARED BLIKRE: Yeah, and I just learned the name Roblox exactly six months ago in the [? year-up ?] and the lead-up for the IPO. I am not the demographic, so I'll just throw that out there. But I do have some remarks from the Street, and let me see if I can find our ticker here. Here's a benchmark. They have it with a sell price target has been lowered to $70 from $75.

And here's Roblox. Now I can show a chart on the YFi Interactive. Benchmark saying the results show June bookings deaccelerated, and we are cautious over player engagement, retention, and monetization trends from key geography. They expect revenue growth of 50% this year, down from a prior view of 60%.

But I just want to share something from the report. I dug this out yesterday. Roblox bookings growth is down to 35% in the second quarter. One year ago, it was 229%. So this is the quarterly gross bookings. And you can see they just flattened out over the last three quarters. So if you're growing 35%, might be great for Walmart, might be not so great for Roblox here.

JULIA LA ROCHE: And finally, Jared, Cathie Wood hitting back at Michael Burry of ""The Big Short"" fame over a bet against her ARK fund. What can you tell us about this trade and her response?

JARED BLIKRE: Well, as you know, Julia, you follow the 13Fs, we learned that this was a trade that existed in the prior quarter, so it might not even be on. And this is done through the options market. So Michael Burry bought 2,355 puts, which would control 235,500 shares, so not a small sum, not the biggest sum.

But Cathie Wood responded, and I have some of these responses here, really fascinating, gives you an insight into her mindset. ""To his credit, Michael Burry made a great call based on fundamentals, recognized the calamity brewing in the housing/mortgage market. I do not believe that he understands the fundamentals that are creating explosive growth and investment opportunities in the innovation space.""

And then continuing here, this is only three tweets long of about 20, ""In our view, the seeds for innovation explosion at ARK Invest is dedicated to researching. These seeds were planted during the 20 years ending with the tech and telecom bust."" So that was 20 years ago. ""Having gestated for more than 20 years, these technologies should transform the world during the next 10 years,"" so into 2030.

""If we are correct""-- and I think this is very important-- ""GDP and revenue growth will diminish until the opportunities in nascent technologies begin to move macro needles. In this environment, innovation-based strategies should distinguish themselves."" So I think she's setting up the expectation for a bifurcated market where you have haves and have-nots. And we're not going to really see the valuations come down to Earth until we see the growth in the economy, until we move those macro needles, until we see robotaxis, a million robotaxis [? couriering ?] around people here in New York City. Guys.

BRIAN CHEUNG: Yahoo Finance's Jared Blikre, thanks again for breaking that down.","Video TranscriptBRIAN CHEUNG: But let's bring in Yahoo Finance's Jared Blikre for some more detail on the market action.
And things kind of started out rocky at the 8:30 AM retail sales report, which missed expectations by a fairly wide margin.
Consumer discretionary, that reflects retail sales, that's down over 2 and 1/2%, followed by materials, industrials, energy, and then tech and then financials.
As you can see, retail really getting a double whammy today from some disappointments out of the Home Depot earnings and the retail sales report that we were talking about.
BRIAN CHEUNG: Yahoo Finance's Jared Blikre, thanks again for breaking that down.",https://finance.yahoo.com/video/nasdaq-sinks-home-depot-roblox-184057177.html,2021-08-18 17:13:15+00:00
63,ARKK,Why Skillz Plunged 35.2% in July,"What happened

Shares of Skillz (NYSE:SKLZ) plummeted 35.2% in July, weighed down by doubts raised from stock-shorting hedge funds, the availability of warrants that will dilute existing shareholders' stock, and investment management favorite Cathie Wood dumping a large tranche of shares.

All of that was occurring as the mobile esports platform headed toward an Aug. 3 earnings-release date that would also weigh on Skillz shares.

So what

Earlier this year, two negative reports were issued alleging Skillz management concealed the fact that revenue from its three most important games -- Blitz, Solitaire Cube, Blackout Bingo -- had plummeted. (These games account for almost 90% of the company's revenue.) The reports also claim that money Skillz gave to players as game ""bonuses (which they would spend in the game) counted toward its revenue. Skillz is now facing dozens of shareholder lawsuits seeking to become a class action suit.

Wood, however, refuted one of the charges and bought large amounts of Skillz stock to show her support, and Motley Fool contributor Jon Quast addressed the other. Both suggest the concerns are overwrought, but they remain clouds over the company.

Skillz also issued warrants to the special purpose acquisition company (SPAC) that took it public. With its stock remaining above $20 a share for a specified period of time, those warrants could be exercised at a discount to where Skillz was trading. Although oftentimes warrants are not exercised (Skillz's expire on Aug. 16), they still represent dilution existing shareholders face.

Despite Wood's earlier show of support, she sold a portion of her holdings, suggesting she could find a better spot for her money given the continued downward spiral in the company's stock. Shares have lost nearly three-quarters of their value from their February highs. Even so, Wood's Ark Innovation ETF still owns almost 13.7 million shares, and her Ark Next Generation Internet ETF owns 6.6 million shares.

Now what

Esports is a massive growth opportunity, and Skillz is looking to capture a good portion of it. Because its platform is neutral about what games can be played on it, Skillz is able to welcome all comers. It's still a money-losing operation, but it has no debt and ended the most recent quarter with plenty of cash in the coffers, providing gamers and itself a platform for future growth.","What happenedShares of Skillz (NYSE:SKLZ) plummeted 35.2% in July, weighed down by doubts raised from stock-shorting hedge funds, the availability of warrants that will dilute existing shareholders' stock, and investment management favorite Cathie Wood dumping a large tranche of shares.
All of that was occurring as the mobile esports platform headed toward an Aug. 3 earnings-release date that would also weigh on Skillz shares.
The reports also claim that money Skillz gave to players as game ""bonuses (which they would spend in the game) counted toward its revenue.
Wood, however, refuted one of the charges and bought large amounts of Skillz stock to show her support, and Motley Fool contributor Jon Quast addressed the other.
Because its platform is neutral about what games can be played on it, Skillz is able to welcome all comers.",https://www.fool.com/investing/2021/08/04/why-skillz-plunged-352-in-july/,2021-08-04 00:00:00
64,ARKK,China tech crackdown claims ETF victims,"Beijing’s regulatory crackdown on some of its biggest companies in technology and education has delivered a bruising blow to highly specialised China-focused exchange traded funds.

Broad-based tech ETFs have sailed through virtually unscathed, but some narrowly focused thematic instruments have taken a beating. Among those most affected, the KraneShares CSI China Internet ETF (KWEB) has nearly halved in value since its peak in February.

Some ETF buyers are hunting specifically for targeted strategies, despite the risks. But Kenneth Lamont, senior fund analyst at Morningstar, said this highlights the potential drawbacks of tracking a narrow theme without the flexibility to shift tactics.

“The [passive thematic] strategy has no way to quickly react to bad news and will hold the stock until the next rebalance. The small number of fund holdings also means that overall returns can be influenced by the performance of handful of stocks,” Lamont said.

He noted that for the KraneShares ETF, one Chinese education group alone — TAL Education Group — was responsible for knocking 2.8 percentage points off performance from the end of June.

Global X Education ETF (EDUT), which has a large exposure to the Chinese online education sector, was also badly affected.

Actively managed ETFs, such as Ark Invest’s ARKK flagship Innovation fund, can react more quickly. After voicing her optimism for the prospects for China’s tech disrupters earlier this year, Cathie Wood, Ark’s chief executive, shed millions of dollars worth of shares in four China-domiciled companies.

Investors in ARKK have not been rewarded as well as those who simply put their money in broadest based funds such as the Vanguard Total World Stock Index Fund ETF (VT), but they have still managed to ride out the China tech storm far better than more exposed counterparts.

Some investors insist Chinese investments can bounce back. Mark Martyrossian, chief executive of UK-based Aubrey Capital Management, said he believed many of the affected tech companies would maintain their market leadership.

“The gravy train may have slowed but you disembark at your peril,’ Martyrossian said.

Lamont said badly hit funds had suffered such losses because they were doing exactly what they had promised to do — provide narrow exposure.

More nimble active investment strategies also face their own challenges, said Elisabeth Kashner, director of global fund analytics at FactSet. “Active managers may successfully anticipate market reversals, but they can also miss them, sometimes seriously tanking returns,” she said. “Some people can be skilful and some people can be lucky and if you’re lucky and skilful in one period you might be lucky and skilful in the next, but you might not.”

Additional reporting by Steve Johnson","Beijing’s regulatory crackdown on some of its biggest companies in technology and education has delivered a bruising blow to highly specialised China-focused exchange traded funds.
Broad-based tech ETFs have sailed through virtually unscathed, but some narrowly focused thematic instruments have taken a beating.
Among those most affected, the KraneShares CSI China Internet ETF (KWEB) has nearly halved in value since its peak in February.
He noted that for the KraneShares ETF, one Chinese education group alone — TAL Education Group — was responsible for knocking 2.8 percentage points off performance from the end of June.
Global X Education ETF (EDUT), which has a large exposure to the Chinese online education sector, was also badly affected.",https://www.ft.com/content/b7f07692-d044-46ad-8ea4-47ce2bb43b1a,2021-08-02 04:26:10.828000+00:00
65,ARKK,"The Bear Market in Small-Caps, Growth Stocks, and Speculative Stocks Has Ended","The market celebrated a dovish Jerome Powell on Friday and kept the recent uptrend in good shape. There is a growing belief that the Fed will start to taper off its bond-buying as early as its September meeting, but concerns about inflation have declined as Powell continues to promote his belief that it is transitory.

The indices hit new all-time highs once again on Friday, and that is causing talk about how extended the market has become and has caused the usual market-timing bears to declare that disaster awaits.

While the indices are in lofty territory, the real story of this market continues to be the rotational action. All year long, there has been a major disconnect between the indices and the action under the surface. Speculative small-caps, growth stocks, and many sectors like biotechnology and gambling topped out in February and fell into a deep bear market. The folks in the business media have largely ignored this story as they celebrated the indices that kept running higher on poor breadth.

Over the last seven days or so, there has been a major turn in the small stocks and growth names that have been struggling for months. It looks like a bottom has formed and that the bear market in these names has come to an end. Speculative interest has picked up, cryptocurrencies have been trading better, growth names like those held by ARK Innovation ETF (ARKK) have bounced and are back over the 50-day simple moving average.

This stealth bear market has been vicious but what has made it worse is that the media and traditional Wall Street didn't even recognize it. They are still focused on just the indices as trading action for stock-pickers has really started to improve. During the last few months, there have been several false rallies by the growth and speculative names, but the current one has had better momentum, and there is now some decent technical action that will provide a framework for better trade management.

The biggest concern of many market participants is that the indices and big-caps are due for some corrective action and will weigh on the broader market. Can small-caps continue to act well when the media is focused on weak action in the indices? There have been some periods this year when small-caps and growth names have seen positive rotation, but there is no guarantee that it will persist.

What is favorable right now is that the speculative mood is much better. Traders are focused again on stocks like Support.com (SPRT) and Vinco Ventures (BBIG) , and are beating the bushes looking for the next play. This leads to a focus on stock picking, and that helps small-caps.

We have a mixed open on the way but there looks to be some good pockets of speculative action.","Speculative small-caps, growth stocks, and many sectors like biotechnology and gambling topped out in February and fell into a deep bear market.
Over the last seven days or so, there has been a major turn in the small stocks and growth names that have been struggling for months.
Speculative interest has picked up, cryptocurrencies have been trading better, growth names like those held by ARK Innovation ETF (ARKK) have bounced and are back over the 50-day simple moving average.
There have been some periods this year when small-caps and growth names have seen positive rotation, but there is no guarantee that it will persist.
We have a mixed open on the way but there looks to be some good pockets of speculative action.",https://realmoney.thestreet.com/investing/the-bear-market-in-small-caps-growth-stocks-and-speculative-stocks-has-ended-15753549,2021-08-30 06:48:19-04:00
66,ARKK,Vested Finance witnesses increased interest in global investments in 1H21,"MUMBAI: Vested Finance, an online investment platform that enables Indian investors to invest in US equities, has observed a variety of investing behaviour and pattern from Indian investors on their platform for the first half of 2021.

Vested Finance witnessed 80% growth in their user base during the first half of 2021. The company has seen consistent market affinity towards technology stocks. In terms of number of trades, Tesla continues to be the investor favourite followed by Apple, Microsoft and Amazon.

Interestingly, however, the overall percentage of Vested Finance customers owning Tesla shares dropped to 9.2% by June from 11.5% at the start of the year, indicating that new users on the Vested platform were not so gung-ho on the stock. At the same time, the market witnessed some unusual trends including a massive influx into meme stocks such as GameStop and AMC Entertainment Holdings. AMC ended the H1 in the top 10 most popular stock on the platform and is still held by 0.9% of Vested Finance users.

Following the crypto currency momentum, Coinbase was the first crypto exchange to be listed on the stock exchange and was another stock that was quick to become an Indian investor favorite post their IPO in April 2021. It is the 10th popular stock purchased on the Vested platform and is held by 1.3% of the Vested customers, till today.

Viram Shah, chief executive and co-founder, Vested Finance said, “Global investments have gained momentum in the last couple of years. The awareness around brands combined with tech IPOs are bringing more and more people to our platform. Indians who are avid consumers of these global brands have now started investing in them to build their wealth. We are still in early days in terms of global diversification from India. As investor awareness grows and as technology makes the investing journey simpler, we will see more and more investors diversify their portfolio internationally through Vested.""

Other than investing in specific stocks directly, Indian investors have also shown interest in ETFs. ARK ETFs continue to be a popular choice among Indian investors. ARKK, the innovation focused ETF and ARKG, the genomics-focused ETF are both consistently in the top 10 ETF choices as investors look to invest into emerging themes. The S&P 500 (VOO) and Nasdaq 100 (QQQ) index ETFs are common choices along with VGT, Vanguard’s Technology Focused ETF. IAU, the Gold ETF and VYM, Vanguard’s High Dividend Yield ETF are two popular choices as well.

Subscribe to Mint Newsletters * Enter a valid email * Thank you for subscribing to our newsletter.","Vested Finance witnessed 80% growth in their user base during the first half of 2021.
AMC ended the H1 in the top 10 most popular stock on the platform and is still held by 0.9% of Vested Finance users.
It is the 10th popular stock purchased on the Vested platform and is held by 1.3% of the Vested customers, till today.
Viram Shah, chief executive and co-founder, Vested Finance said, “Global investments have gained momentum in the last couple of years.
Other than investing in specific stocks directly, Indian investors have also shown interest in ETFs.",https://www.livemint.com/money/personal-finance/vested-finance-witnesses-increased-interest-in-global-investments-in-1h21-11628144473177.html,2021-08-05 12:02:30+05:30
67,ARKK,Opinion: Forget short-term stock-market fads and just buy these 5 rocketing tech stocks,"Looking at the latest headlines, it’s easy to concoct a narrative around short-term investment trends based on your personal tastes. Is the Afghanistan chaos good or bad for defense firms? Will inflation lift oil stocks or miners? What are the best infrastructure stocks for the trillion-dollar spending bill?

But here’s the thing: Tactical investments and market timing is incredibly difficult, regardless of how good a story you tell yourself. So why overthink things — particularly when the S&P 500 index SPX continues to set...","Looking at the latest headlines, it’s easy to concoct a narrative around short-term investment trends based on your personal tastes.
Will inflation lift oil stocks or miners?
What are the best infrastructure stocks for the trillion-dollar spending bill?
But here’s the thing: Tactical investments and market timing is incredibly difficult, regardless of how good a story you tell yourself.
So why overthink things — particularly when the S&P 500 index SPX continues to set...",https://www.marketwatch.com/story/forget-short-term-stock-market-fads-and-just-buy-these-5-rocketing-tech-stocks-11630433088,2021-08-05 12:02:30+05:30
