,Ticker,Title,Article,Summary,Link,Date
128,ARKK,"SEC Calls Bitcoin ""Highly Speculative"" With ""Potential For Fraud""","It seems likely that a bitcoin ETF is off the table for a while.

It was thought that with the installation of the Biden administration we'd be looking at a more regulatory-friendly environment for cryptocurrencies. Multiple appointees to his staff have openly expressed at least a willingness to allow for greater acceptance of cryptocurrencies.

It looks like we may not be any closer after all.

On Tuesday, the SEC's Division of Investment Management issued a statement regarding mutual funds taking positions in bitcoin futures. Keep in mind that this is the same bitcoin futures market that many thought was going to clear the path for an eventual bitcoin ETF approval since dozens of ETFs already invest in futures contracts.

In the statement, the SEC makes pretty clear that its concerns over a lack of oversight and the potential for investors to be damaged are still very much alive.

The Division of Investment Management (“IM”) staff strongly encourages any investor interested in investing in a mutual fund with exposure to the Bitcoin futures market, as discussed below, to carefully consider the risk disclosure of the fund, the investor’s own risk tolerance, and the possibility, as with all investing, of investor loss. Among other things, investors should understand that Bitcoin, including gaining exposure through the Bitcoin futures market, is a highly speculative investment. As such, investors should consider the volatility of Bitcoin and the Bitcoin futures market, as well as the lack of regulation and potential for fraud or manipulation in the underlying Bitcoin market. As with any fund investment, investors should focus on the level of risk they are taking on, and the level of risk they are comfortable taking on, prior to making an investment.

One could argue that the statement calling bitcoin a ""highly speculative investment"" is more legal jargon than taking a potshot at cryptocurrencies. The fact that the statement specifically calls out the ""lack of regulation"" and the ""potential for fraud of manipulation"" seems like more than just prospectus-speak. It sounds more like the SEC making its opinion of bitcoin quite clear.

But the letter goes on to detail some of the reasons behind the group's thinking, which is actually a pretty interesting read. For example:

The areas identified related to substantive requirements regarding valuation, liquidity, custody, arbitrage mechanisms for exchange traded funds (“ETFs”), as well as potential manipulation and other risks associated with cryptocurrency-related markets.

It turns out that fraud isn't their only concern. It's primarily liquidity. My take is that when/if a bitcoin ETF is launched, there's inevitably going to be a huge flow of assets into it. Despite the interest in bitcoin at a high level, bitcoin futures is actually not a heavily traded market.

The May bitcoin contract has only averaged about 6000 contracts traded daily. I think the SEC's main concern is that if a bitcoin futures ETF is approved, demand will surge and you could run into a situation where the fund literally overwhelms the market and you're facing potentially significant price disconnects. That would lead into the other fear of ""manipulation"", although not quite in the same nefarious sense that I think the SEC is referring to.

The Bitcoin futures market has developed since then, with increased trading volumes and open-interest positions. In addition, the Bitcoin futures market consistently has produced a reportable price for Bitcoin futures. The Bitcoin futures market also has not presented the custody challenges associated with some cryptocurrency-based investing because the futures are cash-settled.

This is an interesting nugget in that the SEC is admitting that the current bitcoin futures market functions fairly well. The SEC has a bit of a blueprint to work with in Canadian bitcoin ETFs, which also seem to be operating just fine. Overall, this should calm some fears about the markets running into significant operational issues.

Consider whether, in light of the experience of mutual funds investing in the Bitcoin futures market, the Bitcoin futures market could accommodate ETFs, which, unlike mutual funds, cannot prevent additional investor assets from coming into the ETF if the ETF becomes too large or dominant in the market, or if the liquidity in the market starts to wane.

It sounds like the SEC wants to use bitcoin futures investment in mutual funds as a test case for how they might operate within an ETF structure. As the passage notes, mutual funds can close if there's too much money coming in too fast or the managers feel they can't effectively put new capital to good use. ETFs don't have that same feature and there isn't a similar mechanism for turning off the spigot if money comes in too fast.

Among open-end funds, IM staff believes at this time that investment in the Bitcoin futures market should be pursued only by mutual funds with appropriate strategies that support this type of investment and full disclosure of material risks. The staff welcomes further input from ETFs and other market participants, particularly input that focuses on efforts to ensure compliance with the Investment Company Act and its rules and promote investor protection. Because closed-end funds do not provide for daily redemption of their shares, they do not present the same types of liquidity challenges as open-end funds. Therefore, staff encourages any closed-end fund that seeks to invest in the Bitcoin futures market to consult with the staff, prior to filing a registration statement, about the fund’s proposed investment, anticipated compliance with the Investment Company Act and its rules, and how the fund would provide for appropriate investor protection.

This seems to be the SEC's official position on bitcoin: it's OK for mutual funds, probably OK for closed-end funds, but it's a no-go for ETFs.

As many have noted on Twitter already, this is probably a chance for the SEC to give itself more time to make a decision. They've kicked the can down the road on a number of bitcoin ETF filings already including the VanEck filing just recently. This is probably an extension of that trend.

As has also been noted, the latest bitcoin ETF filings are proposing the use of physical bitcoin, not bitcoin futures. Does that change the SEC's thinking at all? Probably not in the short-term as many of their concerns would apply to both physical and futures. At a high level, the SEC is essentially saying their uncomfortable still with how a bitcoin ETF may play out in practice. The million dollar question is when will the SEC get comfortable? If not now, when? These core issues they cite aren't going away. Is there a chance we simply never see a bitcoin ETF?

Either way, it seems nearly certain that we won't be seeing a bitcoin ETF in 2021.

Also read:

68 Technology ETFs Ranked For 2021

Bitwise Launching Crypto Innovators ETF

ARKK Is Down 30% From Its Highs; Is It Time To Sell?

This Multi-Asset ETF With A 10% Yield Could Be Just What Your Portfolio Needs

Top Performing ETFs For April 2021

Bottom Performing ETFs For April 2021

6 ETFs For Giving Your Portfolio Cash A Yield Boost

3 Dividend ETFs To Buy And Hold","Among other things, investors should understand that Bitcoin, including gaining exposure through the Bitcoin futures market, is a highly speculative investment.
As such, investors should consider the volatility of Bitcoin and the Bitcoin futures market, as well as the lack of regulation and potential for fraud or manipulation in the underlying Bitcoin market.
In addition, the Bitcoin futures market consistently has produced a reportable price for Bitcoin futures.
The Bitcoin futures market also has not presented the custody challenges associated with some cryptocurrency-based investing because the futures are cash-settled.
As has also been noted, the latest bitcoin ETF filings are proposing the use of physical bitcoin, not bitcoin futures.",https://www.thestreet.com/etffocus/market-intelligence/sec-calls-bitcoin-highly-speculative-potential-for-fraud,2021-05-12 13:31:49+00:00
129,ARKK,Are bitcoin’s ESG credentials impacting its popularity?,"Are bitcoin’s ESG credentials impacting its popularity?

How bitcoin stacks up from an ESG perspective is becoming an increasing concern for investors after a coal mine shutdown in Xinjiang shone a light on the cryptocurrency’s operations.

News of the coalmine’s two-day shutdown sent the price of bitcoin tumbling 23% as the digital asset’s global computing power was cut by a third.

Analysis by CoinShares noted flows into digital assets in the week ending 23 April slowed to their lowest level since October 2020 as bitcoin mining issues in Xinjiang saw assets under management (AUM) drop $10bn, down to $54bn.

Europe’s most popular crypto ETP, the BTCetc Bitcoin Exchange Traded Crypto (BTCE), also took a hit last week. Having claimed 41% of all bitcoin ETP flows in Q1, BTCE saw $100m outflows in the week to 30 April, according to data from Ultumus. This exodus is equivalent to more than a fifth of new assets gathered during the first three months of the year.

Bitcoin – and the ETPs tracking its performance – booked record outflows as the asset’s average hash rate fell 20% during the week of the Xinjiang mine incident, with the region accounting for almost half of the bitcoin mining network.

Despite a subsequent recovery in the crypto’s price, the mining mishap has done little to silence critics raising questions about bitcoin’s environmental, social and governance (ESG) credentials. While accustomed to distrust regulators, its ability to address these concerns may be crucial for bitcoin’s ability to withstand public scrutiny going forwards.

How green can bitcoin be?

On the often prioritised ‘E’ criteria, scores of commentators, pressure groups, analysts and researchers have lined up to condemn bitcoin’s energy consumption.

According to the University of Cambridge Centre for Alternative Finance (CCAF), coal power accounts for two thirds of the energy used in the ‘proof of work’ process central to bitcoin’s secure production process.

This is a problem given this process is essentially a race between different miners, who have to verify 1MB worth of transactions – also known as a hashing puzzle – as fast as possible, with a participant’s portion of the total mining power on a network correlating to their probability of finding the solution before their competitors.

In turn, a vicious cycle has ensued between an increasing number of competitive miners and the use of more powerful and energy-intensive graphics processing units (GPUs) and application-specific integrated circuits (ASICs) by participants trying to outpace one-another.

At present, research from the Bank of America notes the carbon emissions associated with bitcoin are equal to that of Greece, while the Cambridge Bitcoin Electricity Consumption index said the bitcoin network consumes more energy in a year than countries such as the Netherlands, Argentina and the United Arab Emirates.

Refuting these analyses, Chris Bendiksen, head of research at CoinShares, said: “The environmental concerns around mining are overblown, and the analytical frameworks employed on the topic tend to range from nonsensical to outright disingenuous.

“To the extent that financial firms need to improve on the sustainability of cryptocurrency products, this can be achieved for example by purchasing carbon credits at the custodial level to offset the current carbon impact of mining per coin held in custody per unit time.

“So far, we have seen limited specific demand for such offsets and to my knowledge no large custodians currently offer them but it may well become a common product component.”

Bendiksen also agreed with other analysis that bitcoin miners are mobile and seek to access the cheapest and often most freely supplied energy sources – and this is not necessarily limited to coal. For instance, during the rainy seasons in countries such as China and the Democratic Republic of Congo, miners will often rely on hydroelectricity while these sources are producing cheap power.

According to Bendiksen, bitcoin miners are far from using renewables exclusively, but he states that on average the crypto’s clean energy reliance is between double and quadruple the global residential, commercial and industrial average.

Regarding scope for further decarbonisation of the world’s most popular digital currency, innovations such as the MCO2 blockchain-backed carbon credit will help, as will further regulatory pressure. Though this latter point will still create tension, given crypto backers’ defensiveness about the asset class’s decentralised (if waning) nature.

Social and governance concerns deserve credence

‘S’ and ‘G’ considerations also require attention with many attributing the April sell-off to news that the US Treasury was opening an investigation into fresh accounts of money laundering being facilitated by digital assets.

Alongside being used to launder dirty money, bitcoin trading also has a track record of security concerns, such as the half a billion-dollar Mt. Gox hack of 2014, and unwitting individuals being duped by online Ponzi schemes advertising ‘get rich quick’ bitcoin investing on platforms such as Twitter.

Outside of criminal activity, the complexity and high volatility of assets such as bitcoin has prompted regulators such as the UK’s Financial Conduct Authority and the Swedish Financial Supervisory Authority to deem crypto ETPs unfit for use by retail investors, with the former issuing a direct plea to consumers addressing this exact issue.

Unconvinced by these concerns, Bendiksen responded: “There are no other assets that come even remotely close to bitcoin’s ability to promote and protect human rights and aid in the global struggle for freedom.

“Its governance is also unique in its ability to resist corruption and promote transparency.”

Certainly, the blockchain technology underpinning bitcoin is now being applied in the back-office functions of trusted financial institutions and central banks are even toying with the idea of national crypto currencies.

As for ESG, a virtual ledger could assist with labour-intensive tasks, such as supply chain traceability, renewable energy distribution, anti-money laundering and proxy voting.

However, as for bitcoin itself, it still has a way to go before regulators cease to perceive it as a threat to unsophisticated, prospective investors. Likewise, the unregulated and decentralised qualities which make it popular, can also see victims of fraud or investment loss without recourse, should things awry.

Though ESG concerns may not be a deterrent to cryptos’ libertarian vanguard, the increasing importance of these issues in the professional investment community may mean bitcoin will have to answer its critics if it is to enjoy the tailwinds of further institutional adoption.

Bendiksen concluded: “So far we have not seen any evidence of ESG concerns actually impacting ETP flows but we have had the issue raised on numerous occasions by prospective investors.”

Further Reading","Are bitcoin’s ESG credentials impacting its popularity?
Europe’s most popular crypto ETP, the BTCetc Bitcoin Exchange Traded Crypto (BTCE), also took a hit last week.
Despite a subsequent recovery in the crypto’s price, the mining mishap has done little to silence critics raising questions about bitcoin’s environmental, social and governance (ESG) credentials.
On the often prioritised ‘E’ criteria, scores of commentators, pressure groups, analysts and researchers have lined up to condemn bitcoin’s energy consumption.
Bendiksen concluded: “So far we have not seen any evidence of ESG concerns actually impacting ETP flows but we have had the issue raised on numerous occasions by prospective investors.”Further Reading",https://www.etfstream.com/features/are-bitcoin-s-esg-credentials-impacting-its-popularity/,2021-04-05 23:51:22
130,ARKK,Gene and Cell Therapy Breakthroughs Focus of World Medical Innovation Forum May 19-21,"Advancing Revolutionary Treatments, Potential Cures

Boston, MA, May 13, 2021 (GLOBE NEWSWIRE) -- Gene and cell therapy (GCT), a transformative approach to develop treatments, and, potentially, cures for congenital and other diseases, is the focus of this year’s World Medical Innovation Forum May 19-21. Widely recognized as a transformational opportunity in medicine, GCT has the potential to stop or slow the effects of disease by targeting them at the genetic level. When the genetic driver for a disease is known, patients can be molecularly matched to therapies.



Featuring a unique combination of nearly 200 speakers and panelists from Mass General Brigham’s Harvard-affiliated faculty, industry, venture, manufacturing, and regulatory agencies, the World Medical Innovation Forum, in an all-virtual format, will explore interdependent aspects of advancing GCT for patients worldwide. Topics cover GCT strategy, clinical opportunities, patient access, economic and investment considerations, regulatory frameworks and manufacturing scalability. Nearly 1000 organizations will be represented, including attendees from 43 countries and 40 states of the U.S.



The Forum includes updates on:



GCT Potential for Patients

Gene Therapies for Specific Diseases – Large Incidence and Rare

Trends in Vector Development, including AAV, Lentivirus and Nano Methods

Clinical Opportunities, Technology and Market Potential

Regulatory Frameworks for GCT

Shaping GCT Innovation

Cancer, Gene Therapy and Oncolytic Viruses

CAR-T Therapy

GCT Manufacturing, Supply Chain and Scalability

Impact of mRNA Vaccines



“The Forum fosters critical discussions and debates on issues that will determine the pace of expansion of GCT therapies for patients in the coming years,” says Chris Coburn, Chief Innovation Officer, Mass General Brigham. “In the spirit of collaborative innovation, this gathering of leading investors, entrepreneurs, industry executives, Harvard clinicians and scientists is unique in convening top decision-makers in sharing ideas for advancing these game-changing technologies to the front lines of medicine.”



“We are honored to be the presenting sponsor of this year’s World Medical Innovation Forum,” said Dave Lennon, President, Novartis Gene Therapies. “Having brought one of the first gene therapies to market, we have seen the enormous potential these breakthrough medicines hold to transform lives. We look forward to joining other leaders at the forum to share learnings and our vision for the future – one in which gene therapies drive scientific innovation and deliver on their promise for patients and societies.”



Showcasing Mass General Brigham Breakthroughs



The Forum showcases GCT innovation breakthroughs from Mass General Brigham’s Harvard Medical School faculty investigators in 10-minute “First Look” presentations, and a research poster session being included in the Forum for the first time. More than 40 emerging GCT research projects will be part of the virtual showcase, with topics including gene therapy for large incidence and rare diseases including neurology, cardiology, blood disorders, and oncology, CAR-T breakthroughs, and oncolytic, AAV and non-viral delivery methods.



Recipients of Mass General Brigham’s Innovation Discovery Grants for GCT research will be announced. The Forum concludes with the announcement of the annual Disruptive Dozen, 12 GCT advances members of the Mass General Brigham faculty believe are the most likely to break through in the next few years.



This year’s Forum co-chairs are Nino Chiocca, MD, PhD, Chair, Neurosurgery, Brigham and Women’s Hospital and Cushing Professor of Neurosurgery, Harvard Medical School (HMS); Sue Slaugenhaupt, PhD, Scientific Director and Elizabeth G. Riley and Daniel E. Smith Jr., Endowed Chair, Mass General Research Institute, and Professor, Neurology, HMS; Ravi Thadhani, MD, CAO, Mass General Brigham and Professor, Medicine and Faculty Dean, HMS; and Luk Vandenberghe, PhD, Grousbeck Family Chair, Gene Therapy, Mass Eye and Ear, and Associate Professor, Ophthalmology, HMS.



About the World Medical Innovation Forum



The World Medical Innovation Forum was established seven years ago in response to the intensifying transformation of health care and its impact on innovation. The Forum is rooted in the belief that no matter the magnitude of change, the center of health care needs to be a shared, fundamental commitment to collaborative innovation – industry and academia working together to improve patient lives.



To find out more about the Forum, speakers and agenda, and to register, visit https://worldmedicalinnovation.org/



###



About Mass General Brigham



Mass General Brigham is an integrated academic healthcare system, uniting great minds in medicine to make life-changing impact for patients in our communities and people around the world. Mass General Brigham connects a full continuum of care across a system of academic medical centers, community and specialty hospitals, a health insurance plan, physician networks, community health centers, home care, and long-term care services. Mass General Brigham is a non-profit organization that is committed to patient care, research, teaching, and service to the community. In addition, Mass General Brigham is one of the nation’s leading biomedical research organizations and a principal teaching affiliate of Harvard Medical School. For more information, please visit massgeneralbrigham.org.



About Mass General Brigham Innovation



Innovation is the 150-person business development unit of Mass General Brigham responsible for the worldwide commercial application of the unique capabilities and discoveries of Mass General Brigham's 74,000 employees. Innovation supports the research requirements of its 6,200 Harvard Medical School faculty and research hospitals. It has responsibility for industry collaborations, venture investing, international consulting, licensing, innovation management, company creation, technology marketing, open innovation alliances, and workforce development.

Story continues

CONTACT: Bridget Perry Mass General Brigham 8572820608 bperry7@partners.org Rich Copp Mass General Brigham 6172781031 rcopp@partners.org



","Advancing Revolutionary Treatments, Potential CuresBoston, MA, May 13, 2021 (GLOBE NEWSWIRE) -- Gene and cell therapy (GCT), a transformative approach to develop treatments, and, potentially, cures for congenital and other diseases, is the focus of this year’s World Medical Innovation Forum May 19-21.
About the World Medical Innovation ForumThe World Medical Innovation Forum was established seven years ago in response to the intensifying transformation of health care and its impact on innovation.
Mass General Brigham is a non-profit organization that is committed to patient care, research, teaching, and service to the community.
About Mass General Brigham InnovationInnovation is the 150-person business development unit of Mass General Brigham responsible for the worldwide commercial application of the unique capabilities and discoveries of Mass General Brigham's 74,000 employees.
Story continuesCONTACT: Bridget Perry Mass General Brigham 8572820608 bperry7@partners.org Rich Copp Mass General Brigham 6172781031 rcopp@partners.org",https://finance.yahoo.com/news/gene-cell-therapy-breakthroughs-focus-163600325.html,2021-04-05 23:51:22
131,ARKK,Regeneron Pharmaceuticals Inc. stock underperforms Wednesday when compared to competitors,"Shares of Regeneron Pharmaceuticals Inc. REGN, -0.68% shed 0.57% to $482.42 Wednesday, on what proved to be an all-around favorable trading session for the stock market, with the S&P 500 Index SPX, -0.69% rising 0.07% to 4,167.59 and the Dow Jones Industrial Average DJIA, -0.72% rising 0.29% to 34,230.34. This was the stock's second consecutive day of losses. Regeneron Pharmaceuticals Inc. closed $182.22 below its 52-week high ($664.64), which the company achieved on July 20th.

The stock underperformed when compared to some of its competitors Wednesday, as Johnson & Johnson JNJ, -0.42% fell 0.42% to $167.07, Novartis AG ADR NVS, -0.59% rose 1.02% to $86.50, and Amgen Inc. AMGN, -1.08% rose 0.80% to $249.35. Trading volume (837,434) remained 27,875 below its 50-day average volume of 865,309.

Editor's Note: This story was auto-generated by Automated Insights, an automation technology provider, using data from Dow Jones and FactSet. See our market data terms of use.","Shares of Regeneron Pharmaceuticals Inc. REGN, -0.68% shed 0.57% to $482.42 Wednesday, on what proved to be an all-around favorable trading session for the stock market, with the S&P 500 Index SPX, -0.69% rising 0.07% to 4,167.59 and the Dow Jones Industrial Average DJIA, -0.72% rising 0.29% to 34,230.34.
Regeneron Pharmaceuticals Inc. closed $182.22 below its 52-week high ($664.64), which the company achieved on July 20th.
The stock underperformed when compared to some of its competitors Wednesday, as Johnson & Johnson JNJ, -0.42% fell 0.42% to $167.07, Novartis AG ADR NVS, -0.59% rose 1.02% to $86.50, and Amgen Inc. AMGN, -1.08% rose 0.80% to $249.35.
Trading volume (837,434) remained 27,875 below its 50-day average volume of 865,309.
Editor's Note: This story was auto-generated by Automated Insights, an automation technology provider, using data from Dow Jones and FactSet.",https://www.marketwatch.com/story/regeneron-pharmaceuticals-inc-stock-underperforms-wednesday-when-compared-to-competitors-01620249557-f686680cc113,2021-04-05 23:51:22
