,Ticker,Title,Article,Summary,Link,Date
88,russel 1000,How local TV stations plan to remain relevant as viewers shift to streaming,"In this article VIAC

CMCSA

NFLX

GTN

TGNA

SBGI

SSP

NXST

EW Scripps CEO Adam Symson Source: EW Scripps

The technology behind the distribution of television has evolved with time, from the antenna to cable to satellite, and most recently to streaming. Now, according to EW Scripps Chief Executive Officer Adam Symson, the time has arrived for the next frontier of TV viewing: The antenna. As consumers shift away from traditional pay TV and toward subscription streaming services, the digital antenna will emerge as a necessary component of people's viewing habits, Symson said in an interview. EW Scripps plans to begin an advocacy campaign this year to explain the value of the antenna, Symson said. While he declined to say if his plan would involve giving away antennas for free or at a discounted price to consumers, Symson said he has ""a large group of people"" at EW Scripps working on ideas to educate Americans on how an antenna can supplement subscription streaming video. Americans will need to find other, free ways to supplement streaming services as they max out on monthly subscription charges, Symson said. Broadcast stations, which offer local news, sports, soap operas, game show staples like ""Wheel of Fortune"" and ""Jeopardy,"" and prime time content from their national networks, will continue to air must-have content in American homes -- even after streaming services replace linear TV as the dominant form of viewing, he said. ""There is no digital platform that reaches the ubiquity and availability of broadcast television,"" Symson said. ""Everyone is paying attention to the subscription video services. They're all spending enormous amounts of money in very high-risk ventures, trying to create platforms. But for the average American consumer, if you sign up for all of them, I don't think it's economically sustainable.""

A young girl adjusts the antenna of a television in an attempt to obtain a digital signal. Luis Gutierrez | Norte Photo | Getty Images

Retransmission fees

The biggest existential concern for network affiliates is the hypothetical loss of billions of dollars in retransmission fees as Americans cut the cord and ditch pay TV. For the past decade, broadcast station groups have collected fees from pay-TV operators -- Comcast, DirecTV, Dish, Charter, etc. -- for the right to carry their stations. The trend began around 2006 when station groups realized consumers wanted access to their local TV channels just as much as -- if not more than -- they wanted the most popular cable networks (such as ESPN or CNN) which had long charged carriage fees. So station groups began turning down so-called ""must carry"" provisions, which required pay-TV operators to carry local stations and share ad revenue with them, and instead began taking direct payments from the pay-TV operators -- with the risk that, someday, the pay-TV operators could change their minds and drop these channels. That shift led to a booming industry. Total paid retransmission fees paid to station group owners grew from about $200 million in 2006 to more than $10 billion by 2018. They're still rising. Research firm S&P Global expects fees to top $15 billion by 2023. Nexstar, the largest U.S. owner of local TV stations, took in nearly $2 billion in retransmission fees last year -- about 44% of the company's total annual revenue. Buoyed by soaring retransmission revenue, Nexstar's total return between 2010 and 2020 was nearly 3,000 percent, making the company the fifth-best performing stock of the decade in the The Russell 1000 large-company index. Nexstar continues to report increases in retransmission fees. Guggenheim analyst Curry Baker estimates Nexstar will take in about $3 billion in retransmission revenue by 2024. That's assuming that estimated future upcharges in retransmission fees will more than offset the number of subscribers likely to cut the cord in the next three years. About two-thirds of all U.S. households still subscribe to a linear bundle of channels -- either through cable, satellite or a digital bundle of networks, such as Hulu with Live TV or YouTube TV. Fees may also be protected by a ""rebundling"" of digital streaming services and local broadcasting channels in a cable look-a-like package that doesn't yet exist, said John Chachas, a longtime media banker who advised EW Scripps on its $2.6 billion acquisition of Ion Media, which closed earlier this year. In an unusual move, Chachas also personally acquired 23 Ion Media stations to ensure regulatory approval of that deal. ""Inevitably there will be a new streaming distribution platform that will offer a skinnier bundle of subscription streaming services and digital broadcast networks,"" Chachas said. ""Those platform bundles will have to pay broadcast stations for their local content, as they're the only ones who will have it."" But a fundamental shift in how Americans view television could drastically alter those forecasts. The biggest entertainment companies have spent the past year reorganizing to shift resources to streaming and away from traditional linear networks. It's possible entertainment companies will offer enough content within the walls of their paid streaming services that broadcast stations will slowly lose favor over time. There are already signs of this happening. Comcast's NBCUniversal and ViacomCBS recently signed an 11-year-deal with the National Football League, whose games are perennially the most popular content on TV. On the surface, this was good news for the broadcast stations, who now have more leverage to keep increasing retransmission fees. But the deals also give NBCUniversal and ViacomCBS the right to stream local NFL games to paying subscribers of Peacock and Paramount+. That may accelerate cord cutting.

Comedian Seth Meyers during an interview with host Jimmy Fallon on November 18, 2019 NBC

Football isn't the only content that's moving beyond broadcast TV exclusivity. NBCUniversal has made ""The Tonight Show Starring Jimmy Fallon"" available first on Peacock, before it airs nightly at 11:35 pm ET on NBC affiliates. Time shifting programming to favor paid streaming services could upend the value of broadcast TV entertainment, which has historically aired prime time shows first.

The problem with the antenna

About 40% of Americans already own a digital antenna, according to Horowitz research. That's up from 29% before pandemic quarantines, at the end of 2019. There are no retransmission fees associated with an antenna. So while an antenna may help sustain local advertising revenue associated with broadcast TV, it isn't a good solution for the retransmission problem. It's also going to be difficult to convince younger consumers to buy an antenna, said Jack Perry, founder and CEO of Syncbak. About 15 years ago ago, Perry developed a website called AntennaWeb that told consumers which free broadcast stations are available with an antenna. He quickly discovered that while millions of people would use the site each week, it didn't lead to actual sales of antennas.

Loretta Hostettler | Getty Images

""When you say antenna, people think 'old fashioned,'"" Perry said. ""If you want to use an antenna, great, but there needs to be a streaming solution.""

NextGen TV

If younger consumers reject buying a digital antenna, NextGen TV is a potential answer. NextGen TV -- or, more wonkily, ATSC 3.0 -- is 4K over-the-air TV that can be repurposed for streaming. It's accessible with new smart TVs that come with a built-in tuner. Sony, Samsung and LG already make them. So far, it exists in only 26 cities. But 14 more are coming this summer and more than 50 by fall, including New York, San Francisco and Miami. ""By merging over-the-air antenna TV with the Internet, local stations will be able to personalize their news, sports, live events and shows with interactive features that give viewers the content that's most relevant to them,"" according to NextGen's website.

Streaming solutions","Americans will need to find other, free ways to supplement streaming services as they max out on monthly subscription charges, Symson said.
Nexstar, the largest U.S. owner of local TV stations, took in nearly $2 billion in retransmission fees last year -- about 44% of the company's total annual revenue.
""Inevitably there will be a new streaming distribution platform that will offer a skinnier bundle of subscription streaming services and digital broadcast networks,"" Chachas said.
It's possible entertainment companies will offer enough content within the walls of their paid streaming services that broadcast stations will slowly lose favor over time.
On the surface, this was good news for the broadcast stations, who now have more leverage to keep increasing retransmission fees.",https://www.cnbc.com/2021/04/24/local-tv-stations-plot-to-remain-relevant-in-shift-to-streaming.html,2021-04-24 00:00:00
89,russel 1000,Penske Automotive Completes Acquisition of Kansas City Freightliner,"Commercial truck dealership group expected to add $450 million in annualized revenue

BLOOMFIELD HILLS, Mich., April 13, 2021 /PRNewswire/ -- Penske Automotive Group, Inc. (NYSE: PAG), a diversified international transportation services company, and Premier Truck Group (""PTG""), its wholly-owned commercial vehicle subsidiary, have completed the acquisition of Kansas City Freightliner (""KCFL""), a retailer of medium and heavy-duty commercial trucks. The KCFL acquisition is expected to generate $450 million in annualized revenue, building further scale within Premier Truck Group.

The acquisition adds five full-service dealerships, four parts and service centers, and two collision centers located in Kansas and Missouri to the company's existing operation. Commenting on the acquisition, PTG President Richard Shearing said, ""We are thrilled to welcome Kansas City Freightliner to Premier Truck Group. With its contiguous operating area to existing Premier Truck Group markets, KCFL is a natural extension of our existing business as we can offer an expanded service area to both our customer base and KCFL's existing customers. PTG now operates thirty North American commercial truck dealerships located in Georgia, Idaho, Kansas, Missouri, Oklahoma, Tennessee, Texas, Utah, and Ontario, Canada which is expected to generate approximately 20,000 annualized new and used unit sales and annualized revenue of approximately $2.5 billion.

About Penske Automotive

Penske Automotive Group, Inc., (NYSE:PAG) headquartered in Bloomfield Hills, Michigan, is a diversified international transportation services company that operates automotive and commercial truck dealerships principally in the United States, the United Kingdom, Canada, and Western Europe and distributes commercial vehicles, diesel and gas engines, power systems, and related parts and services principally in Australia and New Zealand. PAG is a member of the Fortune 500 and Russell 1000 and 3000 indexes and is ranked among the World's Most Admired Companies by Fortune Magazine. For additional information, visit the company's website at www.penskeautomotive.com .

Story continues

About Premier Truck Group

Premier Truck Group, located in Dallas, Texas, provides customers with a premium selection of new Freightliner and Western Star commercial vehicles. Additionally, Premier Truck Group also offers a large selection of used truck and offers full-service parts and service operations conveniently open extended hours, with some open 24 hours every day.

Caution Concerning Forward Looking Statements

Statements in this press release may involve forward-looking statements, including forward-looking statements regarding Penske Automotive Group, Inc.'s expected unit sales and expected revenue. Actual results may vary materially because of risks and uncertainties that are difficult to predict. These risks and uncertainties include, among others: the satisfaction of customary closing conditions, the duration, severity and resolution of the COVID-19 pandemic, government mandated restrictions on our business in light of COVID-19 or otherwise, economic conditions generally, conditions in the credit markets, changes in interest rates and foreign currency exchange rates, changes in tariff rates, new rules in place after the recent Brexit accord between the European Union and the U.K. could slow parts originating in the U.K. or Europe for distribution to our dealerships, adverse conditions affecting a particular manufacturer, including the adverse impact to the vehicle and parts supply chain due to limited vehicle availability due to the COVID-19 pandemic, the shortage of automotive semiconductor chips or other vehicle components, natural disasters, recalls or other disruptions that interrupt the supply of vehicles or parts to us, changes in consumer credit availability, the outcome of legal and administrative matters, and other factors over which management has limited control. These forward-looking statements should be evaluated together with additional information about Penske Automotive Group's business, markets, conditions, and other uncertainties, which could affect Penske Automotive Group's future performance. These risks and uncertainties are addressed in Penske Automotive Group's Form 10-K for the year ended December 31, 2020, and its other filings with the Securities and Exchange Commission (""SEC""). This press release speaks only as of its date, and Penske Automotive Group disclaims any duty to update the information herein.

Inquiries should contact:





J.D. Carlson Anthony R. Pordon Executive Vice President and Executive Vice President Investor Relations Chief Financial Officer and Corporate Development Penske Automotive Group, Inc. Penske Automotive Group, Inc. 248-648-2810 248-648-2540 jcarlson@penskeautomotive.com tpordon@penskeautomotive.com

Penske Automotive Group logo. (PRNewsFoto/Penske Automotive Group)

Premier Truck Group Logo (PRNewsFoto/Penske Automotive Group, Inc.)

Cision

View original content to download multimedia:http://www.prnewswire.com/news-releases/penske-automotive-completes-acquisition-of-kansas-city-freightliner-301267396.html

SOURCE Penske Automotive Group, Inc.; Premier Truck Group","Commenting on the acquisition, PTG President Richard Shearing said, ""We are thrilled to welcome Kansas City Freightliner to Premier Truck Group.
These forward-looking statements should be evaluated together with additional information about Penske Automotive Group's business, markets, conditions, and other uncertainties, which could affect Penske Automotive Group's future performance.
This press release speaks only as of its date, and Penske Automotive Group disclaims any duty to update the information herein.
Carlson Anthony R. Pordon Executive Vice President and Executive Vice President Investor Relations Chief Financial Officer and Corporate Development Penske Automotive Group, Inc. Penske Automotive Group, Inc. 248-648-2810 248-648-2540 jcarlson@penskeautomotive.com tpordon@penskeautomotive.comPenske Automotive Group logo.
(PRNewsFoto/Penske Automotive Group)Premier Truck Group Logo (PRNewsFoto/Penske Automotive Group, Inc.)CisionView original content to download multimedia:http://www.prnewswire.com/news-releases/penske-automotive-completes-acquisition-of-kansas-city-freightliner-301267396.htmlSOURCE Penske Automotive Group, Inc.; Premier Truck Group",https://finance.yahoo.com/news/penske-automotive-completes-acquisition-kansas-105900626.html,2021-04-24 00:00:00
90,russel 1000,Imagining Russell Westbrook As a Buyout Candidate,"Westbrook is not the one to chase championships, but the possibility of getting bought out by the Wizards is compelling.

Watching Russell Westbrook play basketball this season is, in a word, confusing. Is he the NBA’s worst star or most captivating stat monger?

Since the All-Star break, Westbrook is averaging 24.5 points, 11.8 rebounds and 12 assists per game, a nightly harvest that would’ve placed his name on the tip of every NBA fan’s tongue five years ago. Today it barely induces a yawn.

Also since the All-Star break, he’s made 35.1% of his threes, launching five per game. His looks aren’t the same as what Bojan Bogdanović, Seth Curry or Tyler Herro see, but in this very small sample size, their numbers are comparable.

Last year with the Rockets he didn’t play in any back-to-backs. This season, Westbrook has opted in for most, including a 35-point, 13-assist, 15-rebound sledgehammer hurled at the Jazz, one night after he logged 39 minutes in a two-point loss against the Kings (a game that featured two missed dunks, one so violent the ball nearly flew back to half court).

That battle vs. Utah was an indefatigable, astonishing, out-of-body experience. Vintage Westbrook. He pulled up for transition threes and received every sliver of daylight as an invitation to humiliate Rudy Gobert. When the league’s top defense prerotated to show him multiple bodies, Westbrook fed Alex Len and Rui Hachimura until they looked like stars. During the fourth quarter, Wizards announcer Drew Gooden summed up Westbrook’s umpteenth dagger by assuring viewers that “there’s no defense for a jump shot.” Moments later he rocked the baby on Donovan Mitchell. For a night the Jazz were helpless.

Performances like that are magical. They’re also few and far between, on a team that probably won’t even make the play-in tournament. Even Westbrook’s most cinematic box scores are overshadowed by how they’re formed, with a hyperintense competitiveness that’s become his own worst enemy, marred by obscene shot selection and reckless resolve. Out of 165 players who’ve played at least 1,000 minutes this season, Westbrook is 155th in total RAPTOR, a rating system that uses tracking data to calculate players' value based on plus-minus and wins above replacement. He also ranks 37th among point guards in real plus-minus, with more turnovers than any other player.

When Westbrook shares the floor with Bradley Beal, the Wizards score 110.7 points per 100 possessions (or good for about the 19th-best offense in the league). When Beal is alone that number ticks up to 113.1 points per 100 possessions (right outside the top 10). When Westbrook plays without Beal the team’s offensive rating is ... 98.6. This is “makes the Cavs look like the Lakers” bad. And at -221 he ranks 504 out of 514 players in plus-minus.

SI Recommends

Westbrook’s game was once infused by an enviable degree of fearlessness. He’d set off for the basket with more confidence than a knife in combat with giant sticks of butter. But there are now stretches when he’s unable to harness the first gear that made him unguardable whenever he wants, while the second and third gears that could really help his aging body have yet to be acknowledged. Westbrook isolates more than everyone not named James Harden without being very good at it, forcing awkward floaters and runners that used to be dunks.

Only 29% of his shots come at the rim right now, down from a whopping 49% last season. Those looks have shifted to the midrange, where Westbrook is one of just 10 players who’ve attempted at least 250 pull-up two-point jumpers. He’s only made 40.4% of them, though, which is last in the group and doesn’t come close to justifying such a high volume.

Kim Klement/USA TODAY Sports

The 32-year-old is languishing in a high-usage role that draws attention to his deteriorating influence and mastodon of a contract. But next season perhaps a solution can be found. In the aftermath of Blake Griffin, LaMarcus Aldridge and Andre Drummond receiving buyouts to chase a championship, the thought of Westbrook sharing a similar fate is at once depressing, absurd and perfect.

The NBA landscape can and will change next season, but the possibilities and questions that would sprout from a divorce between Westbrook and the Wizards should still be fascinating. Would he give back millions of dollars to streamline his role, play fewer minutes and possibly come off the bench? (Westbrook is due $44 million next season and has a $47 million player option the following year, which is considerably more than Griffin had remaining on his own maximum contract.)

After hearing comments Westbrook made in response to Stephen A. Smith’s recent criticism about the nine-time All-Star’s inability to win big, he may not be interested in that type of sacrifice—which is understandable. “I don’t have to be an NBA champion. I know many people that got NBA championships that’s miserable, haven’t done nothing for their community, haven’t done nothing for the people of our world.”

For the sake of this hypothetical let’s say Westbrook wakes up one morning in 2022 and decides he really wants to make the Finals. Of equal importance then is another question: Will a contender even want him? The answer can be found picturing today’s version of Westbrook on, say, the Clippers, surrounded by three-point shooters, constantly attacking the paint, turbocharging one of the slower offenses in the league and adding a level of dynamism that Paul George and Kawhi Leonard don’t spark. In other words no team wants to pay Westbrook $90 million, but most should be thrilled with him in their bullpen for the veteran’s minimum.

Imagine him on the Celtics or Heat or Bucks, as a spared-down, tighter version of what he is right now. At virtually no cost all those squads (and several others) would love to throw the embers of Westbrook’s Hall of Fame prime onto their own bonfire, knowing the risk is low but the reward can be an unparalleled adrenaline boost. These theoretical someday relationships could, of course, end in disaster. They might even be sad. But there’s also a chance that Westbrook moonwalks his way back into relevance as a sharper, more efficient and pressureless version of himself.

His broken outside shot won’t be helpful in crunch time of a Game 6; there are obvious fit issues that restrict what he’ll ultimately be asked to do, should we ever arrive at such an exciting day. But undeniably positive qualities are still alive in Westbrook. He’s a voracious rebounder in traffic, and defenses continue to fear the typical result of his downhill drives.

With the days of Westbrook single-handedly lifting a team’s floor over and done, it’s worth thinking about a world where he agrees to a buyout and finds a way to raise a very good team’s ceiling. It’s a far more satisfying reality than the one currently lived, where one of the sport’s all-time individualists is wasting the autumn of his career chasing triple doubles that are all but forgotten two minutes after they’ve been achieved. Westbrook belongs in the playoffs, warts and all.","Westbrook is not the one to chase championships, but the possibility of getting bought out by the Wizards is compelling.
Watching Russell Westbrook play basketball this season is, in a word, confusing.
When the league’s top defense prerotated to show him multiple bodies, Westbrook fed Alex Len and Rui Hachimura until they looked like stars.
Those looks have shifted to the midrange, where Westbrook is one of just 10 players who’ve attempted at least 250 pull-up two-point jumpers.
In other words no team wants to pay Westbrook $90 million, but most should be thrilled with him in their bullpen for the veteran’s minimum.",https://www.si.com/nba/2021/04/09/russell-westbrook-wizards-buyout-future,2021-04-09 00:00:00
