,Ticker,Title,Article,Summary,Link,Date
135,russel 1000,"Sunrisers' solidity and depth vs Knight Riders' versatility and flair in slow, turning Chennai","Big picture

Eoin Morgan is in his first season as full-time captain of an IPL team. When he takes the field on Sunday in Chennai, he will not just square off against David Warner 's Sunrisers Hyderabad, but also against Trevor Bayliss, a close confidante who helped Morgan plot England's white-ball renaissance, which culminated in their 2019 World Cup win. Not to forget, Bayliss was the Knight Riders' coach between 2012 and 2015, when they won the IPL twice, before joining the Sunrisers.

The Kolkata Knight Riders haven't made the playoffs since 2018; their quest for the title stretches even further back to 2014. While many others would have chopped and changed, the core of the Knight Riders is still the same. Sunil Narine and Andre Russell are still as big, if not bigger, as the newer signings like Pat Cummins or Shakib Al Hasan, who has been brought back by the franchise after being part of two title wins in 2012 and 2014. Dinesh Karthik continues to be a key finisher, while they have Shubman Gill as potential retention material going forward.

Among the few teams to conduct yearlong camps, the Knight Riders have a well-oiled Indian group of players, both in batting and in bowling. Kamlesh Nagarkoti was injured for two successive seasons, but has been persisted with. Shivam Mavi has also been retained despite a history of injuries. Their latest project is Varun Chakravarthy, the mystery spinner who broke into the Indian team based on his IPL 2020 performances, but has been let down by fitness issues. Can he build on his previous season?

Over the last two seasons, the Knight Riders have somewhat been let down by their own strengths - the fluidity of the batting line-up has led to a hint of confusion. The three finishers in Morgan, Karthik and Russell have been shuffled around in the order. Maybe a bit more stability is the key for the team.

The Sunrisers are among the more industrious sides, one that bank on collective work. Warner has empowered individuals, given the youngsters a long rope, and has been patient in developing a solid group of players, who've all thrived under his leadership. T Natarajan and Sandeep Sharma are prime examples.

3:28 Are Sunrisers Hyderabad stronger than last season?

They will be boosted by Bhuvneshwar Kumar's return and Wriddhiman Saha's emergence as a T20 opener. They also have two hungry individuals in Manish Pandey and Vijay Shankar, keen to prove a point after overcoming injuries in order to regain their berth in the national squad.

Jonny Bairstow is in fine form, while they can also turn to the ever-reliable Kane Williamson if needed. Throw in the threat a Rashid Khan possesses and it makes for a heady cocktail that can trip up any opponent on a given day. The young group of Abdul Samad, Priyam Garg and Abhishek Sharma add to their batting riches.

There are no clear favourites for this one. Just the promise of two solid teams, with very different philosophies and approaches, going head to head with the aim of starting on the right foot.

In the news

The match will test Warner's fitness. Last month, Warner conceded that he had rushed back during the Test series against India following the groin injury he had suffered during the ODIs in December. Warner made himself available for the last two Tests in Sydney and Brisbane, when he was clearly still hampered by the injury. Another lengthy rehab was followed by an outing for New South Wales before he got on the plane to India for the IPL.

This also marks Shakib's return to the IPL, and to the Knight Riders. Last season, he was far away from the action as he was serving an ICC ban, and he starts out this time - if he gets in the XI - against the team he was with till before the suspension. His presence in the IPL this time hasn't been uneventful either, as he opted for the Knight Riders gig over matches for Bangladesh, and the process was not without confusion.

2:25 Will Andre Russell have a big season for KKR?

Likely XIs

1 Shubman Gill, 2 Rahul Tripathi/Venkatesh Iyer, 3 Nitish Rana, 4 Eoin Morgan (capt), 5 Dinesh Karthik (wk), 6 Andre Russell, 7 Sunil Narine/Shakib Al Hasan, 8 Pat Cummins, 9 Shivam Mavi/Harbhajan Singh, 10 Prasidh Krishna, 11 Varun Chakravarthy

Sunrisers Hyderabad:1 David Warner (capt), 2 Jonny Bairstow (wk), 3 Manish Pandey, 4 Kane Williamson, 5 Vijay Shankar/Abhishek Sharma, 6 Kedar Jadhav, 7 Abdul Samad, 8 Rashid Khan, 9 Bhuvneshwar Kumar, 10 Sandeep Sharma, 11 T Natarajan

Strategy punt

Harbhajan Singh has played much of his IPL cricket recently at Chepauk for the Chennai Super Kings. Friday's opener at the venue threw up a slow black-soil-based surface that gripped and spun. Singh had been used regularly with the new ball by MS Dhoni, particularly against the left-handers. With Warner likely to open, there's a case for Morgan to turn to Harbhajan with the new ball too. There's good reason, too. The senior offspinner has dismissed Warner four times in the IPL.

At IPL 2020, Warner struck at 133 in the powerplay, considerably slower than his overall record. While there may be a temptation to play Saha, who enhanced his reputation as an opener in IPL 2020, it could potentially be advantageous to open with the in-form Bairstow. The England wicketkeeper has struck for the Sunrisers at 142, and he's in red-hot form too, having just been named Player of the Series during the ODI series against India.

Stats that matter

The Sunrisers haven't won in three attempts in Chennai. The Knight Riders haven't fared any better, losing seven out of their nine games here. One of those wins, however, gave them their maiden IPL crown in 2012.","Not to forget, Bayliss was the Knight Riders' coach between 2012 and 2015, when they won the IPL twice, before joining the Sunrisers.
The Kolkata Knight Riders haven't made the playoffs since 2018; their quest for the title stretches even further back to 2014.
While many others would have chopped and changed, the core of the Knight Riders is still the same.
Among the few teams to conduct yearlong camps, the Knight Riders have a well-oiled Indian group of players, both in batting and in bowling.
The Knight Riders haven't fared any better, losing seven out of their nine games here.",https://www.espncricinfo.com/series/ipl-2021-1249214/sunrisers-hyderabad-vs-kolkata-knight-riders-3rd-match-1254060/match-preview,2021-04-23 00:00:00
136,russel 1000,"Fewer Black Employees in Top Finance Roles, Diversity Reporting Lacking","Fewer Black Employees in Top Finance Roles, Diversity Reporting Lacking

©Shutterstock.com

The Financial Times reported that a lower share of top U.S. financial services jobs were held by Black employees in 2018 than in 2008. The researchers, using data from the Equal Employment Opportunity Commission, looked at the demographics of 3.6 million staff across 13,000 financial services employers in the U.S. from 2007 to 2018. They found that in the most senior jobs within the sector, Black professionals were “the only demographic whose share fell.”

See: Bank of America Announces Racial Justice Initiatives

Find: Goldman Sachs Announces $10 Billion ‘One Million Black Women’ Initiative

The decrease, down to 2.62% representation from 2.87%, comes at a time when banks throughout the country claim to have implemented specialized diversity initiatives into their workforce.

Morgan Stanley has created an Institute for Inclusion within its company. CEO James Gorman said in a statement on the company’s website that the institute “will lead an integrated and transparent diversity, equity and inclusion strategy to deliver the full potential of Morgan Stanley to achieve meaningful change.”

J.P. Morgan has an initiative called “Advancing Black Pathways” that is aimed at attracting, hiring, retaining and advancing Black talent. The company also claims to be expanding its recruitment of Black Americans. Still, according to J.P. Morgan’s 2020 Workforce Composition Disclosure, the ethnic percentage of its board of directors dropped 8% from 2019, and 90% of the board identifies as white.

More From Your Money

See: Women Who Are Changing the Landscape of Finance

Find: Socially Responsible Investing in 2021 — How Can You Invest Responsibly?

According to a 2017 report from the Government Accountability Office, as reported by The Washington Post, jobs for African Americans in first-, mid- and senior-level management fell from 6.5% to 6.3% between 2007 and 2015, despite an increase in overall minority representation.

Data regarding corporate demographics is reported each year to the government. However, the information remains confidential, and banks are typically resistant to releasing it publicly. According to Reuters, only 32 of the Russell 1000 companies make the information public.

See: The Gender Gap in Economics is Shockingly Huge — It’s Even Worse Than Tech

Find: Black-Owned Businesses To Support Right Now

Many argue that underrepresentation in top management positions helps to widen the wealth gap. The Certified Financial Planners Board of Standards points out in its “Racial Diversity in Financial Planning” report that, “Firms that fail to hire and retain black and Latino professionals are missing opportunities to work with communities with growing wealth, as well as increase their competitive advantage,” stressing that financial equity is more difficult to achieve when people of color are not part of the decision-making processes at the top.

The Financial Times adds that the most significant increase for Black workers in finance roles only happened in junior-level jobs.

See: Industries With the Biggest (and Smallest) Racial Pay Gap

Find: 10 Questions You Should Ask Before Accepting a Job Offer

Investors have been calling for companies to start releasing the EEO diversity data in recent years. As Diverse and Engaged CEO Dee Marshall puts it, “We’re talking about why we’re not getting anywhere, but we don’t know where we’re going, because you are not tracking.”

Adrienne Moley, head of investment stewardship for the Americas at Vanguard, told the Financial Times, “We believe that asking you to report EEO data is a rational ask, it’s not a hug amount of additional resource required and it’s a great first step…Companies who withhold the information will probably feel more pressure from investors in the coming year.”

More from GOBankingRates

More From Your Money","Fewer Black Employees in Top Finance Roles, Diversity Reporting Lacking©Shutterstock.comThe Financial Times reported that a lower share of top U.S. financial services jobs were held by Black employees in 2018 than in 2008.
The company also claims to be expanding its recruitment of Black Americans.
More From Your MoneySee: Women Who Are Changing the Landscape of FinanceFind: Socially Responsible Investing in 2021 — How Can You Invest Responsibly?
However, the information remains confidential, and banks are typically resistant to releasing it publicly.
The Financial Times adds that the most significant increase for Black workers in finance roles only happened in junior-level jobs.",https://www.gobankingrates.com/money/business/share-of-black-employees-in-senior-us-finance-roles-falls-despite-diversity-efforts/,2021-04-02 08:53:38+00:00
137,russel 1000,IPL 2021: 'Andre Russell is very difficult to manage for Eoin Morgan' - Michael Vaughan,"Andre Russell's fitness struggles during the ongoing IPL 2021 has caught the attention of former England captain Michael Vaughan.

Vaughan believes managing the big-hitting allrounder is becoming a difficult task for KKR captain Eoin Morgan and coach Brendon McCullum.

Russell, who has a history of knee injuries and had to undergo surgery for the same in 2019, has been running gingerly on the field and took zero doubles in his 31-run knock during KKR's 38-run defeat to RCB in Chennai yesterday.

Russell has failed to fire for KKR again

Taking note of the situation during a discussion on Cricbuzz, Vaughan said that Morgan will have to be really careful while managing KKR's star allrounder.

""You got player like Andre Russell, who has been a superstar, but on the field, when the ball is coming to him, he is always using his feet. He is obviously someone who cannot go down. It's a very clever and careful aspect which Eoin Morgan will have to manage.

Vaughan further pointed out Andre Russell's refusal to even attempt to take doubles in the penultimate over bowled by Mohammed Siraj during the match against the RCB.

Fewest runs conceded by a bowler against Andre Russell in a death over in IPL (Min. 5 balls bowled)1*(6) Siraj (19th), Chennai 2021

6*(6) DChahar (19th), Chennai 2019

7*(5) Chahal (17th), Kolkata 2016

7*(5) Kuggeleijn (18th), Chennai 2019+ Only Siraj didn't concede a boundary — 󠄪 󠄪 (@ComeToGabbaMate) April 18, 2021

With 44 runs needed to off 2 overs, Russell failed to clear the fence on the first five deliveries bowled by Siraj. He did not attempt a single double-run even though the ball went to the fielders on the boundary line on four occasions.

""When he (Andre Russell) is at his best, he is great. But when you see him on the field, and when is bowling, he appears to be struggling. While batting he is not taking the twos.""

""He needed to take the twos in the 19th over. Because you want him back on strike. Very difficult to manage for Brendon McCullum and Eoin Morgan.

'Bad look for the team when you've got a player struggling with his body' - Michael Vaughan on Andre Russell and KKR's struggles.

Andre Russell has been playing for the Shahrukh Khan-owned franchise since the 2014 IPL and has produced some phenomenal performances with both bat and ball. It has propelled him to the superstar status in the cricketing world.

Highest T20 Batting Strike Rates in (17-20) overs (Min. 1000 runs)224.86 - AB de Villiers

203.09 - Virat Kohli

202.12 - Andre Russell — 󠄪 󠄪 (@ComeToGabbaMate) April 13, 2021

However, he has failed to live up to his own high standards after the knee surgery in 2019 and his low returns have adversely affected KKR's performances in IPL 2020 as well as the ongoing edition.

It would be one thing if Russell was still scoring those phenomenal sixes and helping KKR win matches from impossible situations. However, that is not the case and his lack of form with the bat means his poor mobility on the field comes under the scanner.

Michael Vaughan opined that Andre Russell's fielding issues are a huge contributing factor in making KKR look bad on the field.

Also Read

“I think in modern-day cricket, you need 9-10 players in a team who are absolutely agile on the field. But when you see KKR on the field, they don’t look electric. It’s a difficult one.

""How can you leave at Russell. But when you look at him on the field, and when he is bowling. it’s a bad look for the team when you got a player who is really struggling with his body"", finished Michael Vaughan.

Edited by Diptanil Roy","Andre Russell's fitness struggles during the ongoing IPL 2021 has caught the attention of former England captain Michael Vaughan.
Fewest runs conceded by a bowler against Andre Russell in a death over in IPL (Min.
""When he (Andre Russell) is at his best, he is great.
'Bad look for the team when you've got a player struggling with his body' - Michael Vaughan on Andre Russell and KKR's struggles.
Michael Vaughan opined that Andre Russell's fielding issues are a huge contributing factor in making KKR look bad on the field.",https://www.sportskeeda.com/cricket/news-ipl-2021-andre-russell-difficult-manage-eoin-morgan,2021-04-19 14:44:07+05:30
138,russel 1000,Davy Russell ‘pushing hard’ to return for Punchestown,"Sign up for alerts from The Irish Times Not Now I am interested

Just click on “Allow Notifications” on the message appearing on your browser to activate them.",Sign up for alerts from The Irish Times Not Now I am interestedJust click on “Allow Notifications” on the message appearing on your browser to activate them.,https://www.irishtimes.com/sport/racing/davy-russell-pushing-hard-to-return-for-punchestown-1.4541510,2021-04-19 14:44:07+05:30
