,Ticker,Title,Article,Summary,Link,Date
0,russel 1000,Off the ropes: Value’s dramatic comeback,"Off the ropes: Value’s dramatic comeback

Rarely do using sporting analogies carry much weight in the world of finance, however, on this occasion, the idea of the boxer on the ropes certainly springs to mind when it comes to the value factor and its woeful performance over the past decade. Value took punch after punch by academics and investment professionals alike with some even calling the death of the renowned factor.

Highlighting this, according to research conducted by Elroy Dimson, Paul Marsh and Mike Staunton, the value premium has delivered returns of -4% in the US between 2008 and 2020, the worst across all factors, with low volatility soaring 6.3% over the same period.

But what drove markets to this point? The low interest rate environment driven by the vast amounts of quantitative easing flowing through the global economy. And more recently, Rob Arnott, founder and chairman of Research Affiliates, said the underperformance, especially during the rapid spread of coronavirus in March 2020, was primarily sentiment driven.

“Value stocks are much less shiny and glamourous compared to market darlings like Tesla. In the current COVID-19-driven environment, the contrarian positioning of value stocks feels especially risky and scary,” Arnott continued. “Extreme underpricing of value stocks relative to their fundamentals, combined with much greater retail participation in momentum trading, has sharpened the contrast between value and growth stocks. This heightened divergence is likely a more reasonable explanation for the current deep discount rates than is the expectation of the lower profitability of value companies.”

To take the boxing analogy a step further, the Pfizer vaccine was certainly the jab value needed to get it back into the fight and has been the catalyst for what has been a remarkable comeback over the past five months. Literally overnight, value stocks started to outperform amid positive news the vaccine would enable countries to emerge from nationwide lockdowns. Following the vaccine news, the Russell 1000 Value index outperformed the Russell 1000 Growth index by 6% on 10 November, the highest daily excess return over the past decade, highlighting the dramatic rebound in the beleaguered stocks.

Since then, value has torn away with the Lyxor Russell 1000 Value UCITS ETF (RUSV) climbing 13.4% since the start of the year, as at 18 March, versus just 0.4% returns for the Lyxor Russell 1000 Growth UCITS ETF (RUSG). The flows have followed with investors piling some €4.3bn inflows in the four months to 25 February, according to data from Bloomberg Intelligence, a monster swing in sentiment following the €160m outflows seen between July and November 2020.

The reason behind the dramatic reversal in flows is relatively simple. The current prevailing sentiment is if the coronavirus vaccine is rolled out across the globe and inflation picks up then cyclical sectors such as financials and energy should outperform the market.

As Russ Mould, investment director at AJ Bell said: “If a COVID-19 vaccine is quickly and successfully distributed, then stocks which are seen as ‘immune’ from the pandemic may be less in demand and seen as less worthy of a premium valuation. Equally, if growth and inflation pick up, then investors may not be so inclined to pay such premium multiples for ‘growth’ companies, if rapid earnings increases can be acquired much more cheaply along with downtrodden value, cyclical plays like industrials, financials and consumer discretionary plays.”

But how long can value’s outperformance continue? The answer most likely is value still has a long way to run simply due to the decade-long underperformance it has suffered. As a recent JP Morgan research note stressed: “Value, on the other hand, is still attractive, and trades not far from multi-year lows. We focus our longs on banks and on the consumer reopening trade, and would potentially look for a general fading of risk-on internals stance sometime nearer Q4, once the acceleration in activity and in inflation is behind us, as well as when the bulk of the tailwind from fiscal stimulus is done.”

So how should ETF investors play this ongoing rally in value stocks? It is well documented how not all ETFs are created equally and two strategies with the same “value” label can have very different drivers of performance. Taking RUSV which tracks the Russell 1000 Value index. As highlighted above it has delivered returns of 13.4% this year while the iShares Edge USA Value Factor UCITS ETF (IUVL) has jumped 21.8% over the same period.

Have ETF investors missed the value trade?

While RUSV tracks a basket of 849 stocks, IUVL has a far more concentrated allocation of 148 currently meaning it will have a more intense exposure to the value factor, especially during periods when value is rallying. On the flipside, RUSV will deliver stronger returns in periods of underperformance for value due to its diversification benefits. For investors, understanding these nuances is crucial when assessing which strategy will best suit their portfolio.

As Athanasios Psarofagis, ETF analyst at Bloomberg Intelligence, said: “It is a two-step process. Investors need to get the factor right but also the individual right as well. Labels tell investors very little about the ETF. As you can see, there are stark differences in construction and methodologies.”

This article first appeared in the Q1 2021 edition of Beyond Beta, the world’s only factor investing publication. To receive a full copy, click here.","Off the ropes: Value’s dramatic comebackRarely do using sporting analogies carry much weight in the world of finance, however, on this occasion, the idea of the boxer on the ropes certainly springs to mind when it comes to the value factor and its woeful performance over the past decade.
“Value stocks are much less shiny and glamourous compared to market darlings like Tesla.
In the current COVID-19-driven environment, the contrarian positioning of value stocks feels especially risky and scary,” Arnott continued.
“Extreme underpricing of value stocks relative to their fundamentals, combined with much greater retail participation in momentum trading, has sharpened the contrast between value and growth stocks.
Literally overnight, value stocks started to outperform amid positive news the vaccine would enable countries to emerge from nationwide lockdowns.",https://www.etfstream.com/features/off-the-ropes-value-s-dramatic-comeback/,2021-06-04 18:15:56
1,russel 1000,"When It Comes to Indexes, the Devil is in the Details","The December 2020 addition of Tesla (TSLA) to the S&P 500 was a useful reminder of the significant differences between apparently similar indexes with respect to how they select stocks, weight them, and maintain their portfolios over time. A casual observer of markets could easily be forgiven for having assumed that Tesla was a component of all major U.S. stock indexes well before the end of last year given its mainstream ubiquity and mushrooming market capitalization. Plus, one of the major points of appeal of broad market indexes is, well, their breadth. They tend not to miss out on much. But not all big benchmarks are similarly broad, nor do they all take the same approach to which stocks they let in and those they leave out.

Here, I’ll illuminate some of the differences between the benchmarks underpinning Morningstar Medalist exchange-traded funds from the large-blend Morningstar Category and their implications for investors.","The December 2020 addition of Tesla (TSLA) to the S&P 500 was a useful reminder of the significant differences between apparently similar indexes with respect to how they select stocks, weight them, and maintain their portfolios over time.
A casual observer of markets could easily be forgiven for having assumed that Tesla was a component of all major U.S. stock indexes well before the end of last year given its mainstream ubiquity and mushrooming market capitalization.
Plus, one of the major points of appeal of broad market indexes is, well, their breadth.
But not all big benchmarks are similarly broad, nor do they all take the same approach to which stocks they let in and those they leave out.
Here, I’ll illuminate some of the differences between the benchmarks underpinning Morningstar Medalist exchange-traded funds from the large-blend Morningstar Category and their implications for investors.",https://www.morningstar.com/articles/1032482/when-it-comes-to-indexes-the-devil-is-in-the-details,2021-04-06 00:00:00
2,russel 1000,Growth Stocks Vs. Value Stocks: The Untold Reality,"Robert Zuccaro, CFA is Founder and CIO Of Target QR Strategies managing the Golden Eagle Growth Strategy.

getty

Russell Investments makes the case in its “2021 Equities Outlook: Value’s Time to Shine?” that value stocks will outperform growth stocks for years to come. Much of their case rests on “regression to the mean” theory, given significant underperformance by value stocks relative to growth stocks over the past 15 years. The suggestion that value stocks will outperform growth stocks based on regression theory is simplistic and ignores the underlying fundamentals that favor growth stocks.

The Russell 1000 Growth ETF enjoyed a banner year in 2020 with a return of 38.2% compared to 2.7% for the Russell 1000 Value ETF. Fortunes flip-flopped in February as the Value ETF beat the Growth ETF for its best relative showing in any month since 2001, according to Bank of America. In March, Bank of America jumped on the value bandwagon saying value stocks will continue to beat growth.

The Wiesenberger Mutual Fund report traced fund performance by style each year from 1959 through 2004. It found that a $100 investment in growth funds in 1958 would have grown to $9,380 by the end of 2004. The same $100 investment in value stocks would have grown to $7,046. Hence, the growth style established a premium of 33% relative to the value style over 46 years.

Now let's consider the performance of the Russell growth and value ETFs in the past 15 years. Cumulative returns for the five-year period ending 2020 were 170% for the growth ETF versus 75% for the value ETF. Thus, there was a growth premium of 133%. Over the 10-year period ending 2020, growth returned 349% versus value’s 164%, for a premium of 113%. And over 15 years, the returns were 426% and 130%, respectively, with a premium of 228%.

Growth premiums have widened significantly in each time period relative to the Wiesenberger growth premium of 33% earned over 46 years. It should also be mentioned that growth won out in 10 of 15 years. Why then have growth stocks significantly outperformed value stocks in the past 15 years?

There has been a seismic shift in the U.S. economy that has carried over to the stock market. During the period when Wiesenberger tracked fund performance, value companies displayed sensitivity to economic cycles, which continues to this day. When the economy turned down, so did their sales and profits. When the economy turned up, so did their sales and profits. Sometimes profits would rise to record levels on the upturn.

Until the turn of the century, the U.S. economy was heavily influenced by industrial companies before technology companies came of age. Apple went public in 1980 with an IPO of $101 million (not billion). Microsoft went public in 1986 and Amazon in 1997.

As late as 2010, there were only two technology companies among the five largest by market cap in the S&P 500. At the end of March, the five largest were all tech companies: Apple, Microsoft, Amazon, Facebook and Google. The stocks of these five companies fall into growth stock nomenclature and represent an unprecedented 22% of overall weighting of the S&P 500 as of year-end, according to my firm’s findings. Each of the big five reported record earnings in 2020 with an average gain of 36%, whereas S&P 500 earnings declined 32% compared to 2019.

I have argued and documented time and again that earnings growth is the key driver of stock prices. Many growth companies continue to report record earnings year in and year out. By comparison, earnings for many companies in the airline, banking, energy and auto companies peaked many years ago, according to my research. This can be seen in the list below that shows the peak profit year for eight companies and compares their earnings per share (EPS) that year to their EPS in 2019, the year in which overall profits rose to a record high. (Using the pandemic year of 2020 would make the comparison even worse as five of the eight companies lost money last year).

• American Airlines: 2015, -66%

• United Airlines: 2015, -41%

• Bank of America: 2006, -40%

• Citigroup: 2005, -83%

• Chevron: 2011, -89%

• Exxon: 2012, -65%

• Ford: 2011, -100%

• General Motors: 2016, -24% (This is for their new stock; after filing for bankruptcy, GM reorganized with an IPO in 2010.)

From 2015 to 2019, corporate profits rose 62% to an all-time high. However, earnings for the value companies in the above list have been in a downward trend for years. Even with improvement this year, earnings progress for each company will still fall far short of their prior peaks set many years ago. Unlike most market commentaries, which lean toward value stocks, I conclude that value stocks have gotten ahead of themselves and that their dominance may not last very long. Thus far this year, their stock prices have risen considerately more than their expected earnings improvements.

I have strong doubts that value stocks can maintain their newfound leadership in the stock market. Many growth companies, and technology companies in particular, are expected to produce record earnings in 2021 and 2022, whereas value company profits will remain depressed against prior peak levels. The chasm in profits between the two styles will continue to widen, which should work to the advantage of growth stocks. I believe the party is not over for growth stocks and that growth stocks will retake the lead in the market before the year is out.

Forbes Finance Council is an invitation-only organization for executives in successful accounting, financial planning and wealth management firms. Do I qualify?","gettyRussell Investments makes the case in its “2021 Equities Outlook: Value’s Time to Shine?” that value stocks will outperform growth stocks for years to come.
The suggestion that value stocks will outperform growth stocks based on regression theory is simplistic and ignores the underlying fundamentals that favor growth stocks.
Why then have growth stocks significantly outperformed value stocks in the past 15 years?
Unlike most market commentaries, which lean toward value stocks, I conclude that value stocks have gotten ahead of themselves and that their dominance may not last very long.
I believe the party is not over for growth stocks and that growth stocks will retake the lead in the market before the year is out.",https://www.forbes.com/sites/forbesfinancecouncil/2021/04/26/growth-stocks-vs-value-stocks-the-untold-reality/,2021-04-26 00:00:00
3,russel 1000,Bathurst 1000: Russell Ingall to race a wildcard entry at Mount Panorama in 2021,"A former Supercars champion is making a shock comeback as a wildcard entry to race in this year’s Bathurst 1000 alongside a highly-rated teenager.

Don't miss out on the headlines from V8. Followed categories will be added to My News.

The “Enforcer” is making a comeback at Mount Panorama.

Five years after his last competitive Supercars drive, former V8 champion Russell Ingall will make a return at this year’s Bathurst 1000.

The 57-year-old, who last raced in Supercars in 2016 as a co-driver alongside Rick Kelly, will come out of retirement to race in a Triple Eight Race Engineering wildcard alongside highly-rated teenager Broc Feeney.

Stream Every Practice, Qualifier & Race of the 2021 Repco Supercars Championship Live & On-Demand on Kayo. New to Kayo? Try 14-Days Free Now >

Ingall and Feeney, 18, will become the oldest-youngest driver combination in Bathurst 1000 history.

Earning the nickname the “Enforcer” during his racing career, Ingall is a two-time Bathurst 1000 champion, winning the Great Race alongside Larry Perkins in 1995 and 1997.

Russell Ingall will race in the Bathurst 1000 for the first time since 2016.

He won the 2005 Supercars championship, retiring from full-time driving at the end of 2014.

Ingall, who will suit up for his 25th appearance in the Great Race, and Feeney will campaign in a Supercheap Auto-backed Commodore.

He said he “didn’t need to be asked twice” for the chance to race again in the Bathurst 1000 and was determined the pair would not be making up the numbers.

“Let me make this clear. We are going to Bathurst to be competitive,” Ingall said.

“We have every intention of being right in the mix and giving the fans something to cheer about, otherwise we might as well stay at home.

“I’m looking forward to driving a Triple Eight-prepared car for the first time and sharing the car with Broc, who is a terrific young driver with an enormous future.”

Feeney races for Triple Eight in the Supercars feeder series Super2 and lined up as a co-driver for James Courtney in last year’s Bathurst 1000.

Russell Ingall will make a comeback as a wildcard entry alongside Broc Feeney in this year’s Bathurst 1000.

“Russell is a legend in the business,” Feeney said.

“(To) have Russell as my teammate in the biggest race of the year is all very surreal, but exciting and I am grateful for the opportunity.

“Having the chance to race with a Supercars and Bathurst champion is an exciting prospect and will certainly help boost my racing career.”

Triple Eight boss Roland Dane said the combination would “not only turn heads, but will be competitive”.

“Russell will get as much time in the car as we can get him during the year and you know there is no one who would take such an opportunity as seriously as him,” Dane said.","A former Supercars champion is making a shock comeback as a wildcard entry to race in this year’s Bathurst 1000 alongside a highly-rated teenager.
Five years after his last competitive Supercars drive, former V8 champion Russell Ingall will make a return at this year’s Bathurst 1000.
Earning the nickname the “Enforcer” during his racing career, Ingall is a two-time Bathurst 1000 champion, winning the Great Race alongside Larry Perkins in 1995 and 1997.
Russell Ingall will race in the Bathurst 1000 for the first time since 2016.
Russell Ingall will make a comeback as a wildcard entry alongside Broc Feeney in this year’s Bathurst 1000.",https://www.heraldsun.com.au/sport/motor-sport/v8-supercars/bathurst-1000-russell-ingall-to-race-a-wildcard-entry-at-mount-panorama-in-2021/news-story/b5f15d2a66d04090c7083f54a7a2cf8a,2021-04-21 04:32:00+00:00
