,Ticker,Title,Article,Summary,Link,Date
44,russel 1000,Gerald Everett excited by opportunity to play with Russell Wilson in Seattle,"With the Rams up against the salary cap this offseason, ﻿Gerald Everett﻿ wasn't staying in Los Angeles past 2020.

Why not follow his old team's assistant coach to a rival franchise featuring a superstar quarterback?

The former Rams tight end moved north in March, signing a one-year deal with the Seattle Seahawks in what amounts to an opportunity to prove his ability to the rest of the league. After playing alongside a cast of weapons in Los Angeles for most of his first four years, Everett joins a similarly talented offense in Seattle that might just have the perfect role ready for him.

It certainly has the best passer he's ever called a teammate.

""I haven't (been) able to play with a quarterback like (﻿Russell Wilson﻿) up to this point in my career,"" Everett said, via the team's official site. ""I've had a different quarterback each place I've been, so to be able to play with a guy of Russ' caliber is really exciting to me.""

Any sane pass-catcher would want to play with a quarterback like Wilson, an eight-time Pro Bowler and Super Bowl champion who elevates his offense's potential on a weekly basis. But another significant reason for Everett's move to the Pacific Northwest wears a headset and will be coordinating Seattle's offense.

Shane Waldron got the offensive coordinator job under Pete Carroll in the latest step of what has been a steady rise up the coaching ranks. He knows Everett well, having served as the tight end's position coach during Everett's rookie season with the Rams and expanding his responsibilities to include passing game coordinator and quarterbacks coach since 2017. There's no doubt that familiarity made Everett's decision easier.","With the Rams up against the salary cap this offseason, ﻿Gerald Everett﻿ wasn't staying in Los Angeles past 2020.
Why not follow his old team's assistant coach to a rival franchise featuring a superstar quarterback?
The former Rams tight end moved north in March, signing a one-year deal with the Seattle Seahawks in what amounts to an opportunity to prove his ability to the rest of the league.
""I haven't (been) able to play with a quarterback like (﻿Russell Wilson﻿) up to this point in my career,"" Everett said, via the team's official site.
Any sane pass-catcher would want to play with a quarterback like Wilson, an eight-time Pro Bowler and Super Bowl champion who elevates his offense's potential on a weekly basis.",https://www.nfl.com/news/gerald-everett-russell-wilson-seahawks-excited-by-opportunity,2021-04-23 22:38:30-04:00
45,russel 1000,"Notable ETF Inflow Detected - IWB, TSLA, HD, MA","Looking today at week-over-week shares outstanding changes among the universe of ETFs covered at ETF Channel, one standout is the iShares Russell 1000 ETF (Symbol: IWB) where we have detected an approximate $212.6 million dollar inflow -- that's a 0.8% increase week over week in outstanding units (from 120,200,000 to 121,150,000). Among the largest underlying components of IWB, in trading today Tesla Inc (Symbol: TSLA) is up about 2.3%, Home Depot Inc (Symbol: HD) is up about 0.1%, and Mastercard Inc (Symbol: MA) is up by about 1.7%. For a complete list of holdings, visit the IWB Holdings page » The chart below shows the one year price performance of IWB, versus its 200 day moving average:

Looking at the chart above, IWB's low point in its 52 week range is $134.37 per share, with $225.89 as the 52 week high point — that compares with a last trade of $225.73. Comparing the most recent share price to the 200 day moving average can also be a useful technical analysis technique -- learn more about the 200 day moving average ».

Exchange traded funds (ETFs) trade just like stocks, but instead of ''shares'' investors are actually buying and selling ''units''. These ''units'' can be traded back and forth just like stocks, but can also be created or destroyed to accommodate investor demand. Each week we monitor the week-over-week change in shares outstanding data, to keep a lookout for those ETFs experiencing notable inflows (many new units created) or outflows (many old units destroyed). Creation of new units will mean the underlying holdings of the ETF need to be purchased, while destruction of units involves selling underlying holdings, so large flows can also impact the individual components held within ETFs.

Click here to find out which 9 other ETFs had notable inflows »

The views and opinions expressed herein are the views and opinions of the author and do not necessarily reflect those of Nasdaq, Inc.","Looking today at week-over-week shares outstanding changes among the universe of ETFs covered at ETF Channel, one standout is the iShares Russell 1000 ETF (Symbol: IWB) where we have detected an approximate $212.6 million dollar inflow -- that's a 0.8% increase week over week in outstanding units (from 120,200,000 to 121,150,000).
Among the largest underlying components of IWB, in trading today Tesla Inc (Symbol: TSLA) is up about 2.3%, Home Depot Inc (Symbol: HD) is up about 0.1%, and Mastercard Inc (Symbol: MA) is up by about 1.7%.
Exchange traded funds (ETFs) trade just like stocks, but instead of ''shares'' investors are actually buying and selling ''units''.
Each week we monitor the week-over-week change in shares outstanding data, to keep a lookout for those ETFs experiencing notable inflows (many new units created) or outflows (many old units destroyed).
Creation of new units will mean the underlying holdings of the ETF need to be purchased, while destruction of units involves selling underlying holdings, so large flows can also impact the individual components held within ETFs.",https://www.nasdaq.com/articles/notable-etf-inflow-detected-iwb-tsla-hd-ma-2021-04-01,2021-04-01 00:00:00
46,russel 1000,These stocks are ‘cash cows’ that give you a better way to play the value sector,"Investors will always argue about growth versus value strategies. Growth strategies have trounced value for years. But with U.S. stocks near record levels, a different approach to value may serve cautious investors well.

Sean O’Hara, the president of Pacer ETFs, argues that traditional measures of value, especially book value, aren’t useful any longer because most of the value of U.S. companies is now made up of “intangible assets, including patents, networks, brand value and customer lists.”

O’Hara,...","Investors will always argue about growth versus value strategies.
Growth strategies have trounced value for years.
But with U.S. stocks near record levels, a different approach to value may serve cautious investors well.
Sean O’Hara, the president of Pacer ETFs, argues that traditional measures of value, especially book value, aren’t useful any longer because most of the value of U.S. companies is now made up of “intangible assets, including patents, networks, brand value and customer lists.”O’Hara,...",https://www.marketwatch.com/story/these-stocks-are-cash-cows-that-give-you-a-better-way-to-play-the-value-sector-11618583192,2021-04-01 00:00:00
47,russel 1000,David England: Large-Caps — Is bigger better?,"Recently, I began my series to identify market cap indexes ETFs, high-performance funds with low expense ratios. I started with the most overlooked group, small caps., then moved to the mid-caps and showed how both groups grossly outperformed the general market ($SPX) in the last year.

What is next? Today, I wrap up with my large-cap index ETFs and show their performance and expense ratios to compare with your holdings.

Here are some of my favorite large-cap ETFs by the size of assets.

SPY-SPDR S&P 500 ETF Trust tracks the investment results of the S&P 500 Index, which measures the performance of the large-capitalization sector of the U.S. equity market. SPY has AUM-Assets under management of 348 billion and an expense ratio of .09%.

IVV-iShares Core S&P 500 ETF alsotracks the investment results of the S&P 500 Index, which measures the performance of the large-capitalization sector of the U.S. equity market. IVV has assets of 261 billion and an expense ratio of only .03%, the lowest expense ratios in the group.

VTI-Vanguard Total Stock Market Index Fund ETF sharestrack the performance of the CRSP US Total Market Index, which represents approximately 100% of the investable U.S. stock market, focusing mainly on large-cap but can include mid-, small-, and micro-cap stocks regularly traded on the New York Stock Exchange and Nasdaq. VTI has assets of 224 billion and an expense ratio of .03%, the lowest expense ratios in the group.

VUG-Vanguard Growth Index Fund ETF tracksthe CRSP US Large-Cap Growth Index, predominantly made up of growth stocks of large U.S. companies. VUG has assets of 144 billion and an expense ratio of .04%.

IWF-iShares Russell 1000 Growth ETF tracks the Russell 1000 Growth Index, which measures the performance of mainly large-cap growth sectors of the U.S. equity market. IWF is the smallest fund in this group, with assets of 61 billion and an expense ratio of .19%, the highest expense ratio in this group.

I charted the performance of each fund from the recent market bottom, March 2020, running to real-time. The results and returns by rank are as follows: VUG-Vanguard Growth Index Fund ETF (blue line) up 96.27%, IWF-iShares Russell 1000 Growth ETF (red line), up 93.40%, VTI-Vanguard Total Stock Market Index Fund ETF (green line) up 93.34%, IVV-iShares Core S&P 500 ETF (purple line), up 85.79%. The laggard in the group, SPY-SPDR S&P 500 ETF Trust (brown line), is up 85.25%, and the market, $SPX (black line), is only up 82.30%.

Here are the action points:

Bigger is not always better. The largest funds did not consistently outperform the smaller funds.

These results represent a specific period. Different dates will result in different outcomes.

Past performance does not dictate future returns.

All these major large-cap ETFs outperformed the returns of the S&P 500 symbol $SPX.

The leader of this group, VUG, outperformed $SPX by 13.97%.

The laggard of this group, SPY, outperformed $SPX by 2.95%.

Next, let’s take the top two ETFs from the small and mid-cap groups and compare them with these top large-cap ETFs. To review the previous small and mid-cap columns, go to thesouthern.com and search for my columns.

I charted the performance of each fund from the recent market bottom, March 2020, running to real-time. The results and returns by rank are as follows: SCHA-Schwab US Small-Cap ETF (blue line) up 129.96%, IWM-iShares Russell 2000 Growth ETF (red line), up 126.50%, IJH-iShares Core Mid-Cap ETF (green line) up 121.75%, MDY-Vanguard Growth ETF (purple line), up 96.16%. The laggards in the group, VUG- Vanguard Growth Index Fund ETF (orange line), up 93.33%, and finally, SPY-SPDR S&P 500 ETF Trust (brown line) is up 85.25%, and the market, $SPX (black line), is only up 82.29%.

Here are the action points:

Bigger is not always better. The small and mid-cap funds consistently outperformed the large-cap funds.

These results represent a specific period. Different dates will result in different outcomes.

Past performance does not dictate future returns.

All these major market cap ETFs outperformed the returns of the S&P 500 symbol $SPX.

Small and mid-cap funds should not be overlooked.

Notice how the fund's performance took off after October 2020-see red oval.

Do you know the expense ratios for your funds? If not, why? Many are shocked when they discover their financial planner has them in market-cap funds with expense ratios north of .50% or higher. If this is the case, make sure the funds outperform the lower expense ratio funds by at least that amount.

Finally, if you own market cap mutual funds, research the name of the index your market cap funds track. If they track the indexes named in this column and have four, five, or six times the fees and expense ratio's ask why?

I have seen many high commission mutual funds that fall into the higher multiple expense ratio camp and, other than a unique fund name, perform a lot less than these funds with exceptionally low expenses.

Even with a time frame of one year, you can see how low expense ratios make a difference in performance. Over 10, 20, or 30 years, it can make a huge difference.

Take the time to learn which brokerages work to lower fees and provide low-expense funds plus no or low-cost client services for the new normal.

Plan your work, work your plan, and share your harvest!

David O. England is an investor/trader, financial analyst/educator/lecturer and Associate Professor Emeritus of Finance. This column is for educational purposes only and not intended as financial advice. Past performance does not dictate future returns. Questions? Send to thetraderseye@gmail.com.

Love 0 Funny 0 Wow 0 Sad 0 Angry 0","VUG-Vanguard Growth Index Fund ETF tracksthe CRSP US Large-Cap Growth Index, predominantly made up of growth stocks of large U.S. companies.
IWF-iShares Russell 1000 Growth ETF tracks the Russell 1000 Growth Index, which measures the performance of mainly large-cap growth sectors of the U.S. equity market.
The results and returns by rank are as follows: SCHA-Schwab US Small-Cap ETF (blue line) up 129.96%, IWM-iShares Russell 2000 Growth ETF (red line), up 126.50%, IJH-iShares Core Mid-Cap ETF (green line) up 121.75%, MDY-Vanguard Growth ETF (purple line), up 96.16%.
Notice how the fund's performance took off after October 2020-see red oval.
Finally, if you own market cap mutual funds, research the name of the index your market cap funds track.",https://thesouthern.com/business/local/david-england-large-caps-is-bigger-better/article_1c34bb13-3df0-5880-905f-b5cb5017909c.html,2021-04-01 00:00:00
48,russel 1000,What now? No La Russell residents cast ballots in Tuesday’s election,"WAXAHACHIE, TX - Dr. Jim Ernest Laughlin, 81, formerly of Stella, MO, passed away Wednesday, September 22, 2021. Services will be at a later date. Arrangements are under the direction of Waxahachie Funeral Home, Waxhachie, TX.","WAXAHACHIE, TX - Dr. Jim Ernest Laughlin, 81, formerly of Stella, MO, passed away Wednesday, September 22, 2021.
Services will be at a later date.
Arrangements are under the direction of Waxahachie Funeral Home, Waxhachie, TX.",https://www.joplinglobe.com/news/what-now-no-la-russell-residents-cast-ballots-in-tuesday-s-election/article_e421c500-980e-11eb-9bfc-478b286e3723.html,2021-04-01 00:00:00
49,russel 1000,Fortuna Advisors' 2021 Value Leadership Report Highlights How Companies Can Achieve Sustained Top-Quartile Value Creation,"Study finds that revenue growth and ""reinvestment effectiveness"" were the most significant determinants of market value creation over the last five years.

NEW YORK, April 29, 2021 /PRNewswire/ -- Capital markets research by the management consulting firm, Fortuna Advisors, highlights how companies drive superior value creation. Key findings include:

(PRNewsfoto/Fortuna Advisors LLC)

GROWTH IS THE MOST IMPORTANT DRIVER - Revenue Growth and Reinvestment Effectiveness were the strongest drivers of top-quartile TSR, despite the common emphasis on profit margins and rates of return.

SIZE OF THE PRIZE - Value leaders delivered 35% higher median annual TSR than the bottom-quartile group, and the market capitalization of the value leaders increased by over $10 trillion versus a decline of over $1 trillion for the bottom quartile.

PAST PERFORMANCE IS NO GUARANTEE - Value leaders in the prior five years were as likely to drop to the bottom quartile in the recent period, as they were to remain top-quartile.

INTANGIBLES INCREASINGLY DRIVE VALUE - Increasingly, value-driving investments appear on the P&L, not the Balance Sheet. Think R&D, brand building, and training expenses, for example.

Features a case study on why Tesla stock has performed so well.

The study evaluated the total shareholder return (TSR) performance, including dividends and share price appreciation, of the non-financial members of the Russell 1000 over the last five years.

The report also unpacks how recent trends in stakeholder value and corporate purpose have changed the nature of value creation. Prior to the digital era, value was largely created from tangible assets—factories, assembly equipment, vehicles, etc.—requiring large investments. Increasingly, investment has shifted to creating intangible assets like patents, customer relationships, brands and organizational capabilities.

The study goes on to summarize key differences in how varying industries achieved value creation, and provides a ""deep dive"" into the top-performing semiconductor industry. The authors also discuss the performance of, and investor expectations around, Tesla Motors; and tell the turnaround story of FMC corporation.

Story continues

Fortuna Advisors (fortuna-advisors.com) collaborates with leaders to transform decision-making throughout their business to achieve exceptional results. Our management playbook delivers measurable outcomes through better insights, better decisions, and better behaviors. Fortuna serve as a catalyst to create a culture of ownership, where everyone from the board to management and employees embraces a long-term investor perspective to unlock the organization's full value creation potential.

Link to Report





Cision

View original content to download multimedia:http://www.prnewswire.com/news-releases/fortuna-advisors-2021-value-leadership-report-highlights-how-companies-can-achieve-sustained-top-quartile-value-creation-301280225.html

SOURCE Fortuna Advisors LLC","Study finds that revenue growth and ""reinvestment effectiveness"" were the most significant determinants of market value creation over the last five years.
NEW YORK, April 29, 2021 /PRNewswire/ -- Capital markets research by the management consulting firm, Fortuna Advisors, highlights how companies drive superior value creation.
INTANGIBLES INCREASINGLY DRIVE VALUE - Increasingly, value-driving investments appear on the P&L, not the Balance Sheet.
The report also unpacks how recent trends in stakeholder value and corporate purpose have changed the nature of value creation.
Link to ReportCisionView original content to download multimedia:http://www.prnewswire.com/news-releases/fortuna-advisors-2021-value-leadership-report-highlights-how-companies-can-achieve-sustained-top-quartile-value-creation-301280225.htmlSOURCE Fortuna Advisors LLC",https://finance.yahoo.com/news/fortuna-advisors-2021-value-leadership-121700501.html,2021-04-01 00:00:00
50,russel 1000,"March ETF Asset Report: What's Hot, What's Not","Wall Street was moderately upbeat in March with the S&P 500 and the Dow Jones adding about 2.28% and 5.34%, respectively. On the other hand, the Nasdaq Composite has lost 2.4% and the Russell 2000 has retreated about 1.6%.

Value stocks gained an upper hand in the month over growth stocks due to rising rate worries. While Wall Street rejoiced the Biden administration’s $1.9-trillion stimulus, tax hike fears are also looming (read: Top-Performing ETFs of March).

In this scenario, we highlight ETF asset flows for the month of March (per etf.com).

S&P 500 in High Favor

The S&P 500 attracted massive funds last month as optimism for sooner-than-expected normalcy ruled the market. Vanguard S&P 500 ETF VOO, iShares Core S&P 500 ETF (IVV) and Invesco S&P 500 Equal Weight ETF RSP amassed about $4.14 billion, $2.75 billion and $2.34 billion in assets, respectively, past month.

Emerging Markets in Sweet Spots

iShares Core MSCI Emerging Markets ETF IEMG and Vanguard FTSE Emerging Markets ETF (VWO) amassed about $3.48 billion and $2.80 billion in assets, respectively. Some emerging economies enacted rate hikes in March, which probably boosted investors’ optimism in those markets. Vaccine distribution was another positive (read: Most Loved/Hated ETFs of Q1).

Total Stock & Total Bond ETF Gain Too

There were moderate risk-on sentiments globally in the month of March. Vanguard Total Stock Market ETF (VTI) attracted about $4.34 billion in assets. Though we saw a bond market selloff in the month, iShares Core Total USD Bond Market ETF (IUSB) hauled in about $1.95 billion in assets. The decent yield in the fund, about 2.53% annually, have probably led to this interest. Moreover, the bond fund holds different duration funds, which offers great diversification against the rising rate trend.

Value Stocks Continue to Hog Attention

Vanguard Value ETF VTV and iShares Russell 1000 Value ETF (IWD) attracted about $2.27 billion and $2.17 billion in assets, respectively. A rising rate environment in the month favored value investing.

Story continues

Gold Loses Glitter

SPDR Gold Trust (GLD lost about $3.08 billion in assets as rising risk-on sentiments went against this safe-haven fund. Rising rate worries are likely offer strength to the greenback, which is a negative for the commodity fund. iShares Gold Trust (IAU) saw asset depletion of about $858.4 million.

Corporate Bonds Out of Favor

iShares iBoxx USD Investment Grade Corporate Bond ETF LQD and iShares iBoxx USD High Yield Corporate Bond ETF (HYG) also saw outflows of about $2.73 billion and $927.3 million in assets, respectively.

Want key ETF info delivered straight to your inbox?

Zacks’ free Fund Newsletter will brief you on top news and analysis, as well as top-performing ETFs, each week. Get it free >>



Want the latest recommendations from Zacks Investment Research? Today, you can download 7 Best Stocks for the Next 30 Days. Click to get this free report



SPDR Gold Shares (GLD): ETF Research Reports



iShares iBoxx Investment Grade Corporate Bond ETF (LQD): ETF Research Reports



Vanguard Total Stock Market ETF (VTI): ETF Research Reports



Invesco S&P 500 Equal Weight ETF (RSP): ETF Research Reports



To read this article on Zacks.com click here.



Zacks Investment Research



Want the latest recommendations from Zacks Investment Research? Today, you can download 7 Best Stocks for the Next 30 Days. Click to get this free report","Wall Street was moderately upbeat in March with the S&P 500 and the Dow Jones adding about 2.28% and 5.34%, respectively.
S&P 500 in High FavorThe S&P 500 attracted massive funds last month as optimism for sooner-than-expected normalcy ruled the market.
Vanguard S&P 500 ETF VOO, iShares Core S&P 500 ETF (IVV) and Invesco S&P 500 Equal Weight ETF RSP amassed about $4.14 billion, $2.75 billion and $2.34 billion in assets, respectively, past month.
Total Stock & Total Bond ETF Gain TooThere were moderate risk-on sentiments globally in the month of March.
Click to get this free reportSPDR Gold Shares (GLD): ETF Research ReportsiShares iBoxx Investment Grade Corporate Bond ETF (LQD): ETF Research ReportsVanguard Total Stock Market ETF (VTI): ETF Research ReportsInvesco S&P 500 Equal Weight ETF (RSP): ETF Research ReportsTo read this article on Zacks.com click here.",https://finance.yahoo.com/news/march-etf-asset-report-whats-170005941.html,2021-04-01 00:00:00
51,russel 1000,It’s a Great Time to Own Financial Stocks. Here’s Why.,"The world has changed a lot over the past year, but for Chris Davis, the Covid-19 pandemic has only amplified his penchant for the financial-services sector, and New York.

“I love this city so much,” says Davis, who spent the first part of the pandemic with his family in upstate New York, but in September returned to New York City and resumed his daily commute to the midtown Manhattan offices of Davis Advisors, a firm that his father, now retired, founded in 1969. The younger Davis, 55, says he’s most productive in the office,...","The world has changed a lot over the past year, but for Chris Davis, the Covid-19 pandemic has only amplified his penchant for the financial-services sector, and New York.
“I love this city so much,” says Davis, who spent the first part of the pandemic with his family in upstate New York, but in September returned to New York City and resumed his daily commute to the midtown Manhattan offices of Davis Advisors, a firm that his father, now retired, founded in 1969.
The younger Davis, 55, says he’s most productive in the office,...",https://www.barrons.com/articles/its-a-great-time-to-own-financial-stocks-heres-why-51617276600,2021-04-01 00:00:00
