title,flair,score,upvote_ratio,id,subreddit,url,num_comments,body,created
Google or AMZN?,,1,1.0,pxaxnc,stocks,https://www.reddit.com/r/stocks/comments/pxaxnc/google_or_amzn/,2,[removed],2021-09-28 17:08:02
Will Amazon and Google ever split their stock? Why and why not?,,1,1.0,pv2t8r,stocks,https://www.reddit.com/r/stocks/comments/pv2t8r/will_amazon_and_google_ever_split_their_stock_why/,281,"I am building positioning in both of these companies as I want one full share of each to just let them ride for the next 5-10 years.

With AMZN currently sitting at $3,425 a share and GOOGL sitting at $2844 a share do you think a split is approaching?

What are the benefits of keeping a stock price this high? What are the benefits of splitting the stock?

I have not been trading that long and the only major stock splits I’ve seen in my time are APPL and NVDA.",2021-09-25 08:34:50
What just happened w MSFT stock?,,1,1.0,ptddqa,stocks,https://www.reddit.com/r/stocks/comments/ptddqa/what_just_happened_w_msft_stock/,2,[removed],2021-09-22 18:10:06
"How come Microsoft has a AAA credit rating while other giants like Apple, Amazon, and Google doesn't?",,1,1.0,psxor1,stocks,https://www.reddit.com/r/stocks/comments/psxor1/how_come_microsoft_has_a_aaa_credit_rating_while/,2,[removed],2021-09-22 02:11:10
Why won’t AMZN friggin split already ????,,1,1.0,psq6sw,stocks,https://www.reddit.com/r/stocks/comments/psq6sw/why_wont_amzn_friggin_split_already/,2,[removed],2021-09-21 19:35:22
I'm holding $200k in 2024 AAPL LEAPS - Should I unload them now or hold?,,1,1.0,ps5sz3,stocks,https://www.reddit.com/r/stocks/comments/ps5sz3/im_holding_200k_in_2024_aapl_leaps_should_i/,210,"The largest position in my portfolio is $200c for AAPL that expire Jan 2024. Before today I felt confident in AAPL's ability to easily surpass $200 by 2024 and had planned to hold for a couple years.  Now I'm not so sure.

So I'm just looking for some extra input. Is this just a short setback for the market giant, or will greater market forces end up causing a major Apple pullback. 

I get that nobody actually knows what will happen, so just give me your most educated guess.",2021-09-20 22:51:20
MSFT or NVDA?,,1,1.0,pq0i8q,stocks,https://www.reddit.com/r/stocks/comments/pq0i8q/msft_or_nvda/,2,[removed],2021-09-17 13:48:56
Tool to analyse stocks in Excel: alternative to GoogleFinance,,1,1.0,ppvwk8,stocks,https://www.reddit.com/r/stocks/comments/ppvwk8/tool_to_analyse_stocks_in_excel_alternative_to/,2,"I've been trying to use GoogleFinance to analyse mainly historical price of stocks.

The thing is: it doesn't work reliably. Most of the time you get a ""Google Finance Internal error"",even after the function menage to pool the data. Repeat that for hundreds of instances, and you got a nightmare.   
I've also tried the ""stock"" tool built into Excel, but it does not look like it provide historical data, so i'm at a loss. 

What other similar tool exist to analyse historical stock data in Excel/G Sheet?",2021-09-17 07:58:49
What's the best way to go short on TSLA and CVNA with a long time horizon?,,1,1.0,ppj408,stocks,https://www.reddit.com/r/stocks/comments/ppj408/whats_the_best_way_to_go_short_on_tsla_and_cvna/,0,[removed],2021-09-16 18:32:02
IRBT strong correlation of shorts with AMZN??,,1,1.0,porrbt,stocks,https://www.reddit.com/r/stocks/comments/porrbt/irbt_strong_correlation_of_shorts_with_amzn/,0,[removed],2021-09-15 14:56:58
How much longer is AAPL going to go down?,,1,1.0,poqk2c,stocks,https://www.reddit.com/r/stocks/comments/poqk2c/how_much_longer_is_aapl_going_to_go_down/,42,"I’m 70% down on my calls right now. They expire Oct, but damn, I just want to cry right now. So much money being lost. This thing is going down everyday. I just don’t know how much longer this will continue and if I should sell.",2021-09-15 13:53:10
$TSLA and $NVDA will be the lead indicators on how the market will be next few trading sessions,,1,1.0,pojy7z,stocks,https://www.reddit.com/r/stocks/comments/pojy7z/tsla_and_nvda_will_be_the_lead_indicators_on_how/,0,[removed],2021-09-15 05:34:54
Microsoft (MSFT) hikes dividend and unveils $60B stock buyback program,,1,1.0,pof499,stocks,https://www.reddit.com/r/stocks/comments/pof499/microsoft_msft_hikes_dividend_and_unveils_60b/,5,"Expanding its program for returning capital to shareholders, Microsoft late Tuesday said its board voted to both boost its quarterly dividend and adopt a new share repurchase program.

Microsoft (ticker: MSFT) raised its quarterly dividend rate by 11%, to 62 cents from 56 cents. It was the 12th straight year that the company has boosted its quarterly payout following its September board meeting. The new rate gives the company a yield of 0.8%. The hike follows increases of 10% last year and 11% in 2019.

The company also announced a new $60 billion stock repurchase program, with no specific expiration date.

Microsoft also said its board has appointed President Brad Smith to the added role of vice chair. “This reflects the unique leadership role that Brad plays for the company, our board of directors and me, with governments and other external stakeholders around the world,” Microsoft CEO and Chairman Satya Nadella said in a statement. 

[Source](https://www.barrons.com/articles/microsoft-hikes-dividend-and-unveils-60-billion-stock-buyback-program-51631662051)",2021-09-15 00:21:19
MSFT hikes dividend and unveils $60B stock buyback program,,1,1.0,pof3ls,stocks,https://www.reddit.com/r/stocks/comments/pof3ls/msft_hikes_dividend_and_unveils_60b_stock_buyback/,2,[removed],2021-09-15 00:20:16
US Regulators Looking Into TSLA,,1,1.0,po5d3b,stocks,https://www.reddit.com/r/stocks/comments/po5d3b/us_regulators_looking_into_tsla/,2,[removed],2021-09-14 15:45:40
How much further will AAPL drop?,,1,1.0,pnp4gb,stocks,https://www.reddit.com/r/stocks/comments/pnp4gb/how_much_further_will_aapl_drop/,38,"I had loaded calls last week on Friday after the lawsuit results. Loaded 160 calls expiring Oct. But didn’t expect AAPL to keep falling...expected to see a bounce. With the event tomorrow, I’m hoping to see a pump, but afraid it might be priced in. What are your thoughts on AAPL in the short term?",2021-09-13 21:42:23
Is now a good time to buy $AAPL? (Apple Inc.),,1,1.0,pm1mz0,stocks,https://www.reddit.com/r/stocks/comments/pm1mz0/is_now_a_good_time_to_buy_aapl_apple_inc/,167,"Apple perhaps is one of the most popular stock being the highest market cap and found it many investor’s portfolio. After dipping due to the in-app purchase lawsuit with Epic Games, I couldn’t resist and bought a few shares of my first $AAPL stock ~$150 planning to hold them for many years. 

Is $AAPL always a good buy at any price? Especially the iPhone 13 event is coming next week, it could dip even further and when Apple Car is ready it can be huge in the future EV market. 

What are your thoughts on $AAPL in the long term since their main source of revenue is currently from iPhones compared to Amazon as more diversified business?",2021-09-11 05:43:45
"If Apple comes out with a car, are you buying an Apple car or a Tesla? TSLA 3,000 is higher then AAPL, Be honest, very curious, Cathie Says",,1,1.0,plxv88,stocks,https://www.reddit.com/r/stocks/comments/plxv88/if_apple_comes_out_with_a_car_are_you_buying_an/,146,"Good evening everyone and thank you so much for reading my posts. There are debates everywhere abou TSLA valuation so I am not here to go into that. It should be noted that TSLA now has a market cap higher than the combination of Toyota, Volkswagen, GM, Ford, Honda all combined. It should also be noted that Toyota alone sells nearly 10 million cars and Tesla 500k…..

This post is not about that though…however Cathie Wood says that TSLA should be worth 3,000 easy, in her base case. \[Mind you she just dumped… along with insiders that sell every day of the week check form 4\] Whatever is the case if TSLA is 3,000 a share it will rival the largest company in the world AAPL. Nearly 2.5 trillion…

TSLA is thought as of the car/tech of the future…Many believe that APPLE is the best innovator… It has been rumored over a year that Apple has plans to possibly team up with a car manufacturer and make an APPLE car….

So the question is simple. If both cars come out, both cars are near the same price…be honest which do you buy? This happened with Blackberry, Iphone and Samsung…

Thank you for taking the time. Please share thoughts, ideas… or if you think someone will overtake Apple and Tesla in the next few years.",2021-09-11 01:20:06
Is it okay to buy $MSFT (Microsoft) now when it's below $300?,,1,1.0,plczl2,stocks,https://www.reddit.com/r/stocks/comments/plczl2/is_it_okay_to_buy_msft_microsoft_now_when_its/,129,"Microsoft is definitely a company that will most likely continue to do well and generate good profits especially from Office, XBox, Azure, Windows &amp; etc.

I am looking to buy some shares of good companies and hold for the long term (&gt;5 years) and have been looking closely at MSFT.

Now that it had a small dip from ATH, is it okay to buy in now while it's below $300 and wait for a bigger pullback? Most people here entered MSFT years ago and before it had a nice run-up since June while I am thinking about buying it now.",2021-09-10 03:20:49
What happens to to AAPL during Apple events?,,1,1.0,pkazwe,stocks,https://www.reddit.com/r/stocks/comments/pkazwe/what_happens_to_to_aapl_during_apple_events/,49,"Hello, new to stocks here. I was kinda curious.

I got an email from Apple saying they will jave a streaming event on the 14th. I own wome of their stock so I'm wondering: how does an event like this usually affect their stock for the day? I assume it increases due to hype right? When a product is released, is there a correction since people the hype ends?",2021-09-08 13:55:47
$TSLA Low Volume?,,1,1.0,pjttq3,stocks,https://www.reddit.com/r/stocks/comments/pjttq3/tsla_low_volume/,0,[removed],2021-09-07 19:16:09
"Patriotic Bets- Stocks of the week $AAPL,$TSLA,$MSI,$AA,$ADMP",,1,1.0,pjnheq,stocks,https://www.reddit.com/r/stocks/comments/pjnheq/patriotic_bets_stocks_of_the_week/,1,"Good Morning Traders! Its another beautiful week to make some money and boy do we have a list for you! 
Now before we begin as always, I want to make sure that I say this, so no one comes after me so please read this carefully when I say if you don’t have the money, or you don’t want to lose money then please do not trade in the market and do not dump all your money into the stocks that are listed in this article! Just because I am writing about them does not guarantee they will go up, down or even move for that matter, the objective of this this weekly draft is to pick stocks that I think might have the best movement and potential, but with the stock market even with all the facts there is no guarantee that it will go your way. 
Now, lets get into it, to start off Adamis pharmaceuticals ($ADMP). Never heard of them? That’s because they are not brother or sister to a company like Pfizer this is more like a second cousin once removed. Just trading at a low price of $1.11 you’re most likely thinking why? Well, what they lack in price they make up in rumors and rumors have it that Adamis are currently in trials with an antiviral drug for upper respiratory infections such as asthma, influenza and covid-19 called tempol, they have already announced dosing patients and are on their II/III phase putting them directly under the microscope as a potential 10x if it goes that way.
Another unsuspecting stock is Alcoa Corp ($AA). Now ill admit this one is a bit of a no brainer, but I figured why not just be captain obvious for the people who may not always research their stocks before diving right in. The only reason I even came across this stock was because I was looking for information on Coco Cola and found that the beverage company is suffering from a shortage of cans and is having a hard time maintain the amount of aluminum. Furthermore, this isn’t just in Coco Colas back door but its apparently a global issue with aluminum making it rarer and less accessible to everyone. The stock is currently trading at $47.21 and if the shortage continues its only going to drive the price of shares up. 
This next stock you know and love, its one of the top tech companies please put your hands together for Apple Corp everyone! ($AAPL) Is pretty much the dominating giant when it comes to phones in the west and Apple have continued to deliver with the new iPhone 13. What makes this release a shocker is that apple have hinted or maybe just confirmed at this point that the new iPhones will be able to use satellite communications making it essentially the first smart satellite phone to hit the market, what’s interesting is that space corporations are jumping on this and a buddy of mine even said “Looks like the astronauts are all getting iPhones now.” A wild statement but not something I couldn’t imagine apple wanting to dominate. First earth then the universe. Apple is trading as of right now just $154.30
Still rolling with communications next in line is apples former king the company that shaped my childhood and phone status with its beautifully designed flip phone, that’s right next we have Motorola ($MSI) despite not being top shit when it comes to how cool your phone is Motorola has managed to stay afloat and prosper while not being in the spotlight. The company has shown tremendous earnings and revenue over the years and don’t seem to be slowing in the growth and development department even with the uncertainty we live in today, trading at a decent $244.85 stock has taken a small dive but in the great words of capitalism buy low sell high. 
Okay, I need to come clean, I didn’t want to put this in here just because of how much everyone talks about it already, but I could not pass it up. Tesla, that’s right the real-life stark industries has made headlines once again thanks to the real-life Tony Stark Mr. Elon Musk. And what did Mr. Musk do? Oh, nothing just stated that Teslas shares could easily be worth $3000 a piece. Now for those of you who are saying big deal its just talk let me remind you that we are talking about a man that tweeted that Tesla’s stock price was too high and by the end of the day Tesla’s share price had shot down so many people were wondering if it was a crash all over again. The man literally made a crypto that was started as a joke rise to nearly .40 cents a coin when it was trading at .003 in just a few months. It may be nothing buts it’s a nothing I can’t ignore and that’s why its on the list today. Tesla is currently trading at $733.57 a share. 
And there you have it the draft is over and well see what’s in store for these stocks at the end of the week with the review that comes out after the market closes on Friday EST.

https://patrioticbets.com/2021/09/07/patriotic-bets-stocks-of-the-week-aapltslamsiaaadmp/",2021-09-07 13:52:38
"Elon Musk says Tesla (TSLA) is worth $3,000 a share ‘if they execute really well’",,1,1.0,pjng0j,stocks,https://www.reddit.com/r/stocks/comments/pjng0j/elon_musk_says_tesla_tsla_is_worth_3000_a_share/,852,"Elon Musk told employees that he agrees with Ark Invest that Tesla (TSLA) is worth $3,000 a share “if they execute really well.” The CEO has often commented on Tesla’s stock price, but surprisingly, it was often to say that the price was too high. 

In 2020, when Tesla’s stock was reaching new high, Musk told his millions of followers on Twitters that he believed the stock was “too high”. It sent Tesla’s stock crashing, but now it is even higher than when Musk made the comment.

Tesla is currently trading at $733 a share and the automaker is the most valuable automotive company in the world at over $730 billion.

Wall Street firms are divided on whether or not the company is overvalued, but a few of them believe that Tesla could be worth a lot more. Ark Invest is one of them. Though to be fair, the company is also a large Tesla shareholders through its investment funds.

This week, they released a new note claiming a $3,000 base stock price target by 2025 for Tesla. Cathie Wood said about the price target during an interview with Yahoo Finance: “Our estimate for Tesla’s success has gone up. The main reason for that is their market share. Instead of going down from year-end 2017 to today, it has actually gone up fairly dramatically,” In its valuation models, Ark Invest believes that Tesla is going to deliver between 5 and 10 million vehicles as soon as 2025. That’s a significant ramp considering Tesla likely will deliver less than 1 million vehicles this year. The firm is also betting on Tesla delivering a completely autonomous ride-hailing network, known as Tesla Network, that is going to bring in a lot of money with high margin.

In an email to Tesla employee obtained by Electrek, Elon Musk shared with employees Ark’s new $3,000 price target and that he agrees with Ark: “If we execute really well, I agree with Ark Invest.” A $3,000 share price would put Tesla’s valuation at $3 trillion and make it the most valuable company in the world. 

Electrek’s Take

Since Ark’s new note was an update on their valuation model and price target, it is fair to say that Musk’s email is basically a direct comment on Tesla’s stock price. He believes that “if executed really well”, Tesla should be worth $3 trillion within the next 4 years.

[https://electrek.co/2021/09/04/elon-musk-tesla-tsla-worth-3000-share/](https://electrek.co/2021/09/04/elon-musk-tesla-tsla-worth-3000-share/)",2021-09-07 13:50:26
$AMZN - now or in 60 days?,,1,1.0,pigbcu,stocks,https://www.reddit.com/r/stocks/comments/pigbcu/amzn_now_or_in_60_days/,0,[removed],2021-09-05 16:34:15
Why is AAPLs revenue growth declining?,,1,1.0,pifkoc,stocks,https://www.reddit.com/r/stocks/comments/pifkoc/why_is_aapls_revenue_growth_declining/,176,"Is AAPLs revenue growth declining mostly because of the chip shortage?

I realize AAPL has a ton of free cash so maybe it won't be that big of a deal?

What is AAPL doing to increase their revenue growth?

I heard they're getting into healthcare and possibly evs?

I have faith that the intelligent people there will fix things!",2021-09-05 15:53:25
AAPL or cash?,,1,1.0,phyt50,stocks,https://www.reddit.com/r/stocks/comments/phyt50/aapl_or_cash/,183,"I've got 20% cash right now. Buy AAPL now or wait for a correction?

Some is in ROTH.  I figure say I buy $5k of AAPL now and make a little bit on its possible rise to $160 or $180 and then sell?

Or do you wait till we get a correction and buy AAPL at $140?  Who knows if it would even go that low.

But also I could just keep a close eye on it in my ROTH and sell if it starts to get close to what I paid for it now?

What would you do?",2021-09-04 20:16:43
"Whistleblower article explaining how AMZN has worked with HF/PE to bankrupt competition, very profitably skirting anti-trust laws. Thoughts?",,1,1.0,ph5ode,stocks,https://www.reddit.com/r/stocks/comments/ph5ode/whistleblower_article_explaining_how_amzn_has/,0,[removed],2021-09-03 13:57:29
MSFT LEAPS Wait for 2024? Exp?,,1,1.0,pgyabe,stocks,https://www.reddit.com/r/stocks/comments/pgyabe/msft_leaps_wait_for_2024_exp/,2,[removed],2021-09-03 04:47:36
Buy AMZN Now or Wait for Pull Back ?,,1,1.0,pg6633,stocks,https://www.reddit.com/r/stocks/comments/pg6633/buy_amzn_now_or_wait_for_pull_back/,0,[removed],2021-09-01 23:53:19
AMZN Help pleeze,,1,1.0,pftqd2,stocks,https://www.reddit.com/r/stocks/comments/pftqd2/amzn_help_pleeze/,0,Total options rookie here. I YOLO’d on AMZN @ 3200 then sold to open a 3445 9/17 contract. It keeps going up and I only have 16k in the bank. Do I bite the bullet and Buy to Close? It’s so spendy.,2021-09-01 13:18:17
"RRL, BABA, SE, AMZN Newbie trading",,1,1.0,pfqqey,stocks,https://www.reddit.com/r/stocks/comments/pfqqey/rrl_baba_se_amzn_newbie_trading/,0,[removed],2021-09-01 10:01:41
What happened to $AAPL and the NASDAQ at 3:50pm today?,,1,1.0,pfipuy,stocks,https://www.reddit.com/r/stocks/comments/pfipuy/what_happened_to_aapl_and_the_nasdaq_at_350pm/,13,"I was scalping $AAPL long at 3:50pm and it tanks. I saw a sell of 12500ish shares go by, then I look at the Nas and see a big hole in the 1m chart. I checked a few discord channels and all I see about it is someone says ""Who?"", but then deletes their post. I assume this was bigger than $AAPL shares. Anyone have insight into who sold off?",2021-09-01 00:39:02
