,Ticker,Title,Article,Summary,Link,Date
48,AMZN,Better Buy: Activision Blizzard vs. Amazon,"Amazon (NASDAQ:AMZN) and Activision Blizzard (NASDAQ:ATVI) have both benefited from the stay-at-home economy, though in different ways. Consumers turned to Amazon for everything from toilet paper to streaming content, while Activision's games provided a source of entertainment and social interaction during an isolating time.

Not surprisingly, the prices for both stocks have performed well over the past year, with Amazon jumping 53% and Activision rising 62%. But which is the better buy today?

Amazon

Amazon is one of the largest, most valuable brands in the world. Its online marketplace is the most visited site on the internet. And according to eMarketer, the company now facilitates an astonishing 39% of digital commerce in the United States, far ahead of second-place Walmart with 5.8%. And while Walmart is still the world's largest retailer, Amazon is closing in on that title, too.

If there was a dark spot in Amazon's performance this year, it was the company's cloud computing business, Amazon Web Services (AWS). Revenue growth in this segment continued to decelerate, dropping from 37% in 2019 to 30% in 2020. On the bright side, the operating margin for AWS reached 29.8%, which is 3.6 percentage points higher than in 2019. Moreover, the company is still the clear leader in the cloud infrastructure space with a 32% market share, though Microsoft Azure is gaining ground.

Even so, the company's growth in e-commerce helped pick up the slack. Revenue from Amazon's own online sales and third-party merchants accelerated to 40% and 50%, respectively. Even more encouraging, Amazon posted positive operating income in its international business last year. The company has invested heavily in expanding its operations beyond the United States, and this is the first time since 2011 that Amazon's international segment has been profitable. If the company can maintain that momentum, it could help Amazon capture more of the massive global e-commerce market.

Over the last three years, the company's solid execution has translated into strong revenue growth and operating margin expansion.

Metric 2017 2020 Change Revenue $178 billion $386 billion 117% Operating Margin 2.3% 5.9% 3.6%

Amazon's consistently strong overall growth -- despite being a $1.6 trillion company -- is one of the most amazing things about this tech giant. And it's not just the top line that's getting bigger. Amazon is also becoming more profitable. Free cash flow (FCF) per share has grown at 29% per year over the last five years, and while growth has slowed recently, FCF per share still jumped 18% in 2020. Even more impressive, Amazon posted that figure despite incurring over $11.5 billion in additional operational expenses due to COVID-19. In other words, this is what Amazon can do with one hand tied behind its back.

Going forward, Amazon remains well-positioned to dominate the U.S. digital commerce and global cloud computing markets, but the company is also gaining ground in digital advertising. The takeaway? Investors still have a lot to be excited about with this company.

Activision Blizzard

Activision Blizzard is one of the largest video game companies in the United States, generating more revenue than rivals like Electronic Arts and Take-Two Interactive. The company is behind popular titles like World of Warcraft, Overwatch, Call of Duty, and Candy Crush.

In 2020, Activision benefited from pandemic-driven tailwinds, as social distancing measures left many gamers with more free time on their hands. Not surprisingly, consumers purchased more consoles and game titles and spent more time engaged in gameplay.

As a result, Activision's Call of Duty: Modern Warfare and Call of Duty: Black Ops Cold War were the two top-selling games in the U.S. last year. More impressively, Black Ops Cold War, which was released in November 2020, is already one of the top 20 selling games of all time, and it continues to top the monthly sales charts as of January 2021, according to the NPD group.

However, like many gaming companies, Activision's business has been somewhat cyclical in the past. For example, the company released fewer major titles in 2019 and sales dropped 13% compared to the prior year. Over the long term, this has resulted in muted revenue growth.

Metric 2017 2020 Change Revenue $7.0 billion $8.1 billion 16%

On the bright side, the company is trying to stabilize its sales. In March 2020, Activision launched Call of Duty: Warzone, the series' first-ever free-to-play installment for PC and consoles. The company hopes this will attract more gamers, which should translate into more in-game purchases. Based on the early results, the strategy seems to be working: Warzone brought over 60 million players to the platform in the first two months.

Investors should pay attention to Activision's top line in the coming quarters to see if free-to-play titles do indeed result in more consistency.

A final word

Activision Blizzard has a great collection of gaming titles and a great strategy for reenergizing its business, but the cyclicality of the gaming industry still results in fluctuations in monthly active users, making its top-line less stable than Amazon's. And even though Activision's sales returned to growth in 2020, Amazon's revenue still increased more quickly.

Moreover, Amazon is a market leader in two different high-growth industries, and the company's dominance within those industries is far beyond what Activision has achieved in gaming. That's why Amazon wins this better-buy investing contest.","Amazon (NASDAQ:AMZN) and Activision Blizzard (NASDAQ:ATVI) have both benefited from the stay-at-home economy, though in different ways.
Revenue growth in this segment continued to decelerate, dropping from 37% in 2019 to 30% in 2020.
Over the last three years, the company's solid execution has translated into strong revenue growth and operating margin expansion.
Over the long term, this has resulted in muted revenue growth.
And even though Activision's sales returned to growth in 2020, Amazon's revenue still increased more quickly.",https://www.fool.com/investing/2021/02/22/better-buy-activision-blizzard-vs-amazon/,2021-02-22 00:00:00
49,AMZN,Amazon's Bombshell Announcement Overshadowed its Breakout Results,"Amazon (NASDAQ:AMZN) stunned investors earlier this month when it revealed that Jeff Bezos would step down as CEO and assume the role of executive chairman. Andy Jassy, CEO of Amazon Web Services (AWS) will assume the role of CEO, with the transition scheduled for the third quarter. The announcement eclipsed the company's fourth quarter results, as Amazon closed out the year on a high note.

On this clip from Motley Fool Live recorded on Feb. 3, ""The Wrap"" host Jason Hall and Fool.com contributors Danny Vena and Brian Stoffel recap Amazon's superb financial results.

Jason Hall: Let's talk about Amazon's financial results, a little bit about the transition, and then I've got some questions for you.

Danny Vena: Well, obviously, the big shot heard around the world yesterday was about Jeff Bezos relinquishing his role as CEO. But Amazon reported its earnings and that got drowned out.

If you look at Amazon's earnings for the fourth quarter, net sales grew to more than $125 billion, up 44% year-over-year. That actually accelerated from the 37% gains that happened in the third quarter. Now, it's not necessarily apples-to-apples comparison this year, because in the fourth quarter, Amazon got a boost from Prime Day, which happened in October this year, when it typically happens in July. That probably accounts for the majority of that increase.

Net income doubled to $7.2 billion, and free cash flow for the trailing 12-month period increased to $31 billion.

Essentially, if you look at what was happening across the board, Amazon did really well for the quarter and probably, well, definitely even better than what analysts were expecting. I think it's hard to focus on that with so many analysts talking about how Amazon is going to fair going forward based on what's happening with Jeff Bezos.

But some of the things that if you look at, for instance, Amazon's net sales over the course of the full year were up 38%. That's a mind-boggling number, $386 billion. They added $100 billion in business over the course of the year. That's an incredible number.

I want to stop there so we can focus more on what the questions that are on everybody's mind about Jeff Bezos. But suffice it to say that the quarter was fabulous and we can expect more good things from Amazon's financial results going forward.

Jason Hall: Yeah. I want to put that revenue dollar growth in perspective. Target, 12-month trailing revenues, $89 billion. Amazon just added a Target over the past year. [laughs]

Brian Stoffel: Not only that, but they said that in the first quarter, they expected it could grow up to 40%. Are you kidding me? 40%? And when you consider that they get so much money from third-party as opposed to first-party, it's just mind-boggling.","Andy Jassy, CEO of Amazon Web Services (AWS) will assume the role of CEO, with the transition scheduled for the third quarter.
The announcement eclipsed the company's fourth quarter results, as Amazon closed out the year on a high note.
Jason Hall: Let's talk about Amazon's financial results, a little bit about the transition, and then I've got some questions for you.
If you look at Amazon's earnings for the fourth quarter, net sales grew to more than $125 billion, up 44% year-over-year.
But suffice it to say that the quarter was fabulous and we can expect more good things from Amazon's financial results going forward.",https://www.fool.com/investing/2021/02/17/amazons-bombshell-announcement-overshadowed-its-br/,2021-02-17 00:00:00
50,AMZN,Better Buy: Amazon.com vs. Walmart,"Amazon (NASDAQ:AMZN) and Walmart (NYSE:WMT) continue their battle for retail supremacy in the U.S. and other parts of the world. Amazon's emergence had once created fear among investors that it would dominate the retail scene. Amid this concern, Walmart has found a way to foster growth through a combined online and in-store presence -- but those improvements may not translate into gains for investors. Let's take a closer look to find out why.

Walmart's comeback

In the middle of the last decade, the rise of Amazon amid Walmart's stagnant sales left the company reeling. However, Walmart began its turnaround when Doug McMillon became its CEO in 2014. The purchase of jet.com and other e-retailers took Walmart online in earnest, allowing the company to build a competitive advantage on a combined in-store and online shopping experience.

Thanks to this offering, customers could shop online when they preferred and, if what they wanted was available at the store, could pick up items rather than waiting on deliveries. With more than 90% of Americans living within 10 miles of a Walmart, the company was uniquely positioned to make this work.

Such improvements continue to drive growth. In the latest fiscal year, revenue increased by almost 7% from year-ago levels to about $559.2 billion. This includes a 79% surge in U.S. e-commerce-based comparable sales over the same period, though the company did not release an actual dollar figure for those sales.

These gains helped operating income rise by nearly 10% to about $22.5 billion. Unfortunately, Walmart's tax burden increased by almost $2 billion during the fiscal year. The company took a tax hit that reduced net income by more than 9% to about $13.5 billion. Also, Walmart's income before taxes increased by just over 2%, as other gains fell from just under $2 billion to around $210 million over the course of the year. The sale of Walmart Argentina explains most of the increased taxes and the reduction in other gains.

The overall growth figures may have left some investors indifferent toward Walmart. After the P/E ratio spiked as high as 60 in 2019, it has fallen back to the 20 range, slightly above its multiple in the middle of the last decade.

Why Amazon could still hold the advantage

In contrast, Amazon shows no signs of stagnation. It continues to manifest most of its growth through its core competency of online retailing. Total net product sales increased by 37% over the previous fiscal year to just under $341 billion.

Nonetheless, Walmart remains ahead on operating margins. Amazon's $9.4 billion in operating income from product sales fell short of Walmart's $22.5 billion.

Still, Amazon has an ace in the hole in its cloud computing business, Amazon Web Services (AWS). AWS brings in substantially higher margins and profits than its retailing arm. Despite net sales of about $45.4 billion, AWS earned $13.5 billion in operating income.

This provides Amazon with a tremendous competitive advantage. For one, few retailers have skillsets that can transfer into a viable cloud computing business. More importantly, AWS makes Amazon less dependent on retail, a business with traditionally thin margins. Hence, AWS can subsidize retailing, allowing Amazon to gain a competitive advantage over Walmart and other peers.

Thanks in large part to this advantage, Amazon generated close to $386.1 billion in overall net sales in fiscal 2020, an increase of 38% year-over-year. This helped net income rise 84% over the same period to $21.3 billion, or $41.83 per diluted share. Much of this increase came from the ""other income"" category, which increased by more than tenfold over the previous 12 months to over $2.3 billion. Changes in equity valuations and foreign currency drove the increase in other income.

Such growth continues to keep Amazon's valuation at a higher level. Its P/E ratio now stands just below 80, which seems to make Amazon's stock so expensive in the minds of some investors. Though this still dramatically exceeds the multiples for Walmart, Target and Costco, the P/E ratio has come down from last fall's levels, when it often surged above 120.

Amazon or Walmart?

In the retailing realm, Amazon and Walmart have fostered growth by combining online and physical store retailing. However, Amazon registers four times as much overall revenue growth as Walmart. Moreover, for all of the accolades about Walmart's e-commerce growth, the company remains unwilling to publish specific revenue numbers for this segment, suggesting that e-commerce still makes up a relatively small portion of its revenue.

Additionally, Amazon has found success with the separate business that is AWS, whose success lets the company pay for improvements that make its retail operation more competitive. This helps make Amazon a safer retail stock for investors, even when you consider its much higher valuation.","Amazon (NASDAQ:AMZN) and Walmart (NYSE:WMT) continue their battle for retail supremacy in the U.S. and other parts of the world.
The purchase of jet.com and other e-retailers took Walmart online in earnest, allowing the company to build a competitive advantage on a combined in-store and online shopping experience.
With more than 90% of Americans living within 10 miles of a Walmart, the company was uniquely positioned to make this work.
Total net product sales increased by 37% over the previous fiscal year to just under $341 billion.
In the retailing realm, Amazon and Walmart have fostered growth by combining online and physical store retailing.",https://www.fool.com/investing/2021/02/20/better-buy-amazoncom-vs-walmart/,2021-02-20 00:00:00
51,AMZN,AMZN: Amazon vs. MercadoLibre: Which E-Commerce Stock is a Better Buy?,"E-commerce platforms have received a significant boost from the COVID-19 pandemic over the last year. The public health crisis has forced people to stay home and rely on online platforms for their shopping needs. Though an ongoing vaccine rollout is encouraging some people to return to traditional brick-and-mortar stores, some observers expect the e-commerce trend to continue even in the post-pandemic world. And, as such, e-commerce companies should continue to flourish on the back of continued innovations and advancements in delivery systems.

Amazon.com, Inc. (AMZN) and MercadoLibre, Inc. (MELI), two prominent global online business service providers, have emerged as lifelines to a public wary of health risks, and have been thriving as a result since the pandemic. The crisis triggered a rapid shift toward the digitization of commerce and trade. As a result, more consumers have been buying products and services online, and more entrepreneurs are adopting digital platforms to meet the demand.

Both stocks have generated significant returns over the past three years. While AMZN returned 125.7% over this period, MELI gained 424.5%. But in terms of the past month’s performance, AMZN is a clear winner with 5.3% returns versus MELI’s 4.8%. But which of these stocks is a better pick now? Let’s find out.

Business Structure and Latest Movements

AMZN is the world’s largest online retailer engaged in the retail sale of consumer products and service subscriptions through its online store. In addition to being a market leader in the cloud computing segment, AMZN has also ventured into various other spaces, most recently into the healthcare segment with the launch of Amazon pharmacy. AMZN also manufactures and sells devices such as Kindle, Fire tablets, Fire TVs, Rings, and Echo. The company operates through three segments – North America, International, and Amazon Web Services (AWS).

AMZN is investing heavily in building fulfilment centers and developing its transportation fleet. The company recently unveiled its plan to open a fulfillment center in Tennessee, which it anticipates opening next year. In December, it revealed its plans to open its first fulfillment center in Carencro and two new fulfilment centers and a new delivery station in Texas. In addition, the company recently purchased its first Boeing (BA) 767-300 aircraft, to serve customers faster. It also purchased 11 aircraft from Delta Air Lines (DAL) and WestJet Airlines to join the Amazon Air cargo network in 2021 and 2022.

MELI is an Argentina-based e-commerce service provider. It operates MercadoLibre Marketplace, an automated online commerce platform that enables businesses and individuals to list merchandise and conduct sales and purchases online, and MercadoPago FinTech, a financial technology solution platform that facilitates transactions on and off its marketplaces by allowing its users to send and receive payments online.

MELI recently closed its inaugural debt offering of $400 million of notes due 2026 and $700 million of notes due 2031. The company intends to use the proceeds to finance ongoing or new projects with social or environmental impacts.

In November 2020, MELI selected AMZN’s AWS as its primary cloud provider to further transform it into a data-driven organization, improve user experiences, accelerate the launch of new services, and support its regional expansion.

Recent Financial Results

In the fourth quarter ended December 31, 2020, AMZN’s revenue increased 44% year-over-year to $125.6 billion. North America contributed 61% to its top line, representing 22% net sales growth. Its operating income for the quarter surged 77% year-over-year to $6.9 billion. The company reported EPS of $14.09, compared to the year-ago value of $6.47.

MELI’s revenue for the quarter ended September 30, 2020 grew 85% year-over-year to $1.1 billion. Its Commerce revenues surged 109.3% year-over-year, hitting $724.5 million, while its Fintech revenues increased 52.3% year-over-year to $391.2 million. Its gross merchandise volume (GMV) reached $5.9 billion, representing an increase of 62.1%. And its EPS came in at $0.28, compared to the year-ago loss of $2.69 per share.

Past and Expected Financial Performance

AMZN’s revenue and total assets have grown at a CAGR of 29.5% and 34.7%, respectively, over the past three years.

The market expects AMZN’s revenue to increase 38.5% in the current quarter (ending March 31, 2021) and 22.8% in the current year. AMZN’s EPS is expected to grow 88% in the current quarter and 13.8% in the current year. Also, its EPS is expected to grow at a rate of 38.4% per annum over the next five years.

In comparison , MELI’s revenue and total assets grew at a CAGR of 43.88% and 52.5%, respectively, over the past three years.

The market expects MELI’s revenue to increase 60.9% in the current quarter and 42.3% in the current year. The company’s EPS is expected to rise 179.5% in the current quarter and 169.2% in the current year. However, MELI’s EPS is expected to grow at a rate of just 20.5% per annum over the next five years.

Profitability

AMZN’s trailing-12-month revenue is nearly 117 MELI’s. In addition, , AMZN is more profitable with a net profit margin of 5.5% versus MELI’s negative value.

AMZN’s ROE of 27.44% compares favorably with MELI’s negative values.

Valuation

In terms of forward p/e, MELI is currently trading at 1,364.90x, significantly higher than AMZN, which is currently trading at 68.78x. Also, AMZN is less expensive in terms of trailing-12-month p/s (4.23x versus MELI’s 29.04x).

In terms of trailing-12-month price/cash flow also, MELI’s 96.33x is 287% higher than AMZN’s 24.92x.

POWR Ratings

AMZN has an overall rating of B, which equates to a Buy in our proprietary POWR Ratings system. However, MELI has an overall rating of C, which represents Neutral. The POWR Ratings are calculated by considering 118 different factors with each factor weighted to an optimal degree.

In terms of Sentiment Grade, AMZN has an A grade, reflecting greater analyst confidence in its prospects. MELI has a grade of C in this regard.

While AMZN has a Value Grade of C, MELI is graded F, consistent with its stretched valuation multiples. Of 67 stocks in the Internet industry, AMZN is ranked #9 while MELI is ranked #31.

Beyond what I stated above, our POWR Ratings system has also rated both AMZN and MELI for Growth, Momentum, Stability, and Quality. Get all the AMZN ratings here. Also, click here to see the additional POWR Ratings for MELI.

The Winner

The coronavirus pandemic forced retailers and businesses to migrate online to survive. However, even if the virus’ spread is contained, the trend is here to stay. Entrepreneurs worldwide are prioritizing digital channels and are depending increasingly on internet services to manage their businesses and grow their brands.

Hence, we believe AMZN and MELI are good long-term investments considering their huge customer base, expansion strategies and industry strength. However, AMZN appears to be a better buy now based on the factors discussed here.

AMZN is more affordable compared to MELI and has an edge over its peers due to its large- scale operation. The company has been implementing robust expansion strategies to increase its market reach by developing its transportation fleet, floor space, and logistics efforts. AMZN is a proven winner, and it is uniquely positioned to ride this secular e-commerce trend.

Click here to learn about other top-rated internet stocks.

Want More Great Investing Ideas?

9 “MUST OWN” Growth Stocks for 2021

How to Ride the 2021 Stock Market Bubble

7 Best ETFs for the NEXT Bull Market

5 WINNING Stocks Chart Patterns

AMZN shares were trading at $3,317.34 per share on Thursday afternoon, up $8.70 (+0.26%). Year-to-date, AMZN has gained 1.85%, versus a 4.11% rise in the benchmark S&P 500 index during the same period.

About the Author: Sidharath Gupta

Sidharath’s passion for the markets and his love of words guided him to becoming a financial journalist. He began his career as an Equity Analyst, researching stocks and preparing in-depth research reports. Sidharath is currently pursuing the CFA program to deepen his knowledge of financial anlaysis and investment strategies. More...

More Resources for the Stocks in this Article","AMZN’s EPS is expected to grow 88% in the current quarter and 13.8% in the current year.
In comparison , MELI’s revenue and total assets grew at a CAGR of 43.88% and 52.5%, respectively, over the past three years.
The market expects MELI’s revenue to increase 60.9% in the current quarter and 42.3% in the current year.
The company’s EPS is expected to rise 179.5% in the current quarter and 169.2% in the current year.
However, MELI’s EPS is expected to grow at a rate of just 20.5% per annum over the next five years.",https://stocknews.com/news/amzn-meli-amazon-vs-mercadolibre-which-e-commerce-stock-is-a-better-buy/,2021-02-20 00:00:00
