,Ticker,Title,Article,Summary,Link,Date
88,AMZN,"Governments need more money to fight Google antitrust cases, lawyer tells Congress","Google CEO Sundar Pichai testifies before the House Judiciary Subcommittee on Antitrust, Commercial and Administrative Law during a hearing on ""Online Platforms and Market Power"" in the Rayburn House office Building on Capitol Hill, in Washington, U.S., July 29, 2020. Mandel Ngan/Pool via REUTERS

The power of Big Tech to tamp down potential business rivals stretches all the way into the courtroom, a leading antitrust attorney testified before the House Judiciary Subcommittee on Antitrust on Thursday.

John Thorne, a partner with the law firm Kellogg, Hansen, Todd, Figel & Frederick, testified that the Justice Department (DOJ) and state attorneys general lack the resources necessary to effectively enforce their antitrust laws and their cases now pending against Google (GOOG, GOOGL).

“The cases right now against Google are the hardest cases ever litigated in our courts,” Thorne testified, describing the state and federal attorneys handling the lawsuits as great lawyers whose departments are underfunded and underpaid.

“The staff lawyers at DOJ, and the staff lawyers at the Texas Attorney General's Office, and the other states that are in that case, are paid below market, but they are working above market,” Thorne said. “They do not have the same resources that their opponent has.”

Thorne said lawyers working on behalf of the Texas Attorney General requested $43 million from the state’s legislature, solely for the purpose of hiring expert witnesses in what they described as a bidding war. “The answer from the finance chair of the Texas Senate was, “‘I don't think that's gonna be enough money for you. I don't think you can actually win this with that [budget],’” Thorne said.

Story continues

""Fancy lawyer"" needed for individual antitrust case

The subcommittee’s hearing was focused on solutions to longstanding concerns that Google, as well as Facebook (FB), Apple (AAPL), and Amazon (AMZN), have abused their monopoly power.

Another witness, Dr. Hal Singer, managing director for Econ One, told lawmakers that the cards are also stacked against individual players who wish to bring an antitrust case against Big Tech companies, particularly against Amazon, which requires its sellers to arbitrate legal claims individually and outside of court.

“To bring an antitrust case against Amazon, by yourself, you'd have to hire a fancy antitrust lawyer and you'd have to hire a fancy antitrust economist, and just the scale doesn't make sense to bring these claims, individually. And so the system is rigged, effectively, to immunize Amazon from antitrust scrutiny, at least in by private complainants,” Singer said.

Antitrust cases can move faster

According to Thorne, sufficient funding for antitrust cases could ensure they don't drag out so long that they're no longer relevant to consumers. “Closely related to resources is how long it takes to get an antitrust trust case to trial,” Thorne said. “If it takes years to investigate, and then years to get the trial, that's a lot of years the public is denied competition, waiting for law enforcement. I know these cases can move faster because I've seen it done.”

WASHINGTON, DC - JULY 29: Apple CEO Tim Cook speaks via video conference during the House Judiciary Subcommittee on Antitrust, Commercial and Administrative Law hearing on Online Platforms and Market Power in the Rayburn House office Building, July 29, 2020 on Capitol Hill in Washington, DC. (Photo by Graeme Jennings-Pool/Getty Images)

Google faces three antitrust lawsuits; one filed in October by the DOJ and 11 states attorneys general; and two others filed in December by coalitions of state attorneys general.

The lawsuits accuse the company of using its monopoly power to exclude rivals from the online search and advertising markets and of improperly entering exclusionary contracts with Apple and other companies that make Google the default search engine on mobile devices; Google is also accused of denying specialized search sites like Expedia (EXPE), Angie’s List, and Yelp (YELP) of “prime real estate” on its search results page.

Facebook is also facing two antitrust lawsuits: one brought by the Federal Trade Commission (FTC) seeking to break it up, and another brought by 48 U.S. attorneys general claiming it violates antitrust law by buying up competitors. The competitive practices of Apple and Amazon remain part of ongoing investigations by federal and state officials.

Alexis Keenan is a legal reporter for Yahoo Finance and former litigation attorney.

Follow Alexis Keenan on Twitter @alexiskweed.

READ MORE:

Twitter's Jack Dorsey sued by shareholder over his dual role as Square CEO

Crypto price surge invites a torrent of crypto crime

Citadel CEO: 'We had no role in Robinhood’s decision to limit trading in GameStop'","“The cases right now against Google are the hardest cases ever litigated in our courts,” Thorne testified, describing the state and federal attorneys handling the lawsuits as great lawyers whose departments are underfunded and underpaid.
And so the system is rigged, effectively, to immunize Amazon from antitrust scrutiny, at least in by private complainants,” Singer said.
Antitrust cases can move fasterAccording to Thorne, sufficient funding for antitrust cases could ensure they don't drag out so long that they're no longer relevant to consumers.
“Closely related to resources is how long it takes to get an antitrust trust case to trial,” Thorne said.
(Photo by Graeme Jennings-Pool/Getty Images)Google faces three antitrust lawsuits; one filed in October by the DOJ and 11 states attorneys general; and two others filed in December by coalitions of state attorneys general.",https://finance.yahoo.com/news/doj-states-lack-funds-to-police-big-tech-antitrust-violations-witness-202459535.html,2021-02-25 00:00:00
89,AMZN,"Should Amazon Try To Acquire Alibaba, Jumia Or eBay In 2021?","Every week, Benzinga conducts a survey to collect sentiment on what traders are most excited about, interested in or thinking about as they manage and build their personal portfolios.

This week we posed the following question to over 500 traders and investors as to whether Amazon.com, Inc. (NASDAQ: AMZN) should buy another e-commerce company:

Over the next year, should Amazon buy Alibaba, Jumia or eBay?

Alibaba Group Holding Ltd - ADR (NYSE: BABA)

Jumia Technologies AG - ADR (NYSE: JMIA)

eBay Inc (NASDAQ: EBAY)

Buy None

As one of the world’s highest-grossing e-commerce platforms, Amazon is more than retail services alone: streams of revenue for the tech giant also include Kindle, Audible and Music subscriptions as well as its IT service management subsidiary AWS.

See also: How to Buy Amazon Stock

Amazon’s main revenue streams are online product and digital media sales, Amazon Web Services cloud computing, storage and database services, Prime membership fees and other subscription-based services product sales at Whole Foods and other physical store retail formats, and advertising services and co-branded credit cards.

Amazon’s market cap comes in at nearly $1.7 trillion, more than twice Alibaba ($712 billion), eBay ($40 billion) and Jumia’s ($5 billion) market caps combined.

Twenty-six percent of traders and investors believe Amazon should try to acquire Alibaba in 2021.

Alibaba operates China's most-visited online marketplaces: the consumer-to-consumer driven Taobao and business-to-consumer focused Tmall.

Many respondents stated that, although Alibaba is less than familiar in America, the Chinese e-commerce company has a global footprint and the acquisition also has the potential to provide exponential reach for Amazon sellers.

An Amazon-Alibaba M&A would undoubtedly further develop Amazon’s international footprint and enhance economies of scale.

See Also: How To Buy Alibaba Stock.

Around 20% of respondents told us Amazon would be best served completing an M&A deal with eBay by the end of 2021.

Story continues

According to Benzinga readers, the eBay acquisition could be the missing piece for Amazon. An eBay-interwoven auction feature, along with Amazon's warehouse offerings, gives the e-commerce giant the potential to go full spectrum with its ability to service consumers of brand new and secondhand goods.

Twenty-six percent see Jumia as the best fit for a 2021 M&A deal.

A number of respondents told us Jumia is the smallest market cap in an early developing market, and a low-risk aquisition for Amazon. One respondent cited e-commerce retail data by Brookings, which said that “Africa is home to roughly 1.2 billion consumers today, projected to increase to 1.7 billion by 2030. The potential for future growth in retail and consumer spending is, therefore, bright.”

Finally, 40% of respondents believe Amazon should not move forward with an M&A deal in 2021.

Many respondents noted Amazon should instead focus on execution in their current offerings, and were concerned that the FAANG company is already fast approaching if not already in monopoly territory stateside.

This survey was conducted by Benzinga in February 2021 and included the responses of a diverse population of adults 18 or older.

Opting into the survey was completely voluntary, with no incentives offered to potential respondents. The study reflects results from over 500 adults.

Photo courtesy of Jumia.

See more from Benzinga

© 2021 Benzinga.com. Benzinga does not provide investment advice. All rights reserved.","Amazon’s market cap comes in at nearly $1.7 trillion, more than twice Alibaba ($712 billion), eBay ($40 billion) and Jumia’s ($5 billion) market caps combined.
Twenty-six percent of traders and investors believe Amazon should try to acquire Alibaba in 2021.
Around 20% of respondents told us Amazon would be best served completing an M&A deal with eBay by the end of 2021.
A number of respondents told us Jumia is the smallest market cap in an early developing market, and a low-risk aquisition for Amazon.
Opting into the survey was completely voluntary, with no incentives offered to potential respondents.",https://finance.yahoo.com/news/amazon-try-acquire-alibaba-jumia-125056724.html,2021-02-25 00:00:00
90,AMZN,Apple (AAPL) Could Sell Off to $110,"Dow component Apple Inc. (AAPL) carved a picture-perfect cup and handle pattern after topping out near $140 in September, breaking out just three days before blowing away first quarter 2021 top- and bottom-line estimates in January. Bulls' ecstasy lasted just a few minutes before the stock turned tail, failing the breakout two days later. It followed through to the downside on Thursday, dropping through the 50-day exponential moving average (EMA) for the first time since November.

Key Takeaways Apple failed a cup and handle breakout after beating estimates in January.

The stock is trading below the 50-day EMA for the first time since November.

Price action is now fully engaged in a correction that could last into the second quarter.

The $110 level looks like a logical downside target.

Technically speaking, nothing went wrong because the most bullish price patterns fail a good percentage of the time. And the obvious reason for the failed breakout was also technical in nature, i.e. a natural reaction to overbought readings following superior market gains. However, the stock had almost five months to work off those extremes through time rather than price but failed to do so, exposing hidden weakness that has now come into play.

Sector rotation has affected Apple's 2021 price action as well. Alphabet Inc. (GOOG) is the only member of the FAANG quintet currently engaged in a trend advance, with the so-called Robinhood and Reddit crowds moving on to less-traveled opportunities. This follows the classic market wisdom that big winners in one year often underperform in the following year because they're priced for perfection and need to shake out complacent shareholders.

Not surprisingly, Wall Street consensus on Apple stock has deteriorated in the past year, with a ""Moderate Buy"" rating based upon 19 ""Buy"" and 5 ""Hold"" recommendations. More importantly, two analysts now recommend that shareholders close positions. Price targets currently range from a low of $80 to a Street-high $175, while the stock is set to open Friday's session nearly $20 below the median $150. This depressed placement highlights confusion about the legitimate value of Apple shares.

Tip ""FAANG"" is an acronym that refers to the stocks of five prominent American technology companies: Facebook, Inc. (FB); Amazon.com, Inc. (AMZN); Apple; Netflix, Inc. (NFLX); and Alphabet (formerly known as Google).

Apple Daily Chart (2018 – 2021)

TradingView.com

A 2017 breakout above resistance in the mid-$30s topped out at $58.37 in October 2018, giving way to a steep slide that posted a 52-week low in December. A broad recovery wave reached the prior high in October 2019, triggering an immediate breakout that stalled in the low $80s in February 2020. The pandemic decline tested new support successfully, ahead of a vertical bounce that reached the first quarter peak in June.

The summer rally added nearly 60 points into September and flamed out, generating the bullish pattern that failed after January 2021 earnings. Price action posted two minor warnings ahead of the breakdown. First, the on-balance volume (OBV) accumulation-distribution indicator failed to reach October's all-time high, and second, three upticks into the top failed to generate higher-than-average volume. Even so, neither of these shortcomings set off a strong sell signal.

So what's ahead for Apple? For now, bulls will be watching for a bounce to lift the stock back above the broken 50-day EMA at $131. If that fails, more aggressive sellers could take control and generate downside that tests the lower boundaries of the trading range in place since September. It's instructive to note that the 200-day EMA has lifted to $112, close to the November swing low at $107. It's doubtful that the stock will undercut both of those support levels.

Tip A cup and handle price pattern on a security's chart is a technical indicator that resembles a cup with a handle, where the cup is in the shape of a ""u"" and the handle has a slight downward drift. The cup and handle is considered a bullish signal, with the right-hand side of the pattern typically experiencing lower trading volume. The pattern's formation may be as short as seven weeks or as long as 65 weeks.

The Bottom Line

Apple failed a cup and handle breakout in January and has now sold off to a four-week low, with downside potentially stretching toward the $110 level.

Disclosure: The author held no positions in the aforementioned securities at the time of publication.","Dow component Apple Inc. (AAPL) carved a picture-perfect cup and handle pattern after topping out near $140 in September, breaking out just three days before blowing away first quarter 2021 top- and bottom-line estimates in January.
Key Takeaways Apple failed a cup and handle breakout after beating estimates in January.
And the obvious reason for the failed breakout was also technical in nature, i.e.
Not surprisingly, Wall Street consensus on Apple stock has deteriorated in the past year, with a ""Moderate Buy"" rating based upon 19 ""Buy"" and 5 ""Hold"" recommendations.
The Bottom LineApple failed a cup and handle breakout in January and has now sold off to a four-week low, with downside potentially stretching toward the $110 level.",https://www.investopedia.com/apple-aapl-could-sell-off-to-110-5113284,2021-02-19 15:25:39.575000+00:00
91,AMZN,"Here's what to expect from the Golden Globes as scandal, coronavirus clouds ceremony","The Golden Globes will air this Sunday on NBC, but the award show's glamor is being overshadowed by a recent scandal and the ongoing COVID-19 pandemic that's forced the production to go virtual.

Despite its not so subtle problems, the Globes still offers a window of opportunity for shows and movies that want to capture more viewers. It is also often perceived as a precursor to the annual Academy Awards ceremony, which will take place on April 25 this year.

Netflix's ""The Trial of the Chicago 7"" (NFLX) and Hulu's ""Nomadland"" (DIS) have both received Oscar buzz and are expected to go head-to-head for Best Picture in the drama category. In the comedy category, many critics believe Sacha Baron Cohen's ""Borat"" sequel, which is available to stream on Amazon Prime Video (AMZN), will take home the award — although Disney's ""Hamilton"" might give the cult classic a run for its money

And in a surprising twist, ""Promising Young Woman"" — which received multiple nominations — could walk away with a few wins, including a Best Actress victory for Carey Mulligan. The late Chadwick Boseman, who was posthumously nominated for his performance in Netflix's ""Ma Rainey's Black Bottom,"" could secure Best Actor.

Shrouded in controversy

Netflix's 'Emily in Paris' secured a nomination for Best Musical / Comedy Series (Courtesy: Netflix)

Story continues

The ceremony is taking place against a backdrop of a brewing controversy. The ""L.A. Times"" recently published a scathing exposé on the Hollywood Foreign Press Association (HFPA), a nonprofit which consists of 87 foreign journalists who dole out the annual Golden Globe awards, and found evidence of alleged corruption, bullying, and self-dealing.

According to the report, millions of dollars were paid to HFPA members in the form of expensive junkets, swag and trips. For the fiscal year ending in June 2020, members collected nearly $2 million in payments — more than double the level three years earlier. The details, and the amounts associated with the largesse, were surprising given a coronavirus outbreak that's largely brought the entertainment industry to a grinding halt.

The investigation also revealed that 30 members were flown to Paris to visit the set of the Netflix series ""Emily in Paris"" in 2019. That show went on to secure a nomination for Best Musical / Comedy Series, which had many critics scratching their heads as notable, Black-centric programs like ""I May Destroy You"" and ""Insecure"" were shut out of the running.

Additionally, the investigation noted that out of the 87 members of the HFPA, not one of them is Black. The organization responded in a statement writing, ""We are fully committed to ensuring our membership is reflective of the communities around the world who love film, TV, and the artists inspiring and educating them.""

Many prominent Black figures in the industry were not surprised by the revelation. Director Ava DuVernay responded on Twitter, writing ""[Isn't this] already widely known?""

This content is not available due to your privacy preferences. Update your settings here to see it.

A greater push has been made for diversity in the entertainment industry, with the Oscars recently tweaking their eligibility requirements to establish greater representation and inclusion.

On Friday, Netflix released a first-of-its-kind diversity study which analyzed its movies and TV shows from 2018 to 2019. Although the report showed the streaming giant ""outpacing the industry in hiring women and women of color to direct [its] films"" and has ""achieved gender equality in leading roles across [its] films and series,"" there is still work to be done.

Netflix plans to commit $100 million over the next five years to further promote inclusion, and close the diversity gap. The money will help fund outside organizations that help underrepresented communities find jobs in TV and film.

Alexandra is a Producer & Entertainment Correspondent at Yahoo Finance. Follow her on Twitter @alliecanal8193

Read more:","It is also often perceived as a precursor to the annual Academy Awards ceremony, which will take place on April 25 this year.
According to the report, millions of dollars were paid to HFPA members in the form of expensive junkets, swag and trips.
The details, and the amounts associated with the largesse, were surprising given a coronavirus outbreak that's largely brought the entertainment industry to a grinding halt.
A greater push has been made for diversity in the entertainment industry, with the Oscars recently tweaking their eligibility requirements to establish greater representation and inclusion.
On Friday, Netflix released a first-of-its-kind diversity study which analyzed its movies and TV shows from 2018 to 2019.",https://finance.yahoo.com/news/golden-globes-2021-what-to-expect-as-scandal-coronavirus-clouds-award-show-164936212.html,2021-02-19 15:25:39.575000+00:00
92,AMZN,Coupang Files for IPO as South Korea Heads Into Boom Year,"South Korean e-commerce giant Coupang Corp. filed for an initial public offering in the U.S. that could raise billions of dollars to battle rivals and kick off a record year for IPOs in the Asian country.

The Seoul-based company revealed a surge in net revenue last year to about $12 billion, almost double the $6.3 billion it made in 2019, according to a prospectus filed with the U.S. Securities and Exchange Commission. It also narrowed losses to a net $474.9 million in 2020, from a loss of about $699 million the year before.","South Korean e-commerce giant Coupang Corp. filed for an initial public offering in the U.S. that could raise billions of dollars to battle rivals and kick off a record year for IPOs in the Asian country.
The Seoul-based company revealed a surge in net revenue last year to about $12 billion, almost double the $6.3 billion it made in 2019, according to a prospectus filed with the U.S. Securities and Exchange Commission.
It also narrowed losses to a net $474.9 million in 2020, from a loss of about $699 million the year before.",https://www.bloomberg.com/news/articles/2021-02-12/softbank-backed-e-commerce-giant-coupang-files-for-u-s-ipo,2021-02-12 00:00:00
93,AMZN,Amazon to pay $61.7 million to settle FTC charges that it didn't pay Flex drivers all their tips,"Amazon.com Inc. AMZN, +1.14% agreed to pay more than $61.7 million to settle charges by the Federal Trade Commission, which alleges the ecommerce giant failed to pay Amazon Flex drivers the full amount of tips received over a 2 1/2-year period. The FTC said Amazon only stopped its behavior after the company became aware of an investigation in 2019. ""Rather than passing along 100% of customers' tips to drivers, as it had promised to do, Amazon used the money itself,"" said Daniel Kaufman, Acting Director of the FTC's Bureau of Consumer Protection. ""Our action today returns to drivers the tens of millions of dollars in tips that Amazon misappropriated, and requires Amazon to get drivers' permission before changing its treatment of tips in the future."" Amazon's stock rose 1.7% in morning trading, while the S&P 500 SPX, +0.30% gained 1.6%.","Amazon.com Inc. AMZN, +1.14% agreed to pay more than $61.7 million to settle charges by the Federal Trade Commission, which alleges the ecommerce giant failed to pay Amazon Flex drivers the full amount of tips received over a 2 1/2-year period.
The FTC said Amazon only stopped its behavior after the company became aware of an investigation in 2019.
""Rather than passing along 100% of customers' tips to drivers, as it had promised to do, Amazon used the money itself,"" said Daniel Kaufman, Acting Director of the FTC's Bureau of Consumer Protection.
""Our action today returns to drivers the tens of millions of dollars in tips that Amazon misappropriated, and requires Amazon to get drivers' permission before changing its treatment of tips in the future.""
Amazon's stock rose 1.7% in morning trading, while the S&P 500 SPX, +0.30% gained 1.6%.",https://www.marketwatch.com/story/amazon-to-pay-617-million-to-settle-ftc-charges-that-it-didnt-pay-flex-drivers-all-their-tips-2021-02-02,2021-02-02 00:00:00
