,Ticker,Title,Article,Summary,Link,Date
129,AMZN,IonQ in Talks to Go Public Through Merger with DMY SPAC,"(Bloomberg) -- IonQ is in advanced talks to merge with blank-check company DMY Technology Group Inc. III, according to people with knowledge of the matter, creating one of the first public quantum-computing firms.

The combined company is slated to be worth about $2 billion and a deal is set to be announced in coming weeks, said one of the people, who asked not to be identified because the matter is private. Silver Lake, MSD Partners, Bill Gates’s Breakthrough Energy and an affiliate of Hyundai Motor Co. are in talks to participate in a so-called strategic private investment in public equity, or PIPE.

Shares of the SPAC surged 15% at 10:24 a.m. in New York.

DMY Technology is discussing raising additional equity from institutional investors, and new equity from strategic and institutional investors is set to total around $300 million, one of the people said. Existing IonQ investors are expected to roll their equity into the transaction, according to one of the people.

As with any deal that hasn’t been finalized, it’s possible terms change or talks fall apart. Representatives for IonQ and DMY declined to comment, as did spokesmen for Silver Lake and MSD Partners. Representatives of Hyundai and Breakthrough Energy Ventures didn’t immediately respond to requests for comment.

The SPAC, led by Chairman Harry You and Chief Executive Officer Niccolo De Masi, raised $300 million in November and said at the time it would pursue a target in consumer technology.

College Park, Maryland-based IonQ was founded in 2015 by Chris Monroe and Jungsang Kim and is led by CEO Peter Chapman. Its investors include Amazon Web Services, Samsung Catalyst Fund, GV (formerly known as Google Ventures), NEA, Lockheed Martin Corp., Airbus Ventures and Robert Bosch Venture Capital GmbH. IonQ in October unveiled what it describes as the world’s most powerful quantum computer.

Quantum has long been touted as the next frontier in technology. Such computers would be capable of simulating and understanding phenomena in the natural world instantly and providing the basis for systems that are unhackable. Intel Corp. and Microsoft Corp., among other companies, are also working to advance quantum computing. The technology also has potential implications for producing new materials or creating new drugs.

Story continues

(Updates share price in third paragraph.)

For more articles like this, please visit us at bloomberg.com

Subscribe now to stay ahead with the most trusted business news source.

©2021 Bloomberg L.P.","(Bloomberg) -- IonQ is in advanced talks to merge with blank-check company DMY Technology Group Inc. III, according to people with knowledge of the matter, creating one of the first public quantum-computing firms.
Silver Lake, MSD Partners, Bill Gates’s Breakthrough Energy and an affiliate of Hyundai Motor Co. are in talks to participate in a so-called strategic private investment in public equity, or PIPE.
DMY Technology is discussing raising additional equity from institutional investors, and new equity from strategic and institutional investors is set to total around $300 million, one of the people said.
Existing IonQ investors are expected to roll their equity into the transaction, according to one of the people.
Representatives for IonQ and DMY declined to comment, as did spokesmen for Silver Lake and MSD Partners.",https://finance.yahoo.com/news/ionq-talks-public-merger-dmy-013246263.html,2021-02-17 00:00:00
130,AMZN,Amazon’s Lack of Public Disclosure on SolarWinds Hack Angers Lawmakers,"As lawmakers and security researchers continue to unravel the SolarWinds hack, some are growing more frustrated with Amazon.com Inc., saying the cloud-computing giant should be more publicly forthcoming about its knowledge of the suspected Russian cyberattack.

There are no indications that Amazon’s systems were directly breached, but hackers used its sprawling cloud-computing data centers to launch a key part of the attack, according to security researchers. The operation has been described as one of the worst instances of cyber espionage in the nation’s history.","As lawmakers and security researchers continue to unravel the SolarWinds hack, some are growing more frustrated with Amazon.com Inc., saying the cloud-computing giant should be more publicly forthcoming about its knowledge of the suspected Russian cyberattack.
There are no indications that Amazon’s systems were directly breached, but hackers used its sprawling cloud-computing data centers to launch a key part of the attack, according to security researchers.
The operation has been described as one of the worst instances of cyber espionage in the nation’s history.",https://www.wsj.com/articles/amazons-lack-of-public-disclosure-on-solarwinds-hack-angers-lawmakers-11614258004,2021-02-17 00:00:00
131,AMZN,"Charting a bull-trend pullback, S&P 500 holds 50-day average (again)","U.S. stocks are mixed early Friday, vacillating as a late-month market whipsaw persists.

Against this backdrop, the major U.S. benchmarks remain in divergence mode — amid uneven price action — though the bigger-picture technical backdrop remains bullish, on balance.

Before detailing the U.S. markets’ wider view, the S&P 500’s US:SPX hourly chart highlights the past two weeks.

As illustrated, the S&P has violated its breakout point (3,870) notching its first close lower since Feb. 3.

Delving deeper, the 3,830 support is followed by the 50-day moving average, currently 3,809. A retest remains underway early Friday.

Meanwhile, the Dow Jones Industrial Average US:DJIA remains the strongest major benchmark.

Still, the index has reversed sharply from its mid-week record high, selling off to the former range.

Recall that major support matches the former breakout point (31,272) an area also detailed on the daily chart.

Perhaps not surprisingly, the Nasdaq Composite US:COMP remains the weakest major benchmark.

This is the lone widely-tracked U.S. benchmark to violate its 50-day moving average, currently 13,299.

Still, the index has thus far maintained last-ditch support (12,973), an area also illustrated below.

Widening the view to six months adds perspective.

On this wider view, the Nasdaq has extended a downdraft from recent record highs.

In the process, the index has violated its breakout point (13,729), and the 50-day moving average, across just four sessions.

Delving deeper, recall that last-ditch support matches the 2020 peak (12,973) — and the late-January low (12,985) — the area from which the prior leg higher originates.

An eventual violation would mark a material “lower low” raising a technical caution flag. The Nasdaq’s intermediate-term bias remains guardedly bullish, based on today’s backdrop.

Looking elsewhere, the Dow Jones Industrial Average has whipsawed to conclude February.

The initial bull-flag breakout — to tag the 32,000 mark — has been punctuated by a swift reversal to the former range.

Though downside momentum can accelerate — and the Dow is respectably lower early Friday — its prevailing backdrop remains comfortably bullish.

Meanwhile, the S&P 500 has extended a pullback from record highs.

Tactically, the 3,830 support is followed by the ascending 50-day moving average, currently 3,809.

Thursday’s close (3,829.3) roughly matched support.

The bigger picture

Collectively, a respectable late-month downturn remains in play, though in characteristically uneven form.

Against this backdrop, selling pressure has been concentrated in large-cap technology names, a group that has borne the brunt of surging Treasury yields. The group’s generally higher valuations are more difficult to justify in a rising-rate environment.

Nonetheless, each big three benchmark’s intermediate-term bias remains bullish, based on today’s backdrop.

Moving to the small-caps, the iShares Russell 2000 ETF US:IWM is digesting the strongest early-month breakout.

Tactically, a retest of trendline support and the breakout point (216.70) remains underway.

Similarly, the SPDR S&P MidCap 400 ETF US:MDY remains in healthy consolidation mode.

The mid-cap benchmark tagged a mid-week record high, and has subsequently pulled in.

Looking elsewhere, the SPDR Trust S&P 500 US:SPY has extended a pullback from all-time highs.

The violation of its breakout point (385.40) has been fueled by a volume spike.

Placing a finer point on the S&P 500, the index has violated its breakout point (3,870).

The prevailing downturn punctuates a failed mid-week retest of the range top (3,931).

More broadly, the S&P 500 has registered its second consecutive late-month downdraft. Recall that the late-January downturn punctuated a shaky retest of major support.

From current levels, the 3,830 support is followed by the ascending 50-day moving average, currently 3,809.

Delving deeper, and as detailed repeatedly, likely last-ditch support points match the 3,723 area and the late-January low (3,694). (The Nasdaq has thus far maintained its corresponding last-ditch support.)

Beyond technical levels, the U.S. sub-sector backdrop remains constructive, as partly detailed in the next section.

The S&P 500’s intermediate-term bias remains bullish, based on today’s backdrop.

Friday’s Watch List

The charts below detail names that are technically well positioned. These are radar screen names — sectors or stocks poised to move in the near term. For the original comments on the stocks below, see The Technical Indicator Library.

Drilling down further, the 10-year Treasury note yield XX:TNX has taken flight amid what is likely the most consequential February price action.

This week’s aggressive follow-through has been punctuated by a 52-week high. Recall that the prevailing upturn originates from gap support precisely matching the marquee 1.00% mark. (See the late-January low.)

Tactically, the former breakdown point matches the 2016 low (1.34) and pivots to a notable floor.

Conversely, an overhead inflection point, circa 1.67, is followed by the 2017 low (2.03). (See the five-year chart.)

More broadly, the prevailing breakout confirms the yield’s late-2020 trend shift, detailed repeatedly.

Charting the traditional sectors leaders: Selling pressure largely localized

Moving to U.S. sectors, the prevailing backdrop remains bullish-leaning, if not outright bullish. Quickly consider the traditional sectors leaders: the financials, transports and technology sector.

To start, the Financial Select Sector SPDR US:XLF is digesting a sharp rally to all-time highs, rising at least partly amid surging Treasury yields.

Recall that a target projects from the former range to the 33.50 area, detailed previously. (See the Feb. 16 review.)

The February closing peak (33.55) has matched the target, and a consolidation phase is underway. Tactically, the breakout point (31.70) pivots to notable support.

Similarly, the iShares Transportation Average ETF US:IYT is digesting a break to record territory.

Recent strength has been fueled by progressively increased volume and a thus far tame downturn from this week’s record high.

More broadly, recall that the prevailing upturn originates from major support — the 212.80-to-214.50 area — detailed previously. (See the Jan. 26 review.)

The January low (212.80), established Jan. 29, precisely matched last-ditch support.

From current levels, the mid-month breakout point, circa 232.00, pivots to first support.

Meanwhile, the PowerShares QQQ Trust US:QQQ — a large-cap technology sector proxy — tracks the Nasdaq 100 Index.

The chart above exemplifies perhaps the strongest bear-case argument.

Technically, a recent violation of trendline support has accelerated amid increased volume.

Downside follow-through places the shares under the 50-day moving average, currently 320.00, and the breakout point (315.30). This marks the first close under the 50-day moving average since Nov. 3, consistent with an intermediate-term trend shift.

So collectively, the shares have reached caution-zone territory, detailed previously. A reversal atop the 50-day moving average would place the brakes on bearish momentum.

Delving deeper, likely last-ditch support matches the September peak (303.50), a level defining the mid-2020 range top.

Beyond the sector leaders

Beyond the sector leaders, price action elsewhere remains largely constructive. Two groups exemplify the backdrop:

To start, the Energy Select Sector SPDR US:XLE is digesting a break to 52-week highs.

The group has reached a projected target in the 50 area — detailed previously — and a consolidation phase is underway.

Recall that the tandem energy sector and transports strength is consistent with a reflation trade, an expected return to pre-virus economic conditions.

Meanwhile, the Industrial Select Sector SPDR US:XLI has sustained a break to record highs.

Recall that the group is also well positioned on the three-year chart, rising from a continuation pattern hinged to the 2020 V-shaped reversal.

Tactically, the breakout point — the 90.30-to-90.50 area — pivots to notable support.

Summing up the sector backdrop

Collectively, the groups detailed signal a still bullish-leaning U.S. sub-sector backdrop.

But to be sure, large-cap technology sector weakness can present a genuine market headwind.

Combined, Apple, Alphabet, Amazon, Facebook and Microsoft account for about 22% of the S&P 500.

Nonetheless, the prevailing selling pressure remains relatively narrow as it applies to the sub-sector backdrop. (Also see recent small- and mid-cap resilience.)

Bellwether technology names reach key thresholds

Speaking of influential large-cap technology names, three key tests are currently in play. Quickly consider the backdrops of Apple, Facebook and Amazon.

To start, Apple, Inc. US:AAPL has ventured under key support detailed previously.

Recall that major support holds in the 125.00-to-125.40 area, levels matching the 100-day moving average and the breakout point.

Wednesday’s close (125.35) matched support, and has been punctuated by downside follow-through, though amid not-so-spectacular volume.

Apple has initially maintained a deeper floor at the 120.00 mark.

Tactically, Friday’s close marks a weekly and monthly close. A Friday close under the 125 area would mark consecutive closes under major support — as well as a monthly close lower — raising a caution flag.

(Also see the Feb. 19 review and Feb. 23 review for added detail.)

Meanwhile, Facebook, Inc. US:FB has ventured slightly under its 200-day moving average, currently 259.54, a widely-tracked longer-term trending indicator.

Tactically, a deeper inflection point, circa 244.60, matches the January low.

Conversely, the 50-day moving average, currently 267.35, has marked an overhead inflection point. A reversal atop the 50-day would place the shares on firmer technical ground.

Finally, Amazon.com US:AMZN has reached a potentially more consequential technical test.

Specifically, the shares have ventured under major support matching the range bottom (3,086.00) and the 200-day moving average, currently 3,077.30.

The prevailing retest — across potentially the next several sessions — will likely add color.

Here again, the 50-day moving average, currently 3,231.50, has marked an overhead inflection point. A reversal higher would place the brakes on bearish momentum.

Still well positioned

The table below includes names recently profiled in The Technical Indicator that remain well positioned. For the original comments, see The Technical Indicator Library.","This is the lone widely-tracked U.S. benchmark to violate its 50-day moving average, currently 13,299.
In the process, the index has violated its breakout point (13,729), and the 50-day moving average, across just four sessions.
Downside follow-through places the shares under the 50-day moving average, currently 320.00, and the breakout point (315.30).
This marks the first close under the 50-day moving average since Nov. 3, consistent with an intermediate-term trend shift.
A reversal atop the 50-day moving average would place the brakes on bearish momentum.",https://www.marketwatch.com/story/charting-a-bull-trend-pullback-sp-500-holds-50-day-average-again-2021-02-26,2021-02-26 00:00:00
132,AMZN,India’s Future Retail Processes Dollar Bond Interest Payment,"Indebted Indian retailer Future Retail Ltd. has processed a dollar bond interest payment originally due Jan. 22. The company’s notes and shares surged on the news.

The interest payment “has been processed at our end,” a Future Group spokesperson said when asked about the issue by Bloomberg News.","Indebted Indian retailer Future Retail Ltd. has processed a dollar bond interest payment originally due Jan. 22.
The company’s notes and shares surged on the news.
The interest payment “has been processed at our end,” a Future Group spokesperson said when asked about the issue by Bloomberg News.",https://www.bloomberg.com/news/articles/2021-02-19/indebted-future-retail-processes-dollar-bond-interest-payment,2021-02-19 00:00:00
133,AMZN,Why Shopify Stock Dropped Today,"What happened

Shares of Shopify (NYSE:SHOP) fell 6% on Tuesday after the online retail platform announced a public stock offering.

So what

Shopify will sell 1.18 million shares to investors at a price of $1,315 per share. The sale price was set approximately 5% below Shopify's closing price on Monday, and its shares fell in kind.

The e-commerce company expects to raise roughly $1.5 billion from the stock sale. Shopify intends to use the proceeds to bolster its balance sheet and fund its growth initiatives. The offering is expected to close on Feb. 25.

Now what

It will be interesting to see how Shopify deploys its newfound cash. E-commerce juggernaut Amazon.com (NASDAQ:AMZN) recently acquired Selz, a company that helps businesses launch their own online stores. The move suggests Amazon may be planning to compete more directly with Shopify.

Online store creation is an area that Amazon ceded to Shopify back in 2015. But after watching Shopify grow at a torrid clip since then, Amazon is likely regretting that decision.

Shopify may be raising capital as a pre-emptive move. The cash could allow it to make an acquisition of its own, as a means to strengthen its defenses against Amazon's potential advances.","What happenedShares of Shopify (NYSE:SHOP) fell 6% on Tuesday after the online retail platform announced a public stock offering.
The sale price was set approximately 5% below Shopify's closing price on Monday, and its shares fell in kind.
The e-commerce company expects to raise roughly $1.5 billion from the stock sale.
Online store creation is an area that Amazon ceded to Shopify back in 2015.
But after watching Shopify grow at a torrid clip since then, Amazon is likely regretting that decision.",https://www.fool.com/investing/2021/02/23/why-shopify-stock-dropped-today/,2021-02-23 00:00:00
134,AMZN,"UPS addresses 'elephant in the room,' as Amazon accounted for more than $11 billion in 2020 revenue","United Parcel Service Inc. UPS, +1.14% surged 3.7% in morning trading, enough to pace the Dow Jones Transportation Average's DJT, -0.09% gainers, after the package delivery giant reported earlier better-than-expected fourth-quarter results. In the post-earnings conference call with analysts, Chief Executive Carol Tomé said, ""So let's just address the elephant in the room, which is our largest customer."" Out of 19 million customers, Tomé said Amazon.com Inc. AMZN, +1.14% was the largest, with the ecommerce giant's share of total revenue rising to 13.3% in 2020 from 11.6% in 2019. With UPS reported total 2020 revenue of $84.63 billion, that indicates Amazon accounted for $11.26 billion in 2020 revenue, up from $8.59 billion a year ago. UPS shares have gained 1.6% over the past three months, while Amazon's stock has advanced 13.9%, the Dow transports have tacked on 10.8% and the Dow Jones Industrial Average DJIA, -0.00% has climbed 13.4%.","United Parcel Service Inc. UPS, +1.14% surged 3.7% in morning trading, enough to pace the Dow Jones Transportation Average's DJT, -0.09% gainers, after the package delivery giant reported earlier better-than-expected fourth-quarter results.
In the post-earnings conference call with analysts, Chief Executive Carol Tomé said, ""So let's just address the elephant in the room, which is our largest customer.""
Out of 19 million customers, Tomé said Amazon.com Inc. AMZN, +1.14% was the largest, with the ecommerce giant's share of total revenue rising to 13.3% in 2020 from 11.6% in 2019.
With UPS reported total 2020 revenue of $84.63 billion, that indicates Amazon accounted for $11.26 billion in 2020 revenue, up from $8.59 billion a year ago.
UPS shares have gained 1.6% over the past three months, while Amazon's stock has advanced 13.9%, the Dow transports have tacked on 10.8% and the Dow Jones Industrial Average DJIA, -0.00% has climbed 13.4%.",https://www.marketwatch.com/story/ups-addresses-elephant-in-the-room-as-amazon-accounted-for-more-than-11-billion-in-2020-revenue-2021-02-02,2021-02-02 00:00:00
