,Ticker,Title,Article,Summary,Link,Date
0,AMZN,Why Amazon Stock Is Due For a Breakout Now,"On October 20, the man who recommended Google before anyone else will reveal his #1 stock pick for 2022 — for FREE — ticker symbol and all — in a special presentation.","On October 20, the man who recommended Google before anyone else will reveal his #1 stock pick for 2022 — for FREE — ticker symbol and all — in a special presentation.",https://investorplace.com/2021/02/amzn-why-amazon-stock-is-due-for-a-breakout-now/,2021-02-23 12:45:19+00:00
1,AMZN,Why Is Everyone Talking About Amazon Stock?,"Amazon (NASDAQ:AMZN) is a perfect example of how investors can find wealth-building investments right under their noses. The e-commerce giant has become a household name, with more than 150 million Prime members and $386 billion in annual sales. Despite its immense size, Amazon keeps delivering market-beating returns to investors.

Amazon is now sporting a market capitalization of $1.6 trillion and its stock has delivered a return of nearly 500% over the last five years. Given its size, some might suggest the company has finally reached the top and will begin to level out. And yet the company continues to reinvest its profits in pursuit of abundant growth opportunities.

What's going on here?

Stretching its lead

The first thing that jumps out about Amazon is that, while it's a large business, it continues to grow like a small one. In 2020, sales accelerated to a 38% growth rate, up from a still-robust 20% growth rate in 2019. And there isn't any sign that this momentum is waning.

One of Amazon's biggest advantages over the competition is logistics. At the end of 2020, the company had a massive 390 million square feet of fulfillment facilities and data centers. That's more than double its square footage in 2017. Management reported during its fourth-quarter earnings call that its square footage grew about 50% during the last year.

Amazon is going to need the extra capacity since Prime members continue to shop more frequently than before the pandemic. This led to a further acceleration in sales growth during the holiday quarter, reaching 44% year over year.

The investment in fulfillment capacity not only leads to greater product selection and shipping efficiency, all of which keeps customers satisfied, but it also sets up Amazon for big profits down the road. Once a new fulfillment center is built, there's limited extra expense to keep it running, which means more incremental sales can be converted into a profit. This explains why the acceleration in sales during the holiday quarter contributed to a whopping 77% increase in operating income.

Retail dominance is only part of the story

Amazon might have surprised some investors with the announcement that founder Jeff Bezos will step down as CEO in the third quarter of 2021, but nothing fundamental about the company is likely to change. Bezos will still be actively involved in making critical decisions about Amazon's future, so the news is actually a signal of how great the company's future looks.

Handing the CEO reins to Andy Jassy, who is currently head of Amazon Web Services (AWS), makes sense because technology is at the heart of Amazon. AWS continues to gain business from corporations looking to expand their use of cloud services. While retail is the core of Amazon's business, it's just as much a cloud company as anything else.

One analyst estimated the value of AWS alone at $500 billion, but that was in 2019 and AWS has continued to grow at high rates. Still, that puts the value of AWS at nearly one-third of the whole Amazon pie, based on the company's current market capitalization.

Digital entertainment is another area that is starting to account for a greater percentage of Amazon's value to investors. Last year, Needham analyst Laura Martin estimated that Amazon's media assets -- including Prime Video, Prime Music, and Twitch, the popular video game streaming site -- were worth another $500 billion.

The growing value of these digital entertainment offerings reflects a wide competitive moat in the retail business. Amazon lured millions of customers in with free two-day shipping and has used things like Echo devices and free streaming to keep customers locked into a sticky ecosystem of services. Once you're a Prime member, it's not easy to cancel, and Amazon is only making it more difficult by adding more perks over time, such as free grocery delivery from Whole Foods.

It's all these reasons why Amazon remains one of the top growth stocks to buy in 2021. Amazon generated $31 billion in free cash flow last year, which will ultimately get reinvested in additional fulfillment centers, as well as digital content and services, all leading to more satisfied customers and happy investors.","Amazon is now sporting a market capitalization of $1.6 trillion and its stock has delivered a return of nearly 500% over the last five years.
This led to a further acceleration in sales growth during the holiday quarter, reaching 44% year over year.
Handing the CEO reins to Andy Jassy, who is currently head of Amazon Web Services (AWS), makes sense because technology is at the heart of Amazon.
Still, that puts the value of AWS at nearly one-third of the whole Amazon pie, based on the company's current market capitalization.
Digital entertainment is another area that is starting to account for a greater percentage of Amazon's value to investors.",https://www.fool.com/investing/2021/02/25/why-is-everyone-talking-about-amazon-stock/,2021-02-25 00:00:00
2,AMZN,Amazon Stock Has Barely Budged. Citi Has 8 Reasons to Buy.,"Amazon.com has been one of the biggest winners in the pandemic era, as shoppers accelerate their adoption of online shopping, and companies shift more of their IT work to public cloud services like Amazon Web Services.

But the stock is oddly dead in the water. Amazon (ticker: AMZN) has appreciated just 3% since hitting the $3,200 level on July 10, a period in which the Nasdaq Composite rallied 30%. Year to date, Amazon shares have barely budged.

That’s...","Amazon.com has been one of the biggest winners in the pandemic era, as shoppers accelerate their adoption of online shopping, and companies shift more of their IT work to public cloud services like Amazon Web Services.
But the stock is oddly dead in the water.
Amazon (ticker: AMZN) has appreciated just 3% since hitting the $3,200 level on July 10, a period in which the Nasdaq Composite rallied 30%.
Year to date, Amazon shares have barely budged.",https://www.barrons.com/articles/amazon-shares-have-barely-budged-since-summer-citi-has-8-reasons-to-be-bullish-51613585191,2021-02-25 00:00:00
3,AMZN,Amazon reports first $100 billion quarter following holiday and pandemic shopping surge,"Amazon announced in its earnings report for the fourth quarter of 2020 that Amazon Web Services CEO Andy Jassy will replace Jeff Bezos as Amazon CEO during the third quarter of this year. Bezos will become executive chairman.

The company also delivered its largest quarter by revenue of all time at $125.56 billion, pushing it past the symbolic $100 billion mark for the first time.

Shares of Amazon were up 1% in extended trading.

Here are the results:

Earnings: $14.09 vs $7.23 per share forecast by Refinitiv

$14.09 vs $7.23 per share forecast by Refinitiv Revenue: $125.56 billion vs $119.7 billion forecast by Refinitiv

Bezos announced his decision to step down in the earnings release and in a memo to employees, noting that he will focus on ""new products and early initiatives"" in his new role, including the Day One Fund, Bezos Earth Fund, The Washington Post and his private space company Blue Origin.

""If you do it right, a few years after a surprising invention, the new thing has become normal. People yawn. That yawn is the greatest compliment an inventor can receive,"" Bezos wrote. ""When you look at our financial results, what you're actually seeing are the long-run cumulative results of invention. Right now I see Amazon at its most inventive ever, making it an optimal time for this transition.""

During a call with investors, Amazon CFO Brian Olsavsky said the company has a ""highly effective"" succession plan in place that will enable a smooth transition for Jassy to take the helm as CEO.

Jassy now has a chance to ""put an imprint on Amazon,"" Olsavsky said, though he noted Bezos won't be far away from the company in his new role as executive chairman.

""I will reiterate that Jeff is not leaving. He is getting a new job,"" Olsavsky said. ""He will be involved in many large one-way-door issues, as we say, one-way doors meaning the more important decisions things like acquisitions, things like strategies, and going into grocery and other things.

""So, Jeff's always been involved with that, and that's where we'll keep his time focused on,"" he added.

After several months of heavy investments, Amazon said it expects coronavirus-related costs to decelerate to about $2 billion in the first quarter of fiscal 2021, down from roughly $4 billion in the third quarter of this year and more than $2 billion in the second quarter.

Olsavsky attributed the step down in Covid costs to a shift in volume. ""We're expecting volumes to drop about 25% from Q4 to Q1,"" he added.

The company also experienced higher costs in the fourth quarter after it paid a one-time $300 bonus to front-line employees in November of last year.

The company forecast operating income of $3 billion to $6.5 billion in the fiscal first quarter, assuming the roughly $2 billion of costs related to Covid-19.

Amazon said sales in the first quarter will be between $100 billion and $106 billion, a slowdown from the fourth quarter of 2020, but an increase of between 33% and 40% from a year earlier. Analysts were expecting revenue of $95.8 billion.

Amazon's blockbuster fourth-quarter results were driven in part by what the company called a ""record-breaking holiday season,"" during which it delivered more than a billion products to shoppers worldwide. Continued accelerated e-commerce demand and a pandemic-delayed Prime Day also contributed to Amazon's record revenue in the quarter.

The company has gone on a hiring spree in order to keep up with the demand spike. Amazon said it hired 175,000 new full- and part-time employees in the fourth quarter alone, which is more than triple the 50,000 employees it hired in the year-ago period. Amazon now counts nearly 1.3 million employees across the globe, an increase of 63% year over year.

Once again, the costs of shipping goods to consumers ticked higher, with expenses up 67% from a year earlier to $21.5 billion.

Outside of its core retail business, Amazon's cloud-computing unit saw its revenue climb 28% to $12.7 billion from $9.95 billion a year earlier. That fell short of Wall Street's expectations of $12.83 billion.

Amazon doesn't break out the performance of its advertising business, but that makes up the majority of its ""other"" category, which brought in $7.9 billion in revenue for the quarter. That's an increase of 64% from a year ago, which Olsavsky said was primarily driven by a resurgence in ad spending and Prime Day.

Sales fell 8% in Amazon's physical store unit, which includes Whole Foods Market, as the pandemic has pushed shoppers to experiment with new shopping methods, including online grocery ordering.","Amazon announced in its earnings report for the fourth quarter of 2020 that Amazon Web Services CEO Andy Jassy will replace Jeff Bezos as Amazon CEO during the third quarter of this year.
The company also delivered its largest quarter by revenue of all time at $125.56 billion, pushing it past the symbolic $100 billion mark for the first time.
The company forecast operating income of $3 billion to $6.5 billion in the fiscal first quarter, assuming the roughly $2 billion of costs related to Covid-19.
Amazon said sales in the first quarter will be between $100 billion and $106 billion, a slowdown from the fourth quarter of 2020, but an increase of between 33% and 40% from a year earlier.
Outside of its core retail business, Amazon's cloud-computing unit saw its revenue climb 28% to $12.7 billion from $9.95 billion a year earlier.",https://www.cnbc.com/2021/02/02/amazon-amzn-earnings-q4-2020.html,2021-02-02 00:00:00
4,AMZN,"Silver, GameStop, Amazon, Australian Wine: Investments in the Spotlight","After a wild ride, calm returned to the silver market.

Prices surged earlier in the week as retail investors on internet platforms like Reddit targeted the metal, sending it to an eight-year high. This followed a weekend buying binge that saw an increase in demand for physical coins and bars, overwhelming some dealers. Silver mining stocks also rose.","After a wild ride, calm returned to the silver market.
Prices surged earlier in the week as retail investors on internet platforms like Reddit targeted the metal, sending it to an eight-year high.
This followed a weekend buying binge that saw an increase in demand for physical coins and bars, overwhelming some dealers.
Silver mining stocks also rose.",https://www.bloomberg.com/news/articles/2021-02-05/silver-gamestop-gme-amc-amazon-amzn-australian-wine-investments-bets,2021-02-05 00:00:00
5,AMZN,"Amazon’s Andy Jassy Inherits an Empire of Drones, Games, and More","LISTEN TO ARTICLE 2:36 SHARE THIS ARTICLE Share Tweet Post Email

When Jeff Bezos steps down as chief executive officer of Amazon.com Inc., he’ll leave his successor, Andy Jassy, a sprawling empire of giant businesses and moonshot experiments. Here are some of the $1.7 trillion company’s most ambitious projects.

The Amazon Luna video game controller. Source: Amazon

Video games

Amazon Game Studios has been churning through almost $500 million a year trying to develop blockbuster games. So far, none has been a hit, Bloomberg reported in January. In early February, Jassy said he’s still committed to the gaming business.

Groceries

Not content after acquiring Whole Foods Market, Amazon launched a lower-cost grocer, Amazon Fresh, opening its first stores in California and Illinois last year. The company is also scaling up its already-booming food delivery operation.

Concept for Amazon’s new headquarters in Arlington, Va. Photographer: Courtesy Amazon

HQ2

Amazon is building its second headquarters in Arlington, Va., centered on an ice-cream-cone-shaped, plant-filled workspace. It’s a region Jassy knows well: The cloud unit he ran has a cluster of data centers and corporate offices in Northern Virginia.

Rachel Brosnahan stars in Amazon’s The Marvelous Mrs. Maisel. Photographer: Alamy

Amazon Studios

Amazon has gone Hollywood, spending billions to compete with Netflix Inc. for shows and movies. Unlike Bezos, Jassy isn’t known for frequenting industry galas, but like his boss, he recently bought a Los Angeles-area mansion.

A Prime Air private trial ground drone. Photographer: Courtesy Amazon

Drones

Bezos predicted that Amazon would be delivering packages by drone in 2018. Three years after that deadline, the company has advanced its drone technology, but the flotilla isn’t operational yet.

Health care

Amazon started an online pharmacy and has opened neighborhood clinics for employees. Analysts expect even bigger moves. CNBC reported that a skunk works R&D team under Jassy even set a goal of curing the common cold.

An Amazon delivery van. Photographer: Getty Images

E-commerce

Amazon’s warehouse footprint, formerly relegated to the exurbs and transportation hot spots, is growing. The company is said to have plans to add more than 1,000 delivery hubs, stitched together by cargo jets and thousands of trucks.

A flying camera from Ring, Amazon’s smart-home security division. Photographer: Courtesy Amazon

Digital helpers

Amazon is working to shore up its position in the market for home technology devices, rolling out flying home-security cameras, a proprietary low-power wireless network, and, perhaps someday, a home robot.

The cloud

Amazon’s cloud division, the source of most of the company’s profit, is expected to rake in almost $58 billion in revenue this year, more than four times the total in 2016. Jassy has led the unit since its founding.","Source: AmazonVideo gamesAmazon Game Studios has been churning through almost $500 million a year trying to develop blockbuster games.
Photographer: Courtesy AmazonHQ2Amazon is building its second headquarters in Arlington, Va., centered on an ice-cream-cone-shaped, plant-filled workspace.
Photographer: Courtesy AmazonDronesBezos predicted that Amazon would be delivering packages by drone in 2018.
An Amazon delivery van.
Photographer: Courtesy AmazonDigital helpersAmazon is working to shore up its position in the market for home technology devices, rolling out flying home-security cameras, a proprietary low-power wireless network, and, perhaps someday, a home robot.",https://www.bloomberg.com/news/articles/2021-02-12/amazon-s-amzn-andy-jassy-will-take-over-jeff-bezos-s-moonshot-businesses,2021-02-12 00:00:00
6,AMZN,Why Is Amazon's Stock So Expensive?,"At roughly $3,300 a share, Amazon's (NASDAQ:AMZN) stock price looks expensive, but you can't judge a stock by its price alone. Another way to think about buying a stock is to think about what you would have to pay to own the whole company (assuming you could).

Amazon's current market capitalization is $1.67 trillion. That is what you would have to pay to buy all of Amazon's shares outstanding at their current stock price. That too looks expensive, but it actually may not be when you factor in the company's earnings potential. That high market cap is a reflection of investor confidence that Amazon will grow revenue to levels in line with its overall value.

We all want to see our stocks go up in value over time. But for investors to make a good return on Amazon stock from these levels, the company will need to generate yearly revenue that is reasonable in relation to its current market cap.

Does Amazon have what it takes to generate multi-trillions a year in revenue down the road?

E-commerce tailwind

Amazon has delivered extraordinary growth since its founding in the 1990s, and it still has opportunities to keep the momentum going. While Amazon hasn't been successful at everything it's tried (e.g., the Amazon Fire Phone), the e-commerce giant has stretched its tentacles successfully into several markets, including streaming video, grocery delivery, and cloud services, and it's still in the early stages of growth in all these markets.

In 2020, Amazon generated a massive $386 billion in net revenue, with 12% of that coming from the Amazon Web Services cloud business. Most impressive is that Amazon's core retail business is still going strong domestically, posting a year-over-year sales increase of 40% in North America in the fourth quarter, which is not far off the pace of international sales, which increased by 57%.

The company got a huge boost from stay-at-home shoppers during the pandemic. Data from the U.S. Department of Commerce shows that total retail e-commerce sales grew 37% in the third quarter, representing a sharp acceleration from pre-pandemic trends. Even with so many people turning to online shopping last year, e-commerce still only made up about 13.5% of all retail sales in the U.S. during the third quarter. It may take decades before e-commerce becomes a more meaningful percentage, providing Amazon a long runway of growth.

With this much opportunity, Amazon could easily generate more than $1 trillion in net yearly revenue at some point, which makes its current market cap look less expensive.

Management reported on the fourth-quarter conference call that Prime customers, who total more than 150 million, continue to shop with greater frequency and across more categories than before the pandemic. Prime members are also engaging more with digital perks, such as Prime Video and Amazon Music, making them more loyal customers.

Amazon has built a powerful flywheel of growth by blending physical store experiences, such as Whole Foods and Amazon GO stores, with the perks that come with a Prime membership.

The company still has plenty of growth potential with its core retail business, but investors also love Amazon for its leading market share position in cloud infrastructure services.

If you're thinking of buying Amazon stock, you need to be aware that Amazon Web Services (AWS) made up most of Amazon's operating profit last year. AWS is now a $51 billion annual run rate business that is generating healthy margins. More organizations continue to shift their data systems from on-premise servers to the cloud, which sent AWS sales up 28% year over year in the fourth quarter.

Expensive or priced about right?

The increasing profit contribution from AWS is one reason why Amazon's stock price has surged more than 500% over the last five years. But about half of that return also came from a near doubling in the stock's price-to-sales multiple.

Compared to other top e-commerce stocks, such as Etsy and Shopify, the online retail giant offers relatively good value. Amazon is cheaper based on price-to-sales and price-to-earnings ratios, and is No. 2 among the three when valued on free cash flow.

Some investors may wonder if Amazon stock is still a good buy since founder Jeff Bezos will be stepping down as CEO in the third quarter to transition to the role of executive chair. Amazon is a well-oiled machine at this point, so investors shouldn't notice any changes in the company's performance.

Moreover, Bezos will still have an active role in overseeing the company and still owns a stake worth around $200 billion.

With so much opportunity ahead in e-commerce globally, Amazon remains a top growth stock to consider.","At roughly $3,300 a share, Amazon's (NASDAQ:AMZN) stock price looks expensive, but you can't judge a stock by its price alone.
That is what you would have to pay to buy all of Amazon's shares outstanding at their current stock price.
If you're thinking of buying Amazon stock, you need to be aware that Amazon Web Services (AWS) made up most of Amazon's operating profit last year.
The increasing profit contribution from AWS is one reason why Amazon's stock price has surged more than 500% over the last five years.
With so much opportunity ahead in e-commerce globally, Amazon remains a top growth stock to consider.",https://www.fool.com/investing/2021/02/19/why-is-amazons-stock-so-expensive/,2021-02-19 00:00:00
7,AMZN,"4 Top Stock Trades for Thursday: AMZN, SPOT, BMY, ABBV","On October 20, the man who recommended Google before anyone else will reveal his #1 stock pick for 2022 — for FREE — ticker symbol and all — in a special presentation.","On October 20, the man who recommended Google before anyone else will reveal his #1 stock pick for 2022 — for FREE — ticker symbol and all — in a special presentation.",https://investorplace.com/2021/02/4-top-stock-trades-for-thursday-amzn-spot-bmy-abbv/,2021-02-04 00:00:00
8,AMZN,"Amazon gets first $5,000+ stock price target, and Alphabet gets first $3,000 target","Analyst Shyam Patil at Susquehanna is now Wall Street's most bullish on Amazon.com Inc.'s AMZN, +1.14% stock, after he raised his price target to $5,200 from $4,000, while reiterating his positive rating, in the wake of the e-commerce giant's record fourth-quarter results. Patil is also the most bullish on Google-parent Alphabet Inc. GOOGL, +0.83% , after he boosted his target by 50% to $3,000 from $2,000. For Amazon, Patil's new target is 30.6% above the average target of the 48 analysts surveyed by FactSet of $3,982.03, and implies a 53.8% gain off Tuesday's closing price of $3,380.00. ""Ultimately, we see [Amazon] as a long-term secular grower whose leadership in its three key markets -- e-commerce, cloud and advertising -- should emerge even stronger coming out of the pandemic,"" Patil wrote in a note to clients. For Alphabet, Patil's new target is 33.5% above the average target of the 43 analysts surveyed by FactSet of $2,247.44. He said a big acceleration in search and YouTube for Alphabet drove a ""nice beat"" of fourth-quarter expectations, and expects a recovery in travel ""should be a tailwind,"" as it represented 10% of search pre-COVID-19. Shares of Amazon rose 1.6% in premarket trading and Alphabet's stock climbed 7.4%, while futures ES00, +0.36% for the S&P 500 SPX, +0.30% edged up 0.3%.","Analyst Shyam Patil at Susquehanna is now Wall Street's most bullish on Amazon.com Inc.'s AMZN, +1.14% stock, after he raised his price target to $5,200 from $4,000, while reiterating his positive rating, in the wake of the e-commerce giant's record fourth-quarter results.
Patil is also the most bullish on Google-parent Alphabet Inc. GOOGL, +0.83% , after he boosted his target by 50% to $3,000 from $2,000.
For Amazon, Patil's new target is 30.6% above the average target of the 48 analysts surveyed by FactSet of $3,982.03, and implies a 53.8% gain off Tuesday's closing price of $3,380.00.
For Alphabet, Patil's new target is 33.5% above the average target of the 43 analysts surveyed by FactSet of $2,247.44.
Shares of Amazon rose 1.6% in premarket trading and Alphabet's stock climbed 7.4%, while futures ES00, +0.36% for the S&P 500 SPX, +0.30% edged up 0.3%.",https://www.marketwatch.com/story/amazon-gets-first-5000-stock-price-target-and-alphabet-gets-first-3000-target-2021-02-03,2021-02-03 00:00:00
