,Ticker,Title,Article,Summary,Link,Date
0,russel 1000,Are you a robot?,"Why did this happen?

Please make sure your browser supports JavaScript and cookies and that you are not blocking them from loading. For more information you can review our Terms of Service and Cookie Policy.","Why did this happen?
Please make sure your browser supports JavaScript and cookies and that you are not blocking them from loading.
For more information you can review our Terms of Service and Cookie Policy.",https://www.bloomberg.com/news/articles/2021-09-17/so-many-stocks-are-joining-russell-indexes-they-got-one-wrong,2021-09-17 00:00:00
1,russel 1000,Better Buy: Vanguard Growth ETF or iShares Russell 1000 Growth ETF?,"For investors searching for stable, long-term returns, large-cap growth funds are a great place to look. Large-cap growth funds invest in the biggest companies in the world that exhibit high revenue and earnings growth rates with higher valuations. They may be prone to more short-term volatility, but over time, large-cap growth stocks have outperformed large-cap value stocks.

A great way to invest in the best large-cap growth companies is through an exchange-traded fund, or ETF. Two of the largest and most popular large-cap growth ETFs are the Vanguard Growth ETF (NYSEMKT:VUG) and the iShares Russell 1000 Growth ETF (NYSEMKT:IWF). Which is the better buy?

Vanguard Growth ETF

The Vanguard Growth ETF is the second-largest large-cap growth ETF, according to ETF Database, with about $86 billion in total assets. It tracks the performance of the CRSP Large-Cap Growth Index and includes about 285 stocks. The stocks in the index are determined to be large-cap growth based on market cap as well as various screens, including future long-term growth in earnings per share (EPS), future short-term growth in EPS, three-year historical growth in EPS, three-year historical growth in sales per share, current investment-to-assets ratio, and return on assets. The average annual earnings growth rate for stocks in this index is 28% over the past five years.

Almost 50% of the portfolio is in technology stocks, while 22% is in consumer discretionary stocks and 12% is in industrials. The three largest holdings are Apple, Microsoft, and Alphabet. The 10 largest holdings make up 47% of the portfolio.

The ETF has returned 19% over the past 10 years on an annualized basis and 23.7% annually over the past five years through Aug. 31. It's up 28.9% over the past year, through Aug. 31, and year to date as of Sept. 24, it has returned about 19%. Also, it has the lowest expense ratio among the 10 largest large-cap growth ETFs at 0.04%.

iShares Russell 1000 Growth ETF

The iShares Russell 1000 Growth ETF is the third-largest large-cap growth ETF, with about $74 billion in net assets. It differs from the Vanguard Growth ETF in that it tracks a significantly broader swath of the market, as it mirrors the performance of growth stocks within the Russell 1000.

As such, while it is predominantly made up of large caps, it also has some mid-cap names. Overall, the portfolio includes about 501 holdings -- roughly 75% more than the Vanguard Growth ETF. The Russell 1000 Growth Index includes companies within the Russell 1000 with higher price-to-book ratios and higher forecasted growth values. The average price-to-book ratio is around 14.2% in the Russell 1000 Growth Index, compared to 4.7% in the Russell 1000. The average earnings growth rate over the past five years is 26%.

About 45% of the portfolio is in information technology stocks, while 18% is in consumer discretionary and 13% is in communication stocks. It has the same top three holdings as the Vanguard Growth ETF, and its 10 largest holdings make up 45.5% of the portfolio.

Over the last 10 years, it has returned 19.2% on an annualized basis, and over the past five years it has posted a 24.1% annualized return, as of Aug. 31. Over the past one-year period through Aug. 31 it is up 28.3%, and year to date as of Sept. 24 it has returned roughly 18%. It has an expense ratio of 0.19%.

Which is the better buy?

These are two of the largest large-cap growth funds and, while they track different indexes, they are very similar in terms of performance. The returns are almost equal over both the long term and the short term. While the iShares fund is more diversified and is slightly less volatile as measured by its beta and standard deviation numbers, the difference is minor.

The one major difference is the expense ratio, which is significantly lower on the Vanguard Growth ETF at 0.04% compared to 0.19% for the iShares fund. So, if I had to pick one, I'd probably go with the Vanguard Growth ETF, based on that key difference. But both have been around a long time, have excellent track records, and are two of the three largest in their class. You can't really go wrong with either.","Two of the largest and most popular large-cap growth ETFs are the Vanguard Growth ETF (NYSEMKT:VUG) and the iShares Russell 1000 Growth ETF (NYSEMKT:IWF).
Vanguard Growth ETFThe Vanguard Growth ETF is the second-largest large-cap growth ETF, according to ETF Database, with about $86 billion in total assets.
iShares Russell 1000 Growth ETFThe iShares Russell 1000 Growth ETF is the third-largest large-cap growth ETF, with about $74 billion in net assets.
The Russell 1000 Growth Index includes companies within the Russell 1000 with higher price-to-book ratios and higher forecasted growth values.
The average price-to-book ratio is around 14.2% in the Russell 1000 Growth Index, compared to 4.7% in the Russell 1000.",https://www.fool.com/investing/2021/09/27/better-buy-vanguard-growth-etf-or-ishares-russell/,2021-09-27 00:00:00
2,russel 1000,Should SPDR Russell 1000 Low Volatility Focus ETF (ONEV) Be on Your Investing Radar?,"If you're interested in broad exposure to the Large Cap Blend segment of the US equity market, look no further than the SPDR Russell 1000 Low Volatility Focus ETF (ONEV), a passively managed exchange traded fund launched on 12/02/2015.

The fund is sponsored by State Street Global Advisors. It has amassed assets over $565.33 million, making it one of the average sized ETFs attempting to match the Large Cap Blend segment of the US equity market.

Why Large Cap Blend

Companies that find themselves in the large cap category typically have a market capitalization above $10 billion. Overall, they are usually a stable option, with less risk and more sure-fire cash flows than mid and small cap companies.

Typically holding a combination of both growth and value stocks, blend ETFs also demonstrate qualities seen in value and growth investments.

Costs

Expense ratios are an important factor in the return of an ETF and in the long term, cheaper funds can significantly outperform their more expensive counterparts, other things remaining the same.

Annual operating expenses for this ETF are 0.20%, making it one of the cheaper products in the space.

It has a 12-month trailing dividend yield of 1.65%.

Sector Exposure and Top Holdings

ETFs offer a diversified exposure and thus minimize single stock risk but it is still important to delve into a fund's holdings before investing. Most ETFs are very transparent products and many disclose their holdings on a daily basis.

This ETF has heaviest allocation to the Information Technology sector--about 18% of the portfolio. Industrials and Financials round out the top three.

Looking at individual holdings, Cognizant Technology Solutions Corporation Class A (CTSH) accounts for about 1.18% of total assets, followed by Progressive Corporation (PGR) and Dollar General Corporation (DG).

The top 10 holdings account for about 6.98% of total assets under management.

Performance and Risk

ONEV seeks to match the performance of the Russell 1000 Low Volatility Focused Factor Index before fees and expenses. The Russell 1000 Low Volatility Focused Factor Index reflects the performance of a segment of large-capitalization U.S. equity securities demonstrating a combination of core factors high value, high quality, and low size characteristics, with a focus factor comprising low volatility characteristics.

The ETF has gained about 20.86% so far this year and is up roughly 40.47% in the last one year (as of 09/28/2021). In the past 52-week period, it has traded between $77.31 and $109.80.

The ETF has a beta of 1.01 and standard deviation of 23.48% for the trailing three-year period. With about 439 holdings, it effectively diversifies company-specific risk.

Alternatives

SPDR Russell 1000 Low Volatility Focus ETF carries a Zacks ETF Rank of 3 (Hold), which is based on expected asset class return, expense ratio, and momentum, among other factors. Thus, ONEV is a reasonable option for those seeking exposure to the Style Box - Large Cap Blend area of the market. Investors might also want to consider some other ETF options in the space.

The iShares Core S&P 500 ETF (IVV) and the SPDR S&P 500 ETF (SPY) track a similar index. While iShares Core S&P 500 ETF has $300.33 billion in assets, SPDR S&P 500 ETF has $399.81 billion. IVV has an expense ratio of 0.03% and SPY charges 0.09%.

Bottom-Line

Retail and institutional investors increasingly turn to passively managed ETFs because they offer low costs, transparency, flexibility, and tax efficiency; these kind of funds are also excellent vehicles for long term investors.

To learn more about this product and other ETFs, screen for products that match your investment objectives and read articles on latest developments in the ETF investing universe, please visit Zacks ETF Center.

5 Stocks Set to Double

Each was handpicked by a Zacks expert as the #1 favorite stock to gain +100% or more in 2021. Previous recommendations have soared +143.0%, +175.9%, +498.3% and +673.0%.

Most of the stocks in this report are flying under Wall Street radar, which provides a great opportunity to get in on the ground floor.

The views and opinions expressed herein are the views and opinions of the author and do not necessarily reflect those of Nasdaq, Inc.","Why Large Cap BlendCompanies that find themselves in the large cap category typically have a market capitalization above $10 billion.
Performance and RiskONEV seeks to match the performance of the Russell 1000 Low Volatility Focused Factor Index before fees and expenses.
The Russell 1000 Low Volatility Focused Factor Index reflects the performance of a segment of large-capitalization U.S. equity securities demonstrating a combination of core factors high value, high quality, and low size characteristics, with a focus factor comprising low volatility characteristics.
AlternativesSPDR Russell 1000 Low Volatility Focus ETF carries a Zacks ETF Rank of 3 (Hold), which is based on expected asset class return, expense ratio, and momentum, among other factors.
Thus, ONEV is a reasonable option for those seeking exposure to the Style Box - Large Cap Blend area of the market.",https://www.nasdaq.com/articles/should-spdr-russell-1000-low-volatility-focus-etf-onev-be-on-your-investing-radar-2021-09,2021-09-27 00:00:00
3,russel 1000,Growth? Value? Some investors opt for a bit of both,"FILE PHOTO: People are seen on Wall Street outside the NYSE in New York

By David Randall

NEW YORK (Reuters) -Some investors are playing this year’s tug of war between so-called growth and value stocks by owning companies that straddle the line between the two categories, as uncertainties mount over the U.S. economy’s trajectory in the months ahead.

Value stocks, which trade at comparatively cheap multiples of their fundamentals, surged in early 2021 as hopes of an economic rebound boosted the shares of banks, energy firms and other economically sensitive names after years of underperformance.

Their performance against growth stocks has varied since then, with signs of a flagging U.S. economic rebound tending to benefit growth names, which are less tied to the economy’s fluctuations and led the market for most of 2020. The Russell 1000 Value index is up 16.2% year-to-date, just behind the 18.6% notched by the Russell 1000 Growth Index as of midday on Friday. The benchmark S&P 500 index is up around 18% this year.

As a COVID-19 resurgence and a looming unwind of the Federal Reserve's easy money policies cloud the economic outlook, ""you're not seeing a great backdrop for the deep value or the mega-growth names, so we think you can find some great businesses in the middle,"" said David Marcus, portfolio manager of Evermore Global Value fund.

Marcus is moving into companies like French media conglomerate Vivendi SA, whose growth prospects he believes will improve after an expected spinoff of a stake in Universal Music Group later this month. On the value side, Vivendi owns a portfolio of economically sensitive media names and pays a dividend of 1.8%.

Investors will be keeping a close eye on next week's Federal Reserve meeting https://www.reuters.com/world/us/delta-darkens-us-q3-growth-views-fed-taper-announcement-expected-nov-2021-09-17, which concludes on Wednesday, for any details of the central bank's plans to pull back its emergency-level support of the economy. The European Central Bank and the Bank of Japan will conclude their meetings on the same day.

Story continues

Some fund managers have also become worried over the comparatively high valuations commanded by growth stocks, which have helped boost the S&P's price-earnings ratio near its highest level since the 2001 dotcom bubble.

Those concerns have led Matthew McLennan, co-head of the Global Value team at First Eagle Investment Management, to hold shares of companies such as logistics firm CH Robinson Worldwide Inc.

A broad recovery that increases the number of global shipments could benefit the company’s business, he said. At the same time, McLennan is betting that the company’s increasing market share and comparatively low valuation of 16.8 times future earnings will make it attractive if global growth concerns spur a flight to quality stocks. ""You don't have to chase the ‘glamour stocks’ that are quite expensive,"" he said.

The search for companies that have attributes of both growth and value comes at a time when analysts across Wall Street are dampening their expectations for stocks.

Banks including BofA, Morgan Stanley, Citi and Credit Suisse cut back on their recommended exposure to stocks in the past week, while Goldman Sachs cut its forecast of U.S. economic growth in the third quarter on Aug. 19 to 5.5% from 9% due to the impact of the Delta variant.

It is unlikely that an outsized rally in value stocks in battered industries like movie theaters and cruise liners, such as that seen during seen during the first three months of this year, will be repeated even if the Delta variant proves less disruptive to the economy than many fear, said David Park, portfolio manager of the Nuveen Santa Barbara Dividend Growth Fund. Yet at the same time, he doubts that growth stocks will resume last year's torrid rally because of their stretched valuations. Instead, Park is looking for companies like discount retailer TJX Companies Inc, which he said has been taking market share from mall-based apparel stores. The company reinstated its stock buyback program in late May and resumed its dividend in December after cutting both in response to the pandemic, giving it a value tilt, he said.

Its shares are up 3.2% for the year.

""We are usually stuck in purgatory because we can't invest in the highest-growth non-dividend payers and we aren’t interested in the lowest quality stocks either,"" Park said. ""We're ... waiting for more opportunities like this.""

(Reporting by David Randall in New YorkEditing by Ira Iosebashvili and Matthew Lewis)","Their performance against growth stocks has varied since then, with signs of a flagging U.S. economic rebound tending to benefit growth names, which are less tied to the economy’s fluctuations and led the market for most of 2020.
The Russell 1000 Value index is up 16.2% year-to-date, just behind the 18.6% notched by the Russell 1000 Growth Index as of midday on Friday.
Story continuesSome fund managers have also become worried over the comparatively high valuations commanded by growth stocks, which have helped boost the S&P's price-earnings ratio near its highest level since the 2001 dotcom bubble.
The search for companies that have attributes of both growth and value comes at a time when analysts across Wall Street are dampening their expectations for stocks.
Yet at the same time, he doubts that growth stocks will resume last year's torrid rally because of their stretched valuations.",https://finance.yahoo.com/news/growth-value-investors-opt-bit-185755112.html,2021-09-27 00:00:00
4,russel 1000,Should SPDR Russell 1000 Momentum Focus ETF (ONEO) Be on Your Investing Radar?,"You're reading Entrepreneur United States, an international franchise of Entrepreneur Media. This story originally appeared on Zacks

Looking for broad exposure to the Large Cap Blend segment of the US equity market? You should consider the SPDR Russell 1000 Momentum Focus ETF (ONEO), a passively managed exchange traded fund launched on 12/02/2015.

- Zacks

The fund is sponsored by State Street Global Advisors. It has amassed assets over $324.72 million, making it one of the average sized ETFs attempting to match the Large Cap Blend segment of the US equity market.

Why Large Cap Blend

Large cap companies usually have a market capitalization above $10 billion. Considered a more stable option, large cap companies boast more predictable cash flows and are less volatile than their mid and small cap counterparts.

Blend ETFs are aptly named, since they tend to hold a mix of growth and value stocks, as well as show characteristics of both kinds of equities.

Costs

When considering an ETF's total return, expense ratios are an important factor, and cheaper funds can significantly outperform their more expensive counterparts in the long term if all other factors remain equal.

Annual operating expenses for this ETF are 0.20%, making it one of the cheaper products in the space.

It has a 12-month trailing dividend yield of 1.09%.

Sector Exposure and Top Holdings

While ETFs offer diversified exposure, which minimizes single stock risk, a deep look into a fund's holdings is a valuable exercise. And, most ETFs are very transparent products that disclose their holdings on a daily basis.

This ETF has heaviest allocation to the Information Technology sector--about 18.90% of the portfolio. Industrials and Financials round out the top three.

Looking at individual holdings, Hp Inc. (HPQ) accounts for about 1.15% of total assets, followed by Dell Technologies Inc Class C (DELL) and Netapp Inc. (NTAP).

The top 10 holdings account for about 5.83% of total assets under management.

Performance and Risk

ONEO seeks to match the performance of the Russell 1000 Momentum Focused Factor Index before fees and expenses. The Russell 1000 Momentum Focused Factor Index reflects the performance of a segment of large-capitalization U.S. equity securities demonstrating a combination of core factors with a focus factor comprising high momentum characteristics.

The ETF has gained about 24.02% so far this year and was up about 36.36% in the last one year (as of 09/03/2021). In the past 52-week period, it has traded between $70.62 and $103.38.

The ETF has a beta of 1.14 and standard deviation of 24.17% for the trailing three-year period. With about 911 holdings, it effectively diversifies company-specific risk.

Alternatives

SPDR Russell 1000 Momentum Focus ETF carries a Zacks ETF Rank of 3 (Hold), which is based on expected asset class return, expense ratio, and momentum, among other factors. Thus, ONEO is a reasonable option for those seeking exposure to the Style Box - Large Cap Blend area of the market. Investors might also want to consider some other ETF options in the space.

The iShares Core S&P 500 ETF (IVV) and the SPDR S&P 500 ETF (SPY) track a similar index. While iShares Core S&P 500 ETF has $306.67 billion in assets, SPDR S&P 500 ETF has $400.60 billion. IVV has an expense ratio of 0.03% and SPY charges 0.09%.

Bottom-Line

While an excellent vehicle for long term investors, passively managed ETFs are a popular choice among institutional and retail investors due to their low costs, transparency, flexibility, and tax efficiency.

To learn more about this product and other ETFs, screen for products that match your investment objectives and read articles on latest developments in the ETF investing universe, please visit Zacks ETF Center.

Tech IPOs With Massive Profit Potential: Last years top IPOs surged as much as 299% within the first two months. With record amounts of cash flooding into IPOs and a record-setting stock market, this year could be even more lucrative.

Want the latest recommendations from Zacks Investment Research? Today, you can download 7 Best Stocks for the Next 30 Days. Click to get this free report



SPDR Russell 1000 Momentum Focus ETF (ONEO): ETF Research Reports



HP Inc. (HPQ): Free Stock Analysis Report



Dell Technologies Inc. (DELL): Free Stock Analysis Report



NetApp, Inc. (NTAP): Free Stock Analysis Report



SPDR S&P 500 ETF (SPY): ETF Research Reports



iShares Core S&P 500 ETF (IVV): ETF Research Reports



To read this article on Zacks.com click here.



Zacks Investment Research","You should consider the SPDR Russell 1000 Momentum Focus ETF (ONEO), a passively managed exchange traded fund launched on 12/02/2015.
AlternativesSPDR Russell 1000 Momentum Focus ETF carries a Zacks ETF Rank of 3 (Hold), which is based on expected asset class return, expense ratio, and momentum, among other factors.
The iShares Core S&P 500 ETF (IVV) and the SPDR S&P 500 ETF (SPY) track a similar index.
While iShares Core S&P 500 ETF has $306.67 billion in assets, SPDR S&P 500 ETF has $400.60 billion.
Click to get this free reportSPDR Russell 1000 Momentum Focus ETF (ONEO): ETF Research ReportsHP Inc. (HPQ): Free Stock Analysis ReportDell Technologies Inc. (DELL): Free Stock Analysis ReportNetApp, Inc. (NTAP): Free Stock Analysis ReportSPDR S&P 500 ETF (SPY): ETF Research ReportsiShares Core S&P 500 ETF (IVV): ETF Research ReportsTo read this article on Zacks.com click here.",https://www.entrepreneur.com/article/383519,2021-09-27 00:00:00
