,Ticker,Title,Article,Summary,Link,Date
46,russel 1000,IWD's Underlying Holdings Imply 11% Gain Potential,"Looking at the underlying holdings of the ETFs in our coverage universe at ETF Channel, we have compared the trading price of each holding against the average analyst 12-month forward target price, and computed the weighted average implied analyst target price for the ETF itself. For the iShares Russell 1000 Value ETF (Symbol: IWD), we found that the implied analyst target price for the ETF based upon its underlying holdings is $178.65 per unit.

With IWD trading at a recent price near $161.07 per unit, that means that analysts see 10.91% upside for this ETF looking through to the average analyst targets of the underlying holdings. Three of IWD's underlying holdings with notable upside to their analyst target prices are Chemed Corp (Symbol: CHE), FireEye Inc (Symbol: FEYE), and Fastly Inc (Symbol: FSLY). Although CHE has traded at a recent price of $477.36/share, the average analyst target is 25.27% higher at $598.00/share. Similarly, FEYE has 18.44% upside from the recent share price of $18.49 if the average analyst target price of $21.90/share is reached, and analysts on average are expecting FSLY to reach a target price of $50.50/share, which is 15.91% above the recent price of $43.57. Below is a twelve month price history chart comparing the stock performance of CHE, FEYE, and FSLY:

Below is a summary table of the current analyst target prices discussed above:

Name Symbol Recent Price Avg. Analyst 12-Mo. Target % Upside to Target iShares Russell 1000 Value ETF IWD $161.07 $178.65 10.91% Chemed Corp CHE $477.36 $598.00 25.27% FireEye Inc FEYE $18.49 $21.90 18.44% Fastly Inc FSLY $43.57 $50.50 15.91%

Are analysts justified in these targets, or overly optimistic about where these stocks will be trading 12 months from now? Do the analysts have a valid justification for their targets, or are they behind the curve on recent company and industry developments? A high price target relative to a stock's trading price can reflect optimism about the future, but can also be a precursor to target price downgrades if the targets were a relic of the past. These are questions that require further investor research.

10 ETFs With Most Upside To Analyst Targets »

The views and opinions expressed herein are the views and opinions of the author and do not necessarily reflect those of Nasdaq, Inc.","For the iShares Russell 1000 Value ETF (Symbol: IWD), we found that the implied analyst target price for the ETF based upon its underlying holdings is $178.65 per unit.
With IWD trading at a recent price near $161.07 per unit, that means that analysts see 10.91% upside for this ETF looking through to the average analyst targets of the underlying holdings.
Three of IWD's underlying holdings with notable upside to their analyst target prices are Chemed Corp (Symbol: CHE), FireEye Inc (Symbol: FEYE), and Fastly Inc (Symbol: FSLY).
Although CHE has traded at a recent price of $477.36/share, the average analyst target is 25.27% higher at $598.00/share.
A high price target relative to a stock's trading price can reflect optimism about the future, but can also be a precursor to target price downgrades if the targets were a relic of the past.",https://www.nasdaq.com/articles/iwds-underlying-holdings-imply-11-gain-potential-2021-09-16,2021-09-16 00:00:00
47,russel 1000,SPDR Series - SPDR Russell 1000 Low Volatility Focus ETF (ONEV) falls 1.36% for September 28,"Last Price $ Last Trade Change $ Change Percent % Open $ Prev Close $ High $ low $ 52 Week High $ 52 Week Low $ Market Cap PE Ratio Volume Exchange ONEV - Market Data & News

Today, SPDR Series Trust - SPDR Russell 1000 Low Volatility Focus ETF Inc’s (NYSE: ONEV) stock fell $1.44, accounting for a 1.36% decrease. SPDR Series - SPDR Russell 1000 Low Volatility Focus ETF opened at $105.22 before trading between $104.65 and $104.20 throughout Tuesday’s session. The activity saw SPDR Series - SPDR Russell 1000 Low Volatility Focus ETF’s market cap fall to $554,503,600 on 2,857 shares -below their 30-day average of 4,474.

Visit SPDR Series Trust - SPDR Russell 1000 Low Volatility Focus ETF's profile for more information.

The Daily Fix

The Federal Aviation Administration (FAA) wants US passenger airlines to do more to address the surge in incidents involving unruly or violent passengers.

Athletes vying to represent the US at the 2022 Winter Olympics in Beijing must be vaccinated against COVID-19, the US Olympic and Paralympic Committee (USOPC) said.

Beyond Meat Inc’s (Nasdaq:BYND) meatless chicken tenders will be available for purchase at select grocery stores nationwide starting next month, the faux meat company said Monday.

About The New York Stock Exchange

The New York Stock Exchange is the world’s largest stock exchange by market value at over $26 trillion. It is also the leader for initial public offerings, with $82 billion raised in 2020, including six of the seven largest technology deals. 63% of SPAC proceeds in 2020 were raised on the NYSE, including the six largest transactions.

To get more information on SPDR Series Trust - SPDR Russell 1000 Low Volatility Focus ETF and to follow the company's latest updates, you can visit the company's profile page here: SPDR Series Trust - SPDR Russell 1000 Low Volatility Focus ETF's Profile. For more news on the financial markets be sure to visit Equities News. Also, don't forget to sign-up for the Daily Fix to receive the best stories to your inbox 5 days a week.

Sources: Chart is provided by TradingView based on 15-minute-delayed prices. All other data is provided by IEX Cloud as of 8:05 pm ET on the day of publication.

DISCLOSURE: The views and opinions expressed in this article are those of the authors, and do not represent the views of equities.com. Readers should not consider statements made by the author as formal recommendations and should consult their financial advisor before making any investment decisions. To read our full disclosure, please go to: http://www.equities.com/disclaimer

Trending Articles

United Airlines To Expand December Schedule to 3,500 Daily Domestic Flights Moody's Sees Long-Term Economic Benefit to Fuller Racial Integration IBM Mandates COVID-19 Vaccine for All US Employees by December 8 Pfizer-BioNTech Ask FDA to Authorize COVID-19 Vaccine for Children 5 to 11","Last Price $ Last Trade Change $ Change Percent % Open $ Prev Close $ High $ low $ 52 Week High $ 52 Week Low $ Market Cap PE Ratio Volume Exchange ONEV - Market Data & NewsToday, SPDR Series Trust - SPDR Russell 1000 Low Volatility Focus ETF Inc’s (NYSE: ONEV) stock fell $1.44, accounting for a 1.36% decrease.
SPDR Series - SPDR Russell 1000 Low Volatility Focus ETF opened at $105.22 before trading between $104.65 and $104.20 throughout Tuesday’s session.
The activity saw SPDR Series - SPDR Russell 1000 Low Volatility Focus ETF’s market cap fall to $554,503,600 on 2,857 shares -below their 30-day average of 4,474.
Visit SPDR Series Trust - SPDR Russell 1000 Low Volatility Focus ETF's profile for more information.
To get more information on SPDR Series Trust - SPDR Russell 1000 Low Volatility Focus ETF and to follow the company's latest updates, you can visit the company's profile page here: SPDR Series Trust - SPDR Russell 1000 Low Volatility Focus ETF's Profile.",https://www.equities.com/news/spdr-series-spdr-russell-1000-low-volatility-focus-etf-onev-falls-1-36-for-september-28,2021-09-16 00:00:00
48,russel 1000,BlackRock Institutional Company N.A. - iShares Russell 1000 Growth ETF (IWF) falls 0.22% on Strong Volume September 14,"Last Price $ Last Trade Change $ Change Percent % Open $ Prev Close $ High $ low $ 52 Week High $ 52 Week Low $ Market Cap PE Ratio Volume Exchange IWF - Market Data & News

Today, BlackRock Institutional Trust Company N.A. - iShares Russell 1000 Growth ETF Inc’s (NYSE: IWF) stock fell $0.64, accounting for a 0.22% decrease. BlackRock Institutional Company N.A. - iShares Russell 1000 Growth ETF opened at $288.73 before trading between $289.27 and $286.56 throughout Tuesday’s session. The activity saw BlackRock Institutional Company N.A. - iShares Russell 1000 Growth ETF’s market cap fall to $74,636,844,000 on 1,630,903 shares -above their 30-day average of 1,248,009.

Visit BlackRock Institutional Trust Company N.A. - iShares Russell 1000 Growth ETF's profile for more information.

About The New York Stock Exchange

The New York Stock Exchange is the world’s largest stock exchange by market value at over $26 trillion. It is also the leader for initial public offerings, with $82 billion raised in 2020, including six of the seven largest technology deals. 63% of SPAC proceeds in 2020 were raised on the NYSE, including the six largest transactions.

To get more information on BlackRock Institutional Trust Company N.A. - iShares Russell 1000 Growth ETF and to follow the company's latest updates, you can visit the company's profile page here: BlackRock Institutional Trust Company N.A. - iShares Russell 1000 Growth ETF's Profile. For more news on the financial markets be sure to visit Equities News. Also, don't forget to sign-up for the Daily Fix to receive the best stories to your inbox 5 days a week.

Sources: Chart is provided by TradingView based on 15-minute-delayed prices. All other data is provided by IEX Cloud as of 8:05 pm ET on the day of publication.

DISCLOSURE: The views and opinions expressed in this article are those of the authors, and do not represent the views of equities.com. Readers should not consider statements made by the author as formal recommendations and should consult their financial advisor before making any investment decisions. To read our full disclosure, please go to: http://www.equities.com/disclaimer

Trending Articles

United Airlines To Expand December Schedule to 3,500 Daily Domestic Flights Moody's Sees Long-Term Economic Benefit to Fuller Racial Integration IBM Mandates COVID-19 Vaccine for All US Employees by December 8 Pfizer-BioNTech Ask FDA to Authorize COVID-19 Vaccine for Children 5 to 11","- iShares Russell 1000 Growth ETF Inc’s (NYSE: IWF) stock fell $0.64, accounting for a 0.22% decrease.
BlackRock Institutional Company N.A.
- iShares Russell 1000 Growth ETF opened at $288.73 before trading between $289.27 and $286.56 throughout Tuesday’s session.
- iShares Russell 1000 Growth ETF’s market cap fall to $74,636,844,000 on 1,630,903 shares -above their 30-day average of 1,248,009.
- iShares Russell 1000 Growth ETF and to follow the company's latest updates, you can visit the company's profile page here: BlackRock Institutional Trust Company N.A.",https://www.equities.com/news/blackrock-institutional-company-n-a-ishares-russell-1000-growth-etf-iwf-falls-0-22-on-strong-volume-september-14,2021-09-16 00:00:00
49,russel 1000,DBX ETF - Xtrackers Russell 1000 US Quality at a Reasonable Price ETF (QARP) falls 0.08% in Light Trading on September 16,"Last Price $ Last Trade Change $ Change Percent % Open $ Prev Close $ High $ low $ 52 Week High $ 52 Week Low $ Market Cap PE Ratio Volume Exchange QARP - Market Data & News

Today, DBX ETF Trust - Xtrackers Russell 1000 US Quality at a Reasonable Price ETF Inc’s (NYSE: QARP) stock fell $0.0345, accounting for a 0.08% decrease. DBX ETF - Xtrackers Russell 1000 US Quality at a Reasonable Price ETF opened at $41.38 before trading between $41.48 and $41.11 throughout Thursday’s session. The activity saw DBX ETF - Xtrackers Russell 1000 US Quality at a Reasonable Price ETF’s market cap fall to $39,303,441 on 4,190 shares -below their 30-day average of 6,336.

Visit DBX ETF Trust - Xtrackers Russell 1000 US Quality at a Reasonable Price ETF's profile for more information.

About The New York Stock Exchange

The New York Stock Exchange is the world’s largest stock exchange by market value at over $26 trillion. It is also the leader for initial public offerings, with $82 billion raised in 2020, including six of the seven largest technology deals. 63% of SPAC proceeds in 2020 were raised on the NYSE, including the six largest transactions.

To get more information on DBX ETF Trust - Xtrackers Russell 1000 US Quality at a Reasonable Price ETF and to follow the company's latest updates, you can visit the company's profile page here: DBX ETF Trust - Xtrackers Russell 1000 US Quality at a Reasonable Price ETF's Profile. For more news on the financial markets be sure to visit Equities News. Also, don't forget to sign-up for the Daily Fix to receive the best stories to your inbox 5 days a week.

Sources: Chart is provided by TradingView based on 15-minute-delayed prices. All other data is provided by IEX Cloud as of 8:05 pm ET on the day of publication.

DISCLOSURE: The views and opinions expressed in this article are those of the authors, and do not represent the views of equities.com. Readers should not consider statements made by the author as formal recommendations and should consult their financial advisor before making any investment decisions. To read our full disclosure, please go to: http://www.equities.com/disclaimer

Trending Articles

United Airlines To Expand December Schedule to 3,500 Daily Domestic Flights Moody's Sees Long-Term Economic Benefit to Fuller Racial Integration IBM Mandates COVID-19 Vaccine for All US Employees by December 8 Pfizer-BioNTech Ask FDA to Authorize COVID-19 Vaccine for Children 5 to 11","Last Price $ Last Trade Change $ Change Percent % Open $ Prev Close $ High $ low $ 52 Week High $ 52 Week Low $ Market Cap PE Ratio Volume Exchange QARP - Market Data & NewsToday, DBX ETF Trust - Xtrackers Russell 1000 US Quality at a Reasonable Price ETF Inc’s (NYSE: QARP) stock fell $0.0345, accounting for a 0.08% decrease.
DBX ETF - Xtrackers Russell 1000 US Quality at a Reasonable Price ETF opened at $41.38 before trading between $41.48 and $41.11 throughout Thursday’s session.
The activity saw DBX ETF - Xtrackers Russell 1000 US Quality at a Reasonable Price ETF’s market cap fall to $39,303,441 on 4,190 shares -below their 30-day average of 6,336.
Visit DBX ETF Trust - Xtrackers Russell 1000 US Quality at a Reasonable Price ETF's profile for more information.
To get more information on DBX ETF Trust - Xtrackers Russell 1000 US Quality at a Reasonable Price ETF and to follow the company's latest updates, you can visit the company's profile page here: DBX ETF Trust - Xtrackers Russell 1000 US Quality at a Reasonable Price ETF's Profile.",https://www.equities.com/news/dbx-etf-xtrackers-russell-1000-us-quality-at-a-reasonable-price-etf-qarp-falls-0-08-in-light-trading-on-september-16,2021-09-16 00:00:00
50,russel 1000,"Nuveen Debuts Active, ESG ETFs","Today, Nuveen rolled out two very different ETFs that each represent milestones for the firm in their own right. The Nuveen Growth Opportunities ETF (NUGO) is the firm’s first actively managed semitransparent ETF that is not based on one of Nuveen’s existing mutual funds. Meanwhile, the Nuveen ESG Dividend ETF (NUDV) is one of the few ESG ETFs to focus on yield.

While NUGO lists on the NYSE Arca with an expense ratio of 0.55%, NUDV trades on Cboe Global Markets with an expense ratio of 0.25%.

NUGO

Nuveen Portfolio Manager Karen Hiatt will manage the portfolio for NUGO. She has an impressive track record of outperformance in the large cap growth space, where she uses rigorous analysis to seek out market inefficiencies, despite the belief by many that large cap growth is a highly efficient segment.

“I take nonconsensus views to whittle down the Russell 1000 Growth Index into, ideally, 45 to 50 stocks within the portfolio that are the highest conviction holdings,” Hiatt said, who characterizes herself as a stockpicker. “This is a truly actively managed portfolio.”

She notes that she analyzes the primary components of growth, quality and valuation, looking beyond the next quarter or two, where she believes inefficiencies tend to be magnified. Digitization is one of the megatrends she is focused on and that she believes is in its early stages and has ramifications across multiple sectors. She points to companies like Zscaler and Square as examples she thinks have the potential for significant growth going forward.

“I’m not looking for a flash in the pan for short-term cyclical growth. I’m looking for long-term opportunities that extend beyond just where we are [in the next couple of quarters,]” Hiatt added.

NUGO looks to outperform the Russell 1000 Growth Index and relies on a proxy portfolio model to obscure its exact holdings.

NUDV

NUDV is one of the few yield-focused ESG ETFs available to investors. Its ESG framework is the same that is used across Nuveen’s entire family of ESG ETFs, which relies on MSCI’s ESG analytics and evaluates companies relative to their industry peers. The methodology also automatically excludes companies operating in the alcohol, tobacco, nuclear power, weapons and gambling industries. It additionally takes into account carbon emissions and fossil fuel reserves, according to the fund prospectus.

Story continues

NUDV’s approach targets securities that are generating high dividend income and demonstrating strong quality characteristics. It is weighted by market capitalization within each sector, with sector weightings adjusted to reflect their weights in the parent index, the document says.

Expense Ratios Cut

In addition to the two launches, Nuveen has also decreased the expense ratios on seven of its equity ESG ETFs by 10 basis points. It has lowered the expense ratios on two of its fixed income ESG ETFs by 5 basis points.

The affected funds and their new expense ratios are as follows:

The issuer says that the cost reductions were made possible by the amount of assets gathered by the funds.

Contact Heather Bell at heather.bell@etf.com

Recommended Stories





Permalink | © Copyright 2021 ETF.com. All rights reserved","Meanwhile, the Nuveen ESG Dividend ETF (NUDV) is one of the few ESG ETFs to focus on yield.
NUDVNUDV is one of the few yield-focused ESG ETFs available to investors.
Its ESG framework is the same that is used across Nuveen’s entire family of ESG ETFs, which relies on MSCI’s ESG analytics and evaluates companies relative to their industry peers.
Expense Ratios CutIn addition to the two launches, Nuveen has also decreased the expense ratios on seven of its equity ESG ETFs by 10 basis points.
It has lowered the expense ratios on two of its fixed income ESG ETFs by 5 basis points.",https://finance.yahoo.com/news/nuveen-debuts-active-esg-etfs-131500836.html,2021-09-16 00:00:00
51,russel 1000,Are you a robot?,"Why did this happen?

Please make sure your browser supports JavaScript and cookies and that you are not blocking them from loading. For more information you can review our Terms of Service and Cookie Policy.","Why did this happen?
Please make sure your browser supports JavaScript and cookies and that you are not blocking them from loading.
For more information you can review our Terms of Service and Cookie Policy.",https://www.bloomberg.com/news/articles/2021-09-28/nuveen-cuts-fees-on-4-3-billion-of-etfs-launches-two-new-funds,2021-09-28 00:00:00
52,russel 1000,"Vanguard, - Vanguard Russell 1000 Index ETF (VONE) falls 1.03% in Active Trading on September 30","Last Price $ Last Trade Change $ Change Percent % Open $ Prev Close $ High $ low $ 52 Week High $ 52 Week Low $ Market Cap PE Ratio Volume Exchange VONE - Market Data & News Trade

Vanguard Group, Inc. - Vanguard Russell 1000 Index ETF (NASDAQ: VONE) shares fell 1.03%, or $2.078 per share, to close Thursday at $200.18. After opening the day at $203.08, shares of Vanguard, - Vanguard Russell 1000 Index ETF fluctuated between $203.36 and $200.00. 61,877 shares traded hands an increase from their 30 day average of 44,620. Thursday's activity brought Vanguard, - Vanguard Russell 1000 Index ETF’s market cap to $2,552,295,000.

Vanguard, - Vanguard Russell 1000 Index ETF is headquartered in Valley Forge, Pennsylvania..

Visit Vanguard Group, Inc. - Vanguard Russell 1000 Index ETF’s profile for more information.

The Daily Fix

Beyond Meat Inc’s (Nasdaq:BYND) meatless chicken tenders will be available for purchase at select grocery stores nationwide starting next month, the faux meat company said Monday.

The Federal Aviation Administration (FAA) wants US passenger airlines to do more to address the surge in incidents involving unruly or violent passengers.

Athletes vying to represent the US at the 2022 Winter Olympics in Beijing must be vaccinated against COVID-19, the US Olympic and Paralympic Committee (USOPC) said.

About The Nasdaq Stock Market

The Nasdaq Stock Market is a global leader in trading data and services, and equities and options listing. Nasdaq is the world's leading exchange for options volume and is home to the five largest US companies - Apple, Microsoft, Amazon, Alphabet and Facebook.

To get more information on Vanguard Group, Inc. - Vanguard Russell 1000 Index ETF and to follow the company’s latest updates, you can visit the company’s profile page here: Vanguard Group, Inc. - Vanguard Russell 1000 Index ETF’s Profile. For more news on the financial markets be sure to visit Equities News. Also, don’t forget to sign-up for the Daily Fix to receive the best stories to your inbox 5 days a week.

Sources: Chart is provided by TradingView based on 15-minute-delayed prices. All other data is provided by IEX Cloud as of 8:05 pm ET on the day of publication.

DISCLOSURE: The views and opinions expressed in this article are those of the authors, and do not represent the views of equities.com. Readers should not consider statements made by the author as formal recommendations and should consult their financial advisor before making any investment decisions. To read our full disclosure, please go to: http://www.equities.com/disclaimer

Trending Articles

United Airlines To Expand December Schedule to 3,500 Daily Domestic Flights Moody's Sees Long-Term Economic Benefit to Fuller Racial Integration IBM Mandates COVID-19 Vaccine for All US Employees by December 8 Pfizer-BioNTech Ask FDA to Authorize COVID-19 Vaccine for Children 5 to 11","After opening the day at $203.08, shares of Vanguard, - Vanguard Russell 1000 Index ETF fluctuated between $203.36 and $200.00.
Thursday's activity brought Vanguard, - Vanguard Russell 1000 Index ETF’s market cap to $2,552,295,000.
Vanguard, - Vanguard Russell 1000 Index ETF is headquartered in Valley Forge, Pennsylvania..Visit Vanguard Group, Inc. - Vanguard Russell 1000 Index ETF’s profile for more information.
About The Nasdaq Stock MarketThe Nasdaq Stock Market is a global leader in trading data and services, and equities and options listing.
To get more information on Vanguard Group, Inc. - Vanguard Russell 1000 Index ETF and to follow the company’s latest updates, you can visit the company’s profile page here: Vanguard Group, Inc. - Vanguard Russell 1000 Index ETF’s Profile.",https://www.equities.com/news/vanguard-vanguard-russell-1000-index-etf-vone-falls-1-03-in-active-trading-on-september-30,2021-09-28 00:00:00
