,Ticker,Title,Article,Summary,Link,Date
90,russel 1000,Can Consumer Discretionary ETFs Make Good Bets for Q4?,"Wall Street is seeing some strength amid September’s dull performance so far. The easing of China’s property market-related tensions and the absence of any hint on an immediate move to taper the bond purchasing program and keeping the benchmark interest rates unchanged have been supporting the market rally.

Investors are still on the edge with concerns over the rising inflationary levels, possibilities of a tax hike and spike in coronavirus cases. Amid the current market environment, investors looking to rake in some good returns can consider the consumer discretionary sector.

The U.S. consumer sentiment marginally improved despite the rising concerns about the surging coronavirus cases and the rising inflationary levels. The University of Michigan’s preliminary consumer sentiment inched up to 71 in September from 70.3 last month, per a BloombergQuint article.

The strength in consumer sentiment can be the major driving force behind the solid performance by the consumer discretionary space as consumers are expected to splurge this holiday season after being restricted for more than a year.

The latest retail sales data has surprised investors pleasantly. The metric inched up 0.7% sequentially in August 2021 against market expectations of a 0.8% decline, per a CNBC article. Online retail sales rose 5.3% last month after dropping 4.6% in July, per the Reuters article. There was an increase in clothing sales as well as that of building material and furniture in the previous month.

According to Mastercard SpendingPulse, U.S. retail sales — excluding automotive and gas — for the “75 Days of Christmas” spanning from Oct 11 to Dec 24 are anticipated to increase 6.8% from the year-earlier tally.

The progress in coronavirus vaccine rollout is presenting a strong case in favor of a faster return to normalcy and economic recovery. The FDA has approved emergency use of a booster dose of the Pfizer Inc. (PFE) and BioNTech SE (BNTX) COVID-19 vaccine. President Joe Biden has also outlined a very effective plan to accelerate the vaccination rate and control the coronavirus outbreak. He has made it mandatory for federal employees to get the COVID-19 vaccination, per a CNBC article. The Biden government will also issue guidelines to the Labor Department for imposing vaccine mandates for employers with more than 100 employees or run weekly tests.

The United States will likely relax travel restrictions for international visitors who are vaccinated against COVID-19 in November, including those from the U.K. and EU, the White House said recently, per a CNBC article. Foreigners visiting the United States will have to present a vaccination proof and a negative COVID-19 test taken within three days of departure. The latest White House announcement came post the peak summer travel season, which signals at strong holiday travel demand.

Notably, a number of restaurants and retailers that have resumed business after restrictions were relaxed in the United States should see some accelerated demand and footfall. Also, the leisure and entertainment space should see a rebound as casinos and amusement parks have started welcoming visitors.

ETFs to Consider

Along with the other favorable factors as mentioned above, the moderate improvement in consumer sentiment is likely to boost the consumer discretionary sector. Below, we have highlighted the four most popular ones that target the broader consumer discretionary sector (see all Consumer Discretionary ETFs):

The Consumer Discretionary Select Sector SPDR Fund XLY

This is the largest and most popular product in the consumer discretionary space, with AUM of $20.08 billion. It tracks the Consumer Discretionary Select Sector Index. The fund charges 12 basis points (bps) in fees per year and carries a Zacks ETF Rank #2 (Buy), with a Medium-risk outlook (read: Will ETFs Gain as US Consumer Sentiment Improves in September?).

Vanguard Consumer Discretionary ETF VCR

This fund currently follows the MSCI US Investable Market Consumer Discretionary 25/50 Index. VCR charges investors 10 bps in annual fees. The product has managed $6.54 billion in its asset base and carries a Zacks ETF Rank #1 (Strong Buy), with a Medium-risk outlook (read: ETF Areas to Gain From the Upcoming Holiday Shopping Season).

First Trust Consumer Discretionary AlphaDEX Fund FXD

This fund tracks the StrataQuant Consumer Discretionary Index, which employs the AlphaDEX stock-selection methodology to select stocks from the Russell 1000 Index. FXD has AUM of $1.97 billion. It charges 63 bps in annual fees and has a Zacks ETF Rank #3 (Hold), with a Medium-risk outlook.

Fidelity MSCI Consumer Discretionary Index ETF FDIS

This fund tracks the MSCI USA IMI Consumer Discretionary Index. The product has amassed $1.60 billion in its asset base. It charges 8 bps in annual fees from investors and carries a Zacks ETF Rank #2, with a Medium-risk outlook.

Infrastructure Stock Boom to Sweep America

A massive push to rebuild the crumbling U.S. infrastructure will soon be underway. It’s bipartisan, urgent, and inevitable. Trillions will be spent. Fortunes will be made.

The only question is “Will you get into the right stocks early when their growth potential is greatest?”

Zacks has released a Special Report to help you do just that, and today it’s free. Discover 7 special companies that look to gain the most from construction and repair to roads, bridges, and buildings, plus cargo hauling and energy transformation on an almost unimaginable scale.

The views and opinions expressed herein are the views and opinions of the author and do not necessarily reflect those of Nasdaq, Inc.","Amid the current market environment, investors looking to rake in some good returns can consider the consumer discretionary sector.
Below, we have highlighted the four most popular ones that target the broader consumer discretionary sector (see all Consumer Discretionary ETFs):The Consumer Discretionary Select Sector SPDR Fund XLYThis is the largest and most popular product in the consumer discretionary space, with AUM of $20.08 billion.
Vanguard Consumer Discretionary ETF VCRThis fund currently follows the MSCI US Investable Market Consumer Discretionary 25/50 Index.
First Trust Consumer Discretionary AlphaDEX Fund FXDThis fund tracks the StrataQuant Consumer Discretionary Index, which employs the AlphaDEX stock-selection methodology to select stocks from the Russell 1000 Index.
Fidelity MSCI Consumer Discretionary Index ETF FDISThis fund tracks the MSCI USA IMI Consumer Discretionary Index.",https://www.nasdaq.com/articles/can-consumer-discretionary-etfs-make-good-bets-for-q4-2021-09-25,2021-09-25 00:00:00
91,russel 1000,Maryland’s record year prompts actuarial rate reduction,"Maryland State Retirement and Pension System is the latest fund to record an historical performance for the 2021 financial year, returning a best ever 26.7 per cent. Again public and private equities were the star performers with an exceptional 51.85 per cent return in private equity and 44.54 per cent in public equities But in recognition there might be a bill to pay for those higher returns in the future the fund has lowered its actuarial rate of return.

In what could almost be described as cruel, the ridiculous return of 51.85 per cent in the PE allocation did not beat its benchmark, a peer-group benchmark developed by State Street that returned 53.13 per cent.

Chief investment officer of the $68 billion fund, Andrew Palmer, says the private equity portfolio, which currently has a 17 per cent allocation against a benchmark of 13 per cent, is a very strong portfolio of high quality managers.

“Our philosophy for this asset class if we can put ourselves with the top managers and diversify by strategy and geography we will be strong. And our managers all did well relative to their peers,” he says in an interview with Top1000funds.com.

The real issue for the fund in PE he says is the portfolio had about 10 per cent in venture and the PE benchmark has about 17 per cent.

“My philosophy of investment is a lot of products have negative skew and you’re lucky to get par back. It’s hard to generate a lot of extra return. We look for opportunities where we can get lots of extra return without corresponding lower return and venture offers that potential for very strong returns,” he says. “The venture benchmark was up 67 per cent last year so if you didn’t have enough or bold enough venture then you didn’t do as well.”

Maryland has a target allocation of 13 per cent to private equity but due to the portfolio’s success the allocation keeps increasing.

“You can’t rebalance PE,” Palmer says.

The fund has been building out its venture allocation, with the 10 per cent of PE allocation lifted from 6 per cent a few years ago.

“The challenge is we are a public plan and venture managers are quite secretive and keep information close so there are some challenges with that. We are also large and venture portfolios are often small so it’s hard for us to write enough checks. We have some partners that help us with that and get the right managers, he says. “What is coming in venture is attractive, there is some great stuff coming in consumer tech, business tech, and medical tech.”

The fund works with 45 core managers, and overall have 64 active GP relationships which was the result of a secondaries sale in 2019 that reduced the number of relationships from a high of 94.

“We now work with active managers we have confidence in. That freed up some capital and freed our attention,” Palmer says.

Public equities

The performance of the public equities portfolio is the result of work over the past five years to improve performance.

This included looking at better management of beta exposures and closer management of regional and strategy exposures.

“We were challenged a bit on managing our exposures between regions and different strategies such as small versus large and growth versus value. We didn’t have great systems or the depth of staff to measure that in real time and manage it. So we’ve been working on that,” he says. “We’ve been measuring and managing the beta at the strategy and total plan level so we didn’t have this drag of not having enough exposures.”

Typically the fund has had a growth tilt versus value, and historically a small versus large tilt, but that has been reduced tremendously in the last few years through tactical allocations.

The 36 per cent allocation to equities is split between US equities (16 per cent) and developed international and emerging markets (10 per cent each).

Palmer says the fund only uses active where it can generate excess return which means it has a lot of passive in US equities and is fairly active everywhere else.

It manages a Russell 1000 portfolio inhouse and is contemplating other strategies it can bring inhouse.

“We are hoping to do some active inhouse too,” Palmer says. “It helps us with having more control of assets and a lower cost. But also the skill set to manage assets helps us to be better managers of others.”

In the past year the fund has been slightly over exposed to equities on a tactical basis which has been managed through a mix of managers with different styles as well as a tactical overlay with derivatives to tweak exposures.

“I wanted to have the exposures I wanted to have,” he says.

Manager outperformance

Maryland’s fund managers have performed extraordinarily well, with 13 outperforming the benchmark by more than 4 per cent, six of them outperforming by more than 8 per cent and two outperforming by more than 20 per cent.

Baillie Gifford, one of the fund’s most consistent outperformers, was up almost 95 per cent relative to the benchmark for calendar year 2020.

“We have this mentality where we are looking for managers with the potential to have outsized returns but they have good risk management so there are not big drawdowns,” Palmer says.

In the year to June 30, Palmer says the contribution to excess return came equal parts from stocks and bonds in public markets.

In equities it was the stock selection from managers, and on the bond side it was how the team allocated between different risks, specifically it was overweight spread products and underweight long treasuries with each position contributing about 100 bps in return to the total plan.

Palmers says it is an example of how the fund manages the risks of the plan, which is to try to find places where the distribution of returns is skewed in one way or the other and then maximise or minimise the exposures.

“You can see that in private credit and real estate too. We have been moving to upgrade our risk posture. The private credit portfolio had moved from high yield to a BB/B benchmark. In real estate we allowed our value added and opportunistic private real estate portfolios to mature and give back capital and become more of a core portfolio. We have spent a lot of time putting money into the market.”

In the past year the fund has added $1 billion in real estate commitments to pivot to more risky assets.

Lower return target

But despite the stellar performance for the past financial year, the fund recently reduced its actuarial rate of return, moving from 7.4 to 6.8 per cent for fiscal 2023.

“The large return we had last year pulled returns forward, all the asset classes have lower expectations today than they did a year ago and the change in the actuarial rate reflects that,” Palmer says.

Palmer likens to the situation to the year 2000 when most US public funds were fully funded with big returns achieved during the tech run.

“At the time the actuaries are saying you are too well funded so you have to increase benefits, stop making contributions or lower your assumed rate. It’s the same sort of environment. We’ve had abnormal returns and the right answer was to lower the assumed rate. Those that did in the past are among the better funded funds today. It’s recognition that there might be a bill to pay for those higher returns in the future.”

The fund is undertaking an asset allocation study with its consultant, Meketa, where it is specifically looking at a number of topics including lower interest rates and whether bonds still have the diversifying properties they had before; whether to use leverage; and whether the impact of climate change changes the mix of assets.

“I think a focus on inflation-protected assets and assets that get a lot of return from income might be where we go, it reduces the reliance on bonds.”

Asset Owner: Maryland State Retirement","“My philosophy of investment is a lot of products have negative skew and you’re lucky to get par back.
We look for opportunities where we can get lots of extra return without corresponding lower return and venture offers that potential for very strong returns,” he says.
The fund has been building out its venture allocation, with the 10 per cent of PE allocation lifted from 6 per cent a few years ago.
“The challenge is we are a public plan and venture managers are quite secretive and keep information close so there are some challenges with that.
The 36 per cent allocation to equities is split between US equities (16 per cent) and developed international and emerging markets (10 per cent each).",https://www.top1000funds.com/2021/09/marylands-record-year-prompts-actuarial-rate-reduction/,2021-09-09 07:15:46+00:00
92,russel 1000,"Investors care more about fair wages for workers than environmental issues, ESG survey shows","Environmental issues often grab the headlines when it comes to sustainable investing. In a new survey, a large number of investors say they put a higher preference on companies that pay fair wages to employees.

A report from Cerulli Associates, a research firm in the asset-management industry, showed increasing interest in environmental, social and governance (ESG) investing from affluent retail investors. The firm’s survey of those from under age 40 to over 70 showed that 49% of respondents said they would rather invest in companies that have a positive social or environmental impact, up from 43% in 2019.

When broken down by topic, preference for investing in a company that pays workers fair wages edged out a preference for environmentally friendly companies, with 65% of total respondents flagging wages and 53% citing environment.

For its report, called The Cerulli Edge-U.S. Retail Investor Edition (third-quarter 2021 edition), the firm surveyed affluent investors in the first quarter of 2021, people with more than $250,000 in investable assets, and the near-affluent, those who earn more than $125,000 annually and are under age 45.

Biggest surprise

The topic of fair wages falls under the social pillar of ESG investing, but like a lot of social issues, it slips through the cracks when it comes to bigger topics such as climate change. Cerulli said the response to the wages question was the biggest surprise in the survey’s findings, and the data highlight a big challenge for people who want to own ESG investments — the focus on environmental issues often overshadow social and governance issues.

Why might fair wages resonate so strongly with survey participants? Cerulli suggested an emotional tie.

“Respondents may be considering the importance they placed in their own life on earning a livable wage, while environmental concerns may never have been a major consideration for them,” the report said.

The charts, below, from Cerullli show the gap in ESG investing interest by age in their survey. There’s little surprise that younger investors are more interested in ESG. But Cerulli says what’s particularly notable is the difference between how older survey participants responded to the fair wages question versus their views on ESG overall.

“These results are indications of interest 16 to 25 percentage points higher among respondents in the three oldest cohorts compared with their … overall ESG interest levels,” the research firm said.

Here are the percentages of people that preferred ESG investing, by age and investible assets, during the first quarter of 2021. The ages are for heads of households:

Household investable assets Under 40 40-49 50-59 60-69 Over 70 Total $100K-$250K 71% 73% N/A N/A N/A 72% $250K-$500K 75% 62% 54% 40% 38% 50% $500K-$1M 81% 69% 53% 36% 29% 45% $1M-$2M N/A 73% 46% 33% 30% 41% >$2M N/A 64% 46% 31% 25% 40% Total 75% 68% 51% 36% 31% 49% Source: Cerulli Associates

Here are the percentages of people that preferred investing in companies with fair wages:

Household investable assets Under 40 40-49 50-59 60-69 Over 70 Total $100K-$250K 79% 76% N/A N/A N/A 78% $250K-$500K 88% 68% 76% 57% 60% 67% $500K-$1M 82% 82% 67% 63% 54% 66% $1M-$2M N/A 81% 54% 54% 59% 60% >$2M N/A 73% 64% 44% 51% 54% Total 82% 75% 67% 56% 57% 65% Source: Cerulli Associates

Here are the percentages of people that preferred investing in environmentally friendly companies:

Household investable assets Under 40 40-49 50-59 60-69 Over 70 Total $100K-$250K 75% 67% N/A N/A N/A 72% $250K-$500K 80% 63% 52% 41% 43% 51% $500K-$1M 80% 71% 60% 46% 38% 53% $1M-$2M N/A 71% 42% 37% 43% 46% >$2M N/A 74% 52% 38% 36% 46% Total 78% 67% 52% 41% 41% 53% Source: Cerulli Associates

Funds that highlight labor

No mutual funds or exchange traded funds exclusively target social themes of fair wages or labor practices. However, most of the actively managed, long-established sustainable investment mutual fund families such as Calvert, Parnassus or Pax World Funds often include screens for companies that treat employees well as part of their overall sustainability investment criteria.

There are four passive ETFs with assets under management of nearly $100 million or more that specifically screen for positive treatment of employees or fair labor practices as part of their index methodology for stock selection. All are large-cap U.S. equity funds, and not surprisingly, all hold the tech heavyweights of Apple AAPL, Alphabet GOOG and Microsoft MSFT in their top 10 holdings, but some also have a few surprises as their biggest holdings.

1. Global X Conscious Companies ETF KRMA is the largest of the four funds, with $500 million in assets and an annual expense ratio of 0.43%. It’s an equal-weighted index that uses ESG metrics to measure how well a company treats all stakeholders, including employees, customers, suppliers, investors and the communities where the company operates. Technology occupies a 29% weighting, and one non-tech holding in the top 10 is commercial real-estate firm Jones Lang LaSalle JLL, which ESG risk-ratings firm Sustainalytics considers to have negligible ESG risk. The ETF is up 21% year-to-date, while the S&P 500 SPX is up 22%.

2. IQ Candriam ESG US Equity ETF IQSU is a market-cap weighted fund with $484 million in assets and a 0.09% expense ratio. The fund’s ESG selection criteria scores companies based on how it treats its customers and employees, a firm’s environmental initiatives and how well suppliers adhere to fair labor standards, among other issues. It has the highest weighting to technology, at 43%. Tesla TSLA is in the top five. However, there are many news reports of poor labor management. MSCI’s ESG ratings considers Tesla a laggard on labor issues. The ETF is up 22% year-to-date, matching the S&P 500’s return.

3. Goldman Sachs JUST U.S. Large Cap Equity ETF JUST is a tier-weighted index of companies in the Russell 1000, building the index based on an annual survey of business behavior priorities. Companies that treat their workers well, including on worker pay and well-being, get the highest weight. The fund has a 35% technology-sector weighting. Among the highest-weighted non-tech names is Johnson & Johnson JNJ, which MSCI considers an ESG leader in human capital development. Both the ETF and the Russell 1000 index are up 21%. It has $264 million in assets and a 0.20% expense ratio.

4. Humankind U.S. Stock HKND screens companies on four “humankind values,” the value a firm creates for investors, consumers, employees and society overall. The index methodology adjusts on the basis of the individual firm’s supply-chain relationships. The ETF’s heaviest weighting is to health care, at 31%, with technology at 16%. Notable top 10 holdings are agricultural firm Bunge BG, which received MSCI’s top ESG rating, and Pfizer PFE, which MSCI considers a laggard overall among pharmaceutical companies. It launched in February and has $95 million in assets. It’s up 5.5% in three months versus the S&P 500’s return of 8%. It has an expense ratio of 0.11%.

As with any investment, one should look beyond the fund’s name and initial description to vet the holdings before they consider buying a fund.

Debbie Carlson is a MarketWatch columnist. She doesn’t own any of the funds or stocks mentioned in this article. Follow her on Twitter @DebbieCarlson1.","In a new survey, a large number of investors say they put a higher preference on companies that pay fair wages to employees.
Why might fair wages resonate so strongly with survey participants?
The charts, below, from Cerullli show the gap in ESG investing interest by age in their survey.
But Cerulli says what’s particularly notable is the difference between how older survey participants responded to the fair wages question versus their views on ESG overall.
Here are the percentages of people that preferred ESG investing, by age and investible assets, during the first quarter of 2021.",https://www.marketwatch.com/story/investors-care-more-about-fair-wages-for-workers-than-environmental-issues-esg-survey-shows-11630687516,2021-09-09 07:15:46+00:00
93,russel 1000,14 dividend stocks from a winning value manager as the broader market hits record highs,"Professional investors following value strategies emphasize total returns over the long haul. But some investors want current income to go along with that growth.

John Buckingham, editor of the Prudent Speculator Newsletter, shares a list of 14 dividend stocks selected for yield and value, below.

The Prudent Speculator (TPS) is published...","Professional investors following value strategies emphasize total returns over the long haul.
But some investors want current income to go along with that growth.
John Buckingham, editor of the Prudent Speculator Newsletter, shares a list of 14 dividend stocks selected for yield and value, below.
The Prudent Speculator (TPS) is published...",https://www.marketwatch.com/story/14-dividend-stocks-from-a-winning-value-manager-as-the-broader-market-hits-record-highs-11630673764,2021-09-09 07:15:46+00:00
