,Ticker,Title,Article,Summary,Link,Date
105,VXRT,"How Much Are 1-800-FLOWERS.COM, Inc. (NASDAQ:FLWS) Insiders Taking Off The Table?","We often see insiders buying up shares in companies that perform well over the long term. Unfortunately, there are also plenty of examples of share prices declining precipitously after insiders have sold shares. So before you buy or sell 1-800-FLOWERS.COM, Inc. (NASDAQ:FLWS), you may well want to know whether insiders have been buying or selling.

What Is Insider Selling?

It is perfectly legal for company insiders, including board members, to buy and sell stock in a company. However, rules govern insider transactions, and certain disclosures are required.

Insider transactions are not the most important thing when it comes to long-term investing. But it is perfectly logical to keep tabs on what insiders are doing. For example, a Harvard University study found that 'insider purchases earn abnormal returns of more than 6% per year'.

1-800-FLOWERS.COM Insider Transactions Over The Last Year

In the last twelve months, the biggest single sale by an insider was when the Founder & Executive Chairman, James McCann, sold US$19m worth of shares at a price of US$28.65 per share. So it's clear an insider wanted to take some cash off the table, even below the current price of US$30.47. As a general rule we consider it to be discouraging when insiders are selling below the current price, because it suggests they were happy with a lower valuation. However, while insider selling is sometimes discouraging, it's only a weak signal. It is worth noting that this sale was only 7.5% of James McCann's holding.

In the last year 1-800-FLOWERS.COM insiders didn't buy any company stock. The chart below shows insider transactions (by companies and individuals) over the last year. By clicking on the graph below, you can see the precise details of each insider transaction!

NasdaqGS:FLWS Insider Trading Volume June 1st 2021

If you like to buy stocks that insiders are buying, rather than selling, then you might just love this free list of companies. (Hint: insiders have been buying them).

1-800-FLOWERS.COM Insiders Are Selling The Stock

The last quarter saw substantial insider selling of 1-800-FLOWERS.COM shares. Specifically, insiders ditched US$105k worth of shares in that time, and we didn't record any purchases whatsoever. Overall this makes us a bit cautious, but it's not the be all and end all.

Insider Ownership of 1-800-FLOWERS.COM

I like to look at how many shares insiders own in a company, to help inform my view of how aligned they are with insiders. We usually like to see fairly high levels of insider ownership. 1-800-FLOWERS.COM insiders own about US$945m worth of shares (which is 48% of the company). This kind of significant ownership by insiders does generally increase the chance that the company is run in the interest of all shareholders.

So What Do The 1-800-FLOWERS.COM Insider Transactions Indicate?

Insiders sold 1-800-FLOWERS.COM shares recently, but they didn't buy any. And there weren't any purchases to give us comfort, over the last year. But it is good to see that 1-800-FLOWERS.COM is growing earnings. It is good to see high insider ownership, but the insider selling leaves us cautious. In addition to knowing about insider transactions going on, it's beneficial to identify the risks facing 1-800-FLOWERS.COM. At Simply Wall St, we found 1 warning sign for 1-800-FLOWERS.COM that deserve your attention before buying any shares.

But note: 1-800-FLOWERS.COM may not be the best stock to buy. So take a peek at this free list of interesting companies with high ROE and low debt.

For the purposes of this article, insiders are those individuals who report their transactions to the relevant regulatory body. We currently account for open market transactions and private dispositions, but not derivative transactions.

This article by Simply Wall St is general in nature. It does not constitute a recommendation to buy or sell any stock, and does not take account of your objectives, or your financial situation. We aim to bring you long-term focused analysis driven by fundamental data. Note that our analysis may not factor in the latest price-sensitive company announcements or qualitative material. Simply Wall St has no position in any stocks mentioned.



Have feedback on this article? Concerned about the content? Get in touch with us directly. Alternatively, email editorial-team (at) simplywallst.com.

The views and opinions expressed herein are the views and opinions of the author and do not necessarily reflect those of Nasdaq, Inc.","So before you buy or sell 1-800-FLOWERS.COM, Inc. (NASDAQ:FLWS), you may well want to know whether insiders have been buying or selling.
It is perfectly legal for company insiders, including board members, to buy and sell stock in a company.
In the last year 1-800-FLOWERS.COM insiders didn't buy any company stock.
1-800-FLOWERS.COM Insiders Are Selling The StockThe last quarter saw substantial insider selling of 1-800-FLOWERS.COM shares.
So What Do The 1-800-FLOWERS.COM Insider Transactions Indicate?",https://www.nasdaq.com/articles/how-much-are-1-800-flowers.com-inc.-nasdaq%3Aflws-insiders-taking-off-the-table-2021-06-01,2021-06-01 00:00:00
106,VXRT,Returns on Capital Paint A Bright Future For Turtle Beach (NASDAQ:HEAR),"Did you know there are some financial metrics that can provide clues of a potential multi-bagger? Ideally, a business will show two trends; firstly a growing return on capital employed (ROCE) and secondly, an increasing amount of capital employed. Put simply, these types of businesses are compounding machines, meaning they are continually reinvesting their earnings at ever-higher rates of return. So when we looked at the ROCE trend of Turtle Beach (NASDAQ:HEAR) we really liked what we saw.

Return On Capital Employed (ROCE): What is it?

Just to clarify if you're unsure, ROCE is a metric for evaluating how much pre-tax income (in percentage terms) a company earns on the capital invested in its business. To calculate this metric for Turtle Beach, this is the formula:

Return on Capital Employed = Earnings Before Interest and Tax (EBIT) ÷ (Total Assets - Current Liabilities)

0.49 = US$67m ÷ (US$207m - US$72m) (Based on the trailing twelve months to March 2021).

So, Turtle Beach has an ROCE of 49%. In absolute terms that's a great return and it's even better than the Tech industry average of 6.1%.

NasdaqGM:HEAR Return on Capital Employed June 25th 2021

Above you can see how the current ROCE for Turtle Beach compares to its prior returns on capital, but there's only so much you can tell from the past. If you're interested, you can view the analysts predictions in our free report on analyst forecasts for the company.

What Does the ROCE Trend For Turtle Beach Tell Us?

We're delighted to see that Turtle Beach is reaping rewards from its investments and is now generating some pre-tax profits. About five years ago the company was generating losses but things have turned around because it's now earning 49% on its capital. Not only that, but the company is utilizing 39% more capital than before, but that's to be expected from a company trying to break into profitability. This can tell us that the company has plenty of reinvestment opportunities that are able to generate higher returns.

On a side note, we noticed that the improvement in ROCE appears to be partly fueled by an increase in current liabilities. Effectively this means that suppliers or short-term creditors are now funding 35% of the business, which is more than it was five years ago. Keep an eye out for future increases because when the ratio of current liabilities to total assets gets particularly high, this can introduce some new risks for the business.

The Bottom Line

In summary, it's great to see that Turtle Beach has managed to break into profitability and is continuing to reinvest in its business. Since the stock has returned a staggering 739% to shareholders over the last five years, it looks like investors are recognizing these changes. So given the stock has proven it has promising trends, it's worth researching the company further to see if these trends are likely to persist.

If you want to continue researching Turtle Beach, you might be interested to know about the 1 warning sign that our analysis has discovered.

Turtle Beach is not the only stock earning high returns. If you'd like to see more, check out our free list of companies earning high returns on equity with solid fundamentals.

This article by Simply Wall St is general in nature. It does not constitute a recommendation to buy or sell any stock, and does not take account of your objectives, or your financial situation. We aim to bring you long-term focused analysis driven by fundamental data. Note that our analysis may not factor in the latest price-sensitive company announcements or qualitative material. Simply Wall St has no position in any stocks mentioned.



Have feedback on this article? Concerned about the content? Get in touch with us directly. Alternatively, email editorial-team (at) simplywallst.com.

The views and opinions expressed herein are the views and opinions of the author and do not necessarily reflect those of Nasdaq, Inc.","Ideally, a business will show two trends; firstly a growing return on capital employed (ROCE) and secondly, an increasing amount of capital employed.
So when we looked at the ROCE trend of Turtle Beach (NASDAQ:HEAR) we really liked what we saw.
Return On Capital Employed (ROCE): What is it?
We're delighted to see that Turtle Beach is reaping rewards from its investments and is now generating some pre-tax profits.
If you want to continue researching Turtle Beach, you might be interested to know about the 1 warning sign that our analysis has discovered.",https://www.nasdaq.com/articles/returns-on-capital-paint-a-bright-future-for-turtle-beach-nasdaq%3Ahear-2021-06-25,2021-06-25 00:00:00
107,VXRT,"Himax Technologies, Inc. (NASDAQ:HIMX) Looks Like A Good Stock, And It's Going Ex-Dividend Soon","Himax Technologies, Inc. (NASDAQ:HIMX) is about to trade ex-dividend in the next four days. The ex-dividend date is one business day before the record date, which is the cut-off date for shareholders to be present on the company's books to be eligible for a dividend payment. The ex-dividend date is important as the process of settlement involves two full business days. So if you miss that date, you would not show up on the company's books on the record date. In other words, investors can purchase Himax Technologies' shares before the 29th of June in order to be eligible for the dividend, which will be paid on the 12th of July.

The company's upcoming dividend is US$0.26 a share, following on from the last 12 months, when the company distributed a total of US$0.27 per share to shareholders. Looking at the last 12 months of distributions, Himax Technologies has a trailing yield of approximately 1.9% on its current stock price of $14.12. If you buy this business for its dividend, you should have an idea of whether Himax Technologies's dividend is reliable and sustainable. We need to see whether the dividend is covered by earnings and if it's growing.

Dividends are typically paid from company earnings. If a company pays more in dividends than it earned in profit, then the dividend could be unsustainable. That's why it's good to see Himax Technologies paying out a modest 43% of its earnings. That said, even highly profitable companies sometimes might not generate enough cash to pay the dividend, which is why we should always check if the dividend is covered by cash flow. Luckily it paid out just 0.003% of its free cash flow last year.

It's positive to see that Himax Technologies's dividend is covered by both profits and cash flow, since this is generally a sign that the dividend is sustainable, and a lower payout ratio usually suggests a greater margin of safety before the dividend gets cut.

Click here to see the company's payout ratio, plus analyst estimates of its future dividends.

Have Earnings And Dividends Been Growing?

NasdaqGS:HIMX Historic Dividend June 24th 2021

Businesses with strong growth prospects usually make the best dividend payers, because it's easier to grow dividends when earnings per share are improving. If business enters a downturn and the dividend is cut, the company could see its value fall precipitously. It's encouraging to see Himax Technologies has grown its earnings rapidly, up 34% a year for the past five years. Himax Technologies is paying out less than half its earnings and cash flow, while simultaneously growing earnings per share at a rapid clip. This is a very favourable combination that can often lead to the dividend multiplying over the long term, if earnings grow and the company pays out a higher percentage of its earnings.

Many investors will assess a company's dividend performance by evaluating how much the dividend payments have changed over time. Since the start of our data, 10 years ago, Himax Technologies has lifted its dividend by approximately 0.8% a year on average. Earnings per share have been growing much quicker than dividends, potentially because Himax Technologies is keeping back more of its profits to grow the business.

To Sum It Up

Is Himax Technologies an attractive dividend stock, or better left on the shelf? Himax Technologies has grown its earnings per share while simultaneously reinvesting in the business. Unfortunately it's cut the dividend at least once in the past 10 years, but the conservative payout ratio makes the current dividend look sustainable. There's a lot to like about Himax Technologies, and we would prioritise taking a closer look at it.

While it's tempting to invest in Himax Technologies for the dividends alone, you should always be mindful of the risks involved. Every company has risks, and we've spotted 2 warning signs for Himax Technologies you should know about.

A common investment mistake is buying the first interesting stock you see. Here you can find a list of promising dividend stocks with a greater than 2% yield and an upcoming dividend.

This article by Simply Wall St is general in nature. It does not constitute a recommendation to buy or sell any stock, and does not take account of your objectives, or your financial situation. We aim to bring you long-term focused analysis driven by fundamental data. Note that our analysis may not factor in the latest price-sensitive company announcements or qualitative material. Simply Wall St has no position in any stocks mentioned.



Have feedback on this article? Concerned about the content? Get in touch with us directly. Alternatively, email editorial-team (at) simplywallst.com.

The views and opinions expressed herein are the views and opinions of the author and do not necessarily reflect those of Nasdaq, Inc.","Himax Technologies, Inc. (NASDAQ:HIMX) is about to trade ex-dividend in the next four days.
Looking at the last 12 months of distributions, Himax Technologies has a trailing yield of approximately 1.9% on its current stock price of $14.12.
That's why it's good to see Himax Technologies paying out a modest 43% of its earnings.
To Sum It UpIs Himax Technologies an attractive dividend stock, or better left on the shelf?
There's a lot to like about Himax Technologies, and we would prioritise taking a closer look at it.",https://www.nasdaq.com/articles/himax-technologies-inc.-nasdaq%3Ahimx-looks-like-a-good-stock-and-its-going-ex-dividend-soon,2021-06-25 00:00:00
108,VXRT,Did United Therapeutics' (NASDAQ:UTHR) Share Price Deserve to Gain 64%?,"The main point of investing for the long term is to make money. Furthermore, you'd generally like to see the share price rise faster than the market But United Therapeutics Corporation (NASDAQ:UTHR) has fallen short of that second goal, with a share price rise of 64% over five years, which is below the market return. Some buyers are laughing, though, with an increase of 46% in the last year.

In his essay The Superinvestors of Graham-and-Doddsville Warren Buffett described how share prices do not always rationally reflect the value of a business. By comparing earnings per share (EPS) and share price changes over time, we can get a feel for how investor attitudes to a company have morphed over time.

During five years of share price growth, United Therapeutics actually saw its EPS drop 14% per year.

This means it's unlikely the market is judging the company based on earnings growth. Since the change in EPS doesn't seem to correlate with the change in share price, it's worth taking a look at other metrics.

The revenue reduction of 2.3% per year is not a positive. It certainly surprises us that the share price is up, but perhaps a closer examination of the data will yield answers.

The company's revenue and earnings (over time) are depicted in the image below (click to see the exact numbers).

NasdaqGS:UTHR Earnings and Revenue Growth June 29th 2021

United Therapeutics is a well known stock, with plenty of analyst coverage, suggesting some visibility into future growth. If you are thinking of buying or selling United Therapeutics stock, you should check out this free report showing analyst consensus estimates for future profits.

A Different Perspective

United Therapeutics' TSR for the year was broadly in line with the market average, at 46%. That gain looks pretty satisfying, and it is even better than the five-year TSR of 10% per year. Even if the share price growth slows down from here, there's a good chance that this is business worth watching in the long term. I find it very interesting to look at share price over the long term as a proxy for business performance. But to truly gain insight, we need to consider other information, too. Consider for instance, the ever-present spectre of investment risk. We've identified 1 warning sign with United Therapeutics , and understanding them should be part of your investment process.

For those who like to find winning investments this free list of growing companies with recent insider purchasing, could be just the ticket.

Please note, the market returns quoted in this article reflect the market weighted average returns of stocks that currently trade on US exchanges.

This article by Simply Wall St is general in nature. It does not constitute a recommendation to buy or sell any stock, and does not take account of your objectives, or your financial situation. We aim to bring you long-term focused analysis driven by fundamental data. Note that our analysis may not factor in the latest price-sensitive company announcements or qualitative material. Simply Wall St has no position in any stocks mentioned.



Have feedback on this article? Concerned about the content? Get in touch with us directly. Alternatively, email editorial-team (at) simplywallst.com.

The views and opinions expressed herein are the views and opinions of the author and do not necessarily reflect those of Nasdaq, Inc.","Furthermore, you'd generally like to see the share price rise faster than the market But United Therapeutics Corporation (NASDAQ:UTHR) has fallen short of that second goal, with a share price rise of 64% over five years, which is below the market return.
During five years of share price growth, United Therapeutics actually saw its EPS drop 14% per year.
Since the change in EPS doesn't seem to correlate with the change in share price, it's worth taking a look at other metrics.
It certainly surprises us that the share price is up, but perhaps a closer examination of the data will yield answers.
If you are thinking of buying or selling United Therapeutics stock, you should check out this free report showing analyst consensus estimates for future profits.",https://www.nasdaq.com/articles/did-united-therapeutics-nasdaq%3Authr-share-price-deserve-to-gain-64-2021-06-29,2021-06-29 00:00:00
