,Ticker,Title,Article,Summary,Link,Date
40,VXRT,"Common Sense Networks launches Sensical, a free, hand-curated streaming service for kids","Common Sense Media has made a name for itself among parents as a useful resource for vetting entertainment and technology in terms of its age-appropriateness. Now, the organization's for-profit affiliate, Common Sense Networks, is taking inspiration from those kid-friendly recommendations with the launch of a new streaming service called Sensical. The service offers age-appropriate, entertaining, and educational videos for children ages 2 through 10.

At launch, the free, ad-supported service includes over 15,000 hand-curated videos and over 50 topic-based channels for children to explore. And unlike other platforms, like Netflix or YouTube, Sensical doesn't use algorithms to make content recommendations. Instead, kids are encouraged to follow their own interests and passions across over 50 topic-based channels. This includes things like Adventures, Animals, Arts & Crafts, Music, Science, Sports, Video Games, and other sorts of kid-friendly topics.

Kids can star these channels, or individual videos or series, in order to keep up with their favorite content in a dedicated Favorites section within the app.

They will see a selection of these channels based on their age, but the company is working to expand the channel lineup so there will be even more specific categories in the future. For example, instead of just ""sports,"" there could be channels like ""soccer"" or ""gymnastics."" Instead of ""Arts,"" there could be ""drawing"" or ""origami."" Instead of just ""science,"" it could include channels like ""geography"" or ""robotics,"" and so on.

Image Credits: Common Sense Networks

The app also features a Live TV section, which is programmed throughout the day with kid-friendly content, so kids don't have to browse to find something to quickly watch.

Story continues

While other streaming services on the market offer kid-friendly content -- as that's a huge selling point for subscribers -- it's not always organized in a way that makes sense. Sometimes, all the content gets lumped into a general ""Kids"" category where videos for little kids are mixed in with content for older children. Sensical, meanwhile, curates the content recommendations into three different experiences, including preschool (2-4), little kids (5-7), and big kids (8-10).

What the child sees is based on how parents configure their profiles. Plus, parents can use the service's ParentZone in-app dashboard to set screen-time limits, extend limits as needed, and view daily reports on what the child has watched.

The service's best feature, however, is that the content is assured to be age-appropriate -- even the ads.

This is possible because the curation approach Sensical takes is very different from YouTube Kids. YouTube's app for kids leans on algorithms to filter out adult content from YouTube's broader library, but the company doesn't manually review all the videos it includes. It warns parents that some inappropriate content could slip through. (And it has.)

Common Sense Networks, meanwhile, says dozens of trained child-development experts view, vet and rate ""every single frame of video"" that goes live on its service using its proprietary IP and patent-pending process. This system involves tagging content with specific child-developmental benefits, too.

Sensical also vets its advertising, which is how the service is supported, with similar direct oversight. Its experts review the sponsor's content to ensure it's appropriate for children -- an area that's often overlooked on other services.

Image Credits: Common Sense Networks

To fill its library, Common Sense Networks partnered with dozens of studios and distribution partners, as well as digital-first creators.

Studio and distribution partners include CAKE (Poppy Cat), Cyber Group Studios (Leo The Wildlife Ranger), The Jim Henson Company (The Wubbulous World of Dr. Seuss, Jim Henson's Animal Show with Stinky and Jake), Mattel (Kipper, Pingu, Max Steel), Raydar Media (Five Apples’ limited series, Apple Tree House), Superights (Bo Bear, Handico), WildBrain (Teletubbies, Rev & Roll), Xilam Animation (Learn and Play with Paprika, Moka's Fabulous Adventures), ZDF Enterprises (Lexi & Lottie, School of Roars), Zodiak Kids (Mister Maker, Tee and Mo), ABC Commercial, CBC & Radio-Canada Distribution, Jetpack Distribution, Nelvana, 9 Story Distribution International, Sesame Workshop, Serious Lunch, and Studio 100.

Digital creators, meanwhile, include ABCMouse, Aaron’s Animals, Alphabet Rockers, batteryPOP, California Academy of Sciences, GoldieBlox, The Gotham Group’s Gotham Reads, Guggenheim Museum, Howdytoons, Kids’ Black History, MEL Science + Chemistry, N*Gen, Pinkfong, Penguin Random House’s Brightly Storytime, Studio71 (Parry Gripp, Maymo, Hyper Roblox), Tankee, Ubongo Kids, Vooks, Bounce Patrol, Hevesh5, Mother Goose Club, StacyPlays, Super Simple Songs and The Whistle.

The service abides by the U.S. children's privacy laws (COPPA), and is certified by the kidSAFE Seal Program.

Image Credits: Common Sense Networks

Having briefly toyed around with the mobile app, it appears Sensical works as described. If I had any complaints personally, it would only be that the experience could be dismissed as ""baby stuff"" by older kids approaching their tween years, due to the cute pictures and youthful iconography used in the app's design. Kids in older age groups take issue with being treated as if they're younger -- and they take particular notice of anything that does so.

The same complaint goes for the Live TV programming, which was clearly aimed at littler kids when we checked it out, despite testing the app as a child profile whose age was set to ""10.""

I also think it would be nice if there were a better way to track Favorite channels and see when they're updated with new videos, as kids moving to Sensical from YouTube will want to ""feel"" like they're still connected to new and fresh content and not a library. But Sensical isn't YouTube. There's a trade-off between hand-curation and timeliness, and Sensical is favoring the former.

Sensical had been first introduced this spring during a closed beta, but is now publicly available to stream across web and mobile on iOS, Android, Roku, Amazon Fire TV and Apple TV. This summer, it will expand to more distribution platforms, including VIZIO.","Common Sense Media has made a name for itself among parents as a useful resource for vetting entertainment and technology in terms of its age-appropriateness.
Now, the organization's for-profit affiliate, Common Sense Networks, is taking inspiration from those kid-friendly recommendations with the launch of a new streaming service called Sensical.
And unlike other platforms, like Netflix or YouTube, Sensical doesn't use algorithms to make content recommendations.
Image Credits: Common Sense NetworksTo fill its library, Common Sense Networks partnered with dozens of studios and distribution partners, as well as digital-first creators.
Image Credits: Common Sense NetworksHaving briefly toyed around with the mobile app, it appears Sensical works as described.",https://finance.yahoo.com/news/common-sense-networks-launches-sensical-172406274.html,2021-06-28 00:00:00
41,VXRT,How I inadvertently became a vinyl nerd,"I don't consider myself an audiophile. For years, my primary pair of headphones were just the wired earbuds that came with my phone. I’m hard-pressed to tell the difference between MP3 and FLAC. Yet, I recently bought a U-Turn Audio Orbit Plus turntable, a pair of Kanto YU4 speakers and several vinyl records on eBay. How did this happen?

It all began nearly a decade ago when I joined a They Might Be Giants fan club. For an annual fee, the band would send members not just bumper stickers and t-shirts, but also several 7-inch singles and the occasional 12-inch LP. Two years later and I had accumulated a mini collection of vinyl that I had no way of playing.

Not wanting to spend a ton of money, I decided to see what the fuss was about and buy a cheap Crosley Cruiser Deluxe (you know, the one in its own suitcase that every late-millennial hipster bought from Target a few years back). I wasn’t expecting much for $50, but somehow it still managed to fall far short of those expectations, with thin and flat audio that sounded bad even to my untrained ears.

U-Turn Audio Orbit Plus

But the experience was strangely charming: It’s hypnotic to set a record on the platter, watch it spin and witness the needle transforming its grooves into sound. Playing a record also reminded me of my childhood, when I would spend hours in my bedroom listening to cassette tapes and CDs, and reading the liner notes. I got lost in the music in a way that random playlists on Spotify can’t quite replicate.

Story continues

I looked around for higher-quality turntables, but the only ones I could find at the time were far outside my price range. I was also reluctant to spend more money on extra equipment like amplifiers, preamps and speakers. Plus I wasn’t entirely convinced that my non-audiophile ears would be able to tell the difference between vinyl and digital. It didn’t seem worth it.

But as time went by, I secretly longed for one. I know it sounds shallow, but to me turntables just look cool. Additionally, vinyl has undergone a resurgence and it’s not uncommon these days for artists to release special edition LPs with album artwork and bonus tracks that aren't available elsewhere. Call me pretentious, but the idea of owning something tangible, something beautiful, that also supports an artist I love, really appeals to me.

Kanto YU4

Then came 2020, and in a fit of quarantine-induced mania, I decided that this was the time to finally give in to the vinyl lust that’s been building all these years. After a copious amount of research that included reading reviews and watching YouTube videos, I chose a setup that could deliver a combination of affordability, design and quality, at least for my tastes and budget.

I knew right away that I wanted U-Turn Audio’s Orbit Plus ($309) as the turntable. It’s not quite as inexpensive as the company’s own Orbit Basic ($200), but it’s still relatively affordable compared to some of the higher-end turntables on the market. Admittedly, one of my primary reasons for going with U-Turn Audio is the sleek and minimalistic design of the company’s hardware. I opted for the Plus over the Basic because its acrylic platter makes for more consistent speeds. It also comes with the Ortofon OM5E cartridge, which I had read delivers a more neutral, balanced sound.

As someone who’s never set up a turntable before, I was impressed with how easy the U-Turn Audio was to put together. When I received it, the tonearm and cartridge were already in place. All I had to do was position the platter, the mat and the belt, connect the appropriate plugs, and I was ready to go in a little over five minutes. Plus, changing speeds between 33 rpm and 45 rpm is as easy as slipping the belt into another pulley groove.

U Turn Audio Orbit Plus

Another thing I like about the Orbit Plus is how customizable it is. It comes in a variety of different eye-catching colors, and I could choose to change out the cartridge for something a little more premium later on if I wanted to. I could also add a built-in phono preamp (which is needed to amplify the signal from the cartridge to your amplifier or speakers) or incorporate a cue lever that lowers and raises the tonearm. Bear in mind that adding these different options (aside from the color change) will cost extra. The addition of the preamp, for example, increases the price of the Orbit Plus to $379.

I went without a preamp on the Orbit Plus because my choice of speakers are the Kanto YU4s, which already have one built-in. I decided against separate components like an amplifier or a standalone phono preamp because I wanted to keep the setup simple, with as few devices as possible. Powered speakers like the YU4 allow me to do that. In fact, the YU4’s versatility is one of the reasons I like it so much. It has RCA and AUX inputs, optical inputs, a USB charge port, a subwoofer output, plus Bluetooth capabilities. Thanks to the latter feature, I often use the YU4 as computer speakers as well.

U Turn Audio Orbit Plus

What's more, the YU4s are just so good-looking. It has this modern, minimalist design that I think pairs wonderfully with the Orbit Plus. I currently have the YU4s positioned on either side of it, and I'm very pleased with how it all looks together. On top of that, I found the YU4’s price ($370) quite reasonable as well, especially with all of its features.

As a self-professed non-audiophile, I found the audio quality of this entire setup to be more than satisfactory. The highs are crisp and the volume is powerful enough to fill the room. The one complaint I would have is that the Kanto YU4’s bass is a little lacking. It’s there, but it just isn’t as thumpy as I would like. Kanto does sell a separate subwoofer for extra bass, but for $300, I think I can live without it.

Since I’ve purchased the turntable, I’ve spent many evenings sitting in my room listening to entire albums without the distractions from the phone or computer. I even enjoy the ritual of cleaning each record and putting them back in their sleeves. It’s become a form of meditative self-care for me. Is that too precious? Does that make me a hipster? I don’t pretend it isn’t at least a little tiresome. But right now, in the midst of a pandemic, I’ll take any kind of self-care I can get.","Yet, I recently bought a U-Turn Audio Orbit Plus turntable, a pair of Kanto YU4 speakers and several vinyl records on eBay.
U-Turn Audio Orbit PlusBut the experience was strangely charming: It’s hypnotic to set a record on the platter, watch it spin and witness the needle transforming its grooves into sound.
Admittedly, one of my primary reasons for going with U-Turn Audio is the sleek and minimalistic design of the company’s hardware.
U Turn Audio Orbit PlusAnother thing I like about the Orbit Plus is how customizable it is.
It has this modern, minimalist design that I think pairs wonderfully with the Orbit Plus.",https://finance.yahoo.com/news/u-turn-audio-orbit-plus-kanto-yu4-irl-150023872.html,2021-06-28 00:00:00
42,VXRT,"McDonald's hit by data breaches in US, South Korea and Taiwan","McDonald's is the latest massive corporation to be hit by a cyberattack. According to The Wall Street Journal, the bad actors that infiltrated its systems managed to steal customer and employee information from its businesses in the US, South Korea and Taiwan. No customer data was stolen in the US, in particular, but the hackers got away with contact information for US employees and franchisees. They also helped themselves to some store information, including seating capacity and the size of play areas.

In South Korea and Taiwan, however, the hackers were able to steal customer information, including people's emails, phone numbers and delivery addresses. Taiwanese employees' names and contact details were stolen, as well. The fast food chain assured The Journal, however, that no customer payment information was affected in this data breach.

The company discovered the incident after it hired external consultants to investigate unauthorized activity on an internal security system. McDonald's cut off the unauthorized access a week after it was identified for the three markets, and it credits the increased investment it made in cybersecurity in recent years for being able to launch a quick response. It's worth noting that the investigators also flagged South Africa and Russia, and McDonald's said it will notify those divisions of possible unauthorized access to their information.

""Moving forward, McDonald’s will leverage the findings from the investigation as well as input from security resources to identify ways to further enhance our existing security measures,"" the fast food giant said in a statement.

While the bad actors made away with some sensitive information, ransomware wasn't involved in this incident unlike in the attacks that hit JBS, Colonial Pipeline and numerous other corporations. JBS, one of the biggest meat suppliers in the US, paid an equivalent of $11 million in ransom. Meanwhile, Colonial Pipeline paid its attackers 75 Bitcoins (worth around $4.3 million at the time) after the hack led to fuel shortages across the East Coast. That said, the DOJ was able to recover 63.7 Bitcoins of the ransom paid by obtaining a private key to the hackers' wallet.","According to The Wall Street Journal, the bad actors that infiltrated its systems managed to steal customer and employee information from its businesses in the US, South Korea and Taiwan.
No customer data was stolen in the US, in particular, but the hackers got away with contact information for US employees and franchisees.
In South Korea and Taiwan, however, the hackers were able to steal customer information, including people's emails, phone numbers and delivery addresses.
The fast food chain assured The Journal, however, that no customer payment information was affected in this data breach.
It's worth noting that the investigators also flagged South Africa and Russia, and McDonald's said it will notify those divisions of possible unauthorized access to their information.",https://finance.yahoo.com/news/mcdonalds-us-south-korea-taiwan-data-breach-163041102.html,2021-06-28 00:00:00
43,VXRT,Valorant's latest Agent is a robot with an ability that lets anyone revive him,"Ever since Riot Games offered a small tease during the Summer Games Fest, Valorant players have had a genuine reason to believe that the new agent coming to the popular free-to-play shooter will be a robot. Not one to keep fans guessing, the company today unveiled KAY/O, a ""machine of war"" whose mechanics are all named for code terminology and borrow a little from other popular FPSes.

KAY/O is an initiator with three throwable abilities. The first is ZERO/point, a knife that when cast lodges into the first surface it hits and suppresses anyone within its blast radius. Think Revenant's Silence from Apex Legends but with a blade instead of a device. Opponents caught within its area of effect will find themselves unable to select their own abilities and have to simply rely on gun skill. It can also deactivate weapons like Killjoy's turret, which will be music to the ears of players who just want to ""click heads.""

Next up is FLASH/drive. It comes in the form of a flash grenade, which can be charged to reduce 'cook' time. Right clicking will throw a charged flash that only needs one second to cook, whereas a left click will up that wait time to 1.6 seconds. KAY/O's final non-ultimate ability is FRAG/ment, an ""explosive fragment"" that will stick to the ground and explode numerous times. It's capable of almost entirely wiping out an opponent's health if they're caught at the centre of its blast, kind of like damage from Raze's Cluster Grenade.

While Sage remains the only hero capable of bringing eliminated players back into battle, KAY/O's ultimate ability looks set to change mid-to-late game skirmishes. NULL/cmd allows players to ""instantly overload with polarized radianite energy"" which gives KAY/O a combat stim, emits pulses that can suppress enemies and, most importantly, allows him to be downed rather than eliminated. But be mindful, that only happens while he's in his overloaded state.

Similar to the revive mechanics in battle royale shooters like Fortnite and Warzone, teammates will be vulnerable to damage while they ""stabilze"" KAY/O's core and eventually get the killer robot back to its feet. Like Sage mains, players willing to take evasive manoeuvres during battle could turn a 1v1 in their favor with a well-timed rescue.

KAY/O isn't the only new addition coming to the Episode 3 Act I battlepass when it goes live on June 22nd. On top of the usual free and paid weapon skins, gun buddies, cards, sprays and titles, Riot is offering bonus XP to players who squad up with friends during the Valorant Year One Event between June 22nd and July 6th. Parties of two will see an 8 percent boost, while squads of three and four will see 12- and 16-percent bonuses respectively. If can you fill all five spots, the XP bonus rises to an impressive 20 percent.","Ever since Riot Games offered a small tease during the Summer Games Fest, Valorant players have had a genuine reason to believe that the new agent coming to the popular free-to-play shooter will be a robot.
The first is ZERO/point, a knife that when cast lodges into the first surface it hits and suppresses anyone within its blast radius.
KAY/O's final non-ultimate ability is FRAG/ment, an ""explosive fragment"" that will stick to the ground and explode numerous times.
While Sage remains the only hero capable of bringing eliminated players back into battle, KAY/O's ultimate ability looks set to change mid-to-late game skirmishes.
Like Sage mains, players willing to take evasive manoeuvres during battle could turn a 1v1 in their favor with a well-timed rescue.",https://finance.yahoo.com/news/valorant-kayo-episode-three-act-one-150040390.html,2021-06-28 00:00:00
44,VXRT,The world's fastest electric motorcycle has a new aerodynamic challenger,"Electric motorcycles now offer a practical alternative to their internal combustion counterparts thanks to quick charging models that boast up to 200 miles of urban range. But, a little-known British company wants to make future e-motorbikes much faster. To get there, White Motorcycle Concepts built a unique prototype that it claims can smash a land speed record. The current record-holder, former world champion Max Biaggi, rode a Voxan Wattman to a peak speed of 254 mph across two runs in opposite directions over a flying mile that averaged out to 228 mph.

As the WMC250EV's name suggests, it could wind up beating that speed by a considerable margin. A quick glance at the concept immediately tells you why it stands out: The bike features a hole that runs from the front to the back. This duct system, dubbed ""V-Air,"" makes it the most ""aerodynamically efficient motorcycle in the world,"" according to its maker. By forcing air through the middle of the bike instead of around it, the WMC250EV reduces drag by up to 70 percent — figures that have been tested at the UK's Horiba MIRA facility.

White Motorcycle Concepts

Gutting the top part of its motorcycle meant the company had to be more creative with the rest of the design, too. The electric drivetrain and battery packs are crammed in the bottom half. It also uses a double-swingarm suspension system. The rear wheel is chain-driven by a pair of 30kW electric motors, while two 20kW power the front wheel. Together, they deliver a total of 100kW, or 134 hp, according to Top Gear.

Though the plan is to eventually bring the tech to the masses, this specific concept is wholly tailored to its rider, Rob White. A motorsports veteran with stints at Formula One, Le Mans Prototype, V8 supercar and World Endurance Championship race teams, White had his silhouette laser-scanned in order to build the bike's bodywork.

The technology will now be put to the test with an attempt at the British electric semi-streamlined motorcycle record later this year followed by the world record in 2022. White reckons a speed of over 250mph is achievable.","To get there, White Motorcycle Concepts built a unique prototype that it claims can smash a land speed record.
This duct system, dubbed ""V-Air,"" makes it the most ""aerodynamically efficient motorcycle in the world,"" according to its maker.
White Motorcycle ConceptsGutting the top part of its motorcycle meant the company had to be more creative with the rest of the design, too.
The rear wheel is chain-driven by a pair of 30kW electric motors, while two 20kW power the front wheel.
The technology will now be put to the test with an attempt at the British electric semi-streamlined motorcycle record later this year followed by the world record in 2022.",https://finance.yahoo.com/news/electric-motorcycle-land-speed-record-100503362.html,2021-06-28 00:00:00
