,Ticker,Title,Article,Summary,Link,Date
72,VXRT,Jeff Bezos and his brother will fly on Blue Origin's first tourist flight,"What's the point in building a crewed spacecraft if you can't take a spin in it yourself? Turns out, those bidding for a seat on Blue Origin's first suborbital tourist flight next month will be joined by two special guests: The private aerospace company's founder, and the world's second richest person, Jeff Bezos, and his brother Mark.

Taking to Instagram, the outgoing Amazon CEO said: ""Ever since I was five years old, I’ve dreamed of traveling to space. On July 20th, I will take that journey with my brother. The greatest adventure, with my best friend."" He signed off with a hashtag containing the Blue Origin motto ""Gradatim Ferociter,"" a Latin phrase that means ""step by step, ferociously.""

This content is not available due to your privacy preferences. Update your settings here to see it.

Bidding is currently underway for a tourist spot on the space venture's inaugural human flight aboard the New Shepard rocket. Close to 6,000 participants from 143 countries have already taken part, with the highest bid at $2.8 million. Blue Origin has said that it will donate the proceeds to its STEM-focused foundation, Club for the Future. The bidding, which you can register for until June 10th, is set to conclude with a live auction on June 12th.

Just over a month later on July 20th, the launch will take six passengers 62 miles (or just shy of 100km) above the surface of the Earth. Those on the flight will experience weightlessness and see the curvature of the Earth, before returning back to the ground.

Now, we know who two of those passengers will be. Notably, by that point Jeff Bezos will no longer be CEO of Amazon as he is set to exit the role to become exec chairman on July 5th. In his place, Amazon Web Services head Andy Jassy will assume the top job.

As for his brother, Mark Bezos is a co-founder of private equity firm HighPost Capital and a director of the Bezos Family Foundation, a non-profit that focuses on early learning education. He previously owned an ad agency and served as the senior VP of communications for the Robin Hood Foundation, an anti-poverty organization.","Turns out, those bidding for a seat on Blue Origin's first suborbital tourist flight next month will be joined by two special guests: The private aerospace company's founder, and the world's second richest person, Jeff Bezos, and his brother Mark.
Taking to Instagram, the outgoing Amazon CEO said: ""Ever since I was five years old, I’ve dreamed of traveling to space.
He signed off with a hashtag containing the Blue Origin motto ""Gradatim Ferociter,"" a Latin phrase that means ""step by step, ferociously.""
Bidding is currently underway for a tourist spot on the space venture's inaugural human flight aboard the New Shepard rocket.
As for his brother, Mark Bezos is a co-founder of private equity firm HighPost Capital and a director of the Bezos Family Foundation, a non-profit that focuses on early learning education.",https://finance.yahoo.com/news/jeff-bezos-blue-origin-tourist-flight-123407896.html,2021-06-08 00:00:00
73,VXRT,The United States online gambling market is projected to register a CAGR of 15.41% during the forecast period (2020 - 2025),"- The current legislation framework for online betting in the United States allows only bookmakers licensed in Nevada, Pennsylvania, Delaware, and New Jersey to operate legally, as these are the four states where online betting is regulated.

New York, June 15, 2021 (GLOBE NEWSWIRE) -- Reportlinker.com announces the release of the report ""United States Online Gambling Market- Growth, Trends and Forecasts (2020-2025)"" - https://www.reportlinker.com/p06000988/?utm_source=GNW

- New Jersey is currently the largest market for regulated online gambling in the United States. Over a dozen legal and licensed online casino sites and poker rooms compete for an overall market that is worth more than USD 225 million a year. There are a number of sportsbooks and online sports betting apps live in the state.

- As per the data released by the Division of Gaming Enforcement (DGE), in June 2019, the revenues from the top three online casinos in New Jersey were as follows. The Golden Nugget/Betfair accounted for USD 13.6 million, the Resorts AC recorded USD 6.39 million revenue, and Borgata/Party earned a revenue of USD 5.66 million.



Key Market Trends

Live Casino Gaining Momentum in The Country



The live casino market is still at nascent stage in the country, owing to its stringent regulations. However, software providers, like Ezugi and Evolution gaming, have been granted licenses to provide their live deal games in New Jersey. Thus, global players are investing significantly and entering into this market, in order to broaden their geographical presence and customer base. For instance:?In January 2018, Evolution Gaming opened its first live casino studio in Vancouver. The New Jersey studio offers ten tables of various games, including American Roulette, Blackjack, Baccarat, and Slingshot Roulette. Moreover, Evolution Gaming signed contracts with several licensed operators, such as Ocean Resort Casino, Hard Rock Hotel & Casino Atlantic City, 888casino, and PokerStars Casino New Jersey. Apart from key players, software providers are also embarking on mergers and acquisitions as one of their key strategies to achieve consolidation and optimize their offerings. For instance, in January 2019, Evolution gaming acquired live dealer gaming provider Ezugi. Ignition Casino, BetOnline, MyBookie, Bovada, 5Dimes, and The BoVegas Casino are some of the prominent players offering live casino games across the country.



Pennsylvania is The Fastest Growing Market



Pennsylvania is the fourth and biggest state to legalize and regulate online gambling. The new law allows for online casinos, online poker, sports betting, and more. Casino gaming (including slots and casino table games, such as roulette and blackjack), poker, sports/horse race betting, and fantasy betting are regulated by the Pennsylvania Gaming Control Board, whereas lotteries are regulated by the Pennsylvania Lottery. Also, as per the data published by the American Gaming Association, the total gross gaming revenue of Pennsylvania casinos amounted to approximately USD 3226.92 million in 2017, which was the second-highest after Nevada. Therefore, regulation of online casinos in the state is expected to increase the number of downloads of various online casino games and add more revenues in the overall online gambling market. After the imminent launch of internet gambling in 2019 in the state of Pennsylvania, the companies are forming partnerships, to handle the spur of demand for these online casino platforms and provide consumers with better online casino-playing experience



Competitive Landscape

The United States gambling market is a highly fragmented market and comprises regional and global players such as 888 Holdings PLC, William Hill PLC, Caesars Entertainment Corporation and others. Major players are focusing on mergers and acquisitions to expand their presence in the country and to enhance their brand portfolio to cater to various preferences of the consumers. Merger and acquisition is the most preferred strategy in the casino gambling market. The key players are also entering into partnerships/agreements to enhance their offerings. Moreover, these players are also focusing to launch their offering in the new potential markets. For instance: In 2018, 888 Holdings PLC launched a new portfolio of live dealer casino games in New Jersey, as part of the continued expansion of its business in the Garden State.



Reasons to Purchase this report:

- The market estimate (ME) sheet in Excel format

- 3 months of analyst support

Read the full report: https://www.reportlinker.com/p06000988/?utm_source=GNW



About Reportlinker

ReportLinker is an award-winning market research solution. Reportlinker finds and organizes the latest industry data so you get all the market research you need - instantly, in one place.



__________________________

Story continues

CONTACT: Clare: clare@reportlinker.com US: (339)-368-6001 Intl: +1 339-368-6001



","New York, June 15, 2021 (GLOBE NEWSWIRE) -- Reportlinker.com announces the release of the report ""United States Online Gambling Market- Growth, Trends and Forecasts (2020-2025)"" - https://www.reportlinker.com/p06000988/?utm_source=GNW- New Jersey is currently the largest market for regulated online gambling in the United States.
Key Market TrendsLive Casino Gaining Momentum in The CountryThe live casino market is still at nascent stage in the country, owing to its stringent regulations.
Pennsylvania is The Fastest Growing MarketPennsylvania is the fourth and biggest state to legalize and regulate online gambling.
Therefore, regulation of online casinos in the state is expected to increase the number of downloads of various online casino games and add more revenues in the overall online gambling market.
Merger and acquisition is the most preferred strategy in the casino gambling market.",https://finance.yahoo.com/news/united-states-online-gambling-market-123200198.html,2021-06-08 00:00:00
74,VXRT,Together Again Outdoor Concert Series is Bringing Live Music Back this Summer,"EDMONTON, AB, June 8, 2021 /CNW/ - Trixstar is pleased to launch Canada's first dedicated socially distanced concert venue this summer. The Together Again Outdoor Concert Series is set to take place at the historic Racetrack Infield on the Edmonton Exhibition Lands (formerly Northlands Park). The world has changed, and live events are changing with it; a new outdoor concert series bringing people together in a safe way is here.

Canada's first dedicated socially distanced concert venue launching this summer in Edmonton, Alberta. New events for the new reality focusing on keeping everyone safe. (CNW Group/Trixstar Productions)

The series kicks off on August 6th and continues over the summer, featuring Blue Rodeo, Dean Brody, Our Lady Peace, Five Alarm Funk, Serena Ryder, The Trews, 54-40, Alan Doyle, I Mother Earth, The Road Hammers, Bif Naked, The Rural Alberta Advantage, The Jerry Cans, and Jess Moskaluke, with even more artists, more dates and more events to be announced in the coming weeks.

Together Again will mark the first major outdoor concert series emerging out of the pandemic in Canada; a celebration of getting through the tough times and a showcase on how large events can come back safely while supporting businesses, artists and charities along the way. Enhanced safety measures include limited capacities to ensure safe social distancing, reserved tables for up to 6 people with full food & beverage service ordered right from your smart device and delivered to your seat, contact tracing, mandatory masks and more - similar to the Alberta Health guidelines in place at restaurant patios.

""Music is an important part of bringing people together and connecting is fundamental for our mental health."" says Trixstar's President Mike Anderson, ""We're making it safer and more intimate while creating more space and keeping the same excitement you'd expect seeing your favorite bands perform live on stage. It's time to get off our screens and back to experiences.""

August 6 Five Alarm Funk, The Jerry Cans, DJ Shub, Shawnee Kish, Halcyon Gray August 7 Serena Ryder, The Rural Alberta Advantage, Nuela Charles, Carter & The Capitals, Shaela Miller August 8 The Trews, 54-40, Bif Naked, Kane Incognito, Stephanie Harpe Experience August 21 Blue Rodeo, Alan Doyle, Captain Tractor, Hailey Benedict and more August 22 Dean Brody, The Road Hammers, Jess Moskaluke, Dan Davidson, Alee August 29 Our Lady Peace, I Mother Earth, Danko Jones, Royal Tusk, Whale & The Wolf

""The Together Again Outdoor Concert Series is the culmination of countless hours, days and months of work by all of our tremendous stakeholders who rode this roller coaster with us."" adds Brennan McFaul, Vice President of Trixstar's US office in Nashville. ""From artists and their representatives to suppliers to sponsors to Government and Health Authorities, the trust and belief in this project has been humbling. It's now time for another, and the most important, stakeholder to be involved in bringing Together Again to life...the FANS.""

Story continues

$2 from every ticket purchased will be donated to Boyle Street and Hope Mission helping them support men, women, youth & children experiencing poverty and homelessness in Edmonton. ""It is an honour to be a charity of choice for the Together Again concert series"" says Boyle Street Community Services' Director of Development, Laurel McCalla. ""When organizations like Trixstar support Boyle Street they signal their desire to create inclusive communities where individuals experiencing poverty and homelessness in Edmonton can achieve their goals. We are proud to partner with Trixstar for this event and feel lucky to call them a neighbour.""

""Hope Mission has been extremely active supporting the vulnerable population during the pandemic and we could not operate our programs without strong community support."" adds Tim Pasma, Manager at Hope Mission. ""Having a local event like Together Again giving back to us is very important to our continued success in providing services and support for some of our most vulnerable community members.""

""This concert series was built on the foundation of second chances and supporting the community is a priority for us."" says Mike Anderson. ""We are very excited to get the live events industry back up and running. This series alone will create over 500 jobs for artists, technicians, security guards, suppliers, bartenders, parking staff, and countless others that have had a tough 15 months.""

Tickets go on sale as reserved tables of 2, 4 or 6 starting as low as $59 per person on Friday June 11, 2021 at 10:00AM MST at TogetherAgainYEG.ca . Stay tuned...more dates, more events and more artists to be announced!

About Trixstar

Founded in Edmonton in 2005 and with offices in Canada and the US, Trixstar is a 360° live event management & consultation firm that activates city and rural markets across North America with safe and memorable craft festival experiences.



Marketing materials can be found at media.togetheragainyeg.ca

Together Again Outdoor Concert Series (CNW Group/Trixstar Productions)

SOURCE Trixstar Productions

Cision

View original content to download multimedia: http://www.newswire.ca/en/releases/archive/June2021/08/c9424.html","The Together Again Outdoor Concert Series is set to take place at the historic Racetrack Infield on the Edmonton Exhibition Lands (formerly Northlands Park).
The world has changed, and live events are changing with it; a new outdoor concert series bringing people together in a safe way is here.
""It is an honour to be a charity of choice for the Together Again concert series"" says Boyle Street Community Services' Director of Development, Laurel McCalla.
""This concert series was built on the foundation of second chances and supporting the community is a priority for us.""
Marketing materials can be found at media.togetheragainyeg.caTogether Again Outdoor Concert Series (CNW Group/Trixstar Productions)SOURCE Trixstar ProductionsCisionView original content to download multimedia: http://www.newswire.ca/en/releases/archive/June2021/08/c9424.html",https://finance.yahoo.com/news/together-again-outdoor-concert-series-134500494.html,2021-06-08 00:00:00
75,VXRT,"Estimating The Intrinsic Value Of Intersect ENT, Inc. (NASDAQ:XENT)","Does the June share price for Intersect ENT, Inc. (NASDAQ:XENT) reflect what it's really worth? Today, we will estimate the stock's intrinsic value by estimating the company's future cash flows and discounting them to their present value. We will use the Discounted Cash Flow (DCF) model on this occasion. Believe it or not, it's not too difficult to follow, as you'll see from our example!

We generally believe that a company's value is the present value of all of the cash it will generate in the future. However, a DCF is just one valuation metric among many, and it is not without flaws. If you still have some burning questions about this type of valuation, take a look at the Simply Wall St analysis model.

The calculation

We are going to use a two-stage DCF model, which, as the name states, takes into account two stages of growth. The first stage is generally a higher growth period which levels off heading towards the terminal value, captured in the second 'steady growth' period. To start off with, we need to estimate the next ten years of cash flows. Where possible we use analyst estimates, but when these aren't available we extrapolate the previous free cash flow (FCF) from the last estimate or reported value. We assume companies with shrinking free cash flow will slow their rate of shrinkage, and that companies with growing free cash flow will see their growth rate slow, over this period. We do this to reflect that growth tends to slow more in the early years than it does in later years.

Generally we assume that a dollar today is more valuable than a dollar in the future, so we need to discount the sum of these future cash flows to arrive at a present value estimate:

10-year free cash flow (FCF) forecast

2021 2022 2023 2024 2025 2026 2027 2028 2029 2030 Levered FCF ($, Millions) -US$56.2m -US$28.4m -US$9.95m US$8.50m US$16.3m US$23.0m US$29.8m US$36.1m US$41.6m US$46.4m Growth Rate Estimate Source Analyst x2 Analyst x2 Analyst x2 Analyst x1 Analyst x1 Est @ 41.13% Est @ 29.39% Est @ 21.17% Est @ 15.42% Est @ 11.39% Present Value ($, Millions) Discounted @ 6.4% -US$52.8 -US$25.1 -US$8.3 US$6.6 US$12.0 US$15.9 US$19.3 US$22.0 US$23.8 US$24.9

(""Est"" = FCF growth rate estimated by Simply Wall St)

Present Value of 10-year Cash Flow (PVCF) = US$38m

We now need to calculate the Terminal Value, which accounts for all the future cash flows after this ten year period. For a number of reasons a very conservative growth rate is used that cannot exceed that of a country's GDP growth. In this case we have used the 5-year average of the 10-year government bond yield (2.0%) to estimate future growth. In the same way as with the 10-year 'growth' period, we discount future cash flows to today's value, using a cost of equity of 6.4%.

Terminal Value (TV)= FCF 2030 × (1 + g) ÷ (r – g) = US$46m× (1 + 2.0%) ÷ (6.4%– 2.0%) = US$1.1b

Present Value of Terminal Value (PVTV)= TV / (1 + r)10= US$1.1b÷ ( 1 + 6.4%)10= US$577m

The total value is the sum of cash flows for the next ten years plus the discounted terminal value, which results in the Total Equity Value, which in this case is US$615m. The last step is to then divide the equity value by the number of shares outstanding. Compared to the current share price of US$17.4, the company appears about fair value at a 6.1% discount to where the stock price trades currently. Valuations are imprecise instruments though, rather like a telescope - move a few degrees and end up in a different galaxy. Do keep this in mind.

Important assumptions

NasdaqGM:XENT Discounted Cash Flow June 30th 2021

The calculation above is very dependent on two assumptions. The first is the discount rate and the other is the cash flows. You don't have to agree with these inputs, I recommend redoing the calculations yourself and playing with them. The DCF also does not consider the possible cyclicality of an industry, or a company's future capital requirements, so it does not give a full picture of a company's potential performance. Given that we are looking at Intersect ENT as potential shareholders, the cost of equity is used as the discount rate, rather than the cost of capital (or weighted average cost of capital, WACC) which accounts for debt. In this calculation we've used 6.4%, which is based on a levered beta of 0.934. Beta is a measure of a stock's volatility, compared to the market as a whole. We get our beta from the industry average beta of globally comparable companies, with an imposed limit between 0.8 and 2.0, which is a reasonable range for a stable business.

Looking Ahead:

Whilst important, the DCF calculation ideally won't be the sole piece of analysis you scrutinize for a company. The DCF model is not a perfect stock valuation tool. Preferably you'd apply different cases and assumptions and see how they would impact the company's valuation. If a company grows at a different rate, or if its cost of equity or risk free rate changes sharply, the output can look very different. For Intersect ENT, there are three further factors you should assess:

Risks: For example, we've discovered 2 warning signs for Intersect ENT that you should be aware of before investing here. Future Earnings: How does XENT's growth rate compare to its peers and the wider market? Dig deeper into the analyst consensus number for the upcoming years by interacting with our free analyst growth expectation chart. Other Solid Businesses: Low debt, high returns on equity and good past performance are fundamental to a strong business. Why not explore our interactive list of stocks with solid business fundamentals to see if there are other companies you may not have considered!

PS. Simply Wall St updates its DCF calculation for every American stock every day, so if you want to find the intrinsic value of any other stock just search here.

This article by Simply Wall St is general in nature. It does not constitute a recommendation to buy or sell any stock, and does not take account of your objectives, or your financial situation. We aim to bring you long-term focused analysis driven by fundamental data. Note that our analysis may not factor in the latest price-sensitive company announcements or qualitative material. Simply Wall St has no position in any stocks mentioned.



Have feedback on this article? Concerned about the content? Get in touch with us directly. Alternatively, email editorial-team (at) simplywallst.com.

The views and opinions expressed herein are the views and opinions of the author and do not necessarily reflect those of Nasdaq, Inc.","Today, we will estimate the stock's intrinsic value by estimating the company's future cash flows and discounting them to their present value.
We will use the Discounted Cash Flow (DCF) model on this occasion.
For a number of reasons a very conservative growth rate is used that cannot exceed that of a country's GDP growth.
In this case we have used the 5-year average of the 10-year government bond yield (2.0%) to estimate future growth.
Dig deeper into the analyst consensus number for the upcoming years by interacting with our free analyst growth expectation chart.",https://www.nasdaq.com/articles/estimating-the-intrinsic-value-of-intersect-ent-inc.-nasdaq%3Axent-2021-06-30,2021-06-30 00:00:00
