,Ticker,Title,Article,Summary,Link,Date
0,VXRT,VXRT Stock: Can Redditors Help Vaxart Power Higher?,"On October 20, the man who recommended Google before anyone else will reveal his #1 stock pick for 2022 — for FREE — ticker symbol and all — in a special presentation.","On October 20, the man who recommended Google before anyone else will reveal his #1 stock pick for 2022 — for FREE — ticker symbol and all — in a special presentation.",https://investorplace.com/2021/06/vxrt-stock-can-redditors-help-vaxart-power-higher/,2021-06-18 17:40:28+00:00
1,VXRT,"Is Vaxart, Inc. (VXRT) A Good Stock To Buy?","While the market driven by short-term sentiment influenced by the accommodative interest rate environment in the US, virus news and stimulus spending, many smart money investors are starting to get cautious towards the current bull run since March, 2020 and hedging or reducing many of their long positions. Some fund managers are betting on Dow hitting 40,000 to generate strong returns. However, as we know, big investors usually buy stocks with strong fundamentals that can deliver gains both in bull and bear markets, which is why we believe we can profit from imitating them. In this article, we are going to take a look at the smart money sentiment surrounding Vaxart, Inc. (NASDAQ:VXRT).

Is VXRT a good stock to buy? Vaxart, Inc. (NASDAQ:VXRT) investors should be aware of a decrease in support from the world's most elite money managers lately. Vaxart, Inc. (NASDAQ:VXRT) was in 6 hedge funds' portfolios at the end of the first quarter of 2021. The all time high for this statistic is 12. There were 9 hedge funds in our database with VXRT positions at the end of the fourth quarter. Our calculations also showed that VXRT isn't among the 30 most popular stocks among hedge funds (click for Q1 rankings).

In the eyes of most market participants, hedge funds are assumed to be unimportant, outdated financial tools of yesteryear. While there are more than 8000 funds trading today, We hone in on the masters of this club, approximately 850 funds. These money managers direct the lion's share of all hedge funds' total asset base, and by following their best stock picks, Insider Monkey has identified a few investment strategies that have historically outpaced the S&P 500 index. Insider Monkey's flagship short hedge fund strategy outperformed the S&P 500 short ETFs by around 20 percentage points annually since its inception in March 2017. Also, our monthly newsletter's portfolio of long stock picks returned 206.8% since March 2017 (through May 2021) and beat the S&P 500 Index by more than 115 percentage points. You can download a sample issue of this newsletter on our website .

Story continues

MILLENNIUM MANAGEMENT

Israel Englander of Millennium Management

At Insider Monkey, we scour multiple sources to uncover the next great investment idea. For example, an activist hedge fund owns nearly 40% of this $24 biotech stock and is trying to buy the rest for around $50. So, we recommended a long position to our monthly premium newsletter subscribers. We go through lists like the 10 best battery stocks to pick the next Tesla that will deliver a 10x return. Even though we recommend positions in only a tiny fraction of the companies we analyze, we check out as many stocks as we can. We read hedge fund investor letters and listen to stock pitches at hedge fund conferences. You can subscribe to our free daily newsletter on our homepage. Keeping this in mind we're going to take a look at the new hedge fund action encompassing Vaxart, Inc. (NASDAQ:VXRT).

Do Hedge Funds Think VXRT Is A Good Stock To Buy Now?

Heading into the second quarter of 2021, a total of 6 of the hedge funds tracked by Insider Monkey were long this stock, a change of -33% from one quarter earlier. Below, you can check out the change in hedge fund sentiment towards VXRT over the last 23 quarters. So, let's see which hedge funds were among the top holders of the stock and which hedge funds were making big moves.

More specifically, Citadel Investment Group was the largest shareholder of Vaxart, Inc. (NASDAQ:VXRT), with a stake worth $3.1 million reported as of the end of March. Trailing Citadel Investment Group was Citadel Investment Group, which amassed a stake valued at $3 million. Pura Vida Investments, Millennium Management, and Bailard Inc were also very fond of the stock, becoming one of the largest hedge fund holders of the company. In terms of the portfolio weights assigned to each position Pura Vida Investments allocated the biggest weight to Vaxart, Inc. (NASDAQ:VXRT), around 0.07% of its 13F portfolio. HighVista Strategies is also relatively very bullish on the stock, designating 0.05 percent of its 13F equity portfolio to VXRT.

Judging by the fact that Vaxart, Inc. (NASDAQ:VXRT) has witnessed a decline in interest from the aggregate hedge fund industry, it's easy to see that there exists a select few hedgies who sold off their full holdings last quarter. Interestingly, Peter Kolchinsky's RA Capital Management cut the biggest stake of the 750 funds watched by Insider Monkey, totaling an estimated $15.7 million in stock. Julian Baker and Felix Baker's fund, Baker Bros. Advisors, also cut its stock, about $8 million worth. These moves are intriguing to say the least, as aggregate hedge fund interest was cut by 3 funds last quarter.

Let's now review hedge fund activity in other stocks similar to Vaxart, Inc. (NASDAQ:VXRT). These stocks are Hawkins, Inc. (NASDAQ:HWKN), Golden Entertainment Inc (NASDAQ:GDEN), Gladstone Commercial Corporation (NASDAQ:GOOD), TrustCo Bank Corp NY (NASDAQ:TRST), Ducommun Incorporated (NYSE:DCO), SpartanNash Company (NASDAQ:SPTN), and Universal Logistics Holdings, Inc. (NASDAQ:ULH). This group of stocks' market caps are similar to VXRT's market cap.

[table] Ticker, No of HFs with positions, Total Value of HF Positions (x1000), Change in HF Position HWKN,9,16505,0 GDEN,18,142230,5 GOOD,7,49377,-2 TRST,15,31323,2 DCO,8,68823,-4 SPTN,11,42421,-2 ULH,12,29540,3 Average,11.4,54317,0.3 [/table]

View table here if you experience formatting issues.

As you can see these stocks had an average of 11.4 hedge funds with bullish positions and the average amount invested in these stocks was $54 million. That figure was $6 million in VXRT's case. Golden Entertainment Inc (NASDAQ:GDEN) is the most popular stock in this table. On the other hand Gladstone Commercial Corporation (NASDAQ:GOOD) is the least popular one with only 7 bullish hedge fund positions. Compared to these stocks Vaxart, Inc. (NASDAQ:VXRT) is even less popular than GOOD. Our overall hedge fund sentiment score for VXRT is 17. Stocks with higher number of hedge fund positions relative to other stocks as well as relative to their historical range receive a higher sentiment score. Hedge funds clearly dropped the ball on VXRT as the stock delivered strong returns, though hedge funds' consensus picks still generated respectable returns. Our calculations showed that top 5 most popular stocks among hedge funds returned 95.8% in 2019 and 2020, and outperformed the S&P 500 ETF (SPY) by 40 percentage points. These stocks gained 19.3% in 2021 through June 25th and still beat the market by 4.8 percentage points. A small number of hedge funds were also right about betting on VXRT as the stock returned 41.2% since Q1 (through June 25th) and outperformed the market by an even larger margin.

Get real-time email alerts: Follow Vaxart Inc. (NASDAQ:VXRT)

Suggested Articles:

Disclosure: None. This article was originally published at Insider Monkey.","There were 9 hedge funds in our database with VXRT positions at the end of the fourth quarter.
We read hedge fund investor letters and listen to stock pitches at hedge fund conferences.
Do Hedge Funds Think VXRT Is A Good Stock To Buy Now?
So, let's see which hedge funds were among the top holders of the stock and which hedge funds were making big moves.
Hedge funds clearly dropped the ball on VXRT as the stock delivered strong returns, though hedge funds' consensus picks still generated respectable returns.",https://finance.yahoo.com/news/vaxart-inc-vxrt-good-stock-141645647.html,2021-06-18 17:40:28+00:00
2,VXRT,Bet on a No-Needle Vaccine Strategy with Vaxart,"On October 20, the man who recommended Google before anyone else will reveal his #1 stock pick for 2022 — for FREE — ticker symbol and all — in a special presentation.","On October 20, the man who recommended Google before anyone else will reveal his #1 stock pick for 2022 — for FREE — ticker symbol and all — in a special presentation.",https://investorplace.com/2021/06/bet-on-a-no-needle-vaccine-strategy-with-vxrt-stock/,2021-06-09 18:38:38+00:00
3,VXRT,"With Fading Covid-19 Infections, VXRT Stock Is at a Crossroads","On October 20, the man who recommended Google before anyone else will reveal his #1 stock pick for 2022 — for FREE — ticker symbol and all — in a special presentation.","On October 20, the man who recommended Google before anyone else will reveal his #1 stock pick for 2022 — for FREE — ticker symbol and all — in a special presentation.",https://investorplace.com/2021/06/vxrt-stock-covid-19-infections-waning/,2021-06-02 16:54:43+00:00
4,VXRT,Will the Promise of Avoiding the Needle Pay Off for Vaxart?,"On October 20, the man who recommended Google before anyone else will reveal his #1 stock pick for 2022 — for FREE — ticker symbol and all — in a special presentation.","On October 20, the man who recommended Google before anyone else will reveal his #1 stock pick for 2022 — for FREE — ticker symbol and all — in a special presentation.",https://investorplace.com/2021/06/vxrt-stock-will-the-promise-of-avoiding-the-needle-pay-off/,2021-06-28 20:45:20+00:00
5,VXRT,Implied Volatility Surging for Vaxart (VXRT) Stock Options,"Investors in Vaxart, Inc. VXRT need to pay close attention to the stock based on moves in the options market lately. That is because the Jul 16, 2021 $17.50 Call had some of the highest implied volatility of all equity options today.

What is Implied Volatility?

Implied volatility shows how much movement the market is expecting in the future. Options with high levels of implied volatility suggest that investors in the underlying stocks are expecting a big move in one direction or the other. It could also mean there is an event coming up soon that may cause a big rally or a huge sell-off. However, implied volatility is only one piece of the puzzle when putting together an options trading strategy.

What do the Analysts Think?

Clearly, options traders are pricing in a big move for Vaxart shares, but what is the fundamental picture for the company? Currently, Vaxart is a Zacks Rank #4 (Sell) in the Medical - Drugs industry that ranks in the Bottom 10% of our Zacks Industry Rank. Over the last 60 days, no analysts have increased their earnings estimates for the current quarter, while one analyst has revised the estimate downward. The net effect has widened our Zacks Consensus Estimate for the current quarter from a loss of 12 cents per share to a loss of 14 cents in that period.

Given the way analysts feel about Vaxart right now, this huge implied volatility could mean there’s a trade developing. Oftentimes, options traders look for options with high levels of implied volatility to sell premium. This is a strategy many seasoned traders use because it captures decay. At expiration, the hope for these traders is that the underlying stock does not move as much as originally expected.

Looking to Trade Options?

Check out the simple yet high-powered approach that Zacks Executive VP Kevin Matras has used to close recent double and triple-digit winners. In addition to impressive profit potential, these trades can actually reduce your risk.

Click to see the trades now >>

The views and opinions expressed herein are the views and opinions of the author and do not necessarily reflect those of Nasdaq, Inc.","That is because the Jul 16, 2021 $17.50 Call had some of the highest implied volatility of all equity options today.
Implied volatility shows how much movement the market is expecting in the future.
However, implied volatility is only one piece of the puzzle when putting together an options trading strategy.
Given the way analysts feel about Vaxart right now, this huge implied volatility could mean there’s a trade developing.
Oftentimes, options traders look for options with high levels of implied volatility to sell premium.",https://www.nasdaq.com/articles/implied-volatility-surging-for-vaxart-vxrt-stock-options-2021-06-16,2021-06-16 00:00:00
6,VXRT,"Creating a Covid Vaccine in Late 2021, Vaxart (VXRT) Could Blow Up the Market? – Own Snap","In the last trading session, the stock of Vaxart (VXRT) surged from $6.91 to $7.33, reaching the highest mark of $7.54 yesterday, on June 7. Can companies like VXRT succeed in creating a vaccine in late 2021, despite the fact, that corporations have already released COVID-19 vaccines?



Experts from Wall Street are betting that the company’s stock will have a growth of 94% in the coming years. Vaxart is creating oral recombinant vaccines in particular, rather than vaccinations that are provided by injection. Pills should be considerably easier to distribute and administer than injections, which might eliminate issues like aversion to injections and lack of vaccination availability. Moreover, the tests signaled, that Vaxart’s oral treatment might be effective against COVID-19 variants.

Thus, they have the opportunity internationally right away to get into these areas where there is still is not enough vaccine. Probably it is too early to get enthusiastic about Vaxart; however, it is undoubtedly a name to keep an eye on.","In the last trading session, the stock of Vaxart (VXRT) surged from $6.91 to $7.33, reaching the highest mark of $7.54 yesterday, on June 7.
Can companies like VXRT succeed in creating a vaccine in late 2021, despite the fact, that corporations have already released COVID-19 vaccines?
Experts from Wall Street are betting that the company’s stock will have a growth of 94% in the coming years.
Vaxart is creating oral recombinant vaccines in particular, rather than vaccinations that are provided by injection.
Probably it is too early to get enthusiastic about Vaxart; however, it is undoubtedly a name to keep an eye on.",https://ownsnap.com/creating-a-covid-vaccine-in-late-2021-vaxart-could-blow-up-the-market/,2021-06-16 00:00:00
7,VXRT,Vaxart Is Still Not Worth Anywhere Near Its Present Price,"On October 20, the man who recommended Google before anyone else will reveal his #1 stock pick for 2022 — for FREE — ticker symbol and all — in a special presentation.","On October 20, the man who recommended Google before anyone else will reveal his #1 stock pick for 2022 — for FREE — ticker symbol and all — in a special presentation.",https://investorplace.com/2021/06/vaxart-vxrt-stock-is-still-not-worth-anywhere-near-its-present-price/,2021-06-17 18:19:32+00:00
8,VXRT,Why Shares of Vaxart Plummeted 38.6% in May,"What happened

The prospective coronavirus vaccine maker Vaxart (NASDAQ:VXRT) crashed by 38.6% in May, according to data provided by S&P Global Market Intelligence. The tumble was caused by the company's publication of new data about its coronavirus vaccine pill on May 3, which failed to show high levels of neutralizing antibodies in a clinical trial despite showing other signals of immune system activation.

So what

Vaxart's coronavirus candidate had shown the same weaknesses in prior data readouts in February, meaning that the latest results served to cement investors' low expectations for its efficacy. Given that competitors like Pfizer and Moderna have both successfully marketed coronavirus vaccines which generate strong antibody responses, it's unlikely that Vaxart's program has much of a future. So far, the company appears to be continuing with development as before in hopes of finding a niche in the market. While it may eventually find that niche in the form of healthcare systems in developing countries, it probably won't be competitive in the most lucrative developed markets like the U.S.

Still, management was quick to point out that its candidate strongly elicits T-cell mediated immunity, potentially beyond that of the major competing vaccines. But, because T-cell mediated immunity may not be as likely to stonewall symptomatic infections as antibody mediated immunity in the context of coronavirus infections, it's a cold comfort for investors.

Now what

Despite the discouraging results, Vaxart's greatest strength is that its vaccines are formulated as pills rather than liquids for jabs. That means they don't need specialized refrigeration to be stored, nor do they need trained staff to be administered. So, there's still a role for the company's products to fill and a potential competitive advantage to be had, provided that in the future they can be proven to be effective at generating the correct type of immune response for their target disease.

On May 7, the company started to enroll new patients in a phase 1 trial of its norovirus vaccine candidate. While it's unclear if the project will allow Vaxart to shift gears and grow for its investors, it'll definitely provide a new chance to demonstrate that its vaccine technology works in the future.","What happenedThe prospective coronavirus vaccine maker Vaxart (NASDAQ:VXRT) crashed by 38.6% in May, according to data provided by S&P Global Market Intelligence.
So whatVaxart's coronavirus candidate had shown the same weaknesses in prior data readouts in February, meaning that the latest results served to cement investors' low expectations for its efficacy.
Still, management was quick to point out that its candidate strongly elicits T-cell mediated immunity, potentially beyond that of the major competing vaccines.
But, because T-cell mediated immunity may not be as likely to stonewall symptomatic infections as antibody mediated immunity in the context of coronavirus infections, it's a cold comfort for investors.
On May 7, the company started to enroll new patients in a phase 1 trial of its norovirus vaccine candidate.",https://www.fool.com/investing/2021/06/10/why-shares-of-vaxart-plummeted-386-in-may/,2021-06-10 00:00:00
