,Ticker,Title,Article,Summary,Link,Date
64,TSLA,Tesla Dealt Big Blow as Almost All Cars in China Need Safety Fix,"(Bloomberg) -- Tesla Inc.’s aspirations in China were dealt a major blow over the weekend after the government ordered that almost all the cars it’s sold in the nation -- more than 285,000 of them -- be fixed to address a safety issue.

The State Administration for Market Regulation said in a statement on Saturday that the action involves 211,256 locally produced Model 3 vehicles and 35,665 imported ones, as well as 38,599 China-made Model Ys. The California-based carmaker only began deliveries of the Model Y sports-utility vehicle in January, so the recall will affect pretty much every driver who bought one.

The Chinese agency said the vehicles’ autopilot systems can be activated automatically, potentially leading to crashes from sudden acceleration. In most cases, the fix should be able to be made remotely with an online update to the cars’ active cruise control feature. Tesla will upgrade the software for free.

While Tesla apologized via its official customer support account on Weibo, saying that it will “continue to improve safety in strict accordance with national requirements,” the recall tops a string of embarrassing setbacks for the company in China. A protest that went viral at the Shanghai auto show in mid-April and a spate of crashes has soured public opinion toward the EV pioneer and a few local governments and official institutions are reviewing Tesla ownership among their staff, citing concerns the cars pose security risks.

Read more: Tesla Dealt ‘Black Eye’ in Recall of Cars Sold in China

In March, Teslas were banned from some military complexes and housing compounds because of worries about the of of in-built cameras. Tesla immediately moved to reassure authorities, saying any data collected in China is stored locally.

That the required software fix impacts Tesla’s Model Y is especially unfortunate. The SUV crossover, which has a driving range of up to 594 kilometers (369 miles), was seen as enabling Tesla to target a much bigger customer base in the world’s biggest market for EVs and cars overall.

Story continues

Read more: Tesla China-Made Model Y Sales Jump as Bigger Cars Gain Traction

Chief Executive Officer Elon Musk has said the Model Y has the potential to outsell all other vehicles it makes and just this month, China’s Passenger Car Association forecast increased interest in larger, roomier cars, particularly in the seven-seater category, as government rules allow parents to have more children.

Credit Suisse Group AG said in a note last week that one key downside risk to its $800 price target for Tesla stock is Model Y difficulties and a lack of demand in international markets. Tesla’s Nasdaq-traded shares closed Friday at $671.87 and are down about 5% since January. They soared 743% last year.

Read more: Tesla Says Sorry as Disquiet in China Climbs After Protest

Tesla’s delivery times at some locations in China “have declined from 39 to 33 days -- potentially an indication of fewer orders converting to sales,” Credit Suisse analyst Dan Levy wrote. However, while some customers have switched brands due to recent negative headlines, “there are still ample Model Y orders to support continued sales volume,” Levy said.

Foreign brands accounted for about 37% of new-energy vehicle sales in China last year and 57% year-to-date. The nation is Tesla’s second most-important market after the U.S. and it’s now exporting China-made cars to Europe from its Shanghai Gigafactory. But a handful of fast-growing, homegrown upstarts threaten its strong position, particularly Nio Inc. and Xpeng Inc. In the mass market, local buyers are being won over by cheap, functional electric cars made by SAIC-GM-Wuling Automobile Co.

Read more: China’s Electric Car Capital Has Lessons for the Rest of World

Sales of China-made Model Ys, which start from around $53,000, more than doubled in May from April. April’s figures were down on March because some production lines at Tesla’s Shanghai factory were suspended for two weeks for maintenance and adjustment.

“Once the Model Y gets to full production, we’ll probably see a ratio of almost a 2-to-1” versus the Model 3 sedan, Tu Le, the managing director of Beijing-based consultancy Sino Auto Insights said earlier this month. “Chinese consumers love SUVs and crossovers. I think the Model Y is going to do really well toward the end of this year.”

More stories like this are available on bloomberg.com

Subscribe now to stay ahead with the most trusted business news source.

©2021 Bloomberg L.P.","The California-based carmaker only began deliveries of the Model Y sports-utility vehicle in January, so the recall will affect pretty much every driver who bought one.
In most cases, the fix should be able to be made remotely with an online update to the cars’ active cruise control feature.
That the required software fix impacts Tesla’s Model Y is especially unfortunate.
However, while some customers have switched brands due to recent negative headlines, “there are still ample Model Y orders to support continued sales volume,” Levy said.
The nation is Tesla’s second most-important market after the U.S. and it’s now exporting China-made cars to Europe from its Shanghai Gigafactory.",https://finance.yahoo.com/news/tesla-dealt-big-blow-almost-210000618.html,2021-06-07 19:06:13+00:00
65,TSLA,"Tesla looks primed for a rebound, trader says. Two ways to play the pullback","Tesla is under pressure again this week, but TradingAnalysis.com founder Todd Gordon says that spells opportunity for savvy investors to build out a position.

Speaking with CNBC's ""Trading Nation"" on Thursday, he said the long-term prospects for Tesla look strong and he predicted that CEO Elon Musk's electric vehicle maker will marry with his space exploration company SpaceX to give it a cutting-edge advantage in the space.

""Tesla, with its efforts in space with SpaceX, with Starlink, they just launched another mission, ultimately I think the game will be won when global internet connectivity from the sky links all the Tesla's fleet whether it's taxis or individual passenger cars, so I think Tesla is going to control it,"" he said.

On a shorter-term basis, Gordon said its technical setup points to upside.

""I think we might have … a little bit more consolidation through the summer before we ultimately move higher. I think, however though, that the lows are in place with Tesla and I think the reward is very large compared to the risk,"" said Gordon.

That bullish outlook changes if Tesla breaks below $545 a share, but Gordon does not expect that. It closed Thursday at 572.84.

Gordon sees two ways to play its pullback. The first, he said, is to buy the stock outright and add a stop order at $550.

The second is to look to the options market. He targets a retest of its $700 region heading into earnings expected late July or early August.

""A trade you can do is do a call spread, buying the 650 strike call in those July [16] monthly expirations, selling a 700 call, a $50 spread for which you will pay $11.20,"" said Gordon. ""I have $1,100 roughly of risk to make 3800. Really good reward-to-risk ratio.""

Tesla shares are down nearly 20% in 2021. It has pulled back 36% from its late January peak.

Disclosure: Gordon holds TSLA.

Disclaimer","Tesla is under pressure again this week, but TradingAnalysis.com founder Todd Gordon says that spells opportunity for savvy investors to build out a position.
""I think we might have … a little bit more consolidation through the summer before we ultimately move higher.
I think, however though, that the lows are in place with Tesla and I think the reward is very large compared to the risk,"" said Gordon.
That bullish outlook changes if Tesla breaks below $545 a share, but Gordon does not expect that.
Gordon sees two ways to play its pullback.",https://www.cnbc.com/2021/06/04/tesla-stock-looks-primed-for-a-rebound-after-pullback-trader-says.html,2021-06-04 00:00:00
66,TSLA,10 Biggest Short Squeezes of All Time,"In this article, we discuss the 10 biggest short squeezes of all time. If you want to skip our detailed analysis of these short squeezes, go directly to the 5 Biggest Short Squeezes of All Time.

Short squeezes have dominated headlines in the finance world this year as retail investors band together on internet platforms like Reddit to spoil hedge fund shorts on certain stocks. However, short squeezes are hardly a new phenomenon. They have existed for as long as the market has and some of the biggest and most famous short squeezes of all time took place more than a century ago. Some cases, like the ones involving GameStop Corp. (NYSE: GME), Tesla, Inc. (NASDAQ: TSLA), AMC Entertainment Holdings, Inc. (NYSE: AMC), Clover Health Investments, Corp. (NASDAQ: CLOV), and Alibaba Group Holding Limited (NYSE: BABA), are still ongoing.

Usually, a short squeeze occurs when the stock of a company rises dramatically as short-sellers, who had earlier bet on the stock to lose value, evaluate their decision in light of unusual conditions and exit their short positions to limit losses. The explosive surge in stock price of GameStop Corp. (NYSE: GME), the video game retailer based out of Texas, is perhaps the biggest example of a short squeeze, as it became the rallying cry for retail investors who wanted to spoil hedge fund short-seller bets. GameStop Corp. (NYSE: GME) stock has returned more than 4,000% to investors over the past year but also invited regulatory scrutiny. On June 14, Morgan Stanley CEO James Gorman said that the wild run-up in GameStop Corp. (NYSE: GME) could be a recipe for disaster.

AMC Entertainment Holdings, Inc. (NYSE: AMC), the Kansas-based theatre chain, has also undergone something similar in the past few months. The share price of AMC Entertainment Holdings, Inc. (NYSE: AMC) has climbed close to 550% in the last three months as retail investors on internet platforms like Reddit load on up the shares to undermine short-seller bets. Clover Health Investments, Corp. (NASDAQ: CLOV), the healthcare insurer operating from Tennessee, is another 'meme stock' - a term used to describe stocks with strong retail investor interest - undergoing a short squeeze. The share price of Clover Health Investments, Corp. (NASDAQ: CLOV) has climbed 72% in the past few weeks.

Story continues

However, the most famous short squeeze of the present era remains the defiance Tesla, Inc. (NASDAQ: TSLA) has shown in the face of short sellers. During the last few years, Tesla, Inc. (NASDAQ: TSLA) owner Elon Musk has been involved in public spats with two famous hedge fund managers, Michael Burry and David Einhorn, over the short-selling and come out on top. The California-based EV maker has seen share price climb more than 700% over the course of twelve months beginning in late 2019 before falling in the post-pandemic inflationary market. Burry recently unveiled a $530 million short position on Tesla, Inc. (NASDAQ: TSLA).

Another interesting case on short squeezes is Alibaba Group Holding Limited (NYSE: BABA), the Chinese ecommerce giant that has become one of the largest technology companies in the world over the course of the past decade. Alibaba Group Holding Limited (NYSE: BABA) has been subject to several short selling schemes in the past few years, but consistently beat market expectations on earnings, disappointing short-sellers in the process who have made multi-million dollar bets against the firm.

The rise of meme stocks and trading applications like Robinhood have stoked concerns around financial stability on Wall Street, with some welcoming the influx of retail investors and the change in market dynamics, while others caution against soaring valuations and warning that central banks may be forced to raise interest rates as inflation continues to rise. It is likely that short squeezes will continue to grab a lot of the attention in the finance world as the market adjusts to the new normal. The signs of a tectonic shift in this regard are already there.

The entire hedge fund industry is feeling the reverberations of the changing financial landscape. Its reputation has been tarnished in the last decade, during which its hedged returns couldn’t keep up with the unhedged returns of the market indices. On the other hand, Insider Monkey’s research was able to identify in advance a select group of hedge fund holdings that outperformed the S&P 500 ETFs by more than 124 percentage points since March 2017. Between March 2017 and February 26th 2021 our monthly newsletter’s stock picks returned 197.2%, vs. 72.4% for the SPY. Our stock picks outperformed the market by more than 124 percentage points (see the details here). We were also able to identify in advance a select group of hedge fund holdings that significantly underperformed the market. We have been tracking and sharing the list of these stocks since February 2017 and they lost 13% through November 16th. That’s why we believe hedge fund sentiment is an extremely useful indicator that investors should pay attention to. You can subscribe to our free newsletter on our homepage to receive our stories in your inbox.

Biggest Short Squeezes of All Time

Luis Louro / shutterstock.com

With this context in mind, here is our list of the 10 biggest short squeezes of all time. These short squeezes were ranked keeping in mind the amount of money involved, the profiles of the individuals involved, and their overall effect on the market.

Biggest Short Squeezes of All Time

10. Reliance Industries Limited (NSE: RELIANCE.NS)

In the late 1980s, Manu Manek, otherwise known as the Cobra of the Bombay stock market due to his short-selling exploits, tried to short the shares of Reliance Industries Limited (NSE: RELIANCE.NS). At the time, Reliance was emerging as a major player in the Indian business industry with Dhirubhai Ambani leading the company. The short squeeze pitted Ambani, one of the most successful businessmen in India at the time, against Manek, perhaps the most powerful stockbroker in the country.

As Manek tried to short the shares, Reliance Industries Limited (NSE: RELIANCE.NS) chief Ambani asked his close lieutenant Anand Jain to mount a defense. Jain, through a body known as Friends of Reliance Association, started buying back all the shares that were being shorted by Manek, helping keep the price of the stock stable. Eventually, as more stock was sold by Manek and bought by Jain, the share price started rising again. In the ensuing chaos, as the bear traders started losing huge amounts of money, the exchange was shut for three days.

These three days allowed Manek and Ambani to reach a compromise settlement that led to INR30 million in losses for Manek and helped Ambani cement his place as one of the most shrewd dealers in India. The Reliance Industries Limited (NSE: RELIANCE.NS) saga and the closure of the exchange led to millions in losses. Today, the Bombay Stock Exchange, where the short squeeze played out, is the ninth largest stock exchange in the world with a market capitalization of more than $3.1 trillion.

Just like GameStop Corp. (NYSE: GME), Tesla, Inc. (NASDAQ: TSLA), Clover Health Investments, Corp. (NASDAQ: CLOV), AMC Entertainment Holdings, Inc. (NYSE: AMC), and Alibaba Group Holding Limited (NYSE: BABA), Reliance Industries Limited (NSE: RELIANCE.NS) features on our list of 10 biggest short squeezes of all time.

9. Piggly Wiggly

Piggly Wiggly was the first self-service grocery store in the United States. It first opened for business in 1916 in Memphis before rapidly expanding and opening in several states across the southern belt of the US. It was the predecessor to the supermarket chains of the present era. Within six years, there were more than 1,000 Piggly Wiggly stores in the country. The company went public in 1922 and looked set for further growth, inviting bull predictions from traders in the first few months of the year.

However, towards the fall of 1922, some franchises of Piggly Wiggly went bankrupt. Although these were not wholly owned by Clarence Saunders, the famous owner of Piggly Wiggly, there was some tension around the firm on Wall Street. Traders started short-selling the stock in anticipation of a further crash in the share price. Saunders decided to challenge the market himself, taking out a $10 million loan to buy back the stock. By the spring of 1923, Saunders controlled more than 99% of Piggly Wiggly, which amounted to almost 200,000 shares.

From a low of $39, the stock climbed to $60 as Saunders regained control. However, he did not stop there. He started selling these shares to the public at a fixed price and bypassed the stock exchange, calling for the return of thousands of Piggly Wiggly shares he had loaned to short-sellers. This pushed the Piggly Wiggly stock to $124. Soon thereafter, the exchange suspended trading in the stock and gave short-sellers time to return the shares they owned. Eventually, Saunders settled the dispute for $100 per share and took in millions in losses.

Just like GameStop Corp. (NYSE: GME), Tesla, Inc. (NASDAQ: TSLA), Clover Health Investments, Corp. (NASDAQ: CLOV), AMC Entertainment Holdings, Inc. (NYSE: AMC), and Alibaba Group Holding Limited (NYSE: BABA), Piggly Wiggly features on our list of 10 biggest short squeezes of all time.

8. Harlem Railroad

Cornelius Vanderbilt, the man at the center of the Harlem and Hudson railroad short squeezes, was one of the richest men in America when he started dabbling in the railroad business. Legend has it that Vanderbilt was even the sole survivor of one of the first deadly rail accidents in the 1850s. By the 1860s, he had set his sights on acquiring the Harlem Rail and Hudson Rail, two undervalued that also happened to be the only two rail lines allowed into Manhattan. As Vanderbilt bought stake in the firm, there were short-sellers squeezing the stock.

Some of the people shorting the stock were very influential, including members of the New York City Council and the board of directors of Harlem Rail. Daniel Drew, a longtime rival of Vanderbilt and successful trader on Wall Street, was also among them. As Vanderbilt continued buying what short sellers sold, the share price started rising even as attempts were made to disrupt it, like the cancellation of a bill authorizing Harlem Rail to lay a double track. Eventually, Vanderbilt gained control of Harlem Rail through this strategy.

The short-sellers that had lost a lot of money on the Harlem Rail now turned their attention to Hudson Rail amid speculation that Vanderbilt had used up his fortune on Harlem Rail and would be in no position to spoil their bet. However, they had miscalculated, and again found themselves at the mercy of Vanderbilt when they had to return the loaned shares. This allowed Vanderbilt to gain full control of Hudson Rail as well. A last ditch attempt by Daniel Drew to short the stock was defeated later and Vanderbilt made $3 million in the process.

Just like GameStop Corp. (NYSE: GME), Tesla, Inc. (NASDAQ: TSLA), Clover Health Investments, Corp. (NASDAQ: CLOV), AMC Entertainment Holdings, Inc. (NYSE: AMC), and Alibaba Group Holding Limited (NYSE: BABA), Harlem Railroad features on our list of 10 biggest short squeezes of all time.

7. Herbalife Nutrition Ltd. (NYSE: HLF)

In December 2012, Bill Ackman, the manager of Pershing Square Capital Management, initiated a short position on the stock of Herbalife Nutrition Ltd. (NYSE: HLF), the California-based dietary supplements company. In a three-hour presentation at an investor conference, Ackman described the reasoning behind his move and called the nutrition firm a pyramid scheme that was destined to go to zero. Ackman, over the course of the next six years, took huge losses and was eventually forced to give up his short position in the firm.

Can hedge funds beat the market

Even though Herbalife Nutrition Ltd. (NYSE: HLF) was fined $200 million by regulators for fraudulent practices in the years following the Ackman presentation, the company still managed to turn fortunes around by improving revenues and cash generation. Ackman was further hit by rival Carl Icahn, who runs Icahn Capital LP, taking a long position in the nutrition company as Ackman shorted it. Icahn acquired a more than 25% stake in the firm and called out Ackman in the media for shorting the stock.

Carl Icahn's top 10 stock picks

An intense feud followed, which was only settled in early 2018 when Ackman was forced to relinquish his remaining short position in Herbalife Nutrition Ltd. (NYSE: HLF). It is estimated that Ackman lost close to $1 billion over the course of six years as a result of his short position, while Icahn gained the same amount. The company now has a market capitalization of close to $5.6 billion and posted more than $5.4 billion in revenue last year. Icahn has trimmed his stake in the company to 8 million shares at the end of March from 20 million shares last year.

Just like GameStop Corp. (NYSE: GME), Tesla, Inc. (NASDAQ: TSLA), Clover Health Investments, Corp. (NASDAQ: CLOV), AMC Entertainment Holdings, Inc. (NYSE: AMC), and Alibaba Group Holding Limited (NYSE: BABA), Herbalife Nutrition Ltd. (NYSE: HLF) features on our list of 10 biggest short squeezes of all time.

6. KaloBios

Martin Shkreli, often called one of the most hated men in America for raising the price of an AIDS-related drug by 5,000%, was also involved in one of the most famous short squeezes of all time. Shkreli, now serving a prison sentence for securities fraud, took over biotech firm KaloBios in November 2015 as the firm was more than $6 million in debt and the sole drug it was working on had failed. As short-sellers tried to take advantage of the dire financial state, Shkreli jumped in and acquired more than 70% of the shares, causing the stock to jump 10,000% in five days.

However, KaloBios did not make much of an impact after the takeover, with share price dropping down again quickly. From a low of 44 cents per share on November 15, the stock jumped to $14 per share by November 18 as panicked short-sellers scrambled for cover following the Shkreli takeover. Shkreli later announced that the biotech firm would be given $3 million in cash, with another $10 million promised following shareholder approval, to get the firm back up and running.

By November 23, KaloBios stock had jumped to $45 per share. It then dropped to around $20 in the next few weeks, prompting Shkreli to call back the shares he had loaned out, resulting in a rally that saw the share price jump to around $45 again. By January, Shkreli was arrested on unrelated charges and KaloBios had filed for bankruptcy protection and been delisted from the stock exchange. In 2016, CNN reported that Shkreli more than doubled his initial investment in KaloBios stock when he sold his stake in the firm for close to $6 million in a private transaction.

Just like GameStop Corp. (NYSE: GME), Tesla, Inc. (NASDAQ: TSLA), Clover Health Investments, Corp. (NASDAQ: CLOV), AMC Entertainment Holdings, Inc. (NYSE: AMC), and Alibaba Group Holding Limited (NYSE: BABA), KaloBios features on our list of 10 biggest short squeezes of all time.

Click to continue reading and see 5 Biggest Short Squeezes of All Time.

Suggested Articles:

Disclose. None. 10 Biggest Short Squeezes of All Time is originally published on Insider Monkey.","In this article, we discuss the 10 biggest short squeezes of all time.
If you want to skip our detailed analysis of these short squeezes, go directly to the 5 Biggest Short Squeezes of All Time.
Biggest Short Squeezes of All TimeLuis Louro / shutterstock.comWith this context in mind, here is our list of the 10 biggest short squeezes of all time.
Click to continue reading and see 5 Biggest Short Squeezes of All Time.
10 Biggest Short Squeezes of All Time is originally published on Insider Monkey.",https://finance.yahoo.com/news/10-biggest-short-squeezes-time-145219717.html,2021-06-04 00:00:00
