,Ticker,Title,Article,Summary,Link,Date
0,TSLA,Ex-Tesla president sold stock worth $274 million since June 10 -SEC filing,"BERKELEY, Calif., June 19 (Reuters) - Long-time Tesla Inc (TSLA.O) executive and president Jerome Guillen, who left the company earlier in June, has sold an estimated $274 million worth of shares after exercising stock options since June 10, according to a filing with the Securities and Exchange Commission (SEC).

The filing, which was submitted to the SEC on Tuesday, said that Guillen expected to sell 215,718 shares for $129 million that day, and that he offloaded 145,289 shares worth $89.6 million on June 14, and 90,111 shares worth $55 million on June 10.

Guillen, a former Mercedes engineer who was with Tesla since 2010, oversaw the company's entire vehicles business before being named president of the Tesla Heavy Trucking unit in March. He left the company on June 3. read more

The departure of Guillen, one of Tesla's top four leaders, including Chief Executive Elon Musk, has sparked market concerns about Tesla's future vehicle programs like the Semi electric truck and new batteries called 4680 cells.

Gordon Johnson, an analyst at GLJ Research, estimated that Guillen has cut his exposure to Tesla from 1.3 million shares a weak ago to about 150,000 as of Friday.

“Should TSLA be on the verge of technological and autonomous breakthroughs and breakout 2Q21E deliveries/earnings, as well as EV domination, why has what many assumed was the second most important person at the company (i.e., Jerome Guillen) sold $274mn worth of TSLA stock,"" he said in a report.

""It could raise some eyebrows for investors,"" Wedbush Securities analyst Daniel Ives said, adding that investors are going to watch closely to see if he sells more.

Stock options give employees and executives the right to buy their company's stock at a specified price for a certain period of time. When share prices rise above the exercise price, they can buy the stocks at discounted prices.

It was not immediately known how much Guillen paid to exercise the options.

Reporting by Hyunjoo Jin, additional reporting by Jessica DiNapoli Editing by Sonya Hepinstall and Steve Orlofsky

Our Standards: The Thomson Reuters Trust Principles.","BERKELEY, Calif., June 19 (Reuters) - Long-time Tesla Inc (TSLA.O) executive and president Jerome Guillen, who left the company earlier in June, has sold an estimated $274 million worth of shares after exercising stock options since June 10, according to a filing with the Securities and Exchange Commission (SEC).
The filing, which was submitted to the SEC on Tuesday, said that Guillen expected to sell 215,718 shares for $129 million that day, and that he offloaded 145,289 shares worth $89.6 million on June 14, and 90,111 shares worth $55 million on June 10.
Gordon Johnson, an analyst at GLJ Research, estimated that Guillen has cut his exposure to Tesla from 1.3 million shares a weak ago to about 150,000 as of Friday.
Stock options give employees and executives the right to buy their company's stock at a specified price for a certain period of time.
Reporting by Hyunjoo Jin, additional reporting by Jessica DiNapoli Editing by Sonya Hepinstall and Steve OrlofskyOur Standards: The Thomson Reuters Trust Principles.",https://www.reuters.com/business/autos-transportation/ex-tesla-president-sold-stock-worth-274-million-since-june-10-sec-filing-2021-06-19/,2021-06-19 00:00:00
1,TSLA,TSLA Stock Price Rises 5% – Time to Buy Tesla Stock?,"Tesla (TSLA) stock rose 5.2% yesterday and was trading higher in US premarket price action today also. The stock is however down 7% for the year. Is it time to buy Tesla stock now?

TSLA stock is still down over 27% from its 52-week highs. The stock had fallen sharply after hitting the all-time high amid the sell-off in growth names.

Buy Tesla stock at eToro, the World’s leading Trading Platform

Tesla stock technical analysis

Tesla is looking quite bullish on the charts. The stock has found strong support at the 200-day SMA (simple moving average) while 50-day SMA has been a resistance. However, amid the recent rally, it has crossed above the 50-day SMA also which is a bullish technical indicator. The stock has also risen above the short-term moving averages including the 10-day and 30-day SMA which signals a short-term uptrend. The next resistance for TSLA stock could be the 100-day SMA which is currently at $678.26. However, the stock is getting near overbought levels with a 14-day RSI (relative strength index) of 61.5.

67% of all retail investor accounts lose money when trading CFDs with this provider.

Tesla stock forecast

Tesla has a median target price of $725 according to the estimates compiled by CNN Business. The target price implies an upside of 10.4% over the next 12 months. However, there is a wide dispersion in analysts’ target prices and Tesla’s highest and lowest target prices are $1,471 and $67 respectively. It is quite unusual for any stock to have such dispersion in target prices. But Tesla being Tesla, analysts either love or hate the stock.

Cathie Wood

Cathie Wood of ARK Invest is among the biggest bulls on Tesla stock. ARK Invest has assigned a target price of $3,000 to the Elon Musk-run company. While Wood sold some Tesla shares earlier this year and instead bought Coinbase, she bought the dip in Tesla shares in May. Tesla remains the top holding for ARK’s flagship ARK Innovation ETF.

Gene Munster sees Tesla stock tripling from these levels

Gene Munster of Loup Ventures is another Tesla bull and has forecast the shares to hit $2,500 by 2023. Munster had correctly predicted Apple’s market capitalization hitting $2 trillion and is now forecasting the iPhone maker to hit a market cap of $3 trillion. However, while he had predicted that Apple will be the best performing FAANG stock in 2021, it is actually the second-worst performing FAANG stock so far. Alphabet, which underperformed the FAANG peers as well as the Nasdaq in 2020, is the best performing FAANG stock in 2021.

Canaccord Genuity slashed its target price

Earlier this month, Canaccord Genuity lowered its target price on TSLA stock from $974 to $812 citing concerns over the battery program. “Leading up to the delayed launch, Tesla cancelled the top trim Model S Plaid Plus, which was reportedly going to be the first to feature the new 4680 cell design. This signals to us the new cell format isn’t ready for production just yet, and cell production capacity constraints for energy storage products like Powerwall remain,” said Canaccord analyst Jed Dorsheimer.

Tesla Model S Plaid

Earlier this month, Tesla unveiled its Model S Plaid model. The company did not produce any of the Model S sedans in the first quarter as it was revamping the model. The model S is Tesla’s flagship premium sedan. The competition is heating up in the premium electric car market with the entry of Mercedes EQS and the upcoming Lucid Air. Lucid Motors is going public through a merger with Churchill Capital IV (CCIV). The SPAC (special purpose acquisition company) merger is expected to complete next month.

Tesla Model S Plaid plus would have competed with Lucid Air. However, Musk canceled the model at the last moment as he found the Plaid model to be good enough. The Model S Plaid+ model was expected to have a range of 520 miles while the Plaid model has a driving range of 390 miles. A higher driving range helps address the range anxiety. Meanwhile, with its ever-growing network of Superchargers, Tesla has been able to somewhat address the range anxiety issue.

Tesla stock valuation

Valuing Tesla has been a conundrum for analysts and it also explains the divergence in analyst opinion. Tesla stock has a market capitalization of $630 billion which is over twice that of Toyota, the second most valuable automaker. At its peak, Tesla’s market cap exceeded that of all leading automakers including Toyota, Volkswagen, General Motors, and Ford put together.

To be sure, it is not possible to justify an automaker commanding a market capitalization of more than $600 billion considering that Tesla sold only about half a million cars in 2020 which is a fraction of what Toyota sold in the year.

TSLA stock bullish view

However, the bullish narrative for TSLA stock is stretched way beyond its automotive business. Tesla is a play on the renewable energy theme, given its solar and energy storage operations. While the energy business currently accounts for less than 10% of the total revenues, Musk expects the business to eventually become as large as the automotive business.

Tesla’s electric car business is also booming and it expects deliveries to rise 50% annually for the next many years. The company is launching several new models including the Cybertruck which will be pitched against Ford’s F-150 and General Motors’ Silverado. The F-150 has been the best-selling pick-up for decades in North America and its recently unveiled all-electric version will be a tough competitor for the Cybertruck.

Tesla’s software capabilities

Meanwhile, the bulk of Tesla’s valuation comes from the software part of the business which even rivals like Volkswagen have appreciated. The company’s autonomous driving and other future services like robotaxis could drive the real value for TSLA stock. These are high-margin businesses and most of the revenues from autonomous driving will flow to Tesla’s gross profits. While the FSD (full-self driving) option currently costs $10,000, Musk expects the price to rise to $100,000 eventually.

TSLA stock valuation

TSLA stock trades at an NTM (next-12 months) EV (enterprise value)-to-sales multiple of 11.7x while legacy automakers trade at a multiple of around 1x. However, the company should not be valued as a legacy automaker given its software capabilities. Meanwhile, TSLA could still appear overvalued even after accounting for future growth.

That said, the stock is looking bullish on the charts and there is strong momentum in electric vehicle stocks that could support a rally in TSLA stock in the near term.

Buy Tesla stock at eToro, the World’s leading Trading Platform","Buy Tesla stock at eToro, the World’s leading Trading PlatformTesla stock technical analysisTesla is looking quite bullish on the charts.
Tesla Model S PlaidEarlier this month, Tesla unveiled its Model S Plaid model.
The Model S Plaid+ model was expected to have a range of 520 miles while the Plaid model has a driving range of 390 miles.
Tesla stock valuationValuing Tesla has been a conundrum for analysts and it also explains the divergence in analyst opinion.
TSLA stock bullish viewHowever, the bullish narrative for TSLA stock is stretched way beyond its automotive business.",https://www.economywatch.com/news/tsla-stock-price-rises-5-time-to-buy-tesla-stock,2021-06-19 00:00:00
2,TSLA,3 Reasons That Tesla Could be a Great Short in the Second Half of 2021,"Tesla (TSLA) was one of the best performers in 2020. In 2020, the stock has mostly been range-bound. However, the stock remains quite overvalued and there are indications that it could fall back to Earth in the coming months.





The combination of the stimulus, Fed policy, and lockdowns was a potent combination that led to extraordinary moves in many growth and momentum stocks in 2020. One of the most notable of these stocks was Tesla (TSLA), which climbed by 1,185% between the March 2020 stock market bottom and its peak in mid-January.

Since January TSLA and many other growth stocks retreated, as money flowed into value and cyclical stocks due to rising interest rates and increasing optimism about the economy returning to normal. However, over the last couple of months, many technology and growth stocks have been rallying and recovered the bulk of their losses, with a handful even making new highs.

TSLA is up 25% since mid-May and bulls are optimistic shares will continue climbing higher. I am not one of those bulls. I view the recent rally in TSLA as an opportunity for investors to take a short position in the stock. The major vulnerabilities that I see in Tesla are slowing sales in China, slowing sales growth as competitors are launching new EV models and some of CEO and founder Elon Musk’s allure wearing off.

Slowing Chinese Sales

UBS recently cut Tesla’s target price to $660 from $730 due to several, negative factors. However, one of its main factors is that “Tesla's demand momentum in China is slowing, and our checks on the ground suggest that BEVs (battery electric vehicles) from domestic brands are gaining further ground vs. Tesla, which may trigger additional pricing action by Tesla and consequently lower gross margins.”

In essence, China is one of Tesla’s largest growth markets, and it’s facing an onslaught of competition from domestic and international companies. UBS is concerned that it may force Tesla to cut prices to retain market share.

Story continues

Another looming concern is that many Chinese EV makers like NIO (NIO) are eager to enter the US market. Given heightened tensions between the US and China, there’s no guarantee that it will get approval, especially with a polarized Congress. Many fear that if NIO’s bid to enter US markets is rejected, then China could pursue retaliatory actions against US companies like Tesla.

Slowing Momentum

Momentum stocks are driven by improvements in second-derivative measures such as revenue growth and margin expansion. Often, narratives develop around these stocks especially as investors become enthused by rising prices and stellar returns. Of course, this becomes harder to sustain once a company reaches a certain size.

In Tesla’s case, the major narratives fueling the stock higher were its leading position in the EV industry which is expected to rapidly grow over the next decade, its energy storage solutions, and its leading position in self-driving cars.

Over the last few months, each of these narratives has been undermined by new developments. Legacy automakers have fully jumped onto the EV bandwagon and numerous new models will hit the market in coming years. Tesla’s energy storage solutions have been a steady contributor to revenue growth but have failed to capture market share or differentiate itself from competitors in a meaningful way.

Finally, Tesla’s self-driving upgrade has been long-promised but has not been delivered yet. Many TSLA owners have already paid for the feature and are becoming frustrated with the delay. Additionally, many of its competitors like Waymo and Cruise have been making strides in terms of the public demos which indicates that TSLA’s gap and early-mover advantage is dissipating.

If we look at Tesla’s recent earnings report, a drop in revenue growth seems imminent especially as the company is going to face tougher comps due to the drop in sales during the coronavirus. Last quarter, Tesla had 74% revenue growth due to this factor. This is certainly going to see a steep drop in the next quarter due to much higher comps.

These developments could detract from the stock’s allure to momentum traders.

Elon Musk Losing Some of His Appeal

Often, stocks like TSLA are referred to as ‘cult stocks’, and it seems that every bull market has a few of them. It’s not hard to see why there are so many fervent believers in TSLA given its astounding returns, incredible technology, and the achievements of founder and CEO Elon Musk.

Musk has had many successes including PayPal (PYPL), SpaceX, and of course, TSLA. Even though TSLA has survived many brushes with bankruptcy, these struggles have only burnished Musk’s legacy and esteem with his investors.

However, Musk seems to have made a rare misstep with his forays into crypto. His social media reach resulted in big swings in crypto prices such as TSLA’s announcement that it would be holding bitcoin on its balance sheet and later his critique that bitcoin was doing considerable environmental damage.

Many crypto zealots have accused him of “pumping and dumping” bitcoin and dogecoin. In part, this is due to the inscrutability of Musk’s tweets, where it’s tough to figure out if he is serious or joking. The latest example is his advocacy of dogecoin which rallied sharply into his SNL announcement, only to top at the moment, he declared himself the “Dogefather”.

In the long term, these absurdities won’t affect Tesla’s long-term future. However, it could matte in the short term as there’s certainly some crossover between Tesla bulls and crypto zealots. Given that momentum stocks are driven by investors’ faith in the companies’ future being bright, these developments could certainly dent some investors’ faith in Musk’s judgment and Tesla’s outlook.

Conclusion

Occasionally, markets serve up opportunities that are attractive from a risk/reward perspective. I believe that TSLA currently qualifies especially as the stock is currently in a zone, where there is a heavy overhead supply. Further, the stock’s recent rally has resulted in an overbought, short-term state which could also result in some selling pressure.

Finally, recent developments for TSLA such as slowing revenue growth and Musk’s alienation of some crypto bulls might make the stock less appealing to momentum investors and traders.

Discover Today’s Best Growth Stocks

This article was written by Jaimini Desai, Chief Growth Strategist for StockNews.com. Jaimini has been dialed into the hottest trends in investing:

Electric Vehicles

5G

Internet of Things

Cloud Computing

Genomics

And Much More

If you would like to see more of his best growth stock ideas, then click the link below.

See Jaimini Desai’s Favorite Growth Stocks

TSLA shares were trading at $680.65 per share on Tuesday morning, down $8.07 (-1.17%). Year-to-date, TSLA has declined -3.55%, versus a 15.22% rise in the benchmark S&P 500 index during the same period.





About the Author: Jaimini Desai





Jaimini Desai has been a financial writer and reporter for nearly a decade. His goal is to help readers identify risks and opportunities in the markets. He is the Chief Growth Strategist for StockNews.com and the editor of POWR Growth newsletter. Learn more about Jaimini’s background, along with links to his most recent articles.

More...

The post 3 Reasons That Tesla Could be a Great Short in the Second Half of 2021 appeared first on StockNews.com","Tesla (TSLA) was one of the best performers in 2020.
One of the most notable of these stocks was Tesla (TSLA), which climbed by 1,185% between the March 2020 stock market bottom and its peak in mid-January.
However, over the last couple of months, many technology and growth stocks have been rallying and recovered the bulk of their losses, with a handful even making new highs.
Further, the stock’s recent rally has resulted in an overbought, short-term state which could also result in some selling pressure.
The post 3 Reasons That Tesla Could be a Great Short in the Second Half of 2021 appeared first on StockNews.com",https://finance.yahoo.com/news/3-reasons-tesla-could-great-155653548.html,2021-06-19 00:00:00
3,TSLA,StarHub wraps up creative pitch with TSLA appointment,"StarHub has appointed The Secret Little Agency (TSLA) as its creative agency, following a three-month pitch process, with expected commencement of joint works in July 2021. This follows StarHub's call for a creative pitch for the Singapore market.

A StarHub spokesperson told MARKETING-INTERACTIVE that the TSLA team impressed StarHub with its collaborative culture, enthusiastic curiosity and fresh approaches. ""We are now working on becoming an integrated team, with a keen focus on transforming our brand and our customers’ experiences for the better. Stay tuned; joint work is expected to start next month, and we look forward to bringing you exciting updates,"" the spokesperson added.

Eva-Lotta Gothe, vice president of brand and marketing communications, StarHub confirmed the pitch when the story was first broken by MARKETING-INTERACTIVE and said it was called to ""identify the best creative agency partner"" as StarHub's business transformation accelerates to meet the ever-changing market demands. Gothe confirmed that a few agencies have been invited to participate at that time. While StarHub invited incumbent BLKJ to pitch for the account, the incumbent told MARKETING-INTERACTIVE that it had politely declined participation in the pitch, and wished StarHub the very best.

TSLA has over the years built up a strong presence across the region, having worked with many notable brands. Recently, it bagged launch duties for Singapore-based global digital and crypto assets exchange Zipmex. TSLA's design practice will manage brand strategy, positioning and design duties, and work is expected to roll out in the second half of the year targetting APAC markets. Meanwhile, Unilever's OLLY, a brand that sells multi-vitamin gummies, also tapped on TSLA’s expertise for its ""Slay it with OLLY"" campaign which promotes its ""Sleep"" product that seemingly helps consumers get better rest. The campaign was run across Singapore and China.

On the Singapore front, TSLA was also the agency behind the Government Technology Agency (GovTech) rebranding its logo for its Singpass mobile app as part of its new brand identity. The rebranding comes as GovTech looks to deliver “an even better Singpass” that offers new features and provides convenient access to a larger range of services. TSLA Design also worked with Singapore’s National Heritage Board (NHB) for a revitalised Roots brand and digital experience via a new logo and a makeover for its website Roots.gov.sg. The refresh is done in line with Roots' fifth anniversary and was also NHB's first major rebrand since the creation of Roots in 2016.

In 2017, the homegrown agency inked a deal with Mother Holdings, a year after TSLA made its first foray into the Shanghai market with the opening of its new office. The new expansion move allowed the agency to form an independent global network and tap on major creative hubs across the Americas, Los Angeles, New York and Buenos Aires; Europe, London; Asia, Singapore and Shanghai. This will allow for a broader reach in both talent pool and cultures for its clients and teams.

Separately, in April this year, StarHub moved away from its iconic green, blue and yellow logo after more than 20 years, to adopt a neon spring green shade. It also embraced a new graphic branding element on its advertising and platforms which it called ""The Portal"". According to StarHub then, ""The Portal"" is a ""bold and unique graphic device that comes straight from its logo"", and is a new identity system that brands all of its content moving forward. It signals transformation and is a gateway to all things StarHub's customers love, the brand added. This way, consumers will know the brand asset belongs to StarHub, even if they cannot see the logo.

Additionally, the telco company was named Asia’s most sustainable telecommunications company and achieved the 80th position globally in the 2021 Corporate Knights Global 100. The Global 100 shortlists large corporations across the globe on 24 key indicators, including resource management, greenhouse gas management, board gender diversity, clean revenue and investment, and supplier performance. In its press release, it was noted that it implemented sustainable and green practices across its business including tackling electronic waste (e-waste), and reducing energy and water consumption among other initiatives.

Related articles:

StarHub slowly rolls out brand refresh starting with new digital-friendly shade of green

StarHub and BLKJ part ways, new creative pitch called","StarHub has appointed The Secret Little Agency (TSLA) as its creative agency, following a three-month pitch process, with expected commencement of joint works in July 2021.
This follows StarHub's call for a creative pitch for the Singapore market.
A StarHub spokesperson told MARKETING-INTERACTIVE that the TSLA team impressed StarHub with its collaborative culture, enthusiastic curiosity and fresh approaches.
While StarHub invited incumbent BLKJ to pitch for the account, the incumbent told MARKETING-INTERACTIVE that it had politely declined participation in the pitch, and wished StarHub the very best.
Related articles:StarHub slowly rolls out brand refresh starting with new digital-friendly shade of greenStarHub and BLKJ part ways, new creative pitch called",https://www.marketing-interactive.com/starhubs-wraps-up-creative-pitch-with-tsla-appointment,2021-06-19 00:00:00
