,Date,text,compound
1127,2021-09-05,"disruptive innovation prophet cathie wood flock need,creative redemption process,cathie wood buy another 5m robinhood 3m peloton,ray dalio gold crypto",0.0772
790,2021-09-06,blackrock gavin lewis black underrepresentation financial service business issue,0.0
943,2021-09-07,"exchange struggle capture etf volume rfq platform,wall street hot investor bet big handful stock critic say play fire,overvalue stock sell invest like michael burry",0.128
1004,2021-09-08,"bet stock soar up draftkings dkng stake,cathie wood invest double multi million share position spac merge ginkgo bioworks,currency hedge etf long expensive unhedged counterpart,priceless piece advice world great investor,robot,fintech battle intensify etf epicenter,amc clover meme stock tumble today,bytedance emulate alibaba tide china fintech crackdown,apollo global rope tinder chief yahoo ceo tinder name new ceo,dave buster entertainment q2 earn top estimate,so share trade high today,highly upvoted wallstreetbets post speculate amazon affirm partnership week official announcement,china central bank say cryptocurrency transaction illegal,dynagas lng partner earn preview",0.8807
1149,2021-09-09,"cathie wood stock trade bull well bear,cathie wood invest buy,z stock cathie wood innovation fund wall street predict rally,company cathie wood see benefit instagram tiktok commerce push outperform amazon year amazon amzn shopify shop,another sign buy pay late momentum,toyota cut production outlook owe chip shortage,bellicum stock move high wednesday,information technology stock move friday pre market session",0.765
1128,2021-09-10,"three active etf investor look target strategy,cathie wood challenger goldman sachs launch tech etf,invest tesla stock price target may outrageous elon musk say worth share execute really well,best look private investment ever see perhaps one bad",-0.0516
1220,2021-09-13,"fintech etf invest ensure capital growth,twitter become unlikely hero rental car fiasco,bytedance emulate alibaba tide china fintech crackdown,twitter distinguish good bot bad new label feature,aircraft conversion mammoth freighter take big twin,disney shut hotstar u service move program espn hulu,date group parshipmeet prepare ipo source,send clown gov shutdown,information technology stock move friday pre market session,fintech etf invest ensure capital growth",0.8689
1111,2021-09-14,"robot,cathie wood growth stock fire continue high,recent poor result make promise cathie wood pick bargain,undervalue innovative stock,jim cramer gold crypto hedge need realistic",0.3182
1125,2021-09-15,"coinbase slide could good fintech etf,price action innovation etf arkk use advantage,expect stock market volatility covid case peak",0.6705
1163,2021-09-16,"cathie wood invest buy share robinhood,robot,sava shareholder class action deadline reminder bernstein liebhard llp remind investor deadline file lead plaintiff motion security class action lawsuit cassava science",0.4019
1112,2021-09-17,"robot,td ameritrade tom lydon talk arkk commodity,stock expensive necessarily deterrent,cathie wood growth stock set september surge,growth stock cathie wood bullish right,cathie wood like tesla fund keep sell stock,cathie wood make adjustment portfolio august,make sense market week september,unusual option activity iovance biotherapeutics iova nike nke alibaba group baba",0.6249
1168,2021-09-20,"watch today dow set drop point global market sell,tesla share could gain year accord investor own company tesla motor tsla,roku share price hit fast forward",0.6908
1110,2021-09-22,"catherine wood innovation etf make unique investment opportunity u stock market,arkk innovation hawkish feed double top pattern foreshadow downside move",0.7783
1140,2021-09-23,"cathie wood invest buy,high open expect singapore stock market,twitter become unlikely hero rental car fiasco,woman health beauty supplement market research report sale channel age group application consumer group product region global forecast cumulative impact covid",0.8126
1118,2021-09-24,"chinese crackdown bitcoin another blow cathie wood etf,innovation etf arkk investment advice,disruptive growth stock could way go,like mutual fund meet etf,theme etf category see influx new product,disruptive growth stock could way go,coinbase score first buy rat stock sag future may look bright,dogecoin cute shiba inu,shift yield curve impact etf,weekend read retirement location state,weekend read retirement location state,best etf september,cathie wood make adjustment,opinion afraid bogleheads,btc usd forex signal bearish flag hint weakness,michael burry call sec gamestop enforcement receive sec subpoena month late,alibaba ant group propose revive ipo,tesla stock dump chamath palihapitiya,update softbank back banco inter stoneco talk potential merger source,make option moderate tesla stock gain,philip start replace repair faulty respiratory sleep device u,stock face another turbulent week third quarter wind,etf need portfolio,bittersweet truth gold stock need know market oracle",0.7906
1153,2021-09-25,"paradox michael burry cathie wood,want outperform p cathie wood consider get hamster,cathie wood invest buy 89m worth twtr bitcoin tip integration",0.128
1178,2021-09-27,"cathie wood invest buy,tesla head 5th straight day,mersana therapeutic share trade low friday",0.25
1107,2021-09-28,"surge treasury yield batter fund amid broad tech selloff,nasdaq tank rise u yield arkk appear confirm double top pattern,arkk etf good buy sell nysearca arkk,move cathie wood pick goldman sachs new etf could smash,best growth etf,grayscale shred hype bitcoin power democratize finance show rias really want dominant wall street middleman will pay hedge fund like fee transparency,big cap catch small cap way,recipe pitiful market action",0.7645
1108,2021-09-29,"cathie wood investment sell 270m worth tesla stake,invest buy 3m coinbase share sell 264m tesla share,cathie wood invest buy,get finger trigger stock start stabilize,investor might want weigh potential skillz nyse sklz new title start sell,coinbase reportedly propose crypto framework u official,brace downside,stock market get bore return normal,converse discount buy one take two asics footwear sale,cathie wood dump big chunk tesla stock recent string sale",-0.0516
1167,2021-09-30,"reopen stock look fragile carry market,skillz stock tumble today,go palantir stock today",0.0
58,2021-11-01,tesla esg conundrum,0.0
167,2021-11-02,time bullish china etf year ox,0.0
1106,2021-11-08,climate code red etf industry,0.0
54,2021-12-01,drive ilmarinen shift esg etf,0.0
405,2021-12-04,"thematic etf fire,tom brady asset management people love hate cathie wood fund get result,time buy stock xpeng palantir zoom draftkings,time machine investor,stock move monday pre market session,go digital new etf dapp vaneck",0.4588
